,comment_id,created,fullname,parent_id,subreddit,text,post_id,title
0,gyvqca8,2021-05-20 23:02:00,t1_gyvqca8,t3_nhdwpl,StockMarket,Keep your vsym. If they actually get the CE lifted it's going to go nuclear.,,
1,gyvqoio,2021-05-20 23:04:50,t1_gyvqoio,t3_nhdwpl,StockMarket,Are any of these companies legit ?,,
2,gyvqzzw,2021-05-20 23:07:31,t1_gyvqzzw,t1_gyv7qoo,StockMarket,"Lang and Schwarz terminated every contract with TradeRepublic after Trade Republic blamed them for liquidity problems/ the GME fiasco. Trade Republic is using TradeGate and controlled by the Bafin so nothing like RobinHood. 

On TradeRepublic you buy shares, they don’t sell nothing and sell the data created to market makers like RobinHood.",,
3,gyvrjay,2021-05-20 23:12:05,t1_gyvrjay,t3_nh2lnb,StockMarket,"I prefer to work for a few hours feeling I did something worth awhile.  The rule of thumb is if one can not earn minimum wage with the stress and risk in stock trading, one should consider another avenue.

If one makes +XX a today, he is likely to lose -XX next day.  Good luck.",,
4,gyvrn68,2021-05-20 23:13:01,t1_gyvrn68,t1_gytc0dh,StockMarket,no,,
5,gyvrqse,2021-05-20 23:13:52,t1_gyvrqse,t3_nhdwpl,StockMarket,Why not just invest in cripto coins?,,
6,gyvrvaq,2021-05-20 23:14:55,t1_gyvrvaq,t1_gyvp001,StockMarket,No I’m not margin and I haven’t had any problems before this. It’s not a lot of money but $ is $,,
7,gyvryvg,2021-05-20 23:15:46,t1_gyvryvg,t1_gyutrad,StockMarket,I've been buying puts all spring. I'm still broke.,,
8,gyvrzig,2021-05-20 23:15:55,t1_gyvrzig,t3_nhdwpl,StockMarket,Everything,,
9,gyvs0ne,2021-05-20 23:16:10,t1_gyvs0ne,t1_gyvrvaq,StockMarket,"So weird. I would give it a couple of days and wait for a proper reply. Don’t drop it, though. It’s a mystery for sure!",,
10,gyvs3s5,2021-05-20 23:16:55,t1_gyvs3s5,t3_nh7zrq,StockMarket,"I tried this 2 day free trial for hot stocks alerts and they're
Great. 
https://t.me/joinchat/cxi0V_NgRws2ZDJh",,
11,gyvs51c,2021-05-20 23:17:12,t1_gyvs51c,t1_gyvs0ne,StockMarket,Thanks for the advise good luck out there,,
12,gyvs6e7,2021-05-20 23:17:32,t1_gyvs6e7,t3_ngutqa,StockMarket,It missed on revenue.  Stock is down. I suspect it will be flat or down Friday.,,
13,gyvsetf,2021-05-20 23:19:31,t1_gyvsetf,t3_nhdwpl,StockMarket,Would recommend not asking Reddit for advice from this point forward,,
14,,2021-05-20 23:23:38,t3_nhehc4,,StockMarket,,nhehc4,Analysts' Ideas - Uranium M&A Activities to Pick Up – Top Picks
15,gyvsxj5,2021-05-20 23:23:54,t1_gyvsxj5,t3_nhehc4,StockMarket,"In this video, Sid Rajeev, head of research, will share his opinion about the uranium market and potential M&A in the sector.   
  
Uranium prices are up since the beginning of 2020, but uranium equities are outperformance the commodity. Global X uranium ETFs, which track uranium share prices of uranium stocks, are almost 100% in the past 12 months. And these are some of the reasons why uranium equities are outperforming, and it is because of an increase in the sentiment for clean energy, and nuclear power is one of the cleanest energy sources.    
  
Increasing demand for nuclear means increasing demand for uranium, which brings us to the second factor that is driving our growing optimism demand for uranium is rising at precisely the same time that supply is becoming less certain.",,
16,gyvtaod,2021-05-20 23:27:04,t1_gyvtaod,t3_nhbx2p,StockMarket,Can you please restate the question in a better way?,,
17,gyvtb4w,2021-05-20 23:27:10,t1_gyvtb4w,t1_gyt7f81,StockMarket,Ty so much late nigh t pipe I don’t drink or drugs. Stared smoking weed at 60 I’m cont ent in life just want some tendies be kind help others ty again,,
18,gyvtmf6,2021-05-20 23:29:53,t1_gyvtmf6,t3_nhdwpl,StockMarket,"""What would you change?"" 

I would stop taking stock picks from wherever you're getting them from. Second, visit the Over-the-counter market website.
https://www.otcmarkets.com/stock/ELTZ/overview",,
19,gyvtqkb,2021-05-20 23:30:53,t1_gyvtqkb,t3_ngug6i,StockMarket,"The Bear Market is the best place to make money.

Be skeptical of defensive stocks at this point, they are no longer discounted.",,
20,gyvtqmu,2021-05-20 23:30:54,t1_gyvtqmu,t1_gyvggtk,StockMarket,Wunderbar,,
21,gyvtvb8,2021-05-20 23:32:00,t1_gyvtvb8,t1_gyvps60,StockMarket,You are welcome just suggest you to add maybe 5%_10 % max pslv allocated silver etf,,
22,gyvu9uo,2021-05-20 23:35:27,t1_gyvu9uo,t1_gytujcu,StockMarket,Awesome plan Man! Stick with it . At 43 I just started and found it helps me as well in the way it does you!! Frekkkinng Awesome!,,
23,gyvuyb8,2021-05-20 23:41:19,t1_gyvuyb8,t3_nhdwpl,StockMarket,All the red,,
24,,2021-05-20 23:41:23,t3_nhetpq,,StockMarket,,nhetpq,Which one are you? Vanguard Virgin reporting in
25,gyvveg8,2021-05-20 23:45:13,t1_gyvveg8,t1_gyvryvg,StockMarket,You showed up early to the party,,
26,gyvvmzu,2021-05-20 23:47:17,t1_gyvvmzu,t3_nhdwpl,StockMarket,Get a large cap somewhere in there.,,
27,gyvvp18,2021-05-20 23:47:46,t1_gyvvp18,t1_gyvbhcq,StockMarket,Plenty religions to pick from now a days.,,
28,,2021-05-20 23:53:43,t3_nhf2c1,,StockMarket,"I really don't understand this shit.

All the time now, a company performs well and the stock price drops because of it. Take Lowe's last week for example. It literally doubled earnings, 8x in a row it's destroyed them, and It's down 9% since. What more could you literally want from a company (I dont own it btw, so this isn't a rant on that basis)

I know the argument is ""ThE WhoLE MaRkEt Is DoWn"". Sorry, no, I don't buy this bullshit.

Let's look at todays winners;

America Great Health is the 5th biggest gainer today, up 15%. It's a garbage fucking pennystock that trades at 0.18 cents. Even worse, it's a bullshit pharma stock that used to be a fucking marketing company. Normal volume is 10 million. Volume today - 200 million. There is no news to justify this interest

Iovance Biotherapeutics, another fucking pharma stock, missed earnings, has CLAIMS OF SECURITIES FRAUD,  and is up 15% today.

LifeMD has had 2 lawsuits filed against it in the last week, about claims its directors have committed (even more) fraud -- seems like a pattern. Even better;

**LifeMD appears to use unlicensed doctors to dispense OTC medications, has implemented an autoshipping/autobilling scheme, failed to honor guarantees, and put in place abusive telemarketing practices.**

So what does the stock do in response to this? Of course, it jumps 15%.

To end my rant, the 3rd placed highest today is another bullshit company, a Chinese medical company called Lianluo Smart. There's one single news article linking it to a takeover by newegg or something, the news article made little sense. Low and behold, normal volume is 400k, today it's 9 million. Even if the news is to be believed, this one single article was posted 1 hour ago, yet the price suddenly spiked 2 hours ago.

So, why do companies that do well, make money, smash earnings lose their stock value, and bullshit, nonsense companies get P&D so much. This is a daily occurence. Every single day I see a new company increasing its share price by 50%+ and it's nonsense. I thought P&D's were illegal.

I'm losing (lost tbh) all faith in the market and it feels more and more like a (rigged) casino every day now.",nhf2c1,"Rant: I don't get it. I kinda got it in 2020, but not now - earnings don't matter anymore, and every single asset class is just pump & dump after pump & dump?"
29,gyvwrpr,2021-05-20 23:57:05,t1_gyvwrpr,t3_nhf2c1,StockMarket,Welcome to the post reality matrix.,,
30,gyvwtxt,2021-05-20 23:57:38,t1_gyvwtxt,t3_nhf2c1,StockMarket,"The price it’s trading at doesn’t mean it’s fairly valued with killer earnings. Will growth be sustainable and usually earnings calls shake that up.

OTC nothing applies too low if volume too low of market caps it’ll be riddled with anomalies.",,
31,gyvwww3,2021-05-20 23:58:19,t1_gyvwww3,t1_gyvwrpr,StockMarket,This is my hell,,
32,gyvwztv,2021-05-20 23:58:59,t1_gyvwztv,t3_nhf2c1,StockMarket,"You mean you actually believed we lived in a non-fraudulent market.  Hahaha oh little one this shit is a casino and the house ALWAYS wins. They know how to distract, divert and divide retail. The only ones who make money are the institutions. But not to worry the reckoning is coming because we all know their game and it’s about to blow up when the credit derivative markets implode because a bunch of apes aren’t selling.",,
33,gyvx0e0,2021-05-20 23:59:08,t1_gyvx0e0,t1_gyvwtxt,StockMarket,What I’m saying is volume shoots up for fucking no name stocks — it’s a pump and dump!!,,
34,gyvx3rq,2021-05-20 23:59:56,t1_gyvx3rq,t1_gyvwztv,StockMarket,🚀🚀🚀 i never got in myself but I'm all for this shit burning down,,
35,gyvx9az,2021-05-21 00:01:13,t1_gyvx9az,t1_gyvx3rq,StockMarket,It’s coming and the over leveraged institutions will fail,,
36,gyvxfd6,2021-05-21 00:02:38,t1_gyvxfd6,t3_nei49n,StockMarket,Anybody selling DISCA to buy DISCK? With the single class structure after the merger then DISCK would gain voting. Seems like slightly more upside vs DISCA,,
37,gyvxftt,2021-05-21 00:02:45,t1_gyvxftt,t1_gyvx9az,StockMarket,you know what's gonna happen. govt bailout,,
38,gyvxg4j,2021-05-21 00:02:49,t1_gyvxg4j,t1_gyvqoio,StockMarket,Yes,,
39,gyvxo4e,2021-05-21 00:04:42,t1_gyvxo4e,t1_gyvrqse,StockMarket,Those are experimenting stocks and yes I do have crypto,,
40,gyvxpe2,2021-05-21 00:05:00,t1_gyvxpe2,t1_gyvqca8,StockMarket,Ok,,
41,gyvxs0t,2021-05-21 00:05:36,t1_gyvxs0t,t1_gyvvmzu,StockMarket,Ok,,
42,gyvxvh3,2021-05-21 00:06:25,t1_gyvxvh3,t1_gyvwrpr,StockMarket,Stonks only go up fellas,,
43,gyvy3rk,2021-05-21 00:08:21,t1_gyvy3rk,t3_nh7zrq,StockMarket,I’m in the goo!!!,,
44,gyvyap3,2021-05-21 00:09:55,t1_gyvyap3,t3_nh7zrq,StockMarket,I’m Going all in on this one. Or at least as much of me as you can handle!!!,,
45,gyvybsz,2021-05-21 00:10:11,t1_gyvybsz,t1_gyvxvh3,StockMarket,rocket emoji,,
46,gyvyg34,2021-05-21 00:11:12,t1_gyvyg34,t3_ngug6i,StockMarket,Take a few pages out of the SwingBot handbook. Day trading the dips and consolidations only.,,
47,gyvynne,2021-05-21 00:13:01,t1_gyvynne,t1_gyvx3rq,StockMarket,It’s not too late,,
48,gyvypj2,2021-05-21 00:13:29,t1_gyvypj2,t3_nhbgi5,StockMarket,Thank you for these recaps!,,
49,gyvyrcb,2021-05-21 00:13:56,t1_gyvyrcb,t3_nh7zrq,StockMarket,This dude drew a bullish penis. Where do I buy?,,
50,gyvz19s,2021-05-21 00:16:21,t1_gyvz19s,t3_nh7zrq,StockMarket,Dividends are stored in the balls,,
51,gyvz6uk,2021-05-21 00:17:38,t1_gyvz6uk,t3_nhdwpl,StockMarket,Go into cryosleep for a year,,
52,gyvzbo4,2021-05-21 00:18:47,t1_gyvzbo4,t3_ngxu87,StockMarket,How many shares of GME do you have?,,
53,gyvzbsk,2021-05-21 00:18:48,t1_gyvzbsk,t3_nh7zrq,StockMarket,This is the best TA I've ever seen.,,
54,gyvzits,2021-05-21 00:20:29,t1_gyvzits,t3_nh7zrq,StockMarket,this made me laugh hard 🤣🤣 you even drew veins in it bahahahahhah,,
55,gyvzltj,2021-05-21 00:21:12,t1_gyvzltj,t3_nh7zrq,StockMarket,It ain’t wrong,,
56,gyvzsda,2021-05-21 00:22:47,t1_gyvzsda,t3_nh7zrq,StockMarket,Excellent! Someone get this man a DD-degree.,,
57,gyvzsw4,2021-05-21 00:22:55,t1_gyvzsw4,t1_gyvxftt,StockMarket,"The government won't be able to afford it, and I know that seems crazy but it's true. That's how crazy leveraged they are. I'm anticipating a hostile takeover from Blackrock or another entity.",,
58,gyvztzj,2021-05-21 00:23:11,t1_gyvztzj,t3_ngoknc,StockMarket,TSM and ASML.,,
59,gyvzwop,2021-05-21 00:23:50,t1_gyvzwop,t3_ngug6i,StockMarket,Rule #1 Buy protection when it’s cheap not when you have too. You should do the Monthly Charts of QQQ and SPY each month and compare to where the VIX and VXN are at. When either looks out of whack like a wide divergence from the MA on the Indexes or volatility at a extremely low level then you look to buy protection for your long positions. Just remember tops happen overtime so your usually gonna be early so sell protection 6 months out and roll it farther if you have to.,,
60,gyw01mj,2021-05-21 00:25:03,t1_gyw01mj,t3_nhf2c1,StockMarket,What's interesting to me is that this shit never seemed to happen before Payment For Order Flow became so prevalent. Sus,,
61,gyw08hm,2021-05-21 00:26:42,t1_gyw08hm,t3_ngug6i,StockMarket,"As long as you hear ""crash""  from everywhere there won't be one.  Be scared when it is quiet.",,
62,gyw092z,2021-05-21 00:26:51,t1_gyw092z,t3_nh7zrq,StockMarket,It's a big veiny one too 🤣🤣,,
63,gyw094g,2021-05-21 00:26:51,t1_gyw094g,t1_gyprdm3,StockMarket,I can’t handle the stress of this bull**** anymore :(,,
64,gyw0a6m,2021-05-21 00:27:06,t1_gyw0a6m,t3_ngxu87,StockMarket,"Bravo, stay the course!",,
65,gyw0b2i,2021-05-21 00:27:19,t1_gyw0b2i,t3_nhf2c1,StockMarket,Retail can’t pull off p&d’s like this. This is most likely hedge funds with liquidity issues. Welcome to the fraudulent market where the rich get richer and the poor get poorer. It’s not supposed to make sense bc the numbers are all made up,,
66,gyw0cc1,2021-05-21 00:27:37,t1_gyw0cc1,t3_nh7zrq,StockMarket,HAR HAR A PEE PEE GUYS,,
67,gyw0n6n,2021-05-21 00:30:17,t1_gyw0n6n,t3_nhdwpl,StockMarket,Does anyone know how to buy LTUM LITHIUM CORPORATION stock?,,
68,gyw0r6d,2021-05-21 00:31:15,t1_gyw0r6d,t3_nhf2c1,StockMarket,It’s not too early to buy this nice dip in crypto. My anxiety over the market lessens every time I liquidate to pump a coin instead,,
69,gyw0uyv,2021-05-21 00:32:12,t1_gyw0uyv,t1_gyw0r6d,StockMarket,"I'm afraid crypto is going to be more of the same soon, if it hasn't happened already. HFs and institutions won't stay away long. And the more money you have easier it is",,
70,gyw0w0o,2021-05-21 00:32:28,t1_gyw0w0o,t1_gyw0b2i,StockMarket,Don't i know it!!!,,
71,gyw0wve,2021-05-21 00:32:40,t1_gyw0wve,t3_nhf2c1,StockMarket,The worst I've seen so far was AMD... that was a TOTAL beat on earnings but because of the Xilinx deal is kept artificially low.,,
72,gyw0x93,2021-05-21 00:32:46,t1_gyw0x93,t1_gyw01mj,StockMarket,That started with Robinhood right?,,
73,gyw104k,2021-05-21 00:33:28,t1_gyw104k,t1_gyvtvb8,StockMarket,Not a bad add at all! thank you for the advice!,,
74,gyw10fd,2021-05-21 00:33:32,t1_gyw10fd,t3_ngzy5z,StockMarket,Stablecoins have no investment value. And if you get something like USDT you also assume extra risk lol,,
75,gyw13tl,2021-05-21 00:34:21,t1_gyw13tl,t1_gyw104k,StockMarket,You are welcome 🙏,,
76,gyw1ds8,2021-05-21 00:36:44,t1_gyw1ds8,t3_nhdwpl,StockMarket,I would buy low sell high,,
77,gyw1f3y,2021-05-21 00:37:04,t1_gyw1f3y,t1_gyvtb4w,StockMarket,Careful tendies are delicious but they increase your cholesterol!,,
78,gyw1hku,2021-05-21 00:37:41,t1_gyw1hku,t1_gyurbwg,StockMarket,More like T&A,,
79,gyw1pgi,2021-05-21 00:39:36,t1_gyw1pgi,t3_nh7zrq,StockMarket,Tits up!! Classic spurt and handle formation !,,
80,gyw1rcl,2021-05-21 00:40:03,t1_gyw1rcl,t3_nhdwpl,StockMarket,I would try to start to invest in real companies,,
81,gyw1s2u,2021-05-21 00:40:14,t1_gyw1s2u,t3_nhf2c1,StockMarket,"Sir, this is a casino",,
82,gyw1wpr,2021-05-21 00:41:21,t1_gyw1wpr,t1_gyvzsw4,StockMarket,Exactly Corona has made the government printers ink cartridges run out,,
83,gyw1zoq,2021-05-21 00:42:03,t1_gyw1zoq,t1_gykcmn7,StockMarket,So how’de that go mate?,,
84,gyw23bq,2021-05-21 00:42:56,t1_gyw23bq,t3_nhf2c1,StockMarket,Sir/ma’am this is a Casino,,
85,gyw28ry,2021-05-21 00:44:15,t1_gyw28ry,t1_gyw0wve,StockMarket,AMD will roar back by the end of the year when the deal gets done n dusted.,,
86,gyw2c6i,2021-05-21 00:45:04,t1_gyw2c6i,t1_gyw0x93,StockMarket,"WeBull actually did it before Robinhood I think, but Robinhood based their entire business around it.",,
87,gyw2j0i,2021-05-21 00:46:44,t1_gyw2j0i,t3_nh7zrq,StockMarket,To my calculations we should peak right around aug 1st . Cheerio,,
88,gyw2k4b,2021-05-21 00:47:01,t1_gyw2k4b,t1_gyw2j0i,StockMarket,"To mine own calculations we shouldst peak right 'round aug 1st.  Cheerio

***



^(I am a bot and I swapp'd some of thy words with Shakespeare words.)

Commands: `!ShakespeareInsult`, `!fordo`, `!optout`",,
89,gyw2rxu,2021-05-21 00:48:53,t1_gyw2rxu,t1_gysfzas,StockMarket," I started trading  Q2 of 2019. I'm hitting my 3rd this August. But you could say that I've benefited a lot from the set up the 2020 bull equity market offered--though majority of my trades were taken in the currency market. 

Of course, there's also another side to the story. The Covid crash chipping a decent 5% of my account and many more! 

Didn't mean to flaunt with the first few lines of my post. And Like I said, luck also played its role.",,
90,gyw325z,2021-05-21 00:51:21,t1_gyw325z,t1_gyw28ry,StockMarket,Yeah maybe... but the point is... it should be roaring NOW! Cost me money on my June calls... will never print.,,
91,gyw33ya,2021-05-21 00:51:47,t1_gyw33ya,t1_gyt8lb4,StockMarket,Who says money doesn’t buy happiness?,,
92,,2021-05-21 00:52:14,t3_nhg5dn,,StockMarket,,nhg5dn,Robinhood unveils new platform that will give retail investors access to IPO shares
93,gyw35zi,2021-05-21 00:52:17,t1_gyw35zi,t3_nh7zrq,StockMarket,Dang it man!  Beer just shot out of my nose!,,
94,gyw3any,2021-05-21 00:53:26,t1_gyw3any,t3_nh7zrq,StockMarket,Loving that Technical analysis.... ape horny... yolo time,,
95,gyw3glx,2021-05-21 00:54:54,t1_gyw3glx,t3_nhdwpl,StockMarket,"There is nothing wrong with the stocks. But it looks like you are buying them when they are already high. Also subpenny stocks are risky. They may all turn worthless, but it only takes one to moon. And you can easily turn a 1k investment into 100k+. If I were you I will not sell a single share. But you have to be patient. Plus the market is just red at the moment.",,
96,gyw3jlk,2021-05-21 00:55:37,t1_gyw3jlk,t1_gyul6dd,StockMarket,You still at this nonsense old man?,,
97,,2021-05-18 22:49:49,t3_nfore2,,StockMarket,,nfore2,Virgin Group's VG Acquisition Corp. Announces Date of Shareholders Meeting in Connection with its Pending Business Combination with 23andMe
98,gyw3lqp,2021-05-21 00:56:10,t1_gyw3lqp,t3_nhf2c1,StockMarket,"https://en.wikipedia.org/wiki/Kondratiev_wave?wprov=sfti1

Read this. It hypothesizes that the next wave is big pharma and mental health.

Could be bogus but kind of interesting!",,
99,gyw3oj8,2021-05-21 00:56:52,t1_gyw3oj8,t1_gyw3glx,StockMarket,That some great advice 💯,,
100,gyw3ot8,2021-05-21 00:56:56,t1_gyw3ot8,t1_gyw1s2u,StockMarket,Slot machine broken,,
101,,2021-05-21 00:57:00,t3_nhg8kr,,StockMarket,,nhg8kr,Watching your life savings burn to ash as you invested in bitcoin
102,gyw3qfy,2021-05-21 00:57:21,t1_gyw3qfy,t1_gysjndo,StockMarket,"Definitely man. Which is why I jumped from one broker to another. My first broker robbed me with high spreads. Trading opportunities were very much limited because of it. 4th rule was more of a psychological awakening to me. For running trades, the less you care, the more you win. 

Thank you, man!",,
103,gyw3s2x,2021-05-21 00:57:45,t1_gyw3s2x,t1_gyrq69o,StockMarket,"There is a 23 hour delay fetching comments.

I will be messaging you in 21 days on [**2021-06-10 01:25:57 UTC**](http://www.wolframalpha.com/input/?i=2021-06-10%2001:25:57%20UTC%20To%20Local%20Time) to remind you of [**this link**](https://www.reddit.com/r/StockMarket/comments/ngkp5p/im_calling_it_tesla_is_gonna_dump_hard_better/gyrq69o/?context=3)

[**CLICK THIS LINK**](https://www.reddit.com/message/compose/?to=RemindMeBot&subject=Reminder&message=%5Bhttps%3A%2F%2Fwww.reddit.com%2Fr%2FStockMarket%2Fcomments%2Fngkp5p%2Fim_calling_it_tesla_is_gonna_dump_hard_better%2Fgyrq69o%2F%5D%0A%0ARemindMe%21%202021-06-10%2001%3A25%3A57%20UTC) to send a PM to also be reminded and to reduce spam.

^(Parent commenter can ) [^(delete this message to hide from others.)](https://www.reddit.com/message/compose/?to=RemindMeBot&subject=Delete%20Comment&message=Delete%21%20ngkp5p)

*****

|[^(Info)](https://www.reddit.com/r/RemindMeBot/comments/e1bko7/remindmebot_info_v21/)|[^(Custom)](https://www.reddit.com/message/compose/?to=RemindMeBot&subject=Reminder&message=%5BLink%20or%20message%20inside%20square%20brackets%5D%0A%0ARemindMe%21%20Time%20period%20here)|[^(Your Reminders)](https://www.reddit.com/message/compose/?to=RemindMeBot&subject=List%20Of%20Reminders&message=MyReminders%21)|[^(Feedback)](https://www.reddit.com/message/compose/?to=Watchful1&subject=RemindMeBot%20Feedback)|
|-|-|-|-|",,
104,gyw3s4x,2021-05-21 00:57:46,t1_gyw3s4x,t3_nhf2c1,StockMarket,because assets now are highly inflated. earnings don't make sense.,,
105,gyw3t5e,2021-05-21 00:58:02,t1_gyw3t5e,t3_nh9c8e,StockMarket,Should I still invest?,,
106,gyw3u8v,2021-05-21 00:58:18,t1_gyw3u8v,t1_gyw2c6i,StockMarket,Yep and are making a killing,,
107,gyw3v86,2021-05-21 00:58:33,t1_gyw3v86,t1_gyw325z,StockMarket,"I feel you. The stocks are distracted because the media n boomers n Cramer are busy talking about inflation, rotation, transitional, Fed, interest rate, COVID n so on.",,
108,gyw3vwg,2021-05-21 00:58:43,t1_gyw3vwg,t3_nhg8kr,StockMarket,Not if you drop them paper hands and hodl.,,
109,gyw3wpj,2021-05-21 00:58:56,t1_gyw3wpj,t1_gyw23bq,StockMarket,Slot machine broke,,
110,gyw3ys3,2021-05-21 00:59:28,t1_gyw3ys3,t3_nhg5dn,StockMarket,"Just wait, it will be like only for those with more than $10M in their RH accounts or some shit.",,
111,gyw3yvw,2021-05-21 00:59:29,t1_gyw3yvw,t1_gyw3s4x,StockMarket,That's what I'm saying. Doesn't seem like a bubble or necessarily mania but we're still seeing this happen,,
112,gyw40s2,2021-05-21 00:59:58,t1_gyw40s2,t1_gyw3t5e,StockMarket,I did,,
113,gyw42f7,2021-05-21 01:00:22,t1_gyw42f7,t1_gyvynne,StockMarket,maybe not maybe not,,
114,gyw44o1,2021-05-21 01:00:56,t1_gyw44o1,t3_nhf2c1,StockMarket,The smart thing is to invest with a company over five plus years. Earnings will matter. Fuck the day trading pump and dumps,,
115,gyw481y,2021-05-21 01:01:48,t1_gyw481y,t1_gyw3wpj,StockMarket,"Sorry, here we don’t refund money lost!",,
116,gyw4a2f,2021-05-21 01:02:18,t1_gyw4a2f,t1_gyv6b97,StockMarket,"One thing I noticed about Gold is how it changed behavior post 2020 to 2021. But yes,  sometimes we just need to get a hold of our inner FOMO. 

 Right now, I'd rather have a wrong bias than an analysis that I completely went against.",,
117,gyw4czl,2021-05-21 01:03:03,t1_gyw4czl,t1_gyt2x52,StockMarket,"Laughed a bit too much with the first line. 

Thanks, man!",,
118,gyw4hhy,2021-05-21 01:04:10,t1_gyw4hhy,t3_nhf2c1,StockMarket,"If u follow value investing, then u should know it looks at at least 10 years span. If u r mad at short term up and down, u r not value investor at all....",,
119,gyw4l85,2021-05-21 01:05:03,t1_gyw4l85,t3_ngxu87,StockMarket,That's awesome! At that rate you'll be a millionaire in no time!,,
120,gyw4nbp,2021-05-21 01:05:34,t1_gyw4nbp,t3_nhf2c1,StockMarket,You just don't realize how much earnings have exploded. S&P is lower relative to earnings today than in 2019,,
121,gyw4xew,2021-05-21 01:08:04,t1_gyw4xew,t1_gyw3ys3,StockMarket,Nah the server will go down every time even though they were “prepared for the traffic”,,
122,gyw52jf,2021-05-21 01:09:21,t1_gyw52jf,t3_nhg5dn,StockMarket,Robinhood sucks,,
123,gyw56lw,2021-05-21 01:10:21,t1_gyw56lw,t1_gyw1wpr,StockMarket,And yet the Fed keeps saying “dOn’T wOrrY aBoUt InfLaTiOn” like ok… you just pumped billions of new money into the economy… unless they plan to take away and burn a near equal amount of money after we completely reopen idk what their justification is for saying this.,,
124,gyw58ek,2021-05-21 01:10:48,t1_gyw58ek,t1_gyw52jf,StockMarket,I read that as robinhood snacks lmfao oops,,
125,gyw59jj,2021-05-21 01:11:05,t1_gyw59jj,t1_gyw56lw,StockMarket,To keep the herds calm,,
126,gyw5b2f,2021-05-21 01:11:27,t1_gyw5b2f,t1_gyujymg,StockMarket,All currency and assets face wild swings in the beginning. Look at the US dollar when the country first started. Adoption and stability happens over time.,,
127,gyw5dsn,2021-05-21 01:12:08,t1_gyw5dsn,t1_gyw59jj,StockMarket,Maybe but anybody with even the most basic Econ 101 knowledge knows they’re full of shit though. Lol,,
128,gyw5jey,2021-05-21 01:13:31,t1_gyw5jey,t1_gyw5dsn,StockMarket,You need to understand that there’s a 1% and 99% for a reason. You think tiger king would worry about inflation?,,
129,gyw5k7a,2021-05-21 01:13:43,t1_gyw5k7a,t3_nh7jes,StockMarket,"Idk why the hell the FED is talking about, transitory is more like a suppository giving us the shaft! If they used the older metric for inflation that accounts for what really hurts people inflation is 11-14% !",,
130,gyw5q3v,2021-05-21 01:15:10,t1_gyw5q3v,t3_nhg5dn,StockMarket,I don't even seeing RH being a company in two years,,
131,gyw61cz,2021-05-21 01:17:49,t1_gyw61cz,t1_gyw5jey,StockMarket,"Exactly what I’m saying, the people that care already know the Fed is full of shit and the rest of the people don’t give a fuck about inflation so why even bother lying",,
132,gyw68v2,2021-05-21 01:19:36,t1_gyw68v2,t1_gyw61cz,StockMarket,I don’t know I just keep trying to protect myself from the impending storm,,
133,gyw6c30,2021-05-21 01:20:22,t1_gyw6c30,t1_gyw5q3v,StockMarket,Be greedy when others are fearful,,
134,gyw6cx5,2021-05-21 01:20:33,t1_gyw6cx5,t3_nhg8kr,StockMarket,"BTC will be over 70k soon, enjoy the ride",,
