,comment_id,created,fullname,parent_id,subreddit,text,post_id,title
485,,2021-05-21 10:01:32,t3_nhov3b,,StockMarket,"I am a new investor and while I am learning more every day and looking into stuff more and more, Coca Cola has caught my eye. Basically, coca cola (I'll just say KO for now on) was shown to have a div/yield of around 3. On top of that, KO isn't going anywhere any time soon, and even though it's a gigantic thing, it's only at around 54 dollars per share. I'm thinking of buying a bit more shares of this than I normally would, around 19-20 or so, so I can get a decent amount of dividends and put those back into investing. I have tried to play it as intelligently as I could, and while something may seem dumb, to me it made logical sense. I've mostly been investing in ETF's, with only Visa being my one blue collar company. I was wondering if it would be wise to then buy a few of KO as my next blue collar company, and buy more for the dividends aspect too.  


My comparison, my portfolio right now is:  
2.51 shares of VOO (Vanguard S&P 500 ETF)  
3.02 shares of V (Visa)  
1.05 Shares of SPY (SPDR S&P 500 ETF)  
2.53 shares of VTV (Vanguard Value ETF)  
(I plan on buying a few shares of KO but here's where I come to ask if it's worth it to buy more, around 19-20 or just buy a few like I did with the others)  


Thanks for the help and if you read this far, thanks for reading this far too.",nhov3b,Is it wise to invest in Coca Cola for Dividends?
486,gyxe334,2021-05-21 10:07:08,t1_gyxe334,t3_nhmqut,StockMarket,Does the author know what skyrocketed even means?,,
487,gyxebvy,2021-05-21 10:11:00,t1_gyxebvy,t1_gyx729s,StockMarket,"There are plenty of things that sell for way over fair market value, including Tesla.  If money can be made money can be made. Doge was a good doggie moneymaker, and it paid off tenfold for me and much more for others.  It is as risky as every single other crypto investment, and the ability of its price to be manipulated way beyond its value is also the same as every other crypto investment.  Every time that fool opens up his mouth it's a good options trigger pull for Tesla.",,
488,gyxeeo3,2021-05-21 10:12:12,t1_gyxeeo3,t1_gyx53bf,StockMarket,More like a potato cannon,,
489,gyxeltn,2021-05-21 10:15:13,t1_gyxeltn,t3_nhmqut,StockMarket,That man is just the distraction to fuck with your stupid mind.  For once people think,,
490,gyxeor0,2021-05-21 10:16:28,t1_gyxeor0,t3_nh3913,StockMarket,The one stock for me that's up 40%,,
491,gyxeqqb,2021-05-21 10:17:17,t1_gyxeqqb,t1_gyx45yu,StockMarket,"And never trust someone who have said not to trust someone who had said not to trust someone, because you never trust someone who says don't trust someone",,
492,gyxezfl,2021-05-21 10:20:54,t1_gyxezfl,t3_nhimck,StockMarket,That’s kind of like saying I have never and will never sell the US dollar. Coins are meant to buy things not to sell.,,
493,gyxezn5,2021-05-21 10:20:59,t1_gyxezn5,t3_nhov3b,StockMarket,Good steady payer of dividends. KO is a [dividend aristocrat](https://www.buyupside.com/dividendaristocrats/dividendaristocratsyieldssorted.php),,
494,gyxf7kq,2021-05-21 10:24:14,t1_gyxf7kq,t1_gyx4unu,StockMarket,Ya man I don’t get these types of people. In his shoes I’d just cash out and live in stress free luxury for the rest of my days instead. Which is probably also why I’ll never be in his shoes I guess lol.,,
495,gyxfc88,2021-05-21 10:26:07,t1_gyxfc88,t3_nh9k5i,StockMarket,Der gute alte lange schwarze,,
496,gyxfk6p,2021-05-21 10:29:20,t1_gyxfk6p,t1_gyx5pjc,StockMarket,I highly doubt that was his intention,,
497,gyxfndb,2021-05-21 10:30:40,t1_gyxfndb,t1_gyxeqqb,StockMarket,And never fight a man with a perm.,,
498,gyxfqnd,2021-05-21 10:32:01,t1_gyxfqnd,t1_gyxfndb,StockMarket,No? Hold my perm,,
499,gyxfrd5,2021-05-21 10:32:19,t1_gyxfrd5,t1_gyv7qoo,StockMarket,"You can invest in Trade Republic through the Sino AG. They bought into trade republic and hold a share in them. A few days ago, sino already shot up because of that.",,
500,gyxfyxy,2021-05-21 10:35:16,t1_gyxfyxy,t3_nhimck,StockMarket,Elon is probably taking the piss about the regulators.,,
501,gyxg2xc,2021-05-21 10:36:49,t1_gyxg2xc,t1_gyxeqqb,StockMarket,Never trust someone who likes fortnite,,
502,gyxg4bv,2021-05-21 10:37:24,t1_gyxg4bv,t1_gyxg2xc,StockMarket,:(,,
503,gyxgiti,2021-05-21 10:43:04,t1_gyxgiti,t1_gyxfrd5,StockMarket,Yeah they have like 4% left now... I think that shipped sailed,,
504,gyxglou,2021-05-21 10:44:09,t1_gyxglou,t3_nhimck,StockMarket,Until he changes his mind.....,,
505,gyxgmgr,2021-05-21 10:44:28,t1_gyxgmgr,t1_gywp1co,StockMarket,"That's exactly what all the people being interviewed on MSNBC and CNBC, analysts putting our reports and advice on buy and sell targets doing. And that market is regulated lol.",,
506,gyxgo8d,2021-05-21 10:45:08,t1_gyxgo8d,t1_gyw0b2i,StockMarket,We all get richer :),,
507,gyxgzn0,2021-05-21 10:49:28,t1_gyxgzn0,t1_gywd91j,StockMarket,"“Far more money has been lost by investors preparing for corrections, or trying to anticipate corrections, than has been lost in corrections themselves.” – Peter Lynch",,
508,gyxh7sk,2021-05-21 10:52:30,t1_gyxh7sk,t1_gywn1kr,StockMarket,"Fake money has no owners, only spenders.  And bag holders, lots of bag holders",,
509,gyxhcwk,2021-05-21 10:54:31,t1_gyxhcwk,t3_nhov3b,StockMarket,I never understood why would you want a dividend paying equity and not dividend reinvesting so you dont need to pay taxes. Can you explain it to me?,,
510,gyxhezv,2021-05-21 10:55:19,t1_gyxhezv,t3_nhimck,StockMarket,How is this dumb shit in a stock sub.,,
511,gyxhl3l,2021-05-21 10:57:38,t1_gyxhl3l,t1_gywvw9m,StockMarket,"😄
Slick statements...what would be the purpose of getting involved if you never intend to sell for profit?",,
512,gyxijgy,2021-05-21 11:10:15,t1_gyxijgy,t3_nhf2c1,StockMarket,"Yes, and worse, when you turn on the radio or whatever some talking head lies! and says it's because individuals are going by feelings. When it's really the big guys manipulating the markets.

True story.",,
513,gyxipax,2021-05-21 11:12:19,t1_gyxipax,t1_gywp7m4,StockMarket,Drive it,,
514,gyxirlv,2021-05-21 11:13:09,t1_gyxirlv,t3_nho5kv,StockMarket,I plan to learn from this,,
515,gyxiuvu,2021-05-21 11:14:20,t1_gyxiuvu,t3_nhov3b,StockMarket,Having some of the dividend aristocrats in ur portfolio is never a bad idea,,
516,gyxiv2r,2021-05-21 11:14:24,t1_gyxiv2r,t3_nhg5dn,StockMarket,"Yup, not touching that with a 10-ft pole",,
517,gyxix2z,2021-05-21 11:15:07,t1_gyxix2z,t1_gyxirlv,StockMarket,What do you mean by that ? 😂,,
518,gyxiydr,2021-05-21 11:15:34,t1_gyxiydr,t3_nhmqut,StockMarket,"Currently sitting at $0.38/each, half the price it was two weeks ago. So either you’re a retarded fuck-monkey posting bull shit or....no, no that’s really the only option right now.",,
519,gyxj24r,2021-05-21 11:16:53,t1_gyxj24r,t1_gyxix2z,StockMarket,My portfolio is horrible Yours looks nice. Just gonna see what people say,,
520,gyxj32c,2021-05-21 11:17:12,t1_gyxj32c,t3_nho5kv,StockMarket,"You have soooo much going on here. Adding or not adding reits, or anything else for that matter will not affect your returns in any meaningful way. Seems like you have literally everything in your portfolio, I don’t do diversification at all so this pie doesn’t make any sense to me. Its one big etf that will move along with the market. So expect to track sp500 forever (not a bad thing).",,
521,gyxj3g5,2021-05-21 11:17:19,t1_gyxj3g5,t3_nhg5dn,StockMarket,"Who at this point in retail would trust another service offered by robinhood?

Imma stay far away from that and RH.. Free trades arnt really free for us. Get another broker.",,
522,gyxj7jc,2021-05-21 11:18:43,t1_gyxj7jc,t1_gyxhcwk,StockMarket,You do pay taxes on reinvested dividends,,
523,gyxj8nj,2021-05-21 11:19:06,t1_gyxj8nj,t3_nhov3b,StockMarket,"Dividends are taxable, even if you choose to roll those into a DRIP immediately.",,
524,gyxj9ug,2021-05-21 11:19:30,t1_gyxj9ug,t1_gyxj32c,StockMarket,"I like to diversify but that portfolio is still 70% equity and 20% crypto, this pie is just going into detail of each holding",,
525,gyxjb0w,2021-05-21 11:19:54,t1_gyxjb0w,t1_gyxj7jc,StockMarket,Only after you sell. Which translates to compound interest if you don't.,,
526,gyxjera,2021-05-21 11:21:10,t1_gyxjera,t3_nhmqut,StockMarket,Considering his influence he’s pretty much manipulating the pricing. You can’t prove it though as he’s smart enough to not do it explicitly.,,
527,gyxjezq,2021-05-21 11:21:15,t1_gyxjezq,t1_gyx4cub,StockMarket,">It's cool that he is building electric cars but I am not fooled into thinking it isn't for anything more than lots of money.

Tesla did not bring profit for years...",,
528,gyxjfrv,2021-05-21 11:21:31,t1_gyxjfrv,t1_gyxhcwk,StockMarket,"Dividends are taxable, even if you roll those into a DRIP immediately.",,
529,gyxjhy8,2021-05-21 11:22:16,t1_gyxjhy8,t1_gyxjfrv,StockMarket,So that might be a tax difference between the US and israel,,
530,gyxjjnn,2021-05-21 11:22:52,t1_gyxjjnn,t3_nhmqut,StockMarket,When did this skyrocketing happen?,,
531,gyxjlod,2021-05-21 11:23:33,t1_gyxjlod,t1_gywwn4n,StockMarket,Facts people have RESPONSIBILITY,,
532,gyxjohl,2021-05-21 11:24:30,t1_gyxjohl,t1_gyxiydr,StockMarket,"Obeying the clown CEO is retarded, indeed.",,
533,gyxjq1m,2021-05-21 11:25:02,t1_gyxjq1m,t1_gyxj9ug,StockMarket,"Yeah I meant you are so diversified within stocks, you sp500 and nasdaq etfs, then 2 ”portfolios” of growth and divvy stocks both with 7% allocation. That means you will always move along with the market so all that diversification is unnecessary.

Personally I have 10 individual stocks in my portfolio and nothing else. So to me that pie looks like its diversified in to the fifth dimension.",,
534,gyxjz06,2021-05-21 11:28:05,t1_gyxjz06,t1_gyxjq1m,StockMarket,"That’s a fair point , I did want to have a part witch keeps me busy that I can actively manage such as the growth stocks and dividend part , but yes would mainly like to move with the market while also keeping good crypto exposure",,
535,gyxk08j,2021-05-21 11:28:30,t1_gyxk08j,t3_nhmqut,StockMarket,Fuck you musk,,
536,gyxk3iq,2021-05-21 11:29:37,t1_gyxk3iq,t1_gytlhxi,StockMarket,"There is a 21 hour delay fetching comments.

I will be messaging you in 1 month on [**2021-06-20 13:48:03 UTC**](http://www.wolframalpha.com/input/?i=2021-06-20%2013:48:03%20UTC%20To%20Local%20Time) to remind you of [**this link**](https://www.reddit.com/r/StockMarket/comments/ngylpx/just_a_joke/gytlhxi/?context=3)

[**CLICK THIS LINK**](https://www.reddit.com/message/compose/?to=RemindMeBot&subject=Reminder&message=%5Bhttps%3A%2F%2Fwww.reddit.com%2Fr%2FStockMarket%2Fcomments%2Fngylpx%2Fjust_a_joke%2Fgytlhxi%2F%5D%0A%0ARemindMe%21%202021-06-20%2013%3A48%3A03%20UTC) to send a PM to also be reminded and to reduce spam.

^(Parent commenter can ) [^(delete this message to hide from others.)](https://www.reddit.com/message/compose/?to=RemindMeBot&subject=Delete%20Comment&message=Delete%21%20ngylpx)

*****

|[^(Info)](https://www.reddit.com/r/RemindMeBot/comments/e1bko7/remindmebot_info_v21/)|[^(Custom)](https://www.reddit.com/message/compose/?to=RemindMeBot&subject=Reminder&message=%5BLink%20or%20message%20inside%20square%20brackets%5D%0A%0ARemindMe%21%20Time%20period%20here)|[^(Your Reminders)](https://www.reddit.com/message/compose/?to=RemindMeBot&subject=List%20Of%20Reminders&message=MyReminders%21)|[^(Feedback)](https://www.reddit.com/message/compose/?to=Watchful1&subject=RemindMeBot%20Feedback)|
|-|-|-|-|",,
537,gyxk42p,2021-05-21 11:29:48,t1_gyxk42p,t1_gyx729s,StockMarket,"I mean... All your investments in a single company can be ruined by the board taking a bad decision... Heck, even just one member of the board getting caught for fraud or sexual harassment or whatever can make the price dip!",,
538,gyxk76z,2021-05-21 11:30:53,t1_gyxk76z,t1_gyxiydr,StockMarket,If you look at the chart it had a big jump when he tweeted and then the price corrected itself to sign with the rest of the market...,,
539,gyxka8g,2021-05-21 11:31:56,t1_gyxka8g,t3_ngxu87,StockMarket,this guy has a green portfolio jhheez👊🏻,,
540,gyxkcqm,2021-05-21 11:32:46,t1_gyxkcqm,t3_nh6grs,StockMarket,"Cryptocurrencies are here to stay, but if Bitcoin is to last ""indefinitely"", we're gonna have to find ourselves another planet to live on.",,
541,gyxkdiy,2021-05-21 11:33:02,t1_gyxkdiy,t1_gyxjera,StockMarket,You can prove it. With his stupid ass tweets. The guy is a megalomaniac. He shits all over Bitcoin AFTER making a bunch of money off it and the price falls. Yeah.... not too discreet there. He’s a clown and all his obsessed bros enable that. Jokes,,
542,gyxklwd,2021-05-21 11:35:48,t1_gyxklwd,t3_nhov3b,StockMarket,"KO is generally owned for exactly that reason. The dividends is reliable and fantastic. Know that it may underperform in times of excellent market performance, but you get reliability.",,
543,gyxkng4,2021-05-21 11:36:18,t1_gyxkng4,t3_nhmqut,StockMarket,"Can't see it ever going into the .60s again, I kept a handful of coins though just to see what happens",,
544,gyxkqwg,2021-05-21 11:37:25,t1_gyxkqwg,t1_gyxjb0w,StockMarket,If GME had dividends. Would you hold it when it was 480 until next year for compound interest? Just curious,,
545,gyxkx2x,2021-05-21 11:39:27,t1_gyxkx2x,t1_gyxkqwg,StockMarket,"I figured op was talking about a long term hold, which i thought was obvious from my replies. Gme is a short term play.",,
546,gyxl27g,2021-05-21 11:41:07,t1_gyxl27g,t1_gyvq2yu,StockMarket,Nice,,
547,gyxl315,2021-05-21 11:41:24,t1_gyxl315,t1_gyxkqwg,StockMarket,And what is it with reddit users trying really hard all the time to prove a stranger they are right?,,
548,gyxl6wq,2021-05-21 11:42:39,t1_gyxl6wq,t3_nho5kv,StockMarket,"Its so close to perfect... it just needs a little banano coin to balance it out 

&#x200B;

/u/Banano_tipbot 1",,
549,gyxl97c,2021-05-21 11:43:22,t1_gyxl97c,t1_gywmq3e,StockMarket,Excellently put,,
550,gyxlifj,2021-05-21 11:46:20,t1_gyxlifj,t3_nhdwpl,StockMarket,Try to get some green in there,,
551,gyxlyft,2021-05-21 11:51:17,t1_gyxlyft,t3_nho5kv,StockMarket,"If you're gonna diversify so much just buy an S&P500 etf, set it, forget it and focus on other areas of your life to try and generate more income to consistently keep buying more of the ETF. That's just me. You do what you wanna do. There's a million different ways to invest and trade and noone knows what the future holds.",,
552,gyxm5lp,2021-05-21 11:53:27,t1_gyxm5lp,t3_nhmqut,StockMarket,No it didn’t.,,
553,gyxm65u,2021-05-21 11:53:38,t1_gyxm65u,t3_nhg5dn,StockMarket,"Like I’d want to ever try them after the shit they pulled off with GME, robin you blind is what they’re doing",,
554,gyxm9pr,2021-05-21 11:54:43,t1_gyxm9pr,t3_nhmqut,StockMarket,Ah the good old skyrocket -3% red. U colorblind isn't it?,,
555,gyxmctz,2021-05-21 11:55:40,t1_gyxmctz,t3_nho5kv,StockMarket,"Just buy a global index ETF or fund with low fee and then add some crypto.

It’s pretty much the same as what you have now, except less complicated to track.",,
556,gyxmja9,2021-05-21 11:57:36,t1_gyxmja9,t3_nhmqut,StockMarket,Fck Elon Musk. Stop following these mentally ill morons and instead use your brains.,,
557,gyxmlfd,2021-05-21 11:58:13,t1_gyxmlfd,t1_gyv2vum,StockMarket,that’s robinhood feom the looks of it,,
558,gyxmll4,2021-05-21 11:58:16,t1_gyxmll4,t1_gyx53bf,StockMarket,OP is a bot. He posts like every hour 24/7.,,
559,gyxmlvm,2021-05-21 11:58:21,t1_gyxmlvm,t1_gyx729s,StockMarket,Stop talking about stocks that way.,,
560,gyxmnzn,2021-05-21 11:58:59,t1_gyxmnzn,t1_gyxk42p,StockMarket,There’s actually corporate liability insurance for exactly this reason. Elon’s schtick works different because he’s selling his cult of personality rather than useful projects,,
561,gyxmv02,2021-05-21 12:01:04,t1_gyxmv02,t1_gyx729s,StockMarket,"Have you paid attention to the market everytime the Fed talks? We live in a world where everyone has easy access to the market and easy access to information, and a commission  free world with lot of new places to trade/invest. So everything will turn into the same way sooner or later.",,
562,gyxn7cl,2021-05-21 12:04:42,t1_gyxn7cl,t3_nhov3b,StockMarket,"Yes you should also have a look at European/ Swiss Stocks good dividend payers and lagging behind.

And dividends help you to keep cool in volatility as you now you get something in return",,
563,gyxnaqw,2021-05-21 12:05:40,t1_gyxnaqw,t3_nhdwpl,StockMarket,"Based on your current performance...literally everything you’re doing. Best advice I think is whatever you’re thinking about doing, do the complete opposite Lol",,
564,,2021-05-18 22:14:39,t3_nfnxi0,,StockMarket,,nfnxi0,Self Storage companies are thriving in this environment and the avg dividend yield is at 3.3%
565,,2021-05-18 22:37:20,t3_nfogn8,,StockMarket,"Hi all! I hope this is posted in the correct sub. 

I’m currently enrolled in a MBA and I’m looking for some advice on an assignment in my microeconomics module. Essentially I’ve been asked to give my analysis and hypothesis of an excel spreadsheet that contains customer deposits for a brokerage firm. This spreadsheet contains two columns (sum and net deposits) that I am to base my calculations on.

I’m attempting to calculate assets under management (image 1). The professor has provided the formula for this however I’m unsure how to calculate market movements. I know the definition for market movements varies between subject and company so I’m unsure of how to approach this.

Can anyone tell me how to calculate market movements based off the columns in image 2? 

Any help would be greatly appreciated 🙏

https://imgur.com/a/99WYEJU",nfogn8,Question: MBA stock market question
566,gyxnpdo,2021-05-21 12:09:57,t1_gyxnpdo,t1_gyxmnzn,StockMarket,How are Enron investors feeling about insurance? 🤪,,
567,gyxo2dw,2021-05-21 12:13:49,t1_gyxo2dw,t3_nho5kv,StockMarket,"looks balanced overall,  you could split in more etf like semiconductors, tech, construction, biotech. Personally i would have a 5% for doing dumb stuff and having some fun, to get some experience in that kind of stuff. Im also your age and looking to make a portofolio, my problem now is that i dont have money to invest :p so im looking for work instead.",,
568,gyxo4fb,2021-05-21 12:14:23,t1_gyxo4fb,t1_gyvbgga,StockMarket,Tonight’s forecast: dark,,
569,gyxo982,2021-05-21 12:15:48,t1_gyxo982,t3_nho5kv,StockMarket,"It’s a highly market correlated portfolio. There’s more than one way to skin a cat. In that sense, if that’s the sort of allocation you’re looking for, there’s no problem with that. That’s like going to the candy store and asking if your selection is good. If you’re looking for something not correlated to market and rather stable, private debt funds are picking up a lot of steam.",,
570,gyxo9fz,2021-05-21 12:15:52,t1_gyxo9fz,t1_gyxnpdo,StockMarket,"At that point regulations break down and people get fucked. Presumably most large companies produce something of value that they sell for a profit, so one scandal doesn’t bring down the entire house.

We’re talking about elon, a man who routinely skirts regulations as a hobby, and doggie coin, just one unregulated worthless asset in a sea of unregulated worthless assets.

That’s like comparing apples to pig shit. Yeah they’re both organic matter. Yes they will both make good compost if used properly and wisely. But there’s only one that you’d be willing to put on a plate and eat with peanut butter",,
571,gyxobyw,2021-05-21 12:16:35,t1_gyxobyw,t1_gyxo982,StockMarket,Cheers thanks for your reply,,
572,gyxoelg,2021-05-21 12:17:22,t1_gyxoelg,t1_gyxjhy8,StockMarket,"That makes sense. Gosh, I want the Israeli tax policy!",,
573,gyxofgl,2021-05-21 12:17:36,t1_gyxofgl,t1_gyxlyft,StockMarket,"Cheers yer I agree but I also do like to diversify into some other indexes, cheers for your reply",,
574,gyxogvc,2021-05-21 12:18:01,t1_gyxogvc,t3_nhov3b,StockMarket,Sorry anyone knows the difference between KO and COKE,,
575,gyxoikw,2021-05-21 12:18:30,t1_gyxoikw,t1_gyxo2dw,StockMarket,Yer man get the money coming in and get investing,,
576,gyxokff,2021-05-21 12:19:02,t1_gyxokff,t1_gyxl6wq,StockMarket,0.1% shitcoins allocation ?,,
577,gyxoki2,2021-05-21 12:19:04,t1_gyxoki2,t1_gyxoelg,StockMarket,Sure is better as far as I see. 25% all around for capital gains.,,
578,gyxoms1,2021-05-21 12:19:41,t1_gyxoms1,t1_gyxmctz,StockMarket,Cheers!,,
579,gyxomwj,2021-05-21 12:19:44,t1_gyxomwj,t3_nh9k5i,StockMarket,Some say it is Long and Black,,
580,gyxoo2w,2021-05-21 12:20:04,t1_gyxoo2w,t3_nho5kv,StockMarket,"REITs are good ideas. The biggest logistics company in China listed their logistics property IPO in Hong Kong a few days ago! 

[https://www.scmp.com/business/banking-finance/article/3133198/sf-holdings-reit-raises-us334-million-after-pricing-hong](https://www.scmp.com/business/banking-finance/article/3133198/sf-holdings-reit-raises-us334-million-after-pricing-hong)

(I am not affiliated with South China Morning Post in the link)",,
581,gyxoqhl,2021-05-21 12:20:44,t1_gyxoqhl,t3_nhdwpl,StockMarket,AMC is missing from your portfolio,,
582,gyxorzs,2021-05-21 12:21:09,t1_gyxorzs,t3_nho5kv,StockMarket,Where’s your DOGE holdings?,,
583,gyxotfy,2021-05-21 12:21:34,t1_gyxotfy,t3_nhg5dn,StockMarket,That's great news! I hope including IPOs in Hong Kong as well?,,
584,gyxox2h,2021-05-21 12:22:35,t1_gyxox2h,t1_gygj69r,StockMarket,"I couldn't agree more. I used to like Elon, but I'm beginning to think he's his own worst enemy. He's turned Tesla into a personality cult and shifted the focus onto himself rather than the product and the business. I think Nio has an awesome opportunity to become a preeminent force in the EV sector which is why I'm long on it.",,
585,gyxoxqx,2021-05-21 12:22:46,t1_gyxoxqx,t1_gyxkcqm,StockMarket,https://www.google.com/amp/s/nymag.com/intelligencer/amp/2021/05/jack-dorsey-says-bitcoin-is-climate-friendly-is-he-right.html,,
586,gyxoysm,2021-05-21 12:23:03,t1_gyxoysm,t1_gyxjz06,StockMarket,"You shouldn't want to do that.  This is the wrong sub to say this in, but you probably want to follow buffets advice to 99% of investors. 

Pick a broad etf like the sp500, set it and forget it.

And imo, dump the crypto.  We seen a very consistent pattern every couple of years where we have a huge run up, then a huge crash.  Were due for that crash.  I would dump it forever.  But if you want to gamble id bet on a crash before another run up.",,
587,gyxp06z,2021-05-21 12:23:27,t1_gyxp06z,t1_gyiamu6,StockMarket,"Hey, Willy Li was given the moniker ""The Elon Musk of China"". So, who knows how that will turn out. Hopefully he's less insane on Twitter than Elon.",,
588,gyxp0wj,2021-05-21 12:23:39,t1_gyxp0wj,t1_gyxoo2w,StockMarket,Thanks I’ll have a look!,,
589,gyxp6gm,2021-05-21 12:25:11,t1_gyxp6gm,t1_gyxoysm,StockMarket,"Made over 1000% on my crypto, I understand it well and won’t sell any, will hold for many many years but thanks for your insight",,
590,gyxp9mc,2021-05-21 12:26:04,t1_gyxp9mc,t1_gyxn7cl,StockMarket,Got any specific suggestions?,,
591,gyxpd23,2021-05-21 12:27:01,t1_gyxpd23,t3_nhov3b,StockMarket,No. Please no.,,
592,gyxpdd6,2021-05-21 12:27:07,t1_gyxpdd6,t3_nh6grs,StockMarket,"I'm getting tired of the conflating of Bitcoin and Cryptocurrencies. I think the arguments are valid for Bitcoin, but not for so many other cryptocurrencies!

Cryptocurrencies move value digitally, this solves the problem of value transfer between banks.

Some cryptos have no fees and are incredibly fast, this is an improvement on slower and costly payment systems such as Visa or Paypal.

Some cryptos secure other things than transactions, this is a very handy way of saving information in an extremely sturdy and reliable way.

We are also discovering new use cases for crypto as we go along. In any case - it is clear that it is a technology that can do things that we could not do before. The use case is there.",,
593,gyxpkir,2021-05-21 12:29:03,t1_gyxpkir,t1_gyxj9ug,StockMarket,This is bitch boy investing. I’m gonna give you a real man portfolio. 60% SPY puts august expiration 20% vix calls 20% gme calls yes i said it. !remindme in 3 months,,
594,gyxpkov,2021-05-21 12:29:06,t1_gyxpkov,t1_gyxl6wq,StockMarket,aye fellow monke,,
595,gyxpprz,2021-05-21 12:30:30,t1_gyxpprz,t3_nho5kv,StockMarket,You don’t have any FNMA or FMCC.,,
596,gyxpq8d,2021-05-21 12:30:37,t1_gyxpq8d,t3_nho5kv,StockMarket,"more ETH!! if there's anything that is going to do very well this year it's ETH...

primarily because of EIP-1559 rolling out in a few months and ETH 2.0 near the very end of the year, we expect a value of around 8K maybe more by then, which is quite reasonable actually",,
597,gyxpsw0,2021-05-21 12:31:20,t1_gyxpsw0,t3_nho5kv,StockMarket,"It appears that you've tried to devise a ""set it and forget it"" portfolio.  There's no such thing for the real investor.  Even a long-term portfolio needs adjusting and managing at a minimum of once a month to take advantage of the swings in the market.  You'll make money with the above setup but when sectors in the market swing, your bottom line isn't going to do much of anything.  I own just 10 Index-ETF's which probably gives me as much exposure  as you have above and I adjust it once a month in calm waters, and once every two weeks in a volatile market (I figured out a while back that my 10 ETF's are comprised of over 6,000 different companies)  There is such a thing as over-diservifying!",,
598,gyxpulh,2021-05-21 12:31:47,t1_gyxpulh,t3_nhdwpl,StockMarket,This MNGG nonsense doing weird shit in your otherwise flawless portfolio,,
599,gyxpwwg,2021-05-21 12:32:26,t1_gyxpwwg,t1_gyxl315,StockMarket,Karma,,
