,comment_id,created,fullname,parent_id,subreddit,text,post_id,title
249,gywjews,2021-05-21 03:18:26,t1_gywjews,t3_nhg5dn,StockMarket,Only for them to restrict it when the IPO share price plunges and you can't get out. Fuck them.,,
250,gywjk6t,2021-05-21 03:19:50,t1_gywjk6t,t1_gyvx0e0,StockMarket,The entire market is and always has been completely manipulated.,,
251,gywjqol,2021-05-21 03:21:32,t1_gywjqol,t3_nhf2c1,StockMarket,I don't think you truly understood 2020...or the stock market for that matter.,,
252,gywjyh3,2021-05-21 03:23:39,t1_gywjyh3,t3_nhf2c1,StockMarket,"Zoom out, you’re not looking at the long term. Pump and dumps come and go all the time but real value lasts the test of time.",,
253,gywjz84,2021-05-21 03:23:51,t1_gywjz84,t3_nhf2c1,StockMarket,Imagine what would happen if they forced HFs to stop shorting?,,
254,gywk444,2021-05-21 03:25:11,t1_gywk444,t1_gywidgf,StockMarket,"I’m not arguing here, just trying to understand. I understand the value of gold. It’s a tangible object you can hold and use, that is subjectively favored by many people. It’s crazy that this one shiny, maleable rock is preferred over other pretty rocks, but I understand why it is something people would invest in.

What is the underlying value of a Bitcoin?",,
255,gywk5ve,2021-05-21 03:25:40,t1_gywk5ve,t3_ngkq1h,StockMarket,"Waymo is a research project, not a business. Which idiots are going to give them money?",,
256,gywkajj,2021-05-21 03:26:59,t1_gywkajj,t1_gyuwiz5,StockMarket,They wanna be hip. Uncle Joe 😎,,
257,gywkalm,2021-05-21 03:27:00,t1_gywkalm,t1_gywj3r9,StockMarket,Better bet was that he threw $10k into it for the lulz,,
258,gywkb34,2021-05-21 03:27:08,t1_gywkb34,t3_nhf2c1,StockMarket,I just put all I got in GNUS lol,,
259,gywkfg5,2021-05-21 03:28:20,t1_gywkfg5,t3_nhdwpl,StockMarket,Get a better job so you can invest more than $300,,
260,gywkg16,2021-05-21 03:28:30,t1_gywkg16,t1_gyw23bq,StockMarket,"It’s not a Casino, they’re better regulated and will escort you’re ass out if you can’t cover your bet. This is monopoly, except they’re the only ones allowed to use fake money. You’ve got to use real money and they take all the properties before the game starts. They’ll let you buy the brown or orange properties but only if you pay double what the board says.",,
261,gywkmpa,2021-05-21 03:30:22,t1_gywkmpa,t3_nhf2c1,StockMarket,Bull markets like this are all about potential growth instead of fundamentals. Best markets will have people going back to their 5% yoy instead of looking for 500% yoy stuff.,,
262,gywkncn,2021-05-21 03:30:33,t1_gywkncn,t3_nhf2c1,StockMarket,"I actually think all the big banks are fucked, and it didn’t come to light until the Citadel/GME thing. So they’ve basically been scrambling and tanking the market to make up what they don’t have.",,
263,gywkp2s,2021-05-21 03:31:02,t1_gywkp2s,t3_ngxu87,StockMarket,Better than most!,,
264,gywksov,2021-05-21 03:32:01,t1_gywksov,t1_gywj695,StockMarket,Jack and Crack,,
265,gywkt50,2021-05-21 03:32:08,t1_gywkt50,t3_ngxu87,StockMarket,"'looks like you need some debt, friend :)' -the american banks",,
266,gywl0ba,2021-05-21 03:34:07,t1_gywl0ba,t3_nhf2c1,StockMarket,"A large Part of earnings is expectations. Even if a company kills earnings on A, B, and C like people expected; if they don’t double expectations on D, E, AND bring a wendy‘s $4 meal then you will see a negative reaction. We are dealing more with people‘s emotions than numbers.",,
267,gywl1vq,2021-05-21 03:34:33,t1_gywl1vq,t3_nhf2c1,StockMarket,"Sentiment drives swing trading activity. Value will always drive longer term. Also, when the government money dries up the influence of a lot of retail investors will wane.",,
268,gywl6am,2021-05-21 03:35:46,t1_gywl6am,t1_gyw3u8v,StockMarket,*were making a killing,,
269,gywl79h,2021-05-21 03:36:01,t1_gywl79h,t3_nhdwpl,StockMarket,Been active in the stock market for 12 years and I don't know WHAT THE FUCK EVEN ONE OF THESE COMPANIES IS,,
270,gywl7vp,2021-05-21 03:36:12,t1_gywl7vp,t3_nh6grs,StockMarket,remember those guys that wouldn't stop using blackberry phones  they used them until they stopped  making them and they all broke.,,
271,gywl9qu,2021-05-21 03:36:43,t1_gywl9qu,t1_gyvqoio,StockMarket,Thats what I'm saying,,
272,gywlkr0,2021-05-21 03:39:45,t1_gywlkr0,t1_gyw6wpn,StockMarket,It's almost like a huge portion of society is made up of whiny bitches looking for something to project blame at. Who knew? /s,,
273,gywlmum,2021-05-21 03:40:19,t1_gywlmum,t3_nhf2c1,StockMarket,You posted this yesterday you fucking idiot.,,
274,gywltoz,2021-05-21 03:42:12,t1_gywltoz,t3_ncayop,StockMarket,I am in 21 @48.76 and I bought pretty close to the IPO I am let down by it tanking to 37.02 and now I think I should have sold it when up but I thought the company was interesting and it's not ever mentioned in r/wallstreetbets or ANYWHERE... seriously though what the actual fuck is going on...,,
275,gywlzn5,2021-05-21 03:43:49,t1_gywlzn5,t3_nhf2c1,StockMarket,You can thank citadel securities for that it's called  market manipulation all to rob the retail investor,,
276,gywm15t,2021-05-21 03:44:13,t1_gywm15t,t1_gyw0x93,StockMarket,Not even close. It’s been around for more than two decades and was pioneered by Bernie Madoff.,,
277,gywm1vz,2021-05-21 03:44:25,t1_gywm1vz,t3_nhimck,StockMarket,Did he not pay for a satellite with it?,,
278,gywm3bn,2021-05-21 03:44:48,t1_gywm3bn,t3_nhg5dn,StockMarket,You gotta pay extra for the sell button though,,
279,gywma4k,2021-05-21 03:46:41,t1_gywma4k,t3_ngxu87,StockMarket,"That used to be me, but then college came....

My pride wouldn't let me take scholarships or money from mom and dad. So I paid it myself. So glad I did though. My degree is my burden. And my pride.",,
280,gywmexl,2021-05-21 03:48:01,t1_gywmexl,t1_gywk444,StockMarket,"But subjectivity is subjectivity, right? It’s perception. Physical, digital…why is one intuitive and the other one isn’t? It’s what we are habituated to.",,
281,gywmfsr,2021-05-21 03:48:16,t1_gywmfsr,t1_gyw56lw,StockMarket,"They're just going to keep hiking up the minimum wage. Everyone loves getting a pay raise, just ignore how everything went up in price too.",,
282,gywmgzr,2021-05-21 03:48:35,t1_gywmgzr,t3_nhf2c1,StockMarket,Fraud lawsuits mean nothing. You’re giving *way* too much credibility to the equities equivalent to personal injury ambulance chasers.,,
283,gywmj1c,2021-05-21 03:49:10,t1_gywmj1c,t1_gyvx0e0,StockMarket,"also I think it’s likely cause the low cap stocks can easily move much higher with increased volume

day traders likely see this (esp when the larger market isn’t doing great) and jump in for the day pumping it higher",,
284,gywmq3e,2021-05-21 03:51:09,t1_gywmq3e,t1_gyw1rcl,StockMarket,"I'm going to piggyback off this so this is seen and give some value rather than the bs everybody else is posting. 

Some people don't know, so get off your high horses and help the guy out for God sakes. 

It looks like you're trying to turn a small amount of money into a decent amount of money by the way you set up your positions. 

The problem with penny stocks, is that it is extremely difficult to find one that isn't priced based on rumors (which means it'll eventually die down) and has some actual value. Finding a 2-10x bagger is very rare but it does happen. 

Theres an entire industry of information to learn,, however, if youre looking to play around with smallish amounts of money and hit a home run on a penny stock,, then....

Find 2-3 companies that are TRULY undervalued (that's a can of worms in itself)
Vet everything about the company, the management, the numbers,, it's prospects, potential catalysts,, etc. 
If youre comfortable that the play is extremely undervalued and that once people catch on and volume comes in, it'll sprint, then invest. 

A penny stock could take a very long time, but if you do your due diligence, you could strike gold. 

Put in small amounts of money on a weekly basis into 2-3 penny stocks that you have serious conviction about. 

Wait 6 months - 5 years and you might just get rich. Some of these do 100x at some point in time. Just remember to always challenge your belief about a company and its valuation. 

If new information presents itself and you no longer believe. Get out and try again. 

Otherwise, learn other methods of investing.

Good luck!",,
285,gywmqdv,2021-05-21 03:51:14,t1_gywmqdv,t3_nhf2c1,StockMarket,"Why would you expect sane companies to have wild daily volatility. Reasonably valued companies shouldn't come up in the daily, weekly, or even monthly mover charts. You're looking at a terrible measure of long term success and wondering why it isn't indicating long term success. Volatility does not equal profitability.",,
286,gywmrsh,2021-05-21 03:51:38,t1_gywmrsh,t1_gywl0ba,StockMarket,I had to scroll pretty far down to find this.,,
287,gywmsr5,2021-05-21 03:51:55,t1_gywmsr5,t3_nhf2c1,StockMarket,Earnings are long term fundamentals.  Market sentiment is for short term.  Time in market beats timing the market.,,
288,gywmvlu,2021-05-21 03:52:44,t1_gywmvlu,t1_gyw72mr,StockMarket,"Exactly this.




*we'll give you free trades, but you're going to get the worst available share price*",,
289,gywmze1,2021-05-21 03:53:53,t1_gywmze1,t1_gyuv755,StockMarket,Sounds like someone just got burned.,,
290,gywn112,2021-05-21 03:54:22,t1_gywn112,t3_nhf2c1,StockMarket,"There’s always been fuckery about in small/micro cap stocks, especially in the ones that only sell a hope and a dream. 

Value investing just got hot again as you saw a rotation back to cyclical and cash flow generating businesses.",,
291,gywn1kr,2021-05-21 03:54:31,t1_gywn1kr,t3_nhimck,StockMarket,He is right...he has never owned DC.,,
292,gywn2hz,2021-05-21 03:54:48,t1_gywn2hz,t1_gyw3wpj,StockMarket,Only because you broke the slot machine handle off in your rectum. Chill out and waste some money with us idiots.,,
293,gywn3ap,2021-05-21 03:55:02,t1_gywn3ap,t1_gywmq3e,StockMarket,"Also, on those high conviction plays, average down if the price drops, there is a lot of bot trading going on at these levels and you could ride their waves every once in a while. 

I don't know about just about ANY of those companies, however, HCMC, their current business models, and the lawsuit, I've got a sweet spot for. 

Penny stocks will always be high risk, high reward. Gotta find the balance that suits your goals.",,
294,gywn3tv,2021-05-21 03:55:12,t1_gywn3tv,t3_nhf2c1,StockMarket,"More evidence that you should consistently DCA into VTI or VOO over a long time horizon, and just forget it.",,
295,gywn4mh,2021-05-21 03:55:25,t1_gywn4mh,t1_gysup2j,StockMarket,"I am from punjab,india",,
296,gywn6vm,2021-05-21 03:56:05,t1_gywn6vm,t3_nhf2c1,StockMarket,Because the best way to make money is to bet that a stock will go up or down and then to force it to go up or down lol,,
297,gywn76l,2021-05-21 03:56:10,t1_gywn76l,t1_gyw3s4x,StockMarket,Excess capital chasing returns. Money flowing from one bubble to the next.,,
298,gywn7hs,2021-05-21 03:56:15,t1_gywn7hs,t3_nhdwpl,StockMarket,"Consider investing 60% of your money in a US total stock market index fund (whichever is offered by your broker. For example, VTI or ITOT/FSKAX, if you use Vanguard or Fidelity). Then put 40% of your money in an international market fund (I.e. VXUS or IXUS/FTIHX)",,
299,gywn8pf,2021-05-21 03:56:36,t1_gywn8pf,t1_gywdkx6,StockMarket,This is why me arm mental then them do this??,,
300,,2021-05-21 03:56:33,t3_nhjgjb,,StockMarket,,nhjgjb,Hemostemix Inc. | Autologous Stem Cell Therapy Company
301,gywnd4l,2021-05-21 03:57:55,t1_gywnd4l,t3_nhdwpl,StockMarket,Sell all and wait patiently.,,
302,gywnjei,2021-05-21 03:59:44,t1_gywnjei,t3_nhf2c1,StockMarket,"The System is rigged so that regular people lose. 

If you're getting your advice from YouTube YOU are being solid a pump and dump by the host - FOR ALL CHANNELS on some level it is true - Even if the hosts intentions are pure just having a mass audience makes anything they recommend a 'pump' and dump by virtue of it.

&#x200B;

If you are doing you're own DD and it works/doesnt work out you can only blame yourself. Long term the best companies are the ones who preform well - seem to not understand the concept of news being priced in. 

&#x200B;

However it is true the BIG fund investors RIG the system to screw retail investors. Right now BTC is a prime example of something 100 un-regulated that is being manipulated by the rich (cough) Elon.",,
303,gywnko5,2021-05-21 04:00:06,t1_gywnko5,t3_nhdwpl,StockMarket,Red to green,,
304,gywnkx7,2021-05-21 04:00:10,t1_gywnkx7,t3_nhf2c1,StockMarket,"Whoa chill brah. There’s still money to be made, just have to be one step ahead of the average joe.",,
305,gywnmhb,2021-05-21 04:00:36,t1_gywnmhb,t3_nh3913,StockMarket,"3D printing has been this fringe industry for such a long time now. Same with VR. Both industries should be set to boom as soon as they become household, retail, or industrial powerhouses. 

Wish I knew more about both industries to see what's holding them back. 

My first thought is that big money won't touch them until other big money touches them, so they're stuck in limbo.",,
306,gywnt6i,2021-05-21 04:02:34,t1_gywnt6i,t3_nhg5dn,StockMarket,"Another way to rip off users.   I see so many IPO go south.   Looked at one today (don't recall) but 5 days ago it opened and got to $49.XX and today it was $7.23

Amateur investors see red and panic sell.  They can't hold till it comes back.   And they won't resist the temptation to ""get in early"" to wait till the dust settles before getting in.",,
307,gywnz5d,2021-05-21 04:04:20,t1_gywnz5d,t3_nhf2c1,StockMarket,"There are forces in the market that are bigger than you, me, or any single player there",,
308,gywo0n6,2021-05-21 04:04:47,t1_gywo0n6,t1_gywgnvq,StockMarket,"The US cannabis sector also saw a lot of gains in this same period you outlined. If there is actual movement in legislation soon, we could see a lot of volume roll in for a prime growth play. Short term and long term in my opinion. OTC sucks, but when uplisting happens I think investors are going to look at the value of these stocks compared to others that may be, like you said, over inflated",,
309,gywo2wh,2021-05-21 04:05:26,t1_gywo2wh,t3_nhf2c1,StockMarket,"Oh shit, someone is mad they own rkt.... I am too, this is fucking horsshit.",,
310,gywo6qr,2021-05-21 04:06:33,t1_gywo6qr,t1_gywb0lm,StockMarket,"Even if I guess correctly something will tank and short it (like when they short cover on a certain day), if I don’t sell it the next day at a certain time then it will come roaring back to make sure you don’t get the best return. Algorithms are finicky and random at best, take what you can get and get out haha",,
311,gywogyt,2021-05-21 04:09:35,t1_gywogyt,t1_gyw3lqp,StockMarket,I hope so. Weedstocks since 2018,,
312,gywopsx,2021-05-21 04:12:11,t1_gywopsx,t1_gywjews,StockMarket,Most IPOs are failing these days,,
313,gyworpz,2021-05-21 04:12:45,t1_gyworpz,t3_nhimck,StockMarket,On to the next pump and dump...,,
314,gywotky,2021-05-21 04:13:18,t1_gywotky,t1_gywgnvq,StockMarket,Buy all the things!,,
315,gywp1co,2021-05-21 04:15:34,t1_gywp1co,t3_nhimck,StockMarket,"When will people realize that he just figured out that he has the power to manipulate an unregulated market, and does so whenever it suits him?",,
316,gywp7m4,2021-05-21 04:17:24,t1_gywp7m4,t1_gywibds,StockMarket,"Serious question, what do I do with my lambo when I'm 65?",,
317,gywp94r,2021-05-21 04:17:51,t1_gywp94r,t3_nhf2c1,StockMarket,"“Stonks only go up theory” will die when the olds holding and manipulating it up die (sorry, morbid but true). I imagine many new investors will embrace the “stocks only go up” theory only to become the biggest future bag holders if not liquidated. It’s hard to ignore the crypto elephant in the room.",,
318,gywpd3q,2021-05-21 04:19:03,t1_gywpd3q,t1_gywm3bn,StockMarket,DLC,,
319,gywpu6c,2021-05-21 04:24:09,t1_gywpu6c,t1_gywmfsr,StockMarket,"i'm fine with raising wages across the board as well to keep up with inflation or beat it. If the federal government raises the federal minimum wage (not just states doing this on their own but the actual federal gov't) to like $15 cus ""wages aren't realistic with the times anymore"", then i want to see equal percentage of wage increases across the board for everyone to catch up to the past 30 years.

College tuitions have far surpassed wage increases and the cost of goods and services increase on average, what between 1% and 3.5% year over year? Unless you're getting a yearly 3.5% pay bump you're not even beating inflation in terms of getting paid, if anything if your salary stays the same year over year you're losing purchasing parity and power.

Now, if this is the case you could argue that inflation will sky rocket cus people have more disposable income but that's not necessarily true. Salaries come bi-weekly or monthly so the increase in purchasing power will be gradual and the amount of money in circulation shouldn't change unless the Fed decides to print more money.",,
320,gywpu8e,2021-05-21 04:24:11,t1_gywpu8e,t3_nhimck,StockMarket,Fuck Musk.,,
321,gywpx13,2021-05-21 04:25:02,t1_gywpx13,t1_gywb0lm,StockMarket,Waiting for someone to post this!,,
322,gywpz4o,2021-05-21 04:25:40,t1_gywpz4o,t1_gywl79h,StockMarket,I don't recognize even one either.,,
323,gywq25k,2021-05-21 04:26:37,t1_gywq25k,t3_nhg5dn,StockMarket,Another Ponzi scam,,
324,gywq88y,2021-05-21 04:28:28,t1_gywq88y,t1_gyw7tqi,StockMarket,"Did I say that it didnt?


I agree with you. 

Imo, this was scripted long ago. 
there were even less reason to have these big inflation worries in Nov. 2020

But the real hammering on CNBC started in Jan. 
regardless of jobs data, unemp data, numerous Fed mtgs and discussions with Powell & Yellen where every conclusion led us to wrry about the fed moving rates “sooner rather than later”.

And tech earnings were “all priced in”.",,
325,gywqcpc,2021-05-21 04:29:50,t1_gywqcpc,t3_nh6grs,StockMarket,those are called religions,,
326,gywqdb5,2021-05-21 04:30:00,t1_gywqdb5,t1_gyw83nz,StockMarket,gottem,,
327,gywqens,2021-05-21 04:30:25,t1_gywqens,t3_nhimck,StockMarket,Obviously he is the well known whale with billions in it who just bought 420.69 more and often buys on increments of his birthday.,,
328,gywqj8v,2021-05-21 04:31:50,t1_gywqj8v,t3_nhdwpl,StockMarket,"I would buy more and more, lower it gets the more you buy.",,
329,gywqsjm,2021-05-21 04:34:46,t1_gywqsjm,t1_gyvq2yu,StockMarket,Crush it up and take 2 lines per red line!,,
330,gywqu0q,2021-05-21 04:35:13,t1_gywqu0q,t3_nhimck,StockMarket,"ok sell in two weeks, got it",,
331,gywqy45,2021-05-21 04:36:31,t1_gywqy45,t3_nhimck,StockMarket,never trust someone who can regrow hair after balding for years,,
332,gywqyic,2021-05-21 04:36:39,t1_gywqyic,t1_gywma4k,StockMarket,What ? Why pride,,
333,gywr377,2021-05-21 04:38:08,t1_gywr377,t1_gyt7grw,StockMarket,"ARKK is still 32% OVER Spy in a 1 year timeframe. It was obvious that the rally had to end soon. 

May i ask when and for what price you bought ark? :)",,
334,gywr3mu,2021-05-21 04:38:17,t1_gywr3mu,t1_gyvk199,StockMarket,monday is more likely to see a boost than tomorrow due to FTDs needing rolled over.  convergence of t+21 and t+35 from april 16 options.  MM wont want to cover them tomorrow to avoid more calls going ITM.,,
335,gywr535,2021-05-21 04:38:44,t1_gywr535,t1_gywp1co,StockMarket,Amen to that! He is a business man. He is going to play this to best suit his financial gain.,,
336,gywrf50,2021-05-21 04:41:57,t1_gywrf50,t1_gywqyic,StockMarket,"Because im in college to study two majors in finance and accounting (conceptually money management). If I couldn't manage my money for the things I want, then I've failed the real life equivalent of a money manager.",,
337,gywrj2p,2021-05-21 04:43:13,t1_gywrj2p,t3_nhdwpl,StockMarket,"Penny stocks seem like a good idea because one thinks “holy crap if I buy 10,000 of these and the price goes up by 1 penny I can make $10,000.” The problem is, if a company is worth let’s say a penny then going up to a penny means it doubled in value; Like the entire company doubled in value. 
Your best bet is to cut losses and buy some companies that are already well established. For example one Apple stock, sure it’s $127 but for you to make $1 on that $127 is way easier than making that 1¢ on the penny stock.",,
338,gywrkmd,2021-05-21 04:43:43,t1_gywrkmd,t3_nhimck,StockMarket,"I sold off most of my Tesla today and I will put it into GME. Kept a little but I'm done with Musk. 

And yes his cars are wicked fast but I won't be buying one. I'm happy for his dreams of space flight but I'm kind of done with him.

The only doge I have are laying in bed with me.",,
339,gywrn0e,2021-05-21 04:44:29,t1_gywrn0e,t1_gyw3jlk,StockMarket,"One sign of a bubble is people telling critics they ""just don't get it""",,
340,gywrn6o,2021-05-21 04:44:32,t1_gywrn6o,t1_gywrf50,StockMarket,But on the same time it would make sense to take the free money (scholarship assuming you were eligible) and use those instead of working and putting that time in studying,,
341,gywrsbd,2021-05-21 04:46:12,t1_gywrsbd,t1_gyvh1kk,StockMarket,"Hmm... Do U see where it says  **Timeframe:** on the upper right side? Just click on Weekly.

Yes, most weekly stock will give U 3 years of data. So the TSLA Weekly chart goes from November 2019 to this current week in May,",,
342,gywru96,2021-05-21 04:46:51,t1_gywru96,t1_gywmexl,StockMarket,So you agree there's no real value here,,
343,gyws3um,2021-05-21 04:49:56,t1_gyws3um,t1_gywpu6c,StockMarket,It works to up to a point but not the one that gets sold to voters. Nobody is making more true wealth or getting legislated out of poverty. Increased wages help to absorb the additional money in circulation but doing it too much is just as much of a shock as raising the interest rate.,,
344,gyws4r1,2021-05-21 04:50:13,t1_gyws4r1,t3_nhimck,StockMarket,"He should stop acting like a rock star. As a CEO of mega cap public company, he should learn to be more responsible for what he says and tweets.",,
345,gywsb7k,2021-05-21 04:52:19,t1_gywsb7k,t1_gywaaim,StockMarket,"Sadly, they won’t. They have by far the best UI of any stock trading app right now.",,
346,gywsfkb,2021-05-21 04:53:46,t1_gywsfkb,t3_nh6grs,StockMarket,A mania that will only grow bigger,,
347,gywsfko,2021-05-21 04:53:46,t1_gywsfko,t3_nhg5dn,StockMarket,Shorting Robinhood is a very bad idea. You bet your ass that price is gonna be propped up by its owners.,,
348,gywsifz,2021-05-21 04:54:42,t1_gywsifz,t1_gywru96,StockMarket,"Real? *turns on Morpheus voice* How do you define real?   
An agreed-upon value is real. And value is also subjective. If in a society people want and use bitcoin as a store of value and/or currency, then it's valuable and real.  
You can think of hundred other things:
Information -it's valuable and its real (ask the military, scientists, politicians, etc) but not tangible.  
Collectibles - a glove that was used by Babe Ruth once would probably fetch quite a penny even if thousands identical to it exist.",,
349,gywsjud,2021-05-21 04:55:10,t1_gywsjud,t3_nhimck,StockMarket,"I'm not sure why anyone thinks he owns it

He has unimaginable wealth, yes mostly tesla stock that he's collateralized, but still, he could stop working tomorrow and his family will live comfortably for generations

He can watch from the sidelines with the same entertainment as owning since money is worthless to him",,
350,gywsl1b,2021-05-21 04:55:34,t1_gywsl1b,t3_nhimck,StockMarket,"Trust Musk on crypto??? Anyone who is, is HIIIIIGH",,
351,gywsuq2,2021-05-21 04:58:45,t1_gywsuq2,t3_nhimck,StockMarket,Then what's the point of him buying it?,,
352,gywsye2,2021-05-21 04:59:59,t1_gywsye2,t1_gywqy45,StockMarket,LeBron James?,,
353,gywt0jg,2021-05-21 05:00:42,t1_gywt0jg,t1_gytlm6c,StockMarket,I like this metaphor,,
354,gywt4y5,2021-05-21 05:02:12,t1_gywt4y5,t1_gysfmwn,StockMarket,"There is a 23 hour delay fetching comments.

I will be messaging you in 1 year on [**2022-05-20 05:18:10 UTC**](http://www.wolframalpha.com/input/?i=2022-05-20%2005:18:10%20UTC%20To%20Local%20Time) to remind you of [**this link**](https://www.reddit.com/r/StockMarket/comments/ng35du/arkk_arkx_and_coin_bagholder/gysfmwn/?context=3)

[**CLICK THIS LINK**](https://www.reddit.com/message/compose/?to=RemindMeBot&subject=Reminder&message=%5Bhttps%3A%2F%2Fwww.reddit.com%2Fr%2FStockMarket%2Fcomments%2Fng35du%2Farkk_arkx_and_coin_bagholder%2Fgysfmwn%2F%5D%0A%0ARemindMe%21%202022-05-20%2005%3A18%3A10%20UTC) to send a PM to also be reminded and to reduce spam.

^(Parent commenter can ) [^(delete this message to hide from others.)](https://www.reddit.com/message/compose/?to=RemindMeBot&subject=Delete%20Comment&message=Delete%21%20ng35du)

*****

|[^(Info)](https://www.reddit.com/r/RemindMeBot/comments/e1bko7/remindmebot_info_v21/)|[^(Custom)](https://www.reddit.com/message/compose/?to=RemindMeBot&subject=Reminder&message=%5BLink%20or%20message%20inside%20square%20brackets%5D%0A%0ARemindMe%21%20Time%20period%20here)|[^(Your Reminders)](https://www.reddit.com/message/compose/?to=RemindMeBot&subject=List%20Of%20Reminders&message=MyReminders%21)|[^(Feedback)](https://www.reddit.com/message/compose/?to=Watchful1&subject=RemindMeBot%20Feedback)|
|-|-|-|-|",,
355,gywtdkr,2021-05-21 05:05:07,t1_gywtdkr,t1_gywp1co,StockMarket,"Because most of the people are dumb, that’s just it",,
356,gywten0,2021-05-21 05:05:28,t1_gywten0,t1_gyws4r1,StockMarket,Stfu boomer this is the future,,
357,gywtlo8,2021-05-21 05:07:52,t1_gywtlo8,t1_gywqy45,StockMarket,This is the way.,,
358,gywtvkg,2021-05-21 05:11:19,t1_gywtvkg,t3_nhimck,StockMarket,He's just more of a Catcoin kinda person.,,
