,comment_id,created,fullname,parent_id,subreddit,text,post_id,title
708,gyxxqi6,2021-05-21 13:43:04,t1_gyxxqi6,t1_gyxwxia,StockMarket,"The technology is incorruptible, cracking blockchain security is an NP-Complete problem. 

I’m telling you they are already using cryptocurrency at a [very high rate](https://www.google.com/amp/s/www.bbc.com/news/world-africa-56169917.amp). This is only the first decade of crypto... it is still very early. 

It seems like a lot of people in this thread have closed their mind on this sector so what can I do.",,
709,gyxxrt2,2021-05-21 13:43:22,t1_gyxxrt2,t1_gyxx7f9,StockMarket,Than*. Even as an unilingual illiterate you fail..,,
710,gyxxrzd,2021-05-21 13:43:25,t1_gyxxrzd,t3_nho5kv,StockMarket,"Curious: You're still young, do you NEED dividends at this age? If you're looking to increase your overall capital, I'd go with Capitalizing ETFs (any increase in % is directly added to the Capital in the ETF, making it grow).

But this mostly applies for long term saving.",,
711,gyxxwqq,2021-05-21 13:44:32,t1_gyxxwqq,t3_nho5kv,StockMarket,It’s not 100% GME.,,
712,gyxxxqu,2021-05-21 13:44:46,t1_gyxxxqu,t1_gyxxrzd,StockMarket,"I don’t need them but they are fun to build up and see income, I may scrap them and add more to the ETF and build dividends when I’m older",,
713,gyxxyt0,2021-05-21 13:45:00,t1_gyxxyt0,t1_gyxxwqq,StockMarket,My trading account is lol,,
714,gyxy110,2021-05-21 13:45:32,t1_gyxy110,t1_gyxw2g2,StockMarket,"Nice! Very simple approach to take. There are ways to stake ETH and build APR on that position too, but it’s locked up until ETH 2.0 comes out. Can be done on both Coinbase and Kraken",,
715,gyxy736,2021-05-21 13:46:55,t1_gyxy736,t1_gyxy110,StockMarket,"Yer I’m in U.K. so Coinbase does not allow it over here yet, but will stake everything when it’s available",,
716,gyxyc0o,2021-05-21 13:48:01,t1_gyxyc0o,t1_gyxxrt2,StockMarket,r/confidentlyincorrect,,
717,gyxyfol,2021-05-21 13:48:52,t1_gyxyfol,t3_nho5kv,StockMarket,No precious metals? How about some physical silver or PSLV?,,
718,gyxyig9,2021-05-21 13:49:30,t1_gyxyig9,t1_gyxyfol,StockMarket,tbh I view metals how old people view crypto,,
719,gyxykgw,2021-05-21 13:49:59,t1_gyxykgw,t1_gyxy736,StockMarket,Very nice! And great portfolio!,,
720,gyxyls2,2021-05-21 13:50:17,t1_gyxyls2,t1_gyxu7hp,StockMarket,Thank you!,,
721,gyxyolc,2021-05-21 13:50:55,t1_gyxyolc,t1_gyxvsb2,StockMarket,"I bought my two girls (4 & 2 y.o.) one ETH and 500 ADA. Hoping that can pay for ""space doctor engineer"" college in 15 years.",,
722,gyxyooe,2021-05-21 13:50:56,t1_gyxyooe,t1_gyxrw5n,StockMarket,I view metals how old people view crypto,,
723,gyxys79,2021-05-21 13:51:44,t1_gyxys79,t1_gyxvyts,StockMarket,What would you suggest just s and p ? cheers,,
724,gyxytzl,2021-05-21 13:52:08,t1_gyxytzl,t1_gyxxyt0,StockMarket,This is the way,,
725,gyxyuts,2021-05-21 13:52:19,t1_gyxyuts,t1_gyxykgw,StockMarket,Thank you !,,
726,gyxywzz,2021-05-21 13:52:49,t1_gyxywzz,t1_gyxytzl,StockMarket,He has spoken,,
727,gyxyypc,2021-05-21 13:53:13,t1_gyxyypc,t1_gyxtej7,StockMarket,"I second this. Not a joke. Refer to the r/superstonk AMAs on youtube for reputable sources, plus the DD in the sub",,
728,gyxz1c1,2021-05-21 13:53:49,t1_gyxz1c1,t1_gyxxxqu,StockMarket,"(Just me of course) I'm in my 30s and I got rid of any dividends. I figured I'd let my capital grow as much as possible. That's why most boomers begin transitioning into dividends, so as to have a large capital that gives back a percentage, getting ready for retirement. If you only have a couple of Ks, it won't give that much back.

Unless you can invest a sizeable amount to begin with, which could yield an interesting enough return.",,
729,gyxz1ry,2021-05-21 13:53:55,t1_gyxz1ry,t1_gyxvbso,StockMarket,"Kids these days are very smart, especially with tech. Hard to admit sometimes, even to myself.",,
730,gyxz4su,2021-05-21 13:54:37,t1_gyxz4su,t1_gyxxgzo,StockMarket,"There is no really right or wrong answer for this.  At the end you have to do what you think is best based on your research.  My reasoning for  recommending the s&p for someone starting out are the following: 

1. Warren Buffet and Jack Bogle recommend this. 

2. Most if not all of the s&p 500 companies are also international companies so what is the point in investing in international etfs or emerging market when US companies have business there? 

I think this is a good place to start for you as you develops your skills and knowledge. 

I started investing in the s&p which I still do in my 401k but I mainly focus in dividend growth investing and own a portfolio of 13 stocks.  If I where not doing single stocks I would be doing SCHD etf. 

I arrive to that conclusion after 3 years of reading and research. So my advice start with the s&p and buy some time for you to keep on learning.  

Also congrats for starting at 19.  At that age i did not even know what a 401k.  Keep it up!",,
731,gyxz61v,2021-05-21 13:54:53,t1_gyxz61v,t1_gyxyolc,StockMarket,"Hope it works out for you! I’ve sold all my holdings now but may get back in eventually. I’ve held Bitcoin, LTC, and Ether since 2015 before the DAO Hack before the chain split into ETC/ ETH but I’ve sold a lot over the years and gotten back in to start other ventures.",,
732,gyxz659,2021-05-21 13:54:54,t1_gyxz659,t3_nho5kv,StockMarket,"Although I think a small amount of crypto and such is fine and maybe even good for your portfolio I think you may have a bit too much of it your portfolio in it. But besides that I think it looks good. But try to buy a few more individual stocks than just ETFs. You can more easily get larger average returns that way. But ETFs are still good.

Overall your portfolio is definitely not the worst and is probably a fairly decent one.",,
733,gyxz8w7,2021-05-21 13:55:30,t1_gyxz8w7,t1_gyxoqhl,StockMarket,OP doesn't want any tendies,,
734,gyxz9ct,2021-05-21 13:55:37,t1_gyxz9ct,t1_gyxp9mc,StockMarket,Allianz looks nice,,
735,gyxz9wv,2021-05-21 13:55:44,t1_gyxz9wv,t1_gyxtphv,StockMarket,"Sure. 

BABA (Now 30% of the whole portfolio)
AMT
BAM
DLR
EQIX
STOR
BRK-B
ETSY

Etsy is the newest addition (2 days ago) its a high flyer for sure but unlike most of the tech high flyers I understand the business and use it myself, so Im comfortable buying in now and adding if they go lower.


Then 2 Finland based companies, one is insurance and one is a fashion brand with great growth.",,
736,gyxzdhb,2021-05-21 13:56:32,t1_gyxzdhb,t1_gyxw4g8,StockMarket,Very balanced and smart way of investing.  I'm the total opposite!,,
737,gyxzdog,2021-05-21 13:56:34,t1_gyxzdog,t3_nhov3b,StockMarket,"I prefer BP over KO in terms of dividend payout. BP is half the price per share of KO and pays $0.315 per share quarterly compared to the $0.42 that pays out.  
Regardless of what you buy, reinvest your dividends where possible if you intend to hold it as a long term investment and try to regularly buy a few more shares when your finances allow it.",,
738,gyxze29,2021-05-21 13:56:39,t1_gyxze29,t1_gygf8fb,StockMarket,"Diversify with an ETF like VTI, VXUS, or SPY.  Then you're actually diversified.  This is literally all tech stocks and meme stocks with 1.6% allocated to VTI.",,
739,gyxzevm,2021-05-21 13:56:50,t1_gyxzevm,t1_gyxz1c1,StockMarket,"Going to take this advice and drop the dividends for a later date , cheers",,
740,gyxziys,2021-05-21 13:57:44,t1_gyxziys,t1_gyd73ka,StockMarket,Why VTI when you could just buy one share of every stock you can afford?,,
741,gyxzl09,2021-05-21 13:58:11,t1_gyxzl09,t1_gyxz61v,StockMarket,"Thanks! Hedging a bit with a ""real"" college fund, as well, but hopefully that just means I can pay for a few textbooks, too. Lol.",,
742,gyxzlvz,2021-05-21 13:58:23,t1_gyxzlvz,t1_gyxvmeh,StockMarket,"Umm, I think you misunderstand currency then.

By definition currency is a store of value.   If you have a dollar bill it's ""storage"" for a dollar.

Yes, bitcoin is currently storing value.  But there is absolutely no value in those bitcoins if people decide to use a different technology instead of bitcoin.  A somewhat simplified view of what you're buying with bitcoin is a share of the mathematical work that has been done to 'mine' those coins.   However, if that mathematical work no longer has value since people have moved onto Etherum or whatever the next coin is then your purchased Bitcoins won't have value.   

The point I was making is that there are restrictions in the current implementation of Bitcoin which make it technically unattractive for many reasons.   There is a reason why Etherum is gaining more and more traction in real-world applications.  

So if you're looking for a 'buy X and ignore for 20 years' investment, bitcoin is definitely not it.   Which is the point I was making - you're investing in a 'currency' or 'value store' which may or may not have any value in the future.",,
743,gyxzm7i,2021-05-21 13:58:27,t1_gyxzm7i,t1_gyxz4su,StockMarket,"Many thanks, funny enough I started at 15 with a custodial account investing into VWRL and Apple 😂",,
744,gyxzpb3,2021-05-21 13:59:09,t1_gyxzpb3,t1_gyxz659,StockMarket,Cheers for taht!,,
745,gyxzqea,2021-05-21 13:59:23,t1_gyxzqea,t1_gyxzdhb,StockMarket,Thanks 😂😂,,
746,gyxzri3,2021-05-21 13:59:38,t1_gyxzri3,t3_nho5kv,StockMarket,"REITs usually have lower return than index, however, if you plan to do dividend reinvestment, then REITs would be a great idea",,
747,gyxzsy7,2021-05-21 13:59:57,t1_gyxzsy7,t3_nho5kv,StockMarket,"If I were to simplify this, I would re-create this with two funds:

90% - [$VT](https://investor.vanguard.com/etf/profile/VT)

10% - [$GDLC](https://grayscale.com/products/grayscale-digital-large-cap-fund/)

You get the crypto exposure you want, the world exposure that you created at (what I assume are) arbitrary weightings are now real weights, and you only have two funds to rebalance.",,
748,gyxztff,2021-05-21 14:00:04,t1_gyxztff,t3_nho5kv,StockMarket,"I'm not exactly ""picking holes"", because I can only judge based on my own views, and my strategy is way different than yours (I'm not half as aggressive), but anyway, some points I notice right away:

* Too little cash. 2% gives you no wiggle room, I'm aiming for more like 10% with valuations as high as right now. (I took it as a given that your emergency funds are not included).
* Too much crypto. I probably wouldn't be able - nor would I want - to dissuade you from going heavy in on cryptos if you believe so much in it, but the risks associated with this whole market and your exact picks are very high. It's a high risk - high reward game, personally I wouldn't be comfortable with anything more than 5-10%, and even that is a stretch (I have something like 3-4% total in BTC and ETH).
* Too little exposure to emerging markets. I like it between 10 and 30% of my equity basket, so if you aim for 70% equity, you should have 7-21% of your total portfolio in EM. I would say a good 10% is warranted.
* I don't get why you overweight the UK through the FTSE 100 - home country bias maybe? -, but I see no specially promising outlook for that market or economy, you might as well go for a STOXX600 or similar EU fund if you want to diversify that way.",,
749,gyxztw3,2021-05-21 14:00:10,t1_gyxztw3,t1_gyxv2s2,StockMarket,"oh yes good point, depends how you want to play it. VT + crypto would be even simpler.",,
750,gyxzuyc,2021-05-21 14:00:24,t1_gyxzuyc,t1_gyxxqi6,StockMarket,"As I said earlier, to each their own. I wish you luck with your investments but I do know how block chain works, I get that you can’t break the chain but that doesn’t stop corruption. What happens if Nigeria accepts Bitcoin as its official currency? Hooray says the crypto fam. However, a state entity that can physically print money, converting its state currency to one it can manipulate by buying a Trillion USD in value in one crypto and then dumping it or doing as it pleases with that significant value is the definition of market manipulation.",,
751,gyxzvef,2021-05-21 14:00:30,t1_gyxzvef,t1_gyxz9ct,StockMarket,Aren’t the caught in the fraud in Italy with Zürich Insurance?,,
752,gyxzwe6,2021-05-21 14:00:44,t1_gyxzwe6,t3_nh9k5i,StockMarket,"Broker app Trade Republic Bank GmbH, founded by former Merrill Lynch banker Christian Hecker, has become one of Germany’s biggest fintech firms by valuation.


The Berlin-based company finished a $900 million financing round with investors including Sequoia, TCV, Thrive Capital, and Peter Thiel’s Founders Fund, it said in a statement on Thursday. The round valued Trade Republic at more than $5 billion.

Trade Republic lets customers trade stocks, ETFs, crypto currencies and other financial products on its app, mostly without order commissions or other fees. It was founded in Germany in 2015 and has recently expanded into Austria and France. Hecker told Bloomberg earlier this month the company is looking to offer its services all over Europe.

Today’s funding round followed a 62-million-euro ($75.5 million) round last year that had already turned Trade Republic into one of the highest valued startups in Germany, next to smartphone bank N26.

Late last year, N26 was considering a fresh fundraising at a valuation above $3.5 billion, while early this year Berlin-based banking platform provider Mambu raised 110 million euros at a 1.7 billion euros ($2.1 billion) valuation.




The funding is also a glimmer of success for Germany’s fintech industry, after the high-profile collapse of payment firm Wirecard.



“We expect the company to break even in 2022 and achieve strong margin growth thereafter,” said Marius Fuhrberg, analyst at German financial services firm M.M. Warburg.
Brokerage houses from Germany, U.K., France and Denmark reported a surge in retail trading during the pandemic. However, startups such as U.S. rival platform Robinhood Markets Inc., which is planning to reveal filings for its initial public offering, have seen order volumes surge thanks to their low-cost model.

Traditional brokers finance themselves through fees and rebates from trading venues. New challengers, like Trade Republic and Robinhood, receive revenue from “payment for order flow,” a system where market makers like Citadel Securities pay retail brokers for routing orders to them.
“Don’t really box this company into one of those ready for an exit, it is a very young company that has a lot to do before thinking about anything,” said Luca Bocchio, a partner at Accel who sits on Trade Republic’s board. He added that he expects Trade Republic to focus on growth over profitability. “In a way monetization, it is not yet the most important variable I would consider,” he added.
According to Hecker, 31, who previously worked within the investment banking unit at Merrill Lynch, the rebates alone are enough for Trade Republic to be able to earn money. Trade Republic declined to comment on their revenue. Robinhood received about $331 million in the first quarter from payments for order flow, up from $91 million a year ago.
”We are currently consciously accepting losses in order to be able to grow quickly,” Hecker said in an interview.",,
753,gyxzwv8,2021-05-21 14:00:50,t1_gyxzwv8,t3_nho5kv,StockMarket,"Everything should be ETH. 
Diversification is for those who don’t know what they’re investing in",,
754,gyxzz57,2021-05-21 14:01:20,t1_gyxzz57,t1_gyxyypc,StockMarket,"True, the latest AMA on youtube with Wes Christian, dave lauer and jsmar18 was great, shout out superstonk

https://youtu.be/2rJujnpKiqM",,
755,gyy00h6,2021-05-21 14:01:38,t1_gyy00h6,t1_gyxzwv8,StockMarket,Damn son,,
756,gyy03r6,2021-05-21 14:02:22,t1_gyy03r6,t1_gyxzvef,StockMarket,I like ur username,,
757,gyy04qr,2021-05-21 14:02:35,t1_gyy04qr,t1_gyxws7t,StockMarket,This is the way,,
758,gyy0648,2021-05-21 14:02:54,t1_gyy0648,t1_gyxzm7i,StockMarket,Thats amazing. I wish I started sooner!  Keep the snowball growing.   You will do great.,,
759,gyy0ahw,2021-05-21 14:03:52,t1_gyy0ahw,t3_nho5kv,StockMarket,You’re missing 10% allocation to $HBAR!,,
760,gyy0d3o,2021-05-21 14:04:27,t1_gyy0d3o,t3_nho5kv,StockMarket,"This looks really good IMO. That's a lot of crypto exposure for my taste, but if you're a believer in the space then go for it.  A few things.

* Dividends aren't useful for anything other than psychology. When you receive a dividend, the stock price falls by the amount of the dividend. It's really just a forced early withdrawal of value from the stock. If you're just going to reinvest it immediately then it's pointless.

* You don't really need a slice for emerging markets since you already have exposure to that space through VWRL.

* You're heavily tilted towards growth stocks. Consider adding some value exposure. Value stocks have underperformed in recent decades, but that won't always be the case. Value stocks have been crushing growth for the last 6 months, for example. QQQ and SPY already give good growth exposure, so consider switching that growth stock slice into a value stock slice, unless that's you're stock picking slice or something like that.",,
761,gyy0dn6,2021-05-21 14:04:34,t1_gyy0dn6,t1_gyxz9wv,StockMarket,Thanks for sharing,,
762,gyy0dwi,2021-05-21 14:04:38,t1_gyy0dwi,t1_gyxztff,StockMarket,"Thanks for this reply, and agreed with the FTSE 100 I think i tried to capture too much of everything, the U.K. economy is dying , will re evaluate cheers",,
763,gyy0erx,2021-05-21 14:04:49,t1_gyy0erx,t1_gyy0648,StockMarket,Thank you !,,
764,gyy0g5e,2021-05-21 14:05:07,t1_gyy0g5e,t1_gyy0ahw,StockMarket,"Already In my crypto portfolio, HBAR is nuts",,
765,gyy0jv2,2021-05-21 14:05:56,t1_gyy0jv2,t1_gyy0d3o,StockMarket,Cheers for your help!,,
766,gyy0nxz,2021-05-21 14:06:49,t1_gyy0nxz,t1_gyxt810,StockMarket,Fuck the haters.,,
767,gyy0ro1,2021-05-21 14:07:39,t1_gyy0ro1,t1_gyxyls2,StockMarket,Anytime my dude!,,
768,gyy115d,2021-05-21 14:09:43,t1_gyy115d,t1_gyxys79,StockMarket,"VOO or VT.  Bump up growth to like 10-15%. I’ve had a lot more success with individual companies (aapl, amzn, nflx) than broad indexes over the last decade fwiw, but may just be lucky. I’m also fairly risk tolerant, may not be your cup of tea",,
769,,2021-05-21 14:10:06,t3_nhtfq2,,StockMarket,,nhtfq2,Market Map 5/21
770,gyy1336,2021-05-21 14:10:08,t1_gyy1336,t1_gyxzuyc,StockMarket,"You aren’t concerned about the US central bank unilaterally printing trillions of USD? Fiat doesn’t “solve” corruption. 

Yes, whales can try to pump and dump various currencies but as the supply spreads out that becomes less and less viable.",,
771,,2021-05-21 14:11:12,t3_nhtgnk,,StockMarket,"OTCQB: TGCB

Tego Cyber, Inc., CEO Shannon Wilkinson reacted to the cyber attack on the Colonial pipeline while speaking to Donald Baillargen this week on MoneyTV.

MoneyTV is the internationally syndicated television program all about money and what makes it happen, featuring informative interviews with company CEOs and executives, providing insights into their operations and outlooks for their futures. MoneyTV is seen in over 200 million TV households in more than 75 countries.

Find the full release here at: [https://ca.finance.yahoo.com/news/week-moneytv-donald-baillargeon-5-090000132.html](https://ca.finance.yahoo.com/news/week-moneytv-donald-baillargeon-5-090000132.html)

&#x200B;

Stay safe, this is not financial advice!",nhtgnk,"Tego Cyber This Week on MoneyTV with Donald Baillargeon, 5/21"
772,gyy18cd,2021-05-21 14:11:19,t1_gyy18cd,t1_gyy00h6,StockMarket,I’m a whole other breed of autistic,,
773,gyy18qm,2021-05-21 14:11:24,t1_gyy18qm,t1_gyxwa3k,StockMarket,"The fund you're thinking of is VXUS.

VT= all world.

VTI= US only

VXUS = only non-us (X-us)

Note that VTI+VXUS together hold more stocks than VT, and most of the stocks that are missing from VT are in the US.   That's why I like VTI+VXUS.   Plus I have a bit of home-country bias in that I don't think I need a 60/40 ratio of us/international like VT has.",,
774,gyy19op,2021-05-21 14:11:36,t1_gyy19op,t1_gyy0g5e,StockMarket,I know... I’m a converted skeptic. I put a ton into $HBAR a few weeks ago and now I wait with bated breath.,,
775,gyy1ccl,2021-05-21 14:12:11,t1_gyy1ccl,t1_gyy19op,StockMarket,It will soon go crazy,,
776,gyy1cfb,2021-05-21 14:12:12,t1_gyy1cfb,t3_nho5kv,StockMarket,Way too spread out. Buy 3 companies or an index fund,,
777,gyy1f1m,2021-05-21 14:12:46,t1_gyy1f1m,t3_nh6grs,StockMarket,"I propose that [this is a cult too.](https://www.youtube.com/watch?v=JSmhJ5Ow8b4)  
  
You just gotta pick whatever cult you think benefits you the most.  
  
I encourage everyone to watch this 5 and a half minute video if you've previously had negative thoughts about Bitcoin or are inclined to take nerds like Paul Krugmans advise [\- he is specifically mentioned in this video.](https://www.youtube.com/watch?v=xLYYh4aPXAM)  
  
If you respond negatively and don't mention anything from this video, I will understand you never had intentions of having a genuine conversation and I most likely won't respond. Cheer everyone.",,
778,gyy1g3x,2021-05-21 14:13:00,t1_gyy1g3x,t1_gyxvg1g,StockMarket,Vermont is very nice too. You should visit in the autumn when the trees change.,,
779,gyy1h0z,2021-05-21 14:13:12,t1_gyy1h0z,t1_gyxofgl,StockMarket,"A combination of VTI+VXUS will get you pretty much every stock in the entire world in two funds.   Not much more diversification possible than that.

Note that VT statistically is about the same thing as holding VTI/VXUS in a 60/40 ratio.  I just like holding them separately since VT doesn't hold as many us stocks as VTI.",,
780,gyy1jjj,2021-05-21 14:13:45,t1_gyy1jjj,t3_nhtfq2,StockMarket,Sooo they took their hands off her throat 🧐🤔,,
781,gyy1rcu,2021-05-21 14:15:28,t1_gyy1rcu,t1_gyxvhaw,StockMarket,"Yeah people have been telling us that for years everytime there is a dip. And then it hits new ATH. I buy every dip and sell every high.  Shit I was up 34% yesterday alone on my crypto after the dip. It performs better than anything else ive found. 
People have been saying it will fail for a decade. And yet it just goes higher and higher and higher year after year.  Maybe it will crash someday.  I'll take the risk.",,
782,gyy22oh,2021-05-21 14:17:54,t1_gyy22oh,t1_gyy1rcu,StockMarket,"Yeah everybody tells me that, and I understand both sides of the argument. I’m not a boomer (20), it’s just hard to follow crypto because theirs no real indicators. Also, no real incentive to use it as an actual currency. Why would someone sell a house for a currency worth $300k, then it tanks the next day and they sold it for today’s $250k?",,
783,gyy27zc,2021-05-21 14:19:01,t1_gyy27zc,t1_gyxzm7i,StockMarket,"You dont even know how much this will help you in your life. I was an idiot and blew all my money. I started a year ago and im about to be 28. Altho I have had crypto on and off since 2011. Sadly sold most of my BTC years ago before it broke 500. Then lost a wallet with 210 btc. Fuck my life. Id be worth millions.  But regardless. Youre already so far ahead of the curve. I would do anything to go back and start when I was 15, or even 19! Keep it up and you'll be killing it by thr time your my age!",,
784,gyy2c8l,2021-05-21 14:19:54,t1_gyy2c8l,t1_gyy27zc,StockMarket,Thanks a lot mate!,,
785,gyy2ctx,2021-05-21 14:20:01,t1_gyy2ctx,t3_nho5kv,StockMarket,No gold mining stocks? I would allocate at least 5-10% in gold/silver mining stocks as a hedge against inflation. I’m sure that’s what the crypto is for but tbh that seems to be correlating with risk assets. If gold spike like it has before you really are gonna want some exposure to it.,,
786,gyy2ect,2021-05-21 14:20:21,t1_gyy2ect,t1_gyxxgzo,StockMarket,"I posted a reply up above.

I think you probably need to spend some time here:

[https://www.bogleheads.org/wiki/Getting\_started](https://www.bogleheads.org/wiki/Getting_started)

That will help  you understand why everyone is just pushing you toward holding a S&P fund, although many people have moved on from a S&P fund to VTI which holds not only the S&P 500 but the rest of the USA, so you are also covered if small/medium businesses do well.    And often people add VXUS in case international does better than the US.   Or if they're lazy they just by VT which does it all.

The whole boglehead philosophy is to hold as much of the world stock market as possible so you're diversified as much as possible so no matter what does well, you're still growing.   The S&P 500 advice is based on the fact that it is an easy thing to explain to many, S&P 500 funds are widely available in most retirement accounts, and so on.",,
787,gyy2i8d,2021-05-21 14:21:11,t1_gyy2i8d,t3_nhov3b,StockMarket,AT&T is also good for dividends,,
788,gyy2kcm,2021-05-21 14:21:37,t1_gyy2kcm,t1_gyy2i8d,StockMarket,"**also good for dividends, at&t is.** 

*-Bob-Chaos*

***



^(Commands: 'opt out', 'delete')",,
789,gyy2km3,2021-05-21 14:21:41,t1_gyy2km3,t1_gywkg16,StockMarket,Was this monopoly designed by a Bulgarian!?,,
790,gyy2lmz,2021-05-21 14:21:53,t1_gyy2lmz,t1_gyy2ctx,StockMarket,I have a tiny bit of gold but for me I think of gold the same way old people think of crypto,,
791,gyy2rv2,2021-05-21 14:23:12,t1_gyy2rv2,t3_nf91ct,StockMarket,"fuck it I'm still so pissed I actually bought more twice, let the squeeze begin, don't trust those fuckers and they need to stop the market manipulation. I have the biggest, hardest, largest diamond hands!!!!🚀🚀🚀🚀🚀🚀",,
792,,2021-05-21 14:23:45,t3_nhtqsf,,StockMarket,,nhtqsf,Updated target portfolio? 70% equity 20% crypto 10% ‘others’ is this better? Am I missing anything? cheers
793,gyy2xvn,2021-05-21 14:24:30,t1_gyy2xvn,t3_nho5kv,StockMarket,Just made a new post of an updated portfolio tel me what you think! Cheers,,
794,gyy2ywu,2021-05-21 14:24:43,t1_gyy2ywu,t1_gywxyun,StockMarket,$EEM isn't really as broad as you think.  Almost 60% of it is in SE Asian countries :) I think fund managers have the same thesis.,,
