,comment_id,created,fullname,parent_id,subreddit,text,post_id,title
0,gywqc2n,2021-05-21 04:29:38,t1_gywqc2n,t1_gywpvmw,pennystocks,"ABML Wall Street conference that was leaked not to long ago. Ryan talks about the new association, they where looking for a partnership  and added Stanley to the team ... at a high cost obviously.",,
1,gywqr7v,2021-05-21 04:34:22,t1_gywqr7v,t1_gytoh9l,pennystocks,His original buy signal was at .50 well before it made its run up to 3.50.... not saying the price movement isn’t counter intuitive but facts are facts.,,
2,gywr72c,2021-05-21 04:39:20,t1_gywr72c,t3_nhixfs,pennystocks,"Well, according to stock twits, i will become a millionaire on every single one of my stocks tomorrow at open..",,
3,gywrcnr,2021-05-21 04:41:08,t1_gywrcnr,t3_nh089t,pennystocks,"Nope, never again.",,
4,gywrdnx,2021-05-21 04:41:28,t1_gywrdnx,t1_gywniwp,pennystocks,"I like DPLS, but they have so many outstanding shares. And float was so high the last time I looked.
I will check out VSQTF. Have never heard of it. 👍",,
5,gywrgsl,2021-05-21 04:42:29,t1_gywrgsl,t1_gytw9bu,pennystocks,"I hate you being that guy too, but someone's gotta do it...",,
6,gywrkcp,2021-05-21 04:43:37,t1_gywrkcp,t1_gyuj5it,pennystocks,"Yeah, he's been pumping since the start. Definitely got connections to $KAVL",,
7,gywrl2o,2021-05-21 04:43:51,t1_gywrl2o,t3_nhixfs,pennystocks,$VBHI $TRCK $ILUS some of my favs,,
8,gywrylk,2021-05-21 04:48:15,t1_gywrylk,t3_nhixfs,pennystocks,Nakd should always be number 1 on the to do list,,
9,gyws2a4,2021-05-21 04:49:27,t1_gyws2a4,t3_ngt7ym,pennystocks,Every day nakd gives the bargains is a great day to get nakd. Absolutely amazing entry prices right now,,
10,gywsavc,2021-05-21 04:52:11,t1_gywsavc,t3_ngzk0e,pennystocks,Wow how do you find these at .04 unreal how much the OTC uplistings go.,,
11,gywsn4m,2021-05-21 04:56:15,t1_gywsn4m,t1_gytjtlb,pennystocks,I got the same and I’ve traded lots of penny stocks lately. I’ll have to call tomorrow.,,
12,gywsnl1,2021-05-21 04:56:24,t1_gywsnl1,t3_ngzk0e,pennystocks,Duck the bears. I’m long as fuq,,
13,gywstod,2021-05-21 04:58:23,t1_gywstod,t1_gywkypo,pennystocks,Buy the rumor sell the news.  And if you're long rebuy after first dip.,,
14,gywstt0,2021-05-21 04:58:25,t1_gywstt0,t1_gyt0icq,pennystocks,"1. ""**Also I wonder how difficult it is to prepare these drugs....""**

TK216 is administered via IV and the current recommended dosage is for a period of 14 days. This still beats the current standard of care which is chemotherapy combined with invasive surgical procedures with some patients even **having entire limbs cut off** to minimize metastasis. Again, I can't stress how pitiful current treatments are for ES and TK216 beats them both in terms of efficacy, safety, and dosage form.

1. ""**The TK drug wasn't doing well in the data until cohort 9....""**

There were 9 escalation cohorts from 18-288 mg/m2/day.  Dosages used in the other cohorts were exploratory in nature and it was only the 9th and expansion cohort that used the current recommended phase 2 dose of 200mg/m2/day. 

1. **""I've seen drugs like Lartruvo get fast tracked...then fail in the macro data....""**

Fair point but the same can be said about every single clinical trial in existence, so it's not an argument unique to ONCT per se. This risk is the name of the game in the biotech/pharma industry. I still find it very promising that there are 2 sustained complete responses, one for over 2 years and the other for over a year. No ES intervention that I know of has reported this kind of data. 

1. **""ROR sounds like a good new target to try, but I've seen other targets like hedgehog fail when you use more patients.""**

Agreed! ROR1 is a great target due to its specificity and safety profile. Can't say much about using more patients since that will just come later but cirmtuzumab beats hedge inhibitors when it comes to safety. There are 3 approved hedgehog inhibitors: ATO, Vismodegib, and Sonidegib. A quick glance at each of its safety profile will show that cirmtuzumab (as of now) offers a promising combination of efficacy and safety. Then again, we're talking about 2 entirely different set of drugs for 2 entirely different set of indications so this really is comparing apples to oranges at this point.",,
15,gywsvb6,2021-05-21 04:58:57,t1_gywsvb6,t1_gywstt0,pennystocks,"> apples to oranges

But you can still compare them.",,
16,gywsytc,2021-05-21 05:00:07,t1_gywsytc,t1_gywsvb6,pennystocks,How the hell did you read my reply so fast :O Must have some insane reading speed,,
17,gywt4p3,2021-05-21 05:02:06,t1_gywt4p3,t1_gywauka,pennystocks,"I don’t know I focus on percentages. If a penny stock goes up 500% but you had 10,000 shares that’s a bigger gain than you’d get waiting a decade on a bigger company.",,
18,gywt8l6,2021-05-21 05:03:28,t1_gywt8l6,t3_nhgt0t,pennystocks,I bought 3 days to soon... Still holding . its only a loss if I sell,,
19,gywtjg4,2021-05-21 05:07:05,t1_gywtjg4,t1_gyvffk0,pennystocks,GVSI looks promising but also like it need some time.,,
20,gywtm20,2021-05-21 05:08:00,t1_gywtm20,t1_gyvnaz9,pennystocks,Are you the youtuber i watched yesterday?,,
21,gywtw01,2021-05-21 05:11:28,t1_gywtw01,t3_ncafay,pennystocks,How does June tenth benefit this? Someone explain,,
22,gywty37,2021-05-21 05:12:12,t1_gywty37,t1_gywm7i7,pennystocks,it moves with the share price ...,,
23,gywty9d,2021-05-21 05:12:16,t1_gywty9d,t3_nhieaw,pennystocks,Bro this cart is ugly as fuck lol,,
24,gywuu7h,2021-05-21 05:23:23,t1_gywuu7h,t3_nh39sa,pennystocks,"How far? Hovering around 4 ish levels, one more spike maybe into high 5 s.nothing more.",,
25,gywv7c9,2021-05-21 05:28:01,t1_gywv7c9,t3_nhgt0t,pennystocks,"They have shown a Market Cap. (A$0.024) A$301 in their announcement with different projects in focus, 88 Energy(ASX:[88E](https://kalkinemedia.com/au/companies/oil-and-gas/88e-88-energy-limited)) has a combined portfolio with 3.4 billion",,
26,gywv9mn,2021-05-21 05:28:52,t1_gywv9mn,t1_gyuhlg0,pennystocks,"Just recently sold my bags, it is seemingly at the bottom but there were other plays I wanted that money in that had higher upside than ASRT in my opinion. And by recently it was literally today haha",,
27,gywv9qg,2021-05-21 05:28:54,t1_gywv9qg,t3_nhkxsq,pennystocks,"
Does this submission fit our subreddit? If it does please **upvote** this comment. If it does not fit the subreddit please **downvote** this comment.



---

^(*I am a bot, and this comment was made automatically.*) ^(Please) [^(contact)^( )^(us)^( )^(via)^( )^(modmail)](https://www.reddit.com/message/compose?to=/r/pennystocks&subject=Updoot%20bot%20questions!) 
^(if) ^(you) ^(have) ^(any) ^(questions) ^(or) ^(concerns.)",,
28,gywva1k,2021-05-21 05:29:01,t1_gywva1k,t3_nhkxvm,pennystocks,"
Does this submission fit our subreddit? If it does please **upvote** this comment. If it does not fit the subreddit please **downvote** this comment.



---

^(*I am a bot, and this comment was made automatically.*) ^(Please) [^(contact)^( )^(us)^( )^(via)^( )^(modmail)](https://www.reddit.com/message/compose?to=/r/pennystocks&subject=Updoot%20bot%20questions!) 
^(if) ^(you) ^(have) ^(any) ^(questions) ^(or) ^(concerns.)",,
29,,2021-05-21 05:28:49,t3_nhkxsq,,pennystocks,"Two  names came up  , it is Friday , so not going to touch them . 
- pdsb 
- mnbd

Both names are news related , so by tuesday the picture will be clear. Pdsb is looking slightly better, would buy it in deep red days.",nhkxsq,Watch list
30,,2021-05-21 05:28:57,t3_nhkxvm,,pennystocks,[https://seekingalpha.com/article/4430328-as-covd-19-restrictions-are-eased-thai-airways-could-go-up](https://seekingalpha.com/article/4430328-as-covd-19-restrictions-are-eased-thai-airways-could-go-up),nhkxvm,"$TAWNF ""As COVD-19 Restrictions Are Eased, Thai Airways Could Go Up"""
31,gywvav0,2021-05-21 05:29:18,t1_gywvav0,t1_gyvmsmv,pennystocks,"Guess you didn’t look too hard for the SEC financial report: https://sec.report/otc/financial-report/278615. And here are lawyers looking into HMBL manipulation, for example : https://twitter.com/otclawyers/status/1390364278763491337?s=21.",,
32,gywvavs,2021-05-21 05:29:18,t1_gywvavs,t1_gywvav0,pennystocks,"Your [comment](https://www.reddit.com/r/pennystocks/comments/nhagek/hindenburg_research_report_on_hmbl/gywvav0/?context=3) in /r/pennystocks was automatically removed because you used a URL shortener.

URL shorteners are not permitted in /r/pennystocks as they impair our ability to enforce link blacklists. Twitter is not allowed either.

Please re-post your comment using direct, full-length URL's only.

*I am a bot, and this action was performed automatically. Please [contact the moderators of this subreddit](/message/compose/?to=/r/pennystocks) if you have any questions or concerns.*",,
33,gywvedq,2021-05-21 05:30:35,t1_gywvedq,t1_gyw2w31,pennystocks,"Thanks for the response, appreciate it!",,
34,gywvhmx,2021-05-21 05:31:46,t1_gywvhmx,t1_gyvmsmv,pennystocks,"And here’s a reply, though I do not think they need to dignify every short piece: https://www.globenewswire.com/en/news-release/2020/12/16/2146547/0/en/HUMBL-Responds-to-Recent-Seeking-Alpha-Article.html.",,
35,gywvn3o,2021-05-21 05:33:45,t1_gywvn3o,t1_gywr72c,pennystocks,Crazy how it's the same exact messages over there. It's boring as hell. But you get quick links to info and I like the ranking tabs,,
36,gywvyod,2021-05-21 05:37:49,t1_gywvyod,t1_gyvmsmv,pennystocks,[Reply](https://www.globenewswire.com/en/news-release/2020/12/16/2146547/0/en/HUMBL-Responds-to-Recent-Seeking-Alpha-Article.html),,
37,gywwi4f,2021-05-21 05:44:56,t1_gywwi4f,t3_nh9isb,pennystocks,"Damn, Fidelity doesn't even have this ticker.",,
38,gywwmq2,2021-05-21 05:46:41,t1_gywwmq2,t3_nhgt0t,pennystocks,"I'm holding 1,476 shares and praying for light at the end of the dark tunnel",,
39,gywwys4,2021-05-21 05:51:07,t1_gywwys4,t3_nh1ejx,pennystocks,"Prospective Player DD... 

https://www.reddit.com/rMLFBprospringfootball/comments/ltun85/mlfb_prospective_player_pool_its_deep/?utm_source=share&utm_medium=ios_app&utm_name=iossmf",,
40,gywwztr,2021-05-21 05:51:30,t1_gywwztr,t1_gyw6t7p,pennystocks,I don't know if RH has any OTC stocks at all,,
41,gywx8ei,2021-05-21 05:54:44,t1_gywx8ei,t1_gywwmq2,pennystocks,I’m in for 10k shares 0.056 avg OOFT,,
42,gywxxcz,2021-05-21 06:04:07,t1_gywxxcz,t1_gywx8ei,pennystocks,I got in with an average of 0.02.,,
43,gywy9qx,2021-05-21 06:08:46,t1_gywy9qx,t3_nepwog,pennystocks,"If we can trust the last financial statement they have roughly 3.2B in debt, a majority of this debt was brought on around 3 years ago with the acquisition of a few major telecommunication companies(this comprises the majority of the upcoming infrastructure deal), if said infrastructure deal goes through we’re talking 2 Billion in cash upfront and 100 million later. This capital would definitely be enough to cover any short term debt obligations. Also it should be mentioned that the stockholder equity was last reported to be around 200 million which is basically double what the current market cap is, kind of signals that even on paper the stock is undervalued. After a good amount of this debt clears up it will also lessen the very high interest expenses they’ve been paying which has been the main cause of them losing profits since their income from operations has been at a respectable level. In essence there’s really no reason they would file for bankruptcy at this time, it would be illogical. They have the complete ability to handle short term debt obligations and once investors realize this the tide will change.",,
44,gywyv3o,2021-05-21 06:16:58,t1_gywyv3o,t3_nhixfs,pennystocks,GGII is pink current,,
45,gywzecu,2021-05-21 06:24:17,t1_gywzecu,t3_nhlrkx,pennystocks,"Your post with title ""$hmbl Short Squeeze tomorrow 5/21/21 @ 2 PM EST 🔥 those hedgies and Market Manipultors!!!!"" has been automatically removed from r/PennyStocks for being low-effort/spam. (Low word count) probably by u/automod 

*I am a bot, and this action was performed automatically. Please [contact the moderators of this subreddit](/message/compose/?to=/r/pennystocks) if you have any questions or concerns.*",,
46,gywzglc,2021-05-21 06:25:11,t1_gywzglc,t1_gywvav0,pennystocks,@otclawyers is a well known fake account used to pump tickets. Just have a look at their tweets.,,
47,gywzkxg,2021-05-21 06:26:53,t1_gywzkxg,t3_nhixfs,pennystocks,$ENVB ran big Thursday afternoon and after house. Interested to see what it does today,,
48,,2021-05-21 06:29:09,t3_nhlu2t,,pennystocks,"$PANR | $PTHRF estimate of 12.1 billion barrels of oil in place and 1.41 billion barrels of recoverable oil in the basin floor fan complex; company believes the estimates could be categorised as contingent resources. here is the RNS: [https://polaris.brighterir.com/public/pantheon\_resources/news/rns/story/w6p699x](https://polaris.brighterir.com/public/pantheon_resources/news/rns/story/w6p699x)

here is a conservative example valuation from the panr sub based on the oil search/armstrong pikka deal (credit: Embarrassed\_Cat\_1396):

https://preview.redd.it/p30pqhxl3f071.png?width=1148&format=png&auto=webp&s=fa026d7fb19a4d081dfb4de97cb14738ca5adf67

here are new interviews with the management team on the discovery:

[https://www.youtube.com/watch?v=oJL\_WHLw8mQ](https://www.youtube.com/watch?v=oJL_WHLw8mQ)

[https://www.youtube.com/watch?v=N7Iq08Rr6-o](https://www.youtube.com/watch?v=N7Iq08Rr6-o)

[https://www.voxmarkets.co.uk/articles/bill-brodie-good-of-alien-metals-jay-cheatham-bob-rosenthal-of-pantheon-resources-plus-john-meyer-8af6411/](https://www.voxmarkets.co.uk/articles/bill-brodie-good-of-alien-metals-jay-cheatham-bob-rosenthal-of-pantheon-resources-plus-john-meyer-8af6411/)

note: this is not financial advice and I have a position.",nhlu2t,updated $PANR $PTHRF valuation based on oil search deal following theta west maiden resource numbers
49,gywzrbm,2021-05-21 06:29:22,t1_gywzrbm,t3_nhlu2t,pennystocks,"
Does this submission fit our subreddit? If it does please **upvote** this comment. If it does not fit the subreddit please **downvote** this comment.



---

^(*I am a bot, and this comment was made automatically.*) ^(Please) [^(contact)^( )^(us)^( )^(via)^( )^(modmail)](https://www.reddit.com/message/compose?to=/r/pennystocks&subject=Updoot%20bot%20questions!) 
^(if) ^(you) ^(have) ^(any) ^(questions) ^(or) ^(concerns.)",,
50,gywzst4,2021-05-21 06:29:56,t1_gywzst4,t3_nhieaw,pennystocks,Lmao imagine reading this and thenn saying yes i will put a % of my networth into this. So sad,,
51,gywztff,2021-05-21 06:30:12,t1_gywztff,t3_nhixfs,pennystocks,with the marketing behind $PANR and $PTHRF I don't expect it to stay under the radar for long.,,
52,gywzvp3,2021-05-21 06:31:06,t1_gywzvp3,t1_gywty9d,pennystocks,This is how low this sub went,,
53,gyx00z2,2021-05-21 06:33:09,t1_gyx00z2,t3_nhieaw,pennystocks,"Wtf kinda chart is that? I have holdings but damn, delete this lol.",,
54,gyx069u,2021-05-21 06:35:13,t1_gyx069u,t1_gywrdnx,pennystocks,4 billion outstanding shares may seem like a lot but if DPLS signs a $5 billion partnership with the DoD the share price would easily be $1+,,
55,gyx0cxv,2021-05-21 06:37:48,t1_gyx0cxv,t1_gywe1md,pennystocks,Source for the billion barrel? Ho thats right yall idiots,,
56,gyx0grr,2021-05-21 06:39:18,t1_gyx0grr,t1_gywniwp,pennystocks,"I mean I just saw that the div date was may 20th so. 

The other thing shows 21st but you had to buy yesterday to qualify due to the T+1 rules.",,
57,,2021-05-21 06:43:31,t3_nhm1ik,,pennystocks,,nhm1ik,Just holdz 🤓
58,gyx0sbi,2021-05-21 06:43:49,t1_gyx0sbi,t3_nhm1ik,pennystocks,"
Does this submission fit our subreddit? If it does please **upvote** this comment. If it does not fit the subreddit please **downvote** this comment.



---

^(*I am a bot, and this comment was made automatically.*) ^(Please) [^(contact)^( )^(us)^( )^(via)^( )^(modmail)](https://www.reddit.com/message/compose?to=/r/pennystocks&subject=Updoot%20bot%20questions!) 
^(if) ^(you) ^(have) ^(any) ^(questions) ^(or) ^(concerns.)",,
59,gyx0w8h,2021-05-21 06:45:21,t1_gyx0w8h,t3_nhm1ik,pennystocks,When i see CTXR at 2.89 go back down to 1.55 i know that holding is bullshit,,
60,gyx1a35,2021-05-21 06:50:47,t1_gyx1a35,t3_nhm1ik,pennystocks,Boy that Megan fox indeed!,,
61,,2021-05-21 06:50:50,t3_nhm5bm,,pennystocks,,nhm5bm,Some days...then the “Other” days...👀🥂🤷🏻‍♂️
62,gyx1aw5,2021-05-21 06:51:05,t1_gyx1aw5,t3_nhm5bm,pennystocks,"
Does this submission fit our subreddit? If it does please **upvote** this comment. If it does not fit the subreddit please **downvote** this comment.



---

^(*I am a bot, and this comment was made automatically.*) ^(Please) [^(contact)^( )^(us)^( )^(via)^( )^(modmail)](https://www.reddit.com/message/compose?to=/r/pennystocks&subject=Updoot%20bot%20questions!) 
^(if) ^(you) ^(have) ^(any) ^(questions) ^(or) ^(concerns.)",,
63,gyx1cfe,2021-05-21 06:51:43,t1_gyx1cfe,t3_nhm1ik,pennystocks,"I'll get in on that oversight process/ all other aspects, I have zero clue about how to do any of it, but I've got hoop dreams and internet moxie, I'm certain I can contribute :P",,
64,gyx1cfh,2021-05-21 06:51:43,t1_gyx1cfh,t3_nhm1ik,pennystocks,This just doesn't vibe right for some reason,,
65,gyx1dau,2021-05-21 06:52:03,t1_gyx1dau,t1_gyx1aw5,pennystocks,Good bot🤖😘,,
66,gyx1hvi,2021-05-21 06:53:52,t1_gyx1hvi,t3_nhm1ik,pennystocks,Olsen stock has always been strong lol,,
67,,2021-05-21 06:55:14,t3_nhm7n8,,pennystocks," 

Talk about your plays today or things you are on the lookout for. This is where you belong if your comment includes a ticker.

*keep it civil please*",nhm7n8,"Daily Plays - May 21, 2021"
68,gyx1p8g,2021-05-21 06:56:51,t1_gyx1p8g,t1_gyw6oh9,pennystocks,So this is a good buy?,,
69,gyx1t2w,2021-05-21 06:58:23,t1_gyx1t2w,t1_gyx1p8g,pennystocks,Yes. Long term this is an insane buy.,,
70,gyx1wfp,2021-05-21 06:59:44,t1_gyx1wfp,t1_gyx1cfh,pennystocks,It’s fuckin weird.,,
71,gyx212b,2021-05-21 07:01:35,t1_gyx212b,t3_nhitz6,pennystocks,Currently trading at $6.....👀🤑👍,,
72,gyx25oh,2021-05-21 07:03:30,t1_gyx25oh,t3_nhm7n8,pennystocks,Just waiting and holding for $MEIL Custodianship!,,
73,gyx2bun,2021-05-21 07:05:56,t1_gyx2bun,t1_gyua1fu,pennystocks,Considering that most cops don’t comment about it,,
74,gyx2lng,2021-05-21 07:10:00,t1_gyx2lng,t3_nhm1ik,pennystocks,Mmmm Scarlett,,
75,gyx40eo,2021-05-21 07:31:29,t1_gyx40eo,t3_nhh6pj,pennystocks,This is getting primed to have a big run imo,,
76,gyx4bs6,2021-05-21 07:36:05,t1_gyx4bs6,t3_nhkxvm,pennystocks,I caught covid on thai air,,
77,gyx54f3,2021-05-21 07:48:04,t1_gyx54f3,t1_gywh1su,pennystocks,I bought on TD ameritrade,,
78,gyx56e7,2021-05-21 07:48:55,t1_gyx56e7,t3_nhm7n8,pennystocks,Gonna buy more $AVVH,,
79,gyx59pc,2021-05-21 07:50:17,t1_gyx59pc,t3_nhixfs,pennystocks,How many penny stocks should I trade at a single time?,,
80,gyx5xk3,2021-05-21 08:00:25,t1_gyx5xk3,t1_gyuhlg0,pennystocks,In other words: either stock goes up or stock goes down,,
81,gyx65p6,2021-05-21 08:04:01,t1_gyx65p6,t1_gyx5xk3,pennystocks,"In case of ASRT it has 95% chance to go down, 5% chance to go up.",,
82,,2021-05-21 08:10:29,t3_nhna3e,,pennystocks," Let me start of with some ethos. I work as a design planner for large fibre infrastructure network. Part of my job is deciding where, how, when and at which cost we build out fibre optic networks for our customers. It includes technical drawings in different softwares, creating schematics, documentation, cost analysis and projections etc.

I have been doing this for 4 years now, and I have made plan designs for complete fibre optic GPON networks supplying over 25000 buildings with high speed connections. My company is gigantic in comparison to iQSTEL. We have over 8000 employees and only a small part of the company is publicly traded.

And I am super bullish on iQSTEL. I don't own a single stock in my company. I love it, but I don't see a big growth potential as such large companies need to disrupt an industry to see big growth. iQSTEL on the other hand, is tiny and a little baby in the stock market. They will grow fast with new acquisitions, and their aqcuisitions are working on products in almost exclusively futuristic market segments.

Some of the fields are the fields they in:

\- 5G Telecom solutions: 5G is going to be so big, so soon, that it's hard to imagine. 5G networks needs alot more mobile sites (antennas) per square kilometer than 4G. And each 5G site needs a fibre connection. This means that companies need to hire and produce alot more fibre optic connections and mobile sites per customer than ever before. This translates into much more employees, more revenue, bigger EPS.

\- IoT, connected devices

\- Battery and EV technologies

\- FinTech: Automation and enhancement of financial processes

\- Blockchain technology

My company have already installed several 5G test sites in several countries. Some of which we were the very first to do it. But let me tell you, we do NOT have enough people with the expertise needed to start large scale installations of 5G. No one has, because it's so new. Companies need to hire engineers and create knowledge down the ladder for years before every major telecom contractor can serve large scale installation operations.

This is so important for iQSTEL that it's hard to describe. All the worlds large telecom providers are in such a hurry to install 5G and be the first to get market domination, that they will hire absolutely any contractor to do it as long as they know how to. This means that an equal amount of business could go to small companies such as iQSTEL as they can to large companies like mine. If my company in 2021 only have the capacity to install 75 mobile sites, and the telecom provider wants to install 1000 of them, they will buy these services from all other companies too. Only to be first to market domination.

So believe me when I say, that iQSTEL will have an unrealistic growth, because they are perfectly positioned as a small company in a completely new market with diabolically big players that want rapid expansion.

But why would iQSTEL be able to compete with big contractors? Won't the big contractors get the best engineers putting iQSTEL at a loss of manpower and competence pools? No. Big contractors like my company have insane overhead costs. In some areas we have to have at least 15% profit on big projects just to pay the overhead costs when the money is lifted upwards. Remember, we have big HR departments, accountants, lawyers, account managers and many more. Small companies rarely have such overhead costs and can therefore provide bigger paychecks than the large companies can.

So if iQSTEL want to hire they can tempt future employees with bigger paychecks. They can also tempt them with their tiny size. Just think of how many people who hates the machine, the system, the big corps etc. Even with the same pay, I think most people would prefer to work in a smaller and more down to earth environment than in large corporate environments with giant pyramids of management and leadship teams.

On a final note, I hope iQSTEL will drop even more in price and stay low for another few months. Every surplus dollar from my pay each month, and every bitcoin amount I get from mining will go to loading up more iQST stocks.

I believe that every stock of IQST you buy today, will have a major impact on you economy in a few years time. I plan on living lean as hell and just buying more until the price starts to climb. A bull run WILL come, as it allways do after a bear cycle. And when that bull run starts, you will want to have as many shares as you possibly can!

TL;DR: iQSTEL is positioned perfectly in a new and GIGANTIC market, and stands to have godlike increases in revenue and growth in the next few years. Buy IQST now while you still can. This ride is going to be in a steep hill upwards!",nhna3e,"$IQST, and why you should buy it now! (not DD, but insight into 5G and their position in the market)"
83,gyx6s0w,2021-05-21 08:10:38,t1_gyx6s0w,t3_nhna3e,pennystocks,"
Does this submission fit our subreddit? If it does please **upvote** this comment. If it does not fit the subreddit please **downvote** this comment.



---

^(*I am a bot, and this comment was made automatically.*) ^(Please) [^(contact)^( )^(us)^( )^(via)^( )^(modmail)](https://www.reddit.com/message/compose?to=/r/pennystocks&subject=Updoot%20bot%20questions!) 
^(if) ^(you) ^(have) ^(any) ^(questions) ^(or) ^(concerns.)",,
84,gyx6z7e,2021-05-21 08:13:50,t1_gyx6z7e,t3_nhieaw,pennystocks,Sometimes I open posts like this just to see people roast the charts lol,,
85,gyx70kh,2021-05-21 08:14:28,t1_gyx70kh,t3_ngzk0e,pennystocks,"TDAmeritrade charged me a $40 ""mandatory reorganization fee"" the last time one of my stocks did this a couple months ago.  Does anyone know if Fidelity charges a similar fee?  I'm only in for a couple hundred bucks so a big fee would absolutely murder my profitability chances.  Might be best to sell and get back in after.",,
86,gyx78f9,2021-05-21 08:17:32,t1_gyx78f9,t1_gyue0gd,pennystocks,TD absolutely rapes you on fees.  I got charged a $40 mandatory reorganization fee on a $200 investment the last time one of my stocks changed listing.  You might want to wait until after to buy in.,,
87,gyx7bmn,2021-05-21 08:18:56,t1_gyx7bmn,t3_nhna3e,pennystocks,What caused the big climb and drop earlier this year?,,
88,gyx7cnl,2021-05-21 08:19:23,t1_gyx7cnl,t3_nhnell,pennystocks,"Your post with title ""New investor looking for som promesing pennystocks"" has been automatically removed from r/PennyStocks for being low-effort/spam. (Low word count) probably by u/automod 

*I am a bot, and this action was performed automatically. Please [contact the moderators of this subreddit](/message/compose/?to=/r/pennystocks) if you have any questions or concerns.*",,
