,comment_id,created,fullname,parent_id,subreddit,text,post_id,title
697,gyzac2r,2021-05-21 19:51:25,t1_gyzac2r,t3_nhixfs,pennystocks,"MJWL looks like a great end of the day play for a swing next week. 

&#x200B;

running on acquisition news - 20mil cap buying a 150 mil currency exchange",,
698,gyzac92,2021-05-21 19:51:27,t1_gyzac92,t1_gyza3jr,pennystocks,Well I have been buying ABML on TD and they charge $6.95 per trade regardless if you buy 100 or 1000.,,
699,gyzacwz,2021-05-21 19:51:36,t1_gyzacwz,t3_nhm7n8,pennystocks,"MJWL looks like a great end of the day play for a swing next week.   
running on acquisition news - 20mil cap buying a 150 mil currency exchange",,
700,gyzadiu,2021-05-21 19:51:44,t1_gyzadiu,t3_nhixfs,pennystocks,"I have been trying to post DD for over two days now, lol. I have enough karma, my post has no links or pictures, isn't low effort--I am 100% positive my post follows all of the sub's guidelines. But it gets flagged by the AutoMod every single time. Has anyone dealt with this before?",,
701,gyzajp7,2021-05-21 19:53:04,t1_gyzajp7,t3_nhixfs,pennystocks,Have you seen the volume on ELOX?,,
702,gyzalbf,2021-05-21 19:53:26,t1_gyzalbf,t1_gyys7zn,pennystocks,Yes brother,,
703,gyzb30u,2021-05-21 19:57:21,t1_gyzb30u,t1_gyyyi4l,pennystocks,Looks like we should have eh?,,
704,gyzb73q,2021-05-21 19:58:13,t1_gyzb73q,t1_gyyhjzo,pennystocks,I sold everything but 15 shares. For me a reasonable amount to average down if it drops.. I believe in the technology,,
705,gyzbm8a,2021-05-21 20:01:32,t1_gyzbm8a,t1_gyzac92,pennystocks,Guess you’re right. I could have sworn I picked this shit because of fees. Fuck me now I need to switch. Again.,,
706,gyzc634,2021-05-21 20:05:57,t1_gyzc634,t1_gyzbm8a,pennystocks,I am on the phone right now requesting they reverse the fees.,,
707,gyzcaly,2021-05-21 20:06:56,t1_gyzcaly,t3_nhixfs,pennystocks,Is it better to swing trade penny stocks or hold them for long-term? Or Should I only swing trade them until they get above $5 ?,,
708,gyzcbq2,2021-05-21 20:07:11,t1_gyzcbq2,t1_gyvgxgg,pennystocks,Same.  This was one of the first stocks I took a chance on.  Been slowly adding some here and there (\~10k total now).  The last two days have been a ton of fun to watch.  Still can't wait to see what happens after the share removal and merger.,,
709,gyzd9yg,2021-05-21 20:14:53,t1_gyzd9yg,t3_nhixfs,pennystocks,Ssm plays are on fire. Fbcd avvh nspt Ifan,,
710,,2021-05-21 20:18:59,t3_ni1uob,,pennystocks,"Recently, Farmmi did a stock offering of 140M shares at $0.30 each. This cause a price drop from ~0.96 to about 0.40.

The average price for this stock had been moving towards about $1 for at least the last 5Y (excluding a couple large price spikes.)

With 4.32M short interest as of 4/30, this stock seems primed for a squeeze. These guys are going to have to cover soon. With some pressure put on them, the price should easily jump quite a bit.

This is a relatively short DD, and I'm sure I missed something, but it does look like it could be a promising little stock to throw 5 or 10% at.

Of course, I'm not a financial advisor or anything, it just looks like a promising opportunity to me.",ni1uob,$FAMI looks like it might want to return to the mean
711,gyzdt1r,2021-05-21 20:19:13,t1_gyzdt1r,t3_ni1uob,pennystocks,"
Does this submission fit our subreddit? If it does please **upvote** this comment. If it does not fit the subreddit please **downvote** this comment.



---

^(*I am a bot, and this comment was made automatically.*) ^(Please) [^(contact)^( )^(us)^( )^(via)^( )^(modmail)](https://www.reddit.com/message/compose?to=/r/pennystocks&subject=Updoot%20bot%20questions!) 
^(if) ^(you) ^(have) ^(any) ^(questions) ^(or) ^(concerns.)",,
712,gyzdutn,2021-05-21 20:19:36,t1_gyzdutn,t3_nh1ejx,pennystocks,To the moon!,,
713,gyzf7fv,2021-05-21 20:30:22,t1_gyzf7fv,t3_nhixfs,pennystocks,Are there any Penny Stock mentors that are good? I'm sick of the BS with financial advisors they keep telling me not the screw with penny stocks. I have trouble with risk management and trading on unsettled cash then getting stuck in a position.,,
714,,2021-05-21 20:33:39,t3_ni26md,,pennystocks,"[https://www.otcmarkets.com/filing/html?id=14976164&guid=26CnUahj0Iglc3h#EX10-1\_HTM](https://www.otcmarkets.com/filing/html?id=14976164&guid=26CnUahj0Iglc3h#EX10-1_HTM)

&#x200B;

 FOMO CORP. (“FOMO”) is providing documentation of its acquisition target SmartGuard-Solutions LLC selection by a branch of the United States Military for repeat orders of UV light disinfection fans on a non-competitive basis",ni26md,8K FOMO CORP. (“FOMO”) is providing documentation of its acquisition target SmartGuard-Solutions LLC selection by a branch of the United States Military for repeat orders of UV light disinfection fans on a non-competitive basis
715,gyzfmjl,2021-05-21 20:33:46,t1_gyzfmjl,t3_ni26md,pennystocks,"
Does this submission fit our subreddit? If it does please **upvote** this comment. If it does not fit the subreddit please **downvote** this comment.



---

^(*I am a bot, and this comment was made automatically.*) ^(Please) [^(contact)^( )^(us)^( )^(via)^( )^(modmail)](https://www.reddit.com/message/compose?to=/r/pennystocks&subject=Updoot%20bot%20questions!) 
^(if) ^(you) ^(have) ^(any) ^(questions) ^(or) ^(concerns.)",,
716,gyzfupo,2021-05-21 20:35:37,t1_gyzfupo,t3_nhsu12,pennystocks,"Dumped my 110,000 shares eod Wednesday on a 50% loss. Fml",,
717,gyzfzrj,2021-05-21 20:36:44,t1_gyzfzrj,t3_mza00l,pennystocks,My calls turned out to be FDs but I'm still long on $LIFE,,
718,gyzg2ye,2021-05-21 20:37:26,t1_gyzg2ye,t3_nhm7n8,pennystocks,"Don't have any dry powder today. It's all on the AVVH train. Up 80%, and no news as of yet. This thing is gonna skyrocket.",,
719,gyzg629,2021-05-21 20:38:09,t1_gyzg629,t3_neq0tt,pennystocks,Added 50K shares today. This is still high risk.,,
720,gyzgbhn,2021-05-21 20:39:24,t1_gyzgbhn,t1_gyyvi0j,pennystocks,I have no idea. All those stocks are pink current or better. I use Fidelity. The only stocks restricted only Fidelity are penny stocks that have stop signs on them on OTCmarkets.com. Usually they are delinquent on reporting,,
721,gyzgemo,2021-05-21 20:40:08,t1_gyzgemo,t1_gyzfupo,pennystocks,"Ouch, sorry to hear that. It is an OTC stock so there is volatility. I see this as a long hold because the tech they have warrants dollars per share and I'm waiting for that.",,
722,gyzgoqg,2021-05-21 20:42:26,t1_gyzgoqg,t1_gyylx27,pennystocks,"I have been wondering if there is a better timeframe

Like 2 weeks rather than 1 for example",,
723,gyzh2mv,2021-05-21 20:45:35,t1_gyzh2mv,t1_gyyi42g,pennystocks,Yep.,,
724,gyzh5o8,2021-05-21 20:46:16,t1_gyzh5o8,t3_ni26md,pennystocks,Looking forward to the continued decline. -79% and going strong here. My punishment for buying into a meme stock lol,,
725,gyzhcgw,2021-05-21 20:47:48,t1_gyzhcgw,t3_nhm7n8,pennystocks,$ABML!!!  My first green stock!!!!,,
726,gyzhm0m,2021-05-21 20:49:57,t1_gyzhm0m,t1_gyzgemo,pennystocks,"Oh for sure I like the stock, I just sell after a fifty percent loss as a rule. I’ll probably buy back in once my wash sale goes by lol",,
727,gyzi1i5,2021-05-21 20:53:25,t1_gyzi1i5,t3_ni1uob,pennystocks,not a short squeeze candidate for fucks sake do you people actually understand anything about trading? multiple offerings this year. They did an offering at a third of their current share price was showing how overvalued even management thought this was. this could do some weird chinese shit like $tkat did. im applying for margin on monday so i can start shorting stocks on posts like these,,
728,gyzi3wv,2021-05-21 20:53:59,t1_gyzi3wv,t1_gyzh2mv,pennystocks,I always hear about these too damn late,,
729,gyzj9t6,2021-05-21 21:03:31,t1_gyzj9t6,t1_gyx59pc,pennystocks,"Be careful with the information you take from strangers on the internet. ""Gurl"" below just commented multiple times on what you should do as if she knows what she's talking about enough to give advice but if you look further down you'll see she just posted a comment stating she just made her ""first big purchase"" of $90....I have over $50K invested.

In my OPINION, you should always diversify in almost any type of investing you do. I personally have 17 different OTC stocks at the moment. MOST OTC stocks will end up at $0.00 in the long term (and by most I mean 19/20) so unless you are extremely well versed in financial sheet analysis (I already know you aren't just by the question you asked) trying to pick out the perfect ones isn't doable for most people.

12 of the 17 stocks I own are more than 25% losses at the moment. 3 are profitable in the 10-20%ish return on investment range, and TWO I have made well over 1000% on each.

In the land of penny stocks it's about picking a couple that will have massive returns and knowing that most will leave you with a hole in your pocket if you hold them for too long.

Study a dozen stocks for about a month and then jump into the ones you deem to have potential after they have a big sell off. DON'T buy into hype or try to chase a rising share price",,
730,gyzjisu,2021-05-21 21:05:34,t1_gyzjisu,t1_gyyzt66,pennystocks,"Great DD, keep it up.",,
731,gyzjw4o,2021-05-21 21:08:37,t1_gyzjw4o,t1_gyz7ua1,pennystocks,"I usually don't pump anything, but I think anyone sitting on this is missing out...",,
732,gyzk7n8,2021-05-21 21:11:13,t1_gyzk7n8,t1_gyyl16q,pennystocks,Here here,,
733,gyzk8yv,2021-05-21 21:11:30,t1_gyzk8yv,t1_gyzj9t6,pennystocks,"> DON'T buy into hype or try to chase a rising share price

Your right I know more technical analysis but, that goes out the window with penny stocks. I only know to buy a penny stock if current liabilities are less than current asset and the same for total assets and liabilities. I look for triple digit percent revenues in the PRs. I look for cash on hand too. I was thinking of picking 3 only and the rest in stable companies. I'm thinking $AABB , $IQST , and $AYLI (A Speculation).",,
734,gyzleeo,2021-05-21 21:20:30,t1_gyzleeo,t3_ni0i5m,pennystocks,Shout out to MSNVF or MRS,,
735,gyzlt7y,2021-05-21 21:23:39,t1_gyzlt7y,t3_ni0i5m,pennystocks,So FIRE ^^^sale,,
736,gyzm31c,2021-05-21 21:25:46,t1_gyzm31c,t3_ktuzvv,pennystocks,I’m rich!,,
737,gyzm4qz,2021-05-21 21:26:08,t1_gyzm4qz,t3_nhu461,pennystocks,"In case anyone wanted to see the last 10-Q:

https://www.otcmarkets.com/filing/html?id=14970545&guid=8pCnUHFwNSn4t3h",,
738,gyzm7sg,2021-05-21 21:26:47,t1_gyzm7sg,t3_nhsu12,pennystocks,can i buy on TOS?,,
739,gyzmoha,2021-05-21 21:30:30,t1_gyzmoha,t3_nhm7n8,pennystocks,Ok not the worst of days. ABML carried my penny portfolio followed by some solid gains from tawnf and RETC..still down hut gotta start somewhere,,
740,gyzmr24,2021-05-21 21:31:03,t1_gyzmr24,t1_gyzjisu,pennystocks,thank u,,
741,gyzn7hw,2021-05-21 21:34:44,t1_gyzn7hw,t3_ni3hsk,pennystocks,"Your post with title ""SHOW LOVE TO #CTRM"" has been automatically removed from r/PennyStocks for being low-effort/spam. (Low word count) probably by u/automod 

*I am a bot, and this action was performed automatically. Please [contact the moderators of this subreddit](/message/compose/?to=/r/pennystocks) if you have any questions or concerns.*",,
742,gyzng0b,2021-05-21 21:36:36,t1_gyzng0b,t1_gyzm7sg,pennystocks,"I have TD Ameritrade and TOS is their platform, so I'd say yes.",,
743,gyznoxj,2021-05-21 21:38:34,t1_gyznoxj,t3_ni0i5m,pennystocks,"Why would you hold through earnings in this market? I thought almost every name dipped hard post earnings, good or bad",,
744,gyznqmd,2021-05-21 21:38:57,t1_gyznqmd,t1_gyz760g,pennystocks,AGM means Annual General Meeting.,,
745,gyznt9k,2021-05-21 21:39:31,t1_gyznt9k,t3_ni3lcx,pennystocks,"Your post with title ""Is it a buy; Wpmlf ?"" has been automatically removed from r/PennyStocks for being low-effort/spam. (Low word count) probably by u/automod 

*I am a bot, and this action was performed automatically. Please [contact the moderators of this subreddit](/message/compose/?to=/r/pennystocks) if you have any questions or concerns.*",,
746,gyznxer,2021-05-21 21:40:26,t1_gyznxer,t3_ni1uob,pennystocks,Wpmlf,,
747,gyznzll,2021-05-21 21:40:55,t1_gyznzll,t3_nhcjpt,pennystocks,Wpmlf,,
748,gyzo4cy,2021-05-21 21:42:00,t1_gyzo4cy,t1_gyxzhjk,pennystocks,April 5th. I bought in 3/31 at something like 0.02 decided to yeet more money because of the hype and bought more at .079 then it crashed the next day down to 0.018 .,,
749,gyzo5xu,2021-05-21 21:42:20,t1_gyzo5xu,t1_gyznoxj,pennystocks,When that hindsight bias hits 😩😩😩,,
750,gyzokth,2021-05-21 21:45:40,t1_gyzokth,t1_gyxnwhm,pennystocks,"Not as up to speed but in a nut shell you can’t touch them until a certain time they probably deem, my guess 1 yr at a minimum.   But they should continue to increase/decrease like other shares.  As the person who provided me insight also stated it keeps from people dumping a ton of shares immediately as well which would have an effect in its price",,
751,gyzomtv,2021-05-21 21:46:06,t1_gyzomtv,t1_gysfl5s,pennystocks,"All good, she's still a 🦄",,
752,gyzozny,2021-05-21 21:49:02,t1_gyzozny,t1_gyzokth,pennystocks,"i see i see, thank you for the explination",,
753,gyzp98a,2021-05-21 21:51:07,t1_gyzp98a,t3_nhyh6g,pennystocks,SGMD is the way!,,
754,,2021-05-21 21:55:53,t3_ni3xhq,,pennystocks,,ni3xhq,SGMD Caveat Emptor label has been removed! Mind you it has pink current information! 🤫 This means it will be available across all brokers! 🥂
755,,2021-05-21 21:55:55,t3_ni3xiy,,pennystocks,"[https://www.youtube.com/watch?app=desktop&v=sB4XpuGMfGs](https://www.youtube.com/watch?app=desktop&v=sB4XpuGMfGs)

Recent (2 days ago) interview with the company as a good, short review and upcoming timelines.

Basically,

\-Well 2 to be done by End of June.

\-Well 2 AND core analysis of Well 1 findings to be released by end of July.  He states this is where IF (highlight IF) results are what they expect then major SP movement may occur.

\-2 Seismics to be done in August

\-JV partnerships to be discussed in q4 2021.  (My guess should start hearing rumors after Halloween (good trick or treat).",ni3xiy,RECAF review and timelines
756,gyzpvda,2021-05-21 21:56:07,t1_gyzpvda,t3_ni3xhq,pennystocks,"
Does this submission fit our subreddit? If it does please **upvote** this comment. If it does not fit the subreddit please **downvote** this comment.



---

^(*I am a bot, and this comment was made automatically.*) ^(Please) [^(contact)^( )^(us)^( )^(via)^( )^(modmail)](https://www.reddit.com/message/compose?to=/r/pennystocks&subject=Updoot%20bot%20questions!) 
^(if) ^(you) ^(have) ^(any) ^(questions) ^(or) ^(concerns.)",,
757,gyzpvf7,2021-05-21 21:56:08,t1_gyzpvf7,t3_ni3xiy,pennystocks,"
Does this submission fit our subreddit? If it does please **upvote** this comment. If it does not fit the subreddit please **downvote** this comment.



---

^(*I am a bot, and this comment was made automatically.*) ^(Please) [^(contact)^( )^(us)^( )^(via)^( )^(modmail)](https://www.reddit.com/message/compose?to=/r/pennystocks&subject=Updoot%20bot%20questions!) 
^(if) ^(you) ^(have) ^(any) ^(questions) ^(or) ^(concerns.)",,
758,gyzq31t,2021-05-21 21:57:50,t1_gyzq31t,t3_ni0i5m,pennystocks,"Kinda used to be ramp up to earnings then dip after (good or bad ER). Never hold through earnings. 

Now it’s trade flat to earnings, then dip whether they are good or bad",,
759,gyzqjs5,2021-05-21 22:01:41,t1_gyzqjs5,t1_gyzo5xu,pennystocks,"It’s not hindsight bias, I have no idea what this stock is. I’m just talking about how earnings date have led to a drop afterwards for most companies. Look at banks and infra companies, had fantastic earnings and still dropped temporarily afterward",,
760,gyzqozx,2021-05-21 22:02:55,t1_gyzqozx,t3_ni3xhq,pennystocks,Massive news! Happy to be in this one with over 2 mil shares.,,
761,gyzr0jt,2021-05-21 22:05:36,t1_gyzr0jt,t1_gyzh5o8,pennystocks,We must have hit buy at the same time!,,
762,gyzr6md,2021-05-21 22:07:01,t1_gyzr6md,t1_gyz02rm,pennystocks,"Between $1.00 and $2.00 😉

Unfortunately didn’t know about this one back when it was $0.10.",,
763,gyzr8rt,2021-05-21 22:07:32,t1_gyzr8rt,t1_gyzqozx,pennystocks,"Congratulations and welcome to the club! Truth be told a number of people didn't think they would pull through! SGMD got this far with that label, imagine what is going to happen when it's available across all brokers 3 days from now! Plus the company completed the land acquisition. The Lemon Glow acquisition includes 640 acres of property, 32 of which have already been designated for outdoor cannabis cultivation.",,
764,gyzrbap,2021-05-21 22:08:07,t1_gyzrbap,t1_gyyqky1,pennystocks,Awesome!  I’m thrilled to be wrong on this one. 🤯,,
765,gyzrdbm,2021-05-21 22:08:34,t1_gyzrdbm,t1_gyz4m48,pennystocks,The company has said they’re going for $2.  Multiple times.,,
766,gyzrn1s,2021-05-21 22:10:48,t1_gyzrn1s,t3_ni3xiy,pennystocks,Thank you,,
767,gyzrzf8,2021-05-21 22:13:41,t1_gyzrzf8,t1_gyz5ybg,pennystocks,"Essentially going Pink Current means the company has provided all of the required up to date financial reports to show the OTC Markets it is active.

Pink Current is the top tier of disclosure in the OTC Pink Sheets, followed by Limited Information and No Information. 

This shows that GGII has nothing to hide, and was one of the last hurdles before the reverse merger with Hempacco can go through.",,
768,gyztfj4,2021-05-21 22:25:50,t1_gyztfj4,t3_ni0i5m,pennystocks,Your post was removed by a moderator of r/pennystocks because gains/losses/memes are only permitted on Saturdays.,,
769,gyztkd1,2021-05-21 22:26:58,t1_gyztkd1,t3_ni3xhq,pennystocks,This is great news!,,
770,gyzu2jw,2021-05-21 22:31:17,t1_gyzu2jw,t1_gyznqmd,pennystocks,Thank you!!,,
771,gyzu40f,2021-05-21 22:31:39,t1_gyzu40f,t1_gyzh5o8,pennystocks,This is me with TAWNF 🥺,,
772,gyzublk,2021-05-21 22:33:28,t1_gyzublk,t1_gywo4uf,pennystocks,!remindme 1 month,,
773,gyzuls1,2021-05-21 22:35:55,t1_gyzuls1,t1_gywo4uf,pennystocks,RemindMe! 1 Month,,
774,gyzump9,2021-05-21 22:36:08,t1_gyzump9,t3_ni3xiy,pennystocks,"Thanks, I bought in a few weeks ago and after some up and down action it’s gone down quite a bit 😅 Been too busy to play with stonks at all and figured I’d just hold. Let’s see where it goes",,
775,gyzuorf,2021-05-21 22:36:37,t1_gyzuorf,t3_ni1uob,pennystocks,"It's shorted because it makes sense to, but it's not a squeeze candidate. This is pump and dump - get in low and ride it for a few weeks. Made some decent money day trading FAMI lately. 

The valuation of this stock is intentional. It was devalued in a press release. Don't be caught bagholding because of FOMO. I'm likely out next week.",,
776,gyzusuz,2021-05-21 22:37:35,t1_gyzusuz,t3_ni3xiy,pennystocks,I really wish I had bought more than 2 shares a month ago.,,
777,gyzv1nd,2021-05-21 22:39:41,t1_gyzv1nd,t1_gyza1dd,pennystocks,"You know, I'm something of an Raimi fan myself.",,
778,,2021-05-21 22:40:24,t3_ni4uem,,pennystocks,,ni4uem,when you chase after seeing something already run all day
779,gyzv52n,2021-05-21 22:40:30,t1_gyzv52n,t3_ni4uem,pennystocks,"
Does this submission fit our subreddit? If it does please **upvote** this comment. If it does not fit the subreddit please **downvote** this comment.



---

^(*I am a bot, and this comment was made automatically.*) ^(Please) [^(contact)^( )^(us)^( )^(via)^( )^(modmail)](https://www.reddit.com/message/compose?to=/r/pennystocks&subject=Updoot%20bot%20questions!) 
^(if) ^(you) ^(have) ^(any) ^(questions) ^(or) ^(concerns.)",,
780,gyzv7gc,2021-05-21 22:41:04,t1_gyzv7gc,t3_ni26md,pennystocks,FOMO isn’t gonna happen,,
781,gyzv7yj,2021-05-21 22:41:12,t1_gyzv7yj,t1_gyzi3wv,pennystocks,"The big run hasn’t happened yet. It’s been trading relatively sideways for the past few weeks waiting for things to get rolling, which is just now starting to happen. With the attorney letter being filed, pink current should happen soon, which will start the big run, and they should update the website with the big reveal right after, which should be the spike like ICBU had. Same ceo.",,
782,gyzva1l,2021-05-21 22:41:42,t1_gyzva1l,t3_ni3xhq,pennystocks,Was in this a few months ago before learning how much of a scammer the CEO is. I truly wish nothing but the worst for sketchy shell companies like this that just take money from their investors and never return anything other than hot air.,,
783,gyzvlgg,2021-05-21 22:44:25,t1_gyzvlgg,t3_ni4x6o,pennystocks,"Your post with title ""What we think about $shiba ?"" has been automatically removed from r/PennyStocks for being low-effort/spam. (Low word count) probably by u/automod 

*I am a bot, and this action was performed automatically. Please [contact the moderators of this subreddit](/message/compose/?to=/r/pennystocks) if you have any questions or concerns.*",,
784,gyzvpdb,2021-05-21 22:45:21,t1_gyzvpdb,t1_gyyslsy,pennystocks,Googled “short interest for HMBL stock” and thestockobserver.com had that information published on there from May 3rd,,
785,gyzvpx1,2021-05-21 22:45:28,t1_gyzvpx1,t3_ni4uem,pennystocks,It’s ok brother dad and sister mom will fix him right up...🤦‍♂️,,
786,gyzvxby,2021-05-21 22:47:17,t1_gyzvxby,t1_gyzva1l,pennystocks,Sounds like a bunch of FUD! That  being said do what is best for you and keep it moving! 😄,,
787,gyzw3dy,2021-05-21 22:48:44,t1_gyzw3dy,t3_ni26md,pennystocks,Keep pumping this shit stock,,
788,gyzw9lk,2021-05-21 22:50:13,t1_gyzw9lk,t1_gyzvpdb,pennystocks,The website is claiming a 40% increase in short interest. Not 40% short interest,,
789,gyzwj67,2021-05-21 22:52:29,t1_gyzwj67,t1_gyzvxby,pennystocks,"Have you even looked at the LinkedIn? 3 employees, all with sketchy profiles. Continual dilution on every pump. Why does a nothing company need 5.5B shares lol, never seen anything like it before.

If that gives you confidence as an investor then all the more power to you, I hope you do well. Just trying to save some others who may value those types of things.",,
790,gyzwjn9,2021-05-21 22:52:36,t1_gyzwjn9,t1_gyzng0b,pennystocks,"Thanks, Webull and robinhood don’t support this. Is it cause it’s OTC?",,
791,gyzwnll,2021-05-21 22:53:33,t1_gyzwnll,t3_ni26md,pennystocks,Not happening lmao.,,
792,gyzwouw,2021-05-21 22:53:53,t1_gyzwouw,t1_gyzv7yj,pennystocks,I’m in. Thanks,,
793,gyzx6ej,2021-05-21 22:58:09,t1_gyzx6ej,t3_nhozyt,pennystocks,Exceptional report. A++. The stuff of legends!,,
794,gyzx705,2021-05-21 22:58:17,t1_gyzx705,t3_ne4feb,pennystocks,Drnk seems to have the infrastructure to transition in to the THC CBD drink market easily,,
795,gyzx7bf,2021-05-21 22:58:22,t1_gyzx7bf,t1_gyzwj67,pennystocks,"Question good grief all you all ever talk about is dilution, dilution dilution! Look at $WNBD and their shares! Look at $AZFL and their 14.22 billion out standing shares! It's like people don't like to read and review sec fillings and sign up for corporate updates 🤫 I can name of number of stocks that have outstanding shares within the range of 2 billion to 20 billion shares! Look at EEENF 🤣🤣🤣🤣 and their 12.57 billion shares.",,
796,gyzxd9c,2021-05-21 22:59:51,t1_gyzxd9c,t1_gyzwj67,pennystocks,You all just scream dilution to give the uninitiated a sense of FUD but to do those who understand what it going on it comes off as flaming pile of 🔥 💩   🤣🤣🤣,,
797,gyzxgio,2021-05-21 23:00:39,t1_gyzxgio,t1_gyzh5o8,pennystocks,-70% here waiting for it to drop to .000? To average down,,
798,gyzxzak,2021-05-21 23:05:14,t1_gyzxzak,t1_gyzwouw,pennystocks,"Just keep a close eye once the run starts. I’m sure there will be a big pullback after. I’m thinking it will trade around the same or dip a little beginning of the week, and possible pink current as early as mid week. I’ll be hunting down any dips beginning of the week to add more.",,
799,gyzy2vf,2021-05-21 23:06:06,t1_gyzy2vf,t1_gyzh5o8,pennystocks,Pretty much my biggest failure tbh. Same average as you lol,,
800,gyzybua,2021-05-21 23:08:20,t1_gyzybua,t1_gyzxzak,pennystocks,Right on. Thanks for the info,,
801,gyzyhx8,2021-05-21 23:09:48,t1_gyzyhx8,t1_gnou50o,pennystocks,Currently sos is at 2.98  bullish was a awesome thought 😂😂😂,,
802,gyzynat,2021-05-21 23:11:05,t1_gyzynat,t3_nhu461,pennystocks,"8500 shares, 9 months hodling. Let’s f*** roll!",,
803,gyzyq7i,2021-05-21 23:11:47,t1_gyzyq7i,t1_gyzx7bf,pennystocks,"Dilution was just one thing I spoke about, the other you completely ignored because there is no possible logical retort to a sketchy 3 person shell company. I don’t fault you for not acknowledging that part, but going to point it out nonetheless.

I don’t know what AZFL is but looks like a complete trash company. EEENF is not the model company as well. I have no idea why you’d bring up 2 garbage companies when trying to prove your own company isn’t garbage but you do you.",,
804,gyzyqa6,2021-05-21 23:11:48,t1_gyzyqa6,t1_gnot9dh,pennystocks,Well do you support being a bull trader over a data signal over a landline terminal? When I day trade that half a second matters when buying and selling at times 😉,,
805,gyzytuk,2021-05-21 23:12:39,t1_gyzytuk,t3_ni3xiy,pennystocks,"You should type reconafrica whistleblower into Google and read the articles that just popped up, before you invest. Good luck either way but nice to hear both sides",,
806,gyzz6wc,2021-05-21 23:15:54,t1_gyzz6wc,t1_gyzusuz,pennystocks,Don't worry everyday I think about how I didn't get into ocugen at 0.8 when a poster mentioned it around 2 o'clock and I read the post on this very board.  I thought I had too many covid plays at the time (stupid medivolve and RLFTF) so didn't go for it.  This one hasn't even hit yet  like that one did so don't feel bad!,,
807,gyzz80f,2021-05-21 23:16:10,t1_gyzz80f,t1_gyzyq7i,pennystocks,I don't fault you for spewing 💩 but I guess it becomes a habit that is hard to break away from! However I forgive 🙏you for you not what you do!,,
