,comment_id,created,fullname,parent_id,subreddit,text,post_id,title
120,gyxetgi,2021-05-21 10:18:27,t1_gyxetgi,t3_nhosna,pennystocks,"a computer glitch? If you look at the last few days, there is no sign of this spike. Could be a currency conversion problem or something like that?",,
121,gyxf1ca,2021-05-21 10:21:40,t1_gyxf1ca,t3_nh2isu,pennystocks,Guess I'm the only 1 watching this 🤷🏻‍♂️,,
122,gyxf5pm,2021-05-21 10:23:28,t1_gyxf5pm,t1_gywpwna,pennystocks,Ahh I see. Interesting. I will definitely continue to watch this stock and this space. Thanks for your comment. I really appreciate it! ![gif](emote|free_emotes_pack|grin),,
123,gyxfnv2,2021-05-21 10:30:53,t1_gyxfnv2,t1_gywrl2o,pennystocks,$VBHI is an undervalued stock IMO. They trade in a nice channel and I have a feeling its going to soar. I'm anticipating a big run here!,,
124,gyxg26a,2021-05-21 10:36:31,t1_gyxg26a,t3_nhosna,pennystocks,Anzeigefehler in dein Programm.,,
125,gyxg3d8,2021-05-21 10:37:00,t1_gyxg3d8,t1_gywstt0,pennystocks,"Thanks for that.  Are you a drug rep for the company? Lol, you sound like one ;)  I won't deny Ewing sarcoma can use some more players other than chemo and amputation(a dose escalation makes sense for the cohort 9 results).  I was just addressing how early these trials are (probably phase 1?)  And the risk involved with new drugs.  Perhaps I am jaded because I see lots of investigational drugs come and go at my work so I'm always skeptical of new ones.  As an oncology pharmacist I hope these do work, we always need new weapons in the arsenal.  Sometimes companies hit it big with new targets (wish I would have invested in PD 1 but thats Merck and not a pennystock right ;)",,
126,gyxg4n4,2021-05-21 10:37:31,t1_gyxg4n4,t1_gyxetgi,pennystocks,Sell sell sell![gif](emote|free_emotes_pack|joy),,
127,gyxgo7i,2021-05-21 10:45:08,t1_gyxgo7i,t1_gywgtfc,pennystocks,"I think the 3.4 billion is a combination of prospective resources (except Umiat, discussed below) from all their leases. The 1.6 billion is from Project Peregrine alone. However, they have not updated that since the Merlin well which found different zones than they were expecting so not sure if that number goes up or down.

Doubtless they will tell us soon. As for Umiat, they are saying the have 2P and 3P reserves but this is not a correct reflection of the SPE PRMS they claim to have applied. They have already said that Umiat is not commercially viable unless other finds at Peregrine are a success to it should be Contingent Resources but then Dave Wall was never one to let definitions get in the way. I like Ashley Gilbert far more as I think he will try to underpromise and overdeliver in contrast to his predecessor",,
128,gyxgs33,2021-05-21 10:46:37,t1_gyxgs33,t1_gyxdrc8,pennystocks,After that hearing??,,
129,,2021-05-21 10:47:43,t3_nhpjvz,,pennystocks,,nhpjvz,MLFB demo season is officially on!
130,gyxgvdv,2021-05-21 10:47:53,t1_gyxgvdv,t3_nhpjvz,pennystocks,"
Does this submission fit our subreddit? If it does please **upvote** this comment. If it does not fit the subreddit please **downvote** this comment.



---

^(*I am a bot, and this comment was made automatically.*) ^(Please) [^(contact)^( )^(us)^( )^(via)^( )^(modmail)](https://www.reddit.com/message/compose?to=/r/pennystocks&subject=Updoot%20bot%20questions!) 
^(if) ^(you) ^(have) ^(any) ^(questions) ^(or) ^(concerns.)",,
131,gyxgvvk,2021-05-21 10:48:03,t1_gyxgvvk,t1_gyxgs33,pennystocks,"Not playing this game again. If you want to spin, go do it somewhere else.",,
132,gyxgx1b,2021-05-21 10:48:30,t1_gyxgx1b,t1_gywv7c9,pennystocks,"3.4 billion of prospective resources. They have to demonstrate discoveries and hopefully the analysis of Merlin during the summer will help firm that up. In the short term, I expect that Pantheon releasing figures for the Talitha discovery in the two zones 88E shows as extending into Project IceWine acreage (75% working interest) will provide a catalyst as well.",,
133,,2021-05-21 10:50:34,t3_nhplhm,,pennystocks,,nhplhm,ImageProtect : Celebrity NFT Flagship Fotofy Live Q&A Today!
134,gyxh3ec,2021-05-21 10:50:50,t1_gyxh3ec,t3_nhplhm,pennystocks,"
Does this submission fit our subreddit? If it does please **upvote** this comment. If it does not fit the subreddit please **downvote** this comment.



---

^(*I am a bot, and this comment was made automatically.*) ^(Please) [^(contact)^( )^(us)^( )^(via)^( )^(modmail)](https://www.reddit.com/message/compose?to=/r/pennystocks&subject=Updoot%20bot%20questions!) 
^(if) ^(you) ^(have) ^(any) ^(questions) ^(or) ^(concerns.)",,
135,gyxhcay,2021-05-21 10:54:17,t1_gyxhcay,t1_gyu50hl,pennystocks,the address if the executive office is someones house according to the otc market website,,
136,gyxhe2r,2021-05-21 10:54:58,t1_gyxhe2r,t3_nhozyt,pennystocks,"Just the post is worth 100,000 shares! Well done and Thank you!",,
137,gyxhknt,2021-05-21 10:57:28,t1_gyxhknt,t3_nhozyt,pennystocks,nice work dude,,
138,gyxhomk,2021-05-21 10:58:58,t1_gyxhomk,t1_gywt8l6,pennystocks,This is the way,,
139,gyxicfs,2021-05-21 11:07:42,t1_gyxicfs,t1_gyxaysk,pennystocks,"Still great opportunity under $2 (or even above $2).  June/July loaded with catalysts between final permit approval, start of construction, and a LOT of smoke around new partnership PR.  Not financial advice, but lots of DD and great community on the ABML Reddit.  I feel like I’m pumping but seriously just sharing because I love ABML.",,
140,gyxiin3,2021-05-21 11:09:57,t1_gyxiin3,t1_gywo4uf,pennystocks,"Most important comment here.  This is all about the building.  Once that starts (June, it seems), this is game over.  I have all my dry powder in ABML.",,
141,gyxilzv,2021-05-21 11:11:08,t1_gyxilzv,t1_gywletw,pennystocks,"Li-cycle after merger would be an estimated $1.7B.  They’re “ahead” but their processed volume is so low and the industry is going to be so large that there is no leader at the moment.  Honestly both will be successful, this ABML is the differentiation that wins the game.",,
142,gyxiovs,2021-05-21 11:12:10,t1_gyxiovs,t1_gyu1ljd,pennystocks,"Easy to avoid when the news in June is going to be so positive.  There isn’t much selling right now, yesterday we saw how fast this can rise even on a PR that wasn’t even new information.",,
143,gyxirfn,2021-05-21 11:13:05,t1_gyxirfn,t1_gyueacb,pennystocks,"I heard people saying similar stuff at $1.50.....”I’m waiting for a dip”.  Guys, this is STILL the dip.  Just accumulate and accumulate more.  Under $2 is a good spot.  I’m all in here.",,
144,gyxisma,2021-05-21 11:13:31,t1_gyxisma,t1_gyu1584,pennystocks,Want to bet?  Let’s revisit this later in year.,,
145,gyxiubd,2021-05-21 11:14:07,t1_gyxiubd,t1_gyuga20,pennystocks,This train might leave you waiting at the station.,,
146,gyxixpm,2021-05-21 11:15:20,t1_gyxixpm,t1_gywiitf,pennystocks,Pumped?  I’ve seen it mostly drop the past 3 months.  Now it’s rising organically on progress and positive news.,,
147,gyxizx4,2021-05-21 11:16:07,t1_gyxizx4,t1_gywmcnx,pennystocks,Wrong.  There are criteria to qualify at $2 and $3.  They are pursuing the $2 track.,,
148,gyxj3lz,2021-05-21 11:17:22,t1_gyxj3lz,t1_gywh1su,pennystocks,I got mine through Fidelity.,,
149,gyxj7e5,2021-05-21 11:18:40,t1_gyxj7e5,t3_l8sipo,pennystocks,Any info or thaughts about this company? Looks solid,,
150,gyxj82g,2021-05-21 11:18:54,t1_gyxj82g,t3_nhm7n8,pennystocks,"Putting more into $AIKI, Gonna see how IDEX looks as well.",,
151,gyxjadf,2021-05-21 11:19:41,t1_gyxjadf,t1_gyxg3d8,pennystocks,Haha thanks for the compliment! You're completely right about investing in early stage trials. Obviously I hope that ONCT's will work out but there is no denying that even if the data seems to be present things can go wrong. Cool to hear about your work! I just hope that ONCT can be my little pre-Merck PD1 stock :p,,
152,,2021-05-21 11:24:11,t3_nhq587,,pennystocks,,nhq587,MLFB (first publicly traded sports league) nearly tops the list after 8k. So many catalysts coming up with the start of season coming soon!
153,gyxjogd,2021-05-21 11:24:29,t1_gyxjogd,t3_nhq587,pennystocks,"
Does this submission fit our subreddit? If it does please **upvote** this comment. If it does not fit the subreddit please **downvote** this comment.



---

^(*I am a bot, and this comment was made automatically.*) ^(Please) [^(contact)^( )^(us)^( )^(via)^( )^(modmail)](https://www.reddit.com/message/compose?to=/r/pennystocks&subject=Updoot%20bot%20questions!) 
^(if) ^(you) ^(have) ^(any) ^(questions) ^(or) ^(concerns.)",,
154,gyxjtee,2021-05-21 11:26:11,t1_gyxjtee,t3_mi4t8q,pennystocks,I bought in without looking at their website and now I'm regretting it lol,,
155,gyxjyzm,2021-05-21 11:28:05,t1_gyxjyzm,t1_gywwmq2,pennystocks,"Hold tight....you might see a bump today but the real payday will come in the winter time.   

When it jumped back in March, I sold half of my shares around .045, which was more than double of my initial investment, so the remaining shares are basically free money.   I've been buying more shares here under .02 now because this stock will easily be worth 5x that in the winter time again.  I've got all the patience in the world here.",,
156,gyxk1dh,2021-05-21 11:28:54,t1_gyxk1dh,t1_gyw3uo4,pennystocks,"The app says delay 20 minutes? You may have to go to settings and request real time data, which you also have to do to get L2 data.",,
157,gyxk2ly,2021-05-21 11:29:19,t1_gyxk2ly,t3_nhm7n8,pennystocks,"Keep buying ASKE, even tho the longtime outstanding shareholders are Guna dump. Get em out so we can move on and make it big",,
158,gyxk2v6,2021-05-21 11:29:24,t1_gyxk2v6,t1_gywa8n0,pennystocks,Bahahahaha people are still investing in quEEENF? That’s incredible.,,
159,gyxk3m5,2021-05-21 11:29:39,t1_gyxk3m5,t1_gywvedq,pennystocks,Dont mention it!,,
160,gyxk4u4,2021-05-21 11:30:04,t1_gyxk4u4,t1_gyxisma,pennystocks,"You think they will get back to 4 bucks organically and go to a a market cap of a few billion? Yeah, no. RS will happen. Company should do well overall. When RS is announced the stock will go down and then it will trade in the same range for awhile after nasdaq and then it will steadily go up. I do not need to revisit anything. I am good at my job.",,
161,gyxk82t,2021-05-21 11:31:12,t1_gyxk82t,t1_gyxk2v6,pennystocks,I wouldn’t say investing just waiting until we get our money back so any good news is great,,
162,gyxkaw1,2021-05-21 11:32:09,t1_gyxkaw1,t1_gywh7jz,pennystocks,Yes it did,,
163,gyxkdvj,2021-05-21 11:33:09,t1_gyxkdvj,t1_gyx0cxv,pennystocks,"Feel free to sell you shares then...I love the fact that the price keeps staying under .02 USD, I'll keep scooping up more shares...this is easy money over the next 9 months.",,
164,gyxkghk,2021-05-21 11:34:02,t1_gyxkghk,t1_gyxk2v6,pennystocks,"Absolutely....keep selling me your shares, I'll gladly take them.",,
165,gyxkknr,2021-05-21 11:35:24,t1_gyxkknr,t3_nh2q89,pennystocks,To expand into brewing? Isn't that their main business?,,
166,,2021-05-21 11:35:31,t3_nhqc4p,,pennystocks,After a good AH move $FAMI is starting the morning at the top of the movers list. Been mentioning it for days and still looking like a good opportunity.,nhqc4p,$FAMI starting the morning off at the top of the movers list....
167,gyxkl8q,2021-05-21 11:35:35,t1_gyxkl8q,t3_nhqc4p,pennystocks,"
Does this submission fit our subreddit? If it does please **upvote** this comment. If it does not fit the subreddit please **downvote** this comment.



---

^(*I am a bot, and this comment was made automatically.*) ^(Please) [^(contact)^( )^(us)^( )^(via)^( )^(modmail)](https://www.reddit.com/message/compose?to=/r/pennystocks&subject=Updoot%20bot%20questions!) 
^(if) ^(you) ^(have) ^(any) ^(questions) ^(or) ^(concerns.)",,
168,gyxkn9a,2021-05-21 11:36:14,t1_gyxkn9a,t1_gyxk2v6,pennystocks,This is the most cringe comment,,
169,gyxkuty,2021-05-21 11:38:43,t1_gyxkuty,t1_gyxicfs,pennystocks,Appreciate that!,,
170,gyxkyfs,2021-05-21 11:39:54,t1_gyxkyfs,t1_gyx1cfh,pennystocks,Ya it's very pedoy...,,
171,gyxl31i,2021-05-21 11:41:24,t1_gyxl31i,t1_gyxilzv,pennystocks,"I think the market can be huge but ABML got way ahead of itself on valuation. I know it has come down a lot but believe it needs some execution and serious progress before its stock is going to catch a bid again.

I bought at 0.40 and sold at $2ish I think. I am holding bags on Li-Cycle though 🤦‍♂️",,
172,gyxl7ij,2021-05-21 11:42:51,t1_gyxl7ij,t1_gyxkn9a,pennystocks,"No, investing in EEENF is the most cringe thing a human can do.",,
173,gyxl9c4,2021-05-21 11:43:25,t1_gyxl9c4,t1_gyxkghk,pennystocks,Yeah… I have no EEENF shares to sell you turd.,,
174,gyxlph9,2021-05-21 11:48:34,t1_gyxlph9,t1_gyxl7ij,pennystocks,"You must live a very boring, sad life if you’re here just to harass people in this sub. I bet you feel like a big tough guy sitting behind that dorito encrusted keyboard scratching your neckbeard and going upstairs to ask mom if she could turn down Maury Povich so you can focus on your next scathing comment to random strangers on Reddit.",,
175,gyxlqhe,2021-05-21 11:48:54,t1_gyxlqhe,t3_nhm5bm,pennystocks,More like my days and others’ days...,,
176,gyxlr70,2021-05-21 11:49:06,t1_gyxlr70,t1_gyuno8h,pennystocks,Too much hype I suppose. It's like everyone got the news they wanted and didn't know what to do once they got it. If I were bag holding I think I would continue to hold. I could totally see a run in the short distance future - especially after the bankruptcy hearing,,
177,gyxltw3,2021-05-21 11:49:55,t1_gyxltw3,t3_ngpgqm,pennystocks,"GGII Pink current, could be a nice day from that",,
178,gyxlvzf,2021-05-21 11:50:33,t1_gyxlvzf,t3_nhieaw,pennystocks,"Good grief, next ill be garnering a salad. What even is that graph.",,
179,gyxm55m,2021-05-21 11:53:19,t1_gyxm55m,t1_gyvsv14,pennystocks,That’s why I grabbed it. The jump was a nice bonus,,
180,gyxmazp,2021-05-21 11:55:07,t1_gyxmazp,t3_nhq587,pennystocks,SAML!!!!,,
181,gyxmhrf,2021-05-21 11:57:08,t1_gyxmhrf,t3_nhkxvm,pennystocks,"“Could” or yknow, could tank 10% again",,
182,gyxmkfx,2021-05-21 11:57:57,t1_gyxmkfx,t1_gyxgs33,pennystocks,What happened?,,
183,gyxmope,2021-05-21 11:59:11,t1_gyxmope,t3_nhqc4p,pennystocks,ENVB!,,
184,gyxms1p,2021-05-21 12:00:11,t1_gyxms1p,t3_nhozyt,pennystocks,Delete this please until my last batch of funds clear.,,
185,gyxn2d0,2021-05-21 12:03:14,t1_gyxn2d0,t3_m8asxx,pennystocks,More insider buying!!!,,
186,gyxn3nc,2021-05-21 12:03:36,t1_gyxn3nc,t1_gyxfnv2,pennystocks,"Me too. Seems like it may be finishing a nice accumulation phase, and may be on the verge of popping.",,
187,gyxn4k6,2021-05-21 12:03:53,t1_gyxn4k6,t1_gyxicfs,pennystocks,"Seems Webull has the stock listed, but is not allowing trades. What platform do you use? Thanks.",,
188,gyxnb21,2021-05-21 12:05:46,t1_gyxnb21,t3_nhbxzc,pennystocks,Investing dot com,,
189,gyxnugz,2021-05-21 12:11:28,t1_gyxnugz,t3_nhixfs,pennystocks,"LLNW.  Small but growing player in a huge growth market, specializing in edge computing, content delivery, and cyber security.  Very cheap at $3.  Some new management with good growth focus.  They will capture more market share in the coming quarters.  Short term price target of $7-$10, long-term $25-$30.",,
190,gyxnuu9,2021-05-21 12:11:34,t1_gyxnuu9,t3_nhm7n8,pennystocks,"LLNW.  Small but growing player in a huge growth market, specializing in edge computing, content delivery, and cyber security.  Very cheap at $3.  Some new management with good growth focus.  They will capture more market share in the coming quarters.  Short term price target of $7-$10, long-term $25-$30.",,
191,gyxnwhm,2021-05-21 12:12:03,t1_gyxnwhm,t1_gynrjpl,pennystocks,"lesser educated teen trader here, what do you mean by restricted? (ive never recieved dividends before, AABB is the first company ive had enough of to get one)",,
192,gyxnx6g,2021-05-21 12:12:15,t1_gyxnx6g,t3_nhagek,pennystocks,Hit piece is a shit piece ... great opportunity to buy.,,
193,,2021-05-21 12:17:05,t3_nhr3j3,,pennystocks,,nhr3j3,$HTZGQ - Please let the paper hands be selling!
194,gyxoep5,2021-05-21 12:17:23,t1_gyxoep5,t3_nhr3j3,pennystocks,"
Does this submission fit our subreddit? If it does please **upvote** this comment. If it does not fit the subreddit please **downvote** this comment.



---

^(*I am a bot, and this comment was made automatically.*) ^(Please) [^(contact)^( )^(us)^( )^(via)^( )^(modmail)](https://www.reddit.com/message/compose?to=/r/pennystocks&subject=Updoot%20bot%20questions!) 
^(if) ^(you) ^(have) ^(any) ^(questions) ^(or) ^(concerns.)",,
195,gyxofsw,2021-05-21 12:17:43,t1_gyxofsw,t3_nhqc4p,pennystocks,Chinese shrooms!,,
196,,2021-05-21 12:17:49,t3_nhr426,,pennystocks,,nhr426,"SIML to the moon and beyond!? Definitely holding my 15,000 shares!"
197,gyxogxy,2021-05-21 12:18:02,t1_gyxogxy,t3_nhr426,pennystocks,"
Does this submission fit our subreddit? If it does please **upvote** this comment. If it does not fit the subreddit please **downvote** this comment.



---

^(*I am a bot, and this comment was made automatically.*) ^(Please) [^(contact)^( )^(us)^( )^(via)^( )^(modmail)](https://www.reddit.com/message/compose?to=/r/pennystocks&subject=Updoot%20bot%20questions!) 
^(if) ^(you) ^(have) ^(any) ^(questions) ^(or) ^(concerns.)",,
198,gyxonfe,2021-05-21 12:19:53,t1_gyxonfe,t3_nhr426,pennystocks,All $12 worth?,,
199,gyxopey,2021-05-21 12:20:26,t1_gyxopey,t3_nhr5u0,pennystocks,"
Does this submission fit our subreddit? If it does please **upvote** this comment. If it does not fit the subreddit please **downvote** this comment.



---

^(*I am a bot, and this comment was made automatically.*) ^(Please) [^(contact)^( )^(us)^( )^(via)^( )^(modmail)](https://www.reddit.com/message/compose?to=/r/pennystocks&subject=Updoot%20bot%20questions!) 
^(if) ^(you) ^(have) ^(any) ^(questions) ^(or) ^(concerns.)",,
200,gyxouhk,2021-05-21 12:21:51,t1_gyxouhk,t1_gyxgo7i,pennystocks,Agreed. This is a strong hold until drilling season....unless we get lucky and Exxon/Conoco comes a knocking to talk buy out  =),,
201,gyxoxop,2021-05-21 12:22:45,t1_gyxoxop,t1_gyxabxy,pennystocks,I feel you. I've got a heavy bag myself at ALPP. 8.8. But patience = happiness.,,
202,gyxp113,2021-05-21 12:23:41,t1_gyxp113,t1_gyxms1p,pennystocks,I know what you mean… it may last a few weeks before it takes off or it may be that it lasts a few days but either way it looks undervalued doesn’t it?,,
203,gyxp2kw,2021-05-21 12:24:06,t1_gyxp2kw,t3_nhm5bm,pennystocks,Can confirm that this exactly how it is,,
204,gyxphlg,2021-05-21 12:28:17,t1_gyxphlg,t3_nhr426,pennystocks,Some analyst fell asleep on their keyboard and didn’t check before submitting 🤦‍♂️,,
205,gyxpijl,2021-05-21 12:28:32,t1_gyxpijl,t1_gywa8n0,pennystocks,Agreed.  Unless your acreage is next to the Dalton Highway. Then you can drill all year round from a gravel pad,,
206,gyxpnwt,2021-05-21 12:29:59,t1_gyxpnwt,t3_nhrce3,pennystocks,"Your post with title ""Vaxil bio about to make big announcements https://discord.gg/KxfJzaW6Nt"" has been automatically removed from r/PennyStocks for being low-effort/spam. (Low word count) probably by u/automod 

*I am a bot, and this action was performed automatically. Please [contact the moderators of this subreddit](/message/compose/?to=/r/pennystocks) if you have any questions or concerns.*",,
207,gyxpo3a,2021-05-21 12:30:02,t1_gyxpo3a,t3_nhr426,pennystocks,I have begun to hate what has become of “to the moon” culture. This is one of the many reasons.,,
208,gyxptif,2021-05-21 12:31:30,t1_gyxptif,t1_gyxpo3a,pennystocks,It was a satirical spin on the phrase.,,
209,gyxpuly,2021-05-21 12:31:48,t1_gyxpuly,t1_gyxonfe,pennystocks,I'd be happy if it was that high!,,
210,gyxq2bg,2021-05-21 12:33:54,t1_gyxq2bg,t3_nhm7n8,pennystocks,I am thinking about selling my VIAC and buying ABML instead. How is the momentum aboit thisnstock here?,,
211,gyxq89n,2021-05-21 12:35:28,t1_gyxq89n,t3_nhm7n8,pennystocks,Holding NUWE!,,
212,gyxqaa1,2021-05-21 12:36:00,t1_gyxqaa1,t1_gyxpo3a,pennystocks,All investment subs have been corrupted by idiots,,
213,gyxqbco,2021-05-21 12:36:18,t1_gyxqbco,t3_nhpjvz,pennystocks,"I'd just like to remind everyone that literally every NFL competitor has failed and gone bankrupt very quickly. None of them have ever been profitable. If you invest in this, good luck and have a quick exit plan.",,
214,gyxql5q,2021-05-21 12:38:57,t1_gyxql5q,t3_nhq587,pennystocks,It's up like 124% which to me means it's going to drop a bit before picking up. Weary of getting in right now regardless of the catalysts this sub has talked about,,
215,gyxr6xw,2021-05-21 12:44:44,t1_gyxr6xw,t1_gyxql5q,pennystocks,You might be right but in January it ran for multiple days. It could go either way in the short term but It’s gaining traction and the potential is massive.,,
216,gyxrinw,2021-05-21 12:47:49,t1_gyxrinw,t3_nhq587,pennystocks,I'm assuming they will be advertising the stock during the live broadcasts.  Now's the time.,,
217,gyxrjz7,2021-05-21 12:48:09,t1_gyxrjz7,t1_gyxhe2r,pennystocks,For real thanks for the effort,,
218,gyxrmar,2021-05-21 12:48:45,t1_gyxrmar,t3_nhr426,pennystocks,So much hate on this post... I think this is hilarious!,,
219,gyxsboi,2021-05-21 12:55:14,t1_gyxsboi,t1_gyxonfe,pennystocks,😂,,
220,gyxsgc6,2021-05-21 12:56:25,t1_gyxsgc6,t1_gywvyod,pennystocks,"""Therefore, we will not comment on the credibility of the Seeking Alpha article but invite accredited journalists and financial analysts to discuss our endeavors with us.""

Sounds like they don't oppose any of the criticism.  This is how a PR firm would handle it when they know there is truth in the comments. They would start mentioning free speech instead of addressing any libel comment as an excuse not to respond in kind.  

Trust me ANY lawyer would knows the difference between ""free speech"" and libel.  The fact they are not addressing the criticism and trying to weasel out of it based on ""free speech"" comment is a joke.  Always wonder how gullible the public can be.",,
221,gyxsk2t,2021-05-21 12:57:23,t1_gyxsk2t,t3_nhozyt,pennystocks,"Another reminder of the OTC Mining Company Cycle / (scam).

Buy/lease land.

Conduct test drills.

Report results in fancy PowerPoint presentation to attract retail investors and pump up the price.

Dilute stock by 20% to raise tens/hundreds of millions.

Pay management huge salaries.

Pay off immediate debts.

Buy/lease new land.

Repeat.",,
222,gyxsumd,2021-05-21 13:00:05,t1_gyxsumd,t1_gywvav0,pennystocks,"Thanks I did miss this. 

Interesting they gave out this info.  Was this AFTER the new guidance about pink noncurrent not being traded ruling came down starting in September or before?  My guess, it was after.  

It was just recent because last I checked (during the RS) time there was no disclosures.",,
223,gyxsva0,2021-05-21 13:00:15,t1_gyxsva0,t1_gyti1wr,pennystocks,"Not sure of how it ends up, but there’s a lot of calls that are in/near the money in short term",,
224,gyxt32a,2021-05-21 13:02:12,t1_gyxt32a,t3_ncafay,pennystocks,WOW you GUESS IT RIGHT! HOPE YOU SOLD IT!,,
225,gyxthn0,2021-05-21 13:05:52,t1_gyxthn0,t1_gyx7pdt,pennystocks,I'm pretty sure whoever it was helped drive it up too. A giant penny stock wide pump and rug pull.,,
226,gyxtoga,2021-05-21 13:07:35,t1_gyxtoga,t1_gyxgvdv,pennystocks,"A person should have an exit strategy in mind for every stock, especially pennystocks.  

And a company can look at other company's successes and failures and adapt.  In 1983, you could have told Nintendo not to bother because Atari and the rest of the video game industry was dead.  Instead, they learned from Atari's mistakes.  

In football, the USFL was very successful until they moved from the Spring to the Fall to compete with the NFL.  Bad move.  XFL was looking really good until covid hit, and then had to stop.  They also spent a lot of cash. 

MLFB aims to be fiscally responsible and to be a feeder league for the NFL (and not a competitor).  

College football is a good training ground for many players, but there are certainly some college athletes who go undrafted by the NFL, have to develop elsewhere, and then shine later in the NFL (Warren Moon and Kurt Warner are two of them.)",,
227,gyxtqxd,2021-05-21 13:08:13,t1_gyxtqxd,t1_gyxqbco,pennystocks,"A person should have an exit strategy in mind for every stock, especially pennystocks.  

And a company can look at other company's successes and failures and adapt.  In 1983, you could have told Nintendo not to bother because Atari and the rest of the video game industry was dead.  Instead, they learned from Atari's mistakes.  

In football, the USFL was very successful until they moved from the Spring to the Fall to compete with the NFL.  Bad move.  XFL was looking really good until covid hit, and then had to stop.  They also spent a lot of cash. 

MLFB aims to be fiscally responsible and to be a feeder league for the NFL (and not a competitor).  

College football is a good training ground for many players, but there are certainly some college athletes who go undrafted by the NFL, have to develop elsewhere, and then shine later in the NFL (Warren Moon and Kurt Warner are two of them.)",,
228,gyxtrr3,2021-05-21 13:08:26,t1_gyxtrr3,t1_gywflea,pennystocks,Bullish AF,,
229,gyxtuut,2021-05-21 13:09:12,t1_gyxtuut,t1_gyxmkfx,pennystocks,"Pump and Dump.  Made a big run, but crashed really hard.",,
230,gyxtvv3,2021-05-21 13:09:28,t1_gyxtvv3,t3_nhozyt,pennystocks,What about natural gas?  Any gravy there?,,
231,gyxu257,2021-05-21 13:11:01,t1_gyxu257,t1_gyxthn0,pennystocks,Absolutely possible.,,
232,gyxu33o,2021-05-21 13:11:15,t1_gyxu33o,t1_gyxqbco,pennystocks,"Completing against the nfl isn’t there intention here. They are trying to setup professional developmental league with a strict budget 30 mil a year. Those other leagues were blowing through money, there spending wasnt sustainable.",,
