,comment_id,created,fullname,parent_id,subreddit,text,post_id,title
374,gyy4bzb,2021-05-21 14:35:10,t1_gyy4bzb,t3_nhss9i,pennystocks,Everyone else here with hundreds of shares meanwhile I have 12 😂😭,,
375,gyy4cgp,2021-05-21 14:35:16,t1_gyy4cgp,t1_gywsavc,pennystocks,I found it on the motely fool and bought in at 0.09,,
376,gyy4ffx,2021-05-21 14:35:54,t1_gyy4ffx,t1_gyy3ix1,pennystocks,"Two with actual businesses and potential, $CELZ and $OZSC. One with potential, but I'm waiting to see if they start their basketball teams, $PSRU (I don't recommend sinking much into it but it could be good for a pump at some point... And they are current in fillings). Finally, don't walk...run from DSCR... Down 85% on that pig",,
377,gyy4lct,2021-05-21 14:37:10,t1_gyy4lct,t1_gyy3yo7,pennystocks,![gif](giphy|RYjnzPS8u0jAs),,
378,,2021-05-21 14:38:18,t3_nhu2i8,,pennystocks,"Further to my ongoing due diligence on Canada Nickel Company (CSE $CNC) (OTCQB $CNIKF), below is an antidotal piece of information that I feel some may benefit from:

Mark Selby stated: *""The results of our Preliminary Economic Assessment for Crawford will now be released on May 25th with a conference call to be held the following morning at 10 am EDT May 26th.""* [http://www.prnewswire.com/news-releases/canada-nickel-announces-discovery-at-macdiarmid-nickel-project-301293277.html](http://www.prnewswire.com/news-releases/canada-nickel-announces-discovery-at-macdiarmid-nickel-project-301293277.html)

That would make today the last day to buy shares ahead of this announcement.

**Short-term catalysts**

* PEA results;
* Drilling on the Crawford extensions as assay backlogs finally begin to clear

**Long-term catalysts**

* Feasibility Study by year-end 2021

*Disclaimer: I've been long Canada Nickel since March, 2019 with no intension of selling short-term. Always do your own DD.* 😇",nhu2i8,Last Day to Buy Canada Nickel Shares Ahead of the PEA Release
379,gyy4rmb,2021-05-21 14:38:29,t1_gyy4rmb,t3_nhu2i8,pennystocks,"
Does this submission fit our subreddit? If it does please **upvote** this comment. If it does not fit the subreddit please **downvote** this comment.



---

^(*I am a bot, and this comment was made automatically.*) ^(Please) [^(contact)^( )^(us)^( )^(via)^( )^(modmail)](https://www.reddit.com/message/compose?to=/r/pennystocks&subject=Updoot%20bot%20questions!) 
^(if) ^(you) ^(have) ^(any) ^(questions) ^(or) ^(concerns.)",,
380,gyy4vr8,2021-05-21 14:39:21,t1_gyy4vr8,t1_gyy4ffx,pennystocks,"I was looking at CELZ, buts it’s too much for me right now, I went with SGMD instead. I think they’re trying to go pink current.",,
381,gyy4w50,2021-05-21 14:39:26,t1_gyy4w50,t3_nhm7n8,pennystocks,Arbkf at a discount.  Just avg down and took advantage of this dip. I think bitcoin will rebound and these miners will move back up. Anyone else playing these miner dips?,,
382,,2021-05-21 14:40:23,t3_nhu461,,pennystocks,"> WARWICK, NY, May 21, 2021 (GLOBE NEWSWIRE) -- Ozop Energy Solutions. (OZSC), (“Ozop” or the “Company”), today announced an order for 10 electric vehicle charging stations to be installed in Bical Auto Mall dealerships in Brooklyn, NY, marking the first step in developing a regional NeoGrid Modular Network (patent pending) that will spark a new generation of electrical supply, storage & distribution.
> 
> The initial $80,000 order Bical placed in February through wholly owned subsidiary Ozop Energy Systems, Inc. (OES) and INF Associates, a multi-state energy efficiency and EV support company, called for four (4) dual port Level II Enel X Juice Pedestal chargers to be delivered and installed at two Bical locations. After further surveying the property and accounting for growing demand over the past three months, the order was increased almost eight-fold, resulting in the current order for 10 units at a pre-incentive cost of $600,000.
> 
> An order for an additional six (6) Level III rapid chargers, which could increase the sale by another $409,000 before rebates are applied, is pending approval from Con Edison.
> 
> “This announcement is not just about an order for individual charging stations,” said Brian Conway, CEO of Ozop Energy Systems. “This puts in motion our plan to eliminate the municipal grid or keep it as a luxury supplier instead of a necessary supplier of energy for electric vehicles.”
> 
> “As these systems are deployed,” he added, “we are increasing our network which, modular by design, can be deployed in days not months or even years in many urban areas, and we plan to expand to other markets in the near future.”

https://www.globenewswire.com/news-release/2021/05/21/2234204/0/en/Ozop-Energy-OZSC-Begins-Rollout-of-NeoGrid-Modular-EV-Charging-Network-with-600-000-Order-for-10-Charging-Stations-in-Brooklyn-NY.html

This is a follow up on the PR from February 2021 @ https://www.globenewswire.com/news-release/2021/02/03/2169325/0/en/Ozop-Energy-OZSC-Executes-Agreement-with-Bical-Auto-Mall.html",nhu461,"Ozop Energy OZSC Begins Rollout of NeoGrid Modular EV Charging Network with $600,000 Order for 10 Charging Stations in Brooklyn, NY"
383,gyy5141,2021-05-21 14:40:28,t1_gyy5141,t1_gyy2n6b,pennystocks,"I'm thinking it will start late morning Monday, as people start thinking that maybe they should get in, just in case.",,
384,gyy51q0,2021-05-21 14:40:36,t1_gyy51q0,t3_nhu461,pennystocks,"
Does this submission fit our subreddit? If it does please **upvote** this comment. If it does not fit the subreddit please **downvote** this comment.



---

^(*I am a bot, and this comment was made automatically.*) ^(Please) [^(contact)^( )^(us)^( )^(via)^( )^(modmail)](https://www.reddit.com/message/compose?to=/r/pennystocks&subject=Updoot%20bot%20questions!) 
^(if) ^(you) ^(have) ^(any) ^(questions) ^(or) ^(concerns.)",,
385,gyy52l5,2021-05-21 14:40:47,t1_gyy52l5,t3_nhixfs,pennystocks,Nspt going up!,,
386,gyy55hh,2021-05-21 14:41:24,t1_gyy55hh,t3_nhm7n8,pennystocks,Added to BANT and HSTO.. started a small position in TAWNF at 13.5.. leaving a third of my portfolio in cash over the weekend,,
387,gyy58xm,2021-05-21 14:42:08,t1_gyy58xm,t3_nhu461,pennystocks,More great news. Can’t wait to see what else is coming!,,
388,gyy5ely,2021-05-21 14:43:20,t1_gyy5ely,t1_gyy4a1x,pennystocks,I sympathize - the hype on 88E took it to a point where it was priced as if it had already found more than 600 million barrels. It is an interesting contrast to Pantheon that seems almost embarrassed to tell people what they have found rather than shouting about what they hope to find like Dave Wall used to do.,,
389,gyy5eof,2021-05-21 14:43:21,t1_gyy5eof,t1_gyy4vr8,pennystocks,Hope you do well with it! I looked at SGMD but I am done playing with non current. Just one of my personal rules after being burned,,
390,gyy5f32,2021-05-21 14:43:27,t1_gyy5f32,t3_nhu6ot,pennystocks,"Your post with title ""Thai airways stock is .14 cengg th get in now. Dirt cheap"" has been automatically removed from r/PennyStocks for being low-effort/spam. (Low word count) probably by u/automod 

*I am a bot, and this action was performed automatically. Please [contact the moderators of this subreddit](/message/compose/?to=/r/pennystocks) if you have any questions or concerns.*",,
391,gyy5h51,2021-05-21 14:43:52,t1_gyy5h51,t1_gyy2aob,pennystocks,Amazing well thought out analysis. Great work. I'm convinced.,,
392,gyy5le6,2021-05-21 14:44:44,t1_gyy5le6,t1_gyy2t9w,pennystocks,"Omg 😂 they are debt free! Dilution is completely normal and its the only reason to take a company public. Dilution raises major capital, which in turn allows rapid expansion. If you are circling r/pennystocks and complain about dilution, you should stay away from stock trading. You know too little.",,
393,gyy5qi1,2021-05-21 14:45:48,t1_gyy5qi1,t1_gyy5eof,pennystocks,From what it sounds like the CEO is trying to get his ducks in a row.,,
394,gyy5y57,2021-05-21 14:47:23,t1_gyy5y57,t1_gyy3yo7,pennystocks,"also, just in case there's any confusion, I also dropped the youtube link.  Now I just look weird. But still....I like ATOS lol",,
395,gyy63cy,2021-05-21 14:48:28,t1_gyy63cy,t3_nhixfs,pennystocks,Was hoping MLFB would run a bit more today,,
396,gyy6b1l,2021-05-21 14:50:04,t1_gyy6b1l,t3_nhss9i,pennystocks,The battle for ATOS. Buy vs. Sell walls be crazy,,
397,gyy6k3o,2021-05-21 14:51:54,t1_gyy6k3o,t1_gyy4bzb,pennystocks,40k shares here,,
398,gyy6m9a,2021-05-21 14:52:19,t1_gyy6m9a,t1_gyxmhrf,pennystocks,"lol true, but i'm clearly trying to manifest something over here",,
399,gyy6p9a,2021-05-21 14:52:56,t1_gyy6p9a,t1_gyx4bs6,pennystocks,I'm sure at least one person has caught covid on every single airline in existence,,
400,gyy6rjq,2021-05-21 14:53:23,t1_gyy6rjq,t1_gyxczf5,pennystocks,and they all the way up!,,
401,gyy6wb6,2021-05-21 14:54:22,t1_gyy6wb6,t1_gyxyih4,pennystocks,"Yeah it was due to them acquiring a casino I’m pretty sure, I had 15 shares at 4.90 sold at 8.40 and regret it 😂",,
402,gyy6yzp,2021-05-21 14:54:55,t1_gyy6yzp,t1_gyxzq1k,pennystocks,Yeah it is I doubled my money today . I had bought 3 contracts at 20 a pop and excerused my rights this morning. I’m in it for the long run,,
403,gyy7096,2021-05-21 14:55:12,t1_gyy7096,t1_gyy36ub,pennystocks,"Thanks for the local knowledge, Acceptable.  PTHRF/PANR plan to flowtest(?) their Alkaid play from a gravel pad alongside Dalton Highway this summer/fall.",,
404,gyy74vl,2021-05-21 14:56:09,t1_gyy74vl,t3_nhagek,pennystocks,Short interest is around 42% according to last filing around April 15.,,
405,gyy7dgt,2021-05-21 14:57:55,t1_gyy7dgt,t1_gyxj82g,pennystocks,"I just put more in, too.",,
406,gyy7epc,2021-05-21 14:58:11,t1_gyy7epc,t3_nh50e6,pennystocks,"If it’s not a pump and dump, people here are not interested. People are willing to throw at garbage companies but not at actual ones with huge partnerships...",,
407,,2021-05-21 14:58:41,t3_nhuiy1,,pennystocks,,nhuiy1,Further Confirmation of Enzolytics $ENZC and Intel Collaboration
408,gyy7ho0,2021-05-21 14:58:48,t1_gyy7ho0,t3_nhuiy1,pennystocks,"
Does this submission fit our subreddit? If it does please **upvote** this comment. If it does not fit the subreddit please **downvote** this comment.



---

^(*I am a bot, and this comment was made automatically.*) ^(Please) [^(contact)^( )^(us)^( )^(via)^( )^(modmail)](https://www.reddit.com/message/compose?to=/r/pennystocks&subject=Updoot%20bot%20questions!) 
^(if) ^(you) ^(have) ^(any) ^(questions) ^(or) ^(concerns.)",,
409,gyy7kfn,2021-05-21 14:59:22,t1_gyy7kfn,t1_gyy74vl,pennystocks,"15M shares short out of 900M, less than 2% SI. 42% is the variation.",,
410,gyy7yqn,2021-05-21 15:02:22,t1_gyy7yqn,t3_nhm7n8,pennystocks,METX is gunna turn you into jordan belfort,,
411,,2021-05-21 15:03:32,t3_nhunag,,pennystocks,,nhunag,KYNC Attorney letter dropped. Pink current soon!
412,gyy85op,2021-05-21 15:03:49,t1_gyy85op,t3_nhunag,pennystocks,"
Does this submission fit our subreddit? If it does please **upvote** this comment. If it does not fit the subreddit please **downvote** this comment.



---

^(*I am a bot, and this comment was made automatically.*) ^(Please) [^(contact)^( )^(us)^( )^(via)^( )^(modmail)](https://www.reddit.com/message/compose?to=/r/pennystocks&subject=Updoot%20bot%20questions!) 
^(if) ^(you) ^(have) ^(any) ^(questions) ^(or) ^(concerns.)",,
413,gyy88ch,2021-05-21 15:04:22,t1_gyy88ch,t1_gyy5qi1,pennystocks,Just make sure it's not the same CEO from GARB (too tough for him so he quit) or the shyster from NPHC that promised to get current in Dec and still isn't. 😂,,
414,gyy8bbg,2021-05-21 15:05:00,t1_gyy8bbg,t1_gyy7096,pennystocks,I’m not sure what they’ve got going exactly up there but I do know they are scrambling to get people working on the north slope again especially with the reopening and high oil prices.,,
415,gyy8fvt,2021-05-21 15:05:54,t1_gyy8fvt,t1_gyxkknr,pennystocks,No. They manufacture brewing equipment.,,
416,gyy8i6b,2021-05-21 15:06:22,t1_gyy8i6b,t3_nhm7n8,pennystocks,"Still holding $IPIX waiting on July so I can say either dang it or told ya so. Price keeps moving, but no volume to speak of. May the odds be ever in your favor folks",,
417,gyy8j45,2021-05-21 15:06:34,t1_gyy8j45,t1_gyy88ch,pennystocks,I think his name is Jimmy.,,
418,gyy8s1o,2021-05-21 15:08:24,t1_gyy8s1o,t1_gyy63cy,pennystocks,Manageable wall hit at .034. I think it breaks through and runs to .04 by EOD. $MLFB is a stud!,,
419,gyy8squ,2021-05-21 15:08:32,t1_gyy8squ,t1_gyy7epc,pennystocks,I gotchu. Maybe a few on here will see this and join the enzc train! Preciate you letting me know,,
420,gyy8yki,2021-05-21 15:09:44,t1_gyy8yki,t3_nhixfs,pennystocks,$MLFB is gaining momentum and has a number of huge catalyst over the next two months with expected PR by EOM,,
421,gyy97jl,2021-05-21 15:11:35,t1_gyy97jl,t3_nhu461,pennystocks,"down on my investment with ozop but don't care, *i like the stock*.

EV market is the future of transportation, next thing after that is self-driving.

well... until we get teleporters, and then i'll invest in that too.",,
422,gyy9hip,2021-05-21 15:13:37,t1_gyy9hip,t3_nhm7n8,pennystocks,MLFB hype!,,
423,gyy9t7t,2021-05-21 15:16:03,t1_gyy9t7t,t3_nhss9i,pennystocks,"i would be careful with this post, OP is a new account with only comments about ATOS and this single post about ATOS, im not accusing him of anything, its just fact thatmany accounts like this are pretty sus",,
424,gyy9uim,2021-05-21 15:16:19,t1_gyy9uim,t3_nhm7n8,pennystocks,HMBL  HMBL  Short  squeez  today watch at close it's almost 70% shorted from $7,,
425,gyy9x2g,2021-05-21 15:16:51,t1_gyy9x2g,t1_gyx9s7e,pennystocks,I jumped into VBHI at .01 cents. Will be adding more because I am very happy with the results.,,
426,gyya3fq,2021-05-21 15:18:08,t1_gyya3fq,t1_gyy9t7t,pennystocks,I would agree to be careful with anything you see on the internet... but it’s hard to make up a literal National Congressional Hearing,,
427,gyya6ry,2021-05-21 15:18:50,t1_gyya6ry,t3_nhozyt,pennystocks,Raise funds---> Pay exec. bonuses --> Tank --> Repeat,,
428,gyyae4w,2021-05-21 15:20:20,t1_gyyae4w,t3_nhm7n8,pennystocks,Is any one holding NMGRF?,,
429,gyyanf7,2021-05-21 15:22:12,t1_gyyanf7,t1_gyy48ir,pennystocks,"Hah, crazy run up this week.",,
430,gyyaojw,2021-05-21 15:22:26,t1_gyyaojw,t3_nhixfs,pennystocks,ABML starting to moon,,
431,gyyarij,2021-05-21 15:23:03,t1_gyyarij,t1_gyxl31i,pennystocks,Who cares about current valuation?  You either believe in the company or you don’t.  Valuation is about future expectations and clearly plenty of people believe that Melsert and team are going to be very successful.,,
432,gyyarkr,2021-05-21 15:23:04,t1_gyyarkr,t1_gyya6ry,pennystocks,"I think that you have described the model under the previous CEO of 88E (although I would defend him in the sense that he always believed they would find oil). I think Ashley Gilbert is much less of a hype merchant so perhaps a change of culture.

Pantheon seems to be too far the other direction, hardly talking about their prospects publicly until discovery confirmed...",,
433,gyyas9t,2021-05-21 15:23:12,t1_gyyas9t,t1_gyxn4k6,pennystocks,Fidelity.,,
434,gyyavdd,2021-05-21 15:23:51,t1_gyyavdd,t3_nhm7n8,pennystocks,HMBL get in below $1 its gonna 🚀  Burn Shorts Hold Sell After NFTs and p2p,,
435,gyyax7y,2021-05-21 15:24:13,t1_gyyax7y,t3_nhixfs,pennystocks,Abxxf looks like a chance to get on the ground level of a transformative company. Any thoughts.  I’ve taken a small position.,,
436,gyyaxe5,2021-05-21 15:24:16,t1_gyyaxe5,t1_gyy8yki,pennystocks,"MLFB will dip soon. AVVH cancelled 1 billion shares, news yet to break",,
437,gyyb0be,2021-05-21 15:24:51,t1_gyyb0be,t3_nhm7n8,pennystocks,Thank you to whomever posted the DD on ABML several days ago. Giving my portfolio a nice bump. ![gif](emote|free_emotes_pack|hug),,
438,gyyb0uy,2021-05-21 15:24:58,t1_gyyb0uy,t1_gyxk4u4,pennystocks,"They can qualify under the $2 uplist criteria and they had said that is the plan.  The stock is literally at $1.96 as I speak.  I fully expect June will have enough positive momentum to stay well above $2.  Didn’t say you aren’t “good at your job”.  Just stating facts, $2.00 is a sufficient price for uplist.",,
439,gyyb58k,2021-05-21 15:25:52,t1_gyyb58k,t1_gyyae4w,pennystocks,Yep it's been increasing over the past week or so. Since they're starting trading on a bigger exchange I think Monday I'll hold,,
440,gyyb8jp,2021-05-21 15:26:32,t1_gyyb8jp,t3_nhss9i,pennystocks,No shorts available 🤭,,
441,gyybaxq,2021-05-21 15:27:03,t1_gyybaxq,t3_nhm7n8,pennystocks,Bagholding GTLL is starting to payoff,,
442,gyybcx9,2021-05-21 15:27:27,t1_gyybcx9,t1_gyyaxe5,pennystocks,Kind of a dumb questions but what is the typical effect of a share cancellation?,,
443,gyybgkn,2021-05-21 15:28:13,t1_gyybgkn,t3_nfd7je,pennystocks,"Late to the party with this post but if T212 hadn't stopped new buys I would definitely be averaging down right now, hopefully they sort it so it opens up another group of buyers again",,
444,gyybjay,2021-05-21 15:28:47,t1_gyybjay,t3_nhv692,pennystocks,"Updated 8k as of 05/19/2021

javascript:OpenWindow('https://dd7pmep5szm19.cloudfront.net/2245/0001640334-21-001204.htm')",,
445,gyyblci,2021-05-21 15:29:12,t1_gyyblci,t1_gyybgkn,pennystocks,Oooh I didn't know that happened interestinggggg,,
446,gyybsfm,2021-05-21 15:30:40,t1_gyybsfm,t1_gyubd7m,pennystocks,"I was looking at the SEC Halt on UONE today and thought about your post. Good call. I don’t own any shares of this stock. Hope you were able to jump in and squeeze a few dollars out of it.

Seems like UONE received the bid for a casino in Virginia. I will think about long term if they decide on a dividend but it’s too risky for me.",,
447,gyybv88,2021-05-21 15:31:15,t1_gyybv88,t1_gyyblci,pennystocks,"Yep, apparently it's not 'penny stock exempt' haven't been able to buy since Feb.... painful watching it drop and not being able to buy in this cheap 😂",,
448,gyyc69j,2021-05-21 15:33:34,t1_gyyc69j,t1_gyy6k3o,pennystocks,I’m just 16 so 🤷🏻‍♂️,,
449,gyyc6np,2021-05-21 15:33:39,t1_gyyc6np,t3_nhm7n8,pennystocks,I have a feeling the cryp dip will turn my day from pretty good to red. We'll see.,,
450,gyycc1o,2021-05-21 15:34:46,t1_gyycc1o,t1_gyya3fq,pennystocks,Quay’s talking about the origin of the Coronavirus and how he thinks it came from a lab. This has nothing to do with ATOS,,
451,gyycdfw,2021-05-21 15:35:02,t1_gyycdfw,t1_gyybcx9,pennystocks,"Bro what? The amount of shares is unaffected, simply AVVH doesn’t see it as a good investment anymore",,
452,gyycflh,2021-05-21 15:35:29,t1_gyycflh,t1_gyycc1o,pennystocks,The dude has 2 different Covid therapeutics based on his research. This was the first sentence I wrote. Did you not read?,,
453,gyych99,2021-05-21 15:35:50,t1_gyych99,t1_gywvn3o,pennystocks,You can also see how many people watching the stock and buying shares. It’s what I use it for.,,
454,gyych9l,2021-05-21 15:35:50,t1_gyych9l,t1_gyyb58k,pennystocks,I'm holding too.,,
455,gyyck7d,2021-05-21 15:36:25,t1_gyyck7d,t1_gyxyx2f,pennystocks,"$10 would be nice, but there are $10 10/15 calls selling for $1 right now, and I can live with $8 per share if the stock takes off...",,
456,gyyckhn,2021-05-21 15:36:28,t1_gyyckhn,t3_nhagek,pennystocks,If you go over to the humbl sub you aren't allowed to talk about this or you get banned. They all claim it's a lie etc etc. But if you read it all it's doing is stating the obvious. I was all in on this stock pre reverse split and until the share structure was revealed. It's so disappointing to see how many people were sucked on to this. With the current amount of shares a and b the company is supposedly worth billions so this stock will need to correct to under .10 to be ok . Instead of focusing on the payment app they are releasing nfts and other shit.  Don't bother with this one.,,
457,gyycpkf,2021-05-21 15:37:31,t1_gyycpkf,t1_gyycdfw,pennystocks,"I literally asked you the question because I didn't know what it was. Don't need to ""Bro what"" me you sarcastic prick",,
458,gyycrwg,2021-05-21 15:38:01,t1_gyycrwg,t3_nhm7n8,pennystocks,So much for $WSGF….,,
459,gyycy09,2021-05-21 15:39:15,t1_gyycy09,t3_nhkxvm,pennystocks,I'll be a bagholder intel 2023 looks like 👍,,
460,,2021-05-21 15:39:26,t3_nhvhoz,,pennystocks,,nhvhoz,$GGII (Green Globe International) goes PINK CURRENT!
461,gyyczxn,2021-05-21 15:39:38,t1_gyyczxn,t1_gyycflh,pennystocks,Do you think he’ll talk about the nasal spray?,,
462,gyyd0jz,2021-05-21 15:39:45,t1_gyyd0jz,t3_nhvhoz,pennystocks,"
Does this submission fit our subreddit? If it does please **upvote** this comment. If it does not fit the subreddit please **downvote** this comment.



---

^(*I am a bot, and this comment was made automatically.*) ^(Please) [^(contact)^( )^(us)^( )^(via)^( )^(modmail)](https://www.reddit.com/message/compose?to=/r/pennystocks&subject=Updoot%20bot%20questions!) 
^(if) ^(you) ^(have) ^(any) ^(questions) ^(or) ^(concerns.)",,
463,gyyd1hp,2021-05-21 15:39:57,t1_gyyd1hp,t3_nhna3e,pennystocks,Seems like this has potential. When do you expect this to run again?,,
464,gyyd338,2021-05-21 15:40:17,t1_gyyd338,t1_gyxaloh,pennystocks,I got scared/excited when it opened high and dipped to .1022 and got out immediately. Didn't want to ruin my early weekend checking it every 30 seconds. This was my third crack at the GGII rollercoaster.,,
465,gyyd43h,2021-05-21 15:40:29,t1_gyyd43h,t1_gyyczxn,pennystocks,"I’m sure his company, atossa, and consequent research will get mentioned.",,
466,gyyd545,2021-05-21 15:40:41,t1_gyyd545,t3_nhu461,pennystocks,That's SOLID news and coming at a good time at bottom I just bought in for first time tossed a couple hundred at it 4k shares at .082. Excited for the future of this dude,,
467,gyyd9ox,2021-05-21 15:41:37,t1_gyyd9ox,t3_nhvhoz,pennystocks,"I called this happening anytime last week and some doubted, but here it is! Was up 50% at open and has consolidated around 12% which makes a great entry point before they drop the 8K.",,
468,gyydj9u,2021-05-21 15:43:33,t1_gyydj9u,t3_nhm7n8,pennystocks,"I love how I am averaging down on ZOM, and it keeps dropping. Will I ever be able to sell and get out, FML.",,
469,gyydnjk,2021-05-21 15:44:25,t1_gyydnjk,t3_nhss9i,pennystocks,"While this obviously effects ATOS, it's only part of the story. Quay seems to be really riding on COVID, for a variety of reasons, but their cancer treatment is what we (holders) should all be focusing on. Suppose we'll see Monday how this plays.",,
470,gyydqrr,2021-05-21 15:45:04,t1_gyydqrr,t1_gyyd43h,pennystocks,"Hope so, I’ve been waiting so long for this ticker to break out",,
471,gyye1de,2021-05-21 15:47:17,t1_gyye1de,t1_gyy4bzb,pennystocks,Could be worse. I have a 3.50 call thats about to expire worthless today 🤷‍♂️,,
472,gyye5ya,2021-05-21 15:48:14,t1_gyye5ya,t1_gyycpkf,pennystocks,No sarcasm. Just read that you said “kind of a dumb question”. My bad,,
473,gyye6eg,2021-05-21 15:48:20,t1_gyye6eg,t1_gyyb0uy,pennystocks,"I do not think they have the assets to meet the criteria for $2 uplist, but since I already planned on waiting I did not dig too deep. I will look at their financials over the weekend. Thanks.",,
474,gyye6m3,2021-05-21 15:48:23,t1_gyye6m3,t1_gyydnjk,pennystocks,I agree. I’m betting that this gives validity to his Covid therapeutics and brings many investors to the table by virtue of publicity.,,
475,gyye6xr,2021-05-21 15:48:27,t1_gyye6xr,t1_gywmjj2,pennystocks,dEfInItE GaPpEr (;,,
476,gyye78s,2021-05-21 15:48:30,t1_gyye78s,t3_nhkxvm,pennystocks,Bankruptcy off the table?,,
477,gyyeam6,2021-05-21 15:49:12,t1_gyyeam6,t3_nhu461,pennystocks,Some assclown told me this was a fake company a few weeks ago L O L. See you on the moon.,,
478,gyyecjk,2021-05-21 15:49:35,t1_gyyecjk,t1_gyye6m3,pennystocks,"That certainly helps, and seems to be the plan.",,
479,gyyeclp,2021-05-21 15:49:36,t1_gyyeclp,t3_nh4wbl,pennystocks,I had heavy bags that I rode from .80 up to 1.41 then back down to 0.45. Likely the last time I drop 30k on  pennystock as a long term hold,,
480,gyyemlk,2021-05-21 15:51:40,t1_gyyemlk,t1_gyybsfm,pennystocks,"Yeah you know a lot of people were already up 100% on their initial investments who bought in around $4 so just wasn't worth the risk of being a bag holder - I'm sure it will settle and go up again in the next 2 - 3 weeks based on Juneteenth

For me, it is just tough as well trying to make money on a morbid cause like this. I'd probably play one of the other ones but expect another P&D to occur (which is sad because it really does screw the businesses over reputability wise)",,
481,gyyeqwx,2021-05-21 15:52:34,t1_gyyeqwx,t3_nhm7n8,pennystocks,Where should I throw my last 3k in the account?,,
482,gyyerff,2021-05-21 15:52:40,t1_gyyerff,t1_gyy1222,pennystocks,Did he say they’re getting ready for soft launch?,,
