,comment_id,created,fullname,parent_id,subreddit,text,post_id,title
740,gz2vot9,2021-05-22 18:21:41,t1_gz2vot9,t3_nicj9p,StockMarket,So? They can ban it all they want doesn’t change what people will do with BTC.,,
741,gz2vwo3,2021-05-22 18:23:34,t1_gz2vwo3,t1_gz2i55j,StockMarket,"You should educate yourself before you spout off and demonstrate what an ignorant fool you are.  

One reason unions disappeared is that when unions were calling the shots and pushing up wages, productivity declined until companies started going bankrupt.  Another reasons union shrank almost to nothing is that people got tired of hearing about the high wages union members earned for doing fuck all and they stopped supporting unions.  The reality is that not many people can be employed at high wages to jack off all day.",,
742,gz2w7t8,2021-05-22 18:26:12,t1_gz2w7t8,t1_gz2i55j,StockMarket,"When people living paycheck to paycheck get more money, they just spend more, so they're back to living paycheck to paycheck.

Oh, and spare me the ""happiness"" studies.  Psychology and social sciences have long been a joke, but the last ten years has shown that their analyses are rarely replicable and that most of the work they produce is garbage.

your no scientist.",,
743,gz2whxv,2021-05-22 18:28:36,t1_gz2whxv,t3_niogtu,StockMarket,Yahoo finance,,
744,gz2wkl6,2021-05-22 18:29:14,t1_gz2wkl6,t3_niiacg,StockMarket,This is why CNBC is the worst.,,
745,gz2wmgz,2021-05-22 18:29:40,t1_gz2wmgz,t3_niiacg,StockMarket,"Let us start with the USELESS CEOs banking all the money. Why would a CEO get paid 10,000x an average worker in their company ?",,
746,gz2wn5i,2021-05-22 18:29:50,t1_gz2wn5i,t3_niiacg,StockMarket,If you don’t like what a company pays you just quit. It’s their business and they can pay whatever they’d like. They will simply stack workload or cut hours. They’ll always have the upper hand.,,
747,gz2wnas,2021-05-22 18:29:52,t1_gz2wnas,t3_niiacg,StockMarket,They see that as a problem because they want people to remain slave to those companies paying low wages,,
748,gz2wrhi,2021-05-22 18:30:51,t1_gz2wrhi,t3_niepg2,StockMarket,A New Hope begins,,
749,gz2wtic,2021-05-22 18:31:19,t1_gz2wtic,t1_gz1scam,StockMarket,"Buy SPXS, baby",,
750,gz2wu91,2021-05-22 18:31:30,t1_gz2wu91,t3_nioqac,StockMarket,"If you want a tool for news, tracking trends, social media chatter, and other stock/crypto markets information you could check out my project [quantrinsic.com](https://quantrinsic.com). Hope it helps you on your journey!   
Oh and if you'd like you can also [join our discord](https://discord.gg/hXbsrUJe4g) for suggestions and feedback on how it can be made better for you.",,
751,gz2wvdp,2021-05-22 18:31:46,t1_gz2wvdp,t3_ni3055,StockMarket,Bought it,,
752,gz2wzxp,2021-05-22 18:32:53,t1_gz2wzxp,t1_gz2mdna,StockMarket,Exactly. Thanks government for printing trillions of dollars to give to big corporations so that my savings and labor are devalued,,
753,gz2xc0w,2021-05-22 18:35:42,t1_gz2xc0w,t1_gz2nl5e,StockMarket,"The economy is not a zero sum game. People can have more, and you can have more too.",,
754,gz2xdpg,2021-05-22 18:36:07,t1_gz2xdpg,t3_ni3055,StockMarket,Flashbacks are a thing,,
755,gz2xfip,2021-05-22 18:36:33,t1_gz2xfip,t1_gyznvy4,StockMarket,More like PTDD - Post Traumatic Dip Disorder.,,
756,gz2xqsz,2021-05-22 18:39:16,t1_gz2xqsz,t1_gz2xc0w,StockMarket,But it is because grades/pay are not going up with the economy. If the libs win and M4A wins I’ll quit my job since why would I pay for the cow (health insurance) when I can have the milk for “free.” M4A is more expensive for government workers.,,
757,gz2xudw,2021-05-22 18:40:09,t1_gz2xudw,t3_niiacg,StockMarket,BUY THE DIP!! Binance is the number one crypto exchange in the world. Get a 10% OFF on all trading fees using the referal ID X6NBS28W when you open a new account🙌🙌🙌,,
758,gz2xyc3,2021-05-22 18:41:07,t1_gz2xyc3,t1_gz2ulwk,StockMarket,That last sentence is completely on point.,,
759,gz2y3eb,2021-05-22 18:42:21,t1_gz2y3eb,t1_gz2xqsz,StockMarket,"M4A is more expensive for everyone buddy, not just public sector workers.",,
760,gz2ydco,2021-05-22 18:44:43,t1_gz2ydco,t3_niiacg,StockMarket,And you have red states now who are cutting back on unemployment payouts in order to coerce the population to go back to work while simultaneously fighting minimum wage hikes at the same time. Could there be a correlation between these two facts? 🤔,,
761,gz2yg3o,2021-05-22 18:45:18,t1_gz2yg3o,t1_gz2y3eb,StockMarket,"Yes, but I was pointing out that the incentive to work for the government and be loyal goes to shit as you decrease purchasing power and remove benefits. If I didn’t need the insurance I would not work for the government due to pay being low.",,
762,gz2ygwp,2021-05-22 18:45:27,t1_gz2ygwp,t1_gz2i55j,StockMarket,"Happiness is important, but this is a discussion on productivity. Simply increasing wages does not, in and of itself, lead to people working harder just because they were paid more.

And as I said, higher wages allows companies to acquire and retain better talent. None of that has anything to do with individuals working harder post pay bump.",,
763,gz2yn3r,2021-05-22 18:46:41,t1_gz2yn3r,t3_niiacg,StockMarket,Training an employee is single handed the most expensive part of the process. Higher wages leads to more productive workers and less turn over thus the profit hit is not as substantial as it seems. Title seems just to scare investors on companies talking about pay raises.,,
764,gz2yov0,2021-05-22 18:47:07,t1_gz2yov0,t3_niepg2,StockMarket,People who do technical analysis on VXX out themselves as noobs or retards,,
765,gz2ypnc,2021-05-22 18:47:16,t1_gz2ypnc,t3_niiacg,StockMarket,Heaven forbid someone gets a fair wage...,,
766,gz2z4nk,2021-05-22 18:50:25,t1_gz2z4nk,t3_nigtfn,StockMarket,Did these dips precede a crash or not?,,
767,gz2zg2l,2021-05-22 18:52:57,t1_gz2zg2l,t1_gz2z4nk,StockMarket,They did.,,
768,gz2zgdp,2021-05-22 18:53:02,t1_gz2zgdp,t3_niiacg,StockMarket,"So companies' profits take a hit if their customers have more money to buy their products? Patti you dipshit tool, you have never seen an empty fridge in your fucking life before, right?",,
769,gz2zpu3,2021-05-22 18:55:21,t1_gz2zpu3,t1_gz2zg2l,StockMarket,so time to cash out or 'this time it's different'?,,
770,gz2zt3u,2021-05-22 18:56:09,t1_gz2zt3u,t1_gz2zpu3,StockMarket,I've cashed out but I'm no financial advisor. History does tend to repeat itself so better safe than sorry IMO.,,
771,gz2zw73,2021-05-22 18:56:54,t1_gz2zw73,t3_ni3055,StockMarket,Hahah this shit is funny. Well played OP.,,
772,,2021-05-22 18:58:17,t3_niph4j,,StockMarket,"I don't even know where to begin with this one, I'm loving the setup so much.  
The company issued an offering recently which led its stock to drop from 10$ a share down to about 3$ where it bottomed out.  


Since then the daily chart has been curling up, it has been very bearish up until this point. All of the indicators are very extended, bottomed out and converging on bullish. As of three days ago green volume has started coming in more and more. Currently as of Friday sitting at 2x average volume.  
AEI has a low float of 6m, and currently receiving higher than average volume as it curls back up. Its sitting at 4.21$ after hours, but on the 30min chart it is very extended and I would expect a pullback to the 4$ mark and hold that as new support. If it hold 4$ there isn't anything stopping it to 6$. Especially if it receives more volume, with a 6m float, this stock could go crazy and I want to be in it if and when it does!  


RSI, MACD, and Stochastics and Volume all indicate a nice run up in the very near future and I will absolutely watch to size into a position around the 4$ mark.",niph4j,$AEI - Low Float
773,gz303sy,2021-05-22 18:58:45,t1_gz303sy,t1_gz2so4n,StockMarket,"I put the gap r /   because some reddits will  ban your post if you mention other subreddits or even some stocks 

I don't won't to make a sub reddit but if I did I would let guys talk about anything they like in the subject maybe you can start a sub that I can join called r/everythinginvestmentrelated 🤔",,
774,gz30e2n,2021-05-22 19:01:14,t1_gz30e2n,t3_nin9pi,StockMarket,Almost bought a 100 at 16 but didn’t pull the trigger I’m a scaredy-cat,,
775,gz30f8g,2021-05-22 19:01:31,t1_gz30f8g,t3_nigtfn,StockMarket,"Why is this not reported anywhere else? I tried searching, anyone got a link?",,
776,gz30j85,2021-05-22 19:02:29,t1_gz30j85,t1_gz2ulwk,StockMarket,Wow I like it you would be a good mod top guy happy investing I will take that all on  bored,,
777,gz30n13,2021-05-22 19:03:24,t1_gz30n13,t1_gz2xyc3,StockMarket,That's true 100%,,
778,gz30s9y,2021-05-22 19:04:42,t1_gz30s9y,t3_nigtfn,StockMarket,Reminder that markets change and nothing in life is guaranteed. History has shown that investing will pay off despite inevitable difficulties.,,
779,gz30yu7,2021-05-22 19:06:17,t1_gz30yu7,t1_gz1rsj8,StockMarket,It also appears to be a year old image.,,
780,gz319ci,2021-05-22 19:08:49,t1_gz319ci,t3_nioo6h,StockMarket,"The advice you’re going to get here will tell you to use very low cost funds, which tend to be index funds rather than managed funds such as the ones that you currently own. A couple examples of index funds are a total US stock market fund or one that tracks the S&P 500.

FSKAX and FXAIX are the Fidelity versions of those two index funds.",,
781,gz31cq0,2021-05-22 19:09:38,t1_gz31cq0,t3_niiacg,StockMarket,CEOs aren’t gonna be able to afford that third beach house they so desperately needed 😔😔😔 so unfair,,
782,gz31pmb,2021-05-22 19:12:50,t1_gz31pmb,t3_nik04r,StockMarket,I wonder if now they will now take a snap on stablecoins.,,
783,gz31xpr,2021-05-22 19:14:49,t1_gz31xpr,t3_ni3055,StockMarket,everyone should also buy sc on crypto.com siacoin this bastard is going up and up,,
784,,2021-05-22 19:14:55,t3_nipu07,,StockMarket,,nipu07,Virgin going to SPCE
785,gz3217g,2021-05-22 19:15:40,t1_gz3217g,t3_nin9pi,StockMarket,Priced in already,,
786,gz321ae,2021-05-22 19:15:42,t1_gz321ae,t1_gz30e2n,StockMarket,"To be fair, quite a lot of people were selling because they delayed their test flights before",,
787,gz328ym,2021-05-22 19:17:33,t1_gz328ym,t1_gz2cnzr,StockMarket,"""Take measures to curb it""

The whole country is experiencing a protracted severe labor shortage, theyre not gonna do shit to curb it they are desperate for workers.",,
788,gz32cgb,2021-05-22 19:18:23,t1_gz32cgb,t3_nin5fa,StockMarket,"Yeah, people on here seem to be treating investing like a team sport",,
789,gz32t1n,2021-05-22 19:22:21,t1_gz32t1n,t3_niiacg,StockMarket,Boo hoo. The rich corps will make 9 billion instead of 10 this year. What a shame.,,
790,gz334pa,2021-05-22 19:25:09,t1_gz334pa,t3_niiacg,StockMarket,Take it out of all the tax money that was saved over the last few years that was supposed to trickle down,,
791,gz334x4,2021-05-22 19:25:12,t1_gz334x4,t1_gz1xuic,StockMarket,"dogs bark

sharks bite

bees sting

a business show reports on the impact of rising wages on business

the sun is hot

water is wet

... am I missing something?",,
792,gz335vp,2021-05-22 19:25:26,t1_gz335vp,t1_gz334x4,StockMarket,Water is actually not wet. It only makes other materials/objects wet. Wetness is the ability of a liquid to adhere to the surface of a solid. So if you say something is wet we mean the liquid is sticking to the surface of the object.,,
793,gz336w5,2021-05-22 19:25:40,t1_gz336w5,t1_gz2lozj,StockMarket,Yup. The 1% that controls 50% of the world's wealth are not just going to sit by see their billions fall into the dirty middle/lower working class if they can avoid it.,,
794,gz33dsb,2021-05-22 19:27:20,t1_gz33dsb,t3_niiacg,StockMarket,"Oh no, not the poor company profits. How will they stay above water now that they have to pay workers something approaching a livable wage?",,
795,gz33k88,2021-05-22 19:28:55,t1_gz33k88,t3_nigtfn,StockMarket,Only if there was a stock with a negative beta that could hedge against the market..... hmmm,,
796,gz33qq9,2021-05-22 19:30:31,t1_gz33qq9,t1_gz2zt3u,StockMarket,This. I'd honestly rather miss out on gains than risk losses,,
797,gz33xbt,2021-05-22 19:32:06,t1_gz33xbt,t1_gz2t7b9,StockMarket,TY⬆️,,
798,gz340wj,2021-05-22 19:32:58,t1_gz340wj,t1_gz2yov0,StockMarket,you must be both.,,
799,gz341ue,2021-05-22 19:33:12,t1_gz341ue,t1_gz2wrhi,StockMarket,Always. ⬆️,,
800,gz344iq,2021-05-22 19:33:51,t1_gz344iq,t3_niiacg,StockMarket,CNBC is fake news.  Bought out by hedge funds,,
801,gz349ys,2021-05-22 19:35:11,t1_gz349ys,t3_nin9pi,StockMarket,"Lol it went up to $50 or so a few weeks ago, and then it took several nosedives after several people in the company sold millions of shares. I bought some shares a while back and now I am at the break even point and I have been debating if I want to buy more as a long play. Considering it went up by 10% Friday I might just do it.",,
802,,2021-05-22 19:35:48,t3_niq9b6,,StockMarket,"I don't even know where to begin with this one, I'm loving the setup so much.
The company issued an offering recently which led its stock to drop from 10$ a share down to about 3$ where it bottomed out.

Since then the daily chart has been curling up, it has been very bearish up until this point. All of the indicators are very extended, bottomed out and converging on bullish. As of three days ago green volume has started coming in more and more. Currently as of Friday sitting at 2x average volume.
AEI has a low float of 6m, and currently receiving higher than average volume as it curls back up. Its sitting at 4.21$ after hours, but on the 30min chart it is very extended and I would expect a pullback to the 4$ mark and hold that as new support. If it hold 4$ there isn't anything stopping it to 6$. Especially if it receives more volume, with a 6m float, this stock could go crazy and I want to be in it if and when it does!

RSI, MACD, and Stochastics and Volume all indicate a nice run up in the very near future and I will absolutely watch to size into a position around the 4$ mark.",niq9b6,$AEI - Low Float
803,gz34cv1,2021-05-22 19:35:53,t1_gz34cv1,t3_niiacg,StockMarket,Won’t somebody think of the shareholders!?!?,,
804,gz34fhc,2021-05-22 19:36:30,t1_gz34fhc,t3_nin5fa,StockMarket,very very true,,
805,gz34vtc,2021-05-22 19:40:26,t1_gz34vtc,t3_niiacg,StockMarket,"Oh noes, the employees profit is taking hit after hit every year. 

A shame nothing can be done about that „cough“",,
806,gz350qk,2021-05-22 19:41:37,t1_gz350qk,t1_gz2ryxc,StockMarket,"I didn’t realize this was r/latestagecapitalism 

How are people really surprised a business/finance news site is reporting this? That is what they cover",,
807,gz356lo,2021-05-22 19:43:04,t1_gz356lo,t3_niiacg,StockMarket,"I didn’t realize this was r/latestagecapitalism

How are people really surprised a business/finance news site is reporting this? That is what they cover",,
808,gz35blf,2021-05-22 19:44:18,t1_gz35blf,t3_nigtfn,StockMarket,Is this a year old? I found an article from March 21 and it looks like the dip has reversed (probably with a lot of help from FED but hey),,
809,gz35dip,2021-05-22 19:44:48,t1_gz35dip,t3_niiacg,StockMarket,"Inflation.. more money doesn't mean MORE money, the cost of everything is also going up, sigh...",,
810,gz35ioo,2021-05-22 19:46:03,t1_gz35ioo,t3_niiacg,StockMarket,Companies who employ workers that need food stamps are just welfare recipients...  stop corporate welfare.,,
811,gz35klh,2021-05-22 19:46:31,t1_gz35klh,t3_nigtfn,StockMarket,"There will always be a bear case and a bull case, if your gonna look at history as an indicator then it's always been best to just stay invested, ride the waves and continue regular contributions. Don't try to time the market.",,
812,gz361z4,2021-05-22 19:50:42,t1_gz361z4,t3_nigtfn,StockMarket,What does this mean in regular person terms lol,,
813,gz368kg,2021-05-22 19:52:15,t1_gz368kg,t3_niiacg,StockMarket,"They all preach for less government and to allow the market to dictate who “lives and who dies”. Well, here we are.",,
814,gz36aw0,2021-05-22 19:52:48,t1_gz36aw0,t1_gz2m07x,StockMarket,"When is it ever not fucked? Doesn't matter when you look at the chart, there will always be FUD regardless.",,
815,gz36ccy,2021-05-22 19:53:08,t1_gz36ccy,t3_niiacg,StockMarket,Didnt realize this was a commie circle jerk /s,,
816,gz36jih,2021-05-22 19:54:50,t1_gz36jih,t1_gz32cgb,StockMarket,How else am I supposed to do a modern day pump & dump?,,
817,gz37b4j,2021-05-22 20:01:25,t1_gz37b4j,t3_niiacg,StockMarket,Yep.,,
818,gz37cch,2021-05-22 20:01:42,t1_gz37cch,t1_gz2v9l0,StockMarket,And the price increases will be larger than the increase in wages so everyone will lose more,,
819,gz37hid,2021-05-22 20:02:56,t1_gz37hid,t1_gz30yu7,StockMarket,"The spaces between the dots mark the years, not the dots themselves. 

If you look at the last labeled ones (2015-2019) there are 5 spaces.  The current dip occurs in the second space of the newest set (2021). 
It can't be a year old image if the data is current and ongoing.",,
820,gz37iw1,2021-05-22 20:03:17,t1_gz37iw1,t1_gz335vp,StockMarket,Water actually is very sticky and for years it generally baffles people when I say this.,,
821,gz37jtk,2021-05-22 20:03:30,t1_gz37jtk,t1_gz2l000,StockMarket,"Absolutely. Not only is trickle down economics bullshit, it's actually the complete opposite of that. Give the money to normal folks and it will end up in the pockets of the rich when they spend it",,
822,gz37otz,2021-05-22 20:04:42,t1_gz37otz,t1_gz1k2k5,StockMarket,Retard,,
823,gz37rlz,2021-05-22 20:05:20,t1_gz37rlz,t1_gz1skth,StockMarket,This year.  The chart is reflective of changes through 2021.,,
824,gz37snm,2021-05-22 20:05:34,t1_gz37snm,t3_nifshi,StockMarket,"Weird though because stocks are a hedge against inflation. Tech/innovation should be hit, but real companies should be fine.",,
825,gz37v4a,2021-05-22 20:06:08,t1_gz37v4a,t1_gz37cch,StockMarket,BINGO,,
826,gz37zyd,2021-05-22 20:07:17,t1_gz37zyd,t1_gz29tzg,StockMarket,You realize this is TTM? As in its looking back. Coming out of COVID you should probably use forward earnings.,,
827,gz3837a,2021-05-22 20:08:04,t1_gz3837a,t3_niiacg,StockMarket,"A yes, another round of people getting pissed on news sites, for reporting news.",,
828,gz389cy,2021-05-22 20:09:31,t1_gz389cy,t1_gz2l2eb,StockMarket,"This is why I don’t get this argument? Higher wages doesn’t equal more purchasing power right? Despite a short term boost, there is an equilibrium point between wages and consumer prices that we’ll always revert to.",,
829,gz38hhf,2021-05-22 20:11:24,t1_gz38hhf,t3_nicj9p,StockMarket,So is this start of end run for unofficial crypto currencies?,,
830,gz38l3x,2021-05-22 20:12:15,t1_gz38l3x,t1_gz2wzxp,StockMarket,"This is the real plan
Just check how much cost a f150 in 1980's and now
Second check the dollar straight in 1980 and now",,
831,gz38lig,2021-05-22 20:12:20,t1_gz38lig,t1_gz33xbt,StockMarket,Could sell covered calls at the top too.,,
832,gz38lxx,2021-05-22 20:12:26,t1_gz38lxx,t3_niiacg,StockMarket,what about it’s impact on inflation?,,
833,gz38mco,2021-05-22 20:12:32,t1_gz38mco,t1_gz1x8m3,StockMarket,Maybe you can help me understand this better. Doesn’t increasing wages increase prices? Is there not an equilibrium between wages and prices that will always be reverted to? Or does raising wages actually give people more purchasing power? I’m genuinely curious because I haven’t looked into this.,,
834,gz38mmc,2021-05-22 20:12:36,t1_gz38mmc,t3_nifshi,StockMarket,"but nothing to worry about, its just transitory :)",,
835,gz38ybl,2021-05-22 20:15:19,t1_gz38ybl,t3_nicj9p,StockMarket,I wonder what theyre going to do about bitmains business,,
836,gz39474,2021-05-22 20:16:39,t1_gz39474,t3_nipu07,StockMarket,80km is technically not space.,,
837,gz3952k,2021-05-22 20:16:51,t1_gz3952k,t1_gz39474,StockMarket,After one look at this planet any visitor from outer space would say “I WANT TO SEE THE MANAGER.”,,
838,gz395ji,2021-05-22 20:16:57,t1_gz395ji,t1_gz2a55r,StockMarket,But but but his profit margins,,
839,gz395zu,2021-05-22 20:17:04,t1_gz395zu,t1_gz3952k,StockMarket,After one look at this planet any visitor from outer space would say “I WANT TO SEE THE MANAGER.”,,
840,gz39bg9,2021-05-22 20:18:17,t1_gz39bg9,t3_nin9pi,StockMarket,I didn't know Virgin Galactic was still in the game. Good to see a successful flight.,,
841,gz39rv7,2021-05-22 20:22:02,t1_gz39rv7,t1_gz33k88,StockMarket,"Could I interest you in a particular stock starting with GM and ending in E? 
Not financial advice (just sexual advice;)",,
842,gz39ul3,2021-05-22 20:22:39,t1_gz39ul3,t1_gz2ewp0,StockMarket,Yep. I don’t understand how this is not being talked about. If the economy does not reach new highs over the next few years I think the Great Depression 2.0 is where we are headed(possibly even if the economy does well),,
843,gz3a8q9,2021-05-22 20:25:52,t1_gz3a8q9,t1_gz2a55r,StockMarket,Hitler had a picture of Henry Ford on his desk...,,
844,gz3abwe,2021-05-22 20:26:37,t1_gz3abwe,t1_gz2o4cr,StockMarket,"This doesn't have to do with printing money, the concept is that money would be reallocated from company profits (which are often either just kept as cash on the balance sheet or for public companies used for share buybacks) to consumer spending. It isn't ""new money"", it's just money which will be spent in the economy instead of saved in the company's bank account.",,
845,,2021-05-22 20:28:15,t3_nirc3n,,StockMarket,,nirc3n,Who wants to see what position this is ?
846,gz3amz0,2021-05-22 20:29:11,t1_gz3amz0,t1_gz2o4cr,StockMarket,Reallocating existing profit that would’ve gone to stock buybacks and executive bonuses instead to workers doesn’t require new money.,,
847,gz3aq2g,2021-05-22 20:29:54,t1_gz3aq2g,t3_niiacg,StockMarket,"This just in: paying your workers fairly costs money.

More at 5.",,
848,gz3b1qs,2021-05-22 20:32:40,t1_gz3b1qs,t1_gz2o4cr,StockMarket,This has nothing to do with printing money.,,
849,gz3b2fp,2021-05-22 20:32:50,t1_gz3b2fp,t3_ng2g6g,StockMarket,"Hit me up in DM buddy… I could help you with few pointers and guide you in the right direction.. the companies you have purchased are good… however what you should be doing is looking at high growth companies… India is an emerging market, we have lotta wonderful businesses present here..",,
850,gz3b408,2021-05-22 20:33:13,t1_gz3b408,t3_nirc3n,StockMarket,"I'm good, thank you though",,
851,gz3b6r4,2021-05-22 20:33:53,t1_gz3b6r4,t1_gz2l000,StockMarket,"Another way you can look at it is people that earn less spend a lot of money on consumables, which we get from other countries, so that's money flowing out if our economy, while wealthy people tend to either put their money into capital investments, or save it in a bank. Wealthy people don't really hoard cash under their mattresses. They use it to create value, or store it in a bank where the bank can loan it to people who will create value.",,
852,gz3b7cc,2021-05-22 20:34:01,t1_gz3b7cc,t1_gz2a55r,StockMarket,"Research shows taking care of your workers makes companies beat the return seen in fortune 500 companies over those who don't. 

It takes a while to compound and make the return happen, but it makes sense happy workers are more productive.",,
853,gz3b7i7,2021-05-22 20:34:03,t1_gz3b7i7,t1_gz3abwe,StockMarket,"This is not meant to be a refute of what houseplant said, which i agree with %100 and upvoted i would like to point out.  I just don't believe they will go into those companies pockets to take back any of the money they were and will continue to be awarded for putting their thumbs on the scale.  They will indeed ultimately try to please everyone by prestidigitation of more currency.",,
854,gz3b9kg,2021-05-22 20:34:32,t1_gz3b9kg,t3_niiacg,StockMarket,Companies will just raise the cost of goods so the inflation that creates effectively negates any increase in wages eventually. I could be wrong but you can research the last major inflationary period during the Carter administration,,
855,gz3bba4,2021-05-22 20:34:55,t1_gz3bba4,t1_gz2bod3,StockMarket,"And full control over the total money supply by slowly choking off cash under the premise of ""combating money laundering"" and claiming physical currency is inefficient to deal with, getting rid of it as a competitor so no more bank runs no matter how poorly the banking system is run, allowing interest rates to go negative and banks to charge whatever obscene transaction fees they want to and the public footing the bill for both.",,
856,gz3bgi0,2021-05-22 20:36:06,t1_gz3bgi0,t3_nirc3n,StockMarket,https://images.app.goo.gl/CXZCF6V4PAmnS67g9,,
857,gz3bgxf,2021-05-22 20:36:12,t1_gz3bgxf,t1_gz356lo,StockMarket,"It's not only with finance/business news sites. It's with every news site.
People see a news site report news. They reported a fact.
People inside their minds create a personality and emotions for that fact.
Now they think the fact is personally attacking them.
They blame the new site for attacking them or saying in this case that minimum wage should not increase because it hurts company profits, when actually non of that was said and they just factually reported that wages go up profits down in upcoming year.
Many people have a weird victim mentality that I can't get it.",,
858,gz3bs84,2021-05-22 20:38:43,t1_gz3bs84,t3_nh4end,StockMarket,I was so excited since they announced plans to IPO only to find out Canadians can’t purchase shares. :(,,
859,gz3byxb,2021-05-22 20:40:17,t1_gz3byxb,t1_gz33k88,StockMarket,You could buy inverse ETFs lol SQQQ,,
860,gz3c2eg,2021-05-22 20:41:06,t1_gz3c2eg,t1_gz3b408,StockMarket,It’s got room to twenty in the next 90 days but ok,,
861,gz3c44x,2021-05-22 20:41:29,t1_gz3c44x,t1_gz3bgi0,StockMarket,Aight dawg,,
862,,2021-05-22 20:41:47,t3_nirm83,,StockMarket,,nirm83,Office-leasing company WeWork announces $2 billion loss ahead of stock market debut
