,comment_id,created,fullname,parent_id,subreddit,text,post_id,title
0,gyytmdo,2021-05-21 17:42:58,t1_gyytmdo,t1_gyxxggk,StockMarket,RemindMe! 3 Days,,
1,gyytmmf,2021-05-21 17:43:00,t1_gyytmmf,t1_gyytbn4,StockMarket,"I asked you who claimed that, because you talked about it as if anyone made a claim of it changing the value",,
2,gyyu3bq,2021-05-21 17:46:31,t1_gyyu3bq,t3_nhy1tb,StockMarket,"Music has been off for a while and it isn’t because of this. 

Also, silver isn’t the best hedge.",,
3,gyyu55w,2021-05-21 17:46:54,t1_gyyu55w,t3_nh780z,StockMarket,The UK a looking in to this as well. Having a digital coin along side the analogue coin. I guess it could reduce how much physical coinage needs to be created,,
4,gyyuesi,2021-05-21 17:48:55,t1_gyyuesi,t3_nho5kv,StockMarket,"Sell btc, buy back in at 15k",,
5,gyyuid4,2021-05-21 17:49:40,t1_gyyuid4,t3_nhtqsf,StockMarket,"Can you please tell us something about the goal of this portfolio. In my opinion a portfolio should always be build with a target in mind. Eg. Target retirement in X years. The smaller X the less risky the portfolio should be. On the other hand, more risk also means more potential gain - get rich or die trying is a valid target in my opinion. The portfolio should also reflect your attitude. Some see their portfolio as a hobby, in this case the whole thing can be super complex to increase the fun. If it is more of a necessity and a chore to maintain the portfolio it should be kept simple.",,
6,gyyusey,2021-05-21 17:51:44,t1_gyyusey,t1_gyyu3bq,StockMarket,This is the end game,,
7,gyyvhkt,2021-05-21 17:57:00,t1_gyyvhkt,t1_gyxxgzo,StockMarket,"Unless you _need_ the funds at a given time, you don't really need to worry about temporary American downturns. Unless you expect a multi-decade stagnation for some reason, s&p 500 is fine.",,
8,,2021-05-21 17:57:26,t3_nhyp8r,,StockMarket,,nhyp8r,Hard shorts on this stock. Extremely low daily volume. This is primed!
9,gyyvpuh,2021-05-21 17:58:44,t1_gyyvpuh,t1_gyyusey,StockMarket,Crypto doesn't exist without China?,,
10,gyyw17x,2021-05-21 18:01:09,t1_gyyw17x,t1_gyyvpuh,StockMarket,The game really over dudes and possible to see 10.000 usd again therefore just hedge yourself,,
11,gyyw1q9,2021-05-21 18:01:16,t1_gyyw1q9,t3_nho5kv,StockMarket,"More crypto my friend, some mid and low cap alts.",,
12,,2021-05-21 18:02:39,t3_nhythr,,StockMarket,,nhythr,A stock chart has appeared in my morning coffee. Should I buy the dip?
13,gyywemx,2021-05-21 18:04:02,t1_gyywemx,t3_nho5kv,StockMarket,"It's good you started early. Soon you would have your own thesis. I wish, I had started as soon as I started earning... 

Cheers. Keep it up",,
14,gyywj7v,2021-05-21 18:05:00,t1_gyywj7v,t3_nhx7f0,StockMarket,Thx for sharing! Used your invite code to get started.,,
15,gyywkbu,2021-05-21 18:05:14,t1_gyywkbu,t3_nhythr,StockMarket,Trust in the gods,,
16,gyywske,2021-05-21 18:06:58,t1_gyywske,t3_nhythr,StockMarket,"Yes buy the DIP, so you can buy more Acid, so you can see more charts in your coffee, so you can buy more DIPs😁✌️",,
17,gyyxa5r,2021-05-21 18:10:40,t1_gyyxa5r,t1_gyyrs8l,StockMarket,"I highly doubt that it doesnt consume any battery. If it's not actually mining then it might not use a lot, but if its mining then it will use easily as much as a top resolution full combat game will drain for",,
18,gyyxbhq,2021-05-21 18:10:57,t1_gyyxbhq,t1_gyywske,StockMarket,"Hey I’d rather practice seeing charts in my coffee while on drugs than join the you know what cult waiting for their messiah to return and squeezeth once again.

Edit: joking",,
19,gyyxlzo,2021-05-21 18:13:09,t1_gyyxlzo,t1_gyyxbhq,StockMarket,I just wanted some acid too 😁🤣✌️,,
20,gyyxr4d,2021-05-21 18:14:15,t1_gyyxr4d,t3_nhov3b,StockMarket,"Is it wise to invest in a company whose main contribution to society is obesity, diabetes, rotten teeth, etc?  

I don’t think so.",,
21,gyyy17o,2021-05-21 18:16:23,t1_gyyy17o,t3_nho5kv,StockMarket,Where’s the cash for the crash?,,
22,gyyy5im,2021-05-21 18:17:15,t1_gyyy5im,t3_nhythr,StockMarket,Sip the dip!,,
23,gyyybw5,2021-05-21 18:18:35,t1_gyyybw5,t3_nhythr,StockMarket,Serious question though you guys can see the chart too...right? :0,,
24,gyyydbz,2021-05-21 18:18:53,t1_gyyydbz,t3_nhy1tb,StockMarket,All they did was restate their stance from 2017. Literally nothing changed.,,
25,gyyyehe,2021-05-21 18:19:08,t1_gyyyehe,t3_ngug6i,StockMarket,"Are you saying, “ this dead cat is bouncing “ ?",,
26,gyyyiwm,2021-05-21 18:20:02,t1_gyyyiwm,t3_nhg5dn,StockMarket,SPCE to the moon...or atleast a take off!,,
27,gyyyq4j,2021-05-21 18:21:31,t1_gyyyq4j,t1_gyyydbz,StockMarket,No dude 37.000 now 3 times of 2020 levels and will go under 10.000 my imho this is over,,
28,gyyyt4e,2021-05-21 18:22:10,t1_gyyyt4e,t3_nhythr,StockMarket,"Yes, but also you should buy water filter.",,
29,gyyyx5u,2021-05-21 18:23:00,t1_gyyyx5u,t1_gyywske,StockMarket,I have to maintain a careful dip to acid ratio to stay in line with my risk management plan.,,
30,gyyyy6v,2021-05-21 18:23:13,t1_gyyyy6v,t1_gyyydbz,StockMarket,For you an example silver reached 50 usd then declined 10 usd and today 27 usd therefore for crypto forget those 5 digits numbers,,
31,gyyyzxa,2021-05-21 18:23:34,t1_gyyyzxa,t1_gyyyt4e,StockMarket,LMFAO!!!,,
32,gyyz1gf,2021-05-21 18:23:53,t1_gyyz1gf,t3_nhythr,StockMarket,"But if you turn it around, it goes up🤔",,
33,gyyz1jo,2021-05-21 18:23:54,t1_gyyz1jo,t1_gyyxa5r,StockMarket,"Your participating in validating the blockchain, but your not technically mining, so it doesn't use the processing power that normally comes with mining.",,
34,gyyz1md,2021-05-21 18:23:55,t1_gyyz1md,t3_nho5kv,StockMarket,"First You have a broad U.S. index plus a growth portfolio plus a dividend portfolio plus the Nasdaq.  This makes the growth and/or dividend somewhat redundant.   It the idea is to slightly undervalue non-dividend value stocks, I guess that’s one way.  Otherwise, ditch both growth and value if you intend to have broad exposure. 

Second, you do not need a FTSE 100 index fund plus a Broad FTSE fund.  That is overweighting large cap when the indexes already are mostly large cap and the funds even overweight large cap even more than the indexes they track. So the mega cap and large cap funds are both dominated by the same stocks.  

Third, you should not have so much invested in UK stocks, even if you live in the UK.  I live in the U.S and I intend to retire here or in no particular country and even I limit my exposure to the U.S. to about 60% which is a very broad stock market and makes up a huge part of all public stocks by market cap (and number) worldwide.  I would put half of that money into a broad international index fund, preferably one with some small-cap exposure.

To deal with these first three redundancies/over complications, I’d look at an all cap world stock index fund or etf, (like VT/ vanguard all-cal world index etf) instead of having all of these.  Then I’d supplement that with emerging markets; small cap international (ex us), small cap emerging market, and small cap U. S. funds to overweight emerging markets and small cap slightly.  These all-cap funds and international funds actually only have a bit of emerging market or small cap exposure (less than the indexes they track, which in and of themselves only have 15-25% mid-small cap or emerging market stocks, and only 5-10 percent small cap (and even then small cap parts are dominated by the biggest cap stocks.  You may even consider adding micro cap funds.

Fourth, that much in Etherium, bitcoin, and staking funds seems excessive.  I’d cut each down to 5% or have 5% in but coin and 5% in the largest 2-19 alt coins by market cap.  But you could go as high as having 5% in 4-20 coins, including bitcoin, and the next 3-19 biggest.   In general, you should maintain a 5% rule-no more than 5% in any one security/crypto.  I would staking funds like a single security. You have 3 in that case that break the 5% rule.",,
35,gyyza6h,2021-05-21 18:25:40,t1_gyyza6h,t1_gyyz1gf,StockMarket,I don’t know isn’t that market manipulation?,,
36,gyyzl82,2021-05-21 18:28:01,t1_gyyzl82,t1_gyyi7oy,StockMarket,Bad bot,,
37,gyyzqr2,2021-05-21 18:29:12,t1_gyyzqr2,t3_nhythr,StockMarket,Why are you even asking?,,
38,gyyzyjk,2021-05-21 18:30:50,t1_gyyzyjk,t3_nhov3b,StockMarket,Yes,,
39,gyyzzng,2021-05-21 18:31:03,t1_gyyzzng,t3_nho5kv,StockMarket,Way too diversified,,
40,gyz01vt,2021-05-21 18:31:33,t1_gyz01vt,t3_nho5kv,StockMarket,I personally keep my crypto levels at 5% and hold around 15% to 20% cash.,,
41,gyz056f,2021-05-21 18:32:16,t1_gyz056f,t3_nho5kv,StockMarket,Playing scared. Trust yourself and what you see.,,
42,gyz05g7,2021-05-21 18:32:19,t1_gyz05g7,t3_nhythr,StockMarket,Dip your biscuit,,
43,gyz06be,2021-05-21 18:32:30,t1_gyz06be,t3_nhythr,StockMarket,You deserved an award just for seeing a chart in you coffee!,,
44,gyz086x,2021-05-21 18:32:54,t1_gyz086x,t1_gyz06be,StockMarket,Thank you :),,
45,gyz0dlf,2021-05-21 18:34:03,t1_gyz0dlf,t1_gyxxfle,StockMarket,May i ask why?,,
46,gyz0lu6,2021-05-21 18:35:47,t1_gyz0lu6,t3_nhx7f0,StockMarket,Lmao spamming this MLM shit errrrwhere,,
47,gyz0o0y,2021-05-21 18:36:15,t1_gyz0o0y,t3_nhythr,StockMarket,BUY THE DIP🚀👨‍🚀 to da moon,,
48,gyz0oei,2021-05-21 18:36:20,t1_gyz0oei,t3_nho5kv,StockMarket,No AMC or GME,,
49,,2021-05-21 18:37:41,t3_nhzleb,,StockMarket,,nhzleb,"U.S. Department Of Treasury: Encrypted Digital Currency Transactions Exceeding $10,000 Should Be Reported To The U.S. Internal Revenue Service (IRS)"
50,gyz0v4e,2021-05-21 18:37:46,t1_gyz0v4e,t3_nhudje,StockMarket,"Nvidia gets the big bucks because of miners. Once PoW gets nixed for PoS, Nvidia's sales are going to bomb.

The ARM deal isn't happening. China is not stupid, if they authorize the purchase then they effectively cut themselves off because ARM would become an American based entity.

Nvidia is bundled in literally every fucking ETF.

Does anyone ever wonder why Nvidia's market cap is less than say TSM, is 100% fabless, but each share is worth 5x more than say a company like TSM?

Red flags everywhere. The gamer in me values their GPUs (which no one can get their hands on because of PoW miners), but the investor in me knows that Nvidia is going to shit hard one day. Good luck to all.",,
51,gyz14dz,2021-05-21 18:39:45,t1_gyz14dz,t1_gyyt7x9,StockMarket,Google doc,,
52,gyz15jw,2021-05-21 18:40:01,t1_gyz15jw,t1_gyyuesi,StockMarket,Brought in at 1k,,
53,gyz17y8,2021-05-21 18:40:31,t1_gyz17y8,t1_gyyp98b,StockMarket,"C'mon, it's 2021, you know people are flush with money and no one cares about fundamentals. I'm staying away from Nvidia for a good long time. Plenty of money to be made in cc right now, especially with the launch of ICP.",,
54,gyz19w0,2021-05-21 18:40:56,t1_gyz19w0,t3_nhzleb,StockMarket,"The wisdom of Ronald Reagan is bearing out.

If it moves, tax it.  If it keeps moving, regulate it.  If it stops moving, subsidize it.  

It appears that we have now entered step 1.",,
55,gyz1hu2,2021-05-21 18:42:37,t1_gyz1hu2,t1_gyywemx,StockMarket,Cheers mate,,
56,gyz1p7k,2021-05-21 18:44:11,t1_gyz1p7k,t1_gyyy5im,StockMarket,And dont forget to refill,,
57,gyz1pmq,2021-05-21 18:44:16,t1_gyz1pmq,t1_gyyza6h,StockMarket,"No no, all we do is a little trolling.",,
58,gyz1u6v,2021-05-21 18:45:15,t1_gyz1u6v,t1_gyxmctz,StockMarket,Vanguard.,,
59,gyz1vjw,2021-05-21 18:45:32,t1_gyz1vjw,t1_gyyz1md,StockMarket,"Cheers for this I would like to just use s & p 500 and emerging markets, what percentage split should I use ?",,
60,gyz1wa0,2021-05-21 18:45:42,t1_gyz1wa0,t3_nho5kv,StockMarket,OHI...you're welcome,,
61,gyz1wjz,2021-05-21 18:45:45,t1_gyz1wjz,t1_gyz01vt,StockMarket,Cheers,,
62,gyz1x68,2021-05-21 18:45:53,t1_gyz1x68,t3_nhubj7,StockMarket,"Stupid post edit music overlay for, dramatic effect?",,
63,gyz1xqn,2021-05-21 18:46:00,t1_gyz1xqn,t1_gyz0oei,StockMarket,You would love my trading account,,
64,gyz1zo8,2021-05-21 18:46:24,t1_gyz1zo8,t3_nhythr,StockMarket,This beats any chart analysis. You should post your coffee daily so we can all profit 💲💲💲,,
65,gyz2b45,2021-05-21 18:48:52,t1_gyz2b45,t1_gyyjste,StockMarket,Finally someone got it !!!!!,,
66,gyz2q3m,2021-05-21 18:52:00,t1_gyz2q3m,t3_nhythr,StockMarket,Dirty bean water,,
67,gyz2rj1,2021-05-21 18:52:17,t1_gyz2rj1,t1_gyyerj7,StockMarket,Cheers mate,,
68,gyz2t2a,2021-05-21 18:52:37,t1_gyz2t2a,t3_nh6grs,StockMarket,"Cult that can last indefinitely…

You mean like Keynesian economics?",,
69,gyz2tn2,2021-05-21 18:52:44,t1_gyz2tn2,t1_gyy8i32,StockMarket,Added !,,
70,gyz2u6u,2021-05-21 18:52:52,t1_gyz2u6u,t3_nho5kv,StockMarket,Always keep 10-30% cash,,
71,gyz2ww3,2021-05-21 18:53:26,t1_gyz2ww3,t3_nhy1tb,StockMarket,"Gotta love the sentiment that China sounds more fiscally/monetarily responsible than the US. 

If the second largest economy in the world wanted to become the first and therefore rip the benefits that  follow, they should have the largest GDP and of course very much invested and involved in a significant part of the worlds logistics supply chain, but more importantly is the public perception in the integrity of their capital markets and trust they are fair that will shift investors money from other markets.",,
72,gyz2xcy,2021-05-21 18:53:32,t1_gyz2xcy,t3_nhx7f0,StockMarket,Stfu,,
73,gyz38tb,2021-05-21 18:55:58,t1_gyz38tb,t1_gyz19w0,StockMarket,The appeal of bitcoin is that you can’t really do that short of simply buying the bitcoins from everyone- in which case you’re hardly controlling their currency anymore and the entire concept that gives it any value is now gone.,,
74,gyz3cvc,2021-05-21 18:56:48,t1_gyz3cvc,t3_nho5kv,StockMarket,Move all into hbar,,
75,gyz3gju,2021-05-21 18:57:36,t1_gyz3gju,t3_nhythr,StockMarket,If I zoom in and squint. Yes. Yes I can see it,,
76,gyz3syr,2021-05-21 19:00:15,t1_gyz3syr,t3_nhy1tb,StockMarket,makes sense.,,
77,gyz41dz,2021-05-21 19:02:05,t1_gyz41dz,t3_ngguoz,StockMarket,"Screw this company I hope they fail.  I was in to gporq (pre zeroing the shares) before the bankruptcy.  I knew there was a risk of them taking back the shares but on paper all looked ""ok"".  Basically they came out of bankruptcy, took back the old shares (a big FU) to those who stuck with them, and put out new shares under gpor.  So this is a scummy company and I wouldn't put the sweat off my nuts into their business.

But I'm not bitter lolol.",,
78,gyz4dnf,2021-05-21 19:04:44,t1_gyz4dnf,t3_nhythr,StockMarket,Your coffee looks a little volatile.,,
79,gyz4ere,2021-05-21 19:04:58,t1_gyz4ere,t1_gyz2u6u,StockMarket,For real ?,,
80,gyz4l9j,2021-05-21 19:06:21,t1_gyz4l9j,t3_nhyp8r,StockMarket,nope,,
81,gyz4o37,2021-05-21 19:06:58,t1_gyz4o37,t1_gyz0v4e,StockMarket,Serious question: why would China have a say in the ARM deal? Isn’t ARM a UK based company?,,
82,gyz4xgr,2021-05-21 19:09:00,t1_gyz4xgr,t3_nhythr,StockMarket,Turn the mug around and it’s not a dip anymore,,
83,gyz55aa,2021-05-21 19:10:42,t1_gyz55aa,t3_nhov3b,StockMarket,"I respect your approach. Toward your stated goal, rather than ""buy more"", I would suggest taking a closer look at $T as well. Maybe split that dedicated portion of your investment between the two?

AT&T has a market valuation very similar to Coca-Cola but with a 7% dividend.",,
84,gyz5brd,2021-05-21 19:12:07,t1_gyz5brd,t1_gyyyt4e,StockMarket,This happens due to the fats in the milk actually dude :(,,
85,gyz5hr9,2021-05-21 19:13:25,t1_gyz5hr9,t3_nhzleb,StockMarket,Redcoats gonna redcoat,,
86,gyz5k1r,2021-05-21 19:13:55,t1_gyz5k1r,t1_gyyz1jo,StockMarket,Is it mining btc??,,
87,gyz5lba,2021-05-21 19:14:11,t1_gyz5lba,t1_gyytmmf,StockMarket,The guy who made the comment said it will be great for small investors as if it does anything it’s probably the opposite bc stupid kids think this means their shares are about to drop,,
88,gyz5lef,2021-05-21 19:14:12,t1_gyz5lef,t1_gyxmctz,StockMarket,Double leveraged QQQ please,,
89,gyz5omm,2021-05-21 19:14:55,t1_gyz5omm,t1_gyxmctz,StockMarket,Also probably better balanced as well. Personally I like VT as it's broader then just US markets and it has appropriate weighting of all markets.,,
90,gyz5qpa,2021-05-21 19:15:22,t1_gyz5qpa,t3_nhythr,StockMarket,"Buy the donut, then dip it.",,
91,gyz5zuc,2021-05-21 19:17:19,t1_gyz5zuc,t3_nho5kv,StockMarket,"Concentration builds wealth, diversification preserves wealth. Take big risks since you're still a kid. Not dumb risks, big ones. Use your returns from successful big risks and allocate those into an account with less net risk, even better, use a ROTH IRA for your safety account, avoid cap gain taxes via roth ira, compound and add over time.",,
92,gyz613u,2021-05-21 19:17:35,t1_gyz613u,t3_nhythr,StockMarket,"Are you sure those weren't your tears convincing you to be in denial of your losses?   
It's cool man, my morning coffee tastes really salty sometimes.",,
93,gyz63x5,2021-05-21 19:18:12,t1_gyz63x5,t3_nhythr,StockMarket,Coffee bean futures to the moon,,
94,gyz662i,2021-05-21 19:18:40,t1_gyz662i,t3_nhythr,StockMarket,This was creative,,
95,gyz66xn,2021-05-21 19:18:51,t1_gyz66xn,t1_gyyybw5,StockMarket,🤔 I see 6 months of TBLT...,,
96,gyz6dlh,2021-05-21 19:20:17,t1_gyz6dlh,t1_gyxxggk,StockMarket,RemindMe! 1 day,,
97,gyz6kv5,2021-05-21 19:21:50,t1_gyz6kv5,t1_gyz662i,StockMarket,It just happened lol I saw the coffee and took a picture...the image is NOT edited,,
98,gyz6l7q,2021-05-21 19:21:55,t1_gyz6l7q,t3_nho5kv,StockMarket,"Might want to hedge against a market crash, try looking for a stock with severely negative beta.",,
99,gyz6n0b,2021-05-21 19:22:19,t1_gyz6n0b,t3_nhythr,StockMarket,"You can change the angle of the chart by moving the cup. It can give you any result you want, just like any other technical analysis.",,
100,gyz6noi,2021-05-21 19:22:28,t1_gyz6noi,t1_gyz613u,StockMarket,No I have consistent gains lol,,
101,gyz6qa1,2021-05-21 19:23:03,t1_gyz6qa1,t1_gyz4dnf,StockMarket,Just like my morning mood <3,,
102,gyz6qmp,2021-05-21 19:23:08,t1_gyz6qmp,t1_gyz6kv5,StockMarket,"Are you DA?? Like you just looked at it and it was ALREADY LIKE THAT!!!!!!!????? 

Its GOTTA be a sign",,
103,gyz6ub8,2021-05-21 19:23:56,t1_gyz6ub8,t1_gyz4o37,StockMarket,"I don’t think China has a say. ARM is a UK company, with majority holding by SoftBank, so it’s UK, Japanese, and US regulators that will be scrutinizing. Plenty of Chinese companies license ARM IP, but as far as I am aware they wouldn’t have a sale in the deal. I might be unaware of something though, but that’s what I know.",,
104,gyz6zfr,2021-05-21 19:25:02,t1_gyz6zfr,t3_nho5kv,StockMarket,"Read this article it will lead you in a good direction for long term investing, especially if your only 19. You may want to think about starting a Roth IRA. Roth accounts are a retirement account funded with post tax dollars and any money made in that accout in not taxable.

https://www.google.com/amp/s/www.fool.com/amp/investing/stock-market/types-of-stocks/dividend-stocks/dividend-aristocrats/",,
105,gyz6zqm,2021-05-21 19:25:06,t1_gyz6zqm,t3_nhythr,StockMarket,I see... nothing,,
106,gyz70ll,2021-05-21 19:25:17,t1_gyz70ll,t1_gyz6zfr,StockMarket,"Non-AMP Link: [https://www.fool.com/investing/stock-market/types-of-stocks/dividend-stocks/dividend-aristocrats/](https://www.fool.com/investing/stock-market/types-of-stocks/dividend-stocks/dividend-aristocrats/)

I'm a bot. [Why?](https://np.reddit.com/user/NoGoogleAMPBot/comments/lbz2sg/) | [Code](https://github.com/laurinneff/no-google-amp-bot) | [Report issues](https://github.com/laurinneff/no-google-amp-bot/issues)",,
107,gyz71au,2021-05-21 19:25:26,t1_gyz71au,t1_gyytamm,StockMarket,-sighs from Canada,,
108,gyz79sq,2021-05-21 19:27:17,t1_gyz79sq,t3_nho5kv,StockMarket,"QQQ and crypto, tech outperforms so why not invest in it.",,
109,gyz7dt4,2021-05-21 19:28:10,t1_gyz7dt4,t1_gyz41dz,StockMarket,"Interesting, thanks. I had no idea - I just thought it was really weird and wanted some sort of answer so my brain would stop itching. In the meantime whilst waiting for an answer, I decided to pull up their chart and compare it to AMC's chart for funzees and they aren't identical but seem to be eerily similar, either way , thanks again for the reply, I really appreciate it. Sorry for your loss too.",,
110,gyz7gcw,2021-05-21 19:28:44,t1_gyz7gcw,t1_gyz6noi,StockMarket,shit...I guess I'm the only one drinking my tears as coffee.,,
111,gyz7kc8,2021-05-21 19:29:36,t1_gyz7kc8,t1_gyxhcwk,StockMarket,"Dividend reinvestment is the long term way

I bought a share 30 years ago and then ignored it.  I just checked and I have about 170 shares now worth over $9k.  So about a 16% annual return.

Could do a lot worse.",,
112,,2021-05-21 19:30:08,t3_ni0s05,,StockMarket,"so i actually favored using RH over my ‘at’ and thinkorswim platforms. i know. must be the colors on RH! so. the cannabis sector is huge. it’s not legal by the feds so it can’t be on an exchange.. so the pink sheets it goes!.. . but this is the biggest US marijuana company by far. RH let’s you few the price on curaleaf but the stock is not supported. will this change? bc the only reason i use ‘at’(thinkorswim) is to buy my OTC curaleaf stock. does anyone else deal w this bs?!  i like all my stocks in one place, the two apps kills me. i wish i could just have it all on RH!",ni0s05,otc stocks on RH
113,gyz7p2w,2021-05-21 19:30:37,t1_gyz7p2w,t1_gyz6qmp,StockMarket,Like for real I was drinking my coffee and looked at it and it looked like that. The only editing I did was change the contrast because it didn’t show up very well in the photo,,
114,gyz7rc3,2021-05-21 19:31:07,t1_gyz7rc3,t1_gyz6n0b,StockMarket,Nice,,
115,gyz7wpn,2021-05-21 19:32:17,t1_gyz7wpn,t1_gyz7p2w,StockMarket,BUY THE DIP !!!!!,,
116,gyz81fk,2021-05-21 19:33:19,t1_gyz81fk,t1_gywem0n,StockMarket,A ray of sunshine!,,
117,gyz87ze,2021-05-21 19:34:45,t1_gyz87ze,t1_gyy329a,StockMarket,That's why people give that feedback. Having fewer levers is better for most.,,
118,gyz8c5m,2021-05-21 19:35:39,t1_gyz8c5m,t1_gyz5brd,StockMarket,"Or the oils in the beans, if you've done French press with a metal filter.",,
119,gyz8g3a,2021-05-21 19:36:29,t1_gyz8g3a,t3_ni0s05,StockMarket,Yeah that is pretty annoying. I smoke Curaleaf products all the time and would invest in it if I could with RH,,
120,gyz8ogo,2021-05-21 19:38:17,t1_gyz8ogo,t3_nhythr,StockMarket,hedgies shorting this too ? can i buy and HODL it :P,,
121,gyz8q29,2021-05-21 19:38:38,t1_gyz8q29,t3_nhythr,StockMarket,the urge I get to tell people I drink my coffee black is insane,,
122,gyz8rwd,2021-05-21 19:39:01,t1_gyz8rwd,t1_gyz5lba,StockMarket,He references that the reduction of price will be great for those that don't have a lot to invest as it makes the stock more affordable. That's regarding those on brokers that don't have factional shares,,
123,gyz8z2y,2021-05-21 19:40:35,t1_gyz8z2y,t1_gyz5k1r,StockMarket,"No, It's mining Pi. A coin that hasnt IPO'ed yet.",,
124,gyz8zue,2021-05-21 19:40:46,t1_gyz8zue,t3_nhythr,StockMarket,Definitely buy the drip,,
125,gyz9aji,2021-05-21 19:43:06,t1_gyz9aji,t1_gyz8ogo,StockMarket,Next on CSNBC “Reddit investors dangerously inflate the price of coffee but are now turning to silver.”,,
126,gyz9hmq,2021-05-21 19:44:41,t1_gyz9hmq,t1_gyqp1of,StockMarket,"> the adoption will expand.

What adoption? No one is buying bitcoin to use it as a currency or anything else. They buy it because they hope to sell it to someone else for more money. If Bitcoin had stable value no one would care about it and most people would never have even heard of it. The only reason it is famous is because it gained fame as a get-rich-quick scheme. There is no problem in this world that requires bitcoin as a solution",,
127,gyz9li4,2021-05-21 19:45:31,t1_gyz9li4,t3_nho5kv,StockMarket,"Have you read up on HedgeFundie’s Excellent Adventure? Google it if you haven’t. Its a leveraged fund strategy that uses rebalancing to adjust for the inherent risk. I would make space for it in your portfolio, personally.",,
128,gyz9p0t,2021-05-21 19:46:18,t1_gyz9p0t,t3_nhzleb,StockMarket,"Several small transactions of $9,999",,
129,gyz9pg5,2021-05-21 19:46:24,t1_gyz9pg5,t3_nhdwpl,StockMarket,Information on other shorted stocks we should as a group invest in such as Academy Sports ASO Super shorted,,
130,gyz9ptd,2021-05-21 19:46:29,t1_gyz9ptd,t3_nho5kv,StockMarket,Everything is wrong with this - It should look like one huge red circle that says GME.,,
131,gyz9wki,2021-05-21 19:48:00,t1_gyz9wki,t3_nhythr,StockMarket,Always 😎,,
132,,2021-05-21 19:51:04,t3_ni18jn,,StockMarket,,ni18jn,Wk 9 1k portfolio
133,gyzansd,2021-05-21 19:53:59,t1_gyzansd,t3_ni18jn,StockMarket,"Still down on the year after a solid start. This week saw huge swings downwards but Finished flat. I’m thinking about rebalancing to include some $PFE, $MMM, $KHC, $GOLD and $X",,
