,comment_id,created,fullname,parent_id,subreddit,text,post_id,title
233,,2021-05-21 21:03:24,t3_ni2u7c,,StockMarket,"**PsychoMarket Recap - Friday, May 21, 2021**

Stocks traded mixed today, with the S&P 500 (SPY) and Nasdaq (QQQ) declining modestly after yesterday’s rally. It’s encouraging to see the market holding on to yesterday’s gains following the volatility experienced in recent weeks. It seems overall market sentiment is improving following a surge in inflationary fears after the release of the April Consumer Price Index. The SPY closed 0.08% down, the QQQ closed 0.56% down, and the Dow Jones (DIA) closed 0.36% up.

Markets have recently been shaken by the prospect that a rise in inflation may prompt the Federal Reserve to tighten monetary policy sooner than expected. However, as has been reiterated in the recap before, there are several reasons why a change in monetary policy seems very unlikely. In the Federal Reserve’s April meeting minutes, “participants generally noted that the economy remained far from the Committee’s maximum-employment and price-stability goals”.  Jerome Powell and other monetary officials have reiterated several times that they want to see a “string” of strong labor reports before major adjustments to policy are considered. The April Job Reports showed only 266,000 jobs added back to the economy, widely missing analyst expectations and marking a sharp deceleration in job growth from March, bolsters that argument.

As the US economy reopens, we are seeing a surge in consumer spending (we saw a 10.8% increase in spending in March), supply is having a hard time catching up to rising demand, which of course, causes a rise in prices. As the economic reopening continues and supply in various consumer industries is able to catch up, inflation is expected to slow down. In a nutshell, this is why Jerome Powell and other monetary officials consistently refer to current inflationary pressures “transitory”.

On a slightly sour note, the meeting minutes also noted “a number of participants suggested” that as the economy continues to quickly, “it might be appropriate at some point in upcoming meetings to begin discussing a plan for adjusting the pace of asset purchase”, which have currently been going at a rate of $120 billion per month. However, this is not a surprising statement and one Powell himself has said before. Back in an April 14 meeting, Powell said, “We will reach the time at which we will taper asset purchases when we have made substantial further progress towards our goals from last December. That would in all likelihood be before, well before, the time we would consider raising interest rates. We have not voted on that order but that is the sense of the guidance.” As a reminder, quantitative easing is a process in which the Fed buys government bonds in order to inject money into the economy. It is only natural that as the economy recovers, less money needs to be injected into the economy in this manner. The Federal Reserve gave absolutely no signal it was even considering beginning discussion on raising interest rates, which is what market participants are really concerned about. [Read the entire meeting minutes here](https://www.federalreserve.gov/monetarypolicy/files/fomcminutes20210428.pdf)

**Highlights**

* Shares of Nvidia (NVDA), one of the leading semiconductor companies, jumped after the company announced a 4-1 split. This means that after the split goes through, every share of  NVDA will become 4 and the price will adjust accordingly.
* In the midst of surging prices, the housing market has begun showing signs of slowing down. Today, the National Association of Realtors showed that existing home sales fell 2.7% in April compared to the month prior. That is well below the expectation of 1% growth and may be a sign the rise in prices may be slowing in the near-term. However, compared to April 2020, existing home sales are up 33.9%.
* Snap (SNAP) said it will acquire WaveOptics, a British Augmented Reality company, for over $500 million. The company has recently been making a big push into the world of wearable AR technology.
* China's internet watchdog said on Friday that companies including ByteDance, Baidu, and Microsoft (MSFT) improperly collected user data in the country.
* Yesterday, the US Department of Treasury announced it was taking steps to crackdown on digital assets by requiring any transfer worth $10,000 or more to be reported to the Internal Revenue Service (IRS)
* China’s Financial Stability and Development Commission, which is chaired by Vice Premier Liu He, released a statement today saying it is necessary to “crack down on digital asset mining and trading behavior and resolutely prevent the transmission of individual risks to the social field.”

“All our dreams can come true, if we have the courage to pursue them.” - Walt Disney",ni2u7c,"Here is a Market Recap for today Friday, May 21, 2021"
234,gyzjb1o,2021-05-21 21:03:49,t1_gyzjb1o,t1_gyzj8k6,StockMarket,Gold does well when markets drop,,
235,gyzjfxi,2021-05-21 21:04:55,t1_gyzjfxi,t1_gyzj8cc,StockMarket,"Ah, good...much easier to grab an ETF.  Thanks.  

I still have a portion that I manage directly, although 70% of my stock holdings are in ETF’s.",,
236,gyzjikl,2021-05-21 21:05:31,t1_gyzjikl,t1_gyz2u6u,StockMarket,"Always aim to be in a position of power. So when prices drop, you pick them up. Also nibble on dips. Don't just throw it all in there. That will keep you ready for any other dips. Once your buying power is completely drain, well, GET BACK TO WORK, HUSTLE or STACKING YOUR CHIPS  UP.",,
237,gyzjk65,2021-05-21 21:05:53,t1_gyzjk65,t1_gyzd3op,StockMarket,"I mean to some extent. But look at what the market is right now. Its a total joke. Theres nothing backing a lot of the high prices on stocks right now. Telsa, gme etc. Its all gambling. At least with crypto it has followed the same exact patterns year after year and its almost impossible to lose money on it. Unless somethibg major happens, which everyone has been saying for a decade lol. Shit Tesla or any other stock could crash like crazy tomorrow.   The whole market is rigged for the rich. Were all just gambling in different ways.",,
238,gyzjoql,2021-05-21 21:06:55,t1_gyzjoql,t1_gyyybw5,StockMarket,I think you need to take a break bud.,,
239,,2021-05-21 21:07:08,t3_ni2x41,,StockMarket,"Title. It's basically a value ETF and I'm wondering if it'd be worth it to sell my VTV (Since I'm up anyway), and buy a growth ETF instead to build upon my portfolio? I have a relatively small ish portfolio. I'm still learning a lot more each and every day and I have a lot of questions from time to time which is why I come here, so apologies for the stupid question. It's really just a simple question in all honesty but... I'm mostly just rambling at this point so I can post due to the minimum character limit. But anyway, what do you think? Thanks for the help.",ni2x41,Should I replace my VTV with a growth ETF or stock?
240,gyzjvzw,2021-05-21 21:08:35,t1_gyzjvzw,t1_gyzhah8,StockMarket,"Depends on the investor, I like to keep some dry gunpowder at hand. I'm not an expert though, so if you're interested I recommend doing some research on the role of cash or cash equivalents in a portfolio, what's a healthy amount etc.",,
241,gyzjzml,2021-05-21 21:09:24,t1_gyzjzml,t3_nhythr,StockMarket,Turn it upside-down to see all the tendies.,,
242,gyzk2q0,2021-05-21 21:10:06,t1_gyzk2q0,t1_gyzjoql,StockMarket,A coffee break :),,
243,gyzk51g,2021-05-21 21:10:38,t1_gyzk51g,t1_gyz6qa1,StockMarket,Just like my asshole after morning coffee,,
244,,2021-05-21 21:11:08,t3_ni3055,,StockMarket,,ni3055,Buy the dip they say....
245,gyzkg76,2021-05-21 21:13:09,t1_gyzkg76,t1_gyzeoe9,StockMarket,"I like that you increased your s&p 500.   This is what i would with passive investing. 

Option 1:  90% SCHD and 10% cash.  Since im a dividend growth investor. 

Option 2 : 90% S&P 500 and 10% Cash 


I personally do not like bitcoin, not saying it will go to zero or go up. I just rather invest in companies.  I dont like gold as an investment since it does not really produce anything.  Again this is my opinion, not saying that you are doing anything wrong.",,
246,gyzkiak,2021-05-21 21:13:38,t1_gyzkiak,t1_gyzerj2,StockMarket,"> Odd. I could have sworn that Bitcoin has added 10+ million users in the last year.

Are you daft or just playing dumb? That's not adoption, that's more people jumping on the bubble. Not one of these people bought bitcoin because they want to use it. They bought it because they want to resell it at a later date to someone else for more. It's called Greater fool theory. Look it up.

https://en.wikipedia.org/wiki/Greater_fool_theory",,
247,gyzkmu7,2021-05-21 21:14:40,t1_gyzkmu7,t3_nhythr,StockMarket,"Even though this meme was right before meme-haven of theweekend began, I didn't see it until the Friday beer was opened.

Therefore, it'll stay. Stop reporting it now. Enjoy the weekend! See you at opening bell!",,
248,gyzksq6,2021-05-21 21:15:58,t1_gyzksq6,t1_gyzkmu7,StockMarket,Oh I’m so sorry I didn’t know memes were only allowed on weekends. I just took the picture right when my coffee did that. Next time I’ll wait.,,
249,gyzkuga,2021-05-21 21:16:20,t1_gyzkuga,t3_nhythr,StockMarket,Turn it 180 and ride the high,,
250,gyzkv9e,2021-05-21 21:16:31,t1_gyzkv9e,t1_gyzk51g,StockMarket,The username checks out :P,,
251,gyzkvkb,2021-05-21 21:16:35,t1_gyzkvkb,t3_nhg5dn,StockMarket,🖕🏾🖕🏾🖕🏾Robinhood,,
252,gyzkwli,2021-05-21 21:16:48,t1_gyzkwli,t3_ni3055,StockMarket,🤣🤣🤣,,
253,gyzky3c,2021-05-21 21:17:08,t1_gyzky3c,t1_gyziuu8,StockMarket,"This is the first I e heard of this- which currency did you choose, if I may ask?",,
254,gyzkz8m,2021-05-21 21:17:23,t1_gyzkz8m,t3_ni1g4b,StockMarket,"Thanks for the post! This guy explained the Greeks very simply. I've read a few books about it, but this the first time I actually get it.",,
255,gyzl1j3,2021-05-21 21:17:52,t1_gyzl1j3,t1_gyzkv9e,StockMarket,It aint my poop if it aint liquid,,
256,gyzl4ge,2021-05-21 21:18:27,t1_gyzl4ge,t3_nhdwpl,StockMarket,"Set a limit order for just above the purchase price for all your underperforming stocks. Once you’ve recouped what you can do much more research before reinvesting and avoid OTC unless you REALLY, REALLY believe in the company.",,
257,gyzl6di,2021-05-21 21:18:51,t1_gyzl6di,t3_nhdwpl,StockMarket,Need to re-evaluate how you pick stocks,,
258,gyzl75i,2021-05-21 21:19:01,t1_gyzl75i,t1_gyxz1c1,StockMarket,Are there ETFs with very small or no fees?,,
259,gyzlad2,2021-05-21 21:19:40,t1_gyzlad2,t1_gyzkg76,StockMarket,"Thanks for the help Any chance you could view my recent post it’s my updated portfolio, tell me what you think cheers!",,
260,gyzlckl,2021-05-21 21:20:07,t1_gyzlckl,t1_gyzkg76,StockMarket,Thanks for the help!!,,
261,gyzlfn5,2021-05-21 21:20:46,t1_gyzlfn5,t1_gyzidat,StockMarket,"it’s personal preference really! Both of these areas are continuously growing, especially now with covid, medicine and tech sectors should grow steadily and are forever advancing so are good sectors to be invested in! I also invest in the NASDAQ as well as S&P.",,
262,gyzlfxz,2021-05-21 21:20:49,t1_gyzlfxz,t1_gyzky3c,StockMarket,"I use GBP witch is the same as the TGBP stable coin, I then stake it for 10% APR",,
263,gyzljld,2021-05-21 21:21:34,t1_gyzljld,t1_gyzkz8m,StockMarket,No problem bud glad you enjoyed the video. That's my channel btw feel free to ask any questions,,
264,gyzlkw3,2021-05-21 21:21:51,t1_gyzlkw3,t1_gyzlfn5,StockMarket,"I do have Nasdaq holdings, but I may just go fully s and p now I’m not sure lol",,
265,gyzln09,2021-05-21 21:22:18,t1_gyzln09,t3_nho5kv,StockMarket,"How much cash-on-hand? 30-50% of your portfolio should be in cash. This will allow you to jump on opportunities, or average down when needed.",,
266,gyzlnjd,2021-05-21 21:22:25,t1_gyzlnjd,t3_ni3055,StockMarket,"Chips you mean TSM, AMD, QCOM, NVDA and INTC? :)",,
267,gyzlon9,2021-05-21 21:22:39,t1_gyzlon9,t1_gyzlkw3,StockMarket,S&P should do you just fine!,,
268,gyzlpnp,2021-05-21 21:22:52,t1_gyzlpnp,t1_gyzljld,StockMarket,I’ll keep that in mind and follow you too. Thanks!,,
269,gyzlruf,2021-05-21 21:23:20,t1_gyzlruf,t1_gyzlon9,StockMarket,Cheers mate,,
270,gyzm16j,2021-05-21 21:25:23,t1_gyzm16j,t3_nhythr,StockMarket,I think it’s in consolidation,,
271,gyzm1nr,2021-05-21 21:25:29,t1_gyzm1nr,t3_ni2mh0,StockMarket,Be interested to know what one EM is referring to / going into.,,
272,gyzm3fj,2021-05-21 21:25:51,t1_gyzm3fj,t3_nho5kv,StockMarket,"Yo man don’t listen to these idiots telling you to just invest in the S&P500. You’re doing a good job diversifying. It is important to branch out to international markets. 

Within US markets you could do some consolidation. It just makes it easier to add contributions down the road and will incur less commission fees (unless you have $0 commission trades). 

I would look into adding some real estate exposure. You can look at VNQ and VNQ ex US.",,
273,gyzm6vs,2021-05-21 21:26:35,t1_gyzm6vs,t1_gyzm3fj,StockMarket,"Cheers, will look into it",,
274,,2021-05-21 21:28:09,t3_ni3cyd,,StockMarket,,ni3cyd,I text my boyfriend after seeing my stocks at the end of the day...
275,gyzmhoq,2021-05-21 21:28:59,t1_gyzmhoq,t3_ni3055,StockMarket,It's my mantra...,,
276,gyzn1km,2021-05-21 21:33:25,t1_gyzn1km,t1_gyys0cb,StockMarket,"Gold actually has utility.  It's used for many industrial purposes and is popular for jewelry.  That being said, I don't like gold either; never have.  Why?  Because something like 60-75% of its demand is purely for investor speculative frenzy with no basis in actual usefulness.

Crypto however takes this ridiculousness to an entirely new level with something that is \*completely\* imaginary with no material quality or usefulness whatsoever.  Someone just decided, ""hey, the dollar sucks, we should make our own supply-limited money by solving this random ass algorithm, and we can become billionaires in the process as the sheep eat it up!""  Greatest pyramid scheme con ever invented!",,
277,gyzn5rs,2021-05-21 21:34:20,t1_gyzn5rs,t1_gyzm6vs,StockMarket,Check out blog posts by lyn Alden. She’s got great macro economic posts and has good wisdom on portfolio allocation,,
278,gyzneal,2021-05-21 21:36:13,t1_gyzneal,t1_gyytbn4,StockMarket,Why so salty bro lol? The split doesn’t change the overall value of the company but most investors can afford multiple shares of $150 (600 / 4) than 1 share of $600. That’s all he was saying,,
279,gyzngs0,2021-05-21 21:36:46,t1_gyzngs0,t3_nhythr,StockMarket,"A doughnut for the dip, duhhhh.",,
280,,2021-05-21 21:39:13,t3_ni3l40,,StockMarket,,ni3l40,"Mormon Church made large profit on GameStop and Tesla stock craze, security filings show"
281,,2021-05-21 21:39:50,t3_ni3ll8,,StockMarket,,ni3ll8,Essex Properties Current Yield and Dividend History
282,gyznvy4,2021-05-21 21:40:07,t1_gyznvy4,t3_ni3055,StockMarket,Will forever have PTSD,,
283,gyznxyr,2021-05-21 21:40:34,t1_gyznxyr,t1_gyz8z2y,StockMarket,Lol so you’re all making your phones into zombies to be used later when you won’t notice? There’s no such thing as a free meal dude you’re gonna get used,,
284,gyzo1x4,2021-05-21 21:41:27,t1_gyzo1x4,t1_gyznvy4,StockMarket,where can i buy that? 😂,,
285,gyzo3c2,2021-05-21 21:41:46,t1_gyzo3c2,t3_ni3l40,StockMarket,Savages like the rest of us,,
286,,2021-05-21 21:41:39,t3_ni3mz8,,StockMarket,,ni3mz8,These Amazing Necklaces are FREE for a Limited Time! Check them out
287,gyzo519,2021-05-21 21:42:08,t1_gyzo519,t1_gytc0dh,StockMarket,"I am also surprised that May didn't even make the list.

I guess because May is a correction month and not a crash month.",,
288,gyzo5p3,2021-05-21 21:42:17,t1_gyzo5p3,t1_gyzo1x4,StockMarket,On the same exchange that sells $ROPE 🤣,,
289,gyzogtl,2021-05-21 21:44:46,t1_gyzogtl,t3_ngj0we,StockMarket,"[ETSY FREE 40 PRODUCTS](https://etsy.me/3cnAwHC) Hello there , Get 40 Free Etsy Listings If You Would Like Open ETSY Shop , you can use my Etsy Referral Link  : etsy.me/3cnAwHC",,
290,gyzoq1o,2021-05-21 21:46:50,t1_gyzoq1o,t1_gywn4mh,StockMarket,"I would suggest you to use Groww then.
It has an easy interface which tells a lot of information about any stock plus i add and withdraw money from it using UPI. 
Use my link (we both get INR 100)
https://groww.app.link/refe/mayank9159109",,
291,gyzot6e,2021-05-21 21:47:34,t1_gyzot6e,t3_nhythr,StockMarket,"Looks like a pump n' dump!

Calls it is! 🚀",,
292,gyzozt4,2021-05-21 21:49:04,t1_gyzozt4,t1_gyzkiak,StockMarket,"As much as crypto enthusiasts don't want to hear it, this is the truth.

Crypto is a fad, and they never last.

No different than beanie babies and multi-colored tulips.

Sooner or later, there will be no more greater idiots, that's when the house of cards comes down.",,
293,gyzpa3v,2021-05-21 21:51:19,t1_gyzpa3v,t3_nhythr,StockMarket,Thats the D.R.I.P,,
294,gyzpahx,2021-05-21 21:51:24,t1_gyzpahx,t3_ni3055,StockMarket,😅😅😹🚀🚀 chitchatting,,
295,gyzpbgd,2021-05-21 21:51:37,t1_gyzpbgd,t3_nhdwpl,StockMarket,"You should use stop market orders to limit your losses. I set them at 25%.

This is why :

This might help you decide.  It becomes increasingly difficult to recover from a loss greater than 20-25%. Certain stocks do recover eventually. 
http://imgur.com/a/fRYqehh",,
296,gyzpdgw,2021-05-21 21:52:04,t1_gyzpdgw,t3_nhythr,StockMarket,If you refer to the dip as the dip then you know the dip will dip. So buy the dip when it has dipped the dip that dipped,,
297,gyzq00x,2021-05-21 21:57:10,t1_gyzq00x,t3_nhythr,StockMarket,Should i sell tesla with loss or hold on for another year ??,,
298,gyzq2rc,2021-05-21 21:57:47,t1_gyzq2rc,t3_ni2x41,StockMarket,"Well of course you can. But instead, why not hold both? Value and growth are a good blend. They sometimes perform conversely to each other which is good for balancing your portfolio’s performance over the long term.",,
299,gyzqhti,2021-05-21 22:01:14,t1_gyzqhti,t1_gyzq00x,StockMarket,I try to avoid very hyped companies as their performance drifts away from any predictable metrics...hype is unpredictable and volatile.,,
300,,2021-05-21 22:03:27,t3_ni432h,,StockMarket,,ni432h,This is what I’m going with
301,gyzquk9,2021-05-21 22:04:13,t1_gyzquk9,t3_ni432h,StockMarket,"Also have 1,100 ALGO",,
302,gyzquwn,2021-05-21 22:04:18,t1_gyzquwn,t3_nhythr,StockMarket,"Coffee futures it is, thanks for the dd",,
303,gyzqv5j,2021-05-21 22:04:22,t1_gyzqv5j,t3_ni432h,StockMarket,Split on Nvidia 4 to 1 😁 thoughts?,,
304,gyzqzyw,2021-05-21 22:05:27,t1_gyzqzyw,t1_gyzqv5j,StockMarket,"Wait till after split and see if it comes down, happens often. I just talked to my buddy about it for 30 min on the phone",,
305,gyzr3g9,2021-05-21 22:06:16,t1_gyzr3g9,t1_gyzquwn,StockMarket,LMFAO also you’re a comedic genius and I missed the chance to play on that,,
306,gyzr7u0,2021-05-21 22:07:19,t1_gyzr7u0,t3_nh4h3r,StockMarket,"Occam's Razor says...

AMC was selling shares to raise money every time their stock got stupid high (14+) because they are getting the most bang for their buck that they can imagine they will get.  The shares they sold put downward pressure on the stock price, causing it to move lower.  AMC stopped selling once the price of its shares got stupid low (like 10, or whatever), and waited until the stock got stupid high again before selling more.

This theory does not require a conspiracy in order for it to be correct, therefore, it probably is correct.

Also, the part about AMC trying to sue, arguing their FMV is the price at the top of a short squeeze seems like a bit of a stretch.

Myself having a business degree and not a law degree... I would say that there is no way for AMC to successfully argue their stock has some FMV that is far higher than what they have been averaging for a long time frame and that they therefore lost some huge figure worth of money they could potentially have had.

Why wouldn't the counterparty to the suit just make the argument that if AMC wanted post squeeze prices on its shares, then AMC could have just sold AFTER the squeeze?  That was something that AMC could have done to mitigate its own loss.   
 That's imminently doable AND it takes the fault away from whoever is doing the shorting.

Again, I don't have a law degree, but if someone isn't mitigating their own loss, then I don't think they have a solid claim.  TMK, damages should be awarded based on damages that AMC tried to mitigate above that which they were actually able to mitigate.  Without AMC trying to mitigate their own loss, the counterparty should be able to successfully argue that there should be no award of any kind to AMC.",,
307,gyzrbaz,2021-05-21 22:08:07,t1_gyzrbaz,t3_ni432h,StockMarket,Also I’m holding 2k cash in tda,,
308,gyzrvf4,2021-05-21 22:12:46,t1_gyzrvf4,t3_ni3055,StockMarket,I'm so full of dip.,,
309,gyzrvpy,2021-05-21 22:12:50,t1_gyzrvpy,t3_nhythr,StockMarket,Those are actually two middle fingers,,
310,gyzrwqk,2021-05-21 22:13:04,t1_gyzrwqk,t3_nhythr,StockMarket,"No, I think you need a vacation",,
311,gyzsugf,2021-05-21 22:20:54,t1_gyzsugf,t1_gynksxm,StockMarket,"It's not ""pure"" DCAing unless you have a lump sum which you then opt not to invest immediately in the entirety.

If you have $500/m (or $100/m or $1000/m or whatever) and you invest all of it every time it is available, that is ""investing all of your available money immediately"", which is the opposite of DCAing.

A lot of people use DCAing the wrong way, to the point that nobody really understands what DCAing actually means anymore.  That doesn't mean the meaning has changed however.

Still, meanings DO change with how people popularly use words, so who knows?  Maybe the official meaning of DCAing is in the process of changing.",,
312,gyzsx41,2021-05-21 22:21:32,t1_gyzsx41,t3_nhythr,StockMarket,Hmm descending wedge that keeps bouncing off support. Expect alot of volatility when it breaks out!,,
313,gyzt4ja,2021-05-21 22:23:16,t1_gyzt4ja,t3_nh289d,StockMarket,I've been preaching these guys for 3 months now. I'm just not seeing why they are being called overvalued and predicted bearish. It's insane.,,
314,gyztlf9,2021-05-21 22:27:13,t1_gyztlf9,t1_gyzqzyw,StockMarket,I think you buy NVDA now it will run up to the split then drop but recover,,
315,gyztltl,2021-05-21 22:27:19,t1_gyztltl,t3_nhdwpl,StockMarket,Everything... just everything,,
316,gyztnh2,2021-05-21 22:27:42,t1_gyztnh2,t3_ni432h,StockMarket,Nice holdings of you hold these long term you will make a decent profit,,
317,gyztp84,2021-05-21 22:28:08,t1_gyztp84,t1_gyn36f8,StockMarket,"What does this company even do?

Plz god don't tell me they are in the business of selling DSL service.

What product is it that you are enamored with?

I am genuinely interested to know what kind of company can consistently burn its investors and still have them be enthusiastic buyers of its stock.",,
318,gyztx1h,2021-05-21 22:29:59,t1_gyztx1h,t3_nghpae,StockMarket,Is this a failed pump and dump attempt?,,
319,gyzujte,2021-05-21 22:35:27,t1_gyzujte,t3_nhythr,StockMarket,Textbook cup and handle pattern,,
320,gyzumke,2021-05-21 22:36:06,t1_gyzumke,t1_gyztnh2,StockMarket,Yes all longs,,
321,gyzuzyl,2021-05-21 22:39:17,t1_gyzuzyl,t3_nhg5dn,StockMarket,Oh so we don't get tricked in to Ponzi schemes like coinbase??? Great news for once,,
322,gyzvm0n,2021-05-21 22:44:33,t1_gyzvm0n,t3_nhythr,StockMarket,Is the cup half full?,,
323,gyzvmgf,2021-05-21 22:44:39,t1_gyzvmgf,t1_gyyybw5,StockMarket,You should def buy more fresh cream... not sure about the dip😉,,
324,gyzvwy4,2021-05-21 22:47:11,t1_gyzvwy4,t3_ni3055,StockMarket,buy chips... i get a backflash for the chip shortage in car industry which caused serious dips,,
325,gyzw51c,2021-05-21 22:49:08,t1_gyzw51c,t3_nhythr,StockMarket,Get to work Roscoe!,,
326,gyzw79t,2021-05-21 22:49:39,t1_gyzw79t,t3_ni1g4b,StockMarket,Great vid! Positions?,,
327,gyzwrsv,2021-05-21 22:54:36,t1_gyzwrsv,t3_ni432h,StockMarket,"I would drop all of it and go all in on FUNFF for 1000% gain in 1 year, set a reminder if needed. GL!",,
328,gyzwvd9,2021-05-21 22:55:28,t1_gyzwvd9,t1_gyzb5qj,StockMarket,"The dip was on the 5th and 13th for most. If you want to do a FOMO, Monday/Tuesday would be a good peak to ride down.",,
329,gyzwwge,2021-05-21 22:55:45,t1_gyzwwge,t1_gyzwrsv,StockMarket,Is this a joke..,,
330,gyzwxwx,2021-05-21 22:56:06,t1_gyzwxwx,t1_gyxys79,StockMarket,"Basically you should be yoloing on high risk investments mainly. 

This is not financial advice",,
331,gyzx70r,2021-05-21 22:58:17,t1_gyzx70r,t1_gyzw79t,StockMarket,"I currently am balls deep in $ATOS calendars. Front month July, back month January. With patience you can get tons of the $2.5 & $3 for like .20. It's like $20 risk for $100 profit. Iron condor on MVIS 10/12 & 15/17 and $25C $PAVE calls",,
332,gyzx8yx,2021-05-21 22:58:47,t1_gyzx8yx,t1_gyzwwge,StockMarket,"It isn’t actually, I made a boat load on the last run from 0.3 to 2$, and the cycle is about to start again, nothing has changed fundamentally since it lost value, and since OP is interested in e-gaming companies it’s a much better pick than GNOG. I lost a boat load on GNOG and the stock isn’t going anywhere and won’t be for a while.",,
333,gyzx9cw,2021-05-21 22:58:53,t1_gyzx9cw,t1_gyzo5p3,StockMarket,"Calls on PTSD. 

PUTS on ROPE.",,
334,gyzxalj,2021-05-21 22:59:11,t1_gyzxalj,t3_nhythr,StockMarket,You ARE the dip!,,
335,gyzxeie,2021-05-21 23:00:09,t1_gyzxeie,t1_gyzjvzw,StockMarket,Usually 5% cash is a good practise.,,
336,gyzxiob,2021-05-21 23:01:10,t1_gyzxiob,t1_gyznvy4,StockMarket,I'm all in on $PTSD,,
337,gyzxkz7,2021-05-21 23:01:44,t1_gyzxkz7,t1_gyzx70r,StockMarket,Any reasons for ATOS specifically?,,
