,comment_id,created,fullname,parent_id,subreddit,text,post_id,title
638,,2021-05-20 01:49:50,t3_ngnide,,investing,"New Investor - Everything I've read says to buy a mutual fund with low expense ratios as the fees add up and you compound more money with lower fees. 

While I understand and agree with the previous statement, I am conflicted. When comparing a fund with a 0.015% expense ratio vs one with 0.7%, the fund with higher expense ratio comes out ahead when it out performs the lower expense ratio fund by 0.625%. 

When looking at Fidelity mutual funds it appears that most funds with a higher expense ratios out perform ones with lower expense ratios by significantly more than 0.625%. Examples:

&#x200B;

**Fidelity 500 Index Fund (FXAIX):** 

\-Expense ratio 0.015%, 1yr +45.97%, 5yr +23.41%, 10yr +14.16%

**Fidelity Select Software and IT Services Portfolio (FSCSX)**

\-Expense ratio 0.7%, 1yr +51.28%, 5yr +28.61%, 10yr +21.23%

&#x200B;

In this example, and in several higher expense ratio mutual funds I looked at, it appears beneficial to pay the higher expense ratio. I do know I'm not accounting for risk here but, being youngish, I am not too worried about it at this point. I also understand the 1 year growth is a bad marker of growth due to the COVID.

What am I missing? Is there a better r/ for this discussion?",ngnide,Mutual Funds - Does Expense Ratio Matter??
639,,2021-05-20 09:00:11,t3_ngv55o,,investing,"If your question is ""I have $10,000, what do I do?"" or other ""advice for my personal situation"" questions, you should include relevant information, such as the following:

* How old are you? What country do you live in?  
* Are you employed/making income? How much?  
* What are your objectives with this money? (Buy a house? Retirement savings?)  
* What is your time horizon? Do you need this money next month? Next 20yrs?  
* What is your risk tolerance? (Do you mind risking it at blackjack or do you need to know its 100% safe?)  
* What are you current holdings? (Do you already have exposure to specific funds and sectors? Any other assets?)  
* Any big debts (include interest rate) or expenses?  
* And any other relevant financial information will be useful to give you a proper answer.  

Please consider consulting our FAQ first - https://www.reddit.com/r/investing/wiki/faq
And our [side bar](https://www.reddit.com/r/investing/about/sidebar) also has useful resources.  

Be aware that these answers are just opinions of Redditors and should be used as a starting point for your research. You should strongly consider seeing a registered financial rep before making any financial decisions!",ngv55o,Daily Advice Thread - All basic help or advice questions must be posted here.
640,,2021-05-20 09:01:09,t3_ngv5u5,,investing,"Have a general question?  Want to offer some commentary on markets?  Maybe you would just like to throw out a neat fact that doesn't warrant a self post?  Feel free to post here! 

This thread is for: 

* General questions
* Your personal commentary on markets
* Opinion gathering on a given stock
* Non advice beginner questions

Keep in mind that this subreddit, and this thread, is not an appropriate venue for questions that should be directed towards your broker's customer support or google.  

If you would like to ask a question about your personal situation or if you are asking for advice please keep these posts in the daily advice thread as that thread is more well suited for those questions.

Any posts that should be comments in this thread will likely be removed.",ngv5u5,"Daily General Discussion and spitballin thread - May 20, 2021"
641,,2021-05-20 14:28:23,t3_nh1ol9,,investing,"https://dronedeliverycanada.com/resources/drone-delivery-canada-selected-by-ubc-for-remote-communities/

Drone Delivery Canada Corp. (TSXV: FLT; OTC QX: TAKOF; Frankfurt:  A2AMGZ or ABB.F) (the “Company” or “DDC”) is pleased to announce that, with the assistance of its sales agent Air Canada  (TSX: AC), it has been selected by the University of British Columbia (“UBC”) to deploy DDC’s patented drone delivery solution at the Stellat’en First Nation, for UBC’s “Remote Communities Drone Transport Initiative” program.

 

The project will enable defined-route deliveries utilizing DDC’s Sparrow drone and its DroneSpot® takeoff and landing zones as well as additional drone flight infrastructure as required.  The solution will be used to transport a variety of cargo for the benefit of the Stellat’en First Nation, located in the Fraser Lake area of Central Northern British Columbia, Canada.

 

DDC and UBC will work towards finalizing a definitive agreement shortly.  DDC is expected to commence deployment of site infrastructure summer of 2021 and expects to begin providing drone delivery services under the agreement in the second half of 2021. The drone project term is expected to be 12 months. This deployment will be DDC’s fourth First Nations project and its first in British Columbia.

 

All operations will be conducted in accordance with appropriate Canadian regulations. Flights will be remotely monitored by DDC from its Operations Control Centre located in Vaughan, Ontario.

 

“We look forward to working with Drone Delivery Canada and all partners on this project for the benefit of the Stellat’en First Nation.  Many First Nations communities in B.C. are on lockdown to reduce transmission of COVID-19, which has exacerbated inequitable access to health care supplies and services, ranging from personal protective equipment and medications to laboratory services such as COVID-19 testing and diagnostics for other medical conditions,” said Dr. Michael Allard, Vice-Dean, Health Engagement & Partnerships, UBC.

 

“Based on the isolated location of our community and the needs of our residents, drone transport may enhance our access to COVID-19 testing and medication without traveling and endangering other members of our community,” said Chief Robert Michell of the Stellat’en First Nation, located about 100 kilometres west of Prince George. “The futuristic potential of this initiative is exciting. With drone technology, there is so much you can do.”

 

“We are pleased that UBC has chosen Drone Delivery Canada as part of their ‘Remote Communities Drone Transportation Initiative’ at the Stellat’en First Nation. The UBC Faculty of Medicine is a recognized global leader and we applaud their initiative to embrace drone delivery to benefit First Nations communities. As an award-winning global leader, DDC is pleased with our continued business successes in the drone delivery industry,” said Michael Zahra, President & CEO of DDC.",nh1ol9,Drone Delivery Canada selected by UBC for remote communities delivery initiative
642,,2021-05-20 14:56:13,t3_nh2dd4,,investing,"In terms of investing as a long term buy to hold asset. I mean I don’t understand how trading in silver works at any macroeconomic level or within the precious metal industry for commercial and industrial use, But I see that Silver Bullion is also available to retail investors but I literally just cannot understand why any small personal investor would want to buy silver bullion when gram for gram there is the far more efficient option of gold?",nh2dd4,What exactly is the point in investing in Silver Bullion?
643,gzjv933,2021-05-26 19:33:06,t1_gzjv933,t1_gzb7kp1,investing,But her returns historically have been far far bigger...,,
644,gzjv9lp,2021-05-26 19:33:12,t1_gzjv9lp,t1_gzjpp64,investing,We shall see what you say when you pay $5 a gallon for gas.  The food you eat that is in plastic containers go up in price.  Pharmaceuticals go up.  Tires on your car.  Petro is in a lot of stuff.,,
645,gzjvf7c,2021-05-26 19:34:18,t1_gzjvf7c,t1_gzitr5w,investing,"HBO Max is my go-to anymore.

Netflix wins on quantity sure, but my god the quality...",,
646,gzjvfrc,2021-05-26 19:34:24,t1_gzjvfrc,t1_gzjup2n,investing,Sides are for karma!,,
647,gzjvi5v,2021-05-26 19:34:51,t1_gzjvi5v,t1_gzawxo8,investing,Buffet returns are just SPY. He has greatly underperformed the QQQ because he is an old man who doesn't understand tech. There is a good reason people don't invest with him anymore.,,
648,gzjviqj,2021-05-26 19:34:58,t1_gzjviqj,t1_gzj1ya6,investing,"It's not since you have to factor in internet costs. While you can have cable with no internet who's really doing that, plus it's cheaper to have a cable/internet bundle",,
649,gzjvn32,2021-05-26 19:35:47,t1_gzjvn32,t3_nli79t,investing,Can't wait to stay in the Amazon Prime Grand Hotel on the strip!,,
650,gzjvqyr,2021-05-26 19:36:32,t1_gzjvqyr,t1_gzjt0re,investing,"Is that the Bloomberg columnist? 

I thought it was pretty common sense - if BlackRock is holding real estate, especially prime real estate in coastal cities like NYC, LA, etc, climate change would threaten the value of those assets

If BlackRock owns insurance companies and fire insurance has been getting more difficult due to more wildfires, that just means insurance companies will lose money on more and more wildfires etc",,
651,gzjvrqz,2021-05-26 19:36:41,t1_gzjvrqz,t1_gzid8hh,investing,"What are your thoughts (and the group's) on Stellantis (STLA)? They don't execute (right now) like TM, but they have a talented CEO that really helped Opel and they are based in one of the hubs of EV acceptance, the European Union. This should help them from a government support standpoint (EU governments need the jobs and manufacturing base) and development of EVs.",,
652,gzjvtxh,2021-05-26 19:37:05,t1_gzjvtxh,t1_gzjvrqz,investing,Plus they have a really low PE of around 6.,,
653,gzjvy3q,2021-05-26 19:37:51,t1_gzjvy3q,t3_nloa75,investing,"Don't cheer too hard without thinking about what really happened here.  Blackrock,  State Street,  and Vanguard together almost own a controlling stake in every company.   That's considered illegal anti competitive for everyone else,  but they just have ETF index funds,  they aren't using that power to make the companies compete less, except that's exactly what just happened here.  

The other oil companies were moving away from oil, XOM wasn't and was going to take that market share, Blackrock punished them for it.  You may like the result in this case, but it's dangerous to have that much power in just a few people and you might not like the result next time. 

Matt Levine often uses the example of airlines.   The idea is If they all started raising prices and flying less often and one holdout was going to keep prices low and fly more,  you could imagine the same result. 

Risk is either we (the consumer or worker) will pay more,  and be paid less, or perhaps the politicians decide this is bad and we lose the ability to buy low fee index ETFs.",,
654,gzjw17z,2021-05-26 19:38:26,t1_gzjw17z,t1_gzjv7uk,investing,which part is untrue?,,
655,gzjw1eh,2021-05-26 19:38:28,t1_gzjw1eh,t3_nllsm8,investing,It will take time to find out how manager of T will handle the deal. Assuming the deal goes through.,,
656,gzjw2c3,2021-05-26 19:38:39,t1_gzjw2c3,t1_gzjs3rj,investing,"I think you'd be wrong then. There are a lot of people who want to gamble with it. Look at how many people trade crypto. Look at how many people do sports betting. Look at the number of WSB subscribers. Look at how many people trade all the non-squeeze meme stocks.

Why is that hard to believe? Everything isn't some dumb conspiracy.

Obviously market makers do *trade* GME with algos, but a lot of that is just gamma hedging.",,
657,gzjw2ui,2021-05-26 19:38:45,t1_gzjw2ui,t1_gzianlq,investing,"But why would they make it up?   


Any chemist familiar with the fuel they use could easily dispute their numbers.",,
658,gzjw5p1,2021-05-26 19:39:19,t1_gzjw5p1,t1_gzjpp64,investing,You can do both.  I started a tree farm/managed forest business a few years ago and will be working on incorporating green energy as we start planning a new building.  That's what these companies need to learn...you can make money and actually improve the environment at the same time.,,
659,gzjwg18,2021-05-26 19:41:19,t1_gzjwg18,t1_gzjrg41,investing,Let me hate,,
660,gzjwibl,2021-05-26 19:41:46,t1_gzjwibl,t1_gzjsqsu,investing,"The biggest issue I see is sunk costs in legacy assets and operations. 

Even if Exxon mobil wanted to go 100% green tomorrow, they have so many existing assets and refineries etc geared towards oil that they essentially have to cannibalize their own business.

No one would logically want to cannibalize their own business - that’s why the market has to cannibalize it for them and that’s the only way they will change due to market pressure. 

So I agree with your point.

I think realistically the best way to transition a company like Exxon Mobil to clean energy would be for the government to give them some kind of financial incentive to sell off their refineries and other assets that would be obsolete in exchange for 100% transition to clean energy.

And to your point about mixes, maybe it would make sense for them to invest as passive investors into seed companies or emerging green companies and just sit back and let others do the work of green energy while just supplying the capital for it.",,
661,gzjwkhi,2021-05-26 19:42:11,t1_gzjwkhi,t3_nlpma6,investing,"Your submission was removed because it is a short post. Any self-post below 400 characters in the body will be removed.  Please refer to rule 6 and make sure your post meets our standards of effort. Automod evasion will be met with a lengthy ban. Do not post just an article; highlight the parts of the article you find relevant or offer some commentary surrounding the article. Self-posts that offer some simple thoughts or questions like ""what do you think"", ""here's my thoughts"", etc. belong as comments to existing posts or the [Daily Advice Thread](https://www.reddit.com/r/investing/about/sticky?num=2).

*I am a bot, and this action was performed automatically. Please [contact the moderators of this subreddit](/message/compose/?to=/r/investing) if you have any questions or concerns.*",,
662,gzk2ext,2021-05-26 20:22:42,t1_gzk2ext,t3_nlccgx,investing,"Hello,

General questions here. If I invest all my assets inside one broker (ie Merrill lynch) and Merrill lynch goes bankrupt do I lose all my money?  
Should I not only be diversifying my investment vehicles (stocks, bonds, mutual funds etc) but also diversifying the broker as well?  (ie 1/4 into vanguard, 1/4 into Merrill lynch, 1/4 into robothood etc) or does it not work like that?  
Also will the above situation impact investment vehicles. For example, if i want to buy an Vanguard S&P 500 index fund inside my Merrill lynch broker acct, should I also be buying a Merrill Lynch S&P 500 index fund incase something happens to vanguard company etc?  
Thx for the help",,
663,gzk2f41,2021-05-26 20:22:44,t1_gzk2f41,t1_gzj0jog,investing,Better a dumb AI than dumb humans on the road. They'll reach a point where self driving is much safer than actually driving. You can also still keep your hands on the wheel as well.,,
664,gzk2f6i,2021-05-26 20:22:44,t1_gzk2f6i,t3_nli79t,investing,Monopoly....SEC shut it down please. Getting over conglomerates.  Just pay your employees more with all of that FCF,,
665,gzk2ila,2021-05-26 20:23:25,t1_gzk2ila,t1_gzk0c5v,investing,"Ah ok, so it's about focusing on immediate demand rather than future-proofing the business and mitigating climate impact. Seems a little myopic. But then, I guess that was the point of having this people appointed to the board.",,
666,gzk2j5r,2021-05-26 20:23:31,t1_gzk2j5r,t1_gzk2511,investing,Sometimes you gotta vote with your feet,,
667,gzk2nyq,2021-05-26 20:24:29,t1_gzk2nyq,t1_gzjp4wc,investing,"I see Pelotons best way forward as their products becoming the smart platform for health the same way apple used the iPhone. A lot of potential money in health data, especially if you can monitor it and improve it (reducing insurance costs, etc.). PTONs value is in the 'elite' feel of the product. If I were them I would look at buying out Strava (cheap social media platform already geared towards cycling) to try and dominate running/cycling both in terms of spin classes and outdoors cycling/running. I'd also open storefronts/classes with brick and mortar - think joining forces with Equinox to maintain brand image - and continue being something that makes people feel good about how they look AND superior.

&#x200B;

As of now it's just a fad bike. Fad exercises are a dime a dozen. And nothing is stopping it from becoming the next expensive piece of workout equipment (this generations boflex). Peloton needs to not stand for stationary bikes but high end fitness , similar to how Apple was once synonymous with desktop computers , then ipods / music, then phones. But I dont believe anyone at PTON is the visionary that Jobs was, and have seen nothing from their leadership to indicate anything other than overpriced work out bike that got lucky with a pandemic",,
668,gzk2vxk,2021-05-26 20:26:03,t1_gzk2vxk,t1_gzjynqq,investing,"I think that’s good advice, and it’s definitely a direction I’m taking my portfolio. And to be clear- my line of thought about leveraged ETF’s wasn’t about sucking short terms gains out of these relatively flat few months, it was more about looking at it as a means of magnifying gains over 40-50 years with an ironclad no-sell policy. 

My takeaway from the comments as a whole, and further reading suggests that entering a leveraged ETF position to hold might be a very good idea if you wait for a major correction and get in then. And even then, it’s only a good part of a balanced breakfast of other etf’s, commodities, and well-picked companies.",,
669,gzk2w59,2021-05-26 20:26:06,t1_gzk2w59,t3_nli79t,investing,did the Bond franchise win the argument over theatre releases & Bond not appearing in spin-offs?,,
670,gzk30ph,2021-05-26 20:26:59,t1_gzk30ph,t3_nli79t,investing,"There’s a bundle option that’s I think is 14.99 for Disney + , Hulu and ESPN +

Amazon prime is included if you have a prime subscription. 

HBO max had a 6 month for $69.99 special at beginning of this year 

Peacock has a free option, that provides access to content, but if you want full access (example: all the seasons of the office) you need to upgrade.  Free version will only get you a limited amount of episodes or seasons depending on the show.  

So there’s definitely ways to cut your costs down.  I always recommend buying the long term deal if there’s an option.  I personally purchased the HBO max deal above to take advantage of watching all the movies Warner bros was releasing there. Saved me about $20 that pretty much cover 1 month of Disney+ bundle and partial amount of 1 month of Netflix costs lol.",,
671,gzk334u,2021-05-26 20:27:27,t1_gzk334u,t3_nloa75,investing,Fantastic.,,
672,gzk34s0,2021-05-26 20:27:46,t1_gzk34s0,t1_gzj9hix,investing,"This is a great analysis - yours? I’m familiar with the myth, and its interesting to look at the vol drag in context of markets that just keep rising. My guess is that the vol will ultimately get you in sideways markets.",,
673,gzk3bde,2021-05-26 20:29:03,t1_gzk3bde,t3_njy53z,investing,My issue is that their website and mobile site (pro.coinbase.com) both suck.,,
674,gzk3gl1,2021-05-26 20:30:03,t1_gzk3gl1,t3_nlcd30,investing,Should I dump Shell stock?,,
675,gzk3gq2,2021-05-26 20:30:05,t1_gzk3gq2,t1_gzg5ihx,investing,"Interested to hear feedback on this as well.  

I paid off my home in 2016 (225k or so) and I feel like it was a waste, because my home is barely worth more than it was 5 years ago.  If I had invested the money in the market the returns would've blown away the interest expenses on a loan.  I was better off preserving my capital and DCA into the market.  That's just me though - I'd rather leverage debt to preserve capital in the even of big market dips.",,
676,gzk3kgw,2021-05-26 20:30:49,t1_gzk3kgw,t1_gzk206z,investing,"Thats a pretty big stretch. Obviously a cigarette company is going to lie about something that would ruin their entire industry. Whereas Virgin would be just fine if they were major polluters or not. The billionaires paying to fly the space for fun could care less about how much CO2 is being emitted per flight.  


> Wouldn’t scientists/doctors/whoever just be able to dispute them?

Uh yes, scientists/doctors/etc did dispute them and thats how we learned the truth...

&#x200B;

>Do we know the exact quantities of fuel they use?

I'm sure people who have a background in this type of research can make a reasonably accurate estimate if anyone had serious doubts about their claims. Nobody seems outraged or surprised by their claims though, so I dont see why I should be.  


>The exact admixture of ingredients?

Sure, why not? Its not like Virgin invented some new type of fuel. They use a mixture of nitrous oxide and HTPB, like several other companies and countries that build and launch rockets. 

&#x200B;

>Taking a two sentence blurb from the president of the company as genuine fact is, I’m sorry, pretty dumb.

I agree completely. I'm just saying, you're making a mountain out of an ant hill. They don't really have any reason to lie about such a minor thing. Do you really think their business would suffer significantly if they emitted more CO2 or any other pollutant?",,
677,gzk3l12,2021-05-26 20:30:55,t1_gzk3l12,t1_gzig3xb,investing,Commenting so I can come back to this 😂,,
678,gzk3v88,2021-05-26 20:32:56,t1_gzk3v88,t1_gzjmm3d,investing,">	Do you think it’s impossible to have a democratic society paired with public ownership?

Generally to enforce the “public good” necessarily requires a concentration of power because it’s impossible for everyone to agree on what is “good for the public”. Enforcement of the public good has been a huge sticking point of collectivist philosophies throughout history and that is not unique to Marxism (i.e. French Revolution). But democratic socialism has so many flavors I would need to know which philosophical strain strain we’re talking about.

>	Everything else you described has nothing to do with farming and everything to do with private ownership of land. 

I know farming as root cause of class struggle isn’t a mainstream argument but I literally have not found one agricultural based society throughout history that has mitigated the exploitation of people. I ask because I’m looking to poke a hole in my argument. 

>	What if there never were any kings (people that own all the land)?

This was how we lived for a couple hundred thousand years, and humans did not live in peace with one another. We banded into tribes and there was a constant struggle for resources, not a sharing of resources (the tribal struggle?). If you think about it on a biological level humans compete for 100% of the same resources as other humans. Why should I let you have access to the best land with the most food and the hottest chicks if I am as entitled to it as you are? The tribal societies were pretty much all conquered by agricultural societies. 

>	Privatisation is what leads to class struggle. Nothing else

A problem with disbanding our kingdom and giving everything back to the people is then who will stop the kingdom next door from taking over our land? This is the impossible dilemma of democratic socialism - I’ll give you the land back AND protect you from your neighbors AND do it equally There is an inherent instability in this equation that will necessarily lead to a concentration of power. A stable system needs checks and balances to power. 

And all this is to say that I do not think capitalism and democracy is a perfect system, but I do think it’s the best of all the bad systems we’ve come up with so far.",,
679,gzk3ygv,2021-05-26 20:33:33,t1_gzk3ygv,t1_gzk2ila,investing,"Business shouldn’t have as objective to exist indefinitely. A company objective is to provide returns to its shareholders and sometimes it does that by stopping operations. 

If it’s so important for the shareholders that Exxon invests in renewables then they’ll be best served by investing their dividends in companies that are dedicated to renewables and that have a competitive advantage in this sector, unlike Exxon.",,
680,gzk3yik,2021-05-26 20:33:34,t1_gzk3yik,t3_nlkofd,investing,It can go to 0 much easier than a non leveraged etf.,,
681,gzk3zim,2021-05-26 20:33:46,t1_gzk3zim,t1_gzjzmf7,investing,It’s the kind of thing that my dick thinks it wants and my brain absolutely does not want,,
682,gzk449n,2021-05-26 20:34:43,t1_gzk449n,t1_gzjwr3x,investing,It makes no sense for their business to have many recurring customers who just accumulate bears and clothes for bears.,,
683,gzk450p,2021-05-26 20:34:51,t1_gzk450p,t3_nloa75,investing,Fiduciary duty was sacrificed to the ESG gods.,,
684,gzk471z,2021-05-26 20:35:15,t1_gzk471z,t1_gziot3g,investing,I still don't understand why seasons of a show would be listed separately...do the employees never use it?,,
685,gzk4ad1,2021-05-26 20:35:54,t1_gzk4ad1,t1_gzju4qu,investing,HBO has been around for nearly 50 years. I'm sure those ads are coming any day now.,,
