,comment_id,created,fullname,parent_id,subreddit,text,post_id,title
0,gzhxdww,2021-05-26 10:24:14,t1_gzhxdww,t3_nl3ne2,investing,"Shipping goods with clean fuels, maybe. Idk if that's a good answer but I'll throw it out there anyway.",,
1,gzhxg16,2021-05-26 10:25:00,t1_gzhxg16,t1_gzh3iwe,investing,Yeah they rebounded much faster than anticipated,,
2,gzhxh7m,2021-05-26 10:25:27,t1_gzhxh7m,t1_gzecawl,investing,It is although risky cause some of the companies are in deep debt.,,
3,gzhxh9q,2021-05-26 10:25:28,t1_gzhxh9q,t3_nl3ne2,investing,"The Italian airforce are paying €600k a seat to train their pilots.
Nasa are using the flights to record data.
There’s lots possible revenue streams besides selling seats to the public.",,
4,gzhxhkm,2021-05-26 10:25:35,t1_gzhxhkm,t3_nl640m,investing,Dude you got yourself into a badddddddd situation. Your buyer played you.,,
5,gzhxj66,2021-05-26 10:26:10,t1_gzhxj66,t3_nldmpt,investing,"Your [submission](https://www.reddit.com/r/investing/comments/nldmpt/uvxy_what_is_going_on_help_me/) in /r/investing was automatically removed because your account has insufficient Karma. Users can earn Karma by commenting on existing threads.

*I am a bot, and this action was performed automatically. Please [contact the moderators of this subreddit](/message/compose/?to=/r/investing) if you have any questions or concerns.*",,
6,gzhxkvs,2021-05-26 10:26:50,t1_gzhxkvs,t1_gzgy3xy,investing,He doesn’t own the accounts receivable.,,
7,gzhxnvl,2021-05-26 10:27:59,t1_gzhxnvl,t1_gzguym7,investing,"They seem to block more than just new ETFs. That forum I linked was from 2019, and the Avantis ETFs I want are still blocked.",,
8,gzhxz2p,2021-05-26 10:32:10,t1_gzhxz2p,t3_nl3ne2,investing,They aren’t. Never have been and never will be.,,
9,gzhy0uk,2021-05-26 10:32:49,t1_gzhy0uk,t1_gzgl3bh,investing,"Oh ok, and a slice is an individual stock/fund/ETF, right?",,
10,gzhy1ni,2021-05-26 10:33:07,t1_gzhy1ni,t3_nl3ne2,investing,"Good morning contrarians!

Futures are a bit higher this morning: Dow, S&P, and Nasdaq all up about 0.3% as of 0620. Yesterday things were flat after a rally earlier in the day stalled.

Bond yields are ticking a bit lower. 10-year down to 1.569, perhaps an indication that investors are less worried about inflation. Disappointing new home sales yesterday likely contributed to that. The VIX is down to about 20, but not sure if that really means anything anymore.

There just isn’t that much to move markets today. Couple Fed speeches. Bank CEOs will testify before a joint session of Congress. Some earnings, but mostly not until after the close: Dick’s Sporting Goods, Abercrombie & Fitch, American Eagle Outfitters, NVIDIA, Snowflake.

Pandemic reopening names and meme stocks are doing well, along with cryptos. This indicates a healthy appetite for risk taking.",,
11,gzhyd2l,2021-05-26 10:37:18,t1_gzhyd2l,t3_nlccgx,investing,"I'm looking to get into passive investing with Vanguard and the S&P 500 fund, putting in $1k per month. I only have $1k now, which is below the $3k minimum for the admiral share, so would it make sense to start investing in the ETF version, then transfer over to the mutual fund?",,
12,gzhyf5r,2021-05-26 10:38:04,t1_gzhyf5r,t3_nl640m,investing,Bet this guy is fake and we never hear from him again. See his other posts.,,
13,gzhyhfn,2021-05-26 10:38:53,t1_gzhyhfn,t1_gzfo7ex,investing,"Yeah very interesting. So it seems to be a philosophical disagreement. These ETFs are ""active"" and therefore dangerous.",,
14,gzhykqy,2021-05-26 10:40:06,t1_gzhykqy,t1_gzhqifo,investing,Where the women flock like the salmon of Capistrano.,,
15,gzhyl19,2021-05-26 10:40:13,t1_gzhyl19,t1_gzht52d,investing,ELI5 = Explain It Like I’m 5,,
16,,2021-05-26 10:42:25,t3_nldvyr,,investing,"Hi, i am a 16 year old and love finance.

I am currently still learning about finance, but i have a few questions in mind.

How should i invest my money i will get from paychecks and savings? (currently looking for jobs)

What investments should i focus on, like stocks, index funds, crypto or mining? My friend mines ethereum and makes 45 dollars everyday, but the miner costed him 10k. So if i calculate it correctly his ROI will break even in 8 months. I dont know if mining crypto is worth it, but it seems really cool and fun. Please tell me about your experiences.

What books, videos etc to learn about financial literacy. Marketing, strategies, and so on. I have read rich dad poor dad. 

What are some ways to make passive income, that are worth it and not very hard to set up. I heard about afiliate marketing and e commerce and rental income but that wont be happening anytime soon. 

If i start doing e commerce or sell on Amazon fba is it profitable, is it hard? Because i watch alot of youtube videos of dropahippers making 100k a month. Ifk if its bs, because everyone on yt magicslly makes 100k a month from this business. 

Also, i am going to become a electrician or automatician i think, so ill make 50k a year with no debt.

Thank you for taking your time reading this",nldvyr,Iam 16 years old and how should i invest my money?
17,gzhyr2w,2021-05-26 10:42:26,t1_gzhyr2w,t3_nldvyr,investing,"**Hi, welcome to /r/investing. Please note that as a topic focused subreddit we have higher posting standards than much of Reddit:**

**1)** Please direct all **advice requests and beginner questions to the stickied daily threads.** This includes beginner questions and portfolio help.

**2) Important: We have strict political posting guidelines** (described [here](https://www.reddit.com/r/investing/comments/cyee69/formal_posting_guidelines_for_political_topics/) and [here](https://www.reddit.com/r/investing/comments/escewo/temporary_rule_change_what_happens_to_stocks_if/)). Violations will result in a likely 60 day ban upon **first instance.**

**3)** This is an open forum but we expect you to conduct yourself like an adult. Disagree, argue, criticize, but **no personal attacks.**


*I am a bot, and this action was performed automatically. Please [contact the moderators of this subreddit](/message/compose/?to=/r/investing) if you have any questions or concerns.*",,
18,gzhysqi,2021-05-26 10:43:03,t1_gzhysqi,t1_gzftdmu,investing,"Thanks, I'll add those to my list to look in to",,
19,gzhytyu,2021-05-26 10:43:29,t1_gzhytyu,t1_gzh2tj4,investing,Why Ethereum instead of any of the other many crypto platforms?,,
20,gzhz0d9,2021-05-26 10:45:49,t1_gzhz0d9,t1_gzg1gb4,investing,"I opened a Schwab account, I'm gonna see how that feels for a month or so and then decide if I'm transferring to them. I don't at all like feeling this restricted.",,
21,gzhz3n3,2021-05-26 10:46:59,t1_gzhz3n3,t1_gzg6ii0,investing,"True but they allow iShares' IJS which is a US small cap value ETF, so doubt it's the factor investing that turns Merrill off.",,
22,gzhz4fl,2021-05-26 10:47:17,t1_gzhz4fl,t3_nlcd30,investing,"What are your thoughts on SFT, I was pretty bullish until they took on that additional debt but the fundamentals look pretty strong. Guess maybe I am second questioning lol.",,
23,gzhz6ah,2021-05-26 10:47:57,t1_gzhz6ah,t1_gzguzfd,investing,"There's one person in these comments saying Fidelity blocks ETNs. Besides that, yeah I'm hearing good things about them.",,
24,gzhzbl9,2021-05-26 10:49:51,t1_gzhzbl9,t3_nldvyr,investing,The intelligent investor is a good book on investing.,,
25,gzhzdmr,2021-05-26 10:50:34,t1_gzhzdmr,t3_nldvyr,investing,If you're interested in college you may be interested in a 529 plan,,
26,gzhzimx,2021-05-26 10:52:22,t1_gzhzimx,t1_gzh4jmi,investing,"Yeah, I sure hope OP made the sale with a lawyer.",,
27,gzhzm6y,2021-05-26 10:53:39,t1_gzhzm6y,t1_gzgzqdi,investing,The sale experience might be all the OP gets. Christ,,
28,gzhzpt2,2021-05-26 10:54:54,t1_gzhzpt2,t1_gzh67re,investing,Both,,
29,gzi01yi,2021-05-26 10:59:10,t1_gzi01yi,t1_gzhbwsx,investing,"The SpaceX business model and Virgin Galactic model are not the same at all.

Also you don't have to look very far in the field to see how quickly you can be in a state of financial instability as Blue Origin is seeking a $10B bailout",,
30,gzi02bn,2021-05-26 10:59:18,t1_gzi02bn,t3_nldvyr,investing,"Good luck,  you'll get some good advice from others here on investing,  so I'm going to give you different advice.  Starting early is a great way to be able to retire financially comfortabe,  but , go hang out with some old people.   They generally have enough money,  but old age sucks.  Enjoy being young,  take your money and spend it on experiences you aren't going to do when you're older. 

My next door neighbor has been dreaming about hiking the Appalachian trail for years,  bought all the expensive super lightweight gear too, but he didn't find the time,  now he's happily married and has a one year old kid.  He's got too many responsibilities to go hiking for a month.  When the kid is grown and moved out,  he's not going to be in shape for that kind of hike.   Reality sucks too.  

Go have fun now, you might have less money when you're old, but when you're old all you will do with money is use it to buy stuff for your grandkids.",,
31,gzi06vq,2021-05-26 11:00:53,t1_gzi06vq,t1_gzhee9q,investing,"Tech companies like to show you stuff they think you'll  like.  The more posts you read about rocketing inflation, the more posts about rocketing inflation they'll show you.

Inflation is much more complicated than just ""more money = higher inflation"".  There are supply issues throughout the economy and it is hard to separate what is actual inflation compared to temporary price increases due to a drop in supply.",,
32,gzi06wy,2021-05-26 11:00:54,t1_gzi06wy,t3_nlcd30,investing,"Gurthang's Gainers +0.38%  


I am long on O,STAG,BND,VIG,VYM,AMT,CCI,MSFT,IRM,QCOM,ESTC,ET,LAND,CRLBF,PW  


Compound interest is the eighth wonder of the world. He who understands it, earns it ... he who doesn't ... pays it.  Compound interest is the most powerful force in the universe.  Compound interest is the greatest mathematical discovery of all time.",,
33,gzi0ist,2021-05-26 11:05:02,t1_gzi0ist,t1_gzdtrlq,investing,Thank you,,
34,gzi0oj6,2021-05-26 11:06:56,t1_gzi0oj6,t1_gzhldel,investing,"> Yeah but those fairly routine pensions were not sustainable.

I have to disagree.  They are working fine in many other western countries where the actuaries are allowed to do their jobs and the CFOs can not mess with them.

Life expectancy has increased a great deal, but most of that is due to reduced infant mortality, vaccines for childhood disease and not getting killed as often on the job.  But what matters in this discussion of pensions is life expectancy at retirement age.

In 1940 a 65 year old American could expect to live another 12.7 years [source](https://www.ssa.gov/history/lifeexpect.html)

In 2018 a 65 year old American could expect to live another 18.1 years [source](https://www.ssa.gov/history/lifeexpect.html)

So an improvement of 5.4 years, however in the meantime the full retirement age has been bumped to 67 so the net increase in retirement years is only 3.4.  

Pensions provide effective means to mitigate longevity risk (by pooling longevity over a large group of people of the same retirement age) and sequence of returns risk (by pooling that risk over large groups of different retirement ages).  What they do not do is let financial service companies bleed retail investors for fees.

The pension system is broken in the United States, but it does not need to be so.  However a lot of people stand to make a lot of money out of this mess, and they have a loud voice in the financial press.

Finally, if a professionally run pension system can not provide for retirement income then what chance does an individual have with a 401k/IRA?",,
35,gzi0r0s,2021-05-26 11:07:46,t1_gzi0r0s,t3_njy53z,investing,"Kind of weird reading some of the responses here with regards to Kraken.  Coinbase Pro has a better fee structure than Kraken and significantly more liquidity, meaning less slippage. If you're actively trading, you should use Pro.  I strongly disagree that Kraken is in any way easier to use, but I'll leave that as a matter of taste. 

Analysts expect revenue to decline > 30% in Q2. Publicly available data suggests that Coinbase has already matched Q1 revenue with 5 weeks to go in the quarter. They are on pace to beat full-year estimates by \~50%. Their custody and prime brokerage businesses are going to be big revenue drivers and have excellent defensibility. 

Below is my thread on Coinbase's future prospects which touches on some of their opportunities and why ""crypto winter"" isn't going to be as bad as people think. If people want to throw a company trading at a 11 forward multiple under the bus, that's their prerogative. But you are ignoring that this is the most profitable tech company IPO ever and they are positioned to be the Google of their industry. Keep an open mind and you may like what you see.

https://twitter.com/DataCommandant/status/1394880235724705799?s=20",,
36,gzi0wxh,2021-05-26 11:09:47,t1_gzi0wxh,t1_gzgoqv7,investing,"Candy bars man, I've heard at least 10 times as a kid that candy bars and moon pies, whatever other junk food was bigger back in the 80's, 70's, when someone else was a kid.",,
37,gzi142f,2021-05-26 11:12:18,t1_gzi142f,t3_nlbe1y,investing,"Because they don't know - these are ""blank check"" companies where the management team behind the SPAC raises money to go look for a deal, usually with a 2 year time limit.",,
38,gzi1alc,2021-05-26 11:14:35,t1_gzi1alc,t3_nl9l9d,investing,"You might want to take a look at this old reddit discussion about what TQQQ would have looked like when the dot-com bubble burst.

[Here](https://www.reddit.com/r/LETFs/comments/mhl5vg/i_wanted_to_see_what_holding_tqqq_would_be_like/)

[Here is the chart](https://docs.google.com/spreadsheets/d/1RoyuOnxzl8ISPCPmZSB6xf5HgdtTFTN0AD40SZGGXzk/edit#gid=0)",,
39,gzi1bmg,2021-05-26 11:14:57,t1_gzi1bmg,t1_gzi02bn,investing,"Don’t take this to literally, you’ll regret not saving properly. Spend your money on the fun things in life but make a plan to secure yourself in the future. There needs to be a balance, life sucks and can’t all be fun",,
40,gzi1d0s,2021-05-26 11:15:26,t1_gzi1d0s,t1_gzhq6de,investing,"You're right, physics wise there isn't much left to discover. But, mechanisms for handling atmospheric re-entry is something that they and SpaceX are doing in somewhat novel ways like the feathered reentry SpaceShipTwo uses. I know the concept is from the 1950s but it's pretty difficult to go from paper to a working concept (as the failures of SS2 prove). We can argue over whether this is a new discovery for aerodynamics but I think you need to ask Burt Rutan rather than me.",,
41,gzi1eub,2021-05-26 11:16:04,t1_gzi1eub,t3_nl76tb,investing,I've been holding New gold $NGD since early february because of the recovery potential. This week is actually the first week i'm in the green tho lol. It's very volatile and not for everyone.,,
42,gzi1evs,2021-05-26 11:16:05,t1_gzi1evs,t3_nlbe1y,investing,SEC bulletin on SPACs here explains it - https://www.sec.gov/oiea/investor-alerts-and-bulletins/what-you-need-know-about-spacs-investor-bulletin,,
43,gzi1hio,2021-05-26 11:16:58,t1_gzi1hio,t3_nleh0g,investing,"Your submission was removed because it is a short post. Any self-post below 400 characters in the body will be removed.  Please refer to rule 6 and make sure your post meets our standards of effort. Automod evasion will be met with a lengthy ban. Do not post just an article; highlight the parts of the article you find relevant or offer some commentary surrounding the article. Self-posts that offer some simple thoughts or questions like ""what do you think"", ""here's my thoughts"", etc. belong as comments to existing posts or the [Daily Advice Thread](https://www.reddit.com/r/investing/about/sticky?num=2).

*I am a bot, and this action was performed automatically. Please [contact the moderators of this subreddit](/message/compose/?to=/r/investing) if you have any questions or concerns.*",,
44,gzi1igs,2021-05-26 11:17:17,t1_gzi1igs,t1_gzhceox,investing,"I'm not sure why you think they'd make the numbers up?

Also, offsetting the carbon ten times over should be easy with the ticket prices!",,
45,gzi1k29,2021-05-26 11:17:47,t1_gzi1k29,t3_nl3ne2,investing,They just have to sign up for that free boomer government money. Jeff Bezos just got a $10 billion handout from the government for losing a contract! Innovation has never been easier when you're a billionaire.,,
46,gzi1lda,2021-05-26 11:18:12,t1_gzi1lda,t3_nl8046,investing,The market's not imploding. The S&P is like 25 off from its all-time high.,,
47,gzi1lqp,2021-05-26 11:18:19,t1_gzi1lqp,t1_gzgsnpk,investing,"Yes, which right now outsizes their revenue. But when they're actually doing flights, they will probably be dwarfed as their revenue ramps up",,
48,gzi1mno,2021-05-26 11:18:36,t1_gzi1mno,t3_nlauet,investing,"No one knows, but we all know for sure the Fed will keep cranking hard on the money machine to make everything go up.",,
49,gzi1nod,2021-05-26 11:18:56,t1_gzi1nod,t1_gzhbuii,investing,We haven't even seen a correction.,,
50,gzi1qqf,2021-05-26 11:19:54,t1_gzi1qqf,t3_nlbe1y,investing,Gotta keep the suspense going to maintain the hype bullshit.,,
51,gzi1rra,2021-05-26 11:20:14,t1_gzi1rra,t3_nl9l9d,investing,Hell yeah let's goooooooo,,
52,gzi1t0d,2021-05-26 11:20:40,t1_gzi1t0d,t1_gzh36vy,investing,"&#x200B;

on what trcy just broke out",,
53,gzi1xdh,2021-05-26 11:22:07,t1_gzi1xdh,t3_nlekb1,investing,"Your submission was removed because it is a short post. Any self-post below 400 characters in the body will be removed.  Please refer to rule 6 and make sure your post meets our standards of effort. Automod evasion will be met with a lengthy ban. Do not post just an article; highlight the parts of the article you find relevant or offer some commentary surrounding the article. Self-posts that offer some simple thoughts or questions like ""what do you think"", ""here's my thoughts"", etc. belong as comments to existing posts or the [Daily Advice Thread](https://www.reddit.com/r/investing/about/sticky?num=2).

*I am a bot, and this action was performed automatically. Please [contact the moderators of this subreddit](/message/compose/?to=/r/investing) if you have any questions or concerns.*",,
54,gzi22lx,2021-05-26 11:23:50,t1_gzi22lx,t1_gzi1t0d,investing,On OPY,,
55,gzi25yt,2021-05-26 11:24:54,t1_gzi25yt,t1_gzhq6lf,investing,"One thing different about SpaceX is an almost absurd willingness to blow up a rocket, figure out what went wrong, and blow up another rocket to find out the next thing wrong, until the rockets finally stop blowing up. They learn really fast that way, and also get good at building new rockets quickly.

National space agencies and their contractors tend to try really hard to get it right the first time and not blow anything up, and that's a much slower process. Blue Origin is the same way, and they've been in business longer than SpaceX and have yet to get anything to orbit.",,
56,gzi2ag8,2021-05-26 11:26:22,t1_gzi2ag8,t1_gzi22lx,investing,ok always get  back in 44-46 till we get a crash,,
57,gzi2ip0,2021-05-26 11:29:01,t1_gzi2ip0,t1_gzi1bmg,investing,"Sure, but in my worthless opinion, mid twenties is still young enough to start settling up for retirement.   Similar to that time value of money thing, I would have had a lot more fun for an extra dollar in my teens than I do with an extra 20 in my 50s.  YMMV.",,
58,gzi2jz8,2021-05-26 11:29:26,t1_gzi2jz8,t1_gzhglk0,investing,"I think though this is the key bit, that British Airways and Air France didn't pay for the development. It was operationally profitable but never even nearly made back its development costs.

>After years of losses and a $2.8-billion government development cost that has been almost completely written off",,
59,gzi2lt6,2021-05-26 11:30:01,t1_gzi2lt6,t3_nlcd30,investing,"think a low debt and high cash flow/market cap, pizza joint $Rave Restaurant can gain traction with its new management. Anyone who's looked into it prior, please share your thoughts",,
60,gzi2r96,2021-05-26 11:31:47,t1_gzi2r96,t1_gz3sq88,investing,Sooooooo...new update was bad. Sticking with my $3 to $4 price target range....good thing I had no position yet.,,
61,gzi30df,2021-05-26 11:34:45,t1_gzi30df,t3_nl76tb,investing,KGC has been good for me.,,
62,gzi3992,2021-05-26 11:37:35,t1_gzi3992,t1_gzhyhfn,investing,"Sorry - maybe I wasn't clear. It looks like actively managed ETFs are allowed. Just not small ones. I did see at least one index ETF which was blocked. But I couldn't figure out a pattern. 

Maybe Merrill doesn't like risks of small ETF liquidation rates - who knows...",,
63,gzi39mf,2021-05-26 11:37:43,t1_gzi39mf,t3_nl6zd6,investing,Depends. If it’s a long play then I’ll keep it but admittedly I’m a swing trader and don’t keep positions open for more than a month usually. So I’d say about 20-25% and I’m out. Unless there is a huge social momentum behind the company I’ll ride it out til that dies,,
64,gzi39ni,2021-05-26 11:37:43,t1_gzi39ni,t3_nl3ne2,investing,By taking a cut of every ticket sold to Disneyland Mars.,,
65,gzi39pv,2021-05-26 11:37:45,t1_gzi39pv,t1_gzhyd2l,investing,"> so would it make sense to start investing in the ETF version, then transfer over to the mutual fund?

Yes

> Why exactly should I avoid ETF?

You can stick with the ETF if you really want to, it just doesn't allow for partial shares like the MF does",,
66,gzi3hnv,2021-05-26 11:40:18,t1_gzi3hnv,t1_gzbfcqd,investing,I love your user name lol,,
67,gzi3i5p,2021-05-26 11:40:28,t1_gzi3i5p,t1_gzhdd7x,investing,"True, very possible, though based on wealth, I'd say we are close to the normal boundaries, I guess that's the point I'm making. 

Central banks hardly ever actually put the brakes on, ever, in the past 20 years. In '08 they did, a tiny bit and we got a crash so now they're just basically adjusting how much of the spigot to keep on haha.",,
68,gzi3jxb,2021-05-26 11:41:01,t1_gzi3jxb,t3_nlbe1y,investing,Maybe they don't want outsiders buying stock they intend to invest in to keep the stock price down.,,
69,gzi3nlv,2021-05-26 11:42:11,t1_gzi3nlv,t3_nl6zd6,investing,I just do nothing every year and stick to low-cost broad-market index funds.,,
70,gzi3o0j,2021-05-26 11:42:19,t1_gzi3o0j,t1_gzhh9pv,investing,"I guess you haven't checked recently. SpaceX advertises $90M for a Falcon Heavy flight, with a payload to LEO of 63,800 kg, giving a price of $1410/kg [pdf](https://www.spacex.com/media/Capabilities&Services.pdf)).

And the FH is only partially reusable. If Starship works out, which seems increasingly likely, then costs will drop much lower than that.

Of course that's the cost in privatized space. For launch on SLS you're right, it'll be $10K/kg or higher.",,
71,gzi3r2u,2021-05-26 11:43:16,t1_gzi3r2u,t3_nlexqv,investing,"Your submission was removed because it is a short post. Any self-post below 400 characters in the body will be removed.  Please refer to rule 6 and make sure your post meets our standards of effort. Automod evasion will be met with a lengthy ban. Do not post just an article; highlight the parts of the article you find relevant or offer some commentary surrounding the article. Self-posts that offer some simple thoughts or questions like ""what do you think"", ""here's my thoughts"", etc. belong as comments to existing posts or the [Daily Advice Thread](https://www.reddit.com/r/investing/about/sticky?num=2).

*I am a bot, and this action was performed automatically. Please [contact the moderators of this subreddit](/message/compose/?to=/r/investing) if you have any questions or concerns.*",,
72,gzi3vl8,2021-05-26 11:44:39,t1_gzi3vl8,t1_gzgx6gq,investing,">  This technology is only going to improve over time

Heh, We put people on the moon in 1969 and it's going to be a technological achievement if we can do it again by 2040.",,
73,gzi3y7v,2021-05-26 11:45:30,t1_gzi3y7v,t3_nl76tb,investing,"Check out ASX listed miners. Political risk is very low. Plus Australia is very good at mining at a profit. Currency exchange also helps. Some are cross listed on OTC but liquidity will vary. Buying on ASX preferred bc of this. Check out Hot Copper but be forwarned, opinions are not equal to facts and no one has all the facts and future events.",,
74,gzi43ju,2021-05-26 11:47:10,t1_gzi43ju,t1_gzgidzm,investing,"Interesting - it does seem like there's some kind of model being used to decide on which ETFs are blocked. I'm sure it's probably a bunch of different scoring factors. 

Fidelity can be a decent choice depending on your investing/trading style. I do like Merrill Edge customer services and research tools better than Fidelity. I have 2 brokerage accounts on Merrill Edge but I do the bulk of my active trading in my Fidelity accounts.  All brokerages have their pros/cons.",,
75,gzi43k7,2021-05-26 11:47:10,t1_gzi43k7,t1_gzh2tu5,investing,Well it's not like they couldn't change strategy to make money off of inflation if they really believed inflation was going to go up and stay up significantly.,,
76,gzi48m4,2021-05-26 11:48:44,t1_gzi48m4,t1_gzgh2rk,investing,That's also a very good question.,,
77,gzi4bk3,2021-05-26 11:49:34,t1_gzi4bk3,t1_gzhrr9z,investing,"Hey, 
I’m a soldier from the US, currently deployed. I have a few grand to spare and invest and was looking into advice and leads in how to go about it. Also looking into buying a home.
I’m completely new so any advice and tip help either here or through PM.
My goal is to learn how and what to invest to make my money work for me.
I would like to know what time frames short and long term investments look like. A low to mid risk tolerance depending on financial returns.
I have no debt. Credit score 810+.

I’m just looking for some guidance and advice, as I don’t even know where to begin (Brokerage Accounts, Stocks, etc.). Thank you.",,
