,comment_id,created,fullname,parent_id,subreddit,text,post_id,title
800,,2021-05-21 13:36:56,t3_nhspuq,,investing,"Investment Thesis for Daily Journal (DJCO)

Introduction:  The Daily Journal is viewed by the general public as a dying newspaper business.  It is a dying newspaper business, but the Daily Journal has pivoted itself to a SaaS business, but is trading at a valuation far below most other publicly traded Saas businesses.  We will investigate why the Daily Journal is a worthwhile investment at its current valuation.

Management:  Normally, we’d begin by looking at the business, but management within the Daily Journal is incredibly strong, so this will be our beginning.  The Chairman of the Board in Charlie Munger, Vice-Chairman of Berkshire Hathaway.  He bought the Daily Journal in 1977 for $2 million dollars and has been the Chairman ever since.  The lesser known name leading the Daily Journal is Gerald Salzman.  He joined the Daily Journal in 1986 as their President, CEO, CFO, Treasurer.  As such, there is likely no one else who knows the Daily Journal as well as Gerald Salzman.  As an added bonus to the quality of the two men leading the Daily Journal, their executive compensation is almost unheard of.  The Board of Directors receive a payment of either $5000 or $0.  Gerald Salzman, the CEO, receives a salary of $250,000.  These are acceptable salaries due to the large amount of insider ownership within the Daily Journal.

The Business:  The Daily Journal has three business segments, 1) The Daily Journal Newspaper, 2) Equity Investments, and 3) Journal Technologies.

---

The Daily Journal Newspaper is a series of mostly California based legal newspapers.  Their revenue comes from advertising from display advertising (i.e. traditional advertising found in most newspapers), classified advertising, trustee notice sale advertising, legal notice advertising, and circulation advertising.  The sad but unfortunate truth for investors is that this portion of their business is worth very little.  The good news, however, is that most investors outside of the Daily Journal are not interested in investing in a dying newspaper and thus has led to the undervaluation of the Daily Journal.

I won’t spend any more time on this segment except to say that the newspaper’s most successful year isemi-modern history was during 2008 due to an extreme uptick in the need for legal advertising relating to the foreclosure of many homes.  It is possible that if another recession strikes, the newspaper business of the Daily Journal could provide some financial cushion to keep the Daily Journal in strong health.

---

Equities have been a growing proportion of the Daily Journal’s intrinsic value.  Charlie Munger’s investing prowess that has benefited Berkshire is also at work within the Daily Journal.  We have insight into the Daily Journal’s American investments thanks to their most recent 13F filing, which was released within the last week.  At this time, the Daily Journal holds $197 million worth of American equities, mostly concentrated in financial services similarly to the holdings of Berkshire Hathaway.  Another notable holding is a new and growing position in Alibaba.  

While it is not explicitly confirmed, there is a VERY strong evidence that the Daily Journal also holds a sizable position in BYD, a Hong Kong traded electric car manufacturer.  This would not appear in its 13F filings, so its size cannot be confirmed, however we can make an educated guess.  The exact value of his BYD investment is unknown, however it is assumed to be be roughly $140 million.  In the most recent filing, the Daily Journal notes that it sold $20 million of one of its positions to reinvest into another security.  The suspicion is that this was a shift from BYD to BABA.  As such, we will value the BYD position at $120, though in truth, it may be slightly higher as BYD traded at a fewer dollars higher of a valuation prior to the most recent filing.  Nonetheless, we will assume its value is $120 million.  This brings the Daily Journal’s equity portfolio to a value of $317 million.

The Daily Journal also has $27 million in cash according to their latest annual report and they hold some office buildings in Los Angeles and in Utah which THEY value at $16.5 million.  I emphasized that they value the building because, as I’ll discuss below, the company has some questionable accounting practices.  In the instance of the office buildings in Los Angeles as an example, they valued the buildings at $16.5 million roughly 20 years ago and that figure has never been adjusted.  The result is that they are likely undervaluing the true value of their real estate holdings.  If we increase the value of these holding to $30 million, which seems like a fair appraisal for their buildings based on current market rate, this results in a total equity and asset value of $374 million.

Their liabilities consist of ~$60 million in deferred capital gains (0% interest), a $29.5 million margin loan (3% interest), and a $1.5 million mortgage (4% interest).  The deferred capital gains will not be paid anytime soon as Charlie Munger likes to hold stocks and when he sells, typically he will move into another qualified investment.  The margin loan was used to acquire businesses to build the Saas business and is serviced by the dividends from the bank stocks in the equity portfolio.  The mortgage is self explanatory.  Total liabilities amount to $91 million

Before jumping into the last portion of the Daily Journal’s business segment, I want to note that the Daily Journal has a market cap of $414 million.  As such, to reach its market cap valuation, assuming no value is assigned to the legal newspaper business (it has a value, it’s just not a high value and in all honesty, I don’t know what a fair value is for that business), the Journal Technologies business only needs to be worth $131 million to come a fair market value at its current market cap valuation.

---

Journal Technologies is the hidden gem of the Daily Journal.  It is a legal Saas business being sold to municipalities via the RFP process.  It is a case management system built off of a central e-Suites product that is then configured to meet the client’s needs.

It has a unique business model that results in, once again, an undervaluation of the company.  After being awarded an RFP, the company will then define the scope of the product, establish servers on site, and install its product, and then configure it to the clients needs.  All of this work takes 4 to 8 years to complete and during this time, the municipality is not billed.  On a relevant note to the questionable accounting practices above, the Daily Journal does not report the forthcoming revenue on its financial statements, thus these contracts have not necessarily been taken into account to determine the Daily Journal’s current market valuation.

When its e-Suites product goes live, the Daily Journal will charge an implementation fee and subsequently bill a licensing fee for the next 10 years (with built in price adjustments to account for inflation).  Currently, Daily Journal has over $100 million in forthcoming revenue which, due to their billing practices, is a very high-margin revenue once billing starts.  These contracts are found in the USA, Australia, Canada, and Tasmania currently, though more may have been signed and not discovered.  Credit to Matthew Peterson for taking the time to search across the web looking for tenders awarded to the Daily Journal, as there is not a central repository to identify these contracts.

Moving forward, the assumption is that the Daily Journal will continue onboarding new jurisdictions, there will be an increase in licenses purchased for existing contracts after e-Suites launches, consulting fees for upgrades and modifications will increase, and other e-solutions will be integrated with e-Suites to increase revenue (such as e-payment for fines and tickets).

While the Journal Technologies already has $30-some million in revenue, this figure will increase with time.  Additionally, these municipalities will likely continue using the e-Suite services once they go live after the time and cost of configuration, meaning revenue that is on the books today is revenue that will be on the books likely after the 10 years of licensing has expired.  Presently, Journal Technologies is a $200-$300 million business based on the figures and assumptions above.  Under this assumption, the Daily Journal is valued somewhere between $483 million and $583 million, meaning it is currently undervalued by 17% to 41%.

---

There are a few risks that need to be mentioned.  One is liquidity.  The Daily Journal has a $400 million dollar market cap and is too small for many large financial institutions to monitor.  It also has a $300 share price which, while irrelevant to value, will scare away many newer retail investors who invest $20 to $50 at a time.  Beyond these two issues, the Daily Journal has quite a bit of insider ownership or is owned by firms with long-term visions, thus they are not willing to sell shares on a daily basis.  The result is that only about 5,000 shares are traded on a daily basis.  This means that if you need to liquidate your position in a pinch, you may have to sell below the market rate.

The other glaring issue is age.  Charlie Munger is 97 years old and Gerald Salzman is 80 years old.  Beyond not being at the forefront of technological innovation on a personal level (some may view this as an issue when running a Saas business, personally I am not concerned as there job is to manage the people driving the Saas business), their old age means that in the coming years, their leadership may cease to exist.  No clear succession plan has been identified (this was raised during their last annual meeting by a concerned shareholder).  As management is a key strength within this business, this could be reason for pause for prospective shareholders.

Lastly, there is the $16 billion elephant in the room.  Tyler Technologies is their key competitor.  There are other smaller competitors who offer more limited solutions, but Tyler Technologies is the real competition in this space.  While their products are more modern and (likely) have better and flashier features, this is not necessarily what wins in RFP processes.  Instead, the Daily Journal’s practice of not charging the client until launch is a much more appealing catch for prospective clients.  While I’m sure Tyler Technologies will be a fine company in the long-term, its hard to argue that their fundamentals are nearly as attractive as the fundamentals of the Daily Journal.  The Daily Journal is valued at 8x sales, has a P/B of under 2, and has a P/E of 3.5.  By comparison, Tyler Technologies has a P/B of 8, is valued at 14x sales, and has a P/E of 91.  Tyler Technologies would need to continue growing at a very rapid pace to be a strong value investment (note that Tyler Technologies is still rapidly growing, though this rapid growth is slowing).  By comparison, the Daily Journal, if it continues at its current growth, is already a great investment.  As most clients are onboarded, growth is increasing and it is my belief that this will be a phenomenal investment.

---

Disclaimer: I hold shares of DJCO.  I am posting this because after my research, I think others could benefit from investing in this company (if they agree with my above analysis) AND because I want community feedback on thoughts about DJCO.  My intention is to hold DJCO for a minimum of 4 years, though more realistically I will hold this for a very long time since, as I noted above, the revenue for this company is incredibly sticky and I believe they have many avenues to increase their sales.",nhspuq,(DJCO) My mini-essay investment thesis for The Daily Journal - Why you should buy a dying newspaper business
801,,2021-05-21 15:20:42,t3_nhv1rp,,investing,"PPE is becoming much more of a B2B industry, with businesses in need of face masks and other gear to keep operations running smoothly while restrictions are lifted for the general public. This is especially true in states like NY where restrictions are tighter than Miami. 

As the CDC loosens fask mask restrictions for vaccinated people, I’m seeing a ton of young people outside (maskless) in strict areas like NYC. The streets look like a Miami Spring Break - a whole gathering of young people in the streets in large numbers and no masks to be found. 

The big takeaway, however, is that masks are strictly enforced inside all establishments. Using restaurants as an example, customers must wear masks when they enter/exit and move around, but they are not required to wear masks when they eat. Most importantly, business employees MUST wear masks at all times, and will therefore go through masks at a much quicker pace. The business itself will have to provide PPE for their employees, leading me to conclude the future of COVID era PPE is B2B (in the US / EU and countries with access to vaccinations). 

What company is best situated to provide business with direct PPE supply? OPTEC International (OPTI) acquired WeShield - a B2B PPE supplier, with clients from Old Navy to Carl’s Jr. What led me to OPTEC and WeShield however, is an [article ](https://www.bkreader.com/2021/04/14/nyc-restaurants-gifted-free-ppe-through-new-partnership/)I found about their PPE donations to NYC restaurants through a partnership with the NYC Hospitality Alliance. It turns out the WeShield is run by fellow restaurant owners turned medical suppliers. In the article, a WeShield spokesperson said that the PPE cost of a restaurant is about $5-10 per employee, per day. 

The article also acknowledged that alleviating PPE costs for independent restaurants is what sparked their donation campaign. But without donations, $5-10 per employee per day really adds up and leaves us with a still emerging market of PPE buyers. Not just restaurants but all brick and mortar businesses are new customers in a space that was mostly used by healthcare organizations.

It will be interesting to see how the divide for public vs commercial PPE restrictions grows and which sectors maintain their status as large quantity PPE purchasers. For now, restaurants and retail locations have no plans on changing their PPE policies which leaves a niche market for suppliers like OPTEC.",nhv1rp,"Is supplying PPE directly to business the way forward for PPE providers in the US, EU?"
802,,2021-05-21 15:39:41,t3_nhvhvu,,investing,"$COTY to announce new VP of luxury. 

The turn-around continues, after relaunching Covergirl and announcing the launch of SKKN (finally). The luxury brand portfolio has been underperforming the competition and we can expect better performance under the savvy guidance of CEO Sue Nabi who made Lancôme relevant again for L'Oreal.

[https://wwd.com/beauty-industry-news/beauty-features/simona-cattaneo-to-exit-coty-1234827846/](https://wwd.com/beauty-industry-news/beauty-features/simona-cattaneo-to-exit-coty-1234827846/)",nhvhvu,Leadership Shake-Up at $COTY
803,,2021-05-21 15:52:46,t3_nhvsxl,,investing,"
Disclosure I do not own any shares. 

I came across LOTZ in a stock screener as I had set a price target of $5 and noticed it got close to it.  To keep with the discipline of doing more research upon researching the 1st price target I dug deeper and did the following model.  

Summary
Carlotz is really a lead-gen tech business to help rental fleets and consumers sell directly to retail  vs. going through the auction process.  They eliminate the extra step and fees that is entailed in auction houses.  The company also allows consumers to sell their cars to other consumers with Carlotz being the ""broker"" that makes the process easy for both parties. 
The revenues are: flat fee from buyer, fee from seller (used to inspect, clean car and take pics), financing and insurance upsells and lease income.  

However, the company reports the total car sale as the revenue which is a bit funky but legal.  This is why the GROSS margins are 10% to 12%, if the Gross Margins were the ""revenues"" the company would only show a revenue of $35 million for 2021 vs. $350 million, kinda hard to sell a SPAC at a $1.4 billion valuation when the revenues are $35 but with eventual ""80% EBITDA margins"". 

I ran a 10 year model and do believe the company can become profitable by 2023 unless they keep expanding more aggressively than modeled but by 2024 they can grow organically using cash flow.  

I think the stock is a buy at $4 since at this price we have some downside protection of the cash on the balance sheet of around $2 and at that price you are only paying a 1x enterprise value to multiple multiple which is on the low side compared to historical of Carvana, KAR and others. 

Would I want to own this business forever?  No,  but I think it can go from $4 to $10 to $15 pretty quickly if the GROSS margins go to 13% to 15% as they originally projected in their investor presentation, however in my 10 year model I do not see 15% margins until 2030z Management has missed guidance on revenues for 2021 and margins and the street doubts they can meet their numbers for this year.  This is the risk and why I think it may trade lower in the short-term.  

2021 rev 330mm and 1x ev would be $4 and 2x ev is $8

2022 rev is 850mm and 1x ev is $8 and 2x would be $16

2023 rev would be $1.4 billion and 1x ev would be $12 and at 2x ev would be $24

The execution risk is will they be able to meet these revenue targets and go from the current 10% gross margins to the 13% they said they would be able to do on the Octoeber 2020 investor deck. 

It could eventually become a takeover target as we have now 5 to 10 companies in this space and companies are always looking for growth. 

Anyway interested to hear your thoughts on this. I can definitely go more granular into the business model but for simplicity sake kept it short.

Looking forward to your comments!",nhvsxl,$LOTZ is this bottom for Carlotz? Or do we go lower? I think worth $4 to $24 over a few years.
804,,2021-05-21 16:22:19,t3_nhwhxu,,investing,">For decades, the story of American steel had been one of job losses, mill closures and the bruising effects of foreign competition. But now, the industry is experiencing a comeback that few would have predicted even months ago.  
>  
>Steel prices are at record highs and demand is surging, as businesses step up production amid an easing of pandemic restrictions. Steel makers have consolidated in the past year, allowing them to exert more control over supply. [Tariffs on foreign steel](https://www.nytimes.com/2020/01/27/business/economy/trump-steel-tariffs.html) imposed by the [Trump administration](https://www.nytimes.com/2018/02/16/us/politics/trump-administration-recommends-stiff-penalties-on-steel-and-aluminum-imports.html?searchResultPosition=1) have kept cheaper imports out. And steel companies are hiring again.

[https://www.nytimes.com/2021/05/21/business/steel-prices-boom.html](https://www.nytimes.com/2021/05/21/business/steel-prices-boom.html)",nhwhxu,"NYT: ""Soaring Prices Herald Boom Time for Steel Makers"""
805,,2021-05-21 18:46:03,t3_nhzs5m,,investing,"Given a basket of stocks I am wondering if there is a tool and can automatically run different % asset allocation in each stock and determine which asset allocation provides the optimal shape ratio. This is obviously ok to do manually for one percentage distribution but not for many.

I would like to have a tool that can do this easily on a regular basis so I can rebalance my portfolio where necessary.",nhzs5m,How to calculate optimal asset allocation based on shape ratio?
806,,2021-05-21 20:53:29,t3_ni2mjv,,investing,"NVIDIA (NVDA) said Friday its board has approved a four-for-one split of its common stock in the form of a stock dividend.

The computer systems design services company said the move would make stock ownership more accessible to investors and employees. The dividend is conditioned on shareholder approval at the company's annual meeting in June to increase the number of authorized shares to 4 billion, the company said.

If approved, each NVIDIA (NVDA) shareholder of record at the close of business on June 21 will receive a dividend of three additional shares for every share held, which will be distributed after the close of trading on July 19.",ni2mjv,NVIDIA Proposes 4-for-1 Stock Split
