,comment_id,created,fullname,parent_id,subreddit,text,post_id,title
361,gzir3l5,2021-05-26 14:58:54,t1_gzir3l5,t1_gziqcco,investing,"Yeah I don't know what this person is talking about. I have a smart TV that uses the Roku operating system, there's no appreciable difference in the functionality of the Amazon interface vs. Netflix.",,
362,gzir3un,2021-05-26 14:58:57,t1_gzir3un,t1_gzieshh,investing,Thank you!,,
363,gzir43u,2021-05-26 14:59:00,t1_gzir43u,t3_nkow1q,investing,"https://backtest.curvo.eu/ strives to be a European portfolio visualizer.  
It seems to at least miss some American ETFs, even if they are available here (in my case I haven't found UPRO)",,
364,gzir573,2021-05-26 14:59:12,t1_gzir573,t1_gziqs4x,investing,"Fidelity. It wasn’t necessarily a charge, just when I bought the stock again today my cost basis was higher than it should have been because they automatically add on wash sale fees to your new cost basis when you incur them. They put a little “W” next to the cost basis, so I know that’s what it was.

I just don’t understand how I incurred a wash sale when I sold the shares for an overall profit, unless it was a wash sale only on specific shares because I bought them separately but sold them all at once.",,
365,gzir5t7,2021-05-26 14:59:19,t1_gzir5t7,t3_nl9l9d,investing,The reason you shouldn’t hold them is because of the inherent time decay. Since they use options/futures to balance you lose money even if the index does nothing,,
366,gzir7or,2021-05-26 14:59:30,t1_gzir7or,t3_nlivu6,investing,[A person has the only indisputable value - ability to work. Everybody wants to take all this value from him in their favor. That's why this Stingy Purposeful Shopping with cynical unbrand tips is so important](http://purposeful.site),,
367,gzir85k,2021-05-26 14:59:33,t1_gzir85k,t1_gzhsq7q,investing,"You are thiking of Repos, not reverse repos. Reverse repos park money at the Fed in exchange for treasuries for 0 or sometimes negative interest. They are shorting the treasury endlessly expecting the rates to go up (and value down). It is becoming concerning.",,
368,gzir8kg,2021-05-26 14:59:36,t1_gzir8kg,t3_nlivj1,investing,[A person has the only indisputable value - ability to work. Everybody wants to take all this value from him in their favor. That's why this Stingy Purposeful Shopping with cynical unbrand tips is so important](http://purposeful.site),,
369,gzirch5,2021-05-26 15:00:06,t1_gzirch5,t3_nlisul,investing,[A person has the only indisputable value - ability to work. Everybody wants to take all this value from him in their favor. That's why this Stingy Purposeful Shopping with cynical unbrand tips is so important](http://purposeful.site),,
370,gzirdoo,2021-05-26 15:00:16,t1_gzirdoo,t1_gziqum6,investing,https://www.barrons.com/articles/virgin-galactic-stock-soaring-buy-rating-51622037677,,
371,gzirflh,2021-05-26 15:00:29,t1_gzirflh,t1_gzicrpt,investing,I’m now considering buying a few shares in case it’s the next r/wsb fascination,,
372,gzirhcf,2021-05-26 15:00:43,t1_gzirhcf,t3_nlj3bu,investing,"**Hi, welcome to /r/investing. Please note that as a topic focused subreddit we have higher posting standards than much of Reddit:**

**1)** Please direct all **advice requests and beginner questions to the stickied daily threads.** This includes beginner questions and portfolio help.

**2) Important: We have strict political posting guidelines** (described [here](https://www.reddit.com/r/investing/comments/cyee69/formal_posting_guidelines_for_political_topics/) and [here](https://www.reddit.com/r/investing/comments/escewo/temporary_rule_change_what_happens_to_stocks_if/)). Violations will result in a likely 60 day ban upon **first instance.**

**3)** This is an open forum but we expect you to conduct yourself like an adult. Disagree, argue, criticize, but **no personal attacks.**


*I am a bot, and this action was performed automatically. Please [contact the moderators of this subreddit](/message/compose/?to=/r/investing) if you have any questions or concerns.*",,
373,gzirhw0,2021-05-26 15:00:47,t1_gzirhw0,t3_nlirwp,investing,[A person has the only indisputable value - ability to work. Everybody wants to take all this value from him in their favor. That's why this Stingy Purposeful Shopping with cynical unbrand tips is so important](http://purposeful.site),,
374,gziri86,2021-05-26 15:00:50,t1_gziri86,t1_gzi5o4e,investing,"Not sure what you’re saying here.  So sorry if this comes off wrong. But, Airlines are safer then driving in cars. 

I think many folks just don’t properly realize the risks they take blowing some out of proportion while ignoring others.",,
375,gzirnyl,2021-05-26 15:01:35,t1_gzirnyl,t1_gzirdoo,investing,So you’re saying There’s a chance,,
376,gzirqdg,2021-05-26 15:01:54,t1_gzirqdg,t1_gziks21,investing,Not sure what you’re responding to here.,,
377,gzirqq7,2021-05-26 15:01:57,t1_gzirqq7,t1_gziqyx7,investing,"The point isnt to keep rates low on the long end.  They are only worried about the short end.  The point of purchasing bonds is confidence and liquidity more than manipulation of long term rates. 

Long term rates have been impacted by inflation expectations, not lack of demand or a fundamental issue in the market",,
378,gzirznz,2021-05-26 15:03:08,t1_gzirznz,t1_gzhcl5y,investing,That's a good way of looking at it LOL,,
379,gzis1k1,2021-05-26 15:03:23,t1_gzis1k1,t3_nlj5oh,investing,"**Hi, welcome to /r/investing. Please note that as a topic focused subreddit we have higher posting standards than much of Reddit:**

**1)** Please direct all **advice requests and beginner questions to the stickied daily threads.** This includes beginner questions and portfolio help.

**2) Important: We have strict political posting guidelines** (described [here](https://www.reddit.com/r/investing/comments/cyee69/formal_posting_guidelines_for_political_topics/) and [here](https://www.reddit.com/r/investing/comments/escewo/temporary_rule_change_what_happens_to_stocks_if/)). Violations will result in a likely 60 day ban upon **first instance.**

**3)** This is an open forum but we expect you to conduct yourself like an adult. Disagree, argue, criticize, but **no personal attacks.**


*I am a bot, and this action was performed automatically. Please [contact the moderators of this subreddit](/message/compose/?to=/r/investing) if you have any questions or concerns.*",,
380,,2021-05-26 15:03:23,t3_nlj5oh,,investing,"I’ve been brainstorming about potentially investing into a friends small business, as a first time private investor, yet I do not have any capital upfront.  

One idea I’ve had is to essentially give my entire paycheck, after taxes, directly back to my friends business for the purpose of capital. Over time this could add up to a decent sum of money.  

Has anyone heard of a strategy like this? What kind of things should I be more aware of before discussing this with my friend? 
Is there anything I should absolutely discuss before considering this?   

Obviously this is a very fresh idea, so I may not be asking you the right questions at the moment. However, I truly believe in my friends start up and started working for them with the intention of helping them with their business. I am more interested in the success of the business than I am about my immediate pay. I work with a salary ethic, though I am paid hourly.  

The end goal is to make money, be compensated fairly for my time, but I’ve always looked at the things I do as an investment rather than an immediate paycheck.",nlj5oh,Investing paycheck into company as employee
381,gzis307,2021-05-26 15:03:35,t1_gzis307,t1_gzir3l5,investing,"If anything, Amazon's search is a little better.",,
382,gzis4ub,2021-05-26 15:03:49,t1_gzis4ub,t3_nlccgx,investing,Late 20's making ~100k looking to start trading a bit on the side for some extra income. I am thinking about starting to do some swing trading. Thinking about starting with ~10k and buying bigger tech stocks like MSFT and then selling each time they go up a few bucks. Is there any downsides to this strategy beyond day trading restrictions and short term capital gains tax?,,
383,gzis6qz,2021-05-26 15:04:05,t1_gzis6qz,t1_gzig3xb,investing,This is gone age well ...,,
384,gzisbtt,2021-05-26 15:04:44,t1_gzisbtt,t1_gziri86,investing,"I know it’s safer but everybody can come up with horrific imagery of a plane crash easily all the same, but it doesn’t stop that many people from using them to reach entertainment destinations. Based on that I don’t think it’d deter many tourist astronauts either, not enough to cause a shortage of customers at least",,
385,gzishst,2021-05-26 15:05:40,t1_gzishst,t1_gzhcl5y,investing,That's a good point LOL.,,
386,gzisiul,2021-05-26 15:05:51,t1_gzisiul,t1_gzghgyj,investing,I don't think you catch my sarcasm.,,
387,gzisjza,2021-05-26 15:06:05,t1_gzisjza,t1_gziqcco,investing,My main beef with amazon’s apps are the I still have to scroll a single filed list to see the things i’ve bought. It seems designed to encourage me not to rewatch things i’ve bought which is very annoying,,
388,gzisr61,2021-05-26 15:07:27,t1_gzisr61,t1_gzhqant,investing,"Supersonic aircraft are insanely inefficient. I don't know what market these aerospace companies are imagining where there are enough millionaires willing to fork over thousands of dollars per flight, every day, in such quantities that it justifies a production line of supersonic aircraft.

They're inefficient so they're emitting tons more CO2 per mile, so that rules out all the environmentally friendly millionaires.

They're incredibly cramped to save weight, so airlines would have to choose between stuffing people in or filling them with luxury seats, increasing ticket prices even more.

Which leads me to my final point, I'm betting the majority of millionaires that could afford supersonic tickets would much rather pay the same price (or less, probably) to get first class in a regular jet.",,
389,gziss6j,2021-05-26 15:07:39,t1_gziss6j,t1_gzirqq7,investing,"I'm not talking about long versus short term rates, which I agree has its own nuance.",,
390,gzisthk,2021-05-26 15:07:55,t1_gzisthk,t1_gzi7wze,investing,Every time I try to do due diligence on this stock i get... Distracted.,,
391,gzisu8p,2021-05-26 15:08:03,t1_gzisu8p,t3_nlj5oh,investing,"I don't like this idea. There are thousands of other companies or ETFs to invest in. What is the chance that your friend's business will be a better investment? Also, you may have a real chance of spoiling the relationship with your friend if something goes wrong.",,
392,gzisv4h,2021-05-26 15:08:13,t1_gzisv4h,t1_gzio3mi,investing,Netflix will never be acquired. No IP worth a damn and expensive as hell,,
393,gzisvwv,2021-05-26 15:08:22,t1_gzisvwv,t3_nli79t,investing,Amazon owns everything,,
394,gzisx8p,2021-05-26 15:08:37,t1_gzisx8p,t3_nlja72,investing,"**Hi, welcome to /r/investing. Please note that as a topic focused subreddit we have higher posting standards than much of Reddit:**

**1)** Please direct all **advice requests and beginner questions to the stickied daily threads.** This includes beginner questions and portfolio help.

**2) Important: We have strict political posting guidelines** (described [here](https://www.reddit.com/r/investing/comments/cyee69/formal_posting_guidelines_for_political_topics/) and [here](https://www.reddit.com/r/investing/comments/escewo/temporary_rule_change_what_happens_to_stocks_if/)). Violations will result in a likely 60 day ban upon **first instance.**

**3)** This is an open forum but we expect you to conduct yourself like an adult. Disagree, argue, criticize, but **no personal attacks.**


*I am a bot, and this action was performed automatically. Please [contact the moderators of this subreddit](/message/compose/?to=/r/investing) if you have any questions or concerns.*",,
395,gzisx8w,2021-05-26 15:08:37,t1_gzisx8w,t1_gzir85k,investing,Thanks for clarifying!,,
396,gzisykl,2021-05-26 15:08:52,t1_gzisykl,t1_gzi5kk8,investing,"I believe that the statement “Tqqq can go to 0” is inaccurate, af least in this context. While the Nasdaq 100 does not have a circuit breaker, each individual security listed in the Nasdaq 100 does. Meaning, if any security drops 20%, it’s trading will be halted for for the rest of the day. I don’t think this applies to QQQ itself, but it does apply to all the companies in the Nasdaq 100.

This could potentially pose A.M. issue with rebalancing, and the following day TQQQ may not track 3x QQQ accurately. But the circuit breakers do still apply in this context, to the best of my knowledge.",,
397,gzit0u2,2021-05-26 15:09:18,t1_gzit0u2,t1_gzishst,investing,😂😂,,
398,gzit15j,2021-05-26 15:09:22,t1_gzit15j,t1_gzir3l5,investing,"I also use Roku, and I find Netflix's system much better than Amazon Prime's...  I guess it's pretty subjective lol.",,
399,gzit2rm,2021-05-26 15:09:40,t1_gzit2rm,t1_gziqcco,investing,"I do love the X-Ray feature, my biggest gripes with the amazon app have more to do with how it distinguishes between Prime Content and $$$ content.  From a pure interface standpoint I can watch anything on netflix, but need to stay in certain areas of prime unless I want to look at subscription content or pay content",,
400,gzit3mt,2021-05-26 15:09:50,t1_gzit3mt,t1_gzhrb8e,investing,"You can't let it phase you. People thought it was insane when the dow broke 10k! Lol. 

Depending where you are at in life, there is a decent chance that you'll have money in the market during a crash. Law of large numbers and all that. (Or even multiple if you are young!) But, we have no idea when that's going to be. Could crash next week. Could crash in 8 years. If you hold your money back and it turns out the 8 year scenario is more accurate though, then there's every possibility that the crash won't even extend down to the current price point. Meaning now was really the last time to get in at these prices. And if it turns out to be next week, well, yeah, that does suck. However, if your holding for decades it's fairly irrelevant actually. 

Then there's also the possibility that you fuck up trying to buy the crash. Lots of people missed the bottom of the covid crash thinking that the market still had a much larger fall coming. Turns out it didn't, and they lost a lot of money trying to time the crash. 

Try not to let the fact that the market grew scare you. The only time that scares me is when I'm making individual stock plays. Cause unlike the broad market, there's a high risk that an individual company is caught up in a fomo bubble and just never reaches those prices again. But that's not true for broad market funds. Like even if the dow somehow tanked back down to 15k throughout the rest of 2021, in 30 years it's going to be a lot higher than 34k.",,
401,gzit3p7,2021-05-26 15:09:51,t1_gzit3p7,t1_gzilzlx,investing,"I think you would be surprised by how many adults bought Animal Crossing ""bears"" from them.",,
402,gzit4gr,2021-05-26 15:10:00,t1_gzit4gr,t1_gzima5x,investing,Except it won't be.  Turner Entertainment (owned by WarnerMedia) owns the entirety of the pre-1986 MGM catalog.  Ever wonder why there's always a Bond marathon going on TNT or TBS?   All the licensing deals done between 1986 and 2020 make it kind of a mess who owns what when it comes to MGM.  This isn't about back catalog.  This is about future production capacity and buying the rights to make future projects off established franchises.,,
403,gzit59z,2021-05-26 15:10:10,t1_gzit59z,t3_nli79t,investing,"Have been bearish on Netflix for a while. They have absolutely no IP compared to Disney and now Amazon, and dont have any other value adding verticals like Disney, Apple, and Amazon do. That means those companies can subsidize their streaming service and crush Netflix on cost, or add other perks that Netflix cant compete with (Disney for example could have plus members be able to see first 20 minutes of new star wars movie before it hits theaters).",,
404,gzit6n5,2021-05-26 15:10:25,t1_gzit6n5,t1_gzid5y8,investing,"Yeah, you see the Porsche Taycan and the Audi e-trons everywhere in Amsterdam here nowadays",,
405,gzitaq0,2021-05-26 15:11:14,t1_gzitaq0,t3_nlgddk,investing,"Well, if you believe that some of this push is designed purposely to damage first world nations and redistribute wealth to poorer nations (many of which will not follow climate agreements and allow “dirty” practices en mass), then invest in emerging markets",,
406,gzitbbo,2021-05-26 15:11:21,t1_gzitbbo,t3_nlauet,investing,"I see 10 saying you don't need to worry about it, and mods removing theories\*, and yet not a single person, offering any sort of explanation as to it , 

&#x200B;

gonna go ahead and commence ""worrying about it""",,
407,gzitbdp,2021-05-26 15:11:21,t1_gzitbdp,t1_gzio3mi,investing,"this art always reminds me of three snowman heads who are putting on glasses, instead of one person three times in the process of putting on glasses",,
408,gzitddo,2021-05-26 15:11:43,t1_gzitddo,t3_nli79t,investing,"Main MGM franchises:
* James Bond
* Stargate
* Rocky
* Pink panther
* Robocop
* individual series (handmaid’s tale, vikings, etc)
* etc (they have quite a few originals, but they are individual movies or less known series)

That doesn’t seem to be a game changer, BUT:
MGM has the capacity/background/know-how to (mass) produce original content (in case of proper investments. I guess it’s easier to buy a factory then to build one.",,
409,gzite1e,2021-05-26 15:11:51,t1_gzite1e,t3_nli79t,investing,"The number one problem with Prime is having a lot of content you have to pay extra for. It makes me use Prime a whole lot less than Netflix because with Prime I have to start budgeting in my head before spending ad hoc throughout the month. 

As a result of this mental arithmetic I simply don’t spend ANY money on Prime to keep my bills simple. 

Prime would be 100x better if they included all content under one larger monthly fee.",,
410,gziteml,2021-05-26 15:11:58,t1_gziteml,t3_nli79t,investing,Netflix is already devoid of good content.,,
411,gzitey7,2021-05-26 15:12:02,t1_gzitey7,t1_gzis4ub,investing,"Yea, stocks go down sometimes.",,
412,gzitglr,2021-05-26 15:12:21,t1_gzitglr,t1_gziot3g,investing,"What improvements do you want on their interface? 
I use the Roku app, iOS app, and website without any issues or major ideas for improvement",,
413,gzithcf,2021-05-26 15:12:29,t1_gzithcf,t3_nl3ne2,investing,simple answer. they are not going to ever be profitable.  complex answer: see simple answer,,
414,gzithqj,2021-05-26 15:12:33,t1_gzithqj,t1_gzikooq,investing,"I came here for this, like wtf.",,
415,gzithz3,2021-05-26 15:12:36,t1_gzithz3,t3_nlj5oh,investing,"If you believe your friends business is sound, and you are an early/only investor see if you can get a percentage of ownership.",,
416,gzitigk,2021-05-26 15:12:42,t1_gzitigk,t1_gziot3g,investing,Meh. Any online streaming service that is done with pay tiers to unlock specific content I will never touch. Might as well go back to cable if thats how they wanna play it.,,
417,gzitmxu,2021-05-26 15:13:33,t1_gzitmxu,t1_gziqcco,investing,"The X-Ray feature is awesome, what a great idea",,
418,gzitp9e,2021-05-26 15:13:59,t1_gzitp9e,t1_gzi817q,investing,"I mean, technically ... The fed does actually literally print money.",,
419,gzitquo,2021-05-26 15:14:18,t1_gzitquo,t1_gzitey7,investing,Also going to to use some basic technical analysis and crossover techniques and am not worried about waiting it out of it drops.,,
420,gzitr5w,2021-05-26 15:14:21,t1_gzitr5w,t1_gzipg1o,investing,I find myself more and more on hbomax.  I swap over to netflix and cannot find anything I want to watch.  No really thrilled with alot of their new content.,,
421,gzits6j,2021-05-26 15:14:34,t1_gzits6j,t1_gzitddo,investing,"If amazon wants money, they better renew Stargate and make a few movies.",,
422,gzitzbk,2021-05-26 15:15:57,t1_gzitzbk,t3_nkyfj6,investing,"Not sure about that, but maybe their FCF come directly from the financial statements and they work backward with the other numbers that they have to the NWC change?

Since most of these data providers have different ways of « normalizing » or bucketing the numbers that could explain this difference.",,
423,gziu09f,2021-05-26 15:16:07,t1_gziu09f,t1_gzima5x,investing,"Netflix has a lot of original content. They aren't going anywhere.

They might be sold to another company though. I fucking hope that doesn't happen.",,
424,gziu0rs,2021-05-26 15:16:13,t1_gziu0rs,t3_nl6zd6,investing,"Just follow my original portfolio allocations, or change those allocations to reflect new beliefs.  
  
That may mean buying or selling, depends on overall performance.",,
425,gziu0wx,2021-05-26 15:16:15,t1_gziu0wx,t3_nli79t,investing,"Finally, Amazon Prime video blows except Invincible, The Boys and Man on High Castle.",,
426,gziu3ge,2021-05-26 15:16:45,t1_gziu3ge,t1_gzir25h,investing,The debate is....short term or structural?,,
427,gziua1v,2021-05-26 15:18:00,t1_gziua1v,t1_gzir573,investing,They are not fees. What's happening is that the cost-basis gets adjusted so that when you sell the stock - your gain will be adjusted appropriately. Look at the gain from your original purchase/sale.,,
428,gziuaoa,2021-05-26 15:18:07,t1_gziuaoa,t3_nli79t,investing,"Netflix has been a great investment if you bought in a decade ago, but I think now, the streaming industry is going to be sort of a race to the bottom that I am not sure I'd want to invest in pure media companies anymore. I'm only in Amazon obviously because it's a diverse company.",,
429,gziuate,2021-05-26 15:18:09,t1_gziuate,t1_gzits6j,investing,That would be amazing :),,
430,gziuchn,2021-05-26 15:18:28,t1_gziuchn,t1_gzir573,investing,Some of the shares were probably not part of the profit then? You bought them in different batches. Can you view each one you sold and it's price?,,
431,gziudgy,2021-05-26 15:18:39,t1_gziudgy,t1_gziom5m,investing,They're aiming for 40% of their production to be EVs by 2030.,,
432,gziugzm,2021-05-26 15:19:19,t1_gziugzm,t1_gzieosy,investing,What is VT or VOD? I'm not familiar with either,,
433,gziuhip,2021-05-26 15:19:25,t1_gziuhip,t1_gzid8u4,investing,Well if you met your wife 5 years ago you just gained yourself a BBW. You wanna take mine? You can take mine.,,
434,gziuhre,2021-05-26 15:19:28,t1_gziuhre,t1_gzimwju,investing,"Yes that's it exactly. If you never go further past that rabbit hole you'll be better off too than most of us. IRA and index funds is all you need.

If you go further down the rabbit hole, see you back in 1-20 years where you'll come to the same conclusion lol.",,
435,gziuj29,2021-05-26 15:19:42,t1_gziuj29,t1_gziot3g,investing,I think the UI is pretty ok. At least on Android. What I absolutely hate about Prime Video is how they sometimes only offer dubbed version. And not only for Prime content. Also if you want to purchase a movie or show. I wanted to buy Blade Runner a while back because I was too lazy to look for my DVD but Amazon is only selling the German version in Germany. It's so stupid.,,
436,gziuje8,2021-05-26 15:19:45,t1_gziuje8,t1_gzil0m5,investing,You can switch on each sale,,
437,gziulel,2021-05-26 15:20:07,t1_gziulel,t1_gzitddo,investing,">I guess it’s easier to buy a factory than to build one.

That's why business buyouts are so popular. And why they are so terrible.

Let someone else do the leg work to build a company, but only give the founders/investors cash handouts. The people who did the actual leg work are stuck with a shitty salary. 

The new company comes in and changes the org structure to squeeze the dollars out of the factory in the name of ""efficiency."" But a lot of these shit-for-brains executives can't tell the difference between fucking over workers (making them work harder for the same dollar) and actual efficiency improvements (process improvements to save time). So they end up pushing their workers harder and the quality of the product goes down. But the executives don't figure that out until years later when the customer wises up to their shitty management and goes to their competition.

It's the current Capitalist system in the world.",,
438,gzium21,2021-05-26 15:20:15,t1_gzium21,t1_gzicxli,investing,"They already did it in Australia, 150MW instillation been running for serval years now. 

There are lots of problems and lots of issues to work out but it’s doable and worth the effort",,
439,gziumd0,2021-05-26 15:20:19,t1_gziumd0,t1_gzicrpt,investing,"As a dad, I invite you to come with me to the mall on Sundays.",,
440,gziunem,2021-05-26 15:20:30,t1_gziunem,t3_nljk1w,investing,"Your submission was automatically removed because it looks like your post is better served as a comment on an existing post. Please also take a moment to review the [r/investing rules](https://www.reddit.com/r/investing/wiki/index/rules) if you have not yet done so. I am a bot and sometimes not the smartest so if you feel your comment was removed in error please message the moderators.

*I am a bot, and this action was performed automatically. Please [contact the moderators of this subreddit](/message/compose/?to=/r/investing) if you have any questions or concerns.*",,
441,gziuq8z,2021-05-26 15:21:01,t1_gziuq8z,t1_gzits6j,investing,"Can I get less eyeliner though?

I love the characters and the arch, the story is well done. I just.. teal'c why?",,
