,comment_id,created,fullname,parent_id,subreddit,text,post_id,title
350,gyrdxe5,2021-05-19 23:42:46,t1_gyrdxe5,t1_gyrd56h,StockMarket,I can assume from the age of your reddit account you have only been investing for 5 years so you'll be forgiven your idiotic nonsense. Learn more talk less,,
351,gyrdxh8,2021-05-19 23:42:47,t1_gyrdxh8,t1_gyrcnra,StockMarket,Time in the market > Timin’ the market,,
352,gyre15t,2021-05-19 23:43:41,t1_gyre15t,t3_ngicxi,StockMarket,Worst UI hands down. A steaming shit-show,,
353,gyre4uk,2021-05-19 23:44:33,t1_gyre4uk,t3_ngkp5p,StockMarket,Once it does I'm buying a shit ton,,
354,gyre77c,2021-05-19 23:45:07,t1_gyre77c,t3_nge5g9,StockMarket,Where can I get a map like that for crypto?,,
355,gyrea0e,2021-05-19 23:45:48,t1_gyrea0e,t1_gyr7wrf,StockMarket,I wish people would stop making stuff up like this. There is no source you can quote which actually says this.,,
356,gyrebo9,2021-05-19 23:46:11,t1_gyrebo9,t1_gyr864a,StockMarket,She believed Tesla would hit $4k and it did.,,
357,gyrecs8,2021-05-19 23:46:28,t1_gyrecs8,t3_ngj0we,StockMarket,Etsy will die in 2022.,,
358,gyreddf,2021-05-19 23:46:35,t1_gyreddf,t3_ngipd7,StockMarket,"This is the person that just today said there is no commodity shortage / major up cycle, and started pumping AI.

I guess TSLAs are made with AI.",,
359,gyredn1,2021-05-19 23:46:39,t1_gyredn1,t1_gyrea0e,StockMarket,Try again: https://www.google.com/amp/s/amp.ft.com/content/4df2b4cf-2ffe-4db5-9594-47e05e1e2240,,
360,gyree73,2021-05-19 23:46:47,t1_gyree73,t1_gyr864a,StockMarket,BTC was less than $500 five years ago and you think $500k five years from today is unreasonable?,,
361,gyreicx,2021-05-19 23:47:46,t1_gyreicx,t1_gyrdxh8,StockMarket,They are fucking oracles!,,
362,gyrekfl,2021-05-19 23:48:14,t1_gyrekfl,t1_gyrczzx,StockMarket,"Yes, obviously, you dumbfuck. The problem is that no one can actually predict when that will happen. Hindsight makes you a genius, doesn’t it?",,
363,gyrekt7,2021-05-19 23:48:19,t1_gyrekt7,t3_ngj0we,StockMarket,WISH ftw?,,
364,gyrep25,2021-05-19 23:49:18,t1_gyrep25,t1_gyrc7ma,StockMarket,"Yeah, TSLA had a hell of a bull run,and ended up way over valued.

COIN is insanely overvalued.

PLTR, great company, unique product, doesn't scale super well, as is my understanding. Long term bullish on them.",,
365,gyreqmn,2021-05-19 23:49:40,t1_gyreqmn,t3_ng3k6d,StockMarket,Why the fuck we care what China thinks??,,
366,gyrer63,2021-05-19 23:49:47,t1_gyrer63,t3_ngipd7,StockMarket,"Why don’t we just say BTC will reach $1 billion if we’re just throwing random figures around? 

Of course anyone who invests in something wants it to only go up, and go up high. That said, BTC is a fucking Ponzi scheme. You’ll need people willing to pay $500k for a worthless digital coin. BTC has a better chance going to $0 than $500k.",,
367,gyresg4,2021-05-19 23:50:04,t1_gyresg4,t3_ngkp5p,StockMarket,I have waiting for a sale or a 30%off coupon to buy!,,
368,,2021-05-19 23:50:13,t3_ngkzfc,,StockMarket,,ngkzfc,How to Create Passive Income by Staking Your Crypto
369,gyretz6,2021-05-19 23:50:25,t1_gyretz6,t1_gyr8j14,StockMarket,The dude is literally agreeing with you,,
370,gyreyk1,2021-05-19 23:51:28,t1_gyreyk1,t1_gyredn1,StockMarket,"Thank you for proving my point. Nowhere in that document does Cathie say that she interprets every market upheaval to be a test of her faith. 

There is just a small percentage of Reddit who hates Christians and anything related to religion. Grow up, because nobody likes that ki d of person.",,
371,gyrf4zk,2021-05-19 23:52:54,t1_gyrf4zk,t3_nge5g9,StockMarket,Now do the crypto market. Last I checked there were 10 tokens in the green and five of those were stablecoins.,,
372,gyrf5xw,2021-05-19 23:53:07,t1_gyrf5xw,t3_ngkzfc,StockMarket,FYECOIN,,
373,gyrf6mx,2021-05-19 23:53:17,t1_gyrf6mx,t1_gyretz6,StockMarket,"Sarcasm, nice catch",,
374,gyrf86r,2021-05-19 23:53:39,t1_gyrf86r,t1_gyrekfl,StockMarket,"It doesn't take hindsight to not make an extremely risky high dollar investment on something that cost $53000 a share.  That's on the order of reckless.  And when that recklessness plays out, you call people who call it out for the recklessness that it is.... cuss words. That's really awesome of you.  And not at all reckless considering our distance from each other.",,
375,gyrfa84,2021-05-19 23:54:08,t1_gyrfa84,t3_ngkp5p,StockMarket,it’s a trap,,
376,gyrfmka,2021-05-19 23:57:02,t1_gyrfmka,t1_gyrf86r,StockMarket,"You don’t have to buy 1 whole Bitcoin you know? In fact, most people don’t. They buy maybe $10 or $20 dollars worth, maybe even $100. Not $53,000. Frankly it doesn’t even sound like you have trades any crypto before. Maybe learn first before talking down to other people, okay?",,
377,gyrfq33,2021-05-19 23:57:53,t1_gyrfq33,t1_gyreqmn,StockMarket,"It isn't about what they ""think.""  The nation that mines 75% of the world's bitcoin just instituted policies that tanked bitcoins value and I shared that info for those who wondered what spurred the bleeding.   Take it for what it's worth.  
[China bans banks and financial institutions from BTC](https://www.reuters.com/technology/chinese-financial-payment-bodies-barred-cryptocurrency-business-2021-05-18/)",,
378,gyrftfj,2021-05-19 23:58:41,t1_gyrftfj,t3_ngkp5p,StockMarket,"Tesla is unironically due for a big correction/crash. It’s run up absurdly in the last year or two and there are no free lunches in investing, especially when your company currently runs on govt credit and Bitcoin profits. 

The endless gains don’t last forever.",,
379,gyrfu3r,2021-05-19 23:58:51,t1_gyrfu3r,t1_gyqvxtd,StockMarket,"That would destroy far too much capital in the US economy, too many stakeholders for that to happen.",,
380,gyrfv3i,2021-05-19 23:59:05,t1_gyrfv3i,t1_gyrdtha,StockMarket,Nobody ever suggested that you should mimic ARK’s trades. They work with more money and much larger volume than any of us retail peasants.,,
381,gyrfvgn,2021-05-19 23:59:10,t1_gyrfvgn,t1_gyre4uk,StockMarket,Hold for decades and buy every burst.,,
382,gyrfxmk,2021-05-19 23:59:41,t1_gyrfxmk,t1_gyrfmka,StockMarket,"Were talking about Cathy Wood's investments, not yours. Your cussing and your pretending to misunderstand what this article is about is tiresome.",,
383,gyrfyy7,2021-05-20 00:00:00,t1_gyrfyy7,t3_ngkp5p,StockMarket,after they sell there BTC and have nothing to pump the quaterly reports with 😂,,
384,gyrg2mv,2021-05-20 00:00:50,t1_gyrg2mv,t3_ng3k6d,StockMarket,China has been against crypto forever. Crypto went down from short sellers covering margins. China just another cover story,,
385,gyrg3ue,2021-05-20 00:01:07,t1_gyrg3ue,t1_gyrdspa,StockMarket,"I am not spouting non-sense. You have no idea what you are talking about. My portfolio looks great and i have no issues with it.   


Bitcoin will be around within the next 10 years, that i am certain. 50 years is a hard prediction, but why would you think that far ahead in terms of an investment. You hold for a maximum of 5 - 10 years and re-evaluate.   


You have no idea what you're doing, you started with the GME hype and im sure you buy Doge. So please, don't talk big when you cant back shit up son.",,
386,gyrg5oz,2021-05-20 00:01:33,t1_gyrg5oz,t3_ngicxi,StockMarket,"As both a buyer and seller for over a decade on eBay, I can say that eBay should be avoided as an investment for now. They are in the process of  changing the user interface along with the payment system and results so far are not good. I am actively looking for another site to use as the changes have made the eBay website clunky and hard to navigate.",,
387,gyrg5qi,2021-05-20 00:01:33,t1_gyrg5qi,t1_gyrfxmk,StockMarket,"Oh we are? Except Cathie doesn’t put BTC in ARK, so what *are* we talking about?",,
388,gyrgarj,2021-05-20 00:02:45,t1_gyrgarj,t1_gyrdxe5,StockMarket,You have mental problems :),,
389,gyrgb2p,2021-05-20 00:02:49,t1_gyrgb2p,t3_nggddu,StockMarket,There’s no point to do that in anyway. Why sell one asset only to buy another asset in the same asset class?  Asset within They same asset class are highly correlated. You’d be better off just saving the trading cost and riding it out.,,
390,gyrgdzr,2021-05-20 00:03:31,t1_gyrgdzr,t1_gyrg3ue,StockMarket,Now you're comparing portfolio size? And you call me son?  Childlike behaviour. Its endearing.  Nobody's talking big here. I am sure your portfolio is awesome. It's amazing. It's so perfect. Lol,,
391,gyrggbg,2021-05-20 00:04:03,t1_gyrggbg,t3_ngkp5p,StockMarket,"Tesla will drop, and I will buy",,
392,gyrgihg,2021-05-20 00:04:32,t1_gyrgihg,t3_ngkp5p,StockMarket,Michael Burry enters the chat:   Ehem!!!,,
393,gyrgnpg,2021-05-20 00:05:45,t1_gyrgnpg,t1_gxo9vjt,StockMarket,Ticker change in 13!,,
394,gyrgq0r,2021-05-20 00:06:18,t1_gyrgq0r,t1_gyq7wts,StockMarket,"JPM has thousands of employees and often puts out competing and contradictory reports simultaneously. As long as they’re being talked about in the media, it’s good for their business.",,
395,gyrgrek,2021-05-20 00:06:37,t1_gyrgrek,t1_gyrer63,StockMarket,"1. BTC was worth less than $500 five years ago. Meaning it has 100x in five years. It would only have to 15x in five years from today’s value to reach $500k. Not unreasonable based on past growth.  

2. You know you don’t have to buy a whole Bitcoin right? You can just buy $10 or $20 worth. No one would have to pay $500k for anything.",,
396,gyrgs1y,2021-05-20 00:06:45,t1_gyrgs1y,t3_ngiz83,StockMarket,At least he's taking the initiative. A lot of people would just run away.,,
397,gyrgs22,2021-05-20 00:06:46,t1_gyrgs22,t1_gyrg5qi,StockMarket,O my I have been so schooled by the bitcoin true believer that can't take anybody that doesn't toe the line with your bitcoin fantasy. Have a nice ponzi.,,
398,gyrgsj0,2021-05-20 00:06:52,t1_gyrgsj0,t1_gyr9ekw,StockMarket,I agree physical currency has utility as a backup. Power outages can cause serious issues.,,
399,gyrgve0,2021-05-20 00:07:33,t1_gyrgve0,t3_ngiz83,StockMarket,Hahaaa!! Facts🤘😎,,
400,gyrgvkl,2021-05-20 00:07:36,t1_gyrgvkl,t3_ngk3kr,StockMarket,Check out avantis funds. AVDV is small cap value.,,
401,gyrgykq,2021-05-20 00:08:18,t1_gyrgykq,t3_ngiz83,StockMarket,When you're witnessing the MOASS happening and buy the dip in stocks that will only continue to tank 🤡,,
402,gyrgzfg,2021-05-20 00:08:30,t1_gyrgzfg,t1_gyrdila,StockMarket,You and a prostitute? Maybe. Me and your wife? Easy.,,
403,gyrh2n3,2021-05-20 00:09:17,t1_gyrh2n3,t3_ngkp5p,StockMarket,MB already predicted it.,,
404,gyrh78g,2021-05-20 00:10:23,t1_gyrh78g,t1_gyrgs22,StockMarket,Dude what are you even talking about? I don’t own any BTC. I am simply correcting you think that ARK buys BTC when they don’t. Either correct your understanding or GTFO.,,
405,gyrha27,2021-05-20 00:11:04,t1_gyrha27,t1_gyrgs22,StockMarket,Man you have problems lol,,
406,gyrhbyr,2021-05-20 00:11:30,t1_gyrhbyr,t3_ngkp5p,StockMarket,I'm not sure I want to buy stocks from a company that counts on tweets for profits :\\,,
407,gyrhci1,2021-05-20 00:11:38,t1_gyrhci1,t3_ngkp5p,StockMarket,I’ll keep shorting it but even heavier now!! Once it’s back to the $400-$500 then buy it up with all the gains!! Thanks for the motivation,,
408,gyrhcnx,2021-05-20 00:11:40,t1_gyrhcnx,t1_gyr77bz,StockMarket,"Funny How this article says different.

[Helium Is Instrumental in Semiconductor Manufacturing](https://www.google.com/amp/s/www.instituteforenergyresearch.org/fossil-fuels/helium-is-instrumental-in-semiconductor-manufacturing/amp/)",,
409,gyrhgrw,2021-05-20 00:12:39,t1_gyrhgrw,t1_gyqw5ez,StockMarket,It’ll be fine,,
410,gyrhh56,2021-05-20 00:12:44,t1_gyrhh56,t1_gyrgq0r,StockMarket,"JP Morgan is in the business of wealth management and lending. There is no shortage of people who need loans, and they already have over $1 trillion in AuM. JP Morgan is the largest bank in the USA. I highly doubt they need any press release.",,
411,gyrhnd3,2021-05-20 00:14:12,t1_gyrhnd3,t3_ngaw32,StockMarket,"Stock dilution is a huge problem that most investors do not understand, if you hate the fed printing money then look at the outstanding shares of each company, if share issuance continues to happen your equity is being diluted, unfortunately most ""growth"" companies continue to do this and most investors do not even notice.",,
412,gyrhnof,2021-05-20 00:14:16,t1_gyrhnof,t3_ng7tot,StockMarket,They buy Wells Fargo while you bitches argue,,
413,gyrhqp3,2021-05-20 00:14:58,t1_gyrhqp3,t3_ngiz83,StockMarket,The flames are hot for sure.,,
414,gyrhsh7,2021-05-20 00:15:22,t1_gyrhsh7,t3_nggn9d,StockMarket,He chose poorly,,
415,gyrhtip,2021-05-20 00:15:36,t1_gyrhtip,t3_ngkp5p,StockMarket,"I Tesla crashes it will crash the QQQ, ARK and SP500. It will take the whole market with it",,
416,gyrhw55,2021-05-20 00:16:13,t1_gyrhw55,t1_gyqp00y,StockMarket,"Like a stock, it needs to *do* something.  Is there a market for the thing it does?  Does it have a developer base?  Does it have funding?  What is its supply and market cap?",,
417,gyri13o,2021-05-20 00:17:21,t1_gyri13o,t1_gyrgdzr,StockMarket,"Where did i compare portfolio size? None of what i have said is child like behavior. I called you son because you are like a underdeveloped child and i am like an adult that is schooling you, kiddo. You are side tracking the discussion and not even talking about the main point because i have schooled you so hard, you literally have no other comeback but to type out junk in an attempt to offend me. Good work!   


I also said you have mental problems, which you haven't defended so i will assume you do have mental problems :)",,
418,gyri279,2021-05-20 00:17:37,t1_gyri279,t1_gyrhsh7,StockMarket,:(,,
419,,2021-05-20 00:18:01,t3_ngll30,,StockMarket,,ngll30,Odd coincidence or manufactured dip what do you think?
420,gyri64s,2021-05-20 00:18:31,t1_gyri64s,t3_nggn9d,StockMarket,Sold yesterday when green. Bought today when red. 😉,,
421,gyri66n,2021-05-20 00:18:32,t1_gyri66n,t1_gyrdtju,StockMarket,😁😁,,
422,gyri7fl,2021-05-20 00:18:50,t1_gyri7fl,t3_ngkp5p,StockMarket,"Bruh id need a thesis paper to express all the ways ""calling it"" based on that is a bad move.

But the easiest and quickest way to point it out would be that the graphic your referencing is old enough that it pre-dates the modern architecture of the stock market.

No one refers to the tail end of the sell off as ""despair"" under the age of 50",,
423,gyriadx,2021-05-20 00:19:30,t1_gyriadx,t3_ngkp5p,StockMarket,"It’s overvalued by almost 300%, that actually is very true!! Elon Musk is very bright and ambitious person but Tesla is only the EV car company, which I love. SpaceX will never go public unfortunately but other start up’s Elon Musk has created should become subsidiaries of Tesla basically creating a new Berkshire A if he doesn’t ever split the stock again ever 😂😂",,
424,gyrib5o,2021-05-20 00:19:41,t1_gyrib5o,t3_ngk3kr,StockMarket,"I have FIDI, FDEM and DEM  Haven't had any of them long enough to make a strong recommendation either way.   My main portfolio is US Large Caps which have a strong international prescence.",,
425,gyribfr,2021-05-20 00:19:45,t1_gyribfr,t3_ngll30,StockMarket,"If it was a marketwide reaction, everything should be staggered after Bitcoin. Looking at the charts it looks super suspect.",,
426,gyricc2,2021-05-20 00:19:58,t1_gyricc2,t1_gyribfr,StockMarket,"If 't be true t wast a marketwide reaction, everything shouldst beest stagger'd after bitcoin.  Looking at the charts t looks super suspect

***



^(I am a bot and I swapp'd some of thy words with Shakespeare words.)

Commands: `!ShakespeareInsult`, `!fordo`, `!optout`",,
427,gyrid2s,2021-05-20 00:20:09,t1_gyrid2s,t1_gyq6lgv,StockMarket,The force is strong with you.,,
428,gyrikxs,2021-05-20 00:21:56,t1_gyrikxs,t1_gyqw5ez,StockMarket,If course it is,,
429,gyriluq,2021-05-20 00:22:09,t1_gyriluq,t1_gyrftfj,StockMarket,That is assuming that there isn’t a major catalyst that will push Tesla up again. And there are a few good ones coming up in the next couple of months.,,
430,gyrim3p,2021-05-20 00:22:13,t1_gyrim3p,t3_ngj0we,StockMarket,"The reason I stayed away is because of lack of LTV. Lifetime value. Because of the repeat customer #, it will have a market saturation point. 
I tend to buy what I use. I always look on Amazon. I rarely even consider Etsy unless amazon doesn’t have. 

It will be a good investment though.",,
431,gyrimpb,2021-05-20 00:22:21,t1_gyrimpb,t1_gyricc2,StockMarket,I hate you Shakespeare bot.,,
432,gyrin8b,2021-05-20 00:22:29,t1_gyrin8b,t1_gyri64s,StockMarket,O wise one ⬆️⬆️,,
433,gyrinmr,2021-05-20 00:22:34,t1_gyrinmr,t1_gyrekt7,StockMarket,No,,
434,gyriobh,2021-05-20 00:22:44,t1_gyriobh,t3_ngiz83,StockMarket,If I’m down $160 what would I need to invest at .33 to get to even? Currently hodlin 8200 coins at avg .45,,
435,gyriojl,2021-05-20 00:22:47,t1_gyriojl,t1_gyrh78g,StockMarket,"This woman is deliberately pumping up a product to further her own investment. Even viewing her face is on par with looking at the lowest of the lowest con people. The whole thing has a hint of criminality about it.  I feel dirty even being here.  Crypto is a get rich quick ponzi scheme, and has no value for the long term investor. The long term investor is not just 5 or 10 years. People are investing for their retirements. I wrongfully assumed Ark was invested in bitcoin, but of course it's not because she would be fined by the SEC for talking it up. But she does it in a 3rd party fashion instead because she's an investor in coinbase. It's sleazy as all heck.  And encouraging people to invest in an item that is doomed to fail is immoral.",,
436,gyriq51,2021-05-20 00:23:10,t1_gyriq51,t1_gyr5pvo,StockMarket,This,,
437,gyrirsn,2021-05-20 00:23:34,t1_gyrirsn,t1_gyriojl,StockMarket,"The other guy is right, you are mentally ill. 😬",,
438,gyrismg,2021-05-20 00:23:45,t1_gyrismg,t3_ngaw32,StockMarket,IN SU I TRUST!,,
439,gyrisnp,2021-05-20 00:23:46,t1_gyrisnp,t3_ngll30,StockMarket,Just admit you are new and stop saying everything is a coordinated attack.,,
440,gyriwcn,2021-05-20 00:24:38,t1_gyriwcn,t1_gyrfyy7,StockMarket,"They told us twice they're not selling.

You must not be paying attention if you think less than 10% of their free cash is pumping their stock. And not the two new factories outside the USA ramping up to make cars directly on the continents where the EV demand is twice as high amoung consumers",,
441,gyriwkd,2021-05-20 00:24:41,t1_gyriwkd,t1_gyrcs1o,StockMarket,Its so easy 😂,,
442,gyrizk9,2021-05-20 00:25:21,t1_gyrizk9,t3_ngkp5p,StockMarket,Tesla has so many catalysts coming up so I dont know...,,
443,gyrj0p1,2021-05-20 00:25:38,t1_gyrj0p1,t1_gyqp1of,StockMarket,"It's funny how many times I say basically this same thing but people downvote me into oblivion


More adoption = less volatility


But it will take time, trust, and businesses are still a ways from having ' infrastructure ' ready, etc.. but with time we get more coins (ALL FUCKING COINS, EVEN ALTS). More coins = hopefully more wide spread holders and therefore even less volatility etc.


How I see it now especially considering everyone argues against alts because they 'can never beat bitcoin cuz MATH'; I agree and I say alts with lower USD equivalent caps have a better chance of being used often for currency because people will learn ""XYZ coin can never go above $xx.xx"".


Let's say that 'max' is $10.. if I need to buy groceries, I'll 1000000% use my coins that are at $6. can't go over $10 anyways so if it blows up tomorrow I'm not that upset. 


But we all know BTC (or a few others) are often theorized $100k+, 200k+.. that's great but I'm not gonna use a portion of my moonshot tickets for groceries when I have other 'less risky' things.


Bring on the downvotes 🤦‍♂️",,
444,gyrj2te,2021-05-20 00:26:07,t1_gyrj2te,t1_gyribfr,StockMarket,"There is a user on 4chan who 6 hours before this all happened said that there would be manufactured dumping to slow bitcoin, ethereum, all the big coins. He gave live updates and said ""expect Bitcoin to fall to 29,000 and then rise a few hours later."" And well, here we are... pretty damn sus",,
445,gyrj9bl,2021-05-20 00:27:40,t1_gyrj9bl,t3_ngll30,StockMarket,One more time for sus,,
446,gyrja1q,2021-05-20 00:27:50,t1_gyrja1q,t3_ngll30,StockMarket,Crypto just does that shit.,,
447,gyrjbmy,2021-05-20 00:28:13,t1_gyrjbmy,t1_gyribfr,StockMarket,Then if you look at drops and when they happened that first little dip on all of them I’m guessing was the people who planned this then right when all the “this is why Bitcoin will fail.” (Which I’m guessing was also planned. As well as them trying to blame it on chinas new plan for electric yen) News came out it all crashed,,
448,gyrjbzi,2021-05-20 00:28:18,t1_gyrjbzi,t1_gyrizk9,StockMarket,Like what ?,,
449,gyrjcci,2021-05-20 00:28:23,t1_gyrjcci,t3_ngll30,StockMarket,From what i heard china banned trading crypto or something of that sort,,
450,gyrjcdt,2021-05-20 00:28:24,t1_gyrjcdt,t3_ngipd7,StockMarket,🤣🤣🤣🤡,,
451,gyrjdcx,2021-05-20 00:28:37,t1_gyrjdcx,t3_ngkp5p,StockMarket,"I think the only way you get TSLA to 'dump' (And when you say dump I'm assuming you mean a crash like $200?) is if the broader markets do some sort of a nose dive. (i.e. 20%+ correction).  I don't see that happening.  But then again, what do I know.",,
452,gyrjf3v,2021-05-20 00:29:02,t1_gyrjf3v,t1_gyrja1q,StockMarket,I’m just not liking the pattern and how they are all equal I agree crypto does that,,
453,gyrjfrn,2021-05-20 00:29:12,t1_gyrjfrn,t3_ngkp5p,StockMarket,4D Chess to Kill Shorts ;),,
454,gyrjgps,2021-05-20 00:29:25,t1_gyrjgps,t1_gyrb4tp,StockMarket,"Anything concrete really. There are no financial statements, no managers to judge, it’s competitors are just other cryptos which I guess you could analyze. I suppose you could also look at market cap but I’m not really sure how much that really factors into how well the crypto is going to do",,
455,gyrjhvr,2021-05-20 00:29:42,t1_gyrjhvr,t1_gyrisnp,StockMarket,Conspiracy theories make the story more exciting than believing our trusted co investors are paper handed bitches.,,
456,gyrji25,2021-05-20 00:29:44,t1_gyrji25,t1_gyrib5o,StockMarket,Im guessing the last two are more emerging market then value etf/fund thats not really what im looking for but tyvm and ill look them up!,,
457,gyrjj3r,2021-05-20 00:29:59,t1_gyrjj3r,t1_gyrjbzi,StockMarket,"Giga Berlin is a big one, but also cybertruck and the semi. Rumors of a new $25k model manufactured in china, hopefully finally larger rollout of FSD, to name a few",,
458,gyrjjgt,2021-05-20 00:30:04,t1_gyrjjgt,t1_gyrf4zk,StockMarket,https://chartexchange.com/crypto/,,
459,gyrjkfg,2021-05-20 00:30:17,t1_gyrjkfg,t1_gyrisnp,StockMarket,Well there’s a lot of proof to back it up I’ve hardly said something was coordinated but this looks off,,
460,gyrjm8d,2021-05-20 00:30:42,t1_gyrjm8d,t1_gyre77c,StockMarket,https://chartexchange.com/crypto/,,
461,gyrjn39,2021-05-20 00:30:54,t1_gyrjn39,t1_gyrjbmy,StockMarket,I am fine with it. I doubled my position today. Now it doesn't have to run as much for me to win big.,,
462,gyrjpnc,2021-05-20 00:31:31,t1_gyrjpnc,t1_gypirkq,StockMarket,Admiral gender studies,,
463,gyrjqj9,2021-05-20 00:31:43,t1_gyrjqj9,t1_gyrgs1y,StockMarket,Hahahah me with Bitcoin right now,,
464,gyrjqwl,2021-05-20 00:31:49,t1_gyrjqwl,t1_gyrfa84,StockMarket,It’s the bear trap. OP is zoomed in too much and isn’t looking at the big picture,,
465,gyrjwpr,2021-05-20 00:33:13,t1_gyrjwpr,t1_gyrjkfg,StockMarket,evidence and proof are two different things. Some guy posting something about something is hardly anything.,,
466,gyrjxsc,2021-05-20 00:33:28,t1_gyrjxsc,t3_ngkp5p,StockMarket,More like it will top BRK-A,,
467,gyrjy42,2021-05-20 00:33:32,t1_gyrjy42,t3_ngkp5p,StockMarket,Gee you're only the 99999th person to say that over the last bunch of years! Wow! Wanna post your shorts?,,
468,gyrjzac,2021-05-20 00:33:50,t1_gyrjzac,t1_gyre4uk,StockMarket,"i know tesla isnt just a car company but tesla is just a car company. Once the valuation gets down to reality and is reflective of one of the smallest car companies in the world, its' stock price will stay there. You do what you gotta do but I wont touch that stock with a 10ft poll. Also Elon is an actual psychopath. It's all downhill for tesla from now on, bro.",,
469,gyrk0kj,2021-05-20 00:34:08,t1_gyrk0kj,t1_gyr9ajo,StockMarket,I bought SLVO and ECC,,
470,gyrk34n,2021-05-20 00:34:44,t1_gyrk34n,t1_gyrgrek,StockMarket,"Say it after me: it’s a worthless digital currency that has proven to have no real world applicability and is on the fast track to be banned around the world along with all other crypto. But good luck with 100x your investments, because...you know...past performance is indicative of future performance.",,
471,gyrk3us,2021-05-20 00:34:55,t1_gyrk3us,t1_gyriobh,StockMarket,Same problem. At 55. Losing $540. Don't think I can spare more to even it out.,,
472,gyrk8lq,2021-05-20 00:36:00,t1_gyrk8lq,t1_gyrk0kj,StockMarket,Good luck. I bought a little bit of silver bullion 🤣🤣,,
473,gyrka3o,2021-05-20 00:36:20,t1_gyrka3o,t3_ngll30,StockMarket,So many idiots that havent a clue what's going on shit posting about the crash.  The Chinese government banned crypto and added even more ways to limit their people to buy it or sell it. this is why every crypto has crashed in the same way. The majority of miners and traders come from there,,
474,gyrka5u,2021-05-20 00:36:21,t1_gyrka5u,t1_gyriwcn,StockMarket,but chinese market share is going to chinese manufacturers and not tesla. europe is going to volkswagen and not tesla and Im a betting man and betting that NA goes to Ford in the end. Tesla is one of the smallest car companies in the world. their stock will soon reflect that.,,
