,comment_id,created,fullname,parent_id,subreddit,text,post_id,title
788,,2021-05-21 01:49:39,t3_nhh78w,,stocks,"Investment Thesis for Daily Journal (DJCO)

Introduction:  The Daily Journal is viewed by the general public as a dying newspaper business.  It is a dying newspaper business, but the Daily Journal has pivoted itself to a SaaS business, but is trading at a valuation far below most other publicly traded Saas businesses.  We will investigate why the Daily Journal is a worthwhile investment at its current valuation.

Management:  Normally, we’d begin by looking at the business, but management within the Daily Journal is incredibly strong, so this will be our beginning.  The Chairman of the Board in Charlie Munger, Vice-Chairman of Berkshire Hathaway.  He bought the Daily Journal in 1977 for $2 million dollars and has been the Chairman ever since.  The lesser known name leading the Daily Journal is Gerald Salzman.  He joined the Daily Journal in 1986 as their President, CEO, CFO, Treasurer.  As such, there is likely no one else who knows the Daily Journal as well as Gerald Salzman.  As an added bonus to the quality of the two men leading the Daily Journal, their executive compensation is almost unheard of.  The Board of Directors receive a payment of either $5000 or $0.  Gerald Salzman, the CEO, receives a salary of $250,000.  These are acceptable salaries due to the large amount of insider ownership within the Daily Journal.

The Business:  The Daily Journal has three business segments, 1) The Daily Journal Newspaper, 2) Equity Investments, and 3) Journal Technologies.

---

The Daily Journal Newspaper is a series of mostly California based legal newspapers.  Their revenue comes from advertising from display advertising (i.e. traditional advertising found in most newspapers), classified advertising, trustee notice sale advertising, legal notice advertising, and circulation advertising.  The sad but unfortunate truth for investors is that this portion of their business is worth very little.  The good news, however, is that most investors outside of the Daily Journal are not interested in investing in a dying newspaper and thus has led to the undervaluation of the Daily Journal.

I won’t spend any more time on this segment except to say that the newspaper’s most successful year isemi-modern history was during 2008 due to an extreme uptick in the need for legal advertising relating to the foreclosure of many homes.  It is possible that if another recession strikes, the newspaper business of the Daily Journal could provide some financial cushion to keep the Daily Journal in strong health.

---

Equities have been a growing proportion of the Daily Journal’s intrinsic value.  Charlie Munger’s investing prowess that has benefited Berkshire is also at work within the Daily Journal.  We have insight into the Daily Journal’s American investments thanks to their most recent 13F filing, which was released within the last week.  At this time, the Daily Journal holds $197 million worth of American equities, mostly concentrated in financial services similarly to the holdings of Berkshire Hathaway.  Another notable holding is a new and growing position in Alibaba.  

While it is not explicitly confirmed, there is a VERY strong evidence that the Daily Journal also holds a sizable position in BYD, a Hong Kong traded electric car manufacturer.  This would not appear in its 13F filings, so its size cannot be confirmed, however we can make an educated guess.  The exact value of his BYD investment is unknown, however it is assumed to be be roughly $140 million.  In the most recent filing, the Daily Journal notes that it sold $20 million of one of its positions to reinvest into another security.  The suspicion is that this was a shift from BYD to BABA.  As such, we will value the BYD position at $120, though in truth, it may be slightly higher as BYD traded at a fewer dollars higher of a valuation prior to the most recent filing.  Nonetheless, we will assume its value is $120 million.  This brings the Daily Journal’s equity portfolio to a value of $317 million.

The Daily Journal also has $27 million in cash according to their latest annual report and they hold some office buildings in Los Angeles and in Utah which THEY value at $16.5 million.  I emphasized that they value the building because, as I’ll discuss below, the company has some questionable accounting practices.  In the instance of the office buildings in Los Angeles as an example, they valued the buildings at $16.5 million roughly 20 years ago and that figure has never been adjusted.  The result is that they are likely undervaluing the true value of their real estate holdings.  If we increase the value of these holding to $30 million, which seems like a fair appraisal for their buildings based on current market rate, this results in a total equity and asset value of $374 million.

Their liabilities consist of ~$60 million in deferred capital gains (0% interest), a $29.5 million margin loan (3% interest), and a $1.5 million mortgage (4% interest).  The deferred capital gains will not be paid anytime soon as Charlie Munger likes to hold stocks and when he sells, typically he will move into another qualified investment.  The margin loan was used to acquire businesses to build the Saas business and is serviced by the dividends from the bank stocks in the equity portfolio.  The mortgage is self explanatory.  Total liabilities amount to $91 million

Before jumping into the last portion of the Daily Journal’s business segment, I want to note that the Daily Journal has a market cap of $414 million.  As such, to reach its market cap valuation, assuming no value is assigned to the legal newspaper business (it has a value, it’s just not a high value and in all honesty, I don’t know what a fair value is for that business), the Journal Technologies business only needs to be worth $131 million to come a fair market value at its current market cap valuation.

---

Journal Technologies is the hidden gem of the Daily Journal.  It is a legal Saas business being sold to municipalities via the RFP process.  It is a case management system built off of a central e-Suites product that is then configured to meet the client’s needs.

It has a unique business model that results in, once again, an undervaluation of the company.  After being awarded an RFP, the company will then define the scope of the product, establish servers on site, and install its product, and then configure it to the clients needs.  All of this work takes 4 to 8 years to complete and during this time, the municipality is not billed.  On a relevant note to the questionable accounting practices above, the Daily Journal does not report the forthcoming revenue on its financial statements, thus these contracts have not necessarily been taken into account to determine the Daily Journal’s current market valuation.

When its e-Suites product goes live, the Daily Journal will charge an implementation fee and subsequently bill a licensing fee for the next 10 years (with built in price adjustments to account for inflation).  Currently, Daily Journal has over $100 million in forthcoming revenue which, due to their billing practices, is a very high-margin revenue once billing starts.  These contracts are found in the USA, Australia, Canada, and Tasmania currently, though more may have been signed and not discovered.  Credit to Matthew Peterson for taking the time to search across the web looking for tenders awarded to the Daily Journal, as there is not a central repository to identify these contracts.

Moving forward, the assumption is that the Daily Journal will continue onboarding new jurisdictions, there will be an increase in licenses purchased for existing contracts after e-Suites launches, consulting fees for upgrades and modifications will increase, and other e-solutions will be integrated with e-Suites to increase revenue (such as e-payment for fines and tickets).

While the Journal Technologies already has $30-some million in revenue, this figure will increase with time.  Additionally, these municipalities will likely continue using the e-Suite services once they go live after the time and cost of configuration, meaning revenue that is on the books today is revenue that will be on the books likely after the 10 years of licensing has expired.  Presently, Journal Technologies is a $200-$300 million business based on the figures and assumptions above.  Under this assumption, the Daily Journal is valued somewhere between $483 million and $583 million, meaning it is currently undervalued by 17% to 41%.

---

There are a few risks that need to be mentioned.  One is liquidity.  The Daily Journal has a $400 million dollar market cap and is too small for many large financial institutions to monitor.  It also has a $300 share price which, while irrelevant to value, will scare away many newer retail investors who invest $20 to $50 at a time.  Beyond these two issues, the Daily Journal has quite a bit of insider ownership or is owned by firms with long-term visions, thus they are not willing to sell shares on a daily basis.  The result is that only about 5,000 shares are traded on a daily basis.  This means that if you need to liquidate your position in a pinch, you may have to sell below the market rate.

The other glaring issue is age.  Charlie Munger is 97 years old and Gerald Salzman is 80 years old.  Beyond not being at the forefront of technological innovation on a personal level (some may view this as an issue when running a Saas business, personally I am not concerned as there job is to manage the people driving the Saas business), their old age means that in the coming years, their leadership may cease to exist.  No clear succession plan has been identified (this was raised during their last annual meeting by a concerned shareholder).  As management is a key strength within this business, this could be reason for pause for prospective shareholders.

Lastly, there is the $16 billion elephant in the room.  Tyler Technologies is their key competitor.  There are other smaller competitors who offer more limited solutions, but Tyler Technologies is the real competition in this space.  While their products are more modern and (likely) have better and flashier features, this is not necessarily what wins in RFP processes.  Instead, the Daily Journal’s practice of not charging the client until launch is a much more appealing catch for prospective clients.  While I’m sure Tyler Technologies will be a fine company in the long-term, its hard to argue that their fundamentals are nearly as attractive as the fundamentals of the Daily Journal.  The Daily Journal is valued at 8x sales, has a P/B of under 2, and has a P/E of 3.5.  By comparison, Tyler Technologies has a P/B of 8, is valued at 14x sales, and has a P/E of 91.  Tyler Technologies would need to continue growing at a very rapid pace to be a strong value investment (note that Tyler Technologies is still rapidly growing, though this rapid growth is slowing).  By comparison, the Daily Journal, if it continues at its current growth, is already a great investment.  As most clients are onboarded, growth is increasing and it is my belief that this will be a phenomenal investment.

---

Disclaimer: I hold shares of DJCO.  I am posting this because after my research, I think others would benefit from investing in this company AND because I want community feedback on thoughts about DJCO.  My intention is to hold DJCO for a minimum of 4 years, though more realistically I will hold this for a very long time since, as I noted above, the revenue for this company is incredibly sticky and I believe they have many avenues to increase their sales.",nhh78w,(DJCO) My mini-essay investment thesis for The Daily Journal - Why you should buy a dying newspaper business
789,gyw9p8y,2021-05-21 01:50:05,t1_gyw9p8y,t1_gyw917s,stocks,05 Sierra 17 f250. 05 m3,,
790,gyw9wqx,2021-05-21 01:51:55,t1_gyw9wqx,t1_gyw6ju8,stocks,Thanks!,,
791,gyw9xis,2021-05-21 01:52:07,t1_gyw9xis,t1_gyvntt9,stocks,"Ford just had the most profitable quarter in their history. They are reducing debt by closing operations in unprofitable areas of the world (See Brazil).  They have the best-selling vehicle in the America (F150) and the best-selling commercial vehicle (Transit). Both are being electrified and will be extremely popular. The F150 Lightning is spectacular. They also have their ICE cars, of course, which gives them a much larger target market than Tesla (which has never turned a profit without carbon credits). The Mustang Mach-E has gotten rave reviews across the board. 

Ford has the resources and brand recognition to overtake Tesla in five years or less. Tesla’s bulls talk about the appeal to Millennials...who are the poorest generation.  

Thank you for explaining what “outperform” means to me. I said I would have plenty left over because it’s not fair to put just shy of $1.3m against whatever you have in your Robinhood account.",,
792,gyw9z28,2021-05-21 01:52:30,t1_gyw9z28,t3_nhgu4k,stocks,">  There is absolutely NO WAY I'm buying ADR shares without the dividend. Why would I sacrifice that much in potential gains

i'd be more concerned about the growth of the company than the dividend...

if the stock goes -50%, do you think you'll care about a 1% div",,
793,gyw9zm9,2021-05-21 01:52:39,t1_gyw9zm9,t1_gyv1uiy,stocks,">  a boatload of

You mean a *truckload*, ***right***?",,
794,gywa05m,2021-05-21 01:52:47,t1_gywa05m,t1_gyv7945,stocks,I gotta think most commercial pickup trucks aren't driving 100+ miles a day.,,
795,gywa2le,2021-05-21 01:53:24,t1_gywa2le,t1_gyv5fif,stocks,RemindMe! 5 years,,
796,gywa2m2,2021-05-21 01:53:24,t1_gywa2m2,t1_gyw9zm9,stocks,Buh dum tsss,,
797,gywa5fe,2021-05-21 01:54:06,t1_gywa5fe,t1_gyw2dlx,stocks,"Unless Tesla is getting into public transportation, they aren’t trying to compete with Tesla.",,
798,gywa6pp,2021-05-21 01:54:25,t1_gywa6pp,t1_gyv5fif,stocks,RemindMe! 5 years,,
799,gywa9z4,2021-05-21 01:55:13,t1_gywa9z4,t3_nhe5c0,stocks,"You started your clock from May 21, 2020 and then arbitrarily allowed for a ""peak value"" at some point in the future. This is a recipe for FOMO and timing the market. 

Look at most any stock and you'll see it at least doubled since then. Even boring staid AAPL lol

FWIW, I have a few. MOGO, ATNF, ARRY, PUBM, SLQT, MLHR, BLDE",,
800,gywaack,2021-05-21 01:55:19,t1_gywaack,t1_gyva1vh,stocks,">No more starter, no more ignition, no more alternators.... no more engineers. 

Ford doesn't design any of those products.  Those are all suppliers that will be cutting jobs, not Ford.  You could argue that the cost going to suppliers will go down, but that's not true either, as battery costs are large.  This is true with batteries at $100/kWh.  We'll need to get a bit lower for your argument to be true.",,
801,gywabf9,2021-05-21 01:55:35,t1_gywabf9,t1_gyuv5sm,stocks,It's not 1998 anymore.,,
802,gywagcf,2021-05-21 01:56:46,t1_gywagcf,t1_gyvb1k3,stocks,"That's the thing, most people do prefer the Ford brand over GM, but the numbers simply looks better for GM because they are running a financially leaner company, whereas F tends to spend a lot, and the debt looks shaky especially when a lot of their  earnings come from Ford credit arm.

&#x200B;

When we're buying Ford stock , we're buying an automaker and a bank. And some folks look to the huge debt sheet as a negative because they borrow a lot on their credit to loan out to their customers. In a downturn that could hurt them.",,
803,gywai5t,2021-05-21 01:57:12,t1_gywai5t,t1_gyusmsu,stocks,Because they cost the same as a full size. I'd love a ranger or diesel Colorado as I need a commuter plus a truck for house stuff but for the same price I'd take the full size all day,,
804,gywaj5h,2021-05-21 01:57:27,t1_gywaj5h,t1_gyuov3x,stocks,">Ford makes all its profit from trucks. 

Pretty understandable when they don't manufacture cars.",,
805,gywao8y,2021-05-21 01:58:42,t1_gywao8y,t1_gyv0ocq,stocks,"Yup.  Ford's a part owner of Rivian, and man right now I'd like to short Rivian... even though I kinda want a Rivian!",,
806,gywap7m,2021-05-21 01:58:56,t1_gywap7m,t3_nhh182,stocks,[This explains dual/multi listing better than I ever could](https://www.investopedia.com/terms/d/duallisting.asp),,
807,gywaqnb,2021-05-21 01:59:18,t1_gywaqnb,t1_gyw9ms2,stocks,"""Radioactive waste"", in other words, less efficient fuel that can still be used. The oil lobby really has done a very effective job keeping the masses ignorant. You realize they pay for your school right? You'll seeeeeeeeeee. Its out of yours and soon their control.",,
808,gywavge,2021-05-21 02:00:27,t1_gywavge,t1_gyvncoc,stocks,"> As an example, my parents live 300 km round trip from me, and in the winter temperatures where they live frequently drop below -20 deg C, at that temperature range is about 50% of nominal. That means there is a unacceptably high chance that current EV ranges would not be enough to make a round trip to my parents house in winter, something I do frequently so my daughter can visit them. Just about every survey and market analyst report I've read lists range as a top barrier/concern for consumers considering EVs, even now with 200-250 mile range EVs. It's a valid point.

I don't think **most people** will need to drive 186 miles in one day in subzero temperatures with parents who don't let their child charge their car at their house very often. 

Not literally every single person needs to buy an EV right away for them to be a success.",,
809,gywawgz,2021-05-21 02:00:42,t1_gywawgz,t3_nhe5c0,stocks,2020 not the year to use as baseline going forward. I for damn sure not making 70% this year,,
810,gywawmj,2021-05-21 02:00:44,t1_gywawmj,t1_gywavge,stocks,300 km is 186.41 miles,,
811,gywb13m,2021-05-21 02:01:51,t1_gywb13m,t1_gyw4u9c,stocks,Why do you believe that to be so?,,
812,gywb188,2021-05-21 02:01:53,t1_gywb188,t3_nhe5c0,stocks,Penis,,
813,gywb2u2,2021-05-21 02:02:16,t1_gywb2u2,t3_ngx4qm,stocks,Bought in at $16 2 days ago. Going good for me so far,,
814,gywb2un,2021-05-21 02:02:17,t1_gywb2un,t1_gyvwbik,stocks,"I use Schwab, where I usually can buy any OTC, and I can’t even find Invictus Energy. That could be why?",,
815,gywb3c4,2021-05-21 02:02:24,t1_gywb3c4,t1_gyvvy7y,stocks,"For you? Yeah. This has been going on for a long time with other expensive electronics. Here the thing though: they make $$, which is good for the stock.",,
816,gywb49j,2021-05-21 02:02:37,t1_gywb49j,t3_nhfij4,stocks,"Wonder when it will finally sink in that TSLA doesn't have, and will probably never have, true Full Self Driving capabilities for their vehicles.

Uber has abandoned it.
Google is ditching it (Waymo IPO). 

How many other failed attempts are needed to finally accept it isn't going to happen?",,
817,gywb7c9,2021-05-21 02:03:23,t1_gywb7c9,t1_gywa05m,stocks,Yeah exactly,,
818,gywb7sr,2021-05-21 02:03:30,t1_gywb7sr,t1_gyuzo66,stocks,"Reddit is gen z version of Facebook, MySpace and Instagram combined.",,
819,gywbcze,2021-05-21 02:04:47,t1_gywbcze,t3_nh5i9p,stocks,AMT,,
820,gywbf2b,2021-05-21 02:05:18,t1_gywbf2b,t3_nh6bxq,stocks,"Electric vehicles are going to be huge and completely control the market soon, the part manufacturers are good investments.",,
821,gywbf42,2021-05-21 02:05:19,t1_gywbf42,t3_nh6bxq,stocks,I'm doing the same for Volvo. Those Polestar models are looking great and I think they can really stand on their own in the next 5-10 years against TSLA,,
822,gywbg6u,2021-05-21 02:05:34,t1_gywbg6u,t1_gyv095g,stocks,"My heart hurts today. My 97 ranger died 2 days ago and it isn't in the cards to fix it. I have a newer truck now that could eat it for lunch, but I'm going to miss that little guy sooo much. I know that I should scrap it, but I can't make myself do it quite yet, so it's parked out back as a reminder of what a personal pickup should be.",,
823,gywbjvm,2021-05-21 02:06:27,t1_gywbjvm,t1_gyw4u9c,stocks,"Humans understand context. They can react appropriately to unpredictable situations (usually caused by other humans). But an AI is limited to its programming. We’ve seen that the moment it encounters a situation it’s not equipped to handle, it fails spectacularly. This is not a huge problem in a controlled environment. However driving in the real world involves a ton of gray situations that nobody can anticipate. Driving is as much a social activity as it is a mechanical one. I don’t see a computer being able to navigate this consistently for a long time.

If we somehow forced EVERYONE to use self-driving, we could take the human element out of it completely and then maybe we could get somewhere. But society would never accept that for obvious reasons.",,
824,gywbkis,2021-05-21 02:06:37,t1_gywbkis,t3_ngt4js,stocks,Who wants to watch me do a 100 -> 10k challenge in poker,,
825,,2021-05-21 02:06:32,t3_nhhij3,,stocks,"Take Walgreens for example. Their earnings did not get cut 6-8X by covid. And yet, somehow their PE shot up from around 11 to around 80 over the course of 2020. 

Can someone help me make sense of this?",nhhij3,Sometimes P/E ratios make no sense
826,gywbogg,2021-05-21 02:07:34,t1_gywbogg,t1_gyw9z28,stocks,You’re right. But I don’t like having x% a year thrown away.,,
827,gywbpcz,2021-05-21 02:07:48,t1_gywbpcz,t1_gylw1ox,stocks,"I was thinking of the line ""trust the force""",,
828,gywbsm1,2021-05-21 02:08:35,t1_gywbsm1,t1_gyw23qs,stocks,editied for clarification,,
829,,2021-05-21 02:09:22,t3_nhhkh7,,stocks,Does anyone know exactly what paysafe does and how they make money? It looks like they are somewhat similar to Square (or maybe not). I am trying to understand their business model and how they are different than others (financial services/companies).,nhhkh7,paysafe stock?
830,gywbxef,2021-05-21 02:09:45,t1_gywbxef,t1_gyw37s1,stocks,No. Why would anyone believe in a company that has lie so many times? Im amaze that its still at $12.,,
831,gywbxf0,2021-05-21 02:09:45,t1_gywbxf0,t1_gyw65bk,stocks,"It’s a Nissan with a laptop. Nissan actually has more consistent quality construction though. I’ve seen Tesla door panels you can slide an entire cell phone through. Model X’s that pour water on your passengers exiting if it’s raining. They don’t get the range they claim, there’s been several occurrences of the cooling system fucking up and catching fire on the freeway, they overstate their autopilot...

I worked in the car industry until recently, and basically everyone who leased a Tesla talked it up at first, but never got another Tesla when their lease was up 😂",,
832,gywbz0t,2021-05-21 02:10:08,t1_gywbz0t,t1_gyw9m62,stocks,"Hey, if you make the tendies, more power to ya.  Nobody is going to shame you on that.  Did you pre-order?  When do they start to deliver these?",,
833,gywc322,2021-05-21 02:11:08,t1_gywc322,t1_gyw9xis,stocks,"Hey man, the RobinHood comment is over the line. 

I use Fidelity. Jeez.

Jokes aside; I’ve been building cars for 20 years now, and I’m pretty clear on who Ford is, and what they do. They *had* to close those factories in Brazil, the electric F-150 isn’t even out yet, they don’t even make passenger cars anymore (trucks, SUV’s and the **real** Mustang is it) …and I’m damn sure Ford ain’t responsible for much (any) of that $1.3M, but you already know that. 

Good luck to you, though. Seriously. I believe there’s much better plays out there, and Tesla is one of them. I guess we’ll see.",,
834,gywc32k,2021-05-21 02:11:08,t1_gywc32k,t3_nhhij3,stocks,"Like you said, this isn’t driven by earnings but by price. If you’re a traditional value investor what this should tell you is the stock is overvalued..especially when compared to competitors like CVS",,
835,gywc51o,2021-05-21 02:11:36,t1_gywc51o,t1_gyw5kgb,stocks,I really think VW is going to run the electric market. In the countries that purchase the most electric cars (Nordic countries) the Audi etron is the best selling electric vehicle by far.,,
836,gywc57h,2021-05-21 02:11:39,t1_gywc57h,t3_nhhij3,stocks,Their earning were cut 6-8x compared to the stock price.,,
837,gywc65x,2021-05-21 02:11:53,t1_gywc65x,t1_gywc32k,stocks,No it didn’t. The price did not change nearly enough for this to happen.,,
838,gywc9hx,2021-05-21 02:12:42,t1_gywc9hx,t1_gywc57h,stocks,No…I literally said that didn’t happen in my post lol.,,
839,gywcbrp,2021-05-21 02:13:17,t1_gywcbrp,t3_nhhn1w,stocks,"Sorry, your [submission](https://www.reddit.com/r/stocks/comments/nhhn1w/question_is_the_interest_that_you_need_to_pay_on/) in /r/stocks has been automatically removed due to Rule 3:  Low effort.

If you just want to post 1 liners or just want to know everyone's thoughts, then post a comment to our daily discussion thread which are generally stickied or [click here.](https://www.reddit.com/r/stocks/search?q=author%3Aautomoderator+daily+discussion&restrict_sr=on&sort=new&t=all)

If you're wondering **why a stock moved** a certain way, check out [Reuters](https://www.reuters.com/), [Motley Fool](https://www.fool.com/), and **especially** [Finviz](https://finviz.com/quote.ashx?t=spy) **which aggregates the most news for almost every stock**.

If instead you're wondering what a term means, go to Investopedia.com and search for said term there.

Either way come back here to repost with your findings, thanks!

A list of the [rules can be found here](https://www.reddit.com/r/stocks/about/rules/), and if you're new to r/stocks please see the [wiki](https://www.reddit.com/r/stocks/wiki/index) and/or [read this post.](https://www.reddit.com/r/stocks/comments/4x1419/if_youre_new_here_read_this_post_first/)

*I am a bot, and this action was performed automatically. Please [contact the moderators of this subreddit](/message/compose/?to=/r/stocks) if you have any questions or concerns.*",,
