,comment_id,created,fullname,parent_id,subreddit,text,post_id,title
148,,2021-05-19 21:28:27,t3_nghpae,,StockMarket,"In the ocean of the biopharmaceutical companies with non approved products such stocks like G1 Therapeutics are brilliant. 

Their Cosela (trilaciclib) approved by FDA in February 2021, their pipeline is concrete, their future profit from Cosela is inevitable (despite of the other moleculars which are even more perspective).

Today it costs ~21$ per stock with ~1 billion cap... That is very, very low for the company with approved unique product that could generate $500 million-$1 billion in revenues/YEAR. It's awesome. And it's approved already, and it's added in Clinical Practice Guidelines in Oncology for small cell lung cancer already and yes, it will be covered by insurance. 

So, the only reason that may explain such low current price is the global rebalancing to a value stocks. But without a doubt price will grow as soon as americans change their focus from coronavirus to other health problems. And probably it's a few months question.

Ah, I almost forgot... According to Webull average price target for $GTHX is 59$, between 41$ and 78$. And it's mostly based on actual price targets from the last three months. So, welcome aboard till it's undervalued.",nghpae,Why do Reddit users ignore such potential blockbuster stocks like $GTHX?
149,,2021-05-19 21:28:36,t3_nghpg5,,StockMarket,,nghpg5,$VAO Vapiano SE 🚀 Europe pennystock
150,gyqxgl0,2021-05-19 21:29:00,t1_gyqxgl0,t1_gyql4ra,StockMarket,"Ok, boomer",,
151,gyqxlbs,2021-05-19 21:30:01,t1_gyqxlbs,t1_gyqnly9,StockMarket,"Mostly, yeah.",,
152,gyqxmod,2021-05-19 21:30:17,t1_gyqxmod,t3_ngh0p2,StockMarket,Those are more worth then BT lmfao,,
153,gyqxp9u,2021-05-19 21:30:50,t1_gyqxp9u,t3_nga7ru,StockMarket,Not really though,,
154,gyqxr3g,2021-05-19 21:31:12,t1_gyqxr3g,t3_nghpae,StockMarket,"We don't generally go for ""blockbuster stocks"" here.  That sounds like wallstreet bets territory.

If it has a superlative attached to sell the idea to me I'm not interested.

Statistics and due diligence is how professionals talk about stocks.",,
155,gyqxuhl,2021-05-19 21:31:54,t1_gyqxuhl,t3_ng3k6d,StockMarket,"the comments in this thread are garbage, most are just resounding negative? why? how is AMC/GME/TSLA not any more bullshit than BTC or GOLD which is literally a fucking rock without any application.",,
156,gyqxvhz,2021-05-19 21:32:06,t1_gyqxvhz,t1_gyqshgm,StockMarket,They have about 4.5B in cash + receivables. Doesn't seem that crazy.,,
157,gyqxxxt,2021-05-19 21:32:36,t1_gyqxxxt,t1_gyqxas7,StockMarket,"Because they were too retarded to do their own research? 

PS. JP Morgan was literally the ONLY bank NOT involved in the 2008 mortgage crisis. lol",,
158,gyqy3rh,2021-05-19 21:33:50,t1_gyqy3rh,t3_nghpae,StockMarket,"$21 per stock isn’t a price tag. Whats the share count and outstanding shares lol?

Run some numbers and come back.",,
159,gyqy8iy,2021-05-19 21:34:49,t1_gyqy8iy,t1_gyqw8dy,StockMarket,"What percentage of people do you think actually held crypto that long to “make those gains”? The majority of people are holding it for very short time frames, or even day-trading it.

And that doesn’t change the fact that all crypto is still a decentralized pyramid scheme.",,
160,gyqybf7,2021-05-19 21:35:25,t1_gyqybf7,t1_gw6ukls,StockMarket,PDSB day today !!!!,,
161,gyqyf8u,2021-05-19 21:36:13,t1_gyqyf8u,t1_gyqujsd,StockMarket,"It’s absolutely a pyramid scheme, do you understand how crypto works? How much “reading” do you need to understand pyramid schemes? It works the same as any other; you can only make money if someone else loses it, hence why crypto is a pyramid scheme.",,
162,gyqyh33,2021-05-19 21:36:35,t1_gyqyh33,t1_gyqt2or,StockMarket,"Sure, and the vast majority of other companies that weren't amazon blimped to 0. How can you be so sure you're buying the next amazon and not the 95% other speculative hyped companies that died off?",,
163,gyqyhhm,2021-05-19 21:36:41,t1_gyqyhhm,t1_gyqvd55,StockMarket,Then why don’t you try to explain how crypto is *not* a pyramid scheme? I’m all ears.,,
164,gyqykv7,2021-05-19 21:37:23,t1_gyqykv7,t3_nghpae,StockMarket,Because a lot of people avoid crazy biopharma plays,,
165,gyqyrhl,2021-05-19 21:38:46,t1_gyqyrhl,t1_gyqwkwl,StockMarket,"The same thing happens *within* crypto too - the amount of hate holders of a certain dog coin would get from crypto nerds was unreal; people just can't stand the fact that other people are winning and they're missing out (especially when the big play is some dumb meme coin with crap fundamentals).

Like, just be happy that people are making money, jesus...",,
166,gyqyuj7,2021-05-19 21:39:25,t1_gyqyuj7,t3_nggddu,StockMarket,R.I.P,,
167,gyqyvud,2021-05-19 21:39:42,t1_gyqyvud,t1_gyolen8,StockMarket,"The funds like VTI and VOO actually follow an index, so that is what I was actually suggesting...

Generally, I am more of an index investor and believe in holding a widely diverse portfolio.   As such I hold VTI which is pretty much all of the exchange-listed publically traded companies in the USA, and VXUS which holds everything outside the US.  Both are tied to an index.

So the suggestion was this:  You should compare your returns to a broad-market index.  I'd ignore NASDAQ since that is tech-heavy and isn't really a good long-term comparison.   The S&P 500 is fine for large US companies.   The MSCI ACWI Index is another good all-world index too.   

Generally, if you're not beating these indexes consistently over time you might want to consider just buying an ETF or whatever your local equivalent is that tracks these indexes.   It's a lot less work and also results in a return which exactly matches the market the index tracks.",,
168,gyqz3dp,2021-05-19 21:41:19,t1_gyqz3dp,t1_gyqy3rh,StockMarket,Thank you😌,,
169,gyqz7v0,2021-05-19 21:42:16,t1_gyqz7v0,t1_gyqxuhl,StockMarket,Fuck that rock that 100$ bill is just a fucking piece of paper the government prints. Investing in properties and useful materials is the smartest!,,
170,gyqz8c8,2021-05-19 21:42:22,t1_gyqz8c8,t3_ngh0p2,StockMarket,I like them,,
171,gyqzeik,2021-05-19 21:43:40,t1_gyqzeik,t1_gyqt2or,StockMarket,"While, for instance, petsdotcom went from $14 to $0.19, and then bankrupt. This type of comparison makes no sense and stinks of hindsight and survivorship bias. At least back then you could make somewhat reasonable picks, but guessing which crypto will survive at all is pretty much impossible.",,
172,gyqzh9h,2021-05-19 21:44:15,t1_gyqzh9h,t1_gyqi06z,StockMarket,My 2 shorts ended up in that little green section. :/,,
173,gyqzz3e,2021-05-19 21:48:02,t1_gyqzz3e,t1_gyqz7v0,StockMarket,"lmao a true retard, what is your point?",,
174,gyr090p,2021-05-19 21:50:08,t1_gyr090p,t1_gyqxxxt,StockMarket,"Lol, you sure about that? Is that why they had to payout 2 different lawsuits totaling almost $20 billion dollars?

> **...In other words, the government has alleged that JPMorgan and the companies it later acquired were offloading bad mortgages on other parties (mortgage backed securities investors, and U.S. taxpayers) through their lax practices.** The Justice Department was said to be on the verge of launching a new civil suit along the same lines before negotiations over a settlement heated up.

And this

> **After JPMorgan’s deceitful activities in the housing market helped trigger the 2008 financial crash that cost millions of Americans their jobs, homes, and life savings, punishment was in order.** Among a vast array of misconduct, JPMorgan engaged in the routine use of “robo-signing,” which allowed bank employees to automatically sign hundreds, even thousands, of foreclosure documents per day without verifying their contents. But in the United States, white-collar criminals rarely go to prison; instead, they negotiate settlements. Thus, on February 9, 2012,

> US Attorney General Eric Holder announced the National Mortgage Settlement, which fined JPMorgan Chase and four other mega-banks a total of $25 billion.

> JPMorgan’s share of the settlement was $5.3 billion, but only $1.1 billion had to be paid in cash; the other $4.2 billion was to come in the form of financial relief for homeowners in danger of losing their homes to foreclosure. **The settlement called for JPMorgan to reduce the amounts owed, modify the loan terms, and take other steps to help distressed Americans keep their homes. **

>",,
175,gyr09pg,2021-05-19 21:50:16,t1_gyr09pg,t1_gyqyf8u,StockMarket,Isn't that the stock market?   You buy at $1 off someone and sell it for $1.25 to someone else.   Or $0.80?,,
176,gyr0dsh,2021-05-19 21:51:08,t1_gyr0dsh,t1_gyqy8iy,StockMarket,"People here don't understand that stocks *aren't* a zero sum game; that's why they compare crypto to stocks and say crypto is the same as stocks.


What they don't think about is that companies generate money, and that money can go back into the business or be paid out to investors. If nobody bought anymore stocks, those stocks would still generate extractable value for their owners, either through buybacks or dividends; if nobody bought anymore crypto, existing crypto owners would be stuck with a bunch of numbers on a computer.",,
177,gyr0e7j,2021-05-19 21:51:14,t1_gyr0e7j,t1_gyqu7qj,StockMarket,You think ARKK is a long term hold?,,
178,gyr0gmp,2021-05-19 21:51:44,t1_gyr0gmp,t3_nghpae,StockMarket,"With all due respect, it doesn’t sound like you’re super knowledgeable about the product. Your phrasing, word choice, lack of citation, etc just don’t inspire confidence. Hell, you didn’t even say what the drug is actually for. The way the post is phrased, someone who didn’t know anything about the space would likely assume Cosela was for treating small cell lung cancer, rather than preventing myelosuppression secondary to chemotherapy",,
179,gyr0ko4,2021-05-19 21:52:35,t1_gyr0ko4,t3_nga7ru,StockMarket,"Latest Monday it will be all green again.   
A lower green, but still green.",,
180,gyr0pwn,2021-05-19 21:53:43,t1_gyr0pwn,t3_nga7ru,StockMarket,"The whole market? My stuff is doing fine, I rotated into value when Burry started shit talking Tesla.",,
181,gyr0qqb,2021-05-19 21:53:54,t1_gyr0qqb,t1_gyqykv7,StockMarket,"Fair enough but G1 is not ""crazy biopharma"" because they have approved unique product and patients are really waiting for it.

Even if the prognosis of 0,5-1 billion sales/year is overvalued its still very undervalued stock with less than 1 billion dollars capitalization.",,
182,gyr0t03,2021-05-19 21:54:23,t1_gyr0t03,t3_ngaw32,StockMarket,"I opened a new AMD position this week, and averaged more today just before the announcement. This company feels like a steal, especially compared with others in the sector, and I'm going to keep buying under $80. Great news though! :)",,
183,,2021-05-19 21:54:53,t3_ngicxi,,StockMarket,"**Coming off a strong 2020, the turnaround story is beginning to realize**  
**Key catalysts to drive revenue and margin growth:**

1. Rollout of new payment initiative
2. Increase in product listing ads
3. Expansion of products sold with authentication guarantee  
**3 Year Performance:**  
EBAY: +56.15%  
XLY (consumer discr): +59%  
NASDAQ 100: +91.70%  
EBIZ (global e-commerce): +108.60%

**Notable Metrics:**  
YoY Revenue Growth: +18.93%  
Gross Merchandise Volume FY20': +16.95%  
Net Takerate: 9.3%  
T12M Gross Margin: 75.19%  
T12M EBITDA Margin: 31.97%  
ROIC: 24.70%  
FCF Yield: 5.79%  
Interest Expense/Net Sales: 2.97%  
Net Debt/ EBITDA: 0.98x  
P/E: 16.07x  
P/S: 3.64x  
P/CF: 14.39x  
EV/EBITDA T12M: 12.46x",ngicxi,EBAY has a fundamental profile that should not be overlooked
184,gyr0vmy,2021-05-19 21:54:57,t1_gyr0vmy,t3_nge5g9,StockMarket,Lake of hell 🔥,,
185,gyr0w76,2021-05-19 21:55:04,t1_gyr0w76,t3_ng3k6d,StockMarket,Wait and see whats gonna happen when the US say to banks they gonna loose their dollar trading license if they trade bitcoins..  the us. eu uk have been warning about crypto for a while now..,,
186,gyr0wrl,2021-05-19 21:55:12,t1_gyr0wrl,t1_gyqvd55,StockMarket,...that’s an ironic comment,,
187,gyr0y9d,2021-05-19 21:55:31,t1_gyr0y9d,t1_gyr090p,StockMarket,Lol lies,,
188,gyr109c,2021-05-19 21:55:56,t1_gyr109c,t3_nga7ru,StockMarket,🦍 this like mmo 👵🏻💪🏼💪🏼,,
189,gyr13h4,2021-05-19 21:56:37,t1_gyr13h4,t1_gyqt2or,StockMarket,"What makes you believe crypto will be around for a long-term (if not being the future)? I am really tempted to buy the dips, but not sure how sustainable is the asset long-term. Thanks.",,
190,gyr14oc,2021-05-19 21:56:52,t1_gyr14oc,t1_gyr09pg,StockMarket,"I was going to say this lol 

Like any other supply and demand?",,
191,gyr182z,2021-05-19 21:57:35,t1_gyr182z,t1_gyqp70w,StockMarket,How original,,
192,gyr18gy,2021-05-19 21:57:40,t1_gyr18gy,t1_gyqoopq,StockMarket,"I just can't believe how this many people - or more like summer children - thought that the stock market is only about fancy tech stocks making +30..50..100% y/y until eternity, oh, and cryptos doing the some times ten.

We didn't even have a proper market-wide correction since the covid crash. If you didn't start investing yesterday and you have an even slightly diverse portfolio, you should be comfortably in the green.",,
193,gyr19rs,2021-05-19 21:57:57,t1_gyr19rs,t1_gyqfxrq,StockMarket,">https://youtu.be/gyaPf6qXLa8

/NQ is fast approaching the buy zone. But don't blow your wad just yet. wait for until July to open up any serious long positions. AMD has a shot at hitting in the 60's wait for it. :)",,
194,gyr1a8f,2021-05-19 21:58:03,t1_gyr1a8f,t1_gyqqqk2,StockMarket,Cramer pumps that stock every day.,,
195,gyr1bxs,2021-05-19 21:58:25,t1_gyr1bxs,t1_gyqthcd,StockMarket,Lol,,
196,gyr1eio,2021-05-19 21:58:58,t1_gyr1eio,t3_nga7ru,StockMarket,I'm buying more AAPL today.,,
197,gyr1f57,2021-05-19 21:59:06,t1_gyr1f57,t3_ndjwoj,StockMarket,"too little to late. this would of worked when the silicon shortage happened 3 years ago, but now suddenly people want to do something. it will take  year to start up production and 2 years to distribute. by then the demand will have dropped and surplus will kill the company. its gonna be at least 2 years until you can buy things off the shelf again",,
198,gyr1hqy,2021-05-19 21:59:40,t1_gyr1hqy,t3_nghpg5,StockMarket,Vapiano is disgusting tbh,,
199,gyr1jem,2021-05-19 22:00:01,t1_gyr1jem,t1_gynag7c,StockMarket,Thanks for reminding me about this article. I'd been meaning to go back and read it but it talks about how the market is currently in a precarious situation similar to 2008 https://theintercept.com/2021/04/20/wall-street-cmbs-dollar-general-ladder-capital/,,
200,gyr1l42,2021-05-19 22:00:22,t1_gyr1l42,t1_gyqw1t5,StockMarket,"-0.17% here, not bad.",,
201,gyr1le6,2021-05-19 22:00:26,t1_gyr1le6,t1_gyr0y9d,StockMarket,"Oh yeah? But I thought you said JPM DOESN’T lie? So they’re lying about this now?

Or what about this [Dept of Justice document where JPM admits to everything mentioned in the previous comment and agrees to pay the $13 billion dollar fine?](https://www.justice.gov/iso/opa/resources/69520131119191246941958.pdf)

Are they lying there too?",,
202,gyr1m7e,2021-05-19 22:00:36,t1_gyr1m7e,t1_gyqyh33,StockMarket,"You don't. 

But diversifying and buying and holding projects that are being spearheaded by extremely ambitious and  intelligent people (Musk, Bezos, Nadella, Lutke, Dorsey) hasn't failed me yet. 

Vitalik Buterin is on the same calibre.  Charles Hoskinson is sort of on the same calibre, but I'd bet more on Vitalik. 

Julie Wainwright of [pets.com](https://pets.com) isn't of the same calibre. 

We'll see what happens years down the road. Do I own some failures? Yes. But overall what I've bought and held for the past 4 years is doing better than index funds.",,
203,gyr1mh0,2021-05-19 22:00:40,t1_gyr1mh0,t3_ng943x,StockMarket,And I didn’t think I could feel anymore pain today..congrats you did it!,,
204,gyr1nhd,2021-05-19 22:00:53,t1_gyr1nhd,t3_nge5g9,StockMarket,Murder scene,,
205,gyr1ooa,2021-05-19 22:01:08,t1_gyr1ooa,t1_gyr1nhd,StockMarket,"Murdene.

***

^(Bleep-bloop, I'm a bot. This )^[portmanteau](https://en.wikipedia.org/wiki/Portmanteau) ^( was created from the phrase 'Murder scene' | )^[FAQs](https://www.reddit.com/axl72o) ^(|) ^[Feedback](https://www.reddit.com/message/compose?to=jamcowl&subject=PORTMANTEAU-BOT+feedback) ^(|) ^[Opt-out](https://www.reddit.com/message/compose?to=PORTMANTEAU-BOT&subject=OPTOUTREQUEST)",,
206,gyr1qm2,2021-05-19 22:01:34,t1_gyr1qm2,t1_gyr0y9d,StockMarket,[Heres all the info on the Dept of Justice government website too if you need more proof of them being pieces of shit](https://www.justice.gov/opa/pr/justice-department-federal-and-state-partners-secure-record-13-billion-global-settlement),,
207,gyr1r3t,2021-05-19 22:01:40,t1_gyr1r3t,t1_gyr1hqy,StockMarket,The money what we are going to make is not disgusting dear 🦍 brother,,
208,gyr1s2t,2021-05-19 22:01:54,t1_gyr1s2t,t3_ng7tot,StockMarket,they were instructed to dump crypto to buy the dip in indices and futures to prevent marketing from actually tanking. all of today's crypto losses bought today's dip. woke up just in time to buy the massive dip and bottom in BTC. perfect timing,,
209,gyr1xtv,2021-05-19 22:03:08,t1_gyr1xtv,t3_ngg36e,StockMarket,The semiconductor market is actively moving away from Helium at a high level in all of their fabs right now because of this.,,
210,gyr1yrs,2021-05-19 22:03:20,t1_gyr1yrs,t1_gyqu7qj,StockMarket,While also having a return of \~120% in the last year and an annualized \~50% in the last 3-5 years.,,
211,gyr2hcy,2021-05-19 22:07:22,t1_gyr2hcy,t1_gyqnly9,StockMarket,"/r/stocks has also absolutely gone down the shitter. It’s filled with crazy theories because people’s portfolios haven’t risen by 1000% in the past three months. If making money on the stock market was that easy, literally everyone would be doing it.",,
212,gyr2j63,2021-05-19 22:07:47,t1_gyr2j63,t1_gyqnh1g,StockMarket,Have you thought of just buying the whole market. I heard about this instrument called an ETF,,
213,gyr2kcu,2021-05-19 22:08:03,t1_gyr2kcu,t3_nga7ru,StockMarket,Can I just say that I dislike the full version of this meme,,
214,gyr2lz8,2021-05-19 22:08:25,t1_gyr2lz8,t3_nga7ru,StockMarket,That's me holding pennystocks too long.,,
215,,2021-05-19 22:08:51,t3_ngipd7,,StockMarket,,ngipd7,"She has a very bullish mouth. irrespective of the fact all her big purchases (PLTR, TSLA, COIN) has been huge losses to her portfolio… What’s the problem in today’s stock market. The rise of retail investors (followers) or publicity of industry players (leaders)? We’ve a chicken and egg problem here"
216,gyr2uru,2021-05-19 22:10:22,t1_gyr2uru,t1_gyr0gmp,StockMarket,"Good feedback, thank you. I edited some points.

But I still don't have any idea why the stock with such great perspectives ignored by Reddit community.

(I described only a minor part of the all perspectives, that any investor could find at the official G1 Therapeutics page)",,
217,gyr2yt3,2021-05-19 22:11:16,t1_gyr2yt3,t1_gyr1qm2,StockMarket,"Fake documents. You are a market maker manipulating the market, aren’t you? No different than CNBC. 

See what I did there. What you’re claiming is no different than JPM going on CNBC and expressing a viewpoint.",,
218,gyr3749,2021-05-19 22:13:07,t1_gyr3749,t1_gyr1jem,StockMarket,You’re welcome! And thank YOU for giving me an article to read!,,
219,gyr38gg,2021-05-19 22:13:25,t1_gyr38gg,t1_gyqplsb,StockMarket,"Like I said there is data and facts. Ortex data, etc. Do research",,
220,gyr3b93,2021-05-19 22:14:02,t1_gyr3b93,t3_nggn9d,StockMarket,"The penitent man....the penitent man....

I just got my head cut off.",,
221,gyr3bnh,2021-05-19 22:14:08,t1_gyr3bnh,t3_nga7ru,StockMarket,"Don't worry guys, we'll all get out right before the crash in the nic of time 🙃",,
222,gyr3du3,2021-05-19 22:14:37,t1_gyr3du3,t3_ngh0p2,StockMarket,The stock market designs my tendies.,,
223,gyr3foo,2021-05-19 22:15:01,t1_gyr3foo,t3_ngdlwp,StockMarket,It's ok Elon just have your wife sing u her song about sexual abuse,,
224,gyr3n80,2021-05-19 22:16:41,t1_gyr3n80,t1_gyr18gy,StockMarket,Something something sector rotation something reflation.,,
225,gyr3ng5,2021-05-19 22:16:44,t1_gyr3ng5,t3_nge5g9,StockMarket,What happened to energy?,,
226,gyr3pj9,2021-05-19 22:17:12,t1_gyr3pj9,t1_gyr1xtv,StockMarket,Any idea what they are replacing it with?,,
227,gyr3v4z,2021-05-19 22:18:25,t1_gyr3v4z,t1_gyr2uru,StockMarket,"I’m not sure. I haven’t seen revenue projections for it and I’m currently at my limit of speculative biotech plays, but it looks interesting as a product. It could just be flying under the radar because it’s in a highly speculative field, it could be because it’s approved for a relatively small slice of the cancer world, it could just be a matter of time before it does spike. No clue. Good luck though. Hopefully it hits those price targets",,
228,gyr3w3g,2021-05-19 22:18:38,t1_gyr3w3g,t1_gyq55mi,StockMarket,I just sold out to get into crypto bahahahaha.,,
229,,2021-05-19 22:18:54,t3_ngiy1m,,StockMarket,,ngiy1m,$NETE: Net Element/Mullen S-4 Merger Document is Released. Technicals in the article!
230,gyr3y2v,2021-05-19 22:19:05,t1_gyr3y2v,t3_ngg36e,StockMarket,"I think u are correct.. wait until the apes of WSB see it gives a funny voice and its goes  to the moon.

/Tired..",,
231,gyr3z1h,2021-05-19 22:19:17,t1_gyr3z1h,t3_nghpae,StockMarket,"The opinions from analysts vary.  Most have a *hold or weak sell* opinion-not terrible for a pharma stock. Webull does ***not*** have analysts. This value is copied from Yahoo financial using discounted cash flow calculation. Getting 1 drug approved is one thing getting physicians recommend a newly approved drug is another. If popular, it may reduce the corp negative earnings as the company is still not profitable.  Its higher beta of 2.2 is quite volatile. PFE: 0.67, Gilead Science; 0.4. High beta may not be a bad thing. 

If GTHX has 10 different approvals I do not hesitate to buy.  Its growth and value based on its sales is a gating issue.",,
232,gyr42rs,2021-05-19 22:20:05,t1_gyr42rs,t1_gyr2yt3,StockMarket,"Hahaha yep. Totally fake legal, government documents from the DOJ that are easily found anywhere because they’re public record. But yep! You caught me.

I’m actually Jamie Dimon! This was my burner account and I had a change of heart and decided to come clean about the economic crash of 08 to some random loser that has a Bloomberg terminal.",,
233,,2021-05-19 22:20:20,t3_ngiz83,,StockMarket,,ngiz83,One bit at a time 🤓
234,gyr4ciu,2021-05-19 22:22:11,t1_gyr4ciu,t1_gyr3foo,StockMarket,Whut?,,
235,,2021-05-19 22:22:24,t3_ngj0w7,,StockMarket,,ngj0w7,Yippee! Wahoo!
236,,2021-05-19 22:22:24,t3_ngj0we,,StockMarket,"Is Etsy a marketplace for the future?

* Etsy had over 100% revenue growth in 2020 on their way to becoming the 4th largest marketplace by site visits.
* Over 88% of customers use the site to find products they can’t find anywhere else
* Over 40% of revenue is coming from outside of the US.
* Etsy estimates its TAM at $100B
* Less than 50% of customers are repeat annual buyers
* Etsy is trading at \~46x earnings
* Revenue grew at 141% yoy compared to Q1 of the prior year, but analysts are projecting revenue growth of 32% for the year 2021
* Etsy is expanding the service side of its business which includes higher margin revenue.

Etsy has a niche with its choice to target specialty goods, but I don’t know if this company has the stickiness and the growth to justify taking a position. Unlike e-commerce platforms like Shopify and BigCommerce, Etsy lacks the subscription revenue and app store that cements its ecosystem. Etsy is trying to salvage this through running onsite and off site ads. Even with this, what stops Etsy from becoming another eBay? Am I misunderstanding the business?  


 Source: $ETSY thread on [StockTalk](https://testflight.apple.com/join/J22OgDlP)",ngj0we,Is Etsy a marketplace for the future?
237,gyr4kcn,2021-05-19 22:23:54,t1_gyr4kcn,t1_gyqzz3e,StockMarket,"I’m saying it’s all bullshit lol at the end of the day if the whole world went broke the most valuable thing you could have would be land, buildings, and other big ticket items to live. So that thing you called just a rock which is gold is also no different than cash which we all go crazy over. My point is the “best” investment anyone could have is them things because when a Great Depression would happen you’d still have things that are valuable.",,
238,gyr4lf8,2021-05-19 22:24:08,t1_gyr4lf8,t1_gyr3b93,StockMarket,The market taketh what it giveth. Recharge and reload. It’s a marathon boxing 🥊 match. Nov-Feb was a joyride. Best. 👍🏼,,
