,comment_id,created,fullname,parent_id,subreddit,text,post_id,title
0,gyqhxg5,2021-05-19 19:46:03,t1_gyqhxg5,t3_nga7ru,StockMarket,"Hahaha, even the economics are down, and the market as well but in my opinion the stock market will be descrease in 2023 or that period, in this year makes me very fast",,
1,gyqhyo4,2021-05-19 19:46:17,t1_gyqhyo4,t1_gyqfsyp,StockMarket,"He was the one behind the SPAC deal that brought Virgin Galactic public. He’s still the Chairman of the Board but he’s sold a huge portion of his shares. If not all of it, I don’t remember at this point. 

He was all about VG at the start and super confident about it. He also made all sorts of statements about never selling a company he doesn’t believe in and only making investment decisions that he’ll see through. 

Then he sold all of his personal shares. It’s a bit of a sketchy thing to do after preaching about these things and how great VG is. He gave no advance warning and a really lazy excuse about wanting to invest in climate change and needing capital. Just all around shitty thing.",,
2,gyqhzcu,2021-05-19 19:46:25,t1_gyqhzcu,t3_ng3k6d,StockMarket,Fuck China. Their money means nothing to the 3T and growing crypto market. What their broken government says about crypto should have no bearing especially since they want to make their own cryptos and go over our heads. It won’t work. Fuck China.,,
3,gyqi06z,2021-05-19 19:46:35,t1_gyqi06z,t3_nge5g9,StockMarket,Completely normal phenomenon,,
4,gyqi0y3,2021-05-19 19:46:44,t1_gyqi0y3,t3_ng3k6d,StockMarket,I wish I could buy bitcoin puts,,
5,gyqi3tl,2021-05-19 19:47:19,t1_gyqi3tl,t1_gyl8bne,StockMarket,Love that,,
6,gyqibah,2021-05-19 19:48:50,t1_gyqibah,t3_ngepbz,StockMarket,Yasss,,
7,gyqicrn,2021-05-19 19:49:08,t1_gyqicrn,t3_ngepbz,StockMarket,Dickcoin,,
8,gyqijxr,2021-05-19 19:50:34,t1_gyqijxr,t1_gyqgrm4,StockMarket,same,,
9,gyqioz1,2021-05-19 19:51:33,t1_gyqioz1,t3_ng7mun,StockMarket,I'll be ok with some of my stonks being -3% today. At least I didn't buy DOGE at $0.70.,,
10,gyqizf9,2021-05-19 19:53:35,t1_gyqizf9,t3_ng7tot,StockMarket,"I'm no expert, but shouldn't they have done this a couple of weeks ago?",,
11,gyqj0er,2021-05-19 19:53:46,t1_gyqj0er,t3_nga7ru,StockMarket,Sold AMC at the dip UGHHH,,
12,gyqj3ru,2021-05-19 19:54:25,t1_gyqj3ru,t3_nga7ru,StockMarket,"""Buy the dip""

\*dip number 47\*",,
13,gyqj4lk,2021-05-19 19:54:35,t1_gyqj4lk,t3_ngdlwp,StockMarket,"1st have we proof that tesla bought these btc
2nd have we proof that tesla kept these btc
3rd who cares about this idiot ? The real pb is china and it's not even a surprise...
4th who seriously thought that btc and crypto will rise forever ? Where comes the profit if it rises continuously ?",,
14,gyqj64s,2021-05-19 19:54:52,t1_gyqj64s,t1_gyq9415,StockMarket,Most of my portfolio (25+ stonks) have been in the red since February but I cannot figure out why 🤔,,
15,gyqj7fk,2021-05-19 19:55:07,t1_gyqj7fk,t1_gyq2uju,StockMarket,"This is the biggest issue, combined with the fact that governments have every incentive to ban it's use domestically...the minute they decide they'd rather tax all these transactions, that's gg.  The bottom could fall out of this at literally ANY point",,
16,gyqjdje,2021-05-19 19:56:17,t1_gyqjdje,t3_ngepbz,StockMarket,Bitemeintheasscoin,,
17,gyqjgxo,2021-05-19 19:56:57,t1_gyqjgxo,t3_nega7v,StockMarket,Why do I never see anyone using Ameritrade??,,
18,gyqji6x,2021-05-19 19:57:11,t1_gyqji6x,t1_gypor66,StockMarket,Lol,,
19,gyqjjq5,2021-05-19 19:57:29,t1_gyqjjq5,t3_ngaw32,StockMarket,A week too late.,,
20,gyqjqm7,2021-05-19 19:58:51,t1_gyqjqm7,t1_gyq7duw,StockMarket,"Oh the market is down again? Wow. Well, anyway.....",,
21,gyqju4d,2021-05-19 19:59:31,t1_gyqju4d,t3_ngepbz,StockMarket,Hahahahaha,,
22,gyqkasc,2021-05-19 20:02:44,t1_gyqkasc,t1_gyqizf9,StockMarket,"No, cuz how will they benefit if they give u fair warning? Always after the fact",,
23,gyqkix4,2021-05-19 20:04:22,t1_gyqkix4,t1_gypirkq,StockMarket,Not a damn thing about her made sense.,,
24,,2021-05-19 20:04:51,t3_ngfl6n,,StockMarket,,ngfl6n,Who does the same today?
25,gyqko48,2021-05-19 20:05:23,t1_gyqko48,t1_gyq2uju,StockMarket,"Not really, ends up being the prisoner's dilemma in a sense. If one country bans crypto and another country opens up it's arms to crypto, that wealth leaves the country that banned it and moves to the country with more favourable policies. 

The only way that a sovereign country can safely ban crypto is if everyone else bans crypto..  thats not going to happen. Of course China will ban it, anyone could have predicted that. And you know what? Fuck China.",,
26,gyqko90,2021-05-19 20:05:25,t1_gyqko90,t3_ng35du,StockMarket,Welcome to Joe bidens grand reopening economy folks.. I closed all my positios on Jan 19th.. great decision...,,
27,gyqkq0j,2021-05-19 20:05:45,t1_gyqkq0j,t1_gyooeel,StockMarket,"I read that, I got it.  As someone who has been doing this for 30 years, I stand by my commitment.  No one can tell in 6 months if they are good or just lucky.  Show me how you do in a 5000 point decline or over a long period, then ask me if you’re cut out for this.  6 months is nothing",,
28,gyqkwia,2021-05-19 20:07:01,t1_gyqkwia,t3_ngaw32,StockMarket,They had 2.5b$ in earnings in 2020 and they will spend 4b$ on share buy backs? Hmmmm,,
29,gyql4ra,2021-05-19 20:08:39,t1_gyql4ra,t1_gyppw5m,StockMarket,"Young  dumbb narrowminded tunnel vision kids who voted for Joe Biden, what did u expect???",,
30,gyql7lx,2021-05-19 20:09:13,t1_gyql7lx,t1_gypgwxi,StockMarket,Yep.  They are manipulating the markets.  This is not the first nor last time China and others have manipulated the crypto space.  I cant remember how many times this exact thing has happened before.,,
31,gyql9uf,2021-05-19 20:09:39,t1_gyql9uf,t1_gyqdmo4,StockMarket,"Exactly what I was thinking. ""Look, there's more!""",,
32,gyqlbx2,2021-05-19 20:10:04,t1_gyqlbx2,t1_gypzxvi,StockMarket,"Me too, closed an hour later for like 60% profit.",,
33,gyqldgz,2021-05-19 20:10:22,t1_gyqldgz,t3_ng9zmu,StockMarket,90% of bitcoin is held by 2% of holders,,
34,gyqlglv,2021-05-19 20:11:00,t1_gyqlglv,t3_ngfl6n,StockMarket,Nope. I'm used to it now.,,
35,gyqlqrn,2021-05-19 20:13:01,t1_gyqlqrn,t3_ngfl6n,StockMarket,My mistress did wake up with dip on her face,,
36,,2021-05-19 20:13:33,t3_ngfsv6,,StockMarket,,ngfsv6,You are not alone we are stronger together
37,gyqltyt,2021-05-19 20:13:39,t1_gyqltyt,t1_gyppfhm,StockMarket,Poor desi!!,,
38,gyqlukt,2021-05-19 20:13:47,t1_gyqlukt,t1_gyq75vz,StockMarket,youre not the boss of me,,
39,gyqlwi6,2021-05-19 20:14:09,t1_gyqlwi6,t3_ng7tot,StockMarket,The hedgies are dumping can’t pay their bills.,,
40,gyqlz8p,2021-05-19 20:14:41,t1_gyqlz8p,t1_gypcdcq,StockMarket,10k INR is 136$. Wasted 10k USD worth of time of this sub followers by announcing his pocket change.,,
41,gyqm2cf,2021-05-19 20:15:18,t1_gyqm2cf,t3_ngfsv6,StockMarket,😁,,
42,gyqm843,2021-05-19 20:16:26,t1_gyqm843,t3_nga7ru,StockMarket,It’s fine it’s just money.,,
43,gyqmahv,2021-05-19 20:16:55,t1_gyqmahv,t3_ngfsv6,StockMarket,Look also my profiles u/kimaxw we are always together,,
44,gyqn013,2021-05-19 20:21:53,t1_gyqn013,t3_nga7ru,StockMarket,MORE!!!,,
45,gyqnh1g,2021-05-19 20:25:11,t1_gyqnh1g,t3_nge5g9,StockMarket,Am I the only one who can never decide what to buy when everything is on sale and then you end up with nothing....,,
46,,2021-05-19 20:25:14,t3_ngg36e,,StockMarket,"[Rare gas](https://oilprice.com/Energy/Energy-General/Amazon-Google-and-Netflix-Are-Fighting-Over-This-Rare-Gas.html)


The next supply squeeze that may take markets by surprise isn’t lithium. It isn’t even a battery metal …

While everyone is distracted by the media barrage surrounding EVs, another commodity may be creating an investment opportunity to rival all …

We think it’s potentially bigger than the cannabis boom that reportedly netted some investors 1,000% gains.

It’s helium.

And some experts say we’re running out of it.

It’s not just a niche commodity anymore. It’s not just about balloons. And we think it’s positioned to become the focus of increased investor interest.  

Like oil and gas, this is about exploration, discovery, and development. And we think the biggest returns may end up coming from the small-cap explorers trying to hit the big time with a new discovery - all on their own.

*Growing Helium Demand*

Demand for helium is increasing, and it’s coming from multiple sectors, including everything from the tech and biomedical industries, to space, medical equipment and national security. And, yes, of course, party balloons and Thanksgiving Day parades.

Many industries require helium.

It’s been reported that the tech industry has been a massive catalyst, and that 2013 was a game-changing year for helium supply.

That’s when the world’s first ‘helium drives’ were made commercially available, making helium a key ingredient to fill our monstrous appetite for data.

Some 3.7 billion people are generating some 2.5 quintillion bytes of data every single day. And even those numbers may grow by up to 60% a year. By 2025, it is projected to be more like 160 zettabytes per year. Helium drives were apparently a breakthrough that replaced the air in hard drives with helium to reduce the energy used. They went from concept to commercialization in 2013.

Amazon (NASDAQ:AMZN), Alphabet (NASDAQ:GOOGL), Facebook (NASDAQ:FB), Netflix (NASDAQ:NFLX)--all are said to need tons of it for their massive data centers.

We think demand is set to surge into the helium-driven territory of zettabytes.

And the growing semiconductor market may depend on helium, too. Why? Because helium can bring temperatures down to below -450 degrees Fahrenheit--lower even than liquid nitrogen. This is important for superconducting equipment in particle accelerators and the magnets used to build semiconductors, according to Forbes.

Driving this further is a global computer chip shortage.

In Geneva, Switzerland, the Large Haldron Collider (LHC), the largest high-energy particle accelerator on Earth--and the biggest machine in the world, needs a truckload of helium every week.

Nor does the demand story end there …

The health sector is another major driver of helium demand. It’s also critical for use in cooling magnets in MRI machines. Without helium, we won’t have working MRIs. The shortage also threatens NMRs--nuclear magnetic resonance spectroscopy, which in turn is a crucial aspect of medical research.

*Two small cap stocks to consider*

Royal Helium - RHC.v
Desert Mountain Energy - DME.v",ngg36e,Have you considered investing in Helium? $RHC.V
47,gyqnipc,2021-05-19 20:25:30,t1_gyqnipc,t3_ng7tot,StockMarket,"They can stick to gold for all I care, tbh what excited me about BTC was the idea of decentralization, aside of profitability. I would be more than happy to use crypto on day to day trade, even without having to earn a dime there. 

If anyone manages to present a stable coin I would be more than glad to drop all fiats.",,
48,gyqnly9,2021-05-19 20:26:09,t1_gyqnly9,t3_nga7ru,StockMarket,Have stock groups just been filled with kids making memes?,,
49,gyqnowv,2021-05-19 20:26:44,t1_gyqnowv,t1_gyqkwia,StockMarket,TLDR. They're bullish AF on their own stock and realize that it's criminally underpriced.,,
50,gyqnrp8,2021-05-19 20:27:17,t1_gyqnrp8,t3_ng6wyo,StockMarket,"Wall street is shaking out retail to buy cheaper 

That means we're going way higher, no paper hands here",,
51,gyqnrvp,2021-05-19 20:27:19,t1_gyqnrvp,t3_nge5g9,StockMarket,“Wanna see a dead body”. Shows heat map,,
52,gyqnsu5,2021-05-19 20:27:30,t1_gyqnsu5,t3_ng3k6d,StockMarket,You're supposed to sell the tip first bro,,
53,gyqnvxt,2021-05-19 20:28:07,t1_gyqnvxt,t1_gyp2j60,StockMarket,"""China the people"" VS ""China the government""",,
54,gyqnz58,2021-05-19 20:28:44,t1_gyqnz58,t1_gyp65x1,StockMarket,"I can technically sell to anybody through any means I want with a wallet to wallet transfer, find a dollar comparison",,
55,gyqo5gj,2021-05-19 20:29:58,t1_gyqo5gj,t1_gyqcm8t,StockMarket,I YOLO'd <hard> at 4.80,,
56,gyqo97b,2021-05-19 20:30:43,t1_gyqo97b,t3_ng6wnr,StockMarket,"You are clueless dude, this happens in the stock market everyday

Don't blame crypto because you paper hands an I vestment and panic sold on a dip 

It's your fault",,
57,gyqohf8,2021-05-19 20:32:19,t1_gyqohf8,t1_gypzb0e,StockMarket,"How is it any different than the SP500 they essentially did the same thing today...  

Crypto haters have done but missed out on massive gains",,
58,gyqok08,2021-05-19 20:32:49,t1_gyqok08,t3_ng3k6d,StockMarket,i think i speak for everyone here when i say fuck the chinese government,,
59,gyqok9s,2021-05-19 20:32:52,t1_gyqok9s,t3_ng7tot,StockMarket,Lolololol,,
60,gyqoopq,2021-05-19 20:33:45,t1_gyqoopq,t3_nga7ru,StockMarket,"QQQ is up over 7% year to date, SPY 11%. 

This place is going to implode when we have a real market drop.",,
61,gyqopcn,2021-05-19 20:33:53,t1_gyqopcn,t1_gyqkix4,StockMarket,Nothing in that series made sense in episodes 7-9 everything before that was great but 7-9 was a hot mess,,
62,gyqp00y,2021-05-19 20:35:59,t1_gyqp00y,t1_gyoqizg,StockMarket,I agree but how would you do DD on crypto? They don’t have any actual fundamentals besides demand.,,
63,gyqp1of,2021-05-19 20:36:18,t1_gyqp1of,t3_ng9zmu,StockMarket,">""When the crypto market cap hits $10 trillion, its volatility will be significantly less. As it approaches $100 trillion, you'll see a decrease in growth, a decrease in volatility, and it will creating a stable influence in the entire financial system of the 21st century,"" the CEO of MicroStrategy said in an interview earlier this year. 

I think this helps summarize the thinking. This investment group believes Bitcoin adoption will continue to grow up to 100x it's current size.

If you assume they are right about the adoption, then the rest makes sense. When Bitcoin adoption is 10X more than today, the market manipulators are not going to be able to destabilize the coin on a whim as they do now.

Most analysts have believed Bitcoin would reach at least a price of $100k since years ago. Recently it got to around $60k from around $10k last year. It's dropping this week, but anyone that takes this space seriously believes Bitcoin is going to grow a lot more before any real threat to its existence. So that means we are likely to see adoption of many more $trillion, and the price of $100k is still in the horizon and is a fairly sure bet if you do believe the adoption will expand.",,
64,,2021-05-19 20:37:08,t3_nggddu,,StockMarket,,nggddu,They say a picture is worth a thousand words.
65,gyqp70w,2021-05-19 20:37:21,t1_gyqp70w,t3_nga7ru,StockMarket,When you buy the dip and it dips even lower...,,
66,gyqpea6,2021-05-19 20:38:47,t1_gyqpea6,t1_gyq4tcv,StockMarket,Just do actual research there is data and reasons why people say 100k. You are spreading FUD because you have no idea what you talking about lol. If you don’t know anything about it be quiet 🤐,,
67,gyqpfdy,2021-05-19 20:39:00,t1_gyqpfdy,t1_gyorngm,StockMarket,I feel this is my soul 😂,,
68,gyqplsb,2021-05-19 20:40:16,t1_gyqplsb,t1_gyqpea6,StockMarket,"I've seen it, you don't know what you're talking about and are just parroting some shitpost you saw",,
69,gyqpsj5,2021-05-19 20:41:35,t1_gyqpsj5,t1_gyqj0er,StockMarket,You're going to regret that more later I assure you,,
70,gyqpw5m,2021-05-19 20:42:18,t1_gyqpw5m,t3_nfrvxz,StockMarket,"The Coinbase Pro fees are still very competitive at 0.5% and they have a much more trustworthy vibe than their competitors.

Binance has lower fees but is illegal in the US and it's weirdly difficult to create an actual account on [Binance.US](https://Binance.US). 

Kraken has no easy way to transfer money onto the platform for some bizarre reason. Literally couldn't get my bank to wire them money. Feels scammy.

Gemini fees are ridiculously high unless you use a special version that's not available on mobile.

[Crypto.com](https://Crypto.com) doesn't even let you do limit orders. It's just a ""buy"" button, which I assume places a market order at a terrible price. Their high-interest stablecoin and debit card stuff feels scammy.

Webull pretends not to have fees but their buy/ask spread for crypto is insane, so you get horrible prices when you buy or sell. You have to be over 2% up to break even.

I haven't used Robinhood, but I assume they're doing the same thing as Webull and of course neither one will let you transfer your crypto off the platform, so it's not really yours at all.

I don't own any Coinbase stock and don't plan to buy any, but I think they're going to do well in the future if only because their competition is all horrible.",,
71,gyqq64f,2021-05-19 20:44:15,t1_gyqq64f,t3_nga7ru,StockMarket,Plug was up,,
72,gyqq7el,2021-05-19 20:44:30,t1_gyqq7el,t3_ng3k6d,StockMarket,"bitcoin back to $100 plz
I want in",,
73,gyqqctt,2021-05-19 20:45:32,t1_gyqqctt,t3_ngfsv6,StockMarket,Why all of these crypto posts in the stock market sub? Isn’t r/crypto a thing?,,
74,gyqqd8j,2021-05-19 20:45:36,t1_gyqqd8j,t3_ng9zmu,StockMarket,These kind of articles would make me rather sell than buy,,
75,gyqqpk3,2021-05-19 20:47:51,t1_gyqqpk3,t3_nggddu,StockMarket,This is brilliant,,
76,gyqqpvj,2021-05-19 20:47:55,t1_gyqqpvj,t1_gyq9uah,StockMarket,Hahahaha likewise buddy,,
77,gyqqqk2,2021-05-19 20:48:03,t1_gyqqqk2,t3_nga7ru,StockMarket,"Can someone tell why the fuck SNOW in bouncing, that's my only short fuck my life",,
78,,2021-05-19 20:48:13,t3_nggn9d,,StockMarket,,nggn9d,Was one of those days. Hope you chose wisely. 🔮
79,gyqr1at,2021-05-19 20:49:44,t1_gyqr1at,t1_gyq75vz,StockMarket,YOLO,,
80,gyqr1lh,2021-05-19 20:49:47,t1_gyqr1lh,t3_nge5g9,StockMarket,"Thanks, I hate it.",,
81,gyqr2ze,2021-05-19 20:49:59,t1_gyqr2ze,t1_gyqjjq5,StockMarket,Why is that?,,
82,gyqr5u0,2021-05-19 20:50:25,t1_gyqr5u0,t1_gyq7duw,StockMarket,Stocks are taking a nappy poo 😴,,
83,gyqr6eu,2021-05-19 20:50:30,t1_gyqr6eu,t3_nga7ru,StockMarket,"Meh, idc if it goes down a bit now, I won't be selling for a while anywho.",,
84,gyqrmhj,2021-05-19 20:53:04,t1_gyqrmhj,t1_gyqr2ze,StockMarket,It's mostly for me. Took an L last week on AMD on the dip.,,
85,,2021-05-19 20:53:57,t3_nggsf5,,StockMarket,"So I sold a covered call earlier and then bought it to close when it dipped. Used the premium to buy 5 more shares after hours so it was a limit buy. 

I vaguely remember reading somewhere that the limit buy doesn't move the needle. Can someone give a quick breakdown of how I either helped or hurt the stock today? 

If you can't tell, smooth brain here. And I recognize that more volume than 5 shares is necessary to make an impact but the concept should still be the same. 

Lastly, does it make a difference if the stock is an Entertainment Holdings company with its own subreddit?",nggsf5,CC and limit buy impacts
86,gyqrskn,2021-05-19 20:54:01,t1_gyqrskn,t3_ngfsv6,StockMarket,r/wallstreetsilver now welcome 🙏,,
87,gyqrwnf,2021-05-19 20:54:39,t1_gyqrwnf,t1_gyqnh1g,StockMarket,"Just decide which one you think is the most on discount when nothing has fundamentally changed with the company and buy in slowly.  I usually have about 5 to 10 favourites and if I take my time, I just mix it up as I go along",,
88,gyqrz77,2021-05-19 20:55:04,t1_gyqrz77,t1_gyq1ux4,StockMarket,Just like Ralphys teacher grading his essay.,,
89,gyqs3gg,2021-05-19 20:55:43,t1_gyqs3gg,t3_nga7ru,StockMarket,Never fear Joe Biden will save the day! 🧑🏼‍🦼,,
