,comment_id,created,fullname,parent_id,subreddit,text,post_id,title
715,gzgvxgd,2021-05-26 02:42:57,t1_gzgvxgd,t1_gzgnanf,stocks,"For a 40-45% cash position, are you taking gains on even ETFs/index funds or letting those ride?",,
716,gzgw0n3,2021-05-26 02:43:44,t1_gzgw0n3,t1_gzgt1lr,stocks,My bad. It's paywall'd so I didn't,,
717,gzgw1r5,2021-05-26 02:44:00,t1_gzgw1r5,t1_gzgfsyt,stocks,Do have some nio no palantir tho 🤑👍,,
718,gzgw3up,2021-05-26 02:44:32,t1_gzgw3up,t3_nknzhl,stocks,For every 2 shares I buy I get one free. Limits apply…,,
719,gzgw76f,2021-05-26 02:45:22,t1_gzgw76f,t3_nl0qad,stocks,"As an experiment, I picked 7 companies with equity summary scores of 9.0 or above from fidelity at the end of March. So far, I'm up 35% on average for those. They give a basic rundown of their fundamental analysis. 
More recently I've just been fed up with the market and just putting money into index etfs.",,
720,gzgw8iw,2021-05-26 02:45:42,t1_gzgw8iw,t3_nkx8pc,stocks,"Sold my savings, and took a loan to buy GME

I’m jacked to the tits",,
721,gzgw8zb,2021-05-26 02:45:49,t1_gzgw8zb,t1_gzfanla,stocks,!RemindMe 20 days,,
722,gzgwa1p,2021-05-26 02:46:05,t1_gzgwa1p,t1_gzgw8zb,stocks,!RemindMe 19 days,,
723,gzgwaa6,2021-05-26 02:46:09,t1_gzgwaa6,t3_lv5dlb,stocks,"Recently got into investing. Goal is mostly long term with some stocks that I keep up with regularly to buy and sell short-term. Main interests are progressive/sustainable companies/etfs and tech.

BYND - 7%

FAN - 2%

FIW - 5%

OKTA - 16%

PTON - 7%

PYPL - 17%

QCLN - 4%

T - 2%

TAN - 5%

TSLA - 10%

VTI - 14%",,
724,gzgway9,2021-05-26 02:46:19,t1_gzgway9,t1_gzgms42,stocks,"If you agree, why play? The great the about the market is you only need to play games that you think you understand",,
725,gzgwbnb,2021-05-26 02:46:29,t1_gzgwbnb,t3_nkx8pc,stocks,"Yes, bought at 40 in January and sold about two weeks later when it peaked around 400.",,
726,gzgwcta,2021-05-26 02:46:47,t1_gzgwcta,t1_gzekanu,stocks,These same dumbasses tried this on wsb and got their post promptly deleted. Not before it got about 21 awards within half an hour though. Paid shills are a scary thing.,,
727,gzgwcv5,2021-05-26 02:46:48,t1_gzgwcv5,t1_gzg49h4,stocks,"I can hardly take any other ticker seriously at this point until the situation plays out. When they release those vote totals and the mainstream finds out just how ridiculous the rehypoth #'s were/are on GME its going to be a sh!tshow the likes of which no one has ever seen. Even conservative math places the shares outstanding to be 200% of the amount that even exist.  At $216 the stuff is still bargain basement priced. Add to that todays Cry p t _0 and nft revelations....  Even without a squeeze the fundamentals on a microcap debt free ecommerce juggernaut show this to be what it is at this price. Free Money at worst, Generational money at best.  Sermon Over.",,
728,gzgwe1x,2021-05-26 02:47:06,t1_gzgwe1x,t1_gzgway9,stocks,I'm in at 32.25 and when I get out I won't come back in,,
729,gzgwg83,2021-05-26 02:47:40,t1_gzgwg83,t3_nl26o9,stocks,"All things SERVICE related: travel, concerts, salon services, restaurants, etc.  Consumers bought goods (durable and non-durable) throughout pandemic because that was all they could buy.  They are tired of that and will buy all the services they have missed for more than a year.",,
730,gzgwixr,2021-05-26 02:48:22,t1_gzgwixr,t3_nknzhl,stocks,"Yes. It was a little tech startup and I got some NSOs. I exercised them early on when I could afford to, even  though I ran the risk of never having anyone to sell my stock to. I believed in the company. 
Patience paid off when we went public. I sold some to diversify, but am holding most of it.
Insider trading restrictions are a pain, but I'll gladly take the bad with the good",,
731,gzgwlvk,2021-05-26 02:49:07,t1_gzgwlvk,t1_gzgu0qz,stocks,"Good for you. Starting to invest was one of the single best decisions I've ever made, I just wish I started sooner. 

Its not like I have a ton of experience, although I do work in finance and have 6+ years in the market, it's 50% intelligence/50% emotions. Do not underestimate the significant impact your emotions will have on your total returns. 

Here's one that's counterintuitive: when you first start building a long position in something like AAPL, the only thing you want to happen is for the share price to decrease for the next few months/years. The stock decreasing doesn't mean anything for you (it was a long position) other than the fact that you can buy more at better prices and lower your cost basis. If you weren't planning on realizing the gain/lose and the company is still operating to your bull thesis, then the shares decreasing is only a good thing.",,
732,gzgwo7o,2021-05-26 02:49:42,t1_gzgwo7o,t3_nky43y,stocks,"Very interesting post. I looked on google and both Truly/White Claw were introduced in 2016, a few months before $TAP started to decline. Apparently Topo Chico already has brand awareness in Mexico and Vizzy is already at my local Wine & Spirits. Strongly considering jumping in with a few 6/16 60c's and see what happens.",,
733,gzgwqo8,2021-05-26 02:50:17,t1_gzgwqo8,t3_nkx8pc,stocks,APES.  APES EVERYWHERE. HEDGIES ARE FUCKED.,,
734,gzgwuh1,2021-05-26 02:51:12,t1_gzgwuh1,t3_nkx8pc,stocks,"Nope. This whole ""Apes together strong"", ""to the moon"", ""diamond hands"" hysteria is not in my investment style. I prefer solid long term investment with lower returns but also more manageable risks.",,
735,gzgwv4r,2021-05-26 02:51:22,t1_gzgwv4r,t1_gzexlxi,stocks,"I sometimes still buy electronics on Amazon for the free shipping, the fact that I always have a ton of Amazon gift cards, etc, but I absolutely do my due diligence on the seller before pulling the trigger on anything.",,
736,gzgww6i,2021-05-26 02:51:37,t1_gzgww6i,t1_gzgvlow,stocks,"I stay away from Chinese companies but I'm poor so it's easy. 

Go all in and mock me in a year!

It does look interesting, but every time I kinda like what I see, I just think China. Been in business since 2014 and steadily declined since then. 

I think the bikes are ugly myself, maybe that is their hang-up. Or could be the competition just makes cooler shit. [https://letschinese.com/chinese-electric-bike-brands/#:\~:text=Guewer%20is%20a%20large%20factory,superb%20quality%20and%20excellent%20design](https://letschinese.com/chinese-electric-bike-brands/#:~:text=Guewer%20is%20a%20large%20factory,superb%20quality%20and%20excellent%20design).",,
737,gzgwzb6,2021-05-26 02:52:22,t1_gzgwzb6,t3_nl26o9,stocks,Beer,,
738,gzgx07x,2021-05-26 02:52:36,t1_gzgx07x,t1_gzgrg67,stocks,"And you back that up with nothing while unable to disprove that all conditions have changed for it to ever be a squeeze again.

Sorry you missed out in January, but you should really do your own homework on what is short squeeze and what made VW and GME work in the first place.

There is nothing out of average left to squeeze, nor does anyone want to buy up 56 mil shares or even can silently. I could imagine share price doubling if the hype resurfaces, but squeezing ? Hell no. When it peaks they will open short positions at peak again and then you all will be running around againg saying to everyone ''squeeze is not squoze yet''

January already made peoples retirements, average market gain is 8% a year, GME made up for more than 7000% increase, made hedge funds lose 70 bils as well, now you are all chasing delusions. Stock was shorted 140% and the whole world joined in on it, its just not happening again because some cult wants it to happen.",,
739,gzgx0at,2021-05-26 02:52:37,t1_gzgx0at,t3_nkx8pc,stocks,I've held GME and AMC since mid January. It's been a wild ride. The energy of the communities is amazing,,
740,gzgx191,2021-05-26 02:52:51,t1_gzgx191,t3_nklllm,stocks,"At least personally for me, the memes and market didn't get to where I'd be seriously listening today. 

Want me to listen? Get what happened on January 25th to happen again tomorrow (had a drop in the major averages late that morning that smelled like some significant liquidation). As that turned out to be a major, major warning even though it was cleaned up. 

Reason why I'm saying ""tomorrow"" is because of what's generally happened in 2021 so far, although this latest small pullback by the S&P happened at a different time.",,
741,gzgx6pc,2021-05-26 02:54:13,t1_gzgx6pc,t3_nl4pih,stocks,I like it. I think a lot of people sell shares out of a disbelief in their own abilities.,,
742,gzgx7qp,2021-05-26 02:54:28,t1_gzgx7qp,t3_nkx8pc,stocks,"To be honest, it’s why I joined Reddit (read about it on the news). I’ve been in it since Feb. Stuck around on Reddit because I liked it here.",,
743,gzgx9m1,2021-05-26 02:54:56,t1_gzgx9m1,t1_gzg4ccy,stocks,"My thoughts exactly. ""I take one of the matches offered to me but not the other"" wtf",,
744,gzgxa37,2021-05-26 02:55:04,t1_gzgxa37,t3_nl6pf3,stocks,"Sorry, your [submission](https://www.reddit.com/r/stocks/comments/nl6pf3/has_anyone_seen_the_vgac_graph_and_can_explain/) in /r/stocks has been automatically removed due to Rule 3:  Low effort.

If you just want to post 1 liners or just want to know everyone's thoughts, then post a comment to our daily discussion thread which are generally stickied or [click here.](https://www.reddit.com/r/stocks/search?q=author%3Aautomoderator+daily+discussion&restrict_sr=on&sort=new&t=all)

If you're wondering **why a stock moved** a certain way, check out [Reuters](https://www.reuters.com/), [Motley Fool](https://www.fool.com/), and **especially** [Finviz](https://finviz.com/quote.ashx?t=spy) **which aggregates the most news for almost every stock**.

If instead you're wondering what a term means, go to Investopedia.com and search for said term there.

Either way come back here to repost with your findings, thanks!

A list of the [rules can be found here](https://www.reddit.com/r/stocks/about/rules/), and if you're new to r/stocks please see the [wiki](https://www.reddit.com/r/stocks/wiki/index) and/or [read this post.](https://www.reddit.com/r/stocks/comments/4x1419/if_youre_new_here_read_this_post_first/)

*I am a bot, and this action was performed automatically. Please [contact the moderators of this subreddit](/message/compose/?to=/r/stocks) if you have any questions or concerns.*",,
745,gzgxaai,2021-05-26 02:55:07,t1_gzgxaai,t1_gzgww6i,stocks,Thank you I appreciate the input,,
746,gzgxbod,2021-05-26 02:55:28,t1_gzgxbod,t3_nkx8pc,stocks,"I recommend anyone who hasn't read it - read the House of Cards DD by atobitt.  

The MOASS is one thing, but the impact it is likely to have on the US if not global economy and the pure corruption and fraud its going to (or atleast SHOULD) bring to light is going to be something to behold.",,
747,gzgxcfx,2021-05-26 02:55:40,t1_gzgxcfx,t1_gzfp1z3,stocks,"Was at 110 before seltzers took market share, so possibly back to that or close to it if they retain a sizeable piece.",,
748,gzgxdf3,2021-05-26 02:55:55,t1_gzgxdf3,t1_gzet9zs,stocks,"Same thing with mini PCs; I was considering getting something for my entertainment center so I could have a browser and a few other things I can't get natively on my Vizio TV, plus my living room looks way nicer than my home office for video calls, etc, etc. It was awful trying to look through everything and compare. 

(I ended up deciding it wasn't worthwhile, not because of the Chinese crap, but because of the current prices; if I were to find a good deal on an Acer chromebox, or a *really* good deal on a Chromebit, I'd be all over it.)",,
749,gzgxe07,2021-05-26 02:56:03,t1_gzgxe07,t1_gzgujyp,stocks,Well it’s worth what people wanna pay for it as a stock. I understand where you coming from tho. To me Dicovery + is not worthy of my $ monthly. I’ve kept it for awhile because my son watches reruns of the GoldMining shows. If you could watch the regular Discovery Channel live on +  it would be worth my sub.,,
750,gzgxe0p,2021-05-26 02:56:03,t1_gzgxe0p,t3_nl4pih,stocks,"I have been happy with trailing stop loss orders, but I need practice on picking which percentage to use.",,
751,gzgxf7i,2021-05-26 02:56:22,t1_gzgxf7i,t3_nkw2lq,stocks,Genomic stocks are all down a lot....,,
752,gzgxjip,2021-05-26 02:57:27,t1_gzgxjip,t1_gzgtncj,stocks,"I get paid on performance my clients are happy with their their returns, some people post some people appear on TV. same same. 

emotions? none here that's why I only deal with price and momentum my long and short strategy doesn't deal with fundamentals, I'll leave that to you reddit apes but explain you did your research on NEM. gold and money supply and still lost out - all that research for not. lol",,
753,gzgxk3l,2021-05-26 02:57:36,t1_gzgxk3l,t3_nkx8pc,stocks,I got a bit of amc at 7$ it's been doing weird shit,,
754,gzgxkj1,2021-05-26 02:57:42,t1_gzgxkj1,t1_gzgna2s,stocks,5_10k sounds niceee,,
755,gzgxlnh,2021-05-26 02:57:59,t1_gzgxlnh,t3_nl5tob,stocks,"no one is denying their success

everyone has an issue with their price point. let's be generous and assume tsla will grow at 40% rev YoY forever. it would take 5 years for them to justify their **current** cap and just be slightly overvalued vs ridiculously overvalued. is tsla just going to stay stagnant for 5 years? i 100% believe in tsla. i just need it to drop 50% before it's a good purchase.",,
756,gzgxumr,2021-05-26 03:00:14,t1_gzgxumr,t1_gzfxgbb,stocks,"I can’t get there.

The landscape is vastly different than the fifties. G/S ratio climbed because of tech. Which is now the reason people are now fine holding intangible assets as if they had a gold bar; (banned word rhyming with brypto) and tokens most notably.

G/S ratio very closely follows inflation in a positive correlation. An inverting G/S ratio to inflation goes against 20+ years of data.

Supply is a huge deal also. Other “experts” laughed when interviewed about Reddit running the price up like GME/AMC. They can just ramp up supply. Only 25% of silver is specifically mined. The other 75% are byproducts from other mining operations. If silver starts spiking, mining is ramped up. Over the past 20 years every single spike in silver has quickly corrected. To me, that’s because of the supply issue. At $100, a lot of miners are dropping other products and going hard on silver.

But even at $130, does it really matter if you paid $32 an ounce when spot was $28.

Absolutely it does.

That’s the equivalent of being charged a $4 fee per share of a $130 stock purchase. That is absurd. That also doesn’t include the sell which would be another $19.50 fee. Can’t say I’d be happy paying $23.50 fee per share at any price.

I don’t see why this is any better than a low fee ETF based on physical assets. The risk is no higher than the risk of someone breaking into your house and running off with the safe in your closet, imo.

For the retail investor I still feel holding physical metals is novelty, and priced as such.

For the G/S ratio, why is it even relevant? And why do experts only focus on the denominator? For example in 1980, when G/S ratio was 1:17 silver was $50/oz. Even then, that was because of price manipulation of silver and low gold prices. It isn’t exactly fair to apply historical ratios to current times while also only adjusting the price of silver.

All said, the fact that retail investors are pouring into the market, they can’t afford gold, and they like the idea of holding a physical investment, that bodes well for silver. Though I just can’t see a $100 price target in less than 10 years.

Lastly, I’m not saying you’re wrong by any means and that I’m right. These are just my observations which could completely be false. If you have strong convictions against any of my points, I’d love to hear your perspective.",,
757,gzgxvnm,2021-05-26 03:00:29,t1_gzgxvnm,t3_nl614g,stocks,"Ebike was popular in China 10 to 20 years ago. The market has reached its peak. Now, it's ev.

The road condition in shitty part of China is too poor for Ebike to function. And Ebike reached peak market in the city.

Growth is at its peak now. I don't see the demand for Ebike going up in the future. Not for China.",,
758,gzgxvoi,2021-05-26 03:00:30,t1_gzgxvoi,t3_nklllm,stocks,"I know investors are against buying Chinese stocks, but how about shorting them. Any negative sentiment there? 

A friend at an auditing company sent me GSX short seller report, and it just went up and up for a solid month even after very obviously having fake user numbers.",,
759,gzgxwlr,2021-05-26 03:00:44,t1_gzgxwlr,t3_nl26o9,stocks,Tech,,
760,gzgxxjs,2021-05-26 03:00:58,t1_gzgxxjs,t3_nl64zm,stocks,I have FOMO for FOMO now.  Thanks for that...,,
761,gzgxzue,2021-05-26 03:01:32,t1_gzgxzue,t1_gzfl69v,stocks,"It won't go back to $40, if it does you can bet a shit load of people would buy back in hoping it would shoot to another $100 or 2.",,
762,gzgy0y6,2021-05-26 03:01:49,t1_gzgy0y6,t1_gzfwoc6,stocks,200% here,,
763,gzgy2h9,2021-05-26 03:02:11,t1_gzgy2h9,t3_nkx8pc,stocks,"I participated in both AMC and GME, but didn't pull off the heist of the century.

I bought into AMC at 9.33 and it held there for awhile, but kept taking a bath for 2 months.  So I sold once it was about a dollar more and reinvested.  It's a little over $16 now, but it's cool b/c I only had 50 shares anyway.

GME I bought in at $50 before the second short and sold the same day when it hit $66 so I could say I got in on it.

Curse my paper hands!",,
764,gzgy37a,2021-05-26 03:02:22,t1_gzgy37a,t1_gzfanla,stocks,RemindMe! 29 days,,
765,gzgy48e,2021-05-26 03:02:38,t1_gzgy48e,t1_gzg1bdm,stocks,"I'm holding for a few years. The demand for flying will be high, no pun intended, in a few years. Of course, you could sell now and buy back later. I doubt it will go up much in the next few months.",,
766,gzgy6w4,2021-05-26 03:03:19,t1_gzgy6w4,t3_nkx8pc,stocks,Bought GME in January and held for a 300%+ return. Cashed out and let a small amount of house money ride to see what happens.,,
767,gzgy77r,2021-05-26 03:03:24,t1_gzgy77r,t3_nl4pih,stocks,The saying is for long term positions.,,
768,gzgy7a0,2021-05-26 03:03:25,t1_gzgy7a0,t1_gzgugnb,stocks,"Disciple? I read a book lol. Maybe you should too.

I’m not bent on Amazon, did you forget the name of the article were commenting on? 

Coca-Cola? If you knew what a monopoly was, you wouldn’t mention them.

Comcast, there could be a stronger case there.

Again, I don’t think you understand what a monopoly is, or what market power is(as defined by the ftc).

You’ve come here defending Amazon like some sort of fanboy claiming they shouldn’t be broken up, yet the committee who’s job it is to break up monopolies has brought forth the exact complaint I’m trying to explain to you. But you seem want to argue for argument sake. 

You want proof, I gave it you. You don’t seem to grasp what a monopoly is or seem to know what you’re talking about so I’m gonna stop. All I’ll say is read some of the article out there. There’s some great reporting on the subject matter. The 450 page released by the house sub committee is out there too if you want more details. 

Amy klobuchar also released a book on antitrust as well. So there’s lots information out there for you to catch-up on if you actually want to have a discussion. Other than that, you speaking out ya ass.",,
769,gzgy8fr,2021-05-26 03:03:44,t1_gzgy8fr,t1_gzfy4la,stocks,Schwab is for my money... no pun intended. I am really having a tough time today with these.,,
770,gzgy9tm,2021-05-26 03:04:05,t1_gzgy9tm,t3_nl0qad,stocks,"Besides PE and book value, what other metrics do you guys look at?",,
771,gzgybko,2021-05-26 03:04:30,t1_gzgybko,t3_nkx8pc,stocks,yes i live and die by memes,,
772,gzgycxt,2021-05-26 03:04:50,t1_gzgycxt,t3_nky8qn,stocks,You just don't name GOLD in this sub. Shhhh,,
773,,2021-05-26 03:05:12,t3_nl6w8c,,stocks,"Hello internet,

Back at it trying to figure out my next move in my standard account, I’ve already maxed out my contribution in my Roth account and put it primarily into AAPL, MSFT, and VOO.

With that being said my standard account is more of my play account where I’ve been losing money ever since. I have 220 shares of $NIO, 90 shares of $GBOX, and 290 shares of $CLOV. I’m down pretty bad in this account but am determined to learn from my mistakes and get better.

I have $10k in cash I want to put in this standard and let it sit for minimum of 18 months due to tax purposes. My thought process is throw it all into $VTI as I’m tired of losing money on “meme stocks” and Twitter kids hyping things up. 

Would the strategy be ETF focused or individual stock picking? My goal in next 2 years is to buy a property",nl6w8c,"$10k to invest in a standard account, but where?"
774,gzgyehw,2021-05-26 03:05:13,t1_gzgyehw,t3_nl6w8c,stocks,"Welcome to r/stocks!

For stock recommendations please see our portfolio sticky, sort by hot, it's the first sticky, or see [past portfolio stickies here.](https://www.reddit.com/r/stocks/search?q=author%3Aautomoderator+%22Rate+My+Portfolio%22+-+r%2FStocks+Quarterly+Thread&restrict_sr=on&include_over_18=on&sort=new&t=all)

For beginner advice, brokerage info, book recommendations, even advanced topics and more, please read our [Wiki here.](https://www.reddit.com/r/stocks/wiki/index)

If you're wondering **why a stock moved** a certain way, check out [Finviz](https://finviz.com/quote.ashx?t=spy) which aggregates the most news for almost every stock, but also see [Reuters](https://www.reuters.com/), and even [Yahoo Finance](https://finance.yahoo.com/).

Also include *some* [due diligence](https://www.investopedia.com/terms/d/duediligence.asp) to this post or it may be removed if it's low effort.

*I am a bot, and this action was performed automatically. Please [contact the moderators of this subreddit](/message/compose/?to=/r/stocks) if you have any questions or concerns.*",,
775,gzgyk50,2021-05-26 03:06:38,t1_gzgyk50,t1_gza53s4,stocks,"I still like it... I’ve added to my position, and also bought calls when it dipped to around 23 which I flipped at around 28 for a quick gain. I think it’ll hit 100 by end of 2023, and I’m willing to wait out short term volatility",,
776,gzgylao,2021-05-26 03:06:55,t1_gzgylao,t1_gzgwcta,stocks,"Wow, you weren’t kidding holy fuck",,
777,gzgyqw2,2021-05-26 03:08:19,t1_gzgyqw2,t3_nkx8pc,stocks,I'm at 95%,,
778,gzgyr1p,2021-05-26 03:08:21,t1_gzgyr1p,t1_gzgwcta,stocks,"No kidding, all the comments seem to be low karma bots and giving each other medals",,
779,gzgysm8,2021-05-26 03:08:46,t1_gzgysm8,t3_nl0qad,stocks,Thanks !,,
780,gzgytda,2021-05-26 03:08:57,t1_gzgytda,t3_nl6w8c,stocks,All $GE calls,,
781,gzgywlt,2021-05-26 03:09:47,t1_gzgywlt,t1_gzfhqmj,stocks,"That's what Amazon has mostly always been. Certainly in the last decade.

Most everything is made in China, but only in last few years Chinese companies are trying to cut out the middlemen which are the thousands of private label amazon businesses.",,
782,gzgyxg3,2021-05-26 03:10:00,t1_gzgyxg3,t3_nl6z7k,stocks,"Welcome to r/stocks!

For stock recommendations please see our portfolio sticky, sort by hot, it's the first sticky, or see [past portfolio stickies here.](https://www.reddit.com/r/stocks/search?q=author%3Aautomoderator+%22Rate+My+Portfolio%22+-+r%2FStocks+Quarterly+Thread&restrict_sr=on&include_over_18=on&sort=new&t=all)

For beginner advice, brokerage info, book recommendations, even advanced topics and more, please read our [Wiki here.](https://www.reddit.com/r/stocks/wiki/index)

If you're wondering **why a stock moved** a certain way, check out [Finviz](https://finviz.com/quote.ashx?t=spy) which aggregates the most news for almost every stock, but also see [Reuters](https://www.reuters.com/), and even [Yahoo Finance](https://finance.yahoo.com/).

Also include *some* [due diligence](https://www.investopedia.com/terms/d/duediligence.asp) to this post or it may be removed if it's low effort.

*I am a bot, and this action was performed automatically. Please [contact the moderators of this subreddit](/message/compose/?to=/r/stocks) if you have any questions or concerns.*",,
783,gzgyxhx,2021-05-26 03:10:01,t1_gzgyxhx,t3_nkug7q,stocks,Truly excellent advice and I can tell you that I do sleep better at night because I figured out or learned these rules the hard way. So this post is a golden nugget for new investors for sure! Great job OP!,,
784,,2021-05-26 03:09:59,t3_nl6z7k,,stocks,"How do YOU determine which stocks to sell at the end of the year to take profits vs. which are never sells?

I plan on balancing out my capital gains at the end of the year, but with the stocks that are currently up 20-25% AND my FAANG stocks (other than Apple), I love them all so much and bought them with the intention of seeing them continue to grow continually year after year.

Sadly my capital gains losses from stocks like AMC and growth stocks means I need to balance it out at the end of the year.

So what is your process of deciding which stocks to sell later on? And when do you act on it?",nl6z7k,How do YOU determine which stocks to sell at the end of the year to take profits vs. which are never sells?
785,gzgyy4l,2021-05-26 03:10:11,t1_gzgyy4l,t3_nl614g,stocks,"I looked it up on Simply Wall St, and it's really over valued for it's size.",,
786,gzgz1tb,2021-05-26 03:11:09,t1_gzgz1tb,t1_gzgytda,stocks,Anything in particular good about General Electric? Too lazy rn to research,,
787,gzgz1tl,2021-05-26 03:11:09,t1_gzgz1tl,t1_gzgytda,stocks,Or $AMC calls!,,
788,gzgz4f9,2021-05-26 03:11:48,t1_gzgz4f9,t1_gzgy8fr,stocks,"Thanks, never heard of it",,
789,gzgz54q,2021-05-26 03:11:59,t1_gzgz54q,t1_gzgtkw8,stocks,"Ik I’ve never understood that mindset, where some people are like “yeah but this money doesn’t matter, I’ll just do what I want with it” but at the same time have budgets and invest a certain amount",,
