,comment_id,created,fullname,parent_id,subreddit,text,post_id,title
592,gyru91r,2021-05-20 02:00:06,t1_gyru91r,t1_gyrsjx9,StockMarket,🦍,,
593,gyrudgr,2021-05-20 02:01:10,t1_gyrudgr,t1_gyqpw5m,StockMarket,"Interesting points. Thanks!

Do you think the majority of crypto holders will care about the bid/ask spread when buying?",,
594,gyrufop,2021-05-20 02:01:42,t1_gyrufop,t1_gynhnhc,StockMarket,details?,,
595,gyrugrm,2021-05-20 02:01:58,t1_gyrugrm,t1_gyrfu3r,StockMarket,Doubt. ❎,,
596,gyruhv9,2021-05-20 02:02:13,t1_gyruhv9,t1_gyr5zuk,StockMarket,"Hahaha you're not stupid, you did the right think, it's not enought to think bitcoin was a good investment in those years but even if someone invested in bitcoin 5 years ago was for mearly speculation for example, if you invest in a Company you expect the Company grows demostring good results, but in bitcoin it's nothing but the feeling of the market, tha same as Amazon 15 years ago was in my opinion a bad and debty Company but por the cuarantine and the grow of the Internet today is the business that we know today but anybody expected that 15 years ago, thinks changes very fast and I think in the next 10 years bitcoin is going to be nothing but a bad remembering",,
597,gyrujs4,2021-05-20 02:02:41,t1_gyrujs4,t1_gyqu48e,StockMarket,"Then you got know when to walk away, know when to run.",,
598,gyrux2i,2021-05-20 02:05:49,t1_gyrux2i,t1_gyrtgpv,StockMarket,"Ha ha, so funny. 👎",,
599,gyrv35r,2021-05-20 02:07:12,t1_gyrv35r,t3_ngkp5p,StockMarket,"Elon is his own worst enemy,  he needs to stay out of the media. Got played by SNL.  The more he is in the media the worse it goes. He's no longer the little guy that people love. People hate a winner. Elon please no more media.",,
600,gyrv48x,2021-05-20 02:07:27,t1_gyrv48x,t1_gyrtmg9,StockMarket,"They are in fact, not at all “tell-tale signs of a sociopath”. Unless you’d like to point me to where it mentions any of those things in the DSM-V.",,
601,gyrv759,2021-05-20 02:08:07,t1_gyrv759,t1_gyrkjt6,StockMarket,$4.20,,
602,gyrv8dc,2021-05-20 02:08:24,t1_gyrv8dc,t1_gyrtb4l,StockMarket,"How can you know if it’s been priced in? There is also the $25,000 sedan. Don’t know if it’s coming out this year, but that definitely has NOT been priced in.",,
603,gyrv9jc,2021-05-20 02:08:41,t1_gyrv9jc,t1_gyrhh56,StockMarket,"They do need press. They’re still competing. People don’t beat a path to their door just cause. Their returns are remarkably similar to their competitors. 

JP Morgan is in many more businesses than those. Speculative businesses that benefit tremendously from scaring buyers out of markets momentarily. 

Just ask their good friend Bill Ackman.",,
604,gyrvbq8,2021-05-20 02:09:12,t1_gyrvbq8,t1_gyroa8u,StockMarket,"Thanks man, I appreciate it.",,
605,gyrvfe0,2021-05-20 02:10:04,t1_gyrvfe0,t1_gyrv759,StockMarket,Haaaaaaa..... I was waiting for maybe $420...,,
606,gyrvh8m,2021-05-20 02:10:31,t1_gyrvh8m,t1_gyrmebz,StockMarket,FIRE SALE 🔥,,
607,gyrvl8s,2021-05-20 02:11:27,t1_gyrvl8s,t3_ngkp5p,StockMarket,Bury put half B on a shorts trust me when a doctor in finance do this you bet that it's going to go down,,
608,gyrvm6h,2021-05-20 02:11:41,t1_gyrvm6h,t1_gyrv8dc,StockMarket,It’s all priced in..unless it’s something no one knows about,,
609,gyrvq1m,2021-05-20 02:12:34,t1_gyrvq1m,t3_nga7ru,StockMarket,I got tired of watching my stocks drop and crypto going up week in week out so I bought crypto at the peak. Now I am getting crushed in both :(,,
610,gyrvrvp,2021-05-20 02:12:59,t1_gyrvrvp,t3_ngkp5p,StockMarket,"Tesla and Elon are concealing his real results, if ony was for the selling of electric cars the Company will  report bad results, but tesla made up his results selling bones to other car's companies and, how's not, with crypto, if not fot these two factors the Company (only by electric cars selling) would have bad results, but Elon is taking advantage that bitcoin has any regulations, and by the way this is not a critic for Elon, in fact, I think he's a genius and it's impressive how a coupple of tweets can descrease the value of an active, in this case, bitcoin",,
611,gyrvssb,2021-05-20 02:13:11,t1_gyrvssb,t1_gyrv8dc,StockMarket,"I've seen more Tesla's in my town in the last few months than ever before.   They're more affordable and people want them. 

I will buy the dip if it goes low enough.",,
612,gyrvucn,2021-05-20 02:13:32,t1_gyrvucn,t1_gyrqflr,StockMarket,I've got an account and a SWIFT routing number... good luck getting your fancy digital money to send to that wallet.,,
613,gyrvuzl,2021-05-20 02:13:41,t1_gyrvuzl,t1_gyrv759,StockMarket,And I would've paid $69.69,,
614,gyrvvcv,2021-05-20 02:13:46,t1_gyrvvcv,t1_gyrvm6h,StockMarket,Given how much people shit all over Elon for not delivering on promises (even though he does follow through on many things) I assume that people would be surprised if something like Gigaberlin were to open this year.,,
615,gyrvzi9,2021-05-20 02:14:45,t1_gyrvzi9,t3_ngkp5p,StockMarket,"Michael Burry and even Bill Gates accepted that they have short term investments in tesla, I don't know what to think about :/",,
616,gyrw3vp,2021-05-20 02:15:48,t1_gyrw3vp,t1_gyrvssb,StockMarket,Same! My wallet begins opening when the share price goes below $550.,,
617,gyrw5s0,2021-05-20 02:16:14,t1_gyrw5s0,t1_gyrchc3,StockMarket,I wish I had sold the moment I heard this.,,
618,gyrw5tu,2021-05-20 02:16:15,t1_gyrw5tu,t1_gyrv9jc,StockMarket,"You do realize I specialize in banks. I cover global banks. I’m well aware of ALL JPMs business lines. And you’re wrong. Trading revenues in equity is tiny. They make their money from the fixed income markets, new issue bonds, syndicates, ABS, swaps, currency trading, derivatives etc. Mortgages generate a majority of their interest income as well as their fee income. Wealth management which Chase has been building out over the years continues to grow steady, and they earn fee income on that. 

JPM makes roughly 50% income from interest income and deposit spreads while the remaining comes in the form of fee and trading revenues. Markets, their trading unit, makes a majority of its income from FICC aka fixed income.",,
619,gyrw77f,2021-05-20 02:16:35,t1_gyrw77f,t1_gyrvfe0,StockMarket,If I am right I will shit my pants for not buying a put.,,
620,gyrw969,2021-05-20 02:17:02,t1_gyrw969,t1_gyrvuzl,StockMarket,Nice,,
621,gyrwa8c,2021-05-20 02:17:17,t1_gyrwa8c,t3_ngkp5p,StockMarket,Lol that's be crazy,,
622,gyrwfgk,2021-05-20 02:18:29,t1_gyrwfgk,t1_gyrjzac,StockMarket,"Aha, sure.

Also don't forger, GME is brick and mortar and is bound for the ground.

Here's an idea. Short if you're so sure :)",,
623,gyrwgw5,2021-05-20 02:18:49,t1_gyrwgw5,t3_ngkp5p,StockMarket,RemindMe! 3 Months,,
624,gyrwgwt,2021-05-20 02:18:49,t1_gyrwgwt,t1_gyrw77f,StockMarket,"Buy it..
.but not that deep",,
625,gyrwhvm,2021-05-20 02:19:02,t1_gyrwhvm,t1_gyrdwdj,StockMarket,"Lol Bitcoin does what it always does, Tesla has nothing to do with that. If Tesla can go to 60k then down to 30k then bounce to 40k that'd be insane.

I'm invested in neither.",,
626,gyrwiwm,2021-05-20 02:19:15,t1_gyrwiwm,t1_gycct1k,StockMarket,"Chargepoint blink Tesla, I can wager on the entire industry with these. No whammies.",,
627,gyrwl9q,2021-05-20 02:19:46,t1_gyrwl9q,t1_gyrwgwt,StockMarket,"Lmao for sure, maybe $420?",,
628,gyrwlgy,2021-05-20 02:19:49,t1_gyrwlgy,t1_gyrkdyr,StockMarket,making your wife have 6 kids in 8 years and deliberately choosing only males is a tad psychotic.,,
629,gyrwnr6,2021-05-20 02:20:20,t1_gyrwnr6,t1_gyrmblf,StockMarket,How about roll out of the eventual end game? Licensing software and selling all that sweet sweet data to other car companies? That’s been the value of Tesla since the beginning. The car is the printer and the data is the ink. They don’t need the car division to be profitable which means they can continue to undercut the competition. It’s cyclical.,,
630,gyrwpd1,2021-05-20 02:20:41,t1_gyrwpd1,t1_gyrsxhl,StockMarket,Just stopping by to say hey to a fellow Lando,,
631,gyrwq5o,2021-05-20 02:20:52,t1_gyrwq5o,t1_gyrwl9q,StockMarket,..for sure maybe $420.,,
632,gyrwxg8,2021-05-20 02:22:30,t1_gyrwxg8,t1_gyrwq5o,StockMarket,"You son of a bitch, I'm in!",,
633,gyrwzu9,2021-05-20 02:23:03,t1_gyrwzu9,t1_gyrwnr6,StockMarket,"I literally believe Tesla will run the world one day in a similar fashion to Amazon or Google, it’s just the short term that’s been ridiculous to me.",,
634,gyrx0q8,2021-05-20 02:23:15,t1_gyrx0q8,t1_gyrh2n3,StockMarket,"MB got Q1 puts.

When reopening was bound to buildup inflation fears. So sure he has a good sense of when to place a bet. 

Has he made any actual PT predictions?",,
635,gyrx3my,2021-05-20 02:23:56,t1_gyrx3my,t3_ngkp5p,StockMarket,Wouldn’t it be nice to be able to get in around 60 Pre split again? Those were the days.,,
636,gyrx5u2,2021-05-20 02:24:26,t1_gyrx5u2,t1_gyrufop,StockMarket,You can look it up on Google,,
637,gyrx6as,2021-05-20 02:24:32,t1_gyrx6as,t3_ngkp5p,StockMarket,"""I'm calling it""...

....Everybody has been ""calling"" it since 2012.",,
638,gyrx79v,2021-05-20 02:24:45,t1_gyrx79v,t3_ngkp5p,StockMarket,$150 sounds like a good price,,
639,gyrxa21,2021-05-20 02:25:24,t1_gyrxa21,t3_ngkp5p,StockMarket,"Are you calling cause this because Michael burry purchased 500milliom worth of puts? 

Or just your own genius DD",,
640,gyrxco9,2021-05-20 02:26:00,t1_gyrxco9,t1_gyrlyis,StockMarket,"> Tesla is 9.99% of ARKK....

And they bought more today",,
641,gyrxe83,2021-05-20 02:26:22,t1_gyrxe83,t1_gyrfvgn,StockMarket,"Hold some for decades, buy every burst, *realize* gains at obvious peaks. If I had gotten I'm on Tesla before it hit $100, I would sell half right now. Not a huge fan of timing the market, but charts like this are hard to ignore.",,
642,gyrxfjv,2021-05-20 02:26:40,t1_gyrxfjv,t1_gyrggbg,StockMarket,Thank you for your support!,,
643,gyrxhnt,2021-05-20 02:27:10,t1_gyrxhnt,t1_gyr2j63,StockMarket,Haha which ETF that’s part of the problem...,,
644,gyrxhss,2021-05-20 02:27:12,t1_gyrxhss,t1_gyrgihg,StockMarket,I think he shorted at the very height so hes already made a lot.,,
645,gyrxkgd,2021-05-20 02:27:50,t1_gyrxkgd,t1_gyrvzi9,StockMarket,"Burry put a massive short on Tsla, so far looks like he is making billions on it.",,
646,gyrxo6z,2021-05-20 02:28:43,t1_gyrxo6z,t1_gyrxhnt,StockMarket,Hmm I think I saw this heat map of this entirely red ETF earlier today with a long history of excellent growth but I can’t quite remember its name,,
647,gyrxpln,2021-05-20 02:29:03,t1_gyrxpln,t3_ngkp5p,StockMarket,You're calling it? Michael Burry already called it.,,
648,gyrxqx5,2021-05-20 02:29:21,t1_gyrxqx5,t1_gyrxkgd,StockMarket,He's a master in short therm investments and making it in tesla is a red code on my opinion,,
649,gyrxre5,2021-05-20 02:29:28,t1_gyrxre5,t1_gyrwxg8,StockMarket,#you son of a bitch IM IN! 🍻,,
650,gyrxsqk,2021-05-20 02:29:45,t1_gyrxsqk,t1_gyrw5tu,StockMarket,"You’re wrong. I deal with banks on a quarterly basis when refinancing my properties. 

Nothing you have just said has anything to do with press, or how JPM puts out contradictory reports simultaneously. 

Thank you for alerting this thread to your reading comprehension level. Low.",,
651,gyrxudj,2021-05-20 02:30:06,t1_gyrxudj,t1_gyrsjx9,StockMarket,"Honestly everyone I know IRL who invests in either Tesla or Bitcoin seem to be insecure young men who can’t think for themselves and follow the herd while trying to convince you that they’re cool and all that. But then they’re also cowards who shy away from the slightest sign of danger.

Oh wait that explains the graphs.",,
652,gyrxvsb,2021-05-20 02:30:24,t1_gyrxvsb,t3_ngkp5p,StockMarket,Burn baby BUUUUUUUUUUUUURN!!!!!!!!!!!,,
653,gyrxzfg,2021-05-20 02:31:13,t1_gyrxzfg,t1_gyrsfom,StockMarket,$69 for me,,
654,gyry1qk,2021-05-20 02:31:43,t1_gyry1qk,t1_gyq6gks,StockMarket,They did? I’m pretty sure that dude died a century ago.,,
655,gyryalk,2021-05-20 02:33:44,t1_gyryalk,t1_gyrv48x,StockMarket,"""Those with ASPD have no regard for others’ rights or feelings, lack empathy and remorse for wrongdoings, and have the need to exploit and manipulate others for personal gain. """,,
656,gyryb4v,2021-05-20 02:33:51,t1_gyryb4v,t3_ngicxi,StockMarket,"I’ve been using google eBay for over a decade as a seller and a buyer and the amount of changes they are rolling out are mixed. Their user interface change is just awful and their fees have gone up for most products being sold.

Yes the eBay payments system is much better than being hit with PayPal fees but overall it’s about the same.

The customer market is also notoriously cheap. It’s fine to want to pay less for a product, but I would get laughable offers 50% below the going market on some items.

I still primarily sell there but I really dislike how customer centric they have become. I have shipped items that were legitimately lost in the mail because of covid and I was forced to refund the buyers. So I am out the inventory of the item because of a massive delay in shipping where it just gets stuck in a terminal.

Their search algorithm is also bunk. I have set prices to the lowest possible price and every now and then my items would not pop up in searches. I would have friends check with there accounts and they couldn’t find the item either.

eBay is a market first mover that is an antiquated dinosaur that saw a huge surge in revenues because of trading cards and sports cards with the pandemic. 

This revenue uptick will decrease as things go back to normal and then I think eBay will die a slow death like Ford is doing right now.",,
657,gyrybrc,2021-05-20 02:34:00,t1_gyrybrc,t1_gyrxzfg,StockMarket,Nice,,
658,gyrycb1,2021-05-20 02:34:07,t1_gyrycb1,t3_ngkp5p,StockMarket,"Given the fact it was over valued in 2019, it’s gonna be a long fall. Especially when Bitcoin falls, that’s a lot of cash they just burned.",,
659,gyryi4f,2021-05-20 02:35:33,t1_gyryi4f,t3_ngkp5p,StockMarket,Or if you believe that maybe buy puts?,,
660,gyryjsr,2021-05-20 02:36:00,t1_gyryjsr,t1_gyrjzac,StockMarket,"I still don't see Teslas in my day to day. Fuck I see things like Lotuses more than I see Teslas. Maybe it's a regional thing, I don't know, but I just don't see them where i live (NE)",,
661,gyryk9w,2021-05-20 02:36:08,t1_gyryk9w,t1_gyrc7ma,StockMarket,"She has multiple failed funds before she got lucky on Tesla, but sure... long term time horizons...",,
662,gyrynbf,2021-05-20 02:36:53,t1_gyrynbf,t1_gyrkdyr,StockMarket,He did name is kid an unpronouncable name.,,
663,gyryr18,2021-05-20 02:37:49,t1_gyryr18,t3_ngkp5p,StockMarket,Michael Burry has entered the chat.,,
664,gyryru3,2021-05-20 02:38:01,t1_gyryru3,t3_ngiz83,StockMarket,"Me with Tesla right now. Fuck it, good time to burn up more margin and add shares.",,
665,gyrz07f,2021-05-20 02:40:04,t1_gyrz07f,t1_gyrxsqk,StockMarket,"Yeah... no I'm not. It's clear you don't know how JPM works. 

&#x200B;

I'll leave this right here. Checkmate. It's quite obvious JPM is #1, not even close. JPM going on CNBC to talk about interest rates forecasts and hiring practices has 0 to do with promoting refinances? lol what? The generally only do interviews on Bloomberg, which is for traders mostly. 

[https://i.imgur.com/Tqyl5OT.png](https://i.imgur.com/Tqyl5OT.png)

Mortgage Originations:

[https://i.imgur.com/CW1QLNi.png](https://i.imgur.com/CW1QLNi.png)

&#x200B;

I analyze banks quarterly, including JPM. I'm more in touch with their business than you'll ever be. Probably never picked up their 10-Q a day in your life.",,
666,gyrz1zg,2021-05-20 02:40:30,t1_gyrz1zg,t3_ngkp5p,StockMarket,See the amount of people who would buy this dip and you’ll know why this won’t happen,,
667,gyrz2qb,2021-05-20 02:40:41,t1_gyrz2qb,t3_nge5g9,StockMarket,Hedg r fuk,,
668,,2021-05-20 02:41:26,t3_ngoknc,,StockMarket,"It's no surprise that these semiconductors have done well over the past few years. Although these companies will have mild corrections, I think it's safe to say they will have a big impact on the technology driven future. 

With that said, I'd like to get peoples opinions on the pros and cons of each of these companies. 

What products do they offer?

How is one better than the other?

Will the function/price ratios of their product be cyclic or will there be a clear winner?

Just to bring up a few.

Here is some quick information on these companies:

**NVDA**: Company focuses on GPUs. Has a great GPU for both gaming and crypto. GPUs thrive in crypto and Neural Networks (AI).

MC\~350B, EV/EBITDA\~60, low debt, good growth

**AMD:** Has made a huge push in the CPU niche and has gained popularity with the gamers. Their CPUs are valued at the best function/price ratio. Pretty sure they are working on a promising GPU.

MC\~90B, EV/EBITDA\~40, low debt, good growth

**INTC:** The most experience and clout in the industry. Look around you, you'll probably see an intel sticker. Recent restructure of company with seems promising. Heavy in the DB and cloud niche which will be massive in the future (and currently is). Also, working on GPUs, not sure on the progress.

MC\~223, EV/EBITDA\~6.7, debt, could have less, good growth

&#x200B;

At first glance the cheapest to most expensive from a valuation standpoint looks as followed INTC, AMD, NVDA, respectively. 

Looking forward to the responses!",ngoknc,"Discussion on the semiconductor giants [AMD, INTC, NVDA]"
669,gyrz5wc,2021-05-20 02:41:28,t1_gyrz5wc,t3_ngkp5p,StockMarket,Tesla. Overpriced garbage. Last earnings fueled by pumping and dumping bitcoin. Lost all respect for Elon and Tesla,,
670,gyrz8qp,2021-05-20 02:42:10,t1_gyrz8qp,t3_ngkp5p,StockMarket,I’m a buyer after it does!!,,
671,gyrzbq6,2021-05-20 02:42:53,t1_gyrzbq6,t3_ngkp5p,StockMarket,It's a doge eat doge world.,,
672,gyrzdbi,2021-05-20 02:43:16,t1_gyrzdbi,t1_gyrz07f,StockMarket,"You don’t need to reiterate your comprehension level. No one asked. 

Again, just press releases. But, I guess they don’t compete for business. That’s a new one. 

Keep it up.",,
673,gyrzi93,2021-05-20 02:44:26,t1_gyrzi93,t1_gyrxco9,StockMarket,ARK is gonna ARK.  It is what it is.,,
674,gyrzixn,2021-05-20 02:44:36,t1_gyrzixn,t3_ngkp5p,StockMarket,So buy TSLA you say. On it!,,
675,gyrzk2m,2021-05-20 02:44:53,t1_gyrzk2m,t1_gyrjdcx,StockMarket,If it did follow that model chart it would crash down to $100-$150 lol,,
676,gyrzl3q,2021-05-20 02:45:07,t1_gyrzl3q,t1_gyrzdbi,StockMarket,">Go ahead, show me all this press you're talking about. Must be boat loads of it. Then show me the contradictory report that refutes whatever they are say. PLEASE show me this proof. I'm showing you all types of stuff, but you're just making baseless claims. JPM is hardly EVER in the press, I know, I'm literally watching the news ALL day. I track JPM new all day every day. Come on buddy. SHOW ME. Back up with some real proof. You're going against an expert in banks, especially US banks ;)

Go ahead, show me all this press you're talking about. Must be boat loads of it. Then show me the contradictory report that refutes whatever they are say. PLEASE show me this proof. I'm showing you all types of stuff, but you're just making baseless claims. JPM is hardly EVER in the press, I know, I'm literally watching the news ALL day. I track JPM new all day every day. Come on buddy. SHOW ME. Back up with some real proof. You're going against an expert in banks, especially US banks ;)

I just ripped you a new one lol. Thought you could go toe to toe with a banking sector expert LOL. That was funny.",,
677,gyrztcj,2021-05-20 02:47:03,t1_gyrztcj,t1_gyryjsr,StockMarket,I see a crazy amount of Teslas where I live. Like all models that are available. People love teslas here.,,
678,gyrzv8y,2021-05-20 02:47:31,t1_gyrzv8y,t1_gyrsfom,StockMarket,"I will join you at $4. I mean, who doesn't want an unprofitable company with a criminal leader at the top that doesn't know anything about AI?",,
679,gyrzzv6,2021-05-20 02:48:38,t1_gyrzzv6,t1_gyrmblf,StockMarket,"Meme investing is consolidating behind GME where it started, and on the side AMC all others at this point are just investing.",,
680,gys01hf,2021-05-20 02:49:02,t1_gys01hf,t1_gyryalk,StockMarket,"Anti-social personality disorder isn’t the same as psychopathy. Regardless, the examples you provided are a MASSIVE reach for diagnosing someone with ASPD.",,
681,gys02lp,2021-05-20 02:49:17,t1_gys02lp,t1_gyrxhss,StockMarket,He bought options. He didn't short.,,
682,gys04z6,2021-05-20 02:49:51,t1_gys04z6,t1_gyq9iot,StockMarket,"The difference is China finally launched the digital yuan. 

This is definitely concerning",,
683,gys06ah,2021-05-20 02:50:10,t1_gys06ah,t3_ngkp5p,StockMarket,Next time call something before someone with a much higher profile does.,,
684,gys08e5,2021-05-20 02:50:40,t1_gys08e5,t3_ngkp5p,StockMarket,Bye bye $100 invested 😂😂😂,,
685,gys0d04,2021-05-20 02:51:46,t1_gys0d04,t1_gyrmzlu,StockMarket,Is that an Elon EOY or a normal one?,,
686,,2021-05-20 02:51:48,t3_ngosam,,StockMarket," Recently, US stocks Q1 institutional positions have been released, UBS, Goldman Sachs and other institutions bucked the trend and increased their positions on Alibaba. UBS's holdings increased by 174% compared with the previous quarter, Goldman Sachs increased its holdings by 36% compared with the previous quarter, and Ali became the Chinese concept stock company with the largest holdings of Goldman Sachs. Most analysts on Wall Street believe that Ali’s firm investment in the new fiscal year will put pressure on short-term profit indicators, but the mid-to-long-term development trend is clear, which will help further strengthen the company’s long-term barriers to competition. At the same time, Ali said that it will disclose more indicators to measure the effectiveness of its investment in the e-commerce ecosystem from the next quarter. Higher transparency is expected to drive the market to regain confidence in the company's stock. 

 Read more info on:  [https://h5.westmoney10.com/StockNewsDetail2/844889505164038144?lang=en](https://h5.westmoney10.com/StockNewsDetail2/844889505164038144?lang=en)[=reddit](https://h5.westmoney10.com/StockNewsDetail2/844153112313860096?&lang=en&from=reddit)",ngosam,"Wall Street increased position of Alibaba(BABA.US), believing that Ali’s mid-to-long-term development trend is positive"
687,gys0e6k,2021-05-20 02:52:03,t1_gys0e6k,t1_gyrpqtx,StockMarket,"Eh, I didn’t say I straight up agreed with it. But a CEO of a major company (and not some rando on the internet) saying something like that was still pretty wild",,
688,gys0f3r,2021-05-20 02:52:17,t1_gys0f3r,t1_gyrztcj,StockMarket,NE tends to live Subaru. All wheel drive and snow. Also a lot of NE is rural. Might be why electric cars aren't really sought after.,,
689,gys0gqq,2021-05-20 02:52:40,t1_gys0gqq,t1_gyrdwdj,StockMarket,Not really. During the last crypto boom there was the weed boom. Musk will find the next wave to ride but in all fairness the Tesla boom already happened way before the Bitcoin one.,,
690,gys0i10,2021-05-20 02:52:57,t1_gys0i10,t1_gyrwzu9,StockMarket,"Well, it was priced as if it was already doing just that 4 months ago. 

Not had the potential to, but already doing it like Amazon and Google.",,
691,gys0ivy,2021-05-20 02:53:09,t1_gys0ivy,t3_ngkp5p,StockMarket,RemindMe! 2 years,,
692,gys0ozg,2021-05-20 02:54:32,t1_gys0ozg,t1_gyrxudj,StockMarket,You don’t know a lot of people then,,
693,gys0r2b,2021-05-20 02:55:01,t1_gys0r2b,t1_gys02lp,StockMarket,"He may have also shorted, that just doesn’t need to be disclosed",,
694,,2021-05-20 02:55:22,t3_ngouux,,StockMarket," It's depressing watching the Reddit investing community post ""DD"" about BlackBerry  that reads more like wishful financial fanfiction, focused on their  ""game changing patent sales"", ""new paradigm cybersecurity software"" and  ""autonomous driving partnerships"", but ignores their -123.63% profit  margin, -54.75% ROE, -1.79% ROA, -2.42 EPS, -25.50% revenue growth, and  $2.66 BVPS.   


I get it, it's easy to disregard basic fundamentals  when you bought a dying meme stock at $22+ in January during the  GameStop short squeeze, and now you're suffering cognitive dissonance  from having to catch a falling knife in a delusional attempt to ""average  down"" on your FOMO induced speculative bet. Behavioural finance never  ceases to amaze me.   


BlackBerry has steadily shrunk since 2015.  They are a tech company that cannot compete effectively with industry  peers and get bullied out of most lines of business they venture into.  The company simply does not create value for shareholders. It is an  objectively poor investment of your money.   


Now, can the Motley Fool do retail investors a huge favour and stop churning out endless  articles about BlackBerry? I'd like to see quality news when I browse  Yahoo Finance, not clickbait.",ngouux,"Everyone who bought BlackBerry is a bagholder, change my mind"
695,gys0vcc,2021-05-20 02:56:00,t1_gys0vcc,t1_gyrohjd,StockMarket,Buy at 400… sell on bounce. Go long at 125.,,
696,gys0wms,2021-05-20 02:56:18,t1_gys0wms,t1_gyr8kur,StockMarket,"If you are managing billions, I feel sorry for your clients, because you are retarded.",,
697,gys0wtv,2021-05-20 02:56:21,t1_gys0wtv,t1_gys0f3r,StockMarket,"I live in a city so that makes more sense. Electric cars will definitely become more and more popular, and Tesla is at the forefront of that industry. They just need to deliver more vehicles and keep innovating with vehicles like the Cybertruck and more. They will be fine long term.",,
698,gys0wz4,2021-05-20 02:56:23,t1_gys0wz4,t3_ngouux,StockMarket,"Ok welp, did you say the same thing about gamestop and Bitcoin",,
699,gys0x64,2021-05-20 02:56:26,t1_gys0x64,t3_ngkp5p,StockMarket,This looks eerily like the entire market after this last year,,
