,comment_id,created,fullname,parent_id,subreddit,text,post_id,title
0,gyvbtut,2021-05-20 21:07:40,t1_gyvbtut,t3_n990dq,stocks,They are shorting this as they once shorted GME AMC...,,
1,gyvbtw8,2021-05-20 21:07:41,t1_gyvbtw8,t1_gyv8pi0,stocks,"Me too!  I have other stocks like LRCX HD UNH HON TMO etc.  I am 50% tech, but I think that's enough 😆.",,
2,gyvbusj,2021-05-20 21:07:51,t1_gyvbusj,t1_gyuzo66,stocks,I’m over 40. It’s good to be in the 2%! 😉,,
3,gyvbvq9,2021-05-20 21:08:03,t1_gyvbvq9,t1_gyux0v5,stocks,Wasn’t Wednesday blood red besides like 0.02% green on the nasdaq.,,
4,gyvbw3v,2021-05-20 21:08:08,t1_gyvbw3v,t1_gyv5fif,stocks,I’m willing to bet my entire portfolio agains yours that you’re wrong.,,
5,gyvbxad,2021-05-20 21:08:23,t1_gyvbxad,t1_gymyj91,stocks,"There's already a bunch of competitors, so this space is already crowded. Chobani is even selling oatmilk. With that said, Oatly is the best one on the market.",,
6,gyvbxrk,2021-05-20 21:08:29,t1_gyvbxrk,t1_gyv86ce,stocks,"I mean, wasn't Ford the only company that didn't need a bailout in 2008?",,
7,gyvbypb,2021-05-20 21:08:41,t1_gyvbypb,t3_nh7ld4,stocks,"Nvidia should be on everyone’s radar. I wouldn’t doubt them being over 1,000 a share in 5-10 years.",,
8,gyvbyyr,2021-05-20 21:08:44,t1_gyvbyyr,t3_nh8jr8,stocks,"It sounds to me like you've been dealt some really shitty hands throughout your life. Maybe some of it was self-inflicted but probably most was just sadly life circumstances. 

At this point, given your history your seeing ALL of your failures and absolutely none of your successes. I'd say given your setbacks and where you came from; landing a six figure salary is a HUGE win-win. 

As to the investment strategy I can't really help there. I'm sorry. I too am in a tough spot, where indexing probably isn't going to do me much good. I'm a bit over 50 and disable-y retired. So far, I've not lost any money and can even boast of some small gains, but nowhere near the SICK GAINS some of these folks have shown, But I also know I don't have the risk tolerance nor the money to take risky bets. All I can do is keep trying and invest in companies I believe in; backed of course by those companies that are profitable. 

Initially, I was hugely disappointed by my returns, especially watching all these meme stocks become high fliers while the stocks I chose were either stagnant or had little gains. I started to question what I was doing wrong. And still do. But when things started to change in the market the companies that I had chosen handled all the negativity in the market much better than the high flyers. 

I have also noted the stock market is like a huge game. The media is used to create fear, doubt, and any other kind of negative emotion to make one question his/her market picks. All I can do is continue to learn, not take any huge risks, and KEEP trying. 

Maybe try just dipping your toes back in; instead of trying to just get Right back to it.

Experiment and see what works and what doesn't. Readjust and continue to move forward. 

The only reason I responded was not to give financial or market advice because I have None, but to possibly help you see that Not everything you've done has been a failure. 

GL&GB",,
9,gyvbz02,2021-05-20 21:08:44,t1_gyvbz02,t1_gyv1eqi,stocks,May be due to larger contributions coming more recently into the account,,
10,gyvbz5a,2021-05-20 21:08:46,t1_gyvbz5a,t1_gyv2zzb,stocks,And the data shows that quantitative easing only played a modest part in that.,,
11,gyvc3tk,2021-05-20 21:09:43,t1_gyvc3tk,t1_gyuvvv9,stocks,"I mean, would you want to be invested in a car company that is not retooling for EV? It'll be interesting what happens to the car companies when cars are fully autonomous",,
12,gyvc44y,2021-05-20 21:09:47,t1_gyvc44y,t3_ngi6ua,stocks,"Precision Biosciences, Inc. (DTIL)

A small cancer research company in NC. One of the therapies they’ve been working on is in a Phase 1/2a trial. It’s been used on only 13 patients with CD19+ Non-Hodgkin lymphoma, but 77% of them have been responding to the therapy.

It’s been gaining over the last couple weeks and I hope it explodes soon!",,
13,gyvc7j2,2021-05-20 21:10:30,t1_gyvc7j2,t3_nh6bxq,stocks,Why is it amazing when all it’s doing is catching up with competition?,,
14,gyvc9tx,2021-05-20 21:10:58,t1_gyvc9tx,t1_gyva1vh,stocks,"All those workers who stand to lose their jobs for the reasons you outline are exactly why Ford and other automakers are going to struggle to transition. They've already gone on strike over the last few years over fears of job loses due to the shift to EVs.

Ford and the other automakers have to essentially cannibalize their own ICE sales and slowly put some of those employees out of a job because of the fact that there's less to do when building an EV.",,
15,gyvc9vw,2021-05-20 21:10:59,t1_gyvc9vw,t1_gyv7cjp,stocks,I love value investing. I own stocks like INTC and LMT. However I still think the companies named are great companies and none of them are really trading at extremely high valuations except AMZN. My problem with it is the not the type of investing he does but what he is saying just to boost his own positions.,,
16,gyvcako,2021-05-20 21:11:08,t1_gyvcako,t1_gyuxdus,stocks,RECAF,,
17,gyvcdj1,2021-05-20 21:11:45,t1_gyvcdj1,t1_gyuvzxk,stocks,"If tomorrow is very green, Im cashing out like 20% on some stocks. Because if its not tomorrow, its Monday when we are getting shafted.",,
18,gyvcf59,2021-05-20 21:12:05,t1_gyvcf59,t3_nh8jr8,stocks,"As you say that you have no time, need quick profits, that means that you will be gambling and DDs will not help. You want to reach your goals quick, means hige risk you are not able to swallow. And you are stuck. Mainly because of your expectations. Eather you accept the risks and gamble, or you just invest in index and take your 7-10% yearly in a long run. There's is no get rich quick and safely scheme in stock market.",,
19,gyvcha8,2021-05-20 21:12:31,t1_gyvcha8,t3_nh6bxq,stocks,"Got in at $4.83 after the crash last year, glad my hold has paid off",,
20,gyvci35,2021-05-20 21:12:40,t1_gyvci35,t1_gytm8g0,stocks,"Stop buying my calls, I don't wanna give up the shares lol.",,
21,gyvck3e,2021-05-20 21:13:05,t1_gyvck3e,t1_gyvbxrk,stocks,"I can't believe that they still have such little investor confidence. They are one of, if not THE oldest American auto maker with a pretty stable history behind them. Chrysler and GM have had horrible histories filled with controversy and financial issues. 

I think that in general the automobile industry is extremely stale, and I don't think electric vehicles are going to suddenly reinvigorate it.",,
22,gyvcm9q,2021-05-20 21:13:32,t1_gyvcm9q,t1_gyvbisa,stocks,"If Tesla thinks their tacky space truck is going to give them an edge in this market they are horribly mistaken.

No self-respecting truck driver would be caught dead in that thing.",,
23,gyvcn9u,2021-05-20 21:13:44,t1_gyvcn9u,t1_gyuk42k,stocks,I bought 267 TSLA at $313 pre-split and sold at $360 after Cybertruck show. Should've been sitting at 1M. Efff me.,,
24,gyvcow6,2021-05-20 21:14:04,t1_gyvcow6,t1_gyuu0qc,stocks,"What you outline is why a number of people think software will be an increasingly important source of revenue for the automakers in the future. This is especially true once self driving cars eventually hit the market (be it years or decades later). Tesla is already pioneering this, you can buy speed upgrades for your car via software updates in addition to FSD.

But Ford and a lot of other automakers aren't very good at making software. An increasing number of them, including Ford, are turning their OS over to Google's Android, which makes selling software upgrades a lot harder in the future.",,
25,gyvcq01,2021-05-20 21:14:18,t1_gyvcq01,t1_gyvbl4v,stocks,"Lol where is he getting these numbers?


Msft is 33.59 pe ratio. with 50% growth, next year it would already be down to like 24, and then another 50% growth and its now down to 18 pe ratio....


Obviously i am not bullish enough to think they will maintain 50% every years but if they did its pretty obviously a good buy lol",,
26,gyvcqp3,2021-05-20 21:14:27,t1_gyvcqp3,t1_gyv7dfb,stocks,"Oh I think the fun is just beginning.

\-Bear",,
27,gyvcrjd,2021-05-20 21:14:37,t1_gyvcrjd,t1_gyurz3y,stocks,"“The largest companies in 2050 may not even be founded yet” 

We can already buy PLTR",,
28,gyvcrqd,2021-05-20 21:14:40,t1_gyvcrqd,t1_gyuszvj,stocks,I think it’ll have a hard time breaking out past $16 (2010 high).,,
29,gyvcrz6,2021-05-20 21:14:43,t1_gyvcrz6,t1_gytdn2o,stocks,Are you serious ?,,
30,gyvcsip,2021-05-20 21:14:49,t1_gyvcsip,t3_ngvmrw,stocks,Did hedges funds rebalance back into tech/growth? Because hard to believe it was just 1 week ago there was a massive inflation panic and people were like sell tech or tech is going to go lower.,,
31,gyvctw2,2021-05-20 21:15:06,t1_gyvctw2,t1_gyuqiaq,stocks,"Oh the new f150 lightning ticks all the boxes for me.    I'm definitely going to buy one at the retail price they're saying.

Plus the frunk.    So awesome.",,
32,gyvcvhn,2021-05-20 21:15:27,t1_gyvcvhn,t3_nh6bxq,stocks,and let's hope they take sunrun with them. I have been waited years -- since $42,,
33,gyvcvjs,2021-05-20 21:15:27,t1_gyvcvjs,t1_gyuxs1c,stocks,Love that company but valued way too high right now.,,
34,gyvcxgj,2021-05-20 21:15:51,t1_gyvcxgj,t1_gyuoybw,stocks,"I think for shareholders, the purchase price is going to be very relevant for, you know. Profits...",,
35,gyvcxgi,2021-05-20 21:15:51,t1_gyvcxgi,t1_gyv717g,stocks,You’re not wrong. You’re just assuming there’s sufficient time gap in there between it crashing down and coming back up to make such a decision. That’s not always the case.,,
36,gyvcz6s,2021-05-20 21:16:13,t1_gyvcz6s,t1_gyv6unj,stocks,"Agree, I am long on PBI and I think it is a way under valued.",,
37,gyvd001,2021-05-20 21:16:24,t1_gyvd001,t1_gyvbyyr,stocks,I appreciate your response! Thank you!,,
38,gyvd02w,2021-05-20 21:16:24,t1_gyvd02w,t3_nh6bxq,stocks,Ford Ford Ford... this is just what they needed to stay in the Game!!! Ford to the moon which is 15$ 🤫,,
39,gyvd0mm,2021-05-20 21:16:31,t1_gyvd0mm,t1_gyv9w0k,stocks,"Yeah, certainly possible",,
40,gyvd21u,2021-05-20 21:16:49,t1_gyvd21u,t1_gyv75ij,stocks,not sure you understand what a minimum tax is. that would mean companies that currently pay 0% would start paying 15% so it could certainly cause a sell off,,
41,gyvd2ga,2021-05-20 21:16:54,t1_gyvd2ga,t1_gyuwnlu,stocks,"Oh for sure. 

Engines that is.",,
42,gyvd3eb,2021-05-20 21:17:06,t1_gyvd3eb,t1_gyuszvj,stocks,"Agreed. That’s a $78 billion market cap. 

With that said I love their new EV line. The Mustang looks sweet and the GT premium performs 0-60 in 3.5 seconds selling in the $60s. The Taycan 4S does 3.9 seconds STARTING at $110K. Audi E-Tron GT does it in 3.1 seconds starting at $100K. 

The F-150 looks fantastic and starts at $58K. Similar to the Cybertruck pricing and compared to the hummer $110K it seems like a steal. 

They are bringing a higher performing electric vehicle that a lot more people can afford. I hope it continues and if successful they could be the leading manufacturer of electric vehicles in the US soon. 

I think a price point of $15 or so with a market cap of $58 billion seems reasonable to me over the next year or so. Maybe it does hit that $20 if actually the leader in the US in a couple years. Not crazy. 

What is crazy is Tesla market cap of $577 billion.  Other people will catch up. I’m personally looking at the Taycan instead of the S because of dealerships and performance reviews I have been reading.",,
43,gyvd40d,2021-05-20 21:17:13,t1_gyvd40d,t3_ngvmrw,stocks,"Tomorrow is the monthly options expiring so if there's going to be a serious move, it's likely going to be overnight/early morning.",,
44,gyvd8zz,2021-05-20 21:18:16,t1_gyvd8zz,t1_gyur60a,stocks,So you think Shopify will be around in 30 years? Shopify.,,
45,gyvd937,2021-05-20 21:18:17,t1_gyvd937,t1_gyu7b0o,stocks,Literally ZERO assurance you can or will get out at $90.,,
46,gyvdb0w,2021-05-20 21:18:42,t1_gyvdb0w,t1_gyv6unj,stocks,"I like PBI, AHT, and Ford",,
47,gyvdc64,2021-05-20 21:18:56,t1_gyvdc64,t1_gyvbz5a,stocks,"All due respect to you Mr. Wikipedia, but if we didn’t have deficit spending and quantitative easing, we have no idea how the last decade would have gone.  All we know is that those were the main monetary and fiscal policies at the time and the results were steady and sustained growth unlike anything we’ve ever seen.

Anyway, I feel at this point that you’re pretty set in your ideology having not studied the subject matter too deeply.",,
48,gyvdcxs,2021-05-20 21:19:05,t1_gyvdcxs,t1_gyv6unj,stocks,"Agree, PBI is way undervalued.",,
49,gyvdd95,2021-05-20 21:19:08,t1_gyvdd95,t1_gyv8rby,stocks,"As a company, I agree. They will post decent growth, probably faster than the market, but not as rapid as a new company. But often and especially in this weird post-corona market, companies' performance don't seem to have the exact correlation to their stock performance, with many companies overbloated in price with future expectations priced-in.  

As a stock,, Volkswagen's (Vz, not St) forward P/E right now is 7.5. Tesla is at 127 and Nio isn't even poised to make a profit apparently. Comparing P/S ratio, Nio is at 11.77, Tesla is at 15.1, and Volkswagen is at 0.53.    

If Volkswagen and Herbert Deiss can implement their plans of becoming a fully top-down tech-first auto company with everything in-house (and being in the industry I have some idea of how serious VW is at not being dependent on literally anyone especially for their software and services, as they see that as the key differentiator in an electric era), the revaluation of the stock price alone should make up a large portion the growth I'm looking for. It may not happen in three or four years. But once CARIAD starts kicking in across the line up in 2024-25, and they maintain their current projected growth in volumes, I see no reason why their valuation should remain so shit.",,
50,gyvddjf,2021-05-20 21:19:12,t1_gyvddjf,t3_nhakdg,stocks,"Yrah and everyone suddenly becoms rational and analytical when investing in stocks. Like literally who would by the stock who has PE ration above 25 in the future? No one. Oh yes, sure that will definitely be the future. NOT.",,
51,gyvdf4m,2021-05-20 21:19:32,t1_gyvdf4m,t3_ngo9ay,stocks,"Commenting to follow this thread as well. Great tips provided already, so thank you! I think we can all better improve our stock picks.",,
52,gyvdh2r,2021-05-20 21:19:56,t1_gyvdh2r,t3_nharj2,stocks,"A lot of Semis dropped after earnings. People were pricing in the beat already. When I didn't beat, but not by as much as they expected, they dropped.",,
53,gyvdhcy,2021-05-20 21:19:59,t1_gyvdhcy,t3_nhbg63,stocks,Hope the day has been a good one and thank you!,,
54,gyvdian,2021-05-20 21:20:11,t1_gyvdian,t3_nh6bxq,stocks,Short Tesla,,
55,gyvdii6,2021-05-20 21:20:13,t1_gyvdii6,t3_ngyrsj,stocks,"Buy and Sell at the market, like GODS.",,
56,gyvdj0x,2021-05-20 21:20:20,t1_gyvdj0x,t1_gyv4rom,stocks,"Ford cut their dividend last year and haven't reinstated it.

I'm holding my shares until they hit $15 sometime next year, then selling, or they reinstate dividends.",,
57,gyvdm0c,2021-05-20 21:20:57,t1_gyvdm0c,t1_gyv5f6h,stocks,"> People want to drive 500 miles on a charge not 200.

The average American commute is 32 miles/day. Charge once a week overnight. Of all the hills to die on this ain't it.",,
58,gyvdm0f,2021-05-20 21:20:57,t1_gyvdm0f,t3_nfrmgh,stocks,coinbase at 390 :D,,
59,gyvdmzj,2021-05-20 21:21:09,t1_gyvdmzj,t1_gyvdm0c,stocks,500 miles is 804.67 km,,
60,gyvdp4s,2021-05-20 21:21:36,t1_gyvdp4s,t1_gyv0omi,stocks,Ah. I see. Thanks for the additional info.,,
61,gyvdpph,2021-05-20 21:21:44,t1_gyvdpph,t1_gyra5er,stocks,"It actually isn't anywhere near that simple. Lots of big tech companies with MASSIVE cash reserves like Apple and Microsoft also get punished when interest rates increase. Biotech companies with long cash runways and no need to borrow for years get punished.   


There are simply too many variables and emotions involved to really know anything in the short term. It won't make sense in the short term. That's why you need patience and DD and buying good companies each time they dip 10%.",,
62,gyvdr0t,2021-05-20 21:22:00,t1_gyvdr0t,t1_gys2dbd,stocks,"TD Ameritrade has a stock screener that’s both easy to use and customizable. It’s how I found a few undervalued stocks that have mostly worked out (only one hasn’t so far, but I’m optimistic for it).",,
63,gyvdshl,2021-05-20 21:22:18,t1_gyvdshl,t3_nhbg63,stocks,Thank you for your service.,,
64,gyvdvmi,2021-05-20 21:22:57,t1_gyvdvmi,t3_nh6bxq,stocks,"Ouch. I don't mean to shit on your parade, but Ford is investing an incredibly small amount of money into EVs compared to VW, yet it's still a very large investment to sell fewer profitable products and replace them with unprofitable products. Meanwhile they have a terrible balance sheet and shareholders and executives that are much more short term-minded than most companies. It'd be a miracle if they still sell anywhere near the same amount of cars in 10 years.",,
65,gyvdvwu,2021-05-20 21:23:01,t1_gyvdvwu,t1_gyvbm7q,stocks,So you're telling me AAPL outperformed the indices for two days in a row? Nice 😏,,
66,gyvdwdk,2021-05-20 21:23:06,t1_gyvdwdk,t1_gyv6ygp,stocks,"Its also incorrect to assume that battery improvements will never decrease costs; the issue is that right now the improvements are geared towards performance. Once those reach satisfactory levels, we'll see improvements to production to reduce costs.",,
67,gyvdxe4,2021-05-20 21:23:19,t1_gyvdxe4,t1_gyv1vsb,stocks,John Deere,,
68,gyve0d0,2021-05-20 21:23:55,t1_gyve0d0,t1_gyvdc64,stocks,">All due respect to you Mr. Wikipedia, but if we didn’t have deficit spending and quantitative easing, we have no idea how the last decade would have gone. All we know is that those were the main monetary and fiscal policies at the time and the results were steady and sustained growth unlike anything we’ve ever seen.

We also saw expansionary monetary police lead to Japan's lost decade as well as the biggest financial disaster since the Great Depression.  You're picking and choosing your data.

I could be wrong, but if you assert ""QE is definitely proven and tested"", that's simply not accurate.  

>Anyway, I feel at this point that you’re pretty set in your ideology having not studied the subject matter too deeply.

My degree is in economics.  I'm not really an economist but I have been studying all of this somewhat deeply for the last few months.  I could be wrong, of course, which is why I'm not asserting anything with certainty.  All I'm saying is that the certainty around these policies is not rooted in fact.

FWIW, I teach English to a top Brazilian economist who is opposed to QE.  BRIC countries in general are opposed to it.",,
69,,2021-05-20 21:23:55,t3_nhbxm2,,stocks,"Ive been thinking about buying XOM but I feel like theyre not gonna be around much longer, especially with how much the democrats hate fossil fuels, the increasing amount of electric vehicles, and the fact so many companies are switching to green energy. Is there any future for XOM and other gas companies, or are they on the way out?",nhbxm2,Oil and Gas stocks on their way out?
70,gyve77i,2021-05-20 21:25:22,t1_gyve77i,t3_nhbxm2,stocks,"Oil and gas will continue to gush cash in the rest of the world.

Russia seems like good bet.",,
71,gyve78r,2021-05-20 21:25:23,t1_gyve78r,t1_gyfd97d,stocks,Tesla's CFO and Chief Accountant starting a side-business together. Interesting. My guess is they're opening a Ford dealership. Yours?,,
72,gyve79x,2021-05-20 21:25:23,t1_gyve79x,t1_gyuszvj,stocks,Lmao same here high af 😂,,
73,gyve91a,2021-05-20 21:25:46,t1_gyve91a,t1_gyvcf59,stocks,"I suppose quick is subjective. I was really hoping for a 2 year time horizon. I was hoping to be able to double my account in 2 years. In this market, it's not impossible, but I know that means taking on higher risk. However my risk tolerance isn't extreme. I don't do YOLOs or OTM options. I also don't use margin. But I have been doing deep ITM 2023 LEAPS. Then putting all my money in savings until another opportunity presents it's self. 

I don't think it's the risk that's my issue, but just my complete mental gridlock of executing a move. I almost had a panic attack when I bought Apple! It's just this insane fear of loss I now have. I can't figure out how to get over it.

I want to be bold, but I'm petrified of going back to my old life.",,
74,gyve9dg,2021-05-20 21:25:50,t1_gyve9dg,t3_nhbxm2,stocks,Electric vehicle technology is nowhere near ready to match (let alone dominate) fuel-based vehicles. Your kids may have to ask that question but not you.,,
75,gyvea9r,2021-05-20 21:26:02,t1_gyvea9r,t3_nhbg63,stocks,"Today’s price movement got me really confused, yesterday’s meeting notes indicate money printing might stop soon, while today most stocks shot up. Is today a bull trap?",,
76,gyveb4o,2021-05-20 21:26:12,t1_gyveb4o,t3_nh758k,stocks,"I would take profits and move on. Or, to think about it another way. Would you be willing to accept a capital depreciation equal to the dividend yield?",,
77,gyvec6h,2021-05-20 21:26:26,t1_gyvec6h,t1_gyvbxrk,stocks,"I just think with China hoarding the chips and taking over the EV market. Potus is trying to take the USA lead with ford. I just purchased a few shares after seeing the post and story on his Instagram a day ago.  I'm surprised not many others caught on. TESLA will fall behind as its quarter profits are from sales of credits to other manufactures, but that all changes when they start making their own EVs.",,
78,gyvecet,2021-05-20 21:26:29,t1_gyvecet,t1_gyvbz02,stocks,I was probably thinking average annual returns. Take uneven contributions out of the picture,,
79,,2021-05-20 21:27:02,t3_nhc086,,stocks,"Hello,

I have 5 shares of Arclight (ACTC) and received an email from Schwab with the above title. In the proposal, it says "" Shareholders of ArcLight Clean Transition Corp. (ArcLight) have an option to redeem their ordinary shares for cash at an approximate per-share price of $10.00."" It also says ""The offer provides shareholders an opportunity to redeem their ordinary shares for a pro-rata portion of the funds available in the Trust Account established in connection with the Initial Public Offering of ArcLight.""

What does this mean? Why would I sell my shares for $10 when they're trading publicly for $16.65? I'm very confused.

Thank you! The email was very long, so if you need more information for context let me know.",nhc086,Notice of Corporate Action - ARCLIGHT CLEAN TRANSIT F
80,gyvegp2,2021-05-20 21:27:22,t1_gyvegp2,t1_gyun3os,stocks,Luckily for everyone involved Toyota has just announced they're not going to compete in the EV space. They're aiming for less than 2 million EV sales per year by 2030. That basically means bankruptcy for a company as large as them.,,
81,gyvegrk,2021-05-20 21:27:23,t1_gyvegrk,t1_gyv114v,stocks,"that's fair - when advocating for DCA, explain that the benefit isn't ""you'll have better returns"" but rather ""in the case that you're volitionally or rationally incapable of acting in accordance with the best evidence, you may do less damage to yourself this way""",,
82,gyvekko,2021-05-20 21:28:11,t1_gyvekko,t1_gyuvvv9,stocks,"You don't seem to think EVs are here to stay.  It definitely sounds like you think it could be a fad. I think that is incredibly naive. People are buying stock based on which carmakers they think will transition to EV most successfully. Don't get me wrong, GM saying ""we'll be all electric by 2035"" seems like a reason to avoid their stock since 1) Tesla is already ""all electric"" 2) People want affordable EVs right now, not  15 years of hybrids lol",,
83,gyvelaf,2021-05-20 21:28:20,t1_gyvelaf,t3_nhbxm2,stocks,50 years too early for this post,,
84,gyvempa,2021-05-20 21:28:38,t1_gyvempa,t1_gyuysw6,stocks,"Fuck, was there triple digit inflation sometime between weeks 200 and 300?",,
85,gyvempf,2021-05-20 21:28:38,t1_gyvempf,t1_gyuilv1,stocks,This. There would be a HUGE demand for old school S10/Blazer truck frame vehicles just as the Silverado/Tahoe/Surburban’s are right now it’s the truth they’re selling like hot cakes.,,
86,gyven4p,2021-05-20 21:28:43,t1_gyven4p,t3_nhbg63,stocks,"Thank you! I’ve been on deadline all week, this is much appreciated! 😊",,
87,gyveogi,2021-05-20 21:29:00,t1_gyveogi,t1_gyuszvj,stocks,"Well, it is moving towards $20 in the same way it's moving towards $2,000.",,
88,gyveovy,2021-05-20 21:29:05,t1_gyveovy,t3_nha7kn,stocks,"Is there still a ban on evictions of renters? I'm too dumb to figure out how profit off of it, but I expect that whenever that lifts there will be alot of evictions.

Maybe buy some residential rental REITs or something if that exists.",,
89,gyvep6c,2021-05-20 21:29:09,t1_gyvep6c,t3_nh02hb,stocks,I feed my family,,
90,gyvepox,2021-05-20 21:29:15,t1_gyvepox,t1_gyv7rbu,stocks,Not with their balance sheet it's not. All they need is 2-3 bad years and they're gone.,,
91,gyveq4n,2021-05-20 21:29:21,t1_gyveq4n,t1_gyvd21u,stocks,"I was under the impression that while 0% tax havens do exist a lot of companies opt for tax havens like Ireland, Switzerland, Luxembourg, Singapore and the like which have tax rates much closer to 15% which would mean there wouldn't be too harsh a loss in profits.",,
