,comment_id,created,fullname,parent_id,subreddit,text,post_id,title
276,gzghlgx,2021-05-26 00:40:31,t1_gzghlgx,t1_gzfqygm,stocks,You as well my friend,,
277,gzghlx1,2021-05-26 00:40:37,t1_gzghlx1,t1_gzg54vc,stocks,My pleasure!,,
278,gzghme8,2021-05-26 00:40:44,t1_gzghme8,t1_gzgcjsf,stocks,The man the myth the legend? Best there is best there was best there ever will be?,,
279,,2021-05-26 00:41:30,t3_nl4ary,,stocks," No names, no promotions.

&#x200B;

Hey guys so you know I've been tracking traders with a weekly **70% success rate from 9 different servers** and the last document I shared here of the trades, hit a share limit which I didn’t even know existed on Google lol. So here’s the link of the file, everyone can view it no access required.  


[https://docs.google.com/spreadsheets/d/1Xog\_BTm6KlB8sZGDsAfJoB7zT3aBJ5-Xwp1cW-pUxIc/edit?usp=sharing](https://docs.google.com/spreadsheets/d/1Xog_BTm6KlB8sZGDsAfJoB7zT3aBJ5-Xwp1cW-pUxIc/edit?usp=sharing)  


If you'd like me to share the trades live, drop a comment to let me know!  


I’ll continue updating the file every night regardless, hope it helps =)",nl4ary,Joined 200+ Trading Discord servers... Results Pt 2!
280,gzghpwm,2021-05-26 00:41:34,t1_gzghpwm,t1_gzg8mey,stocks,"This. I don't understand how people can see this shit and think they covered. We can predict price rises due to the FTD-Cycles pretty much accurately now, and some people still have doubts? I don't get it",,
281,gzghsvp,2021-05-26 00:42:15,t1_gzghsvp,t1_gzggota,stocks,"There is a difference between tapering quantitative easing and raising interest rates, one doesn't necessarily precipitate the other. If we are to believe the Fed, interest rates won't rise until the labor market shows more concrete signs of improvement. Of course just my two cents",,
282,gzghsw5,2021-05-26 00:42:15,t1_gzghsw5,t3_nkx8pc,stocks,Bought palantir at 30. Still hodling,,
283,gzghuh0,2021-05-26 00:42:38,t1_gzghuh0,t1_gzfkb5q,stocks,"The risk to reward ratio is so absurdly good, that everyone should have atleast one stock of it to be honest",,
284,gzghumt,2021-05-26 00:42:40,t1_gzghumt,t1_gzggigw,stocks,Looks like he’s posting this so you don’t have to.,,
285,gzghupu,2021-05-26 00:42:42,t1_gzghupu,t3_nkx8pc,stocks,"I've got positions in gme, bit zero in amc. Personally i don't equate the two and don't really see why others do. Amc feels like a distraction. I'm in gme because of the DD. If you haven't yet, study it. It's quite compelling.",,
286,gzghv70,2021-05-26 00:42:49,t1_gzghv70,t1_gzggeif,stocks,"Do you even know what a synthetic share is ? And what makes you think they are shorting it ''so much'' now ?

On top of that we never owned the float at all, nor do we own it now, if you can buy 56 mil shares, you can buy 56 mil shares, it has literally almost nothing to do with synthetic shares.

Do we seriously have entire generation of investors that doesn't know a single thing about options ?",,
287,,2021-05-26 00:42:36,t3_nl4bja,,stocks,"What are some of your favorite investing/market news podcasts? My favorite is Animal Spirits, and I also listen to Industry Focus and Market Foolery just for some macro idea of what’s going on (I definitely stay away from Motley Fool articles, stock picks, etc.). What else do you guys enjoy and why?",nl4bja,Investing/News Podcasts?
288,gzghwez,2021-05-26 00:43:05,t1_gzghwez,t1_gzgcsw5,stocks,Give us one today.  We’ll subscribe to your newsletter next month.,,
289,gzghy6q,2021-05-26 00:43:30,t1_gzghy6q,t3_nl26o9,stocks,DKNG this year. Easy money,,
290,gzghykg,2021-05-26 00:43:36,t1_gzghykg,t3_nkx8pc,stocks,"I’ve tried riding GME multiple times but for one reason or another I have failed each time. I don’t doubt the ticker will eventually do something bonkers (assuming brokerage failures and mash equilibrium don’t kill the momentum) but that volatility with this particular ticker I feel is just too much for me. I feel you gotta know your own limits and not just look at the cash to be made. 


I have had more success holding the digital cash (I actually have confidence in its long term potential) so I’ll probably just stick with that.",,
291,gzgi0la,2021-05-26 00:44:04,t1_gzgi0la,t1_gzfwoc6,stocks,"Same here, 100% gme. No other stock in my portfolio, and just adding every month with every cent that I can.",,
292,gzgi4px,2021-05-26 00:45:02,t1_gzgi4px,t3_nkx8pc,stocks,"The only one I did was the initial GME runup. Began buying in November and had a cost average of $22 when the huge runup in January began. Unfortunately, 20% of my shares got sold at a sell limit of $100, but I went with the meme $420.69 for about 50% of them which was my biggest gain ever in the stock market. Still holding a few shares for no real reason. Maybe it'll go up, maybe it won't. I don't care either way.",,
293,gzgi504,2021-05-26 00:45:05,t1_gzgi504,t1_gzghpwm,stocks,"But he said it with such confidence. It must be true! I'm selling right away!

/s",,
294,gzgi5dz,2021-05-26 00:45:11,t1_gzgi5dz,t1_gzg7anh,stocks,"Even if you bought now, man, if GME really goes trough with a NFT-Gamemarket, it's gonna be way more worth than now. This is industry-changing",,
295,gzgi6qe,2021-05-26 00:45:29,t1_gzgi6qe,t3_nkx8pc,stocks,"Yes, but meme stock is a misnomer at this point. There’s a lot of well thought objective DD that explains the investment thesis. The best case is basically non existent at this point. People who refuse to see that are simply haters",,
296,gzgi6r1,2021-05-26 00:45:29,t1_gzgi6r1,t1_gzggm13,stocks,Go to their website under investor relations and look at their quarter report. Look at the line items for net income.,,
297,gzgif9g,2021-05-26 00:47:27,t1_gzgif9g,t1_gzfqfj7,stocks,I like the non alcohol topo.,,
298,gzgihab,2021-05-26 00:47:56,t1_gzgihab,t1_gzgfwo4,stocks,"For amc sure, but gme? Especially with their NFT Stuff now, it's industry changing. If they pull it off correctly it's gonna bring them a lot of money",,
299,gzgihg2,2021-05-26 00:47:58,t1_gzgihg2,t3_nl0qad,stocks,Someone told me once that if you see a business that’s always busy or you hear people taking about it in a positive way it’s a good thing to take a look at it.. overall great stepping stones.,,
300,gzgik68,2021-05-26 00:48:37,t1_gzgik68,t1_gzghwez,stocks,I can't say,,
301,gzgin6q,2021-05-26 00:49:20,t1_gzgin6q,t3_nkx8pc,stocks,I liquidated my other stocks to buy more GME. I think the numbers are there. It's not huge money for me. The potential is huge and the loss is minimal for me.,,
302,gzginyk,2021-05-26 00:49:30,t1_gzginyk,t3_nkvtrm,stocks,SCHB or VT I'd say,,
303,gzgiqgi,2021-05-26 00:50:05,t1_gzgiqgi,t1_gzghv70,stocks,"Sorry, synthetic was incorrect terminology. I understand synthetic shares only exist in options. I guess “counterfeit” is the more correct term.",,
304,gzgiqhl,2021-05-26 00:50:05,t1_gzgiqhl,t1_gzft1i9,stocks,"Interesting. The one time I tried to use it I found it to be confusing to onboard and ended up just going in-person. That said, this is not a ""invest in what you know"" investment for me. Rather, it's one where the Morning Star ""fair value"" is almost double what the market price is.",,
305,gzgiqy8,2021-05-26 00:50:11,t1_gzgiqy8,t1_gzfi0j8,stocks,Crazy undervalued,,
306,gzgirtt,2021-05-26 00:50:23,t1_gzgirtt,t3_nl4bja,stocks,InvestTalk.,,
307,gzgiset,2021-05-26 00:50:32,t1_gzgiset,t3_nknzhl,stocks,"I work for Volkswagen but right now I don't, no. I'm right now fully in the forbidden stock but afterwards I want to buy a few VW stocks. Sadly no discount on shares for employees",,
308,,2021-05-26 00:50:52,t3_nl4h40,,stocks,So let’s say you don’t have much money say 2k. You want to try and make some premium with low downside risk. If you pick a stock like Ford (which I’m my opinion is risky) to sell covered calls on weekly you could also have a long put to cover your ass if shit hit the fan. Does anyone have experience doing this? I’m pretty sure I’m theory they should cancel out if worse comes to worse. Is there a calculation that can be done to find out max loss thresh hold? I want to try this and it seems too good to be true.,nl4h40,Long put short covered call
309,gzgiubv,2021-05-26 00:50:58,t1_gzgiubv,t1_gzg5nx0,stocks,If you buy stuff like NKLA dollar cost averaging and holding won't magically make it a good investment.,,
310,gzgiuzh,2021-05-26 00:51:07,t1_gzgiuzh,t1_gzfytbm,stocks,"Why not sell when it’s high like now, and buy back in when it dips a bunch?  You could have many more shares and money doing that than just holding and waiting, right?",,
311,gzgivlm,2021-05-26 00:51:15,t1_gzgivlm,t1_gzfanla,stocks,"I completely agree with this except for 1 point. My dude, they don’t have 21 days left. Buckle in 🤘",,
312,gzgivqi,2021-05-26 00:51:17,t1_gzgivqi,t1_gzgfpva,stocks,"If they wanted that they could have done it already.

Quality still matters, I work for a company does a little of this in tech and the quality of work is still much worse IMO.",,
313,gzgiwo9,2021-05-26 00:51:31,t1_gzgiwo9,t3_njq7ae,stocks,"1) You can day trade all you want with your own money. 
2) Your money consists of two types...settled and unsettled
3) Unsettled money is money that you have used to buy and then sell something...that money is considered unsettled until it works it way through a verification system for accuracy. The system usually settles those funds by the next day (but it may take longer)
4) Settled funds are new money and money that is not unsettled. 
5) Most accounts have some type of Margin which leverages personal money to obtain larger amounts of money (borrowed money). $25K day trade limit makes sure that margin accounts can cover loses. 

By the way if you’re new… and you are thinking about day trading, you are going to get slaughtered. Successful day traders squeeze between brokerage houses high speed computer trading systems, incredible due diligence and technical analysis!  If you do not have a high-speed computer training system, the ability to do incredible due diligence or can accomplish your own technical analysis… bury your money in the backyard in a mason jar… You’ll make more money. Good luck!",,
314,gzgixz6,2021-05-26 00:51:49,t1_gzgixz6,t1_gzfwoc6,stocks,140%,,
315,gzgiy2h,2021-05-26 00:51:50,t1_gzgiy2h,t1_gzgbl4c,stocks,"ENPH has suffered a lot over the past few months, hopefully it can reverse",,
316,gzgiyfe,2021-05-26 00:51:56,t1_gzgiyfe,t3_nkx8pc,stocks,Permanent bank account,,
317,gzgiyif,2021-05-26 00:51:57,t1_gzgiyif,t1_gzgiubv,stocks,I buy real companies.,,
318,gzgizbj,2021-05-26 00:52:08,t1_gzgizbj,t1_gzfk2oz,stocks,"Would love some feedback on this. I used to maintain less than 10 positions, but recently I've spread out to tons of small positions. The idea is that I get a little skin in the game and that keeps me following these companies closely, and then maybe I become aware quickly when good buying opportunities come up down the road. Also, I have re-curring investments so I can DCA into bigger positions.",,
319,gzgizfn,2021-05-26 00:52:10,t1_gzgizfn,t1_gzgc6p6,stocks,"It's a game of musical chairs and the Fed holds the whistle. They will blow for time whenever inflation becomes too detrimental to the uber-richs savings ; inflation is a wealth transfer from lenders to borrowers over time. We are already seeing equities and bonds become more correlated in their moves, because the market is expecting the period of free money to come to an end. When time is up, everything is coming down. 

If you're asking, ""When is the music going to end?"" Then my bet is the Fed is going to raise rates in Q1 2021, but I also think they are behind the market and the 10 year is going to 200 basis points by November. So the market will probably sell off some time between now and then.

From a technical perspective, we are trading in and around the fibonnaci extension from the previous cycle high pre-covid (SPY $339.70) at 1.618 of $414.90, which was pretty much on the nose with the close from the day before yesterday at $414.94. The 1.618x target would be $535.60, which is definitely out of reach given we are already deep in the euphoria stage of the market cycle. 

So I would guess action is going to trade side-ways-ish depending on the news over the next few weeks, then begin trending back towards SPY $340 towards Q1. If Burry is right and the Fed is behind the curve on hyper-inflation, then we're probably going bear market $160-180. But if inflation does not get too out of hand and the Fed reverses course after raising rates and starts pumping again, it could be $535. So that would be my 3 year call hehe $160-$535, depending on whether the music *stops* or just slows down.",,
320,gzgizla,2021-05-26 00:52:12,t1_gzgizla,t1_gzgiy2h,stocks,"Honestly , makes up a good chunk of my portfolio",,
321,gzgizs5,2021-05-26 00:52:15,t1_gzgizs5,t1_gzec2w5,stocks,"I doubt if they still care much about their e-commerce business. They care about AWS and other stuffs. Yes, like you say, I cannot trust many of the listings and the user  comments. I only buy well known items from well known brands at Amazon.",,
322,gzgizvh,2021-05-26 00:52:16,t1_gzgizvh,t3_nkx8pc,stocks,Who's asking? Whats yer business here? Can I see yer hands? Do you owe anyone bananas? If offered a crayon what would you do with it?,,
323,gzgj1na,2021-05-26 00:52:41,t1_gzgj1na,t1_gzg1jj5,stocks,set it and forget it pick,,
324,gzgj23c,2021-05-26 00:52:48,t1_gzgj23c,t1_gzg8blv,stocks,I like what you did there,,
325,gzgj5mq,2021-05-26 00:53:39,t1_gzgj5mq,t3_nkx8pc,stocks,"I was not in the first go round. 

I'm in this time. Not going to miss the spaceship this go round.",,
326,gzgjbds,2021-05-26 00:54:58,t1_gzgjbds,t1_gzfl69v,stocks,💯,,
327,gzgjbzo,2021-05-26 00:55:07,t1_gzgjbzo,t3_nk43rq,stocks,"So let's look at what you really have:

SPY - US Large Blend  
QQQ - US large Growth  
SPYD - US Large Value (div)  
NOBL - US Large Value (div)  
SDIV - World MidCap 

And if you look at their individual stocks, then you are expect to see a lot of overlaps. So yeah you can consolidate this 

Pick one: VTI vs SPY vs QQQ (Just because Growth and Tech has such big market caps now, they over lap with SPY)  
Pick one: VPYD vs NOBL   
SDIV - Keep  


I would also add a

* World Ex-US index 
* Emerging Market
* US Mid/Small Cap
* Also against all your impulses: a Bond Fund so you have 5%-15% exposure to something other than Equity  


I like morningstar's fund reporting to guide on how well I'm allocated.   
https://www.morningstar.com/etfs/arcx/vti/portfolio",,
328,gzgjdgh,2021-05-26 00:55:28,t1_gzgjdgh,t3_nl3qq4,stocks,AVUV is king,,
329,gzgjfi9,2021-05-26 00:55:56,t1_gzgjfi9,t3_nkqj4f,stocks,"ya, it's ad's for all the cheap crap on their site that get bumped up to first page.",,
330,gzgjhk6,2021-05-26 00:56:25,t1_gzgjhk6,t1_gzge6fz,stocks,There are 450 million shares of AMC.  Think the governments and rich would let the almost bankrupt movie theater chain destroy all the worlds economy?,,
331,gzgjqhk,2021-05-26 00:58:30,t1_gzgjqhk,t3_nkx8pc,stocks,Yes. It’s not to late to join.,,
332,gzgjrvf,2021-05-26 00:58:49,t1_gzgjrvf,t1_gzghsvp,stocks,"Yeah, definitely possible they will stick by that line for some time. But I think in the medium term it will depend on whether inflation forces their hand. They'll sacrifice jobs for savings in a heartbeat if it comes down to it.",,
333,gzgjsc6,2021-05-26 00:58:55,t1_gzgjsc6,t1_gzgi5dz,stocks,"What people don't realize. GME is a value investment at this price, so even without a short squeeze.",,
334,gzgjtg3,2021-05-26 00:59:10,t1_gzgjtg3,t3_nknrag,stocks,Confirmation bias,,
335,gzgju9y,2021-05-26 00:59:22,t1_gzgju9y,t1_gzgjhk6,stocks,You’re right. But it just seems like sooo many people truly believe that it will so it had me questioning something so unimaginable,,
336,gzgjv69,2021-05-26 00:59:35,t1_gzgjv69,t1_gzfszra,stocks,"I would say it's all the sponsored products where they pay to get bumped up to top of the page. Amazon has become too shady for my liking if you wander outside the well known brand names.  The reviews are usually fake, only the 1 or 2 star reviews seem to be a better description for all the sponsored products.",,
337,gzgjwa3,2021-05-26 00:59:51,t1_gzgjwa3,t1_gzenmk2,stocks,Yea I think I might jump in with more JD tomorrow,,
338,gzgjxo6,2021-05-26 01:00:10,t1_gzgjxo6,t1_gzgizfn,stocks,"Thank you for the well thought out reply. I am recently up around 35% year to date and closed all of my positions besides Gee EM Eeee (my cost basis is 45$).

I have been looking at 10 year charts for Spy, Dow, Nasdaq, and it seems extremely unsustainable. However, I am in my first year of trading (good timing I suppose)

I think I may continue to sit out until there is a major pullback. Do you have a strategy?",,
339,gzgjy17,2021-05-26 01:00:15,t1_gzgjy17,t1_gzghpwm,stocks,"They see the MSM posts, but won't take time to understand the DD.",,
340,gzgjyuz,2021-05-26 01:00:27,t1_gzgjyuz,t3_nkx8pc,stocks,"100%. Most normal stocks are FUCKED after this is over. I was previously investing heavily in clean energy and lithium. Took the loss, liquidated everything, and hate-bought the fuck out of AMC. No regerts.",,
341,gzgjyv4,2021-05-26 01:00:27,t1_gzgjyv4,t3_nkx8pc,stocks,"Participate in the ASKE stock, need to make a meme, as I am the ASKE father....",,
342,gzgjz2e,2021-05-26 01:00:30,t1_gzgjz2e,t3_nkx8pc,stocks,"I did with GME and got off at the end of January. These types of swings and upturns are fun, but not great for long-term growth. I moved much of my profits into other holdings and will be seeing where my shares in PLTR, APPL, and JNJ will be in a few years.",,
343,,2021-05-26 01:00:25,t3_nl4nb1,,stocks,"If there are thoughts both PROS and CONs regarding this mega deal please feel free to comment. I want all the minds on Reddit to try and make some sense out of this....

When this deal was announced May 17th DISCA and T were on fire. Premarket I was watching shares catch fire and go above $43 on DISCA. Later on during the day, I did decide to start trading it as it fell to $34. In my opinion close to $34-35 is a fair value for the stock without a deal!

DISCA now has 15 + million subscribers for their 4.99 service. Expectations were for 8. We all know the streaming is the wave. As we see also with Netflix and Disney there is enough for them all provided we have rich content. In the most recent report DISCA beat on top line and said that the streaming business added 4 million subs in just the last 2 months. This business is alot more profitable. Current bottom line is about 2.79 for the year, next year is about 3.25 without factoring in the rapid streaming and more profitable side of the business. This yields a PE ratio of this year near 11 and next year under 10! Doesn't that sound cheap for a large company that will grow sales between 10-15%?

This is all before the Warner Media deal.... So in my mind DISCA is worth 34-35.... On it's own its executing and turning the business around.....so now with Adult Swim, Boomerang, Cartoon Network, CNN, TBS, TNT, TruTV, Turner Classic Movies, Turner Sports, HBO..... now its worth less?

I understand we won't be able to see the full details and synergies yet.... this deal may or may not even close! It will be at least 6 months out.... but in the mean time DISCA which has been delivering is getting crushed? This combines to be close to a 50 billion company...... Unfortunately, T paid over 85 billion, and there is still alot of debt. But please help me figure out how DISCA isnt worth at least 35..... 

Should we just can the deal and fight to stop the merger? Is that what the market is saying? That combining all that and maybe charging 14.99 for HBO and Discovery + and maybe having 100 million subscribers is not good?...... Do we see what it is doing for DISNEY? Just shaking my head here.

Thoughts? Thank you",nl4nb1,Discovery + Warner Media from ATT means the stock is worth less? What gives? DISCA was $43 Premarket 5/17/2021 and closed at $30.66?? What?
344,gzgk3z0,2021-05-26 01:01:38,t1_gzgk3z0,t1_gzfg763,stocks,My investments are worth about 10x what my cash holding is. Once you’re well into 5 or 6 figures it’s just not worth holding much cash.,,
345,gzgk5d7,2021-05-26 01:01:57,t1_gzgk5d7,t1_gzgfdwh,stocks,"What is your pt? Did you advertise it in your post

Based on this post, not sure what you're recommending? Presumably you're giving long signals?",,
346,gzgk5w2,2021-05-26 01:02:04,t1_gzgk5w2,t1_gzg7u3c,stocks,"Dude, please know I am not really trying to be a dick, and I sincerely hope you respond so I can get perspective in stocks, but what the fuck are you saying for real?

I have browsed superstonk a few times and it does not seem real.

Elaborate on 20 mil floor? So you're selling you're position at 1-10 mil? Do y'all think it's going to a mil per share?

Like I get a couple shares and I'm a millionaire?

I really don't get that fucking subreddit, are y'all serious?",,
347,gzgk6m1,2021-05-26 01:02:13,t1_gzgk6m1,t1_gzg3qlc,stocks,"Yeah it’s not free money lol, that comment alone tells me you have no idea wtf you’re doing. Probably heard about it at the dinner table and probably jumped in with an average in the high 300s. Don’t talk down to me to try and get me to pump the bags you’re holding bc if it wasn’t for people like me that put the work in last fall, none of this would have happened. I’ll leave you with some advice: it’s NEVER about “how much can I make with this play?” You always have to keep in mind “what’s the bear case? What’s the downside risk and can it bring me down?”",,
348,gzgk7ig,2021-05-26 01:02:26,t1_gzgk7ig,t3_nkx2kz,stocks,"b/c they're not worth that much, there's hesitancy from larger entities, there's more float than previously, the market has overall moved back towards blue chips from speculation, etc.",,
349,gzgk7m8,2021-05-26 01:02:27,t1_gzgk7m8,t1_gzgjwa3,stocks,Me too. Or Amazon. Kinda balls deep in China rn but the prospects are toooo good,,
350,gzgk9qp,2021-05-26 01:02:55,t1_gzgk9qp,t3_nkx8pc,stocks,Been in since January and never looked back. Life is about to change for everyone,,
351,gzgkaf4,2021-05-26 01:03:05,t1_gzgkaf4,t1_gzgiqgi,stocks,You’re a fool if you think retail investors aren’t selling. There’s so much money to be made swing trading GME,,
352,gzgkbps,2021-05-26 01:03:22,t1_gzgkbps,t1_gzfvipi,stocks,"Pandemic increased demand without enough staff to make up for it.

Just my guess",,
353,gzgkbrw,2021-05-26 01:03:23,t1_gzgkbrw,t1_gzgk5d7,stocks,Going long. That was also RIGHT before a market crashed. PT for my clients,,
354,,2021-05-26 01:03:38,t3_nl4pih,,stocks,"""Let your winners ride"", well no fucking shit!  If I knew they still had room to run, I wouldn't be selling them.  This is easy to see after the fact when you've had a huge run up but to say ""let your winners ride"" when you have no idea if a stock is going up, down or sideways irks me.",nl4pih,"Anyone else hate the phrase ""Let Your Winners Ride?"""
355,gzgkd8y,2021-05-26 01:03:42,t1_gzgkd8y,t1_gzgewbp,stocks,"It's also pretty useless commentary

""When it reverses it will be anazing"".",,
356,gzgkdcq,2021-05-26 01:03:44,t1_gzgkdcq,t3_nl4nb1,stocks,I believe Discovery shareholders only get like 29% of the new company.,,
357,gzgkffj,2021-05-26 01:04:12,t1_gzgkffj,t3_nkx8pc,stocks,Um yes,,
358,gzgkisk,2021-05-26 01:04:58,t1_gzgkisk,t1_gzgk7m8,stocks,I hope your right....,,
359,gzgkj7v,2021-05-26 01:05:04,t1_gzgkj7v,t1_gzg0ow5,stocks,The initial run up hit and took days and was then cut short by buy halts via RH. Stop talking.,,
360,gzgkltx,2021-05-26 01:05:41,t1_gzgkltx,t1_gzgkdcq,stocks,I believe so as well...but the deal is so far away ...even if we don't know how the deal will go down to crush disca this far in advance doesn't make sense to me,,
361,gzgkm09,2021-05-26 01:05:43,t1_gzgkm09,t1_gzg69ze,stocks,Or you can go back and look at the historical data that already confirms this has been happening.,,
362,gzgkm7y,2021-05-26 01:05:46,t1_gzgkm7y,t3_nkx8pc,stocks,"Yes, because I love the movies and I want to continue to enjoy the movie experience.",,
363,gzgknhk,2021-05-26 01:06:03,t1_gzgknhk,t1_gzg59ph,stocks,"Alot of stocks are down significantly from their peaks. The news has been pumping article after article that no crash is imminent and no need to fear one.... So yeah,,, Either the news media really cares about our money, or everything's about to get fkd. I personally have inversed the news (all in gme) and thank god I did. Already has changed my life, but nowhere near the level I truly believe it's going to. After MOASS I'll be able to help soooo many people it's going to be amazing! I'll be able to do even more amazing things with my life to help better humanity as a whole",,
364,gzgknoz,2021-05-26 01:06:06,t1_gzgknoz,t3_nl4pih,stocks,Would have had millions if i let the winners run. Learned to take profits partially and manage risk,,
365,gzgkod0,2021-05-26 01:06:15,t1_gzgkod0,t1_gzgi6r1,stocks,I will definitely do this in my free time..thank you,,
366,gzgkp2b,2021-05-26 01:06:24,t1_gzgkp2b,t3_nl4ary,stocks,"Live updates would be nice so I can play off your wins 😎😎

I will follow your posts if this becomes a thing",,
