,comment_id,created,fullname,parent_id,subreddit,text,post_id,title
524,gzgp05e,2021-05-26 01:42:54,t1_gzgp05e,t1_gzgovlg,stocks,My mistake. I’ll retract that statement. Still doesn’t change the fact that you don’t know what you’re talking about. Mention m&a as if it’s relevant.,,
525,gzgp56h,2021-05-26 01:44:05,t1_gzgp56h,t3_nkx8pc,stocks,"GME follows the inverse of the S&P. 

S&P looking to be on thin ice.

If it fails, chances are we're all Eft. 

If it succeeds, you get to be a millionaire. 

Buy GME, Hold GME.",,
526,gzgp5qt,2021-05-26 01:44:13,t1_gzgp5qt,t3_nkx8pc,stocks,Are there even any other 'options'? Hehe,,
527,gzgp6fl,2021-05-26 01:44:23,t1_gzgp6fl,t3_nknrag,stocks,"I don’t watch anything on YouTube, I find it’s often hype or talking technicals, both of those are useless to me. 

I read and research the hell out of them, and try to be emotionless about my decisions.

I’ve been burned any time I ignored fundamentals, deviated from my plan, and/or didn’t hold medium/long term. I’ve done well any time I’ve payed attention to fundamentals, stuck with my plan, and held medium/long term.",,
528,gzgp6sa,2021-05-26 01:44:28,t1_gzgp6sa,t3_nl26o9,stocks,"Healthcare stuff. People postponed so many trips to the doctor/surgeries because if Covid. I'd also throw in anything that makes you look better (makeup, clothing, etc...) as people increasingly go out without a mask (unless of course you're one of those QAnon freakos that believes the vaccine is really a tracking device).",,
529,gzgp75a,2021-05-26 01:44:34,t1_gzgp75a,t1_gzgopmh,stocks,"That's cute, you should take your own advice and stop talking about ""market power"" without providing proof of bullying business practices",,
530,gzgp81m,2021-05-26 01:44:47,t1_gzgp81m,t1_gzgl7an,stocks,What if they are hedging,,
531,gzgpbqh,2021-05-26 01:45:39,t1_gzgpbqh,t1_gzgewbp,stocks,"They are trading watches. You shouldn't just buy them. Wait til they have the proper break out. Grab a quick profit and get the hell out.

I have never bought any of this stuff because it doesn't fit my style. Sometimes I look over the charts to see what's going on. 

Except there were 2 sometime ago that I saw show up here. But I bought and sold about month earlier than he listed them.",,
532,gzgpd23,2021-05-26 01:45:59,t1_gzgpd23,t1_gzfl69v,stocks,It’s been 100% of my portfolio for a long time and all I’ve seen is serious gains. The MOASS is no joke and I firmly believe we will see some historically crazy stuff there.,,
533,gzgpdnd,2021-05-26 01:46:07,t1_gzgpdnd,t3_nknzhl,stocks,"I have plenty of shares from RSU grants and an Employee Stock Purchase plan. I’ve held tons since my companies IPO, but sold a bunch to pay off debts, buy a home and move to my mutual fund account over on vanguard. But I do continue to buy into the employee stock purchase plan, with %15 of my salary.",,
534,gzgphh6,2021-05-26 01:47:03,t1_gzgphh6,t1_gzgp75a,stocks,"Now you want proof? Rolf. You have Google. You can do it yourself. Or read the House Judiciary Subcommittee on Antitrust. It’s 450 pages of proof.

But that’s also a lot of reading for you..... and you barely understand single paragraphs.",,
535,gzgphyt,2021-05-26 01:47:10,t1_gzgphyt,t1_gzdwlcc,stocks,"Love the %15 discount. Find me another investment that returns %15 on your money every 6 months. 

Does your company cap how much you can put in? My company limits to %15 of your salary.",,
536,gzgpi9a,2021-05-26 01:47:13,t1_gzgpi9a,t1_gzgpd23,stocks,67 shares deep and still plan on buying over 200 price. I like the stock.,,
537,gzgpk9a,2021-05-26 01:47:42,t1_gzgpk9a,t1_gzgpbqh,stocks,lol ok,,
538,gzgplh7,2021-05-26 01:48:00,t1_gzgplh7,t3_nklllm,stocks,Didn't the last time GME/AMC run up it caused a huge red day in the market in January. Is that something to be worried about again? Or a dont call it a short squeeze situation?,,
539,gzgpm8w,2021-05-26 01:48:11,t1_gzgpm8w,t3_nkug7q,stocks,im late but this is very well written OP. great insights thanks,,
540,gzgpmfj,2021-05-26 01:48:14,t1_gzgpmfj,t1_gze3gr2,stocks,"ESPP is so nice, if you can afford to put money into it.",,
541,gzgpmop,2021-05-26 01:48:17,t1_gzgpmop,t3_nkx8pc,stocks,Is it a meme if you’re tripling your account value in a few months?,,
542,gzgpor6,2021-05-26 01:48:47,t1_gzgpor6,t1_gzgnhpy,stocks,"I didn't miss out on the January though, i was right there at wallstreebets and 10x my initial investment.

On top of that looks like nobody can debunk that the circumstances are just not even remotely close to what they were.

The once a lifetime happened in January.",,
543,gzgpqsz,2021-05-26 01:49:18,t1_gzgpqsz,t3_nkx8pc,stocks,"Bought GME 200 shares at 20 and sold at 35. Bought gme again 200 shares at 120, sold at 160. Bought AMC 1000 shares at 3, sold for 3.50.

Yeah kinda mad at myself for being a pussy. Could of made over 100k but oh well that’s how it goes lol",,
544,gzgpugr,2021-05-26 01:50:11,t1_gzgpugr,t1_gzgmb7b,stocks,"We have computers in our office, but he doesn't trade on them, Everytime I saw him posts portfolio in our group, it's a screenshot from his phone.
Like I said, there are phones and tablets way more expensive than a computer. 
I personally only use mine to play video games, so I don't doubt anyone who can do all of his business on a phone nowadays.

Whatever, you can keep living in your own cave, and kept thinking that people still acts like  20 years ago.",,
545,gzgpul5,2021-05-26 01:50:13,t1_gzgpul5,t1_gzekvlp,stocks,I didn't even know Amazon ran adds because of this lol,,
546,gzgq2rf,2021-05-26 01:52:07,t1_gzgq2rf,t1_gzf1ihr,stocks,"Agreed. Nobody knows what is going to happen in the market tomorrow, next month, or six weeks from now. Especially with the ongoing volatility we’re seeing in the markets these days. 

How much would you be ok with investing if the market was to drop 40-50% in the coming year?",,
547,gzgq8v3,2021-05-26 01:53:34,t1_gzgq8v3,t1_gzfe3oq,stocks,Where do I find the  historical PE? Its not very mobile friendly.,,
548,gzgq9sw,2021-05-26 01:53:48,t1_gzgq9sw,t1_gzgnwwg,stocks,"Oh wow, you actually think they’ll activate dividends? I’m skeptical. I think that’s a thing of the past. But I’m not trying to call it out and start a revolution. I think we really operate on market sentiment at this point I’m not gunna invest $10k for a $30 dividend. What do you think?",,
549,gzgqac7,2021-05-26 01:53:56,t1_gzgqac7,t3_nkx8pc,stocks,Hell yea! Up 45%!,,
550,gzgqbth,2021-05-26 01:54:17,t1_gzgqbth,t3_nl4pih,stocks,"This should have been part of your research when analysing an investment potential. You typically attempt to map out its financial results. I usually do annual revisions when the annual reports come out, but quarterly reports are also important because things can change suddenly. 

Phrases similar to this (out of context) are kind of bad obviously. It’s like how people say “cut your losses short”. It really only applies to things with context. In your case, if there was a specific investment they’re talking about, it likely means they believe the company has room to grow.",,
551,gzgqhda,2021-05-26 01:55:35,t1_gzgqhda,t3_nkx8pc,stocks,Bought some puts on the original GME deal. Made about 4 grand on that and about 7k on BB.,,
552,gzgqirg,2021-05-26 01:55:55,t1_gzgqirg,t3_nkx8pc,stocks,I lost about 9k on GME during the first hype cuz I have paper hands. Also bought a bunch of amc at 13. Still have the amc.,,
553,gzgqje2,2021-05-26 01:56:03,t1_gzgqje2,t1_gzgp75a,stocks,"That’s what I thought.

Bye 😘😘",,
554,gzgqnlf,2021-05-26 01:57:04,t1_gzgqnlf,t3_nkx8pc,stocks,ive held since the 40 range prior to the massive upcoming.,,
555,gzgqocw,2021-05-26 01:57:15,t1_gzgqocw,t1_gzgpugr,stocks,"I don’t really need to. My computer takes less than ten minutes to boot. 

I can actually view charts to scale. Do research. Y’know, make smart decisions. All without my magical pocket square. 

I should have looked at your post history before I even responded to you and I would have seen by your constant posts about GME and how you plan to sell your 5100 shares of AMC for $1000 that you’re just a complete fucking idiot.",,
556,gzgqqtm,2021-05-26 01:57:50,t1_gzgqqtm,t3_nkx8pc,stocks,Been in since early January but was watching it since December.  Now 99% in on GME.,,
557,gzgqrgx,2021-05-26 01:58:00,t1_gzgqrgx,t3_nkx8pc,stocks,97% GME but will diversify after the  🚀 but I’ve been holding since January and very much like RC and the stock,,
558,gzgqs4v,2021-05-26 01:58:09,t1_gzgqs4v,t3_nl4bja,stocks,"CNBC has a good lineup which is basically a replay of their shows: Squawk on the Street, Halftime Report, Fast Money and Mad Money. 

On the Tape with Danny Moses, Dan Nathan and Guy Addami 

Cannabis Investing Network 

This Week In Startups",,
559,gzgqssp,2021-05-26 01:58:18,t1_gzgqssp,t1_gzg5pxe,stocks,This is the way,,
560,gzgqtb3,2021-05-26 01:58:26,t1_gzgqtb3,t1_gzgpm8w,stocks,Thanks I have too much time on my hands,,
561,gzgqtpa,2021-05-26 01:58:32,t1_gzgqtpa,t1_gzgqrgx,stocks,Will buy in more bc I think long term they could be something,,
562,gzgqtsk,2021-05-26 01:58:33,t1_gzgqtsk,t3_nkx8pc,stocks,"Tuened 2k into 5k on GME.

Since i have taken short positions on reddit hype and its pkayed petty well. AMC kicking my ass right now, but I have plenty of time on my options.",,
563,gzgqty8,2021-05-26 01:58:35,t1_gzgqty8,t3_nkx8pc,stocks,"It had a tight flag breakout a few days ago so I bought in. Still holding, will likely sell half my position later this week.",,
564,gzgqwd6,2021-05-26 01:59:10,t1_gzgqwd6,t3_nkx8pc,stocks,"Bought inn 12 at 40 sold a 60, brought in another 12 at 70 sold at 320. Wish i got back in now",,
565,gzgqxs8,2021-05-26 01:59:30,t1_gzgqxs8,t1_gzgoycn,stocks,You think that Gamestop is farily valued above $200?,,
566,gzgqyc7,2021-05-26 01:59:39,t1_gzgqyc7,t1_gzfanla,stocks,Remind me! 19 days,,
567,gzgqysw,2021-05-26 01:59:46,t1_gzgqysw,t1_gzefefy,stocks,"Wrong... I am an amazon 3rd party seller, and I will bet my entire amazon buisness that it is very sustainable...",,
568,gzgr1od,2021-05-26 02:00:27,t1_gzgr1od,t3_nkx8pc,stocks,"What about all the new regulations from the SEC, DTC and DTCC? Why do you guys think they are being made now? Use the few wrinkles..",,
569,gzgr2te,2021-05-26 02:00:43,t1_gzgr2te,t3_nl0qad,stocks,"wait how is social sentiment of a company's stock important? i get it if its about sentiment of products, but like how does sentiment of a stock matter?",,
570,gzgr6vc,2021-05-26 02:01:41,t1_gzgr6vc,t1_gzg5pxe,stocks,"why not use SPY puts? SPXS calls are only worth it if you're making a short term play... like days.... maybe a week or two at most, otherwise you're just burning cash.",,
571,gzgr6x3,2021-05-26 02:01:42,t1_gzgr6x3,t3_nkx8pc,stocks,Yup...in at 17 out at 120,,
572,gzgr7zn,2021-05-26 02:01:57,t1_gzgr7zn,t1_gzgna2s,stocks,"That's exactly how I got in. 

""Well it's only a couple hundred bucks"" - which I'd of spend on something I didn't need, or whatever.

Now I'm 5 months into DD, AMA's, etc and am holding XX.",,
573,gzgr8gh,2021-05-26 02:02:04,t1_gzgr8gh,t1_gzgp81m,stocks,"I've heard this theory before as well. ""Oh well, they can just buy 800cs themselves and hedge"" Bruce said something like this...

Okay. Well who exactly is selling that 800c? Because guess what, they're now on the hook. 
The fact is, there's noone (okay maybe a few) who is a hodler selling ccs on gme. Significantly more of retail.are buying fds.
There's literally no way for them to hedge. There's no shares available. The only shares available are one they create out of thin air. Which again, only exponentially worsens the problem",,
574,gzgr9x6,2021-05-26 02:02:26,t1_gzgr9x6,t3_nkvtrm,stocks,"As someone who has done this strategy recently, there are lots of ups and downs. Sometimes you’re up a few thousand and others down a few thousand. 

If you need the money immediately and there’s been a market turn, it’s going to hurt selling when you have to. I just sold some money for a deposit in a home that fell through. What I sold was down, so I took a tax hit on it and didn’t get the house. Just be careful, the market is frothy.",,
575,gzgra42,2021-05-26 02:02:29,t1_gzgra42,t1_gzghwez,stocks,He doesn't HAVE a newsletter.  That's what he is saying.,,
576,gzgrba8,2021-05-26 02:02:45,t1_gzgrba8,t1_gzgosyi,stocks,Nope,,
577,gzgrc7x,2021-05-26 02:02:58,t1_gzgrc7x,t1_gzfpwtk,stocks,This is what I use Amazon for these days. You can't find some items anywhere else with such  fast shipping. I do wish Amazon has more sold by Amazon stuff but I think they would rather make money from FBA than managing the inventory themselves.,,
578,gzgrdoq,2021-05-26 02:03:19,t1_gzgrdoq,t1_gzglosa,stocks,Bro even Snoop Dogg can't get high enough to dream GME market cap being that inflated,,
579,gzgrft3,2021-05-26 02:03:49,t1_gzgrft3,t1_gzgqyc7,stocks,It’s going to go off on June 23,,
580,gzgrg3l,2021-05-26 02:03:53,t1_gzgrg3l,t1_gzgcsw5,stocks,You shouldn't anyway.  The more people who know something the less likely it is to be profitable. Play your cards close to the vest.,,
581,gzgrg67,2021-05-26 02:03:54,t1_gzgrg67,t1_gzgpor6,stocks,"January was a baby squeeze, the tutorial level shall we say. A real squeeze is market changing. 

This is infinitely larger than the VW squeeze was... feel free to watch from the sidelines everyone has to make their own decision.",,
582,gzgrgy8,2021-05-26 02:04:05,t1_gzgrgy8,t1_gzdsdbh,stocks,I’ll bring the chips,,
583,gzgripo,2021-05-26 02:04:31,t1_gzgripo,t1_gzgmrt2,stocks,Username checks out Kenny. Thanks for the boat btw!!,,
584,gzgrjfw,2021-05-26 02:04:42,t1_gzgrjfw,t1_gzgrdoq,stocks,Very fair! Maybe I'm living in a dream! But I'd rather live here than in a world with no hope:'),,
585,gzgrk6k,2021-05-26 02:04:52,t1_gzgrk6k,t3_nknzhl,stocks,"I do work for a publicly traded company.  I do not currently own shares.  With that said, when I first started trading, I was swing trading the company I work for.  It should be noted that I am not an insider and was just trading on trends.  I ended up bag holding my last trade for 6 months before finally getting out with a small profit and then I learned there were lots more stocks to play with.  I have rebought my company a couple of times and sold at small losses.

&#x200B;

We used to have a ESOPP program and it was the best thing ever.  You got to buy at the lowest price on Jan 1 or June 30 and then a 15% discount.  I put everything I could into this and made some real money and built my original trading account which has grown over the years.  In the end, the company cancelled the program because most of the participants were just in it to buy and then immediately sell.  They really want you to buy and hold rather than try to make a quick buck.",,
586,gzgrkb0,2021-05-26 02:04:54,t1_gzgrkb0,t1_gzgk5w2,stocks,Dont be mad at the poor fella from holding all the way back down to $28 **when** the bubble bursts,,
587,gzgrl8l,2021-05-26 02:05:07,t1_gzgrl8l,t1_gzglc93,stocks,"It’s in his Roth IRA, the gains are stuck there till retirement which he’ll be able to withdraw tax freep",,
588,gzgrmtg,2021-05-26 02:05:28,t1_gzgrmtg,t3_nklllm,stocks,"Anyone have thoughts on OLO? Positive or Negative. I’m bullish, just looking for some more opinions/thoughts. Cheers.",,
589,gzgrnd6,2021-05-26 02:05:36,t1_gzgrnd6,t1_gzggv0z,stocks,"Probably not.  I want to go to a gym where theres a pool, different equipment, weights, people to socialize with, etc.  These things that maybe you dont do?",,
590,gzgrohf,2021-05-26 02:05:52,t1_gzgrohf,t1_gzgra42,stocks,‘Twas a joke,,
591,gzgrott,2021-05-26 02:05:56,t1_gzgrott,t1_gzgrba8,stocks,"Struck a nerve? Aww, poor bagholder, why don't you try to short it again? I'm sure it'll have a different result next time!",,
592,gzgrpxc,2021-05-26 02:06:12,t1_gzgrpxc,t1_gzgphh6,stocks,"Ahh, that's why you sound so buzzwordy - you've been parroting the Verge article about the house report. The house report that claimed Apple had abusive levels of market power (fucking Apple, lmfao) while turning a completely blind eye to  ISPs like Comcast or Banks like any of them. 



Try thinking for yourself for once",,
593,,2021-05-26 02:05:55,t3_nl5tob,,stocks,"I have heard all the bear and bull cases and I can't comprehend people not lining up to invest in Tesla.

It is more obvious now than it ever was prior that this company is about to explode.

Demand is high. They sell every car they can produce. They are expanding their production capacity and will have two new factories coming online later this year.

They are improving margins with new technology/manufacturing processes and economies of scale.

They are improving revenue by producing and selling more cars every quarter.

Significantly increased revenue with higher margins equals explosive growth for the stock once the PE ratio adjust.

It's obvious. If you don't see it, I'm sure this thread and nothing will help you.",nl5tob,Teslas Explosive Growth
594,gzgrr2z,2021-05-26 02:06:28,t1_gzgrr2z,t3_nl4ary,stocks,Trader 6 FTW !,,
595,gzgrr3g,2021-05-26 02:06:28,t1_gzgrr3g,t1_gzgphyt,stocks,I think 15% is pretty standard.,,
596,gzgrr47,2021-05-26 02:06:29,t1_gzgrr47,t3_nl26o9,stocks,Semi Conductors,,
597,gzgruip,2021-05-26 02:07:17,t1_gzgruip,t1_gzepvp7,stocks,You can get fired for that at some companies,,
598,gzgrvdb,2021-05-26 02:07:30,t1_gzgrvdb,t3_nkx8pc,stocks,Saying it’s a meme stock is disregarding the obvious manipulation of our market; no it’s supporting and being complicit.,,
599,gzgrvrf,2021-05-26 02:07:35,t1_gzgrvrf,t1_gzgrr3g,stocks,"Good to know. First company I’m at that offers an ESPP, but I wasn’t sure if %15 cap was standard.",,
600,gzgrw91,2021-05-26 02:07:43,t1_gzgrw91,t1_gzgca6d,stocks,"Well thats not what I want.  Cycle doesnt cut it.  I want weights, pool, punching bag, other equipment to work core & back, etc.  If I just wanted to cardio, I can do that on my own.",,
601,gzgryhj,2021-05-26 02:08:15,t1_gzgryhj,t3_nl5tob,stocks,We don’t need help,,
602,gzgrzla,2021-05-26 02:08:31,t1_gzgrzla,t1_gzgqje2,stocks,"peace, keep trying and you might be able to critically think instead of regurgitate things others say.",,
603,gzgs3ag,2021-05-26 02:09:22,t1_gzgs3ag,t1_gzgqje2,stocks,sorry to have gotten you so worked up 😘😇,,
604,gzgs3wy,2021-05-26 02:09:31,t1_gzgs3wy,t1_gzfqeca,stocks,"You are the most I'll-tempered person in this thread. Also, this isn't Wall Street.",,
605,gzgs44m,2021-05-26 02:09:34,t1_gzgs44m,t3_nkx8pc,stocks,"Heavily into it since April, when I signed up for an account and cemented myself in the band wagon.

Slowly put more and more of my portfolio into GME, and so far so good..",,
606,gzgs9mp,2021-05-26 02:10:52,t1_gzgs9mp,t3_nl4pih,stocks,Technical analysis can help. Read Marty Zweig,,
607,gzgsbh6,2021-05-26 02:11:18,t1_gzgsbh6,t1_gzgfvyd,stocks,"With that attitude you will never maximize profits because u will never sell at the top. The herd is real I agree, its comprised of folks who are persuaded by social coercion and follow strategies like following what the crowd is doing, this group is easily round like cattle for for the slaughter. Yes be bullish, buy now, at the top, like I did, as you have so poignantly pointed out, but do it for the right reasons, not because you don’t see anyboty posting about it; or else you might find yourself at the slaughter house asking everyone what this place is only to realize that you followed the judas goat all the way from inception.",,
608,gzgsm2z,2021-05-26 02:13:49,t1_gzgsm2z,t1_gzfbu7q,stocks,"idk how people even use Pinterest, just that it plagues my google image search results. Often I'll find a picture using google images, then have to search again to find it not on Pinterest so I can actually look at the full size image or copy/paste it into a message to someone.",,
609,gzgsn4w,2021-05-26 02:14:04,t1_gzgsn4w,t3_nkx8pc,stocks,Made an absolute fortune (to me) inside of a week. Was in the middle of building a custom home and it wasn't worth going to work for. I want it again,,
610,gzgsnh1,2021-05-26 02:14:10,t1_gzgsnh1,t3_nkx8pc,stocks,"I was in before the first squeeze with only whatever cash was leftover in my brokerage account, a couple hundred bucks, I saw it go 400% basically in 2 days. Then I dumped around 50% in, then it crashed. I left it alone for a bit then saw the DFV doubled down and I liquidated the other 50% I had and went 100% GME. 

I have been averaging up/down ever since. I don’t have too much money but I am comfortable and happy with my investment. 25% up on the year with my 100% GME portfolio! Their balance book and the leadership team they are assembling has me very bullish on their future.",,
611,gzgsnyk,2021-05-26 02:14:17,t1_gzgsnyk,t1_gzgrpxc,stocks,"Buzz wordy. Bro it’s what I studied in school...

And that’s an exactly question which I’m glad you asked. I haven’t thought that far, that not my job. My only job is to point out the dangers of owning 1/3 of the internet. If you read Talebs book about anitfragility, this is prime example something we should want to be anitfragile, because 1 company owning 1/3 of the internet is something we shouldn’t want.",,
612,gzgso3v,2021-05-26 02:14:19,t1_gzgso3v,t3_nl4ary,stocks,I haven’t lost a trade in almost 4 years,,
613,gzgspv5,2021-05-26 02:14:44,t1_gzgspv5,t3_nl3qq4,stocks,Nope small caps are on the downtrend. Wait,,
614,gzgsqbw,2021-05-26 02:14:50,t1_gzgsqbw,t1_gzesi8u,stocks,Most people I know who buy a new tv buy a roku - doesn’t make the stock a good buy.  Just my Peter Lynch analysis lol,,
615,gzgsqch,2021-05-26 02:14:51,t1_gzgsqch,t1_gzgekv7,stocks,My Roku sucks ass. Replaced it with the Chromecast with Google TV.,,
616,gzgsr6s,2021-05-26 02:15:03,t1_gzgsr6s,t3_nl26o9,stocks,Itot,,
617,gzgsrk1,2021-05-26 02:15:09,t1_gzgsrk1,t1_gzgr6vc,stocks,They're cheap and I don't have to cover if it misses 🤷‍♂️,,
618,gzgss81,2021-05-26 02:15:18,t1_gzgss81,t3_nl5tob,stocks,"Once I realized that Tesla isn't profitable without bitcoin and without EV credits I lost a lot of the faith I had. I held from 200 pre-split and sold at 700 post-split. I see absolutely no reason to re-invest at these prices. Could you convince me that they haven't already priced in growth for the next several years? 

I was originally going to sell once it got to 400 after the split, but I waited a little longer. Then they announced their new battery tech 2 years out and the stock doubled again. Will there be another insane catalyst causing it to double again? Maybe, but will Tesla continue to outperform the market for the next couple years like it did for the last 2 years? I don't think so.",,
619,gzgstep,2021-05-26 02:15:35,t1_gzgstep,t3_nl5tob,stocks,"TSLA was the only real game in town... til lately.  VW, Ford and pretty much other major auto maker are making their entry.  

They very well may be behind TSLA in terms of FA (fully autonomous), but that doesn't really matter.  Right now people are looking for nice electric cars with good safety (e.g. collision avoidance) at a good price.

As these well know automakers eat away at TSLA they'll also be perfecting their own FA for years down the road when that becomes the norm.

TSLA has lots of legit competition now.  The narrative that ""TSLA will own the EV market"" simply is provably no longer true.  5, 10 years from now there'll still be roughly the same major automakers still competing for that ridiculously lucrative pie.",,
620,gzgsvc2,2021-05-26 02:16:03,t1_gzgsvc2,t1_gzf30ul,stocks,Car parts? Try rock auto. My brother is a mechanic and swears by it.,,
621,gzgsx2q,2021-05-26 02:16:29,t1_gzgsx2q,t1_gzgsbh6,stocks,"lol I run my own family office and manage other people's money, you don't know anything about me. don't like the gold call? move on.

I don't need your advice, it's likely I've traded the markets longer than you have.",,
