,comment_id,created,fullname,parent_id,subreddit,text,post_id,title
470,gyvud1c,2021-05-20 23:36:14,t1_gyvud1c,t1_gyvpo4m,stocks,Why TD versus say fidelity / vanguard / etc. Is it better to put actively managed funds in a Roth IRA instead of passive's ? I read that TD has great actively managed funds so that's why I asked,,
471,gyvudgg,2021-05-20 23:36:20,t1_gyvudgg,t1_gyv1h72,stocks,"Yes that thing really is an abomination 

Speaking of which I vaguely remember a newer “el Camino” that came out years ago that looked more like an uglier PT Crusier.  

My biggest gripe with the auto industry is that everyone always has to follow the trends, they’d never release a more classic look that actually looks good.  If they did I bet it would sell.",,
472,gyvuehp,2021-05-20 23:36:34,t1_gyvuehp,t1_gyphr99,stocks,Whenever i feel like my bank account is too heavy i just throw another 100 bucks at it.,,
473,gyvuffw,2021-05-20 23:36:47,t1_gyvuffw,t1_gyuxdro,stocks,Limit order for SEDG didn’t fill at $200 for me and so I partially entered in at $250. Sigh~,,
474,gyvufmp,2021-05-20 23:36:50,t1_gyvufmp,t3_nharj2,stocks,"This isn't some sort of new phenomena. There are good earnings cycles and bad ones. This has been going on forever. Market sentiment plays a huge role in the short term and it always has. 

In some cycles, earnings need to really impress to drive stocks higher. This is one of those cycles. Look at what TTWO has done the last two days, it's not like every stock is going down.",,
475,gyvugzv,2021-05-20 23:37:10,t1_gyvugzv,t3_nha7k8,stocks,"run the other way, seek professional help and never ask and come to reddit for financial/investing advice. if you do lurk assume it's 100% wrong.",,
476,gyvuho1,2021-05-20 23:37:21,t1_gyvuho1,t3_ngyrsj,stocks,"Stop loss just means when it hits that price your order becomes a market order, it doesn’t have to be executed at your stop price, and it never does during a crash. That’s why sometimes you want to do stop limit. But stop losses are mainly for traders. Not a good idea for holding.",,
477,gyvujdf,2021-05-20 23:37:46,t1_gyvujdf,t3_nha7k8,stocks,You're in the wrong sub. Go to r/investing. Or I can save you the time and say to buy VTI and never open your account again.,,
478,gyvujgw,2021-05-20 23:37:47,t1_gyvujgw,t1_gyvq93o,stocks,Biggest thing is Aetna. Other than that I like the minute clinic model they are building. To me WBA feels more like a retail focus and CVS feels more like a healthcare focus,,
479,gyvuksh,2021-05-20 23:38:06,t1_gyvuksh,t3_nh02hb,stocks,"Its probably a dividend trap. If you have DRIP turned on, maybe turn it off for a bit. Companies can leach value out to shareholders over several quarters before the wheels come off.",,
480,gyvul8v,2021-05-20 23:38:13,t1_gyvul8v,t1_gyvoyno,stocks,"I have a target date fund in my 401k thru my employer. I'm thinking of trying a different type of fund / funds. How are Fidelities zero funds, are they any good for Roth's",,
481,gyvulmf,2021-05-20 23:38:19,t1_gyvulmf,t1_gyuvvv9,stocks, EV is significant here because it's Ford. While never a huge percentage of my portfolio I held it for the divs and on the small chance they would move into the new century. The reason the stock declined for a long time/stagnated is that the company never showed a lot of innovation or initiative to broaden their scope or really move to address evolving challenges in manufacturing etc. This ultimately affects their earnings and standing against GM and others which isnwhy its never done fantastic. I feel this is more a show that management is willing to take the bull by the horns and try to break out of their shell a bit,,
482,gyvuln8,2021-05-20 23:38:19,t1_gyvuln8,t1_gyvsnm7,stocks,Yes. That’s why I bought $JETS. Didn’t want to invest in just one airline.,,
483,gyvum1v,2021-05-20 23:38:25,t1_gyvum1v,t3_nhbxm2,stocks,I don’t think we will get off our plastic high for a long while as well. But petroleum products have uses in other industries to.,,
484,gyvumnw,2021-05-20 23:38:34,t1_gyvumnw,t1_gyvou3w,stocks,I'd take graham's or buffets investment advice over some dude on reddit.,,
485,gyvun6h,2021-05-20 23:38:41,t1_gyvun6h,t1_gyvkg6r,stocks,5-6%,,
486,gyvuntc,2021-05-20 23:38:50,t1_gyvuntc,t1_gyvsf37,stocks,"Haha amen! That’s the hardest part about buying above the initial cost. But like I said in another comment, once you get over that it is so worth it. Even my last purchase buying around $165 feels extremely worthwhile now",,
487,gyvuqqe,2021-05-20 23:39:31,t1_gyvuqqe,t1_gyvo466,stocks,"My sister, in Madison, WI cannot drive her EV from there to our parents about 30 mins north of Green Bay without a layover. 

Most of the time, you don't need range, but when you do, you do. She is about as eco as they come, and sees the required stop as a fair trade. But for a lot of potential EV buyers, that makes ""range anxiety"" a thing, even if it's a capability used only once in a blue moon.",,
488,gyvus29,2021-05-20 23:39:49,t1_gyvus29,t1_gyv8gu6,stocks,Would have gotten a decent amount of dividends too,,
489,gyvuth5,2021-05-20 23:40:09,t1_gyvuth5,t3_nh6bxq,stocks,"After Biden gave a shoutout to Talib when he was suppose to be there talking about business. I immediately dumped all my Ford Shares.

Politics has no place in business.",,
490,gyvutjk,2021-05-20 23:40:10,t1_gyvutjk,t1_gyvoob2,stocks,">Can someone more knowledgable than me help me understand please, I'm really confused.

No one can help you because they don't know anymore than you do about why the stock market does what it does. All they can do is speculate.",,
491,gyvuu5w,2021-05-20 23:40:19,t1_gyvuu5w,t3_ngvmrw,stocks,Just starting to get involved in trading and want to get some green/sustainability stocks to hold onto for many years to come. Anyone got any tips/advice for me to look into?,,
492,gyvuuly,2021-05-20 23:40:25,t1_gyvuuly,t1_gyvlstg,stocks,Many claim WA is out of touch with reality.,,
493,gyvuuyh,2021-05-20 23:40:30,t1_gyvuuyh,t1_gyvun6h,stocks,I'm confused. Why wouldn't you just put the money in an index fund? If I were paying someone I would expect a larger return right?,,
494,gyvuv7v,2021-05-20 23:40:34,t1_gyvuv7v,t1_gyvtf4u,stocks,Any specific type of funds thru fidelity I should stay away from or look for to put inside a Roth IRA. Mutual vs ETF vs index.,,
495,gyvuxjj,2021-05-20 23:41:08,t1_gyvuxjj,t3_nhd7yz,stocks,On etrade you could only do this example with 2 shares. It won't even let you set up the second limit sell,,
496,gyvv4t2,2021-05-20 23:42:54,t1_gyvv4t2,t3_nhdnpl,stocks,I think my choice of broker will be based on what type of fund is best to put inside a Roth IRA.,,
497,gyvv99l,2021-05-20 23:43:58,t1_gyvv99l,t1_gyvuu5w,stocks,"I just started too and what I’ve seen/bought in the solar area is Enphase, first solar, next area energy and a few other renewable energy companies. I don’t own but have my eyes on solaredge and a few others. There’s a lot out there but they are all long holds. I’m trying to get more into wind since I have a good amount of solar.",,
498,gyvv9v5,2021-05-20 23:44:07,t1_gyvv9v5,t1_gyuzo66,stocks,"> 2% of reddit users were over 40

Wow.. I'm old.",,
499,gyvvagr,2021-05-20 23:44:16,t1_gyvvagr,t1_gyvlx61,stocks,They've already said they're going to reinstate their dividend asap so it may even be Q3.,,
500,gyvvcpc,2021-05-20 23:44:47,t1_gyvvcpc,t1_gyvaekd,stocks,Does a job posting demanding 10+ years experience on a application that has only been out a year or two prevent you from applying???,,
501,gyvvcs3,2021-05-20 23:44:49,t1_gyvvcs3,t1_gyvbusj,stocks,👍,,
502,gyvvg9a,2021-05-20 23:45:39,t1_gyvvg9a,t1_gyvun6h,stocks,Is that after fees?,,
503,gyvvh78,2021-05-20 23:45:53,t1_gyvvh78,t1_gyvowqi,stocks,"It’s not so much improvement as it is unlocking gated functionality. You’ll hear about it when there are hurricanes etc and Tesla will unlock extended range temporarily for everyone

https://www.theverge.com/2017/9/10/16283330/tesla-hurricane-irma-update-florida-extend-range-model-s-x-60-60d",,
504,gyvvj4t,2021-05-20 23:46:22,t1_gyvvj4t,t1_gyvq95s,stocks,I was figuring roughly every 7 at 10% yearly,,
505,gyvvk63,2021-05-20 23:46:36,t1_gyvvk63,t1_gyvi9lp,stocks,They’re all a bunch of hypocrites!,,
506,gyvvkqh,2021-05-20 23:46:44,t1_gyvvkqh,t1_gyvuv7v,stocks,"I have a ROTH IRA with Fidelity. Since I already had a regular IRA with them, the Roth took about 3 minutes to open.  
I did not know this until after I opened my Roth, but Fidelity let's you buy individual stocks, if you want.",,
507,gyvvl0l,2021-05-20 23:46:49,t1_gyvvl0l,t3_nh6bxq,stocks,Then need to add a custom fleshlight for the driver's seat,,
508,gyvvl2p,2021-05-20 23:46:50,t1_gyvvl2p,t3_nh6bxq,stocks,"Lightning sales will kill. It looks great compared to elon's beast. If they make an EV Ranger in quad cab I'm buying one. 
Ford will hit this one out of the park.",,
509,gyvvmqx,2021-05-20 23:47:13,t1_gyvvmqx,t3_nhdnpl,stocks,I use M1 Finance. Love the pie structure of the portfolio. Set it and forget it type of account,,
510,gyvvr2k,2021-05-20 23:48:16,t1_gyvvr2k,t3_nhe5c0,stocks,Ideanomics,,
511,gyvvsc2,2021-05-20 23:48:34,t1_gyvvsc2,t1_gyvv99l,stocks,"Thanks mate, definitely going to look into these!",,
512,gyvvttz,2021-05-20 23:48:54,t1_gyvvttz,t3_nhe5c0,stocks,Let this game never stop.,,
513,gyvvud5,2021-05-20 23:49:02,t1_gyvvud5,t3_nheod2,stocks,"Solar, wind, hydro are the dirtiest ""green energy"" that exist. The amount of carbon burned to extract them from the earth, and their efficiency defeats the purpose. 

Nuclear ETF/Tesla is the way.",,
514,gyvvvro,2021-05-20 23:49:22,t1_gyvvvro,t3_nh92l2,stocks,"Pretty much just gonna learn that index funding worked out the best. It's never easy to pick the next big stock, and even when you do, you most likely sell out too early because you think its the best its going to get. 

I can look back on a lot of big companies that no one would imagine where they are these days back then.",,
515,gyvvw0i,2021-05-20 23:49:25,t1_gyvvw0i,t1_gyuyu57,stocks,So you're telling me that I'm the old fucker here?,,
516,gyvvy7y,2021-05-20 23:49:56,t1_gyvvy7y,t1_gyvvh78,stocks,"Wow, even worse than I expected, buying more puts",,
517,gyvvyhl,2021-05-20 23:50:00,t1_gyvvyhl,t3_nhbxm2,stocks,"Unless we stop using plastic we're gonna need oil. Ford will come out with a bamboo electric car, time to sell oil",,
518,gyvw05d,2021-05-20 23:50:24,t1_gyvw05d,t1_gyvvmqx,stocks,"M1 is another option I keep hearing, I may need to see this pie structure everyone keeps boasting",,
519,gyvw0ur,2021-05-20 23:50:34,t1_gyvw0ur,t1_gyvvg9a,stocks,Yes.  I use two different companies.  They both advertise 8-12%,,
520,gyvw2cq,2021-05-20 23:50:56,t1_gyvw2cq,t3_nh6bxq,stocks,So i have a friend that works as a service advisor for a major ford dealership. He said it the worst cars he ever seen. So many recalls so many problems. Engine after 70k miles is common. I cant imagine the problems theyre gonna have with electric.,,
521,gyvw4cs,2021-05-20 23:51:24,t1_gyvw4cs,t3_nhbg63,stocks,This is a cool place..,,
522,gyvw4ec,2021-05-20 23:51:24,t1_gyvw4ec,t3_ngt4js,stocks,lets do it man,,
523,gyvw4nx,2021-05-20 23:51:28,t1_gyvw4nx,t1_gyvvg9a,stocks,"And im not retirement age, so I am typically paying taxes as well.",,
524,gyvw54e,2021-05-20 23:51:35,t1_gyvw54e,t1_gyvoyno,stocks,IMO target dates suck because of their high bond allocation. Much better to just do the fidelity S&P 500 fund and then move some into bonds when you are 50,,
525,gyvw9tu,2021-05-20 23:52:42,t1_gyvw9tu,t1_gyvu74o,stocks,"Bad advice if I wanted to sell him expensive stock, yes",,
526,gyvwaqb,2021-05-20 23:52:55,t1_gyvwaqb,t1_gyvw05d,stocks,"It’s great. Set individual stocks/ETFs to your desired allocation percentage and when you deposit money, it buys based on getting each slice of the pie to your target percentage. If that makes sense.",,
527,gyvwbik,2021-05-20 23:53:06,t1_gyvwbik,t1_gyvsh41,stocks,"Would RECAF have been able to reach its extreme overvaluation level by now if Oilprice.com had not repeatedly pumped it as the next great basin? You will see at the bottom of these articles that Oilprice.com owns shares and will not disclose when they will sell them. Pumping and the dumping shares. If you have seen any excited articles on any website there is a good chance you will see that disclaimer at the bottom. Invictus Energy is also exploring fresh territory in Zimbabwe, but has a 16x lower market cap.",,
528,gyvwbje,2021-05-20 23:53:07,t1_gyvwbje,t1_gyvvud5,stocks,Tesla is somewhat solar too dude. A little contradictory there,,
529,gyvwc9g,2021-05-20 23:53:17,t1_gyvwc9g,t3_nhcy0p,stocks,"I disagree a little with Sid. In a toppy market where we are now... Calls can be a nice bridge to get over rough water.

Example... A high growth, high PE stock like DraftKings... Been down 25% recently, in a slow rev quarter... It will trend up as NFL football kicks up... So buying say October calls is a pretty good bet. 

Definitely start slow and anticipate losing %50 with your first few trades. It can be a wild ride. Options swing heavily. Good luck.",,
530,gyvwcg8,2021-05-20 23:53:20,t1_gyvwcg8,t1_gyvq2c9,stocks,FYI- High margin= profitable,,
531,gyvweh4,2021-05-20 23:53:50,t1_gyvweh4,t3_nh6bxq,stocks,I’m buying a Ford bronco but definitely no EV vehicles.,,
532,gyvwh5l,2021-05-20 23:54:29,t1_gyvwh5l,t3_nfnyup,stocks,So long term thoughts ? Wife said toss in 3k lol. What price should I be looking for ? 15-17$?,,
533,gyvwhpb,2021-05-20 23:54:37,t1_gyvwhpb,t1_gyvl6it,stocks,Historical statistics tell us otherwise. You actually only have about a 10% to outperform.,,
534,gyvwi46,2021-05-20 23:54:43,t1_gyvwi46,t1_gyvwaqb,stocks,That's wicked convenient. Every broker should have that feature.,,
535,gyvwibp,2021-05-20 23:54:46,t1_gyvwibp,t1_gyvuu5w,stocks,VTI or VXUS,,
536,gyvwii7,2021-05-20 23:54:48,t1_gyvwii7,t1_gyvvcpc,stocks,"No, but it wouldn’t make sense to post the job where the average viewer hasn’t been in the work force for 10+ years",,
537,gyvwjms,2021-05-20 23:55:04,t1_gyvwjms,t1_gyvuv7v,stocks,"Yes, Fidelity. Mutual funds charge fees. That’s dumb. Go with indexes. And yes, Fidelity will let you buy individual stocks. Also options, but don’t ask me how I know. I don’t like to talk about it.",,
538,gyvwk03,2021-05-20 23:55:10,t1_gyvwk03,t1_gyv96yv,stocks,Glad I could help just remember the smaller cap ones can move a lot faster but if you consistently add over time you will get a good average and one day you’ll be happy you did !!,,
539,gyvwl5p,2021-05-20 23:55:26,t1_gyvwl5p,t3_nheod2,stocks,"Iberdrola - they are behind COP 26, have oil companies asking for help to become greener and are investing over $100bn in green power to help Europe meet net zero carbon. They have a great balance sheet also",,
540,gyvwla5,2021-05-20 23:55:29,t1_gyvwla5,t3_nh5i9p,stocks,CoreCivic 👀,,
541,gyvwqrh,2021-05-20 23:56:51,t1_gyvwqrh,t3_nh6bxq,stocks,"I like the strategies of (1) using existing truck platforms and parts to save money and lower the cost of manufacturing, and (2) targeting business and fleet customers. Both make a lot of sense.",,
542,gyvwt0a,2021-05-20 23:57:24,t1_gyvwt0a,t1_gyvwbik,stocks,I've never read the publications you are referring to. I avoid hype propaganda. The price is aligned with a rough valuation of 850/acre of proven acreage based on its stage of exploration. As the news provides more positive results it moves in that direction...,,
543,gyvwtea,2021-05-20 23:57:30,t1_gyvwtea,t1_gyvuuly,stocks,Facts.,,
544,gyvwua5,2021-05-20 23:57:43,t1_gyvwua5,t1_gy2yg1v,stocks,Yo sorry just got back. What about that timeline?,,
545,gyvwuhq,2021-05-20 23:57:46,t1_gyvwuhq,t1_gyvwbje,stocks,"Solar has less red tape, currently. Disrupting the perto-dollar/world order ain't easy.",,
546,gyvwvfl,2021-05-20 23:57:59,t1_gyvwvfl,t3_nh7ld4,stocks,Tencent,,
547,gyvwycf,2021-05-20 23:58:39,t1_gyvwycf,t1_gyvtz9i,stocks,You could have bought literally anything at the same time and made a lot on the same time frame.  Berkshire Hathaway was in the 170s.,,
548,gyvx3cf,2021-05-20 23:59:49,t1_gyvx3cf,t1_gyvvkqh,stocks,Do you have to open a brokerage account seperate to the Roth IRA to buy individual stocks or can you buy them inside your Roth account,,
549,gyvx57a,2021-05-21 00:00:15,t1_gyvx57a,t1_gyvud1c,stocks,"I personally had a financial advisor who recommended American funds. After 3 years, I grew tired of telling him how I felt for him to say “I leave it up to the professionals”. I transferred my 62K to TD, immediately sold all shares and have since invested a lot more but when I do the math if I stayed with the fund I’ve made up about 5 years of investing atm. There are a lot of others that can answer your direct questions better. Good vibes to you though, your on your way",,
550,gyvx7ph,2021-05-21 00:00:51,t1_gyvx7ph,t3_nheod2,stocks,"I would look into Xebec, Greenlane renewables, Cielo Waste Solutions and Pyrogenesis. Canada has some of the best green/clean tech stocks out there. There are a few more but I can't think of them right now.",,
551,gyvx93z,2021-05-21 00:01:11,t1_gyvx93z,t1_gyvw54e,stocks,Yeah I hear target date is too conservative so it's better to do something like this ^,,
552,gyvx9j2,2021-05-21 00:01:17,t1_gyvx9j2,t1_gyuvvv9,stocks,"Agree! Also, EV companies like Tesla and NIO have different sales channels. Ford and traditional car companies have vast dealership network to support. Without that 3000 mile oil change scam, many dealerships can’t survive😂. If they can’t lure you to the dealership every few months, how are they going to sell you that $125 cabin filter?",,
553,gyvxbcd,2021-05-21 00:01:42,t1_gyvxbcd,t1_gyvwuhq,stocks,"I work for THE utility company that serves LA
City. We’re going all green 100%. Deadline 2035 per mayor Garcetti request.",,
554,gyvxboo,2021-05-21 00:01:47,t1_gyvxboo,t1_gyv6mn4,stocks,"20 years on Ford. Back when I was just starting out, I was thinking big. I bought into the local electric company and Ford, because I was sure that Electric Vehicles were going to be huge, and make me money. Welp. My Ford stock is still under water and I keep it as a reminder. Yes, there is such a thing as being too far ahead of the game. I've also learned to sell the cycles with 'cyclical stocks' such as automotive and oil. They go up 100%, then eventually go back down 50% (to the same price where you bought in) then they go back up. Holding long-term can get you absolutely nothing over the long term. And there is no reason you need to sell 100% of your shares in any company. Not a bad idea to keep some shares, maybe 5-25%. I sold out of AAPL, AMZN, PCLN etc. back when they were almost penny stocks. Sure, I sold out of some companies before they went bankrupt, but you can only lose 100% of your position. The maximum you can gain is technically infinity, but for the stocks mentioned, we'll say 10,000+%. And you can always write off your losses on your taxes, which means you lower your tax bill (or another way to look at it: too didn't truly lose 100% on that bankrupt company, because it allows you to write a smaller check to the government)",,
555,gyvxcj8,2021-05-21 00:01:58,t1_gyvxcj8,t1_gyvv9v5,stocks,I'm right there with you.,,
556,gyvxe12,2021-05-21 00:02:19,t1_gyvxe12,t1_gyvuv7v,stocks,"The other answers sounds legit. Just to add, I have 2 accounts in Fidelity. You can create as many accounts as you want for free. I suggest you create 1 ROTH IRA account where you can contribute 6k maximum per year. Secondly, 1 normal brokerage account where you can trade freely with no limits. 
They have customer service 24/7 so you can call anytime if you have questions. Also, you can choose a debit card and use your account as you would a bank. You can sign up for direct deposits and sign up for checks if you want. In 2021, there is no need for old Banks.",,
557,gyvxg8a,2021-05-21 00:02:50,t1_gyvxg8a,t3_nheod2,stocks,BEPC,,
558,gyvxi4j,2021-05-21 00:03:18,t1_gyvxi4j,t1_gyuilv1,stocks,I was always partial to the Chevy S-10.  Everyone doesn't need all that extra size.,,
559,gyvxj9g,2021-05-21 00:03:35,t1_gyvxj9g,t1_gyvowqi,stocks,Whats the max horizon on puts? 2023?,,
560,gyvxja6,2021-05-21 00:03:35,t1_gyvxja6,t1_gyvx57a,stocks,"Yeah I think american funds sucks, I just put the minimum in for my employers match. I'll use another broker for any different accounts.",,
561,gyvxl6e,2021-05-21 00:04:01,t1_gyvxl6e,t1_gyv84jj,stocks,+1. Same thing (w/o the pressure washing).  I can’t wait to have a fleet of electric vehicles so I can get rid of the huge gas tank outside that we’re currently paying to fill weekly. 😐. Now the only barrier is coming up with the $$$ to swap our fleet.,,
562,gyvxphv,2021-05-21 00:05:01,t1_gyvxphv,t3_nh6bxq,stocks,"This may be a minority view in this thread, but Ford is a poorly run company relative to other auto companies. I no longer own the shares, but buying them in the first place was a costly mistake. GM is a well run company on the other hand and has great assets that position them for the future (Cruze).",,
563,gyvxpvn,2021-05-21 00:05:07,t1_gyvxpvn,t1_gyuszvj,stocks,50 bucks says the ford EVs break down at record pace,,
564,gyvxtnx,2021-05-21 00:05:59,t1_gyvxtnx,t1_gyvpr4i,stocks,Funky *TOWN*,,
565,gyvxugn,2021-05-21 00:06:10,t1_gyvxugn,t1_gyvshir,stocks,+- price prediction? Do you have any good entry point?,,
566,gyvxuil,2021-05-21 00:06:11,t1_gyvxuil,t1_gyur0hc,stocks,"Thanks Obama, literally in this case",,
567,gyvxxf3,2021-05-21 00:06:52,t1_gyvxxf3,t1_gyvxi4j,stocks,"That's why I liked it. Easy to park/maneuver, blind spots were limited, could move something if I needed to or help a friend. Didn't have to worry about a bunch of people packing in so I wasn't annoyed and could listen to what music I wanted, and still was a proud owner of a truck!",,
568,gyvxxns,2021-05-21 00:06:56,t1_gyvxxns,t1_gyvmlhy,stocks,"There just isn't much profit margin in sedans or small cars which is why there are so few sold anymore. SUVs, trucks and crossovers have been the big vehicle sales and higher margin for the manufacturers. Maybe electric sedans have a future, but ICE sedans are harder to find.",,
569,gyvxy24,2021-05-21 00:07:02,t1_gyvxy24,t1_gyvk63q,stocks,"You schedule 30 minutes to stop, stretch your legs, grab a bite to eat, take a shit. Whatever. 

Paying for and carrying around 400 miles worth of extra battery all the time is just inefficient and pointless.",,
570,gyvxyvb,2021-05-21 00:07:13,t1_gyvxyvb,t1_gytfp73,stocks,I get how a stop limit order can protect you from a flash crash but if you were to set it up as such then wouldn't there be a high chance that in the end your sell wouldn't go through if you wanted it to?,,
571,gyvy08o,2021-05-21 00:07:32,t1_gyvy08o,t3_nhdnpl,stocks,Fidelity,,
572,gyvy3f2,2021-05-21 00:08:16,t1_gyvy3f2,t1_gyvx3cf,stocks,You can buy them inside the Roth,,
573,gyvy8po,2021-05-21 00:09:28,t1_gyvy8po,t3_nh6bxq,stocks,I hate Ford,,
574,gyvyaeo,2021-05-21 00:09:51,t1_gyvyaeo,t1_gyvpa55,stocks,Exactly. Ford is not a well run company.,,
575,gyvykou,2021-05-21 00:12:17,t1_gyvykou,t1_gyv24vn,stocks,That synth hook is gonna be stuck in my head for days now,,
576,gyvylda,2021-05-21 00:12:27,t1_gyvylda,t1_gyvwjms,stocks,What about stocks with dividends to reinvest vs stocks that don't. Are they worth the fee or not in most cases,,
577,gyvynds,2021-05-21 00:12:57,t1_gyvynds,t1_gyv891o,stocks,It would take decades for incomes to catch up to the current prices.,,
578,gyvyosz,2021-05-21 00:13:18,t1_gyvyosz,t3_nh6bxq,stocks,"Ford products and therefore its stock, suck. 

Found
On
Road
Dead",,
579,gyvyowc,2021-05-21 00:13:19,t1_gyvyowc,t3_nh7ld4,stocks,"I know nothing about stock market . I invest 70% of my savings in VTI, VUG, VOO",,
580,gyvyqiq,2021-05-21 00:13:43,t1_gyvyqiq,t1_gyvw9tu,stocks,"For clarification: instead of buying AAPL rn at 130, wait until it falls back down to 115 or 100. Be patient. Even good stocks can be bad deals depending on the price",,
581,gyvyswb,2021-05-21 00:14:19,t1_gyvyswb,t1_gyvuqqe,stocks,"So it would be these kind of mid range trips where its a problem then.

My uncle used to drive us to Canada(from nyc) and we would stop every couple of hours; so I was thinking even with the occasional road trip you already stop enough to charge up.

Thanks that makes more sense.",,
582,gyvytxt,2021-05-21 00:14:34,t1_gyvytxt,t1_gytvgel,stocks,"It did by a lot, so you're saying it's a guarantee that it'll hit ATH very soon?",,
583,gyvyui4,2021-05-21 00:14:43,t1_gyvyui4,t3_nhdnpl,stocks,I love Vanguard x 5 years for this. No complaints.,,
584,gyvyys9,2021-05-21 00:15:45,t1_gyvyys9,t3_ngwml0,stocks,gme or amc because the squeeze will be squoze after i  defrost,,
585,gyvz332,2021-05-21 00:16:47,t1_gyvz332,t3_nh6bxq,stocks,They need to restart the dividend payments,,
586,gyvz4mk,2021-05-21 00:17:08,t1_gyvz4mk,t1_gyvtx7c,stocks,"they shouldve listed during or before the pandemic, missed opportunity.",,
587,gyvz5p3,2021-05-21 00:17:22,t1_gyvz5p3,t1_gyupzpf,stocks,"Ford and the other automakers **have** to cannibalize their profitable ICE vehicles, otherwise their competitors will eventually do it for them.

Switching to EV's will have a lot of upfront costs and R&D costs that will take years to pay for themselves.",,
