,comment_id,created,fullname,parent_id,subreddit,text,post_id,title
0,gzg7cdf,2021-05-25 23:14:09,t1_gzg7cdf,t3_nkx8pc,stocks,Bought 10 AMC in Feb just bc I heard it being the new GME and I didn't wanna shell out 400 bones for 1 GME and now I'm up a couple bucks on AMC. I ain't even mad,,
1,gzg7cw3,2021-05-25 23:14:17,t1_gzg7cw3,t1_gzfkb5q,stocks,"your ability to wait for 'life changing money' might contradict another retailer's ""life-saving money now"", where people will realize their gains now by selling.",,
2,gzg7h14,2021-05-25 23:15:15,t1_gzg7h14,t3_nl1d02,stocks,"NVIDIA long term is a strong play. You have earnings, stock split and ARM acquisition as three question marks with the ARM acquisition being the biggest in my opinion. If the ARM acquisition falls through it will cause a correction, whereas if it goes through I could see the stock pushing $800.",,
3,gzg7hz2,2021-05-25 23:15:28,t1_gzg7hz2,t3_nkx8pc,stocks,"Bought GME in January. Averaged down when it was around 40. Started reading the DD's and listening to the AMAs by industry experts, seeing Ryan Cohen make positive moves and realized that its a great opportunity. Began averaging up to accumulate more shares. Hit my share goal but will probably continue to buy because this is a once in a lifetime short squeeze and may even help end the financial terrorism of naked short selling that is destroying entrepreneurship. Even if you don't trade it's in everyone's best interest to buy and hold, in my humble opinion.",,
4,gzg7lzz,2021-05-25 23:16:23,t1_gzg7lzz,t1_gz143ix,stocks,Closed red today,,
5,gzg7m4c,2021-05-25 23:16:25,t1_gzg7m4c,t1_gzey48g,stocks,"I think margin has a place and shouldn't be as scary as people make it out to be. The problem is it's a form of leverage and with that carries risk, and people combine multiple forms of risk to screw themselves over. It's like a power tool. Treat it with respect it makes your life nicer, and if you don't things will go badly quickly. 

A little margin on a support level on a blue chip, with plans to rebalance/deleverage if things don't go as planned? Can be very lucrative and still relatively safe. Buying speculatives and meme stocks a 100% leverage at whatever price because surely it will go up, with no exit plan? Yeah you're going to get fucked.",,
6,gzg7paq,2021-05-25 23:17:10,t1_gzg7paq,t3_nkx8pc,stocks,I more than quadrupled my portfolio on GME in January/February and cashed out. Recently got back in with a significantly smaller portion of my portfolio just to see what this thing does,,
7,,2021-05-23 20:52:40,t3_njgyv3,,stocks,Recently I bought more shares of a company called CPSL I had originally been holding 100k shares that I bought in 2018 but I purchased another 61k in March 2021 I’m just curious if I sell will my full portfolio be taxed long term or short term or will they split it up?,njgyv3,If I hold a stock long term and keep adding to it does it get taxed long term or short term when I sell it?
8,gzg7u3c,2021-05-25 23:18:17,t1_gzg7u3c,t1_gzg69fv,stocks,"Real talk (I'm a nonentity in superstonk so it doesn't really matter) but we're suddenly going for a 20 mill floor subreddit-wise and I'm probably going to sell somewhere between a floor of 1 mill and 10 mill, if this actually happens.

We are literally a cult, but our exceptional members produce amazing DD (as far as I can tell, my degree is in engineering, not economics). And I personally believe what they say! If you are uncertain, you might look up House of Cards part 1 to see what the largest shorter, citadel, might be planning and download the stonk-o-tracker (I know, right? :P) app to see how much GME is shorted day to day. 

The creator posted it on superstonk and I'm sure if you asked him, he would give you the bare ones explanation of the app he created (just search stonk-o- cause I'm not sure if it's tracker or meter)

Edit: website, not an app",,
9,gzg7vlo,2021-05-25 23:18:38,t1_gzg7vlo,t1_gzg6ldz,stocks,"No. Don’t do that. Seriously tell me how and where you lost money on stocks recently. 

Because I’m truly at a loss",,
10,gzg7vrx,2021-05-25 23:18:40,t1_gzg7vrx,t3_nl26o9,stocks,SPACE TOURISm! I think many EV makers are launching their new ev cars so I expect the ev sector to get hot again and HD map service sector!,,
11,gzg7x8o,2021-05-25 23:19:01,t1_gzg7x8o,t1_gzfot7n,stocks,"you bought NEM when everyone was talking about it, you chased. 

it's all on the price.",,
12,gzg7yb9,2021-05-25 23:19:15,t1_gzg7yb9,t3_nkx8pc,stocks,"Yes, but not at YOLO levels. I've never had more than 3 shares of GME or 10 shares of AMC at a time.",,
13,gzg80hu,2021-05-25 23:19:46,t1_gzg80hu,t3_nkx8pc,stocks,Out of curiosity how do you define meme stocks?,,
14,gzg81rx,2021-05-25 23:20:04,t1_gzg81rx,t1_gzeku3s,stocks,"My 401k through fidelity allows for a self directed ""brokerage link"". I chose to leave about 20% in one of their funds but I manage the rest and can pick almost any stocks/ETFs/CEFs I'd like. I've tried buying derivatives but they told me no and I believe options are off limits as well (no interest in finding out).",,
15,gzg82yx,2021-05-25 23:20:21,t1_gzg82yx,t1_gzfqerc,stocks,"most of reddit actually applies boomer investing path - dividend and fundamentals. I do none of that, just price momentum and technicals.",,
16,gzg85ca,2021-05-25 23:20:56,t1_gzg85ca,t3_nl26o9,stocks,Do you plan to just invest for the summer?,,
17,gzg86rv,2021-05-25 23:21:15,t1_gzg86rv,t1_gzg3s4s,stocks,"I had my exit strategy. I sold on the way up, and was ok with 600% profits lol. I didn't mind it could have doubled a week later, gains are gains. 

I'm all in on L-u-c-i-d calls now. Jan 2022 will either be a great payday or I'll be giving my future ex wife's boyfriend the keys to my house.

(Wow, apparently you can't mention see see eye vee)",,
18,gzg8724,2021-05-25 23:21:19,t1_gzg8724,t1_gzfy4la,stocks,Fidelity is my favorite?,,
19,gzg87v9,2021-05-25 23:21:30,t1_gzg87v9,t1_gzatm69,stocks,"Wait, you paid your house off in early 30s? Or did you mean no debt other than mortgage?",,
20,gzg8998,2021-05-25 23:21:50,t1_gzg8998,t3_lm8vmz,stocks,Friday. If I have bought a 15c @.30 that expires Friday. Since amc is up to like 16.28... I can now sell the contracts to close for .98 share profit?,,
21,gzg89d8,2021-05-25 23:21:51,t1_gzg89d8,t3_nl26o9,stocks,Hurricanes,,
22,gzg89up,2021-05-25 23:21:58,t1_gzg89up,t3_nl0qad,stocks,Plus look at the RSI since mean reversion usually applies to stocks.,,
23,gzg8bax,2021-05-25 23:22:17,t1_gzg8bax,t3_nkx8pc,stocks,"I'm in big. What's to worry about with an opportunity with such asymmetric risk? Sure it could drop 30%, even 50% at some point but it could squeeze to numbers that are hard to fathom.

Have you seen the quality of DD being written on r/superstonk and the AMAs from industry experts who have reviewed the materials?",,
24,gzg8blv,2021-05-25 23:22:21,t1_gzg8blv,t1_gzfwoc6,stocks,110% here,,
25,gzg8cru,2021-05-25 23:22:37,t1_gzg8cru,t3_nl0qad,stocks,YouTube.com,,
26,gzg8dqo,2021-05-25 23:22:52,t1_gzg8dqo,t3_nl26o9,stocks,Tech again,,
27,gzg8gz3,2021-05-25 23:23:39,t1_gzg8gz3,t3_nkw2lq,stocks,Faamg,,
28,gzg8hik,2021-05-25 23:23:47,t1_gzg8hik,t1_gzg3snk,stocks,I inferred it based on the fact that we are discussing Amazon and you were making points about monopolies.,,
29,gzg8i5g,2021-05-25 23:23:56,t1_gzg8i5g,t1_gzb2b55,stocks,"Bro, no offense but you aren't saying anything profound here. It's what I'd imagine a young child might remark after studying markets for like 45 minutes.",,
30,gzg8l09,2021-05-25 23:24:37,t1_gzg8l09,t1_gzfgf36,stocks,Holding cash during any downturns or upturns is great so you can invest in what you think will go up.,,
31,gzg8lea,2021-05-25 23:24:42,t1_gzg8lea,t1_gzg8hik,stocks,It’s like trying to talking about getting wet without talking about water. They go hand in hand with antitrust.,,
32,gzg8mey,2021-05-25 23:24:57,t1_gzg8mey,t1_gzfanla,stocks,The fact that this is a 21 FTD at all proves they didn’t cover in Jan.,,
33,gzg8qa0,2021-05-25 23:25:52,t1_gzg8qa0,t1_gzfe6ow,stocks,"Wouldn't each time gme spikes the amount it mean they are buying back shares to cover the ones they shorted? Wouldn't that mean each spike would be smaller and smaller? I'm genuinely asking, because I don't understand not trying to disagree with your point",,
34,gzg8s0c,2021-05-25 23:26:17,t1_gzg8s0c,t1_gzg777w,stocks,Source?,,
35,gzg8vfy,2021-05-25 23:27:06,t1_gzg8vfy,t1_gzg8lea,stocks,"There’s a pretty common context about getting wet that has nothing to do with water, but maybe not appropriate for this discussion.",,
36,gzg8vsc,2021-05-25 23:27:11,t1_gzg8vsc,t3_nkx8pc,stocks,Can’t do it. I need low volatility or I’ll check my app 3000 times a minute.,,
37,gzg8xez,2021-05-25 23:27:34,t1_gzg8xez,t1_gzfanla,stocks,RemindMe! 20 days,,
38,gzg92a9,2021-05-25 23:28:43,t1_gzg92a9,t3_nl2ytm,stocks,"Welcome to r/stocks!

For stock recommendations please see our portfolio sticky, sort by hot, it's the first sticky, or see [past portfolio stickies here.](https://www.reddit.com/r/stocks/search?q=author%3Aautomoderator+%22Rate+My+Portfolio%22+-+r%2FStocks+Quarterly+Thread&restrict_sr=on&include_over_18=on&sort=new&t=all)

For beginner advice, brokerage info, book recommendations, even advanced topics and more, please read our [Wiki here.](https://www.reddit.com/r/stocks/wiki/index)

If you're wondering **why a stock moved** a certain way, check out [Finviz](https://finviz.com/quote.ashx?t=spy) which aggregates the most news for almost every stock, but also see [Reuters](https://www.reuters.com/), and even [Yahoo Finance](https://finance.yahoo.com/).

Also include *some* [due diligence](https://www.investopedia.com/terms/d/duediligence.asp) to this post or it may be removed if it's low effort.

*I am a bot, and this action was performed automatically. Please [contact the moderators of this subreddit](/message/compose/?to=/r/stocks) if you have any questions or concerns.*",,
39,,2021-05-25 23:28:43,t3_nl2ytm,,stocks,"My brokerage app, fully featured as it may be, does *not* allow for price tracking or alerting (i.e. notify me when price reaches X). For obvious reasons this is problematic. Thus I'm searching for a separate app that allows for me to identify certain assets, set price alerts, and receive (mobile device) alerts when prices reach a set point. I'm trying to avoid apps that require a brokerage account (like ThinkorSwim or Schwab, etc.), but instead wanted something informational (Barrons, MorningStar, etc.). Does anyone have any recommendations?",nl2ytm,Recommendations for mobile price tracking & alerting
40,gzg92tz,2021-05-25 23:28:51,t1_gzg92tz,t1_gywff4b,stocks,"Bee bee boo bee bop, bee boo bee bee bop",,
41,gzg93sk,2021-05-25 23:29:05,t1_gzg93sk,t1_gzfjgx2,stocks,"Once a lifetime was buying it last year, yall missed the retirement January could provided for you.",,
42,gzg95hq,2021-05-25 23:29:29,t1_gzg95hq,t1_gzg8vfy,stocks,🙄,,
43,gzg99jh,2021-05-25 23:30:26,t1_gzg99jh,t1_gzg6dhf,stocks,It happens. Mistakes are part of the learning curve but nobody knew how that would play out. I was glad we had a big run up leading into it so I was heavy cash and had VIX Calls as protection as I always do on that kinda run but man was it crazy watching those limit downs and some stocks going back to the 80’s on price.....,,
44,gzg99lr,2021-05-25 23:30:27,t1_gzg99lr,t3_nklllm,stocks,anyone have any thoughts on the Ziprecruiter direct listing?,,
45,gzg99td,2021-05-25 23:30:30,t1_gzg99td,t1_gzg87v9,stocks,"No debt of any kind other than the monthly credit card payments to net that juicy cash back. I was very lucky an older property opened up in my area when I was about to get married around 10 years ago. I had saved a significant amount from internship and grants during my college years and never had to do a loan through the bank for it as my grandfather loaned me the money I was lacking to pay the house in cash. I paid him back in about 7 years and took a loan for adding rooms that I paid in about 3 years. I was extremely privileged to have everything work so well for me, but yes, I’m not yet 35 and I’m completely debt free and have a house to my name.",,
46,gzg9a0x,2021-05-25 23:30:33,t1_gzg9a0x,t1_gzg3qlc,stocks,">We own the float.

except for 56 mil shares anyone can buy right now, but sure you own the float.",,
47,gzg9bnq,2021-05-25 23:30:56,t1_gzg9bnq,t3_nkcvvm,stocks,Gold coins hidden in the walls,,
48,gzg9ehp,2021-05-25 23:31:35,t1_gzg9ehp,t1_gze1gv7,stocks,"If you’re trying to imply something, you should say it - because you’re not making sense.",,
49,gzg9gid,2021-05-25 23:32:04,t1_gzg9gid,t1_gzflnm8,stocks,Sounds like they haven’t considered the [Infinity Pool](https://www.reddit.com/r/Superstonk/comments/mpvx9n/the_infinity_pool_naming_a_theoretical_posit_for/).,,
50,gzg9juu,2021-05-25 23:32:52,t1_gzg9juu,t1_gzftub0,stocks,"My dad gave me a warning when I first started investing that haunts me to this day and its where this particular bit of advice comes from. See we grew up in a very affluent area where we were middle class but most around us were considered pretty wealthy. My dad worked for a uber rich family company and the higher ups he interacted with used to always toss around big boy talk of how much they had in their portfolios or real estate, etc and on paper they were millionaires. Many would even talk down to my dad about how he wasn't rich because he wasn't investing properly (mind you these guys made 10x what my dad and were born into it so they had zero idea what it took to actually earn your money). He did invest he just always bet a cow instead of the farm which all these supposed millionaires thought was just the dumbest. 

Then, 2008 rolled around. These guys were bankrupt almost overnight. Suddenly their millionaire status was reduced to nothing. Much of what they owned had been bought on their net worth and when the crash happened, that net worth went to zero. As the company began struggling you can imagine the toddler tantrums that occurred because suddenly these guys couldn't pay mortgages and were essentially broke. Several of the non family personnel were laid off and had to sell property at a huge loss just to keep above water because their properties were worthless. Even some of the middle class guys that thought investing was the way to go got screwed because their savings were so much lower than investments. My dad managed to be ok and he bit his tongue when the same people who treated him like an idiot for not pouring his savings into the stock market came crying over how unfair it was that they now had nothing as if it was some injustice.

If you can lose 65k and still be ok, power to ya. Too many people think investments are sure things and while they aren't exactly a craps table, it's not a good mentality to live by. Personally, I make sure we have enough in the bank to cover six months of no job and lost investments. Recessions often mean you lose both very fast and you should always be prepared for that scenario",,
51,gzg9ke7,2021-05-25 23:32:59,t1_gzg9ke7,t1_gzg0jz2,stocks,Following this,,
52,gzg9ljy,2021-05-25 23:33:16,t1_gzg9ljy,t1_gzg8qa0,stocks,Wtf do you think they do every single day? The stock is hit within 2-500k worth of borrowed shares each morning. This isn’t even covering the true short position. This is them just returning shares they borrowed. The stock is mercilessly shorted every single day to keep it manageable. You watch the floor is only rising and it’s going to get bigger. This experiment doesn’t need catalysts. All it needs is the shorters to keep shorting it and return their FTD’s.,,
53,gzg9ls5,2021-05-25 23:33:19,t1_gzg9ls5,t1_gzfry8w,stocks,Are you an expert on making your own DD and vetting out the ones presented to you and have a long history of experience in it ?,,
54,gzg9lxg,2021-05-25 23:33:21,t1_gzg9lxg,t3_nkx8pc,stocks,Finally got out of the AMC hell hole with a 3% profit,,
55,gzg9nqd,2021-05-25 23:33:47,t1_gzg9nqd,t1_gzg0ijr,stocks,"RemindMe! June 22, 2021",,
56,gzg9nt1,2021-05-25 23:33:48,t1_gzg9nt1,t1_gzg8i5g,stocks,it ok if you don't understand it....,,
57,gzg9oih,2021-05-25 23:33:58,t1_gzg9oih,t1_gzg9ljy,stocks,Chill out man I'm asking a question,,
58,gzg9p6y,2021-05-25 23:34:08,t1_gzg9p6y,t1_gzg7x8o,stocks,"Well if everyone was talking about it, i didnt hear it. I bought because of potential stimulus money being printed and the inverse relationship between monetary supply and its value. But sure, undermine the sentiment by assuming it was a fomo. The underlying reason I purchased it still remains and is why have lost nothing on the investment. Even warren buffet joined my party until he realized that the entire market is riding on rehypothicated collateral. Good luck!",,
59,gzg9srv,2021-05-25 23:34:58,t1_gzg9srv,t1_gzft56w,stocks,What were your top performers?,,
60,gzg9ssi,2021-05-25 23:34:58,t1_gzg9ssi,t3_nky8qn,stocks,Gold is good Silver is better right now. Lots of uses and in short supply. Only the 5th time though in 50 years it was a buy and I’ve been on the Silver train since early last year and Comex traders think we could get a 18 month run up on it. We have side bets on which Silver miner Musk is gonna buy.....,,
61,gzg9tve,2021-05-25 23:35:13,t1_gzg9tve,t1_gzg068x,stocks,"I name a lot of people that were told they were outright fucking nuts for what they wanted to do, yet they are billionaires now. 
I’m still taking the shot.",,
62,gzg9u54,2021-05-25 23:35:17,t1_gzg9u54,t3_nkx8pc,stocks,"Made a quick buck in GME because I understood what was happening and was in before the media. Didn't expect the clear market manipulation, so I settled for a simple 100% gain in a few days.

Not planning in participating again though.",,
63,gzg9ub2,2021-05-25 23:35:19,t1_gzg9ub2,t1_gzg9oih,stocks,I am very chill. Just spelling out. I apologize if you read it with venom.,,
64,gzg9y4t,2021-05-25 23:36:11,t1_gzg9y4t,t1_gzfg763,stocks,Gotten that margin call yet?,,
65,gzga04o,2021-05-25 23:36:40,t1_gzga04o,t1_gzfyo9u,stocks,That’s it? I was think 45 percent by wednesday,,
66,gzga099,2021-05-25 23:36:42,t1_gzga099,t3_nkx8pc,stocks,I made a few thousand on GME months ago and haven't touched it since.,,
67,gzga2c5,2021-05-25 23:37:10,t1_gzga2c5,t3_nl34es,stocks,"Welcome to r/stocks!

For beginner advice, brokerage info, book recommendations, even advanced topics and more, please read our [Wiki here.](https://www.reddit.com/r/stocks/wiki/index)

If you're wondering **why a stock moved** a certain way, check out [Finviz](https://finviz.com/quote.ashx?t=spy) which aggregates the most news for almost every stock, but also see [Reuters](https://www.reuters.com/), and even [Yahoo Finance](https://finance.yahoo.com/).

Please direct all simple questions towards the stickied Daily Discussion and Quarterly Rate My Portfolio threads (sort by Hot, they're at the top).

Also include *some* [due diligence](https://www.investopedia.com/terms/d/duediligence.asp) to this post or it may be removed if it's low effort.

*I am a bot, and this action was performed automatically. Please [contact the moderators of this subreddit](/message/compose/?to=/r/stocks) if you have any questions or concerns.*",,
68,,2021-05-25 23:37:10,t3_nl34es,,stocks,"# [Oracle just launched Arm-based cloud computing service , rivals Microsoft Corp (MSFT.O) and Alphabet Inc's (GOOGL.O) Google do not yet offer Arm-based cloud services to the public](https://finance.yahoo.com/news/oracle-unlocks-power-arm-based-150000604.html)Highlights : 

\- Stock has surged \~30% in last 3M -  I wonder who is buying & why? company buybacks, [insider purchases](https://finance.yahoo.com/news/comfort-insider-transactions-oracle-corporation-094432518.html) or an institution ? There's was no obvious catalysts other than 'cloud' growth story.    


\- Market cap   227.89B  
\- 50-Day Moving Average  \~ $77.26  
\- Est. Dividend Yield : 1.61%   
\- Earnings on 06/14, expected to post $1.31 EPS. Historically, Oracle has mostly beat the bottom-line estimates in last 4Q - [https://finance.yahoo.com/quote/ORCL/analysis?p=ORCL](https://finance.yahoo.com/quote/ORCL/analysis?p=ORCL) and has posted \~5% surprise.   


**Anyone holding $ORCL , how are you playing this earnings - HOLD / Sell around earnings?**",nl34es,Thoughts on $ORCL ? Earnings on 06/14
69,,2021-05-25 23:37:52,t3_nl34v8,,stocks,"$ALE  - Great uptrend that showed some life for us at the end of the day, could dip a bit more but this is a great play to watch.

&#x200B;

$AZEK - Called on my discord earlier today and already up 3%, plenty of room still left to run. 

&#x200B;

$CX   - Could use 3% - 5% more dip, but when that comes this thing is an absolute machine and prints like clockwork.

&#x200B;

$KRNY - I need life first because it is free falling, but when it reverses this thing will be an amazing deal for sure.

&#x200B;

$MEOH - Triangle we need a bit more off of before I move in on it. If we get a breakout we may have an amazing play for sure.

&#x200B;

$RADA - Great triangle, we could get it a bit cheaper - but this is a great place to be for a triangle play like this.

&#x200B;

$SXC  - We need again, a bit more off - but once we get it - this thing may be an easy 10 - 15%.

&#x200B;

$URA  - great Uranium ETF coming to value, overall Uranium is an amazing surge and I have been riding it, may buy this 'dip'",nl34v8,My Watchlist For 5/26/2021
70,gzga6sm,2021-05-25 23:38:15,t1_gzga6sm,t1_gzg9juu,stocks,">Personally, I make sure we have enough in the bank to cover six months of no job and lost investments. Recessions often mean you lose both very fast and you should always be prepared for that scenario

This is the best thing to do. Have a strong emergency fund and don't over leverage on real estate like so many people did.",,
71,gzga7cc,2021-05-25 23:38:23,t1_gzga7cc,t3_nkx8pc,stocks,"Gambled about 10% of my portfolio in November on GME and have been reinvesting back into GME since. Some of my accounts have 7,000% returns.",,
72,gzga7fu,2021-05-25 23:38:25,t1_gzga7fu,t3_nkug7q,stocks,I like to buy and hold. So losses don’t scare me as I’ll buy the dip. Kinda nice when you don’t need the $.🤣,,
73,gzga84w,2021-05-25 23:38:34,t1_gzga84w,t1_gzg05kc,stocks,"I must not FOFOMO.  
FOFOMO is the mind-killer.  
FOFOMO is the little-death that brings total obliteration.  
I will face my FOFOMO.  
I will permit it to pass over me and through me.  
And when it has gone past, I will turn the inner eye to see its path.  
Where the FOFOMO has gone there will be nothing. Only FOMO will remain.",,
74,gzga8ss,2021-05-25 23:38:44,t1_gzga8ss,t3_nkx8pc,stocks,"Nice try, SEC...",,
75,gzgaayo,2021-05-25 23:39:15,t1_gzgaayo,t3_nl2ytm,stocks,Yahoo finance.,,
76,gzgae3n,2021-05-25 23:40:00,t1_gzgae3n,t3_nkx8pc,stocks,"If you don’t buy at least 1 share, you should retire from ever trading stocks ever again. Why would anyone leave the possibility off the table? The proof is in the pudding.",,
77,gzgaefw,2021-05-25 23:40:05,t1_gzgaefw,t1_gzg9p6y,stocks,"lol that was theory to go long? because more supply of money. every retailer think that theory is an edge when it comes to gold, it's not.",,
78,gzgagtu,2021-05-25 23:40:39,t1_gzgagtu,t1_gzg49dx,stocks,"I personally agree that the price is heavily suppressed below where it should be currently, and is only going to rise higher as GME pivots into eCommerce.

r/superstonk can handle people pointing and shouting shill at one another because we've seen the swarm of shills first hand. We can't come to other boards and take that energy with us though.",,
79,gzgahy5,2021-05-25 23:40:55,t1_gzgahy5,t1_gzg9y4t,stocks,I don’t play with margin. So no.,,
80,gzgakbz,2021-05-25 23:41:28,t1_gzgakbz,t1_gzf12sr,stocks,"""Man, my company is firing everyone and selling off everything they can. Everyone here says we're going under. Losses are up the wall. No money left. They're not even trying. I'm gonna short it""
 
WSB: *tard*",,
81,gzganhr,2021-05-25 23:42:13,t1_gzganhr,t1_gzecl9w,stocks,"So you’d only get fired if the company tanks. And if the company tanks your shares value tanks. So you don’t want shares.

I guess that makes sense? But even without C level insider info I still think you’d be aware of something and at least not caught completely by surprise. You can basically apply this fear to any company. Just worried about the double whammy or do you not invest at all?",,
82,gzgaot6,2021-05-25 23:42:32,t1_gzgaot6,t1_gzg4avz,stocks,"I remember the first time feeling that way back in February 2009 as well. Not sure if the banks are able to pass the stress test. At that point every bank is on the brink...failing means another major one may go under. 

Of course I was too paralyzed to do anything until like late summer, and not fully go all in until 2010.",,
83,gzgaox9,2021-05-25 23:42:33,t1_gzgaox9,t1_gzfwwgt,stocks,You might want to look at the [DD](https://www.reddit.com/r/Superstonk/comments/nkcwns/the_diamond_handbook_a_compilation_of_superstonks/) over on r/Superstonk it doesn’t look like this situation will ever happen again.,,
84,gzgapgo,2021-05-25 23:42:41,t1_gzgapgo,t1_gzfv1jq,stocks,I totally forgot about that. I still think there's room for there brand name product to find its way into the gyms as well though. Peloton fanboys would flock to a gym that promoted Peloton workouts,,
85,gzgaphc,2021-05-25 23:42:41,t1_gzgaphc,t3_nkx8pc,stocks,"Never sold, bought more, shorts never covered.",,
86,gzgav0c,2021-05-25 23:44:01,t1_gzgav0c,t1_gzaw5q8,stocks,"My guy, basically everything you've written is dead backwards.",,
