,comment_id,created,fullname,parent_id,subreddit,text,post_id,title
180,gyvi9lp,2021-05-20 21:56:20,t1_gyvi9lp,t1_gyvfqc4,stocks,"Don’t forget they don’t drive or use green energy, only want us to. Check out Al Gore old school Green Energy, nothing about his way of life is green except the money he makes.",,
181,gyviadh,2021-05-20 21:56:30,t1_gyviadh,t1_gyvbbf4,stocks,"Fleet sales are what make the Big 3 the Big 3 tho. It's a huge chunk of a reliable and renewable annual revenue (fleets get replaced on a known timetable), as are the service contracts.",,
182,gyviejt,2021-05-20 21:57:24,t1_gyviejt,t1_gyvbisa,stocks,"As we all know, the early pioneers of mobile phones like Blackberry, Palm and Nokia are all top contenders within the space today /s",,
183,gyvieqv,2021-05-20 21:57:27,t1_gyvieqv,t1_gyvh4ee,stocks,Agreed.,,
184,gyvif7u,2021-05-20 21:57:33,t1_gyvif7u,t1_gyufx3d,stocks,"It's possible some of the red yesterday could have been attributed to its massive dump, signaling to the broader market, at least temporarily, a risk off appetite.",,
185,gyvifa7,2021-05-20 21:57:34,t1_gyvifa7,t1_gyvd40d,stocks,I'm not an options guy. Wut mean.,,
186,gyvifm1,2021-05-20 21:57:38,t1_gyvifm1,t1_gyv5eiy,stocks,"This guy knows, never get version 1",,
187,gyvifmr,2021-05-20 21:57:39,t1_gyvifmr,t1_gyvb35m,stocks,"""Specific knowledge"" is a broad term.

If someone has an intuition that these 30 companies are exceptional and higher quality than most, and, based on observation of societal and consumer trends, are bound for comparative outperformance, then does that count as ""specific knowledge?""

And yes, I'm aware that it's possible for people to pick the wrong stocks.",,
188,gyvihhk,2021-05-20 21:58:03,t1_gyvihhk,t3_nhcit9,stocks,I agree with you but i got some july puts juuuuust in case. Long TGT shares.,,
189,gyvij85,2021-05-20 21:58:25,t1_gyvij85,t1_gyv24vn,stocks,Good bye.,,
190,gyvior0,2021-05-20 21:59:37,t1_gyvior0,t1_gyvbw3v,stocks,All ten dollars of it?,,
191,gyvip6b,2021-05-20 21:59:43,t1_gyvip6b,t3_nhcit9,stocks,"Target's an interesting pandemic case in that it's shot up like crazy - it's up almost 100% from pre-crash prices - but still manages to trade below 20 p/e.

I doubt they'll be able to maintain the same level of growth post-pandemic but I also think consumer sentiment is gonna be on their side for a while (unless they fuck something up), and they had been on a solid upward trend for a few years even before covid.",,
192,gyvirgl,2021-05-20 22:00:12,t1_gyvirgl,t1_gyv5f6h,stocks,"Agreed. I don’t live in a city and I don’t want a separate car for long road trips and one for everyday “to and from work”travel. I want an EV that can drive several hundred miles (over 300) without recharging and then it needs to recharge in under 5 minutes. Until it’s as convenient as my ICE vehicle, I’m not interested. But I look forward to the day when that will be true. 
Also, I’m excited about the true self driving Tesla so when I’m older I won’t have to give up my license. But again we aren’t there yet.",,
193,gyvitbd,2021-05-20 22:00:36,t1_gyvitbd,t1_gyvh4ee,stocks,Ford stopped giving dividends a couple years ago.,,
194,gyviu28,2021-05-20 22:00:46,t1_gyviu28,t1_gyv7113,stocks,My wife's boyfriend agrees.,,
195,gyviuv0,2021-05-20 22:00:57,t1_gyviuv0,t1_gyvi9lp,stocks,"Very good point, and I will read up about ol Al.",,
196,gyviv0r,2021-05-20 22:00:59,t1_gyviv0r,t3_ngyrsj,stocks,That second half of what you said.,,
197,gyvixes,2021-05-20 22:01:30,t1_gyvixes,t1_gyv4wr1,stocks,"If you must go with an index, then go with a momentum ETF (like $MTUM).",,
198,gyvj1ma,2021-05-20 22:02:24,t1_gyvj1ma,t1_gyvd40d,stocks,"after market is looking great, i'm thinking tomorrow will be a nice one.",,
199,gyvj2mk,2021-05-20 22:02:38,t1_gyvj2mk,t3_nh6bxq,stocks,I bought in and am holding and just waiting for the Electric F150 to become the biggest truck in the EV market.,,
200,gyvj5z4,2021-05-20 22:03:21,t1_gyvj5z4,t1_gyrfwfk,stocks,"To add to this, often one of the fundamental ideas of buying into a stock is the expectation of a company or its stock to do well or for it to be profitable for whatever reason, since a lot of the market is based on perceived value anyway, then what you say about “enough people believing the same thing” makes sense not only on a technical level but also a fundamental level since the perceived value of the stock is clearly high if the masses believe that.",,
201,gyvj89b,2021-05-20 22:03:51,t1_gyvj89b,t1_gyveqt7,stocks,"Or just check ahead of your trip and include a 30 minutes to 1 hour pit stop to recharge. I swear people trying to convince you that they literally never stop on those 10hr drives to eat and their schedule is so tight a recharge stop is unthinkable...

Like, they sometime wake up in the morning and just go ""Oh shit, I have to drive across 3 states today! Totally forgot. Gotta go""",,
202,gyvj8kv,2021-05-20 22:03:55,t1_gyvj8kv,t1_gyvewd0,stocks,Are you trying to make a quick buck or invest the $100 and forget about it for many months/years.,,
203,gyvjapb,2021-05-20 22:04:23,t1_gyvjapb,t1_gyv5eig,stocks,"I know, right? Imagine replacing your CEO with Steve Ballmer and end up going out of business like Microsoft did.",,
204,gyvjb86,2021-05-20 22:04:30,t1_gyvjb86,t1_gyv31v7,stocks,"I personally wouldn't buy any automotive stock right now if you don't own them already. Profits are really good right now, but most dealers 90 day supply is about to dry up and new production is not backfilling that supply so sales are about to dip, that may have a negative impact on the share price. But, ya, once we're through the chip shortage I think VW is well positioned from a product standpoint.",,
205,gyvjbt3,2021-05-20 22:04:38,t1_gyvjbt3,t1_gyvbbsi,stocks,They're probably hoping after 50 years you've forgotten about the 1970 Maverick.,,
206,gyvjhta,2021-05-20 22:05:56,t1_gyvjhta,t1_gyurhr5,stocks,Unless you’re really hoping for a dead cat bounce after the stop,,
207,gyvjiji,2021-05-20 22:06:05,t1_gyvjiji,t1_gyvip6b,stocks,"I’m very curious to see that. It’s hard to believe they could double their value year over year so I definitely expect growth to slow. But at the same time I think there’s a lot left in the tank. The invest in themselves very well. They crushed same day pick-up and using their stores as pseudo warehouses. Their brand partnerships are great and their target brand groceries are both really good and popular.

I think Target occupies a very special niche of value and chic. Loyal customers. Great business model. And so I don’t bet against continued future growth, even given the huge run up over the past 12 months or so",,
208,gyvjjbw,2021-05-20 22:06:15,t1_gyvjjbw,t1_gytxrvv,stocks,Still another 30-40k left to sacrifice...,,
209,gyvjkqx,2021-05-20 22:06:33,t1_gyvjkqx,t1_gyvitbd,stocks,Then CAT is better than I realized.,,
210,gyvjpg3,2021-05-20 22:07:35,t1_gyvjpg3,t1_gyv4fxw,stocks,"Wow, well I sure don’t feel that way.  The legacy OEMs have shit tons of experience with mass production and QC.  If EVs are to make a big dent in the world or at least US fleet, it’s not going to be from Tesla.",,
211,gyvjr36,2021-05-20 22:07:57,t1_gyvjr36,t1_gyur0hc,stocks,Right? My 2000 Ram is similar size but gets a third of the gas mileage lol,,
212,gyvjsl0,2021-05-20 22:08:18,t1_gyvjsl0,t1_gyvjb86,stocks,I'll give you that. I've owned VW for 15 years or so. Not adding any at the moment.,,
213,,2021-05-20 22:08:35,t3_nhcy0p,,stocks,"Hey everyone, I am trying to learn more regarding calls and puts. I understand the very basics but I want to be able to get into them in a year or so. For instance, let’s say I believe Tesla is going up by Jan of 2022. Current price is at $585. I buy a call for $590. Now let’s say it goes up to $700 way before January. How much profit do you make? Do you lose more the closer it gets? Also is the break even price exactly how it sounds? So if it’s $697 break even, I would only profit after $697?",nhcy0p,Trying to learn about calls
214,gyvjur8,2021-05-20 22:08:46,t1_gyvjur8,t1_gyuuihe,stocks,Week 6 beg dad for money,,
215,gyvjvu0,2021-05-20 22:09:01,t1_gyvjvu0,t1_gyvb8a4,stocks,You’d have to be completely oblivious and naive to think that they don’t collude. They do it on a massive scale. This is common knowledge.,,
216,gyvjvy5,2021-05-20 22:09:03,t1_gyvjvy5,t3_nh6bxq,stocks,I have option with a avg cost of 1.10 expiring on 2023 :( I hope it does something.,,
217,gyvjyrm,2021-05-20 22:09:40,t1_gyvjyrm,t3_nhbxm2,stocks,Can you without googling estimate the percentage of electric vehicles in the US?,,
218,gyvk32v,2021-05-20 22:10:37,t1_gyvk32v,t1_gyuzhu6,stocks,Image link didn’t work,,
219,gyvk4tc,2021-05-20 22:11:00,t1_gyvk4tc,t1_gyvifa7,stocks,"I do not play options.

This is just referencing to how the broad market can get pinned by options expiring, especially monthly options expirations.",,
220,gyvk5ky,2021-05-20 22:11:10,t1_gyvk5ky,t1_gytdn2o,stocks,"Stop losses are basically saying hey I’ll make you a deal. If you offer me way less than the price right now, I’ll sell it to you. Awful deal. You should be buying dips and selling highs.",,
221,gyvk63q,2021-05-20 22:11:17,t1_gyvk63q,t1_gyveqt7,stocks,Except when u want to take a day trip 100 miles away. Then what do you do? Don't currently own an EV. Lease is up in a year. Will be looking for an EV with 400+ mile range.,,
222,gyvk65a,2021-05-20 22:11:17,t1_gyvk65a,t3_nhcit9,stocks,"I am in a similar boat! Bought in a few years ago due to strong fundamentals, it’s been a fun ride.

I’m a classic valuations guy - this market raises a lot of eyebrows for me. So it’s great to see a company that I thought was underpriced turn into a winner without getting overvalued!",,
223,gyvk6rk,2021-05-20 22:11:26,t1_gyvk6rk,t1_gyv1ri4,stocks,It’s a unibody.  Gimme an 80’s full box frame and a bench seat.,,
224,gyvk7u9,2021-05-20 22:11:39,t1_gyvk7u9,t1_gyvcqp3,stocks,Go away plz. Or tell me your secrets,,
225,gyvk8j7,2021-05-20 22:11:48,t1_gyvk8j7,t1_gyvhugn,stocks,"3.4% annualized. Maybe he kept half in cash/bonds. 

And that's over this massive bull market.",,
226,gyvk8k4,2021-05-20 22:11:49,t1_gyvk8k4,t1_gyvekko,stocks,That's not what I said. I own a model 3 long range and have a preorder for a tri motor cybertruck.,,
227,gyvkabc,2021-05-20 22:12:12,t1_gyvkabc,t1_gyvjvu0,stocks,With whom in what way specifically?,,
228,gyvkast,2021-05-20 22:12:19,t1_gyvkast,t1_gyvjr36,stocks,Eh. If you got the diesel that'll be alive longer than any truck made this year. Same with my chevy 350. You win some you lose some,,
229,gyvkb5j,2021-05-20 22:12:24,t1_gyvkb5j,t1_gytb3ez,stocks,"Most of the posts are conspiracy theories. The squeeze squoze back in Jan-Feb. Difference is that you got millions of new traders who only know the GME stuff as it went off the rails. Completely detached. 

One thing I’ve been thinking about tho recently, is that one could probably try doing some quick (~1-2mo long) swing trades, as the past month or so has seen GME settle into a pattern of dropping to the 130-150 range and then popping up again to ~180, before tailing off for a little bit. Maybe it’ll happen again, maybe it’ll drop back down to earth in the next cycle, or maybe I’m dead wrong about everything, but it is an interesting pattern. Along with the fact that it’s just casually lofting about in the mid 100’s for a couple months now lol",,
230,gyvkf2k,2021-05-20 22:13:17,t1_gyvkf2k,t3_nhakdg,stocks,"It took only 20 years for phones to go from big blocky pieces of plastic to iphone 12 pro. If anything tech advances are accelerating, not slowing down. Imagine what the next 10 years will look like. I bet my ass humanity will have their everyday lives altered by a few of those companies he says has no bright future.",,
231,gyvkg0e,2021-05-20 22:13:30,t1_gyvkg0e,t3_nhcy0p,stocks,"Depends. Yes, theta decay. No. No.",,
232,gyvkg6g,2021-05-20 22:13:32,t1_gyvkg6g,t1_gyuvnhz,stocks,"I like the oaty taste it adds to coffee, but yeah it'll never be as creamy as milk.",,
233,gyvkg6r,2021-05-20 22:13:32,t1_gyvkg6r,t1_gyv71i6,stocks,What return has the professional money manager got for you?,,
234,gyvkia0,2021-05-20 22:14:00,t1_gyvkia0,t3_ngt4js,stocks,"$TDOC, $AMWL, $CLOV, $NNOX, $GDRX....?",,
235,gyvki9y,2021-05-20 22:14:00,t1_gyvki9y,t3_nh6bxq,stocks,"Look idk if they are long term, but I bought 100 contracts strike @12 in January and cashed out 19K today when it jumped to 12.6, and I have more calls for 13. Here's hoping!",,
236,gyvkjdw,2021-05-20 22:14:15,t1_gyvkjdw,t1_gyvevs9,stocks,How do you figure they “messed up” with the Bronco and Mach-E Mustang?  Both vehicles have been met with praise from everything I’ve seen.,,
237,gyvkjot,2021-05-20 22:14:19,t1_gyvkjot,t1_gyty6k6,stocks,"I very rarely use stop losses for this exact reason. If you use them, you will eventually see this same issue.

Stop limits are safer, but provide no protection from prolonged crashes, only flash crashes.

Also, keep in mind crashes can occur after hours, in which case most brokers don't provide any kind of stop. I have seen people massively burned because their stops didn't trigger after hours. I can't name it here, but one stock fell from like $60 to $30 overnight, and then continued to fall to under $20. People woke up one morning and were really pissed their stops didn't trigger.

So, ultimately, there really isn't any reliable form of protection.",,
238,gyvkkgb,2021-05-20 22:14:29,t1_gyvkkgb,t1_gyvk65a,stocks,Love to hear this kind of success story!,,
239,gyvkkgd,2021-05-20 22:14:29,t1_gyvkkgd,t1_gyvj8kv,stocks,Probs hold onto it for the next few months type of investment,,
240,gyvklcy,2021-05-20 22:14:42,t1_gyvklcy,t1_gyv24vn,stocks,What the fuck is all this?,,
241,gyvknwg,2021-05-20 22:15:15,t1_gyvknwg,t1_gyu4hgb,stocks,The influx of child investors since covid and Robinhood. Some of these posts are extremely naive borderline laughable/sad.,,
242,gyvkov0,2021-05-20 22:15:29,t1_gyvkov0,t1_gyvjkqx,stocks,Lmao,,
243,gyvkpn1,2021-05-20 22:15:39,t1_gyvkpn1,t3_nh6bxq,stocks,while you were waiting you could have made some money with Tesla.,,
244,gyvkpnk,2021-05-20 22:15:40,t1_gyvkpnk,t1_gyvfvkn,stocks,">I'm not sure any of those companies that I remember, still exist. 

A testiment for index funds.",,
245,gyvkput,2021-05-20 22:15:42,t1_gyvkput,t3_nharj2,stocks,It use to be a big deal for a stock to fluctuate by 20%. Now that everyone's got an app it happens every day.,,
246,gyvkqr1,2021-05-20 22:15:54,t1_gyvkqr1,t1_gyvjiji,stocks,"Yeah, a PEG below 2 does brook confidence.

Target's definitely been stepping up their store/exclusive brands over the last few years (my wife is loving some of the new ELF brand stuff), and their push for inclusivity and paying their workers well can only be long-term fuel for sentiment and loyalty.

I only have 15 shares currently but their continuing strong results have me strongly considering scaling up.",,
247,gyvkr0l,2021-05-20 22:15:57,t1_gyvkr0l,t1_gyvk7u9,stocks,"This market is being propped up by unprecedented QE and fiscal stimulus, and a Fed that doesn't want to take their foot of the brakes in spite of all evidence to the contrary.

The world economy was shattered by Covid but by looking at the stock market you'd never be able to tell. You can't experience such a huge shock and expect business as usual like nothing even happened.  Yet that's what the stock market looks like.  It's completely detached from any fundamentals and at the first sign of trouble the whole house of cards could come toppling down.  We've already seen weakness.",,
248,gyvkr77,2021-05-20 22:16:00,t1_gyvkr77,t3_nh6bxq,stocks,"Though this is clearly a protective play by Ford, folks need to realize the scale we are talking about it and extrapolate the meaning. F sells a lot of cars. Thus, their focus isnt necessarily more sales, its margins and it will take very little change in margin, to move the bar. 

The reason for that is their margins are historically thin. But that also means that even a slight improvement, of say 2-3% in net, would push the stock to double if they can just maintain that for a couple of years. This is all they need to do. So the question you need to ask is will eV's increase margins? And if so, by how much?

Historically, ICE margins are very small and most companies today are lucky to see 5%. So a change of 2-3% is huge. See what I mean? Its not like a startup which has to show 30%-50% rev growth for 10 years straight.

I think the switch to eV's will definitely increase margins. At first it will be slight but the margins will grow every year for the next decade and they will grow by a lot, to the tune of maybe 1% per year as sales increase. I also think that due to Fords legacy in trucks, they will be able to command a premium to everyone else thanks to 3rd party support, ease of repair, and low cost of ownership. 

I also think that in time, fleets management software will indeed become a major thing. As we move more and more to online shopping, efficient delivery will become insanely critical as Amazon has pointed out time and time again. Thus there will be enterprise software profits to be made for those that have a lot of vehicles in the enterprise space... which is likely going to be Ford though Rivian currently has a nice path with Amazon specifically right now. But Ford owns a bug chunk of Rivian too so lol.",,
249,gyvkr9y,2021-05-20 22:16:01,t1_gyvkr9y,t3_nhcy0p,stocks,Go join r/thetagang and r/options,,
250,gyvksoy,2021-05-20 22:16:19,t1_gyvksoy,t1_gyv04vm,stocks,Inb4 Yellen has a stroke and says something about raising interest rates again,,
251,gyvkwq1,2021-05-20 22:17:14,t1_gyvkwq1,t1_gytfp73,stocks,"Besides low floats, when have you ever seen a flash crash that causes 10-20% slippage or even a drop that big for that matter? 

I agree with you that long term investors probably shouldn't be using stop losses. But if you are trying to protect yourself from downside risk a stop limit order leaves you with the chance to not be filled which can be much worse than getting a bad fill.",,
252,gyvkzii,2021-05-20 22:17:52,t1_gyvkzii,t3_ngqfin,stocks,unusualwhales.com subscription.,,
253,gyvkzs6,2021-05-20 22:17:55,t1_gyvkzs6,t1_gyuvvv9,stocks,"What are you talking about? 

Tesla owns the auto industry. Tesla is *all* EV. A lot of the groundwork research has already been done. Ford just has to capitalize on it and take a percentage of market share.",,
254,gyvl2y8,2021-05-20 22:18:38,t1_gyvl2y8,t1_gyvkqr1,stocks,I think a lot of people are getting scared by the run up. But the thing is the company is strong so the uptrend can very well continue. I remember talking to someone towards the end of last year who didn’t want to buy because he felt $175 was too expensive. And now here we are. Price targets keep getting revised up so o think there is a real case to be made that there’s no time to buy like the present,,
255,gyvl3zu,2021-05-20 22:18:53,t1_gyvl3zu,t3_nha7k8,stocks,Time in the market beats timing the market.,,
256,gyvl6it,2021-05-20 22:19:27,t1_gyvl6it,t1_gyvb35m,stocks,Idk I think you can pick 20 great companies out of SP and hold for the long term and have a good chance outperforming by holding,,
257,gyvl80r,2021-05-20 22:19:47,t1_gyvl80r,t3_nh6bxq,stocks,Do you work for Ford or something,,
258,gyvlcql,2021-05-20 22:20:49,t1_gyvlcql,t1_gyvd3eb,stocks,"Of course other OEMs are going to catch up…. I’ve always been baffled by those naive enough (not you obviously) to think that wasn’t going to happen.  

The legacy auto manufacturers have the expertise, marketing, name recognition/following, and engineering to absolutely bury Tesla as they transition to the EV market.  Contrary to some of the less technical savvy out there, EVs are MUCH simpler than an ICE drivetrain.   

Tesla is going to be made irrelevant, but they were never at any point in time going to have a monopoly on EV sales.  Unfortunately, their market cap still reflects that.",,
259,gyvlcso,2021-05-20 22:20:50,t1_gyvlcso,t3_ngt748,stocks,Cidm..    #Cinedigmischill,,
260,gyvld0x,2021-05-20 22:20:53,t1_gyvld0x,t3_nh6bxq,stocks,10 years ford is the silver of stocks lol I mean hey it could. Maybe they will start smacking Harley riders around and take their motorcycle business. That'd be fun to see.,,
261,gyvldvy,2021-05-20 22:21:04,t1_gyvldvy,t3_nh6bxq,stocks,"LMAO I bit into this shit apple last month. Lost my hat on $13 calls. I waited to long to dump them, earnings came out ""STRONG"" and the stock dropped a dollar. Walked away with nothing. Its stable stock I guess but with this chip problem, I think most of them could be in trouble during this ""conversion"". TM doing me right though, long on that.",,
262,,2021-05-20 22:21:28,t3_nhd7yz,,stocks,"I use Fidelity. Suppose I am have a stock that is currently at 100 dollars. I have 1 share of that stock. I see that the price is increasing. The price reaches 101 dollars. I set a limit price order at 100.5 dollars for 1 share and another one at 101.5 dollars. Now whatever happens I will make profit, either 50 cents or 1.5 dollars.

Let's suppose that price keeps on increasing, it hits 101. 5 and my order gets fulfilled. Now I have 0 shares.. After that the price drops and reaches 100.5. What will Happen to the second limit price order that i Set?? I do not have a share now.. But I have a limit price order set.

Will it be cancelled automatically??",nhd7yz,I have a question regarding limit price orders. What happens if I try to sell a stock I do not own using a limit price order?
263,gyvlipo,2021-05-20 22:22:09,t1_gyvlipo,t3_nh6bxq,stocks,153 billion dollars in debt. Their current operating profit margin is 1%. Extremely low future (to none at all) margin on electric vehicles because they have no infrastructure or tooling in place. Reduced their global market lineup to cut costs and focus on their biggest sellers. Literally consuming their current products and their current lifecycle to compete in EV. In what world exactly is Ford supposed to reach $20? That is an almost 80 billion dollar market cap. The top is in folks,,
264,gyvlkd2,2021-05-20 22:22:31,t1_gyvlkd2,t1_gyvagef,stocks,"Terrible comparison. 

Online streaming is a new product. New sector. 

Ford selling an ev is still selling a vehicle. They can't make new sales without taking away from either their own ice sales or competitors sales.",,
265,gyvlke7,2021-05-20 22:22:32,t1_gyvlke7,t3_nh6bxq,stocks,Competition is good!,,
266,gyvll09,2021-05-20 22:22:40,t1_gyvll09,t1_gyvj5z4,stocks,"That's kinda meta, but ya... you could say that a company making money hand over first has a high stock value because people believe it should have a high value because it's making money hand over first.   

To quote my favorite fictional animated scientist (who was quoting my favorite animated scientist's sidekick) ""that just sounds like slavery with extra steps"".  Now, hardcore fundamental investors will have issues investing in companies that show no intention of paying a dividend, because that is truly how profits are returned to ownership of a public company. 

Which, and let's open another can of worms, is why a lot of people, myself included, have issues with corporations using their cash generated from operations on stock buybacks.   The reason boards and executives do this is to increase the value of their own stock options or argue treasury shares to award themselves at a later time.   

When a Company buys its own stock on the open market, it drives the price of the shares up.   Now, you might say ""that's good for owners"", but only if they sale.  If the shares are either awarded out later or used to fulfill exercised stock options, then there is no net effect for owners who held throughout that period.  If, instead, the Company pays a dividend with the money it would have used for the buy back, all owners benefit equitably.  

Here in lies the heart of what makes wallstreet a crooked game.   It doesn't do what it's ment to do anymore,  pay ownership it's share of net income.   The companies that pay regular dividends are far and few between and are pretty much just the dinosaurs of the blue chip echelon.  

Few companies started in the last 50 years would ever consider using their cash in that way.   It's stupid, why pay all the little people that often this company when the boards and executives can pay themselves instead.",,
267,gyvlljf,2021-05-20 22:22:46,t1_gyvlljf,t1_gyvbw3v,stocks,I’d still have plenty left over if I lose so not a terrible idea,,
268,gyvllxm,2021-05-20 22:22:52,t1_gyvllxm,t1_gyv6ygp,stocks,"All the analyst reports I've read state range as one of the top concerns of consumers, most consumers want min 400 km, which only some models today reach, and only in ideal conditions. Driving in -20 deg C weather cuts that range in half to 200 km. Combined with no widespread infrastructure for charging, range is a non-starter for lots of people in North America, especially outside major cities. It'll get there I'm sure, but the guy you responded to makes a valid point about range needing to improve.",,
269,gyvlo0i,2021-05-20 22:23:21,t1_gyvlo0i,t3_nh6bxq,stocks,Silicone shortage is killing the automotive industry right now. Tough to make cars with a chip.,,
270,gyvlpue,2021-05-20 22:23:44,t1_gyvlpue,t1_gyvl2y8,stocks,Let 'em get scared. The price is currently more than justified by their earnings so any selloff is just an opportunity to load up.,,
271,gyvlqjf,2021-05-20 22:23:54,t1_gyvlqjf,t3_nh6bxq,stocks,This is a capital intensive transition. Between that and the Osborne effect they better have enough money to ride out the transition to EVs.,,
272,gyvlrm8,2021-05-20 22:24:09,t1_gyvlrm8,t1_gyv99fl,stocks,You're telling me that Ford had a CEO that didn't have a driver's license?,,
