,created,fullname,post_id,subreddit,text,title,comment_id,parent_id
64,2021-05-28 18:39:48,t3_nn4j10,nn4j10,wallstreetbets,"&#x200B;

***This is my in-depth dd on Fisker which I spent over a week doing, hope you all enjoy! This is part 1 of 4.***

&#x200B;

https://preview.redd.it/nj4jemyx7w171.png?width=462&format=png&auto=webp&s=308a1c25ff10523cfe20b858b01eafe5812d0679

Tl;dr

This is an extensive, in-depth due-diligence document, and I realize that “ain’t nobody got time for that”. So I have decided to do God’s work for him and put the tl;dr at the start, saving you all a couple hours read.

* Henrik Fisker is a God among men in the automotive industry - trust him to do right
* Geeta Gupta-Fisker is a solid Chief Financial Officer with experience in investment banking - she will ensure the shares are valued right
* Henrik has learned from all the mistakes he made with his previous attempt to create Fisker Automotive, and will certainly do everything in his power to avoid that mess again. He has designed systems into the intricacies of the company to avoid failure - meaning Fisker Inc is guaranteed to succeed
* Henrik Fisker on shorting $FSR - “You will quickly understand that you stand to lose a lot of money if you show it against Fisker”
* Production of Fisker Ocean expected to start in November 2022
* 250,000+ units a year expected by 2025
* Partnerships with Foxconn and Magna Steyr, both giants in their respective industries, among others
* Large Fleet market in Europe gaining momentum, and 700+ Fisker reservations in this market alone
* 16,000+ reservations already. More than Tesla had 18 months pre-production
* Revenue streams include leasing automotives, servicing, selling emissions credits, selling insurance (like selling the pickaxe to miners, and selling the diamonds to the mine owners too, absolutely genius - Fisker are insuring cars which they own, because the customer is only leasing it)
* High short interest (20%+), high analyst price targets compared to current share price (100%+) and low valuation compared to peers ($3bn market cap currently)
* Designing the first ever all-electric popemobile - Massive, soon to be historic, event!
* I give $FSR (currently $13 a share) a price target of $100 by end of year 2022, if not sooner
* Price Targets: $35 by end of year - Previous ATH. $50 start of next year - European and Chinese debut of prototypes. $100 end of 2022 - start of production (SOP). $150+ 2023
* 2025 Price Targets, calculated using projected data: Bear case - $97 a share, Bull case - $519 a share
* Downside in the short term is capped by the large amount of cash on hand - one third of market cap is cash. Long term, is capped by risk factors, which are almost eligible and affect every automotive startup anyway.

# Introduction

Fisker Automotive was an American company known for producing the Fisker Karma, which was one of the world's first production luxury plug-in hybrid electric vehicles. It debuted at the 2008 North American International Auto Show, and first deliveries were in 2011. (Wikipedia)

Fisker Inc. is an American electric vehicle automaker founded by Henrik Fisker and his wife Geeta Gupta-Fisker. Launched in 2016 and based in Southern California, Fisker Inc. was preceded by Fisker Automotive, which produced the Fisker Karma. (Wikipedia)

# CEO: Henrik Fisker

([https://en.wikipedia.org/wiki/Henrik\_Fisker](https://en.wikipedia.org/wiki/Henrik_Fisker))

&#x200B;

https://preview.redd.it/c913ihi58w171.png?width=435&format=png&auto=webp&s=9cc9484d3020f5ace5d3cf01f4ffd4a2f08357cb

Henrik Fisker is best known for designing luxury cars including the [BMW Z8](https://en.wikipedia.org/wiki/BMW_Z8), [Aston Martin DB9](https://en.wikipedia.org/wiki/Aston_Martin_DB9), [Aston Martin V8 Vantage](https://en.wikipedia.org/wiki/Aston_Martin_V8_Vantage_(2005)), [Fisker Karma](https://en.wikipedia.org/wiki/Fisker_Karma), [Galpin-Fisker Mustang Rocket](https://en.wikipedia.org/wiki/Mustang_Rocket), [VLF Force 1 V10](https://en.wikipedia.org/wiki/VLF_Force_1), [VLF Destino V8](https://en.wikipedia.org/wiki/VLF_Destino), [Fisker EMotion](https://en.wikipedia.org/wiki/Fisker_EMotion), [Fisker Ocean](https://en.wikipedia.org/wiki/Fisker_Inc.#Fisker_Ocean), and [Fisker Orbit](https://en.wikipedia.org/wiki/Fisker_Inc.#Fisker_Orbit). He also designed the Viking motorcycle and [Benetti Fisker 50](https://en.wikipedia.org/wiki/Benetti_Fisker_50) [superyacht](https://en.wikipedia.org/wiki/Superyacht), and is involved in the design of flexible [solid-state battery](https://en.wikipedia.org/wiki/Solid-state_battery) technology. He is the founder of HF Design, co-founded [VLF Automotive](https://en.wikipedia.org/wiki/VLF_Automotive), founder and former CEO of [Fisker Coachbuild](https://en.wikipedia.org/wiki/Fisker_Coachbuild), founder of [Fisker Automotive](https://en.wikipedia.org/wiki/Fisker_Automotive), where he served as chairman and CEO until March 2013, and currently is the founder, chairman and CEO of [Fisker Inc.](https://en.wikipedia.org/wiki/Fisker_Inc.)

The Fisker Karma was the world's first premium [plug-in hybrid](https://en.wikipedia.org/wiki/Plug-in_hybrid), and received a handful of accolades, including the [International Design Awards](https://en.wikipedia.org/wiki/International_Design_Awards) Product Design of the Year, Silver [Edison Award](https://en.wikipedia.org/wiki/Edison_Awards), [*Automobile*](https://en.wikipedia.org/wiki/Automobile_(magazine)) magazine's Design of the Year Award, [*Top Gear*](https://en.wikipedia.org/wiki/Top_Gear_(2002_TV_series)) Car of the Year, [*Fast Company*](https://en.wikipedia.org/wiki/Fast_Company_(magazine))\*'\*s Innovation By Design Award, and was named one of [*Time*](https://en.wikipedia.org/wiki/Time_(magazine)) magazine's 50 Best Inventions of 2011. Fisker was named one of the 10 Most Interesting People of 2015 by *The Drive*.[\[6\]](https://en.wikipedia.org/wiki/Henrik_Fisker#cite_note-jschultz-6) Goliath.com named him one of the 10 greatest car designers in automotive history, writing that he has created ""some of the modern masterpieces in the automobile industry.""

In 1989, Fisker began working at BMW Technik, the company's advanced design studio in Munich. His first project there was the E1 electric concept car. -  Henrik Fisker has been working on Electric cars since 1989, years before most people even knew about them.

From 1992 to 1997, he refined the Z07 concept car, which would become the BMW Z8 roadster, produced from 1999 to 2003.In 2016, at a press conference celebrating BMW's 100th anniversary, BMW CEO Harald Krueger named the Z8 as one of his three favorite BMW models in the history of the company.

&#x200B;

https://preview.redd.it/wr56rhy68w171.png?width=585&format=png&auto=webp&s=14be7fd7c99ed72b3d411ccfd34e8ca64b3cd35a

In 2007, Tesla Motors hired Henrik Fisker to perform initial design work on the Tesla Model S electric sedan, which was introduced in 2012.

Fisker stated in 2018 that, with the growth of car-sharing, ride-hailing, and autonomous shuttles, he believes within 10 years private cars will be used for less than half of what they are currently used for.

&#x200B;

## Fisker Automotive

In 2008, Fisker Automotive raised over $90 million from investors including venture capital firm Kleiner Perkins Caufield & Byers and actor Leonardo DiCaprio. In September 2009, Fisker Automotive was awarded a $528 million loan guarantee by the United States Department of Energy (DOE). The automaker was one of four recipients of the Advanced Technology Vehicles Manufacturing Loan Program, to encourage the domestic manufacture of electric cars. The funds were to be used to develop the Karma, as well as an affordable family-size plug-in hybrid car. The loan facility was frozen at $192 million in February 2012, after the DOE claimed that Fisker missed its milestones

In December 2011, just as the Fisker Karma was launched, its battery supplier, A123 Systems, recalled all batteries, followed by a second recall in 2012. A123 filed for bankruptcy in October 2012, leaving Fisker Automotive without a battery supplier. After selling approximately 2,000 units, production of the Fisker Karma was suspended in November 2012, in the absence of its battery supplier.

&#x200B;

https://preview.redd.it/59vfj5wa8w171.png?width=511&format=png&auto=webp&s=a1c03d1e1254fea00c195776122de2b26099dd35

Henrik Fisker resigned as chairman from Fisker Automotive in March 2013, because of disagreements with management about business strategy. Later that year, the company declared voluntary bankruptcy.Fisker raised and spent more than a billion dollars over its lifetime.The heart of Fisker’s business model was in that early deal with Quantum. The idea was to design a gorgeous car, and have suppliers like Quantum provide the technology because off-the-shelf parts from suppliers would help keep costs down.

But there were problems with this strategy: Sometimes, those parts had to be custom-made to fit the design vision, which resulted in higher prices for Fisker. Other times, parts were delivered late or, worse, faulty, but Fisker was locked in to those supplier relationships. Sources close to Fisker have also said that many of the parts were owned by the suppliers themselves, so Fisker didn’t own a lot of the internal technology.

The broker that raised funds for Fisker automotive, by selling their private shares, was Advanced Equities.It wasn’t until December 2011 and into 2012 that the more dubious efforts of Advanced Equities became clearer to Fisker’s hundreds of investors. The last few hundred million dollars of Advanced Equities’ fund raising for Fisker, starting with the D-1 round, was what brokers call “pay to play.” As Fisker was running into technical, delivery and political problems, its valuation was quickly declining. But the company still needed more money, so the brokers went back to its current investors and said: Unless you give this more, your current shares will be diluted and your preferred stock will be converted to common stock.

It was essentially a gun to their heads. This is why investor Wray sued Fisker in February 2012, alleging he was on the receiving end of this tactic. In his lawsuit, he says Advanced Equities sent him a letter dated Jan. 18, 2012, stating that he needed to decide if he wanted to invest in Fisker’s next round, and pay around $84,000 by Jan. 27, 2012 — a little over a week from receiving the letter. He also says that Advanced Equities assured him that he would have anti-dilution protection. According to the audio clip from Advanced Equities’ internal sales call in early 2010, Advanced Equity leaders say that the Fisker deal will “suffer no dilution,” and was “a dream scenario.”

That dream would soon end. In September 2012 after Fisker closed on $1.2 billion in funding, the bulk of it organized by Advanced Equities, the SEC charged the broker with misleading investors when it raised money for another company back in 2009 and 2010 (Bloom Energy). Advanced settled, agreeing to pay $1 million, and its co-founders were personally fined. Two months later Advanced Equities closed up shop.

Later, A123 Systems itself went bankrupt, causing more problems for Fisker. Fisker claimed that A123 Systems owed it $140 million, but a bankruptcy settlement reduced that to a paltry $15 million.

Then there was the just plain terrible luck for the ironically named Karma: Super Storm Sandy wiped out 338 of its Karmas in storage in New Jersey. The cars first drowned, and then caught on fire — salt water damage caused a short circuit that was spread to other cars by high winds, Fisker said at the time.

With all of this happening in public — and in a presidential election year — Fisker’s struggles became highly politicized. The company was mentioned numerous times in presidential debates and speeches leading up to the election. Republican nominee Romney called Fisker and other DOE-supported companies losers.

The company didn’t seem to invest substantially in technology innovation or tech IP, and seemed to spend a disproportionate amount on suppliers. For example, numerous sources have said that the company paid upfront for 15,000 of some of the parts for its planned 15,000 Karmas. It ended up only selling around 2,000 of the cars. It has also been said that Fisker paid some funds upfront to have BMW make engines for the 100,000 Nina cars it hoped to produce — in the end, Fisker didn’t deliver a single Nina.

Costs to build each Karma also creeped up because the company missed its volume targets, and because engineering had to change designs around supplier constraints. The company ended up adding $20,000 to its initial sale price.

Expensive hires may also have sucked away chunks of Fisker’s funding: Sources say that Fisker filled the upper levels of the company with seasoned auto executives from Detroit. At the high point of Fisker, the company had around 300 employees, plus dozens of contract staff. Bringing in a certain amount of the old guard could help a car startup ramp up quickly, and also impress potential investors with “industry names.” But those people are also used to big auto-industry budgets that included extensive travel and salaries — that’s the opposite life of a tech startup.

## Fisker Inc.

In July 2016, Henrik Fisker expressed interest in designing a fully connected electric car with autonomous driving features and an aesthetically pleasing look. He has pursued battery technology, and hinted at potentially reviving the Fisker name with a pure-electric vehicle using technology that nobody else has. Since then Fisker has talked about delays to the promised solid state battery technology, which he does not expect to be able to be produced in volume until at least 2025. Posing risk for competition from more scientifically experienced future solid state battery producers such as Quantumscape.

***Forbes:*** “Now he’s back–and three things are different. First and foremost, he has a vital new partner: his wife, cofounder and Fisker Inc. CFO Geeta Gupta-Fisker. Second, his Los Angeles-based company is public this time around, raising more than $1 billion in an October 2020 IPO. And finally, Fisker’s stock price, up 56% since its debut, has made both Henrik and Geeta billionaires, each worth about $1.1 billion as of Friday’s market close. The auto industry has seen father-son and sibling leadership teams, but Fisker Inc.’s CEO-CFO combo is the fast-changing sector’s first husband and wife power couple.”

Wealth isn’t the purpose of the new company, Henrik says. “I never got into cars because of money. (This shows he is willing to do what is in the best interest of the company because he is not motivated by money, unlike 99% of other CEO’s)

The couple sought a big stake in the new venture to ensure they can control its fate in a way Fisker couldn’t with his earlier company.

&#x200B;

https://preview.redd.it/yzhded6pfw171.png?width=408&format=png&auto=webp&s=54b30259720cf853a8efeacf058f2f74315260b9

Henrik is an auto industry celebrity, but Geeta’s background is equally impressive. A native of India, she holds multiple degrees in science, including a Ph.D. in biotechnology from Cambridge University where she was also a Research Newton Fellow. From there, she started a career in international investment for Lloyds Banking Group, and then managed investments for a high-net-worth client for several years. (In particular, this is insanely important - Geeta **KNOWS MONEY**! She knows how best to keep a company afloat, organize its share structure, provide value to shareholders, etc. because she has worked in the industry before. She may just be the most important element of Fisker Inc., due to the financial experience she has. At every step of the way, she is likely to make decisions with one sole focus - increasing share price and value).

She met her future husband in 2011 when he was visiting London, just before things started going very wrong at Fisker Automotive. They married in 2012.

“When I left Fisker Automotive, all I had was my car,” Henrik remembers. “I'm in a different position, mainly because of Geeta. Because she cuts the deals.”

To get the new venture off the ground, the Fiskers invested the majority of their life savings–an enormous financial risk given the fate of Henrik’s prior company. Then, just as they were locking in plans for the IPO back in July, they were hit by a highly unwelcome complication: Geeta learned she had early-stage breast cancer.

“She got the call (from her doctor) during a call with investors,” Henrik says. Despite that bombshell, she continued working with banks and investors in the weeks that followed, even as she underwent two surgical procedures and radiation therapy. Her medical therapy concluded in November.

Henrik, who marvels at her fortitude throughout the health crisis says, “she only missed something like one day of work...That's just how she is. She works tirelessly.”

## Fisker Ocean

The Fisker Ocean will have a nearly 300-mile range with an 80 kWh battery and a solar panel roof as a range extender, adding approximately 1,000 free miles of range per year. Advanced electronics will be housed under the hood, and the vehicle will incorporate recycled and sustainable materials throughout. Deliveries of the Ocean are scheduled to begin in 2022.

&#x200B;

https://preview.redd.it/s87j6bdsfw171.png?width=438&format=png&auto=webp&s=e40add9ce53319d31db242cce73a303afb03cbab

Fisker has also announced a partnership with Electrify America to ensure Fisker Ocean vehicles will integrate seamlessly with Electrify America charging stations when the e-SUV hits the market. With features such as a solar roof and recycled inner materials, it will be, according to Fisker Inc., the ""world's most sustainable vehicle.""

In 2017, Fisker Inc. announced that it had filed patents on flexible solid-state battery designs. Fisker expected the batteries to be produced on a mass scale around 2020. A prototype of the battery debuted at the Consumer Electronics Show in January 2018. In October 2018, Fisker announced new funding for battery development through Caterpillar Venture Capital. The solid-state batteries are intended to deliver longer vehicle range and faster charging times.

In 2018, Fisker was named to the board of directors of First Cobalt, a North American cobalt refinery that produces battery materials.

In September 2019, it was announced that Fisker Inc. was partnering with Game of Thrones actor Nikolaj Coster-Waldau, who will serve as a partner and sustainability adviser to Fisker, to work on advanced, affordable, electric mobility models.

&#x200B;

[In addition to being a well-known actor, Coster-Waldau is also the United Nations Development Program Goodwill Ambassador for climate change and other social issues.](https://preview.redd.it/3hssff5vfw171.png?width=451&format=png&auto=webp&s=ebe55e2468c5b63d1bc0ac3c71547219dff5afaa)

Nikolaj wrote this piece about Fisker:

To quote a friend of mine who is a lot smarter than me, architect Bjarke Ingels: “The idea that sustainability needs to sacrifice quality of life is a flawed one. It’s a design challenge, a challenge to build something that transforms the idea of sustainability into something that will increase the quality of life for all those around it.”

One person meeting that challenge is Henrik Fisker, who has designed some of the most iconic cars over the past decades for BMW and others, like the BMW Z8, Aston Martin DB9 and Aston Martin V8 Vantage. He’s a hero for gas-guzzling supercars. He is a fellow Dane, I am a fan, and we met, of all places, on Twitter.

When we met in person, he described his new project — an all-electric luxury SUV — and asked me if I would help spread the word on his car. The problem as I see it with most electric cars is that they only accomplish the basics. They get you from point A to B. They run electric so you don’t pollute while driving, but that’s it. They are basically unattractive combustion engine cars that have a battery thrown into them — and for most of them, a battery with a limited range. What Fisker does is to try to make every part of the car in a sustainable and attractive way, like a full-length solar roof, recycled floor mats and vegan leather seats. It looks incredibly cool and inviting, with a great 250- to 300-mile range, and at a cost of just under $40,000, it’s a luxury car affordable to a mass market.

I said yes and even became an investor, not only because it’s a great car but more importantly, I hope and believe it can inspire other companies to actively incorporate sustainability goals into all aspects of their business. Fisker then had the idea of calling me “sustainability” adviser. Which I am not. Just to be clear. Thanks Henrik, sounds cool, but I am an actor and a citizen, and that’s really it.

And what about Hollywood? Is our industry changing, are we at the forefront? Looking at social media, you would think so. And things are happening, but usually only when a camera is pointed at people. Remember a few years back when all awards shows only used EVs for the red carpet? We made a difference. We mattered. We showed the way. So cool. So green, so … brief. Now it’s back to the Escalade. But hey, we are not using plastic straws anymore!

To believe that change will come from Hollywood is not really based in reality (when did that stop us?), but we are great at reacting — and things around us are changing, and changing us. I have a good friend who loves his SUV. It’s not electric. But he cannot give up his car. He is a good guy, he’s works for the U.N., so if he has a problem going electric, we all do. But if he is presented with an alternative that doesn’t mean a reduction in his quality of life, something like the Fisker SUV, I think he’d transition to electric in a heartbeat.

The IPO deal values Fisker Inc at US$2.9 billion, with an IPO share price of $10.

On July 30, 2020, Fisker announced plans for a four-vehicle portfolio by 2025. The Fisker Ocean SUV will be joined by a sports sedan based on their previously announced Fisker Emotion concept, a coupe-like SUV, and a lifestyle pickup truck. All will be electric vehicles.

On October 15, 2020, Fisker Inc announced it would be outsourcing vehicle production of its Fisker Ocean electric SUV to Magna Steyr, to reduce the complexities and costs related to the building and operating its own factory. Magna will start building the Fisker Ocean in Europe in 2022.

Wikipedia:

Magna Steyr AG & Co KG is an automobile manufacturer based in Graz, Austria, where its primary manufacturing plant is also located. It is a subsidiary of Canadian-based Magna International and was previously part of the Steyr-Daimler-Puch conglomerate.

Magna International Inc. is a Canadian mobility technology company for automakers. Magna is currently investing heavily in AI, and Level 5 Automation. It is one of the largest companies in Canada and was recognized on the 2020 Forbes Global 2000.

Yahoo Finance:

Magna International Inc. designs, engineers, and manufactures components, assemblies, systems, subsystems, and modules for original equipment manufacturers of vehicles and light trucks worldwide. The company operates through four segments: Body Exteriors & Structures, Power & Vision, Seating Systems, and Complete Vehicles. Its Body Exteriors & Structures segment provides body and chassis systems, as well as engineering and testing services; exterior systems, including fascia and trims, front end modules, front integration panels, liftgate modules, active aerodynamics, engineered glass, running boards, truck bed access products, and side doors; and roof systems, such as modular and textile folding roofs, and hard and soft tops. The company's Power & Vision segment offers dedicated hybrid, dual and e-clutch, and manual transmissions; engine drive plates and accessories; AWD/4WD products, rear drive modules, and hybrid and battery electric drive systems; transmission, engine, and driveline components; advanced driver assistance systems, camera systems, ultrasonic sensors, and electronic controllers; interior and exterior mirrors, actuators, door handles, overhead consoles, and camera monitoring systems; head, tail, and fog lamps; signal and other lighting products; and latching systems, door modules, window systems, power closure systems, hinges and wire forming, and handle assemblies. Its Seating Systems segment provides seat structures, mechanism and hardware solutions, and foam and trim products. The company's Complete Vehicles segment offers vehicle manufacturing and engineering services. It also designs, engineers, and manufactures tooling products. Magna International Inc. was founded in 1957 and is headquartered in Aurora, Canada.

## Henrik Fisker Interview quotes:

I have people on Twitter saying, “Why don’t you just make the car next month? You have a prototype.” Most people don’t understand that it takes 18 months to do long-lead body tooling for high-volume vehicles. Most people don’t understand it takes two years to do durability tests and do all the engineering certification and everything else.

And on the business model itself, I believe that there is nobody in the near future or the next couple of years that’s going to make a million EVs on one model. Today, there’s nobody doing it. Tesla probably has the highest volume of one single model, a couple hundred thousand. But even the big giant established carmakers are not making, right now, a couple hundred thousand vehicles of one model. So the way you get volume, in my view, is if you partner up with other OEMs and share some of the expensive parts of the platform, which in my view is not anymore something that is unique IP or something that is a unique experience to the customer. An aluminum stamped floor or a steel stamped floor really doesn’t have any brand value anymore.

And obviously, as we move forward, we always start to do some of the things ourselves. But it was really about de-risking in our first vehicle to market. So we’re going to do another three vehicles, which we can do because we don’t have to spend all our money and effort on learning how to manufacture a car, for instance.

So we have programmed a lot. We have hired a head of ESG, environmental and social governance, and he is really spearheading developing specific... we kind of put out some goals that we would like to reach with suppliers, and we at least try to bring them in that direction. They are not reaching those goals right now, but they may reach them later. And then we have goals for ourselves. So for instance, we look at transport. Are we choosing a supplier that’s closer to the plant, or are we choosing a supplier that’s on the other side of the planet that way we have to then transport all that stuff. So those are the types of things that we’re really thinking about now as we’re nominating suppliers. And finally, materials as well, looking at sustainable materials. We’ve actually picked up a lot of knowledge on that side as well, where we are adding more sustainable materials to our vehicle. So we are actually looking across everything — supply chain, where the suppliers are located, what the suppliers are doing for sustainability, and also then of course in the vehicle itself — in terms of the type of materials there.

## [Investor Presentation](https://s26.q4cdn.com/943649897/files/Fisker-Company-Overview-April-2021-CLEAN-(FINAL).pdf)

***Key Points:***

Cash and cash equivalents as of Dec 31, 2020: approx. $1.0bn cash / $0 debt

*($1bn cash with a $3bn market cap is a sign of obvious undervaluation. One third of their share price is a solid floor of cash, meaning the ABSOLUTE LOWEST the share price could/should go, isn’t even currently that low - Huge margin of safety)*

**COMPANY STRATEGY**

▪ First design-forward, fully digital, asset-light, direct-to-consumer, ESG-focused OEM

▪ Key partnerships de-risk execution, ensure high-scale from the beginning, and enable a sustainably lean cost structure

▪ Strategy enables us to offer compelling vehicle pricing; equivalent to ICE and below EV competitors

▪ Internal R&D / IP focused on design, user experience, and enhancing base platform performance (electrical architecture / software, powertrain, structural safety)

▪ Continue to execute on financial targets, supported by partnership agreements

▪ Implementation of digital marketing strategy and brand-building efforts continues to drive growth in daily Fisker Ocean reservations and Fisker app downloads

**FISKER OCEAN: LAUNCHING NOVEMBER 2022**

▪ Building the World’s Most Sustainable Vehicle

▪ Vegan interior, recycled materials, optional solar roof

▪ Approx 250 to over 350 miles all-electric range

▪ Aluminum-intensive platform

▪ MSRP of $37,499- $69,900 USD

▪ Unique, flexible leasing model $379-$999 per month

▪ Targeting world’s most sustainable vehicle

▪ Recycled rubber from tire mfg. waste

▪ Eco-suede interior trim from recycled polyester

▪ Carpets made from fishing nets & bottles recycled from ocean waste

▪ Photovoltaic solar roof (see Patents section further below)

▪ Increases overall efficiency

&#x200B;

https://preview.redd.it/cqtx9r44gw171.png?width=592&format=png&auto=webp&s=d2681e033e5b1756ff0e98e3bb8a0e550500e855

▪ Magna incentivized for success of Ocean program through 6% equity stake through warrants

&#x200B;

**PROJECT PEAR WITH FOXCONN**

▪ Pricing starting below $30k, due to compressed development timeline and unique approach to bill of materials and logistics / manufacturing process

▪ Anticipated start of production Q4 2023. Targeted production of 250k vehicles per year initially, likely starting in US and expanding to China, Europe, and India

Wikipedia:

Hon Hai Precision Industry Co., Ltd., trading as Foxconn Technology Group and better known as Foxconn, is a Taiwanese multinational electronics contract manufacturer with its headquarters in Tucheng, New Taipei City, Taiwan.

Yahoo Finance:

Foxconn Technology Co., Ltd. produces and sells metal casings, parts, and components. It offers hand-held device casings and related components of devices, including feature phones, smart phones, laptops, tablet computers, consumer electronics, and digital cameras. The company also produces and sells metal parts and related machine components for automobiles and electric vehicles; thermal modules for system products, such as desktop computers, laptops, tablet computers, servers, smart phones, and game consoles; MIM related products; and consumer electronics components, as well as assembles and sells consumer electronics. In addition, it offers portable computer enclosures, mobile phone enclosures, and 3C product enclosures, as well as alloy products. Further, the company is involved in the research, development, manufacture, and sale of computer thermal module, computer components, and aluminum magnesium cases; investment and reinvestment activities; processing electrical board components; and manufacture and marketing of optoelectronics and computer cables, LED lamps and displays, smart light poles and others, computer cases, new alloy material, precision molds, electronic components, and portable computers and its components. Additionally, it researches, develops, produces, and sells aluminum alloy materials, rail vehicle components, car accessories, electronic components, structured metal products, metal containers, automobile parts, power plugs, wall sockets, micro ribbon connectors for terminals, etc., as well as aluminum alloy parts for automobiles and electronics. The company was founded in 1979 and is headquartered in New Taipei City, Taiwan.

Agreement with Pivet (Cox Automotive brand) for service, maintenance, logistics support.

Wikipedia:

Cox Automotive is an Atlanta-based business unit of Cox Enterprises, formed in 2014 to consolidate all of Cox's global automotive businesses, including Kelley Blue Book, Xtime, Autotrader.com and Manheim.

FAST-CHARGE NETWORKS & PLUG STANDARDS - US strategy: non-exclusive agreement with Electrify America to offer package rates to Fisker customers. Electrify America has announced it will invest $2 billion through 2027, primarily on nationwide EV infrastructure capable of 350+ kW

**FLEXIBLE LEASING STRATEGY:**

&#x200B;

https://preview.redd.it/8ij9y0p6gw171.png?width=610&format=png&auto=webp&s=32280091c2cde1f657336a114c8152262458b4a7

OCEAN TARGETING 8.8 MILLION UNITS

&#x200B;

https://preview.redd.it/l2t69888gw171.png?width=331&format=png&auto=webp&s=312cef1d929978cfe636a1587d89db2fd8dc480a

&#x200B;

https://preview.redd.it/0e51gwn9gw171.png?width=407&format=png&auto=webp&s=019c988c19893467fc2e33d0f2a5772d0744d437

**Fisker Flexible Platform Adaptive Design (FF-PAD)** \- FF-PAD is a Fisker proprietary process that allows the development and design of a vehicle to be adapted to any Fisker-qualified EV platform in the specific segment size. *It de-risks the business model and significantly reduces time and capital intensity associated with vehicle development and manufacturing engineering*.

Benefits / Proof-Points:

▪ Built drivable prototype in 7 weeks from receipt of platform data

▪ 29-month Ocean development timing (2-3 year savings)

▪ Magna architecture in development since 2018. Without FF-PAD, Fisker would have needed to be involved from that date.

Fisker targets 4 unique vehicle models on the market by 2025YE

MEDIUM-TERM OPERATING MODEL:

Targeting annual volume of 200,000-250,000 units by 2025 (under review pending finalized agreement with Foxconn)

Projecting mid-$50k Avg. selling price (ASP) at Ocean maturity (slightly below midpoint of price range)

Platform-sharing, contract manufacturing, outsourced service, digital sales / distribution, and organic marketing supports meaningfully lower OpEx spend vs. competitors.

&#x200B;

https://preview.redd.it/nwsnapjbgw171.png?width=323&format=png&auto=webp&s=3c77df631773ff49cbbc5811d8e113d04ba92653

&#x200B;

Thus concludes part 1 of my $FSR due-diligence. Hope you all enjoyed it so far,

NathMcLovin!",$FSR (Fisker Inc) due-diligence Part 1,,
