,created,fullname,post_id,subreddit,text,title,comment_id,parent_id
0,2021-05-28 02:55:18,t3_nmo5z2,nmo5z2,wallstreetbets,,Lambos or food stamps LFG 🚀,,
1,2021-05-28 03:04:32,t3_nmobeb,nmobeb,wallstreetbets,,Arrival finally ready to gap up Last chance is tomorrow.,,
2,2021-05-28 03:10:50,t3_nmoexo,nmoexo,wallstreetbets,,Expire tomorrow- ape want MOAR🚀🚀,,
3,2021-05-28 03:12:11,t3_nmofqj,nmofqj,wallstreetbets,"
[When we last left our hero,](https://www.reddit.com/r/wallstreetbets/comments/lrly28/the_legend_of_utheemperorofjenks_aka_ornamental/) he had just lost all of his rent money and what he could advance from credit cards on a failed Super Bowl bet, and a YOLO on “Rhodium” that he ordered from a sketchy Slovakian Wish.com ripoff. Alas, it was, of course, fake, and he was broke and depressed. It might have been the first fatal case of autism. He thought to himself “Am I really that retarded?” Then, he realized “No, it must be Oklahoma that’s retarded!”

So, [after a brief case of violent diarrhea from Oklahoma Grocery Store sushi](https://www.reddit.com/r/tulsa/comments/lrslbb/psa_do_not_eat_grocery_store_sushi_right_now/), he was ready to hatch his plan! Uruguay! Yes, Uruguay. [He was going to move to Uruguay.](https://www.reddit.com/r/uruguay/comments/lh5igx/c%C3%B3mo_se_puede_llegar_a_melo_desde_montevideo_sin/)

His plans for this move could’ve been anyone’s guess. One possibility he inquired about was [how to be a Tea Blendmaster.](https://www.reddit.com/r/findapath/comments/lfga0m/how_does_one_become_a_blendmaster/) [Another was him possibly reconnecting with God.](https://www.reddit.com/r/Jewish/comments/lsij6j/agnostic_jew_seeking_faith_in_god/) Yet, he seemed to be asking questions about another topic more often than the others...

[Bees.](https://www.reddit.com/r/uruguay/comments/lxcnt1/c%C3%B3mo_es_la_legalidad_de_la_apicultura_informal/)

Specifically, beekeeping, a topic he admitted he had no experience in, [as evident from him looking for any book on the subject as an introduction months before.](https://www.reddit.com/r/Beekeeping/comments/l6r6y1/best_popular_science_books_about_bees/)

What he planned on doing with the bees was anyone’s guess, and I doubt he thought it through that much either. One post **AFTER** he took possession of 200,000 bees (we’ll get to that later,) was [asking Americans if there was a demand for mead in the states.](https://www.reddit.com/r/Beekeeping/comments/l6r6y1/best_popular_science_books_about_bees/) So, was he thinking of importing Uruguayan honey to the US to be made into mead? Was he going to make it himself? Did he move to another continent for no reason? Let’s all find out!

A little more than 2 months ago, he finally did it. [He moved to Uruguay.](https://www.reddit.com/r/uruguay/comments/m9ejpn/la_paloma/) And about a week after that, [he was driving a truck filled with 200k bees across his new country.](https://www.reddit.com/r/Beekeeping/comments/mfu9r1/transporting_200000_bees_across_uruguay_is_the/) Based on replies in that thread, he was aiming to have [a monopoly on beekeeping in the country.](https://www.reddit.com/r/Beekeeping/comments/mfu9r1/transporting_200000_bees_across_uruguay_is_the/gt48gke/) 

And for a while, things were kind ok for our young Autist. [He picked up his hives without complication.](https://www.reddit.com/r/Beekeeping/comments/mtkkf3/about_to_upsize_my_apiary_whats_the_best_layout/) [And then he settled into Melo, Uruguay, and set up his apiary ](https://www.reddit.com/r/Beekeeping/comments/n1jnte/my_humble_apiary_near_melo_uruguay/). Life was good.

But, trouble was afoot. According to a reply, [the species he was planning on keeping had literally never been kept by keepers in Uruguay.](https://www.reddit.com/r/Beekeeping/comments/mtkkf3/about_to_upsize_my_apiary_whats_the_best_layout/gv0viej/) And then, disaster struck. [He went to TIFU to post his tale of spreading an invasive species in an industry he knew nothing about.](https://www.reddit.com/r/tifu/comments/nmd69k/tifu_by_importing_bees_to_uruguay/)

Indeed, he had no idea even what a bee was until he stumbled his way through a book, and then decided to YOLO into honey in Uruguay. He somehow got in touch with an ecology professor in Montevideo that would help him set things up in exchange for grad students fucking with them every now and again. Oh, and the bees were from fucking Myanmar. Handshake agreement, of course. Total Chad move.

And like I said before, the rest went without incident for a while. It would take the bees “a year” to make honey, so he just kinda hung out, stayed busy, and tried to find part time work in a foreign country he arrived in 2.5 months earlier.

And then, the professor ghosted him. Just disappeared. Shortly thereafter, government agents come out about this kid from Oklahoma illegally importing a non-native bee to their country. Apparently his bees had been fucking with other apiaries. So, he did probably the smartest thing he’s ever done.

He ran.

He fucking ran from the Uruguayan government, took a plane to LAX, and arrived with $14 to his name. His friend sent him $100, which wasn’t enough to go back to Oklahoma, so he took a $75 flight to Seattle, where he is also not from.

His last post is from a train out of the airport, with $39 to his name. I don’t know what is in store for him, but I know that $39 is as good as spent on urchin futures or whatever market he’s going to crash up there.

God speed, /u/TheEmperorOfJenks. May your future YOLOs be just as retarded as the others",The Legend of /u/EmperorOfJenks aka “Ornamental Gourds Futures Guy” continues (Part 2),,
4,2021-05-28 03:12:37,t3_nmofz4,nmofz4,wallstreetbets,"This started as a comment reply but I thought maybe people would like reading it. I've been researching Palantir since literally late November 2020 and I have nearly my entire portfolio in LEAPS expiring January 2023. So I have continually done more research on them this is just the basics to clear up confusion and help people who don't understand it because it's hard to hear all the hype and stuff. Also AMC to the moon tomorrow for my FDs I bought!! Don't judge me it's just fun to be in on the action on weeks like this.


So you should think of palantir as basically three companies and they actually are very far from unprofitable. 

They developed the really massive government software (gotham) specifically as a result of an interaction that happened to Peter Thiel while he was at paypal. They were losing millions to foreign scammers at paypal and the solution ended up being a high quality algorithm that flagged the most likely scam transactions and then allowed analysts to efficiently double check and verify the real scam transactions.

 It essentially was using what computers are efficient at (sorting through massive amounts of data) and then combining that with what humans are good at (looking at the more complex nuances that at least at that point computer algorithms were incapable of doing) and augmenting the humans ability to make complex decisions by rapidly sorting through the incoming data and bringing everything good to their attention.

They fixed paypals using this method and literally made the company profitable overnight because of fixing how much they were losing in the scam transactions. The FBI contacted PayPal and Thiel about using that initial software. That was literally his inspiration for what would become Palantir. He goes over it in huge detail in his book zero to one. If you make an audible account you can read it for free and find the chapter I'm talking about.

Then for 15 years they perfected the government software into the absolute nearly monopoly it is now in government intelligence augmentation software. The whole time though they reinvested almost everything for the last 10 years into building the commercial software (Foundry). That side of the business has only been live for a VERY short time and initially they literally didn't spend a single dollar on marketing their first commercial clients sought THEM out because of their insane reputation with the government. Foundry helps with supply chains and all kinds of other important data  insights. But if you want a recent example the NIH and the NHS both used Foundry to figure out how to best distribute the vaccine and vaccine distribution in the US and Britain has far outpaced expectations. You think commercial companies aren't going to be interested in using the software that was literally proven on a level like that?

 They're only just now adding huge amounts of people to their sales teams literally in the last six months which if you read Peter thiels book is insane for the stock because they have this crazy long term plan and he literally talks about how when they get to a certain point and start adding sales as a full sector of the company it means that is the company the company plans to BEGIN scaling. Meaning they're this big and they literally only just started on the scaling part. Which they've also said in tons of interviews if you're a die hard Palantirian like me. 



They actually also have the third side of the  business which is their actual like full AI for weaponization and war and defense for the government. Gotham is like helping analysts and commanders lead and even helping police or agents figure out what's going on. This other software is different. It's called Apollo and its only at the beginning too. It's like pure AI machine learning AI handles everything stuff. Go find a video called pentagon head of NSC briefs public on AI I think it's on the PBS channel on YouTube or some shit. Or you can listen to Joe Biden talk about how we're going to double our percentage of gdp spending on AI. The amount of government money that's going to go into AI as a weapon to compete with China DWARFS peoples expectations of how much large the market for the kind of software palantir makes is. 

https://www.businesswire.com/news/home/20201001005334/en/U.S.-Army-Research-Lab-Selects-Palantir-Technologies-Inc.-for-91M-Artificial-Intelligence-and-Machine-Learning-Development

This is literally the backbone of everything AI that the government is about to invest in. Sure they're going to experiment with other research but if you do research you'll also find Palantir is the ONLY company that does anything remotely like this software that has anywhere near the kind of clearances like what is required for these contracts. They are currently a clearance level 5 and about to be the highest 6. The closest competitors are almost all a 3 or lower I'm not even sure if there's more than a single 4 and that stuff is crazy hard to get. 

But like again I'm an obsessive. I realize why people get so excited about the commercial side scaling and how it's very possible and can make them huge and it will. But I'm actually pretty sure the reason people like Cathy Wood has such a huge boner for them is that she realizes how MASSIVELY. And I mean MASSIVELY underestimated the amount of government revenue they will get from all this AI investing the United States and NATO are about to do. It's literally the next Manhattan project and they're absolutely going to be one of the biggest players developing it if not the biggest. I think it's funny because most people are pretty disinterested in the government stuff for Palantir but i really think the weaponized AI apollo stuff may be as big as anything could ever be. 




Also people got the insider selling stuff very very wrong. Tom Nash (love him or hate him I don't care) has a few really good recent videos where he explains it in basically full detail what was happening. The selling panicked a lot of retail investors during a time when the buying for growth markets had really slowed because of rate hike due to inflation scares and a ton of retail holders got scared and caused more selling and more people got scared because of that and sold and it really just was mass psychology in effect and a LOT of FUD and confusion. 

Basically a few executives karp in particular got billions of dollars worth of options that vest but literally expire so you have to exercise them which means you buy shares of the company at a strike price. Well because it's the company granting shares the strike price is literally 10 cents or something and these automatically have to vest at quarterly increments. So everytime karp was exercising he's actually buying shares. Like over 150 million in total maybe a lot more million SHARES not dollars. shares. And even those when he exercising he's buying shares technically from the company it ALL counts as profit on taxes and ITS NOT LONG TERM CAP GAINS ELIGIBLE. So over the last year plus this year he's essentially getting shares but the literal dollar value of those shares to the government counts as pure profit. So his total income which he's getting taxed at 40% of is in the BILLIONS yes billions. Because that's a lot to handle people that work for them actually automatically schedule sells of shares to cover the taxes so that there's no issue it's not even like him saying sell today and they do this.... TO AVOID ANY POSSIBLE ACCUSATION OF INSIDER SELLING TO THE SEC. That's why it's automatically happening so no one can ever claim he's timing it. 

So listen cause here's where it gets important. The exercising of the shares counts as almost pure profits but remember he's receiving SHARES not dollars he doesn't actually get billions of dollars. So has to then sell SOME of the shares so he can pays taxes on that. Then when he sells the shares to pay the taxes for exercising he actually owes even more money if they went up from when he exercised. So everytime he's selling low its actually good for him because it's less ADDITIONAL PROFIT that he would owe taxes on.

 If he wasn't selling its because he thought it would go down even further and then he would actually owe less taxes overall. So if he thought it was going to tank he'd wait and actually get a nice fat discount on his taxes. 

I know this seems really crazy but I promise that's how it works you can look it up in detail but yeah shocking that mainstream media and redditors/youtubers who barely do research and have no real understanding of how these billion dollar compensations work would get it wrong. Unbelievable I know. If he had actually sold the massive overall percentage of his shares that some people claim he did the company would be at like $3-6 dollars not low 20s. Retail got confused because of market pressured due to interest rate fears from inflation and sold low (like retail always does) to institutions.","Palantir DD if you want to understand company and it's history better (also insider ""selling"" explained in detail)",,
5,2021-05-28 03:17:26,t3_nmoit0,nmoit0,wallstreetbets,"This isn’t what you think. I’m not going to pitch a shit short interest play or prattle on about some pipe dream. No. I’m going to introduce you to an ultra-high-risk micro-cap play that, very well might be on the precipice of greatness.


What is Blue Apron?


Blue Apron (NYSE: APRN) was the forgotten step child, bad luck Brian, IPO of summer 2017 that priced below range and had the misfortune of debuting after Amazon bought Whole Foods. Since it’s debut, the stock has suffered dropping from nearly $150 per share (adjusted for a 2019 reverse-split necessitated to stay listed) to as low as approximately $2.00!


Why the Drop?


Management. Fucking. Sucked. The prior executive team essentially handed Chad Hello Fresh the keys to the kingdom, when they made the fatal error of betting that the “high affinity core users” would be enough to sustain the business. For this reason, they cut marketing to nearly nothing and attempted to realize operating leverage by shrinking the customer base only to its most prolific buyers.

This was stupid. HelloFresh did the opposite, essentially giving away meals, and they used it to stockpile market share. Put a chart up of HelloFresh customers against Blue Apron. You’ll see the two lines converge and a clear indication that HelloFresh stole most of their business. HelloFresh was one of the best trades of the past 5 years. Look at the chart, look at the sales, and look at the margins. They have managed to achieve operating leverage by employing affordable pricing and emphasizing retention.


Blue Apron Might Go Under....


Today the company is in a dire place. Languishing away in Micro Cap hell at an $80M market cap, no one on Wall Street wants to cover these guys. Only their bankers, CG and MS, write them research and neither are overly optimistic. They’re in a shit spot with a credit line that mandates they keep $15M cash at all times, and they keep their customer base above 300K (thus far, they’ve struggled). They’re sitting on $29M and burn enough cash per Q that they might go below that $15M level (wouldn’t be a first). All signs are negative...


But I Think They Might Win


Blue Apron is under new management. Linda Kozlowski, is the former COO of ETSY and an ex-strategist at Alibaba. She believes HelloFresh did things right and she wants to right the ship. Her ballsy-ass plan is to ride the line on cash and go all in on customer growth. She realizes those customers are worth a lot more than income on the P&L, and that she needs to make the pot as big as she can. Thus far, it’s worked. Customers are up over 20% in the past two periods and retention rates are rising. We are seeing signs of operating leverage, and it opens a big possibility.


My Prediction

Management is buying shares. They know the company is not healthy. The only logic is that they have a plan that’s working. You can’t sell a dying business with a shrinking share, but you can certainly sell a growing community, that could be an accretive asset to a better capitalized entity. I think Linda is going either get the business in a position where it can refinance for better terms, or where it can be sold to create shareholder value via a strategic alternative.

If that happen, given this is priced for bankruptcy and ignored by the Street, the returns could easily reach the triple digits. I’m long and I plan to add on additional weakness.

Disclosure- I’m buying a stock that might go under. This is not advice! I’m stupid.",Blue Apron: Hero or Zero,,
6,2021-05-28 04:18:34,t3_nmpjt2,nmpjt2,wallstreetbets,,"I got 90% profit with amc in korea. (Red is profit, Blue is loss)",,
7,2021-05-28 04:19:12,t3_nmpk6k,nmpk6k,wallstreetbets,,AMC GME Meme 🚀🌕,,
8,2021-05-28 04:29:06,t3_nmpq6d,nmpq6d,wallstreetbets,"Issue a bonus rights issue which is issued as a token on the new NFT platform. Only those who hold real shares can get the GME coin. Synthetic longs would be exposed, create a short squeeze while still being able to raise funds through the bonus issue

&#x200B;

When OSTK did this their shares went to triple digits.

&#x200B;

Adding extra text to get around the dumb robo script which wants to check length. It also wants to check against brevity. Further it is synonymous with red tape. It would actually just want to cut ribbons than get on with it.",What if GME does a OSTK.,,
9,2021-05-28 04:40:59,t3_nmpxc1,nmpxc1,wallstreetbets,,Today was fun tomorrow gonna be amazing,,
10,2021-05-28 04:42:34,t3_nmpybo,nmpybo,wallstreetbets,,"UWMC $200k YOLO update, LFG",,
11,2021-05-28 04:45:41,t3_nmq05j,nmq05j,wallstreetbets,"So this is something I can't figure out and I'd really appreciate it if someone helped me understand.

Everyone is talking about how the squeeze didn't even happen and the shorts didn't cover yet. What I don't understand is why wouldn't that be possible? If short interest is 17%, so let's round up to about 100M shares. Today the volume traded was 700M shares. Couldn't 100M of those 700M have been the shorts covering? And if they didn't cover, today alone 700M shares were traded, why would 100M shares bought by shorts cause a squeeze if today 700M were traded?

I have been having this question for awhile, since I noticed the same with GME. In the days preceding January 28th (when GME reached its peak), the combined volume was several times the amount of float. How come the squeeze happened and why did it happen? If the volume was so high, couldn't the shorts have covered in the days preceding that?

I hope this makes sense and I really hope someone will be kind enough to explain a fellow retard who only knows about crayons what this all means.

P.s. FUCKING HODL AMC 🚀🚀🚀💎💎💎👋👋👋",Genuine AMC question (related to any short squeeze),,
12,2021-05-28 04:51:18,t3_nmq396,nmq396,wallstreetbets,,$AMC +$208K. Still not selling,,
13,2021-05-28 05:06:57,t3_nmqbu4,nmqbu4,wallstreetbets,,$MVIS added to MSCI Small Cap Indexes,,
14,2021-05-28 05:19:45,t3_nmqiy2,nmqiy2,wallstreetbets,,Just a retarded 🦍over here eating crayons 🚀💰#roaringkittywannabe#citadel#nomercy,,
15,2021-05-28 05:28:43,t3_nmqo0s,nmqo0s,wallstreetbets,,AMC as early as 01/27/2021 💎 🤲 🦍 🚀 🌙,,
16,2021-05-28 06:07:12,t3_nmr8jv,nmr8jv,wallstreetbets,,DFV rallying the troops,,
17,2021-05-28 06:16:27,t3_nmrd7x,nmrd7x,wallstreetbets,,Been holding AMC since April 2020.,,
18,2021-05-28 06:35:13,t3_nmrmft,nmrmft,wallstreetbets,,Tesla Will Have to Ship Its Texas-Built Cars Out of State to Sell Back to Residents,,
19,2021-05-28 06:56:34,t3_nmrwom,nmrwom,wallstreetbets,,$AMC gainz. Now I can pay my rent this month,,
20,2021-05-28 07:08:27,t3_nms2wz,nms2wz,wallstreetbets,"On the 22nd SPCE completed the first of its 3 planned test flights to space.
Everything looked to have gone off successfully. We are now waiting on the data and craft to be analysed and inspected. This will take a few weeks according to Michael Colglazier.
That being said he had already outlined the test schedule in the earnings zoom call.

1st test flight - may 
2nd crewed flight - June 
3rd flight with R Branson on board late June/July 

4th flight this will be taking the Italian airforce on a training mission (600k a seat) late July


On the run in to the first test flight some possible maintenance issues appeared with the carrier plane White knight 2…. 
This indeed could have gone either way , after 2 weeks inspections it was decided that WK2 did not need to delay testing no maintenance was needed at this point. Scheduled Maintenance will commence in the fall after all tests have been completed.
Upon this news it is my opinion that the testing programme will go ahead as planned.

The market has responded accordingly and the stock is now up from $17-€31

With all these catalysts lined up before the end of the year and commercial operations looming for early 2022 things are looking up for Virgin Galactic.The success of the last test flight the company have now proven tech and concept. 
Also with revenue now coming in Nasa who are conducting micro gravity analysis.
Also international training for military pilots and astronauts.
Commercial flights look imminent.
Space ports planned for around the globe and intercontinental travel looming.

The future is bright, The future is SPCE",SPCE - we have achieved launch,,
21,2021-05-28 07:30:02,t3_nmsdln,nmsdln,wallstreetbets,,When hyperinflation comes into play in this inflated market buy puts on TLT bond interest rates increase prices of bonds drop especially long term. Profit off of the upcoming Q4 disaster,,
22,2021-05-28 07:41:06,t3_nmsius,nmsius,wallstreetbets,,BB yolo,,
23,2021-05-28 08:01:49,t3_nmssja,nmssja,wallstreetbets,,"Great intro to options aka “if you want to know how many shares your option makes profit off, thats delta”",,
24,2021-05-28 08:12:48,t3_nmsxye,nmsxye,wallstreetbets,,I lost so much money this year...Only thing saving me is vix...,,
25,2021-05-28 08:43:54,t3_nmtcr3,nmtcr3,wallstreetbets,"Is it time to pick some juicy berries? 🍇

I had a look at $BB and assume that we finally formed the bottom. In the last few days we saw a sharp rise which might continue in the next weeks. If we can break the 12$ resistance, the next targets would be aroung 25-28$. 

Using Elliot wave theory we are probably at the end of the correction wave 4 and now began with the bullish wave 5.

Price targets:

\#1 12$

\#2 25$

\#3 48$

The risk/reward is worth entering a trade here. I bought yesterday around 10$. My stop loss is below 8$.

&#x200B;

*This is no financial advice - I am just sharing my opinion. Please do your own due diligence!*

https://preview.redd.it/0fjc5w98pt171.png?width=1518&format=png&auto=webp&s=cf262736c8f4fe448bc881acdd345a1c5747496f",$BB | Technical analysis | The bottom has fully been formed. I assume that we see a similar price action soon,,
26,2021-05-28 08:53:19,t3_nmthag,nmthag,wallstreetbets,,Welp. I’ve been selling CC’s on my GME to bring my cost basis down since January. I knew this day would happen lol. Sold 2 calls at $6. Now worth $69 out of all numbers.,,
