,created,fullname,post_id,subreddit,text,title,comment_id,parent_id
213,2021-05-29 13:20:35,t1_gzvabec,,wallstreetbets,Huge fan of soup myself. Can't go past a hearty vege stock,,gzvabec,t1_gzsyhaa
214,2021-05-29 13:20:36,t1_gzvabgc,,wallstreetbets,Thanks,,gzvabgc,t1_gzva17q
215,2021-05-29 13:20:40,t1_gzvabnp,,wallstreetbets,Interesting,,gzvabnp,t1_gzv8tuy
216,2021-05-29 13:20:40,t1_gzvabns,,wallstreetbets,"Hey bro, let me tell you how this will work. 

The fundamentals here are fucking terrible. I mean this is just a terrible financial situation. I’ve honestly never even seen a gat damn amc movie theater in my life. 

But let me tell you what’s going to happen. The stock will go back down, closer to your average costs basis. You might kick yourself a bit, ahh coulda had more profits. “But I’m a hodler”. Sure. Now, it’ll go up again. And it’ll get really close to that previous peak but it’ll be a bit off. But you still won’t sell. “You’re an ape, together strong the ape”. But that shit fucking tanks again, but a little bit quicker this time. But it doesn’t drop below your cost basis. “You’re a smart stinky fucking ape”. 

Then it happens. Fucking no major price action upwards for a month or two. The stock hovers above and below your costs basis. “You’re a safe ape” Then, one day. It breaks the fuck out. But it’s well below the all time highs. Well below.

It starts to drop again. “Ape hands, they get sweaty. Ape tired. Ape getting weak.” And it keeps dropping. Way past your stupid fucking cost basis. “Hedgies took ape money” but “damn dirty ape had it coming”. The executives in the company you “believe” in made as much money as the “hedgies”.

Wanna know a fun fact, hedge funds performed the best they ever did in 2001/2002 because so many stupid “loves to give away ape and family money retail investor apes” decided they could beat the system. They had dreams. But they crumbled. Much like AMC theatres will when they can’t afford renovation costs due to an inability to even cover the interest on their massive debt load.

And you don’t think the “you buy, I buy, we all hold” movement is splintering? It’s the dumbest and most insane shit I have seen. And you know what I think, the hedge funds are driving this insane movement. They saw what happened with GameStop and they are going to TAKE ADVANTAGE of “retail ape”. They did in the dotcom bubble. They fucking smothered retail investors. They killed them. And they will again. 

You aren’t special and nothing about holding a company with a broken business model is respectable. 

I really don’t want to see you lose money. I don’t want a single retail investor to lose money. But let me tell you something my man, those big posts you see, how do you know they aren’t the hedge funds? Seriously, it’s unreal. Unreal. They literally paid people for high karma WSB accounts when the GameStop thing first happened. The offers were insane. The hedge funds have taken over and are now manipulating retail investors “into damn dirty ape fools”.

Don’t be that fool my man. Be happy you stole money from those hedge fund cucks. But don’t let them take you down. Godspeed brother. I want you to make money.",,gzvabns,t3_nnmw82
217,2021-05-29 13:20:42,t1_gzvabrn,,wallstreetbets,Because u know nothing about investments and you created this account to manipulate sentiment. You sir are a dummy. Tell your wife she is not good enough for me.,,gzvabrn,t3_nnnav4
218,2021-05-29 13:20:44,t1_gzvabwi,,wallstreetbets,Thanks!,,gzvabwi,t1_gzudb7m
219,2021-05-29 13:20:47,t1_gzvac3o,,wallstreetbets,BRUTAL,,gzvac3o,t1_gztuex4
220,2021-05-29 13:20:48,t1_gzvac59,,wallstreetbets,"You don't mean ""he used 'their' incorrectly. 

You mean ""he used the word 'their' incorrectly"".

Bad grammar.

Now turn that gun around , fair is fair....",,gzvac59,t1_gzv74bm
221,2021-05-29 13:20:49,t1_gzvac78,,wallstreetbets,I think I may be onto the next hot idea: winning the approval of *other people’s* fathers. It’s like a whole new flavor of cucking.,,gzvac78,t3_nn680g
222,2021-05-29 13:20:53,t1_gzvacfp,,wallstreetbets,"I am a paleoconservative political scientist.  Your defense on using a long post does not make you intelligent.  You probably will look up that word.  Eisenhower crushed the last great paleo Senator Taft, President Taft's son.

We should stop donating to countries abroad,  Are you part of the military industrial complex?",,gzvacfp,t1_gzv9xoc
223,2021-05-29 13:20:56,t1_gzvackh,,wallstreetbets,Everyone call Mad Money on Tuesday and ask Jim Cramer about AMC Nothing Else.,,gzvackh,t3_nnmw82
224,2021-05-29 13:21:02,t1_gzvacxb,,wallstreetbets,Remember any FUD playing Movie Apes against Vidya Apes is HF propaganda.,,gzvacxb,t1_gzunxic
225,2021-05-29 13:21:07,t1_gzvad75,,wallstreetbets,What conspiracy? There are literally hundreds of articles written about Pantir's human rights record,,gzvad75,t1_gzva9tm
226,2021-05-29 13:21:15,t1_gzvadkz,,wallstreetbets,"Hey guys,
While NOK was a failed meme stock in January, it is a legitimate short squeeze opportunity right now. There are 4.6 billion shares floating right now. This means we can cause a short squeeze if we all buy in on Tuesday once the markets open. Let’s make the big men pay for shorting a stock to the ground. 
Sincerely
Retard",,gzvadkz,t3_nn680g
227,2021-05-29 13:21:19,t1_gzvadtc,,wallstreetbets,My man,,gzvadtc,t3_nnmw82
228,2021-05-29 13:21:25,t1_gzvae66,,wallstreetbets,"Your submission has been removed because it appears to be a screenshots, not a direct link to the article.

It's important to link directly to the article so that readers can contribute to the discussion in an informed manner.

If possible, please try and avoid paywalled articles, use a service like [archive.org](https://archive.org/) or [archive.is](http://archive.is/) to bypass it. 

*I am a bot, and this action was performed automatically. Please [contact the moderators of this subreddit](/message/compose/?to=/r/wallstreetbets) if you have any questions or concerns.*",,gzvae66,t3_nnndfz
229,2021-05-29 13:21:25,t1_gzvae6l,,wallstreetbets,Yeah have had APHA for years and trulieve. I was here January but couldn’t comment just followed. Held the bag for the previous amc move,,gzvae6l,t1_gzv9uku
230,2021-05-29 13:21:26,t1_gzvae74,,wallstreetbets,"News posts **must be market moving** and contain **new** information. Please avoid editorializing the title. 

If your post doesn't meet the requirements above, please delete the thread before a mod sees it.

*I am a bot, and this action was performed automatically. Please [contact the moderators of this subreddit](/message/compose/?to=/r/wallstreetbets) if you have any questions or concerns.*",,gzvae74,t3_nnndfz
231,2021-05-29 13:21:30,t1_gzvaefc,,wallstreetbets,"☺️ty

*sips*",,gzvaefc,t1_gzvaa96
232,2021-05-29 13:21:41,t1_gzvaf0u,,wallstreetbets,"Sell GME premarket: Jail!  
Sell GME aftermarket: Believe it or not, also jail!  


We have the best GME rules on the internet.",,gzvaf0u,t1_gzuleaw
233,2021-05-29 13:21:42,t1_gzvaf50,,wallstreetbets,Absolutely sir,,gzvaf50,t1_gzvaasy
234,2021-05-29 13:21:45,t1_gzvafa0,,wallstreetbets,I’ll see your 2% drop buyers and raise you top buyers after 33% rip.,,gzvafa0,t1_gzva9xx
235,2021-05-29 13:21:48,t1_gzvafg0,,wallstreetbets,Do VSTO brands sell better than others lately (OLN I guess)? Thanks,,gzvafg0,t1_gzuet09
236,2021-05-29 13:21:57,t1_gzvafyv,,wallstreetbets,BB 🚀🚀🚀,,gzvafyv,t3_nnb4d1
237,2021-05-29 13:21:59,t1_gzvag3c,,wallstreetbets,Crazy how dumb the average person is in comparison to the smartest people - a big gap in intelligence parity,,gzvag3c,t3_nn680g
238,2021-05-29 13:22:06,t1_gzvaggs,,wallstreetbets,I put a 💍 on GME’s finger. I’ll hold ‘til I’m a fuckin skeleton,,gzvaggs,t1_gztmk9d
239,2021-05-29 13:22:21,t1_gzvahay,,wallstreetbets,Pedialite,,gzvahay,t1_gzv73nk
240,2021-05-29 13:22:21,t1_gzvahb6,,wallstreetbets,"Rule 204 of Regulation SHO ""requires firms that clear and settle trades to deliver securities to a registered clearing agency for clearance and settlement on a long or short sale in any equity security by the settlement date or to take action to close out failures to deliver by borrowing or purchasing securities of like kind and quantity by no later than the beginning of regular trading hours on T+4 for short sale fails""  


So what's all the hubub about share counts? Seems like a retard's conspiracy theory.",,gzvahb6,t3_nn680g
241,2021-05-29 13:22:21,t1_gzvahc5,,wallstreetbets,"Dude I put my cock in men’s tight anus like yours



Sad life u live",,gzvahc5,t1_gztlma6
242,2021-05-29 13:22:22,t1_gzvahd8,,wallstreetbets,"Unrealized gains - $0 gains

Unrealized losses - $0 gains


Enjoy being poor by never selling and only buying and holding. This applies to any and all stock positions.",,gzvahd8,t3_nn680g
243,2021-05-29 13:22:28,t1_gzvahpk,,wallstreetbets,![gif](emote|free_emotes_pack|sweat_smile),,gzvahpk,t1_gzv9if7
244,2021-05-29 13:22:29,t1_gzvahqo,,wallstreetbets,"did u/competitive_bunny even sleep last night?

Also, old reddit is weird to be in now. Reminds me of high school lmao.",,gzvahqo,t3_mrzztb
245,2021-05-29 13:22:29,t1_gzvahqt,,wallstreetbets,I don't give anybody happy endings.,,gzvahqt,t3_nnmssw
246,2021-05-29 13:22:37,t1_gzvai6y,,wallstreetbets,No,,gzvai6y,t1_gzva1xi
247,2021-05-29 13:22:54,t1_gzvaj5p,,wallstreetbets,"Some people are literally retarded.

But at least you can profit from them. Long MA, V",,gzvaj5p,t1_gzva73o
248,2021-05-29 13:23:01,t1_gzvajka,,wallstreetbets,🙋🏻‍♂️,,gzvajka,t1_gzva8ck
249,2021-05-29 13:23:04,t1_gzvajrs,,wallstreetbets,It’s why we have loss porn,,gzvajrs,t1_gzvag3c
250,2021-05-29 13:23:09,t1_gzvak1q,,wallstreetbets,💩,,gzvak1q,t1_gzumyyh
251,2021-05-29 13:23:10,t1_gzvak37,,wallstreetbets,"Wait, I can't remember, is AMC a stock that's traded on wall street?? Asking for my 9 week old friend here. 🤡",,gzvak37,t1_gzumj0h
252,2021-05-29 13:23:16,t1_gzvakgl,,wallstreetbets,Was that Theon Greyjoy?,,gzvakgl,t1_gzutlis
253,2021-05-29 13:23:17,t1_gzvakif,,wallstreetbets,"Thanks for the reply, yeah I’ve already heard how bad options can be depending on your research and instinct. Will definitely be smart about all of this moving forward. Have a great day!",,gzvakif,t1_gzugish
254,2021-05-29 13:23:18,t1_gzvakjd,,wallstreetbets,"So your response offers no actual rebuttal to the things that i said.

Yeah, that sounds about right...

Have a nice life",,gzvakjd,t1_gzvacfp
255,2021-05-29 13:23:18,t1_gzvakk0,,wallstreetbets,"It's always an account with two words, and a 4 digit number at the end. Only one post, a few karma, and a couple comments.


Sorry, pal. Go fuck yourself.",,gzvakk0,t3_nnnav4
256,2021-05-29 13:23:19,t1_gzvakle,,wallstreetbets,hi bot,,gzvakle,t3_nnnav4
257,2021-05-29 13:23:20,t1_gzvakor,,wallstreetbets,Read the facts sir. There are hundreds of articles about Palantir. You're probably a Palantir bot.,,gzvakor,t1_gzvaao8
258,2021-05-29 13:23:25,t1_gzvakys,,wallstreetbets,AMC GME both suck !!! Rocket to the moon. Let’s see if we go to jail now baby.,,gzvakys,t3_nngzpg
259,2021-05-29 13:23:26,t1_gzvakzw,,wallstreetbets,Could be.  I'm sure It's GOIng tO Be diFFereNT ThiS TimE.,,gzvakzw,t1_gzvafa0
260,2021-05-29 13:23:28,t1_gzval3n,,wallstreetbets,Don’t end a good thing,,gzval3n,t1_gzvabrn
261,2021-05-29 13:23:28,t1_gzval3q,,wallstreetbets,I'm brand new on here. Can anybody recommend any good savings or I bonds?,,gzval3q,t3_nn680g
262,2021-05-29 13:23:30,t1_gzval7t,,wallstreetbets,Do you all just invite women directly to your apartment on the first date if you met them online ?,,gzval7t,t3_nn680g
263,2021-05-29 13:23:31,t1_gzvalah,,wallstreetbets,Short squeeze deez nuts 🥜,,gzvalah,t1_gzvadkz
264,2021-05-29 13:23:32,t1_gzvalbk,,wallstreetbets,"Squeeze my dongus you fuckin nerd. 

*I am a bot, and this action was performed automatically. Please [contact the moderators of this subreddit](/message/compose/?to=/r/wallstreetbets) if you have any questions or concerns.*",,gzvalbk,t1_gzvalah
265,2021-05-29 13:23:33,t1_gzvalet,,wallstreetbets,You can edit comments pal,,gzvalet,t1_gzv86yc
266,2021-05-29 13:23:38,t1_gzvalnw,,wallstreetbets,I am a bot from /r/wallstreetbets. Your submission was too short. Please make it a comment if it's not worth expounding on.,,gzvalnw,t3_nnnep1
267,2021-05-29 13:23:39,t1_gzvalr1,,wallstreetbets,Vote is all the way in July 29th. June 2nd is only the record date where you have to be a stockholder to be able to vote.,,gzvalr1,t1_gzujabr
268,2021-05-29 13:23:40,t1_gzvalsq,,wallstreetbets,"Took the L. Had shares that were green to offset most of my options losses, but still it sucked.",,gzvalsq,t1_gzv7wmg
269,2021-05-29 13:23:42,t1_gzvalxk,,wallstreetbets,McDonald’s breakfast after a night of drinking is just perfection,,gzvalxk,t3_nn680g
270,2021-05-29 13:24:04,t1_gzvan6e,,wallstreetbets,"I may be dumb enough to believe the earth is flat, but still smart enough to know Palantir is evil.",,gzvan6e,t1_gzvaao8
271,2021-05-29 13:24:05,t1_gzvan7r,,wallstreetbets,BuY aNd HoLD!,,gzvan7r,t1_gzvag3c
272,2021-05-29 13:24:11,t1_gzvanjb,,wallstreetbets,That's why they added Powerade as a fountain option,,gzvanjb,t1_gzvalxk
273,2021-05-29 13:24:18,t1_gzvanxy,,wallstreetbets,Yup - Also crazy how dumb people get into positions of power,,gzvanxy,t1_gzvag3c
274,2021-05-29 13:24:21,t1_gzvao4j,,wallstreetbets,‘twas the point,,gzvao4j,t1_gzusodd
275,2021-05-29 13:24:29,t1_gzvaolc,,wallstreetbets,Look up bank of america's silver short positions. That's just one entities. Research the rest yourself or first majestic,,gzvaolc,t1_gzulhpg
276,2021-05-29 13:24:32,t1_gzvaoqt,,wallstreetbets,I’m going to give you a happy ending,,gzvaoqt,t1_gzvahqt
277,2021-05-29 13:24:35,t1_gzvaow7,,wallstreetbets,Will do. Thanks,,gzvaow7,t1_gzv3rnh
278,2021-05-29 13:24:36,t1_gzvaoxq,,wallstreetbets,"AMC 🎥 
Blackberry 📱 
GameStop 🎮 

These are the plays. Power to the Players.",,gzvaoxq,t1_gzua24s
279,2021-05-29 13:24:38,t1_gzvap1y,,wallstreetbets,Everyone call Mad Money on Tuesday and tell Jim Cramer  AMC to the moon 🚀🙌💎🙌Nothing Else.,,gzvap1y,t3_nnnav4
280,2021-05-29 13:24:39,t1_gzvap3x,,wallstreetbets,Sense Monday’s closed was buying options on Friday bad Becuase the time decay hit will be worse ? Or are they already priced in,,gzvap3x,t3_nn680g
281,2021-05-29 13:24:46,t1_gzvapgk,,wallstreetbets,How the hell did you manage to lose ~100k in 2020?,,gzvapgk,t3_nn8uxs
282,2021-05-29 13:24:46,t1_gzvapht,,wallstreetbets,Drugs or AMC/GME ⚖🦧🤔🤔🤔,,gzvapht,t3_nn680g
283,2021-05-29 13:24:49,t1_gzvapmx,,wallstreetbets,bUT it’S nOt AboUt tHe MOneY,,gzvapmx,t1_gzvahd8
284,2021-05-29 13:24:49,t1_gzvapnl,,wallstreetbets,Everyone call Mad Money on Tuesday and tell Jim Cramer  AMC to the moon 🚀🙌💎🙌Nothing Else.,,gzvapnl,t3_nnn8ta
285,2021-05-29 13:24:51,t1_gzvaps1,,wallstreetbets,"Why? I am serious, was just looking for advice. What's wrong with what I said?",,gzvaps1,t1_gzv6biu
286,2021-05-29 13:24:52,t1_gzvapsu,,wallstreetbets,Great short squeeze auto mod,,gzvapsu,t1_gzvalbk
287,2021-05-29 13:24:56,t1_gzvaq1w,,wallstreetbets,Ready for the seconds,,gzvaq1w,t1_gzv9r23
288,2021-05-29 13:24:56,t1_gzvaq20,,wallstreetbets,"You didn’t sell APHA at $30 when you had it at $4. You get what I’m trying to say, right? (In case you don’t, no one reading your shit believes you).",,gzvaq20,t1_gzvae6l
289,2021-05-29 13:24:56,t1_gzvaq2h,,wallstreetbets,I just joined bc I heard this is a forum for retards and I am one.,,gzvaq2h,t3_nn680g
290,2021-05-29 13:24:57,t1_gzvaq3c,,wallstreetbets,"Used to. Horrible idea. One will show up morbidly obese, look nothing like her photos, and be impossible to get to leave your home. Better to meet where YOU can leave",,gzvaq3c,t1_gzval7t
291,2021-05-29 13:24:59,t1_gzvaq83,,wallstreetbets,This is what Buffett means when he says it provides efficiency to the market.,,gzvaq83,t1_gzv6h27
292,2021-05-29 13:25:00,t1_gzvaq92,,wallstreetbets,Fuck Palantir,,gzvaq92,t3_nnnav4
293,2021-05-29 13:25:05,t1_gzvaqj9,,wallstreetbets,You're probably a Palantir bot lol. You can't dispute the articles,,gzvaqj9,t1_gzvakle
294,2021-05-29 13:25:06,t1_gzvaql5,,wallstreetbets,Why?,,gzvaql5,t1_gzv650x
295,2021-05-29 13:25:08,t1_gzvaqp0,,wallstreetbets,You’re accusing them of market manipulation based on....not a whole lot.,,gzvaqp0,t1_gzvad75
296,2021-05-29 13:25:10,t1_gzvaqsp,,wallstreetbets,"Honestly, that is the definition of diamond hands. 

I hope AMC/GME/RKT squeezes and people make money but I also want to see the posts where people were up $1m but end up selling after the crash back to earth and lose money.",,gzvaqsp,t1_gzuj51b
297,2021-05-29 13:25:16,t1_gzvar32,,wallstreetbets,"In a perfect world with law abiding players on all sides I would wholeheartedly agree with you. And I do believe that the system is exactly intended as described and even in the most cases it is done like that, but I am really heavily doubting that it is the case with certain stocks that malicious players want to drive into the ground.
And an overvoting of 250% would mean 100% of all shares on loan And another 50% gotta vote on top of that..... Seems very very fishy......",,gzvar32,t1_gzuz3v4
298,2021-05-29 13:25:20,t1_gzvarbj,,wallstreetbets,Your lack of knowledge on Palantir is apparent in this post. You are failing to convince us that this is not a worthwhile investment.,,gzvarbj,t3_nnnav4
299,2021-05-29 13:25:31,t1_gzvary1,,wallstreetbets,"Guys, there is a whole stock market out there, why are you buying AMC at $30 lmao",,gzvary1,t3_nn680g
300,2021-05-29 13:25:32,t1_gzvaryb,,wallstreetbets,holy shit yall still in here after all this time,,gzvaryb,t3_mrzztb
301,2021-05-29 13:25:32,t1_gzvaryg,,wallstreetbets,Bought Sndl Friday at .98,,gzvaryg,t1_gzva8h4
302,2021-05-29 13:25:36,t1_gzvas6d,,wallstreetbets,Drugs are safer,,gzvas6d,t1_gzvapht
303,2021-05-29 13:25:37,t1_gzvas9b,,wallstreetbets,"You dropped the a...

BannnnnNnNnnNnNnna",,gzvas9b,t1_gzuhl76
304,2021-05-29 13:25:50,t1_gzvasyu,,wallstreetbets,What don't u understand?,,gzvasyu,t1_gzv65sf
305,2021-05-29 13:25:52,t1_gzvat1t,,wallstreetbets,This is a 10/10 pro tip,,gzvat1t,t1_gzvaq3c
306,2021-05-29 13:25:54,t1_gzvat62,,wallstreetbets,"News posts **must be market moving** and contain **new** information. Please avoid editorializing the title. 

If your post doesn't meet the requirements above, please delete the thread before a mod sees it.

*I am a bot, and this action was performed automatically. Please [contact the moderators of this subreddit](/message/compose/?to=/r/wallstreetbets) if you have any questions or concerns.*",,gzvat62,t3_nnng8y
307,2021-05-29 13:25:57,t1_gzvatca,,wallstreetbets,#Just read a Twitter thread. Guy says he took a bath on SQ 6/4 puts. Next tweet 2 mins later: buying more puts. Fucking idiot.,,gzvatca,t3_nn680g
308,2021-05-29 13:25:57,t1_gzvatcw,,wallstreetbets,Where are the comments about how around a month or so ago Cramer was basically at war with WSBs. Now I go on his Twitter feed and hes basically sucking our dicks. Does no one else find that a bit odd?,,gzvatcw,t3_nn680g
309,2021-05-29 13:26:02,t1_gzvatmf,,wallstreetbets,Drugs,,gzvatmf,t1_gzvapht
310,2021-05-29 13:26:08,t1_gzvatx2,,wallstreetbets,DILFs love me.,,gzvatx2,t1_gzvac78
311,2021-05-29 13:26:08,t1_gzvatyc,,wallstreetbets,"I am a bot from /r/wallstreetbets. News should be a screenshot or link to a news story, can't be a selfpost.",,gzvatyc,t3_nnng8y
312,2021-05-29 13:26:09,t1_gzvau18,,wallstreetbets,You have a self fulfilling prophecy posting weak ass fucking jokes.,,gzvau18,t1_gzvakjd
313,2021-05-29 13:26:19,t1_gzvaujt,,wallstreetbets,"At least you are the right one to do it. 
I mean you have a lot of experience giving happy endings behind Wendy's.",,gzvaujt,t3_nnmssw
314,2021-05-29 13:26:27,t1_gzvauyb,,wallstreetbets,"thank you brother, I'm learning the AI music and working on some story generation too.",,gzvauyb,t1_gzv7bbi
315,2021-05-29 13:26:37,t1_gzvavjb,,wallstreetbets,Lmaooooo I love you. 100% on board with this school of thought.,,gzvavjb,t1_gzvahd8
316,2021-05-29 13:26:43,t1_gzvavxl,,wallstreetbets,Did I write the hundreds of investigative articles about Palantir too? Lol,,gzvavxl,t1_gzvakk0
317,2021-05-29 13:26:44,t1_gzvavyw,,wallstreetbets,Why must you be gay,,gzvavyw,t1_gzvary1
318,2021-05-29 13:26:46,t1_gzvaw23,,wallstreetbets,"Fuck you, my Wife loves sweet potato fries, and as it turns out they’re a hell of a lot healthier for you. The people that are real problem in the US are the queefs who look down their noses at others that aren’t wearing masks after the mandate’s been lifted.",,gzvaw23,t1_gzv9cqe
319,2021-05-29 13:26:53,t1_gzvawh9,,wallstreetbets,How come I didn’t get vote email? I bought Amc about a month ago and bought even more the past week.,,gzvawh9,t1_gzu925b
320,2021-05-29 13:26:54,t1_gzvawjh,,wallstreetbets,Markets aren’t open—today already sucks,,gzvawjh,t3_nn680g
321,2021-05-29 13:26:59,t1_gzvawtr,,wallstreetbets,Give me bear case for ASO before I yolo into it.,,gzvawtr,t3_nn680g
322,2021-05-29 13:27:01,t1_gzvaww1,,wallstreetbets,18 shares of amc. Bought at 19.50. From Norway🦍🇧🇻,,gzvaww1,t3_nn4aej
323,2021-05-29 13:27:02,t1_gzvawxq,,wallstreetbets,...there you go ☕️,,gzvawxq,t1_gzvaq1w
324,2021-05-29 13:27:03,t1_gzvax04,,wallstreetbets,An entertainer who panders to his audience for views? Sounds about right.,,gzvax04,t1_gzvatcw
325,2021-05-29 13:27:05,t1_gzvax5m,,wallstreetbets,Reporting in $1k,,gzvax5m,t1_gzrdgut
326,2021-05-29 13:27:16,t1_gzvaxr1,,wallstreetbets,90% chance expire worthless,,gzvaxr1,t1_gzssxko
327,2021-05-29 13:27:16,t1_gzvaxrn,,wallstreetbets,"When someone says financial freedom and the coin in the same sentence I don’t really know what they mean by it or if they do either.

Either way, stonks only go up and that has been true for a long time.",,gzvaxrn,t3_nn680g
328,2021-05-29 13:27:24,t1_gzvay7n,,wallstreetbets,"Fuck your aunt, puts on CLOV market open Tuesday",,gzvay7n,t3_nnlial
329,2021-05-29 13:27:24,t1_gzvay7t,,wallstreetbets,The guys psychotic,,gzvay7t,t1_gzvatcw
330,2021-05-29 13:27:28,t1_gzvayfl,,wallstreetbets,"So if they’re morbidly obese, you don’t attempt to fuk ?",,gzvayfl,t1_gzvaq3c
331,2021-05-29 13:27:31,t1_gzvayli,,wallstreetbets,Why TSM with cap of $552B and not INTC with mkt cap of just 237B?,,gzvayli,t3_nni8bn
332,2021-05-29 13:27:32,t1_gzvayot,,wallstreetbets,🥭believe in the power of recounting votes,,gzvayot,t1_gzvahb6
333,2021-05-29 13:27:37,t1_gzvayws,,wallstreetbets,I am a bot from /r/wallstreetbets. Your submission was too short. Please make it a comment if it's not worth expounding on.,,gzvayws,t3_nnnh3k
334,2021-05-29 13:27:10,t3_nnngz7,nnngz7,wallstreetbets,,My gf still loves me don’t worry,,
335,2021-05-29 13:27:39,t1_gzvaz4b,,wallstreetbets,Yeah but a few games of morning blackjack will get you right,,gzvaz4b,t1_gzvawjh
336,2021-05-29 13:27:40,t1_gzvaz5m,,wallstreetbets,"What is your endgame? Are you waiting for $100+, $1000, etc? Or, are you going to hold forever?",,gzvaz5m,t3_nn985l
337,2021-05-29 13:27:41,t1_gzvaz6m,,wallstreetbets,"They protect freedom. Sure, it’s a “bad company” but there are bad people out there.",,gzvaz6m,t3_nnnav4
338,2021-05-29 13:27:43,t1_gzvazc2,,wallstreetbets,I sold a bunch premarket at 29.50 and CGC at 51.50.,,gzvazc2,t1_gzvaq20
339,2021-05-29 13:27:43,t1_gzvazce,,wallstreetbets,I am a bot from /r/wallstreetbets. Your submission was too short. Please make it a comment if it's not worth expounding on.,,gzvazce,t3_nnnh5j
340,2021-05-29 13:27:48,t1_gzvazko,,wallstreetbets,"Curious, what company do work for that's tasking you with reddit duty? Do they pay you well. Just an honest question.",,gzvazko,t1_gzv45w4
341,2021-05-29 13:27:49,t1_gzvazn3,,wallstreetbets,"Lol, dude waffles so much he should start a restaurant. ""House of Waffles"" or something like that.",,gzvazn3,t1_gzvatcw
342,2021-05-29 13:27:51,t1_gzvazrl,,wallstreetbets,I definitely get where you are coming from and appreciate the sentiment. Learned from my mistakes. Thanks for your reply and have a great day!,,gzvazrl,t1_gzu6rpa
343,2021-05-29 13:27:55,t1_gzvazza,,wallstreetbets,I thought they protected our civil liberties 😅they lied to us!,,gzvazza,t3_nnnav4
344,2021-05-29 13:27:57,t1_gzvb03l,,wallstreetbets,Looking at RKT options to buy Tuesday any thoughts?,,gzvb03l,t3_nn680g
345,2021-05-29 13:28:01,t1_gzvb0dy,,wallstreetbets,What if it goes down to $15. The next three days might be crazy. Are you in AHT?,,gzvb0dy,t1_gzv9zmc
346,2021-05-29 13:28:03,t1_gzvb0hx,,wallstreetbets,I am a bot. You submitted a Gain/Loss/YOLO which was a video or GIF.                            Please make it a Reddit gallery of screenshots including entry and position info.,,gzvb0hx,t3_nnngz7
347,2021-05-29 13:28:04,t1_gzvb0jo,,wallstreetbets,"I worked with a guy that belongs on that sub. The dude would get so wasted every night that he would sleep standing up at work. No matter how much he cleaned himself, he always smelled like sour, sweaty alcohol.",,gzvb0jo,t1_gzv94bx
348,2021-05-29 13:28:11,t1_gzvb0xh,,wallstreetbets,"It might make money, but my point is they are evil. Every other stock on WSB is not.",,gzvb0xh,t1_gzvarbj
349,2021-05-29 13:28:14,t1_gzvb13b,,wallstreetbets,He switched teams.  If you cannot beat them join them.  He went to Harvard; he is not a fool he just pumps up what he has or answers bullshit questions.  MSNBC is part of the problem.,,gzvb13b,t1_gzvatcw
350,2021-05-29 13:28:21,t1_gzvb1hj,,wallstreetbets,"This was like my first stock ever. Nope, not again.",,gzvb1hj,t3_nnenxc
351,2021-05-29 13:28:21,t1_gzvb1hn,,wallstreetbets,It's AbOuT SeNdInG a MeSsAgE,,gzvb1hn,t1_gzvapmx
