,created,fullname,post_id,subreddit,text,title,comment_id,parent_id
794,2021-05-29 13:52:00,t1_gzvdc3z,,wallstreetbets,Crypto just dipped. Buy as much as you can,,gzvdc3z,t3_nnnve5
795,2021-05-29 13:52:01,t1_gzvdc7q,,wallstreetbets,It means.... shut the fuck up and buy the dip. 🚀,,gzvdc7q,t3_nnnm0l
796,2021-05-29 13:52:02,t1_gzvdc8a,,wallstreetbets,"European here (Germany). I hold strong my 440 AMC shares (avg 7,50 €) and 50 GME shares (avg 168 €). :) To the moon! 🚀🚀🚀",,gzvdc8a,t1_gzvbkan
797,2021-05-29 13:52:02,t1_gzvdc9i,,wallstreetbets,I have a bunch of nok what’s the bang ETF,,gzvdc9i,t1_gzsu59n
798,2021-05-29 13:52:09,t1_gzvdcoo,,wallstreetbets,"AMC at 9. SKLZ at 14. Those still make me nervous. MARA is based off the asset we cannot name. I expect it to be all over the map. Eventually it’ll triple though regardless. MARA went70% clean energy, order 10x more mining servers that deliver this year, and agreed to alert the US Govt to suspicious activities. If China cracks down, bullish. They’re going from 102 “assets” mined a month to 55 a day. MARA is the long term keeper that’s fueling the rest. It’s awesome for me to finally build a portfolio and it’s self fueling for now. Hopefully it continues. I can also afford to potentially be bag-holding so it works for me. Unless something goes really wrong. In which case the whole market would be tanking and we’d all be bagholding together in hell. 

Till then. MARA BB SKLZ AMC and I’m researching CLOV TLRY MVIS",,gzvdcoo,t1_gzva2dq
799,2021-05-29 13:52:18,t1_gzvdd7v,,wallstreetbets,"Legit dd for puppy 🐶corn 🌽. 

Shiba inus have a shirt lifespan (wish dogs lived longer). If that meme dog dies - I believe he is quite old, wouldn't that cause a crash.",,gzvdd7v,t3_nn680g
800,2021-05-29 13:52:23,t1_gzvddjc,,wallstreetbets,"Why not? The idiots are still there.

The pilots and the canal authority were responsible because they let the vessel enter despite the storm.",,gzvddjc,t1_gzvbx31
801,2021-05-29 13:52:27,t1_gzvddry,,wallstreetbets,"Trying to use smart tv apps is a nightmare for anyone.

I haven’t bought a tv in a few years because I’m not trying to page through YouTube videos and stuff, or scroll through Netflix shows by pressing a button and waiting 3 seconds between each scroll.

Changing between apps, typing stuff in, all that makes no one care about it because it sucks too much dick to even use 90% of the features.",,gzvddry,t1_gzvcvpy
802,2021-05-29 13:52:28,t1_gzvddva,,wallstreetbets,"We get a **lot** of meme submissions. To make sure only the absolute best make it through, we've disallowed static (picture) memes. 

If you *strongly* believe your meme is higher quality than all the memes currently on r/wallstreetbets/hot, then you may message the moderators.

I know this is disappointing, and you probably put some hard work into this, but this is how we keep the WSB feeds clean for everyone, including the /new feed. 

Thanks for understanding, and may your tendies be golden, and portfolio be green.

*I am a bot, and this action was performed automatically. Please [contact the moderators of this subreddit](/message/compose/?to=/r/wallstreetbets) if you have any questions or concerns.*",,gzvddva,t3_nnnx0z
803,2021-05-29 13:52:30,t1_gzvddxz,,wallstreetbets,Buy low sell high,,gzvddxz,t3_nnnve5
804,2021-05-29 13:52:32,t1_gzvde3h,,wallstreetbets,I’m proud of you son,,gzvde3h,t1_gzvcqv9
805,2021-05-29 13:52:38,t1_gzvdegw,,wallstreetbets,You've arrived,,gzvdegw,t1_gzvcqv9
806,2021-05-29 13:52:42,t1_gzvder3,,wallstreetbets,I wonder if that fake naked chick is DB’s alt?,,gzvder3,t1_gzvcy7o
807,2021-05-29 13:52:49,t1_gzvdf3x,,wallstreetbets,4million shares is nothing....didn’t it do hundreds of millions in volume?,,gzvdf3x,t1_gzvdbce
808,2021-05-29 13:52:52,t1_gzvdfan,,wallstreetbets,I had Tesla calls expire a week before they announced they were being added to the SP500 last fall.,,gzvdfan,t1_gzvctjk
809,2021-05-29 13:53:00,t1_gzvdfta,,wallstreetbets,Mash it up bro,,gzvdfta,t1_gzvcgvh
810,2021-05-29 13:53:03,t1_gzvdfxq,,wallstreetbets,Is this satire or something?,,gzvdfxq,t1_gzvd73g
811,2021-05-29 13:53:04,t1_gzvdg0d,,wallstreetbets,When you look at $TSLA in YahooFinance! The stonks they say that watch that also watch/own APPL MSFT GOOG AMZN,,gzvdg0d,t1_gzvd95c
812,2021-05-29 13:53:06,t1_gzvdg48,,wallstreetbets,"I tried to watch ironically, but couldn’t make it more than 30s he legit sounds drunk.",,gzvdg48,t1_gzvd6hc
813,2021-05-29 13:53:13,t1_gzvdgj2,,wallstreetbets,"Is cosmetic industry sexist too? They make lipstick for women, you want it too?",,gzvdgj2,t1_gzvbcu0
814,2021-05-29 13:53:22,t1_gzvdh3n,,wallstreetbets,"Used to be just Tesla and Toyota dominating the EV market.  Ford coming in with an F-150 (best selling pickup) is huge.  The moat is disappearing.  TSLA going to be shown for the overvalued auto-maker it is.  Or maybe F and TSLA just meet in the middle.  F= 58B market cap.  TSLA =580B market cap.  F to 77, TSLA to 343.",,gzvdh3n,t3_nn680g
815,2021-05-29 13:53:22,t1_gzvdh3x,,wallstreetbets,I am holding shares of a spac that is marrying up with 23andMe. They are offering $10 share to surrender them or changing them over to the new NASDAQ ticker on a 1 for 1 basis. Shares of the new company will be offered at $11.50. Surrender or hold?,,gzvdh3x,t3_nn680g
816,2021-05-29 13:53:25,t1_gzvdh8d,,wallstreetbets,"u/yolocallking show yourself 

We are all waiting for dat smoke show weather girl recap of the week.

Rip a tootskie and get er done",,gzvdh8d,t3_nn680g
817,2021-05-29 13:53:26,t1_gzvdhbi,,wallstreetbets,Learn macD and learn how it’s used and try using that.,,gzvdhbi,t3_nnnve5
818,2021-05-29 13:53:27,t1_gzvdhet,,wallstreetbets,#Did you miss me?,,gzvdhet,t3_nn680g
819,2021-05-29 13:53:28,t1_gzvdhgx,,wallstreetbets,"I like it in cookies!

Or in the rocks.

But I might not qualify on the avid part ...",,gzvdhgx,t1_gzvd9gg
820,2021-05-29 13:53:33,t1_gzvdhsv,,wallstreetbets,TSLA hitting 1000 would make a lot of sense,,gzvdhsv,t3_nn680g
821,2021-05-29 13:53:42,t1_gzvdiax,,wallstreetbets,Check out the overall record. Wrong again just like taking some British wench over good old American sweetheart Aniston,,gzvdiax,t1_gzvd4cy
822,2021-05-29 13:53:42,t1_gzvdic1,,wallstreetbets,Whats your cost average lmao since username checks out,,gzvdic1,t1_gzuzt7i
823,2021-05-29 13:53:44,t1_gzvdifc,,wallstreetbets,an ETF w/ AMC/TSLA/GME/PLTR/NIO [in the top 10 holdings](https://etfdb.com/etf/SFYF/#holdings)?   Which one of you retards works for SoFi and started this!?,,gzvdifc,t3_nn680g
824,2021-05-29 13:53:46,t1_gzvdijl,,wallstreetbets,There are support lines drawn. Crossing 40 and staying there would be bullish crossover and indicate a move to 60. I think technical analysis is bullshit. Yet here I am listening like the faithful,,gzvdijl,t1_gzv9cck
825,2021-05-29 13:53:50,t1_gzvdir5,,wallstreetbets,Shouldve sold at 30. Atleast I wouldve. But Im holding because of cc,,gzvdir5,t3_nnmw82
826,2021-05-29 13:53:50,t1_gzvdiru,,wallstreetbets,Yea he does sound drunk. I guess that's his version of an apology lol,,gzvdiru,t1_gzvdg48
827,2021-05-29 13:53:53,t1_gzvdixd,,wallstreetbets,I'd say some long shorts are in there somewhere and needing closing.,,gzvdixd,t1_gzv4nqn
828,2021-05-29 13:53:58,t1_gzvdj8z,,wallstreetbets,What do you guys think about $GEO? Almost 35% Short interest.,,gzvdj8z,t3_nn680g
829,2021-05-29 13:54:06,t1_gzvdjom,,wallstreetbets,"What is posted in this comment, whatever it is is breaking my firefox  
https://i.imgur.com/ShacuyV.png",,gzvdjom,t1_gzvd2ms
830,2021-05-29 13:54:07,t1_gzvdjqf,,wallstreetbets,TLRY up to 60 by the end of June,,gzvdjqf,t3_nn680g
831,2021-05-29 13:54:08,t1_gzvdjtx,,wallstreetbets,"Hey I doubt this comment will get much traction but I just had a question I was late to the game but I was only able to muster up the money to get 1 share of GME and 4 shares of AMC, is it reasonable to
Hope for these to get to 5k per share? Or is all this 20,000,000 for the floor just being blown out of proportion? Also I’m on Robinhood. I tried to transfer to TD Ameritrade but it won’t let me and I can’t connect my account to fidelity so I just have to hope for the best. Anyway 5k per share??? I don’t need to get to the moon. Just need to get out of the atmosphere",,gzvdjtx,t3_nn680g
832,2021-05-29 13:54:14,t1_gzvdk6l,,wallstreetbets,"As long as it's below 5% of reserves, they could probably hold them as ""Miscellaneous Assets"" without breaking out how much of it was purple dildos.",,gzvdk6l,t1_gzv9ics
833,2021-05-29 13:54:16,t1_gzvdkai,,wallstreetbets,Means buy tech,,gzvdkai,t3_nnnm0l
834,2021-05-29 13:54:23,t1_gzvdkp4,,wallstreetbets,It’s $SPY. S&P500. The index and etf that’s in every brokerage and on every TV,,gzvdkp4,t1_gzuhr6t
835,2021-05-29 13:54:31,t1_gzvdl4p,,wallstreetbets,"Get a big box of crayons and talk to your wife about getting a boyfriend.  

Move into your basement",,gzvdl4p,t3_nnnve5
836,2021-05-29 13:54:31,t1_gzvdl5x,,wallstreetbets,Canadian dollars,,gzvdl5x,t1_gzuefb8
837,2021-05-29 13:54:33,t1_gzvdl8r,,wallstreetbets,"THis is wholesome. I jumped right into options, don’t own any shares.",,gzvdl8r,t3_nnnve5
838,2021-05-29 13:54:38,t1_gzvdlj2,,wallstreetbets,thanks for fueling the squeeze kind sir,,gzvdlj2,t1_gzvcf36
839,2021-05-29 13:54:42,t1_gzvdlst,,wallstreetbets,*Spiderman pointing meme*,,gzvdlst,t1_gzvcz6c
840,2021-05-29 13:54:43,t1_gzvdluz,,wallstreetbets,"Keep an eye on the news because ""events dictate actions in the market.""",,gzvdluz,t3_nnnve5
841,2021-05-29 13:54:43,t1_gzvdlvt,,wallstreetbets,HODLers look like Gollum irl,,gzvdlvt,t1_gzvcajc
842,2021-05-29 13:54:44,t1_gzvdlwm,,wallstreetbets,the sell part happened the first two weeks,,gzvdlwm,t1_gzvcssf
843,2021-05-29 13:54:45,t1_gzvdlyh,,wallstreetbets,"shit man, at 30 my nw was like deep negative so ...",,gzvdlyh,t1_gzvd73g
844,2021-05-29 13:54:46,t1_gzvdm1x,,wallstreetbets,Price prediction for BB Tuesday ?,,gzvdm1x,t3_nn680g
845,2021-05-29 13:54:50,t1_gzvdm7q,,wallstreetbets,Yeah she’d be lucky to date you lol,,gzvdm7q,t1_gzvcf9u
846,2021-05-29 13:54:51,t1_gzvdmaz,,wallstreetbets,It’s pretty democratic in here- you don’t get priority cos you’re famous like on twatter and fb. Idiots do well.,,gzvdmaz,t1_gzvcaoa
847,2021-05-29 13:54:55,t1_gzvdmk6,,wallstreetbets,"If we're going that direction, I want it to hit like $1k or some shit at least, and then make fun of everyone who actually *didn't* sell",,gzvdmk6,t1_gzvcrn2
848,2021-05-29 13:54:55,t1_gzvdmkk,,wallstreetbets,This will be a problem for a while with all of the extra unemployment benefits. Unintended consequence of a quick economic recovery. All us apes with good jobs have been stockpiling cash over the past year.,,gzvdmkk,t1_gzvbgak
849,2021-05-29 13:54:56,t1_gzvdmm7,,wallstreetbets,Fishing for reassurance and affirmation.,,gzvdmm7,t1_gzvdfxq
850,2021-05-29 13:55:02,t1_gzvdmz4,,wallstreetbets,What prices did you buy at?,,gzvdmz4,t1_gzvdjtx
851,2021-05-29 13:55:15,t1_gzvdnp7,,wallstreetbets,Too bad it's gigantic,,gzvdnp7,t1_gzvbv14
852,2021-05-29 13:55:18,t3_nnnyxb,nnnyxb,wallstreetbets,"I recommended a BUY because of Magnite's vastly increased scale because of the SpotX acquisition and the fact that Magnite should close the valuation gap with The Trade Desk.

The informational advantage that The Trade Desk once had over Magnite to target advertising to consumers using third party sources will either be eliminated by Apple, Google or government rules.

This ultimately means that first party sources will become the primary way for advertisers to target advertising to consumers programmatically. The Trade Desk will compensate for the loss of third party sources by using UID 2.0, however, since Magnite will have the ability to gain a rich set of first party data from its relationship with publishers, Magnite's ability to target consumers with advertising will become just as good, if not better than The Trade Desk.

Magnite's greater ability to target advertising should increase its value in the programmatic advertising ecosystem and also ultimately increase its value among investors, as well.

I LIKE THE STOCK!!!! 

MGNI also has 10% short interest and rising. Good squeeze candidate.",MGNI next high growth + squeeze,,
853,2021-05-29 13:55:32,t1_gzvdopw,,wallstreetbets,"Tuesdays probably gonna dip again,  it's Wednesday when the fireworks start. Am smooth brain... 💎🙌🦍🍌🚀🚀🚀🌚",,gzvdopw,t1_gztnvcd
854,2021-05-29 13:55:32,t1_gzvdoqt,,wallstreetbets,"So I’m a retard that bought Tilray at $40 in Feb (I know I’m an idiot sandwich with no stop loss)
So based on the reading, looks like I will make back my losses but I should freaking run away after that because it’s going to tank again. 
Noted. As long as I can make these losses back I will be a happy ape",,gzvdoqt,t3_lhf2qw
855,2021-05-29 13:55:36,t1_gzvdoy4,,wallstreetbets,"You’ve got this! My AMC shares were called away at $12.50. While I am happy with my profit on that trade, I’m super excited to see ***Another Moon Company*** 🚀 to the 🌕 for the rest of this community of 👩‍🚀 and 🐒 !",,gzvdoy4,t3_nn4spa
856,2021-05-29 13:55:36,t1_gzvdoyh,,wallstreetbets,"Get an air purifier.  Indoor air quality is shit, seriously, & the white noise effect will help random noises from becoming a fixation.",,gzvdoyh,t1_gzv57xn
857,2021-05-29 13:55:38,t1_gzvdp4e,,wallstreetbets,"AMC and GME investors are betting on the upcoming shareholder votes.  


Think of it this way:     


If Biden received 420 million votes and Trump received 69 million votes, but the population of The United States is only \~330million including children, how long do you think it's gonna take for the apes to start smearing shit on the walls?  


If AMC or GME or both can gather legally binding bulletproof smoking gun evidence that their stock is being illegally and fraudulently naked shorted in a collusive backscratching dance that boggles the mind, the sky is going to rain tendies.  


None of this is financial advice.",,gzvdp4e,t3_nnnve5
858,2021-05-29 13:55:43,t1_gzvdpdc,,wallstreetbets,5/20 I bought 5 amc call contracts for a $19 strike for 5/28 ..... I sold it 5/27 for 26 and change .. and of course Friday it goes over $30,,gzvdpdc,t1_gzvctjk
859,2021-05-29 13:55:43,t1_gzvdpej,,wallstreetbets,Might be the tie breaker I agree with,,gzvdpej,t1_gzvd80k
860,2021-05-29 13:55:47,t1_gzvdpme,,wallstreetbets,Ban,,gzvdpme,t1_gzvdjtx
861,2021-05-29 13:55:49,t1_gzvdpr6,,wallstreetbets,That’s fucking hilarious 😂,,gzvdpr6,t1_gzvdifc
862,2021-05-29 13:55:51,t1_gzvdpv8,,wallstreetbets,"Ah, 💢 so you 👈 ban 👏🚫 me 🧑🏻‍🤝‍🧑🏽 for 😤 being 😮 a GME holder. I 🤣🎅 see 👀 how 😮 it is.  See, 🙉👀 I 😀😀 am 👏👏 a free 🥰💖🤩⚡ thinker. You 🌟 guys 👨 in 🔚 this situation 🎮 just 🕛👀 see 👀 the ""play 🎮 along 🔚🔚 or die"" ☠️ ultimatum. A free 💜 thinker like 😍💋 myself; 👈 my 👏 decisions 🤔 are not 👎 limited to the choices 🤔 in 🏽 an ultimatum. My 🙏😂 thinking ❓ in 🧑🏻‍🦯 this is that 👉👉👉 in 🚨💯 this given 👤 scenario the likelihood for 😷 survival 🍖 is very 👌 low. 🔉 And weighing the options of how 😡💯 many 💯 people 👫 you 👈🏼 must 😔 murder 😤✴️ for 👷 a small 🦐 chance 🚫 like 📷 that 👉👉👉👉👉 isn't 🚷🗺️👏 worth 💰 it. So what 😳 would 😎 the plan ⚠️📯 from 💥💰 a free 💜 thinker like 💞👨‍❤️‍👨 me 🧘 be? 💎🤔 All 💯 band 🎵 together. 👫 Since 👨 the likelihood for 📓🔞🎁 survival 🍖 is low, 🔉 already 😃 we'd 🙋 may 🤷 as well 🤓🤒 opt to all 💯 not 🚫 play 🎲 into 🚟👉 sick 🤧 people 😡👨 like 😄 these 🏨 people's 🧑‍🤝‍🧑 game. 🎮 We 🤫 keep 👌🙊 our 📌💯 souls 👻 pure 😘 and not 🚫 let 👬👫 evil 🖤 like 💖 this control 🕺 us. 👨 We 🚟🚟 work 😍 together. 👨‍👦 And if they 👬 choose 📥 to kill 🚢 us, 👨 well 😡 then 👉 so be 💎👼 it. Atleast 🤷‍♀️ we 👧 have 🈶 the last 😍 laugh 👱🏻😂 of not 😮 playing 🤸 into 🚟👏 evils sick 😵 game. 🎲 This split ✂️ second 🕐 life 👤 is not ✋ worth 💸🌐 commiting evil 🖤 like 🌟 this to stay 💒 in 😛 it, trust 💯 me. ✨ I'm 💆🏼 trying 🧚🏼‍♀️🔥💖🌝 to reach 👉 the afterlife with a good 🙅‍♂️ soul 😱 not 🚯 tainted 😷 by 😈😈 evil. 🖤 You 😊 guys 👨 have 🈶 alot 🔥💯💪 of spiritual 👻 growing 🌱 and learning 📝 to do. 🤬  Be 👄😱 well! 🤒 :)",,gzvdpv8,t3_mrzztb
863,2021-05-29 13:56:01,t1_gzvdqi1,,wallstreetbets,Let’s go. Everybody  on board 🚀🚀🚀,,gzvdqi1,t3_nnlial
864,2021-05-29 13:56:07,t1_gzvdqw4,,wallstreetbets,Now you got my attention,,gzvdqw4,t3_nltsoo
865,2021-05-29 13:56:12,t1_gzvdr6x,,wallstreetbets,"Meant more societally, but agree hot tub.",,gzvdr6x,t1_gzvdmaz
866,2021-05-29 13:56:13,t1_gzvdr7u,,wallstreetbets,5 million,,gzvdr7u,t1_gzvdm1x
867,2021-05-29 13:56:16,t1_gzvdre0,,wallstreetbets,If it’s not at least 10x leverage I will downvote,,gzvdre0,t3_nmydzw
868,2021-05-29 13:56:18,t1_gzvdrkf,,wallstreetbets,"Name of my position:
460 break even with a vertical spread expiring December 17 end of 2022.",,gzvdrkf,t3_nngwwl
869,2021-05-29 13:56:23,t1_gzvdrve,,wallstreetbets,13,,gzvdrve,t1_gzvdm1x
870,2021-05-29 13:56:31,t1_gzvdsb0,,wallstreetbets,The market is in a snafu,,gzvdsb0,t3_nnnm0l
871,2021-05-29 13:56:35,t1_gzvdsi8,,wallstreetbets,They should go back to being a private company and pay us all $30 a share,,gzvdsi8,t1_gztwl0g
872,2021-05-29 13:56:35,t1_gzvdsj3,,wallstreetbets,Ban for 35 years,,gzvdsj3,t1_gzvdj8z
873,2021-05-29 13:56:37,t1_gzvdsn9,,wallstreetbets,I keep thinking that Aragorn should have shacked up with the horse lady and not with the whiny pouty elf lady ... but :shrug:,,gzvdsn9,t1_gzvd8nb
874,2021-05-29 13:56:38,t1_gzvdspc,,wallstreetbets,"Realize for every ""i think it'll probably go back up"" someone thinks the opposite.",,gzvdspc,t3_nnnve5
875,2021-05-29 13:56:40,t1_gzvdstb,,wallstreetbets,"Yeah I talk a good game, but I love them too much to sell. I will hand them down to my boys then they will sell them when their PLTR 450c weeklies go belly up after I die.",,gzvdstb,t1_gzvd9ew
876,2021-05-29 13:56:44,t1_gzvdt43,,wallstreetbets,I have emojified an apes’ angry ban reply message.,,gzvdt43,t1_gzvdpv8
877,2021-05-29 13:56:57,t1_gzvdttx,,wallstreetbets,I never realized Theon was in the OSDT trailer.,,gzvdttx,t3_nnh1lx
878,2021-05-29 13:56:57,t1_gzvdtvw,,wallstreetbets,"If I want to find a new show to watch, I literally go get my laptop, sit down in front of my tv, look through shows on my laptop, and then if I find one I think looks good, I’ll type it on my tv remote in search just so I don’t have to look through their tv app.",,gzvdtvw,t1_gzvddry
879,2021-05-29 13:57:07,t1_gzvdufe,,wallstreetbets,Thank you very much for the help.,,gzvdufe,t1_gzu8m3z
880,2021-05-29 13:57:10,t1_gzvdum7,,wallstreetbets,The hangover is heavy,,gzvdum7,t1_gzvd9gg
881,2021-05-29 13:57:16,t1_gzvduy0,,wallstreetbets,"Well, yeah all that article is saying is that an imaginary - that holds zero value except the value people place in it - currency doesn't get altered through the waves of our country's juvenile reckless funding and  monetary spending. The US is the sketchy car salesman who made a few cash sales then went to the strip club and threw all the money on a stripper named DijonMustardDeezStainz.

Also not really sure how cryptocurrency would be effected linear to the American dollar regarding inflation when cryptocurrency isn't federally recognized as an actual form of currency.. am I missing something in the article?",,gzvduy0,t3_nnnm0l
882,2021-05-29 13:57:20,t1_gzvdv6k,,wallstreetbets,All hail our new Latina champion. Dilly dilly,,gzvdv6k,t1_gzvdpej
883,2021-05-29 13:57:20,t1_gzvdv84,,wallstreetbets,Stock market isn’t a zero sum game.,,gzvdv84,t1_gzvckop
884,2021-05-29 13:57:23,t1_gzvdvdt,,wallstreetbets,"Sorry you didn’t catch the train, it’s okay though you’re allowed to be mad I get it.",,gzvdvdt,t1_gzt8y0z
885,2021-05-29 13:57:28,t1_gzvdvq1,,wallstreetbets,Do you even have to do repairs? People are so desperate  my parents sold their home without any repairs and it went in a week 30k above listing. Totally dependant on the area though I guess,,gzvdvq1,t1_gzvbnxk
886,2021-05-29 13:57:29,t1_gzvdvrp,,wallstreetbets,My algo stock picker really likes this stock. I had some but sold it. You may have convinced me to buy more or some options.,,gzvdvrp,t3_nni8bn
887,2021-05-29 13:57:32,t1_gzvdvyo,,wallstreetbets,"I was just thinking about the similarities between Saab and Tesla.

Saab was doing FWD from day one and designed their cars from the ground up with that idea. They never made it past a niche manufacturer despite most people being aware of them as a brand and making a decent (but weird) product.",,gzvdvyo,t3_nn680g
888,2021-05-29 13:57:36,t1_gzvdw5y,,wallstreetbets,Go to golden nugget it’s beyond shorted!!,,gzvdw5y,t3_nn4aej
889,2021-05-29 13:57:39,t1_gzvdwbp,,wallstreetbets,"Who here gives a fuck if they’re evil? Coca Cola is evil too. So is nestle. You’re not here trading them to support them, you’re doing it to make money.",,gzvdwbp,t1_gzvb6qe
890,2021-05-29 13:57:41,t1_gzvdwg5,,wallstreetbets,People who say money can’t buy you happiness are definitely lying. Look at all those rich old wrinkly men that are banging hot chicks in their huge mansion,,gzvdwg5,t3_nn680g
891,2021-05-29 13:57:43,t1_gzvdwjw,,wallstreetbets,Or spend it on coke and hookers,,gzvdwjw,t1_gzvd88i
892,2021-05-29 13:57:47,t1_gzvdwsa,,wallstreetbets,JPOW doesn't care about inflation and would rather sell his children before raising rates.,,gzvdwsa,t3_nnnm0l
893,2021-05-29 13:57:58,t1_gzvdxhi,,wallstreetbets,250 for GME and 26 for AMC,,gzvdxhi,t1_gzvdmz4
894,2021-05-29 13:58:01,t1_gzvdxoc,,wallstreetbets,"BB is solid and its fondamentale is better than all other short squeeze stocks. Even if this short squeeze desepeare, BB will pay  you in the long terme. Buy it, forget it, hold ir for ever, back to it in 2-3 years and you will see how it performed. Thats said, in terms of risks, BB is less risky",,gzvdxoc,t1_gzs3jfg
895,2021-05-29 13:58:09,t1_gzvdy4b,,wallstreetbets,"People are literally making the case that this good company is helping our benevolent government fight bad guys. Excuse me for not trusting the ethics of billionaires and government agencies in partnership lol. I may be dumb, but not that dumb.",,gzvdy4b,t3_nnnav4
896,2021-05-29 13:58:11,t1_gzvdy9c,,wallstreetbets,"The shorts are playing this stock like a fiddle. The price is what they want it to be.  Fidelity, for one, is in cahoots with Citadel, Citadel knows your trades before they hit the market, in most cases they don’t even hit the market. They are routed through Citadel Derivatives Group, LLC. MS adjusting their price target down to $18, just a couple of months after they allegedly brokered a block deal of 20.2m shares at $25.25 is another good indication of the BS going around.  They, and any institutional buyer of a block like that, knew then what they know now. It was a photo-op to pump the stock and it worked for them.  We’re just their matchbox cars.",,gzvdy9c,t1_gzuohbw
897,2021-05-29 13:58:17,t1_gzvdyll,,wallstreetbets,Oh,,gzvdyll,t1_gzvc0fz
898,2021-05-29 13:58:19,t1_gzvdyqo,,wallstreetbets,So the new EV bill actually benefits Tesla more than any other car manufacturer lol. $10k off a Tesla? Don’t mind if I do! Might finance one for my dad as well!,,gzvdyqo,t3_nn680g
899,2021-05-29 13:58:28,t1_gzvdz9g,,wallstreetbets,Where’s the best source to learn how to do puts?,,gzvdz9g,t3_nmlnyi
900,2021-05-29 13:58:30,t1_gzvdzf5,,wallstreetbets,Wow u didn’t take 100k. Ur retarded or a billionaire,,gzvdzf5,t1_gztsn5f
901,2021-05-29 13:58:32,t1_gzvdzhs,,wallstreetbets,I am new to this. Like the EXPR play. Retail has been consistently beating forecasts for Q1 and I think EXPR will do the same. They report earnings b4 market opens on June 3rd. Get in before then. I bought in as part of Friday’s slide.,,gzvdzhs,t3_nlk1qb
902,2021-05-29 13:58:32,t1_gzvdzik,,wallstreetbets,It also appears to buy you a longer life,,gzvdzik,t1_gzvdwg5
903,2021-05-29 13:58:37,t1_gzvdzta,,wallstreetbets,I dont know who it is but I can tell you that they def have frosted tips,,gzvdzta,t1_gzvdifc
904,2021-05-29 13:58:42,t1_gzve04s,,wallstreetbets,Are they tax deductible,,gzve04s,t1_gzvdwjw
905,2021-05-29 13:58:43,t1_gzve067,,wallstreetbets,The sun is an economic indicator with a lot of history. https://cpb-us-e2.wpmucdn.com/sites.uci.edu/dist/c/362/files/2011/02/Good-Day-Sunshine-Stock-Returns-and-the-Weather.pdf,,gzve067,t1_gzv4lwf
906,2021-05-29 13:58:43,t1_gzve072,,wallstreetbets,“So beautiful...they should have sent a poet”,,gzve072,t3_nn27e9
907,2021-05-29 13:58:46,t1_gzve0cf,,wallstreetbets,GME will be going well over 400 don't worry...,,gzve0cf,t1_gzt87sp
908,2021-05-29 13:58:46,t1_gzve0dw,,wallstreetbets,"They have 800,000 million dollars cash on hand. Revenues were going up every year since 2012 pre pandemic. Please stay short. Lose your home. I really don’t care. 🤷🏾‍♂️ yes. There’s a downside. But there’s a much bigger upside because of fellows like yourself. 😏",,gzve0dw,t1_gzvcf36
909,2021-05-29 13:58:49,t1_gzve0k5,,wallstreetbets,Why would I sell something I like? Hedgies make no sense.,,gzve0k5,t3_nnlg0e
910,2021-05-29 13:58:52,t1_gzve0r0,,wallstreetbets,217 or something like that for GME and 26 per share for AMC,,gzve0r0,t1_gzvdmz4
911,2021-05-29 13:58:54,t1_gzve0tm,,wallstreetbets,What’s the count?,,gzve0tm,t3_mrzztb
