,comment_id,created,fullname,parent_id,subreddit,text,post_id,title
513,gzo64zd,2021-05-27 19:11:58,t1_gzo64zd,t1_gzo0exr,stocks,It could irrationally shoot up to 60 and you get margin called.,,
514,gzo67ie,2021-05-27 19:12:27,t1_gzo67ie,t3_nm3mzs,stocks,Thought on BB? Is it recovering or just being pulled up by the meme stock gravity?,,
515,gzo68tz,2021-05-27 19:12:44,t1_gzo68tz,t1_gzo3yyn,stocks,I know of one bank that basically rebuilds everything used for algorithm trading at market close to ensure freshness.,,
516,gzo6apl,2021-05-27 19:13:06,t1_gzo6apl,t3_nmf2iv,stocks,"Sorry, your [submission](https://www.reddit.com/r/stocks/comments/nmf2iv/icup_is_about_to_get_pumped/) in /r/stocks has been automatically removed due to Rule 3:  Low effort.

If you just want to post 1 liners or just want to know everyone's thoughts, then post a comment to our daily discussion thread which are generally stickied or [click here.](https://www.reddit.com/r/stocks/search?q=author%3Aautomoderator+daily+discussion&restrict_sr=on&sort=new&t=all)

If you're wondering **why a stock moved** a certain way, check out [Reuters](https://www.reuters.com/), [Motley Fool](https://www.fool.com/), and **especially** [Finviz](https://finviz.com/quote.ashx?t=spy) **which aggregates the most news for almost every stock**.

If instead you're wondering what a term means, go to Investopedia.com and search for said term there.

Either way come back here to repost with your findings, thanks!

A list of the [rules can be found here](https://www.reddit.com/r/stocks/about/rules/), and if you're new to r/stocks please see the [wiki](https://www.reddit.com/r/stocks/wiki/index) and/or [read this post.](https://www.reddit.com/r/stocks/comments/4x1419/if_youre_new_here_read_this_post_first/)

*I am a bot, and this action was performed automatically. Please [contact the moderators of this subreddit](/message/compose/?to=/r/stocks) if you have any questions or concerns.*",,
517,gzo6bnk,2021-05-27 19:13:17,t1_gzo6bnk,t1_gzo5zlg,stocks,\*BJs Wholesale Club,,
518,gzo6cvq,2021-05-27 19:13:31,t1_gzo6cvq,t1_gzo5jhe,stocks,Indeed. We'd never sleep otherwise.,,
519,gzo6fn9,2021-05-27 19:14:05,t1_gzo6fn9,t1_gznmxje,stocks,the kind of DD i like!,,
520,gzo6g4u,2021-05-27 19:14:11,t1_gzo6g4u,t3_nlhpv3,stocks,How to play this? Which of big oils wouldn't bend in front of activists?,,
521,gzo6h47,2021-05-27 19:14:22,t1_gzo6h47,t1_gzo0p0g,stocks,"No, they admitted it was a possibility.   Vastly different.

[Here is the current best-guess as to what it is](https://patents.google.com/patent/US10144532B2/en)",,
522,gzo6hd5,2021-05-27 19:14:25,t1_gzo6hd5,t3_nmeny2,stocks,"100% basing my opinion on the picture above and reading nothing that OP typed. 

Technical analysis- it's an IPO, its too expensive. 

Retail analysis- when I looked at this picture 2 thoughts occurred.  First ""what a handsome looking group of young people"", quickly followed by ""wow did I just think that, I'm getting old"".  Conclusion -Heavy retail influence, it's too expensive. 

Who says you cant judge a stock by its IPO cover.",,
523,gzo6kdn,2021-05-27 19:15:02,t1_gzo6kdn,t1_gzo67ie,stocks,"My fear is just meme stock gravity. There’s been no news that I’ve been able to see, and my understanding is that they won’t have any news in the short-term that would drastically increase their price.",,
524,gzo6kdr,2021-05-27 19:15:02,t1_gzo6kdr,t1_gzo5cx3,stocks,They're ahead of where they were before the delay. They should delay more launches in the future. ^^^/s,,
525,,2021-05-27 19:15:44,t3_nmf4sa,,stocks,"Maybe this is legit, but it feels really sketchy. 

I don't work for this company any longer, but I was able to retain about 51,000 of the stocks that were issued when I left the company last fall. 

Today when I went to move the stocks from the transfer agent into a brokerage, the transfer agent gave me an account statement showing that the number changed in February. Can anyone help me understand *why?* Is there anything I can do about this?

How is it legal for them to issue shares and then remove it from the account without my permission?

**Date**: 02/17/21  
**Description**: RSTR STOCK SPLIT OR DIVIDEND  
**Shares In/Out**: 5,000  
**Balance**: 56,702

**Date**: 02/17/21  
**Description**: RSTR STOCK SPLIT OR DIVIDEND  
**Shares In/Out**: -30,000  
**Balance**: 26,702

**Date**: 02/17/21  
**Description**: BOOK STOCK SPLIT OR DIVIDEND  
**Shares In/Out**: 3,617  
**Balance**: 30,319  


**Date**: 02/17/21  
**Description**: BOOK STOCK SPLIT OR DIVIDEND  
**Shares In/Out**: -21,702  
**Balance**: 8,617",nmf4sa,Why have shares from my old employer been removed from my account?
526,gzo6r8v,2021-05-27 19:16:24,t1_gzo6r8v,t1_gx1p90d,stocks,Vote due date is tomorrow. Go public is June 2nd,,
527,gzo6s4a,2021-05-27 19:16:34,t1_gzo6s4a,t3_nm68sj,stocks,"Having a large position in CPR, this deal negotiation made me rage. But love railways.",,
528,gzo6sfm,2021-05-27 19:16:37,t1_gzo6sfm,t3_nm94eb,stocks,"Cancer research? How in blazes would it help with that? Surface structure simulation perhaps? Protecting secrets? Nope. We can do that fine with a quantum safe algo, of which, there are plenty and a quantum computer will absolutely suck at those for a long time.

Quantum computing has potential, that is true. But the number of application is overblown. It will be critical to some applications, but useless for most. Its like all the idiots who actually thing blockchain is new and magical. It isn't. Quantum will be able to solve things that numerically werent possible before due to data size. But not everything needs that much data solved simultaneously. In fact, very few things need that though those few can be very interesting.

One thing that might come from quantum is the ability to communicate over huge distances at, possibly, speeds faster than light. Think internet without any distance latency. This would open up the possibility of deep space travel. Basically you can watch the latest flicks (porn) from billions of miles away...

Another might be muti dimensional data storage. In theory, if we can stabilize a quantum state for data storage, a quantum storage device can have storage density unlike anything we have now. It would be revolutionary. Think of a box where you can store a message inside. It can be empty or it can have a letter. Now think instead of putting the letter inside, what if you pin the letter to the outsides of the box on one of the 6 surfaces? Since it has 6 sides, you can potentially store 6 messages on the surfaces and all you need to do is say which side of the box to look at to find your letter. Its the same box, but instead of 1 letter you now have 6. Quantum would be able to have a lot more than 6 sides. It will just depend on how well we can devise a way to read it.",,
529,gzo6vdb,2021-05-27 19:17:12,t1_gzo6vdb,t1_gzo5cx3,stocks,"Oof dude, why exit when they have the next test flights coming up? It recovered this much on there first one, I can't imagine it doesn't skyrocket (heh) at least a little when Branson flies.",,
530,gzo6x7k,2021-05-27 19:17:34,t1_gzo6x7k,t1_gzo1zev,stocks,"It depends on the deal, they could transfer into a percentage of Facebook stock or more likely your shares would be converted into cash. As far as I know those are the options.",,
531,gzo6xrc,2021-05-27 19:17:41,t1_gzo6xrc,t1_gzo5cx3,stocks,i bought it at 45 😔,,
532,gzo6y32,2021-05-27 19:17:45,t1_gzo6y32,t3_nm3mzs,stocks,"Most tech is doing well but qqq is being held down by how much weight msft, aapl, amzn and goog hold and they've all been sideways for a while despite strong earnings.",,
533,gzo6zf3,2021-05-27 19:18:01,t1_gzo6zf3,t3_nmdr3z,stocks,Gold miner stocks doing the thing for me.,,
534,gzo70rh,2021-05-27 19:18:17,t1_gzo70rh,t3_nm3mzs,stocks,A M C is pumpin,,
535,gzo731z,2021-05-27 19:18:45,t1_gzo731z,t3_nmb9t6,stocks,"While the discount is kind of pointless, it's still a cool idea. Great way to have people interested in your stock if done well.",,
536,gzo76yz,2021-05-27 19:19:31,t1_gzo76yz,t3_nm3mzs,stocks,"Anyone know anything about nasdaq: root. 
I saw their being shorter at 41%. Seems insanely high for a stock.",,
537,gzo7bq0,2021-05-27 19:20:27,t1_gzo7bq0,t3_nm9uol,stocks,Reddit. Bet most of you didn't think of this one ;),,
538,gzo7btk,2021-05-27 19:20:28,t1_gzo7btk,t1_gzo1vco,stocks,Why are you being downvoted? Wtf is happening to this sub,,
539,gzo7c15,2021-05-27 19:20:31,t1_gzo7c15,t1_gznpruw,stocks,This is me. I have no clue I just hope it goes up,,
540,gzo7d4v,2021-05-27 19:20:44,t1_gzo7d4v,t1_gznviqc,stocks,"The CPI one worries me a bit. But honestly, I almost welcome a dip from it. I let the last one scare me into thinking the dip would be prolonged and didn't buy. After seeing the market's reaction after last time I'll just go shopping if it triggers a big sell off.",,
541,gzo7f7x,2021-05-27 19:21:09,t1_gzo7f7x,t1_gzo4sk8,stocks,Besides I'd rather go forward in a year and see what it's like after the lightning is out,,
542,gzo7fti,2021-05-27 19:21:16,t1_gzo7fti,t1_gzo5zj6,stocks,better than SQ?,,
543,gzo7i9i,2021-05-27 19:21:45,t1_gzo7i9i,t3_nm4vmg,stocks,"trader tv  on youtube, they claim to make millions every day 

&#x200B;

why are they doing  a tv show ?

&#x200B;

he claims $20 gain in amc today scalping 

&#x200B;

7 or 8 massive wins every day 

&#x200B;

who makes this kind of money and does a youtube show for free ?",,
544,gzo7lbd,2021-05-27 19:22:21,t1_gzo7lbd,t1_gznw9py,stocks,"long past ridiculous. 

&#x200B;

sec should have stepped in long ago",,
545,gzo7m97,2021-05-27 19:22:33,t1_gzo7m97,t1_gznsd0z,stocks,To the moon. Time to all in.,,
546,gzo7oa9,2021-05-27 19:22:59,t1_gzo7oa9,t1_gzo5ta4,stocks,lol,,
547,gzo7rab,2021-05-27 19:23:36,t1_gzo7rab,t3_nm3mzs,stocks,Not one but two bounces off resistance today for TLRY?,,
548,gzo7t8j,2021-05-27 19:24:01,t1_gzo7t8j,t1_gzo70rh,stocks,Fucccck. Woulda loved if I sunk in at 8.. Lol. Missed that one.,,
549,gzo7wds,2021-05-27 19:24:41,t1_gzo7wds,t1_gznw4gm,stocks,It won’t.  I was implying that buying it now while the shortage harms HD and holding it until supply returns to normal could give high returns.,,
550,gzo7z0n,2021-05-27 19:25:14,t1_gzo7z0n,t1_gzo6xrc,stocks,"Haha yeah I bought at $43 in January, should have sold when it was almost 60.  I didn't buy much though so I'm gonna let it ride out,  if it's successful it could be really high down the line.",,
551,gzo80xy,2021-05-27 19:25:38,t1_gzo80xy,t1_gzo6y32,stocks,Giants move slower.. but could be sign of things to come. Another rugpull and serious inflation?,,
552,gzo81nb,2021-05-27 19:25:47,t1_gzo81nb,t3_lv5dlb,stocks,"37 years old here, but I just started last November. My choices reflect the atmosphere from Nov - Jan. 

  
BLACKBERRY $BB 26%  
PALANTIR TECHNOLOGIES $PLTR 19%  
AFFIMED $AFMD 13%  
INVITAE $NVTA 12%  
CLOVIS ONCOLOGY $CLVS 7%  
NOKIA $NOK 7%  
ARYA SCIENCES ACQUISITION $ARYA 6%  
BIODELIVERY SCIENCES $BDSI 5%  
ONCTERNAL THERAPEUTICS $ONCT 5%",,
553,gzo828g,2021-05-27 19:25:55,t1_gzo828g,t1_gzo6xrc,stocks,Oh...sorry...,,
554,gzo82jf,2021-05-27 19:25:59,t1_gzo82jf,t1_gzo7z0n,stocks,haha were in it together bro hope this shit booms,,
555,gzo83ln,2021-05-27 19:26:12,t1_gzo83ln,t3_kn1hcd,stocks,It's $28 now lol,,
556,gzo84to,2021-05-27 19:26:27,t1_gzo84to,t1_gzo6vdb,stocks,I wanted my money back 🙃,,
557,gzo85l2,2021-05-27 19:26:36,t1_gzo85l2,t3_nm3qu8,stocks,"The way I see it is if they've been researching the planet and its inhabitants for 1000s of years, unless their is a deposit of source material in our planet that's important to them, and they are slowly depleting the stock then why invade unless they're violent. Pretty sure we'd have been invaded and enslaved 1000 times over by now. Keep going about your business, and don't be the guy who gets us into a galactic arms race.",,
558,gzo87nl,2021-05-27 19:27:03,t1_gzo87nl,t1_glsba4h,stocks,$28 now boi,,
559,gzo87os,2021-05-27 19:27:03,t1_gzo87os,t3_nm3mzs,stocks,"I finally relented and put the last bit of $ I had on the side back into index funds. Pandemic, stimulus, people buying up stocks for meme's. Not sure the market can ever crash again. Would the fed even let it? Probably see an overnight bailout approved.",,
560,gzo8az5,2021-05-27 19:27:43,t1_gzo8az5,t3_nm3mzs,stocks,"Looks like what I thought was going on is going on. There's been some pretty hefty duty SPX futures selling today apparently.

Last time this happened was back in late March and although it worked temporarily, it ultimately failed.",,
561,gzo8cu5,2021-05-27 19:28:06,t1_gzo8cu5,t3_nmeny2,stocks,I’m shocked by its big jump. I researched it and thought not much of it. But it’s the first ipo released on Robinhood. So I think that has something to do with its success.,,
562,gzo8d4a,2021-05-27 19:28:10,t1_gzo8d4a,t1_gzo7fti,stocks,Definitely not.,,
563,gzo8f3o,2021-05-27 19:28:34,t1_gzo8f3o,t1_gzm692b,stocks,"[https://www.reddit.com/r/OverwatchTMZ/comments/ncemfw/dallas\_fuel\_experiencing\_more\_racism\_this\_time\_in/gy6iuoe/?context=3](https://www.reddit.com/r/OverwatchTMZ/comments/ncemfw/dallas_fuel_experiencing_more_racism_this_time_in/gy6iuoe/?context=3)

gross man you're chinese.",,
564,gzo8fwj,2021-05-27 19:28:43,t1_gzo8fwj,t3_nlpv08,stocks,"Assuming this is EPD, this is my second largest holding, and I really love it. In an expensive market, I just keep buying, have a $28 share price, so for me feels pretty undervalued, not least with such a good ""distribution"" / divi. 

&#x200B;

Its latest results I thought were pretty robust considering it had to deal with Covid / reduced demand, Texan weather and not great commodity prices. These are a pretty rare mix of events that is going to cause a strain, and yet they weathered well. 

&#x200B;

They are an extremely well diversified mid-stream company. They have many more miles of gas than oil, have 10s of thousands of miles in total, significant storage, multiple refining locations and also ports. 

&#x200B;

It is now increasingly hard to build even a single pipeline, can you imagine trying to get sign-off for 50000 miles of pipeline? Political winds have given large pipeline companies a significant barrier to entry and competition. 

&#x200B;

Although it's easy to say that political winds and social pressures are moving away from fossil fuels, I'd make a couple of rebuttals. Firstly, not all fossil fuels are equal, going from coal > oil > gas, in that order. Coal exists and is being actively phased out by most of the Western world,, but oil and gas still have decades to run. The data I've seen suggests that although oil falls as a % of total energy by 2050, due to demand from developing world, actually increases in barrels. A lot of people don't realise but less than half of oil goes toward vehicles, and you would be astonished to know what it's used in. Gas will have an even longer shelf-life as the cleanest of the fossil fuels. 

&#x200B;

For me, as a Brit, the fact its an MLP is actually a benefit. Usually I get charged a 15% withholding tax on my American dividends, but as MLPs pay distributions, I am not charged for this. My brokerage takes care of the K-1 paperwork that I understand is a bit of a hassle, but I never see it. A near 8% yield on an American stock is extremely rare, and only my UK miners exceed that (helped as I also get no divi tax on them either as I keep it in an ISA, similar but much better than your IRAs)

&#x200B;

If you like pipelines but don't want to deal with an MLP, I'd probably opt for ENB or KMI.",,
565,gzo8fyp,2021-05-27 19:28:43,t1_gzo8fyp,t3_nm3qu8,stocks,"ASTS, Spacemobile",,
566,gzo8hsy,2021-05-27 19:29:04,t1_gzo8hsy,t3_nm9uol,stocks,LEGO would be pretty good I guess 🤷‍♂️,,
567,gzo8i27,2021-05-27 19:29:07,t1_gzo8i27,t3_nmf4sa,stocks,"There may have been a clause when receiving them that you had to be with the company X amount of years to be vested. If you leave before that time for any reason they retain the shares. I had they same clause at where I work, it was 5 years. Thankfully, I have been here 11years. I am fully vested and the stock are fully mine.",,
568,gzo8io9,2021-05-27 19:29:15,t1_gzo8io9,t3_nm3mzs,stocks,"Might try the George Costanza “opposite” strategy. Any time I want to set a stop loss on a long term play that’s down, set a buy limit instead- Re: NIO",,
569,gzo8n5c,2021-05-27 19:30:07,t1_gzo8n5c,t1_gzo67ie,stocks,It's another heavily shorted stock. People/ institutions finding profit in short hunting. definitely the gravity also.,,
570,gzo8pgo,2021-05-27 19:30:34,t1_gzo8pgo,t3_nm3mzs,stocks,"i posted about the GOED  pump scam, and the bot here deleted it . 

&#x200B;

i didnt know the bot was a fan of boiler rooms",,
571,gzo8pkg,2021-05-27 19:30:35,t1_gzo8pkg,t3_nm3mzs,stocks,any spicy stocks you guys know under $25?,,
572,gzo8qoc,2021-05-27 19:30:48,t1_gzo8qoc,t3_nmf4sa,stocks,"Could be the grants vest over a span of several years. If you don’t stay through the vesting period, parts of each grant would be removed.",,
573,gzo8qts,2021-05-27 19:30:50,t1_gzo8qts,t1_gzo5y51,stocks,"This was a few years ago by now but on the flip side, my work truck is a Ford and runs great for how much it's been through. Just wasn't a good look at the time when I was looking for a vehicle.",,
574,gzo8s0m,2021-05-27 19:31:04,t1_gzo8s0m,t1_gznecmr,stocks,Wash sales are a pain to deal with,,
575,gzo8sxa,2021-05-27 19:31:15,t1_gzo8sxa,t3_nm9uol,stocks,Revolut,,
576,gzo8tr2,2021-05-27 19:31:25,t1_gzo8tr2,t3_nm9vy4,stocks,"It's a 1 to 1 merger but at what price will SOFI supposedly open up at? $10?
So my shares with a cost basis of $15 will lose value post merge?",,
577,gzo8umh,2021-05-27 19:31:35,t1_gzo8umh,t1_gzo8az5,stocks,"well, its clear someone is leaning on the spooz today, and you only need one eye to see it .",,
578,gzo8w0g,2021-05-27 19:31:51,t1_gzo8w0g,t1_gzo8pkg,stocks,"$CLF, $RFP (Obligatory I'm not a financial advisor)",,
579,gzo8ws8,2021-05-27 19:32:00,t1_gzo8ws8,t1_gzo8pkg,stocks,JOAN,,
580,gzo8xhc,2021-05-27 19:32:08,t1_gzo8xhc,t1_gznvvja,stocks,Oh wow didn't even realize BB jumped. It's been red for me for so long I'd given up.,,
581,gzo8xrc,2021-05-27 19:32:11,t1_gzo8xrc,t1_gzo8w0g,stocks,ofcourse ! thanks man,,
582,gzo8zr7,2021-05-27 19:32:35,t1_gzo8zr7,t3_nm3mzs,stocks,GE cup & handle on the 1 day?,,
583,gzo94u3,2021-05-27 19:33:36,t1_gzo94u3,t1_gzo4n6h,stocks,They will but they're also building launch facilities in other areas of the country. So it will build slowly over time most likely.,,
584,gzo9dcu,2021-05-27 19:35:18,t1_gzo9dcu,t1_gz2xn5m,stocks,Tooo bad he blocked me lulz,,
585,gzo9de0,2021-05-27 19:35:18,t1_gzo9de0,t1_gzo7d4v,stocks,Could be a good buy opportunity,,
586,gzo9exr,2021-05-27 19:35:37,t1_gzo9exr,t1_gzo8tr2,stocks,How would that work with my call options? Lol,,
587,gzo9f67,2021-05-27 19:35:40,t1_gzo9f67,t3_nmedcq,stocks,"I work in biomanufacturing and agriculture and it puts a lot of climate science and models across my desk.  You should take a good hard look at the water table before buying anything in that region.  It's not getting the consideration it deserves in real estate markets yet but it will soon and it's going to be devastating to regions like Boca Chica, even the fast growing ones.  Especially the fast growing ones in most cases.  Their drought condition hasn't been better than D0 (abnormally dry) in over a decade and they're seeing D3 (extreme drought) more frequently each year.  It's not about the lack of water, it's about the price of water.  I've had a lot of career opportunities down there but you literally couldn't pay me a million dollars to take on that kind of long term risk.",,
588,gzo9iwk,2021-05-27 19:36:24,t1_gzo9iwk,t1_gzo87os,stocks,Indexing investing will beat active investing 7.8 times out of 10. It's a smart move.,,
589,gzo9jcg,2021-05-27 19:36:29,t1_gzo9jcg,t1_gzo1vco,stocks,A few thousands? You made me laugh.,,
590,gzo9n6k,2021-05-27 19:37:15,t1_gzo9n6k,t1_gznsmrb,stocks,"Yes, misquoting someone does tend to make their sentences make less sense. Amazing.",,
591,gzo9oc6,2021-05-27 19:37:28,t1_gzo9oc6,t1_gznsmrb,stocks,"If it's not worth considering it's not worth the space in my brain. And what a shitty deal for your family right? Hey mom and dad I have been working for Ford for 25 years as an engineer, I can get you 120 bucks off a car. Lol",,
592,gzo9p3m,2021-05-27 19:37:37,t1_gzo9p3m,t1_gznl6ur,stocks,"I’ve heard bigger numbers for that discount, where did you get that from?",,
593,gzo9qgh,2021-05-27 19:37:52,t1_gzo9qgh,t1_gxcwd04,stocks,There is a lot of insider trading but what’s new? 1Q was amazing in terms of the growth,,
594,gzo9qi5,2021-05-27 19:37:53,t1_gzo9qi5,t1_gzo9f67,stocks,Good to know.,,
595,gzo9spz,2021-05-27 19:38:19,t1_gzo9spz,t1_gzo5cj1,stocks,"oh, this is for boring stuff.    got ya",,
596,gzo9vk8,2021-05-27 19:38:52,t1_gzo9vk8,t1_gzo8tr2,stocks,the price it is trading at now pre-merger.,,
597,gzo9wft,2021-05-27 19:39:02,t1_gzo9wft,t1_gzo8i27,stocks,"I did encounter that for a portion of the originally awarded stocks. 

51,702 is the number that was already vested when I departed.",,
598,gzo9wgk,2021-05-27 19:39:02,t1_gzo9wgk,t1_gzo8umh,stocks,TIL,,
599,gzo9wr5,2021-05-27 19:39:05,t1_gzo9wr5,t1_gzo9iwk,stocks,"Yeah, I thought things would be shaky with the election and I would get back in right after when the results were in. Then the pandemic hit and I stayed out longer thinking that would surely drive down the market. Who knew everything would rocket up to all time highs. Pretty good lesson in why just staying in no matter what works.",,
600,gzo9y2s,2021-05-27 19:39:21,t1_gzo9y2s,t3_nm3mzs,stocks,"Lmao I dumped my AMC in February because I wanted to ""invest seriously"" and ""not gamble on meme stocks"". I'm clearly a clown for thinking that investing in good companies that generate revenue/profit was the preferable strategy",,
601,gzo9ybv,2021-05-27 19:39:23,t1_gzo9ybv,t1_gzmxmqs,stocks,"Also alien tentacle dildo companies.

Combination exposure and insertion therapy",,
602,gzo9zzm,2021-05-27 19:39:43,t1_gzo9zzm,t1_gzo8qoc,stocks,"Replied to another comment, but unfortunately this isn't a vesting issue. Trying to find another possible explanation... or recourse.",,
603,gzoa0ll,2021-05-27 19:39:50,t1_gzoa0ll,t3_nmc2cf,stocks,Bullish.  Bought Dec 15 calls 3 weeks ago.  My PT is 18 based on next Fib extension,,
604,gzoa22e,2021-05-27 19:40:07,t1_gzoa22e,t1_gzo7lbd,stocks,I know right? Insane that HF and MM and big banks weren’t chained in 08 and look at what they’re doing today. Makes me sick.,,
605,gzoa2ns,2021-05-27 19:40:15,t1_gzoa2ns,t1_gzo6hd5,stocks,Waiting for that pillow fight,,
606,gzoa553,2021-05-27 19:40:44,t1_gzoa553,t1_gzo7btk,stocks,its turning into a new wallstreetbets.,,
607,gzoa8cs,2021-05-27 19:41:23,t1_gzoa8cs,t1_gzo5nsl,stocks,Only for people who buy a new pickup every 3-4 years though!,,
608,gzoa8ja,2021-05-27 19:41:25,t1_gzoa8ja,t1_gzmwg7q,stocks,Everything is fine go about your day citizen.,,
609,gzoabqr,2021-05-27 19:42:03,t1_gzoabqr,t1_gznuih6,stocks,"""Realistically""

""at 50""

Oh boy",,
610,gzoad38,2021-05-27 19:42:19,t1_gzoad38,t3_nmf4sa,stocks,"I would call your former employer, get an explanation from HR and request all of the documentation around the stock plan. I would assume it’s also something to do with the vesting period but clearly if they are just robbing you, a court can settle that. Doubt that’s the case.",,
611,gzoaeo6,2021-05-27 19:42:37,t1_gzoaeo6,t3_nmd9cr,stocks,LMND,,
612,gzoaf95,2021-05-27 19:42:44,t1_gzoaf95,t3_nm3mzs,stocks,Should I pull out of SPCE now?,,
613,gzoafh0,2021-05-27 19:42:47,t1_gzoafh0,t1_gzo90r6,stocks, good timing on this call TANKED!  hard,,
614,gzoail9,2021-05-27 19:43:24,t1_gzoail9,t1_gzo9y2s,stocks,"If its any help, just like how you couldnt time this, you wouldnt be able to time the exit either, most people will hold this bag when they run for the exits, it could be you too.",,
615,gzoaj7e,2021-05-27 19:43:31,t1_gzoaj7e,t1_gzo9y2s,stocks,"You are not, and you did the smart thing, if not the ""right"" thing. There are a dozen other entry points for AMC you could have bought in at that would have seen you losing money.",,
616,gzoak0h,2021-05-27 19:43:40,t1_gzoak0h,t1_gznow5y,stocks,"I'm rather in the other meme OG stock, but in the future do not believe official shorted SI because those are easily cooked, to be sure check if stock was shorted a lot in the past and also have a massive Failure to Deliver history. It may a sign that a past shorts were ""closed"" with strategic failure to deliver and it may rise with no ""reason"" in the future. At least this is a theory from ""cultists"" sub.",,
617,gzoanqx,2021-05-27 19:44:24,t1_gzoanqx,t1_gzo5n3j,stocks,At the rate its been going? Probably not but I can't see the future. I wouldn't be surprised if it dips in a couple of days but I don't really care because I'm in it for the long run.,,
618,gzoaojm,2021-05-27 19:44:34,t1_gzoaojm,t3_nm3qu8,stocks,Probably ABNB because even aliens need a place to stay,,
619,gzoaosa,2021-05-27 19:44:37,t1_gzoaosa,t1_gzntztx,stocks,I think I'll hold till then,,
620,gzoarbj,2021-05-27 19:45:07,t1_gzoarbj,t3_nm3qu8,stocks,Tin foil 📈,,
621,gzoarjx,2021-05-27 19:45:10,t1_gzoarjx,t3_nmbg2b,stocks,"You had me at ""bananas""",,
622,gzoatr3,2021-05-27 19:45:35,t1_gzoatr3,t1_gzoafh0,stocks, 28.50 to 26.50   for the record   without any adverse movement first,,
623,gzoaw9v,2021-05-27 19:46:05,t1_gzoaw9v,t1_gzo8pkg,stocks,"I don't understand when people ask about stocks based on share price. A company could reverse split and its $25 stock would suddenly be a $50 stock without changing the value of the company at all. Do you actually only have $25? If that's the case, spend it on beans and rice, not a single share of a company whose stock is trading below $25.",,
