,comment_id,created,fullname,parent_id,subreddit,text,post_id,title
214,gznt63y,2021-05-27 17:41:14,t1_gznt63y,t3_nm3mzs,stocks,Hgen near its peak,,
215,gznt6yq,2021-05-27 17:41:24,t1_gznt6yq,t3_nm3mzs,stocks,"UWMC crashed 2 weeks ago, but has since gone up almost 50% in a short time, what gives?",,
216,gznt7e0,2021-05-27 17:41:28,t1_gznt7e0,t1_gznq9x5,stocks,"Thank you, I'll remember to check this",,
217,gznt9zr,2021-05-27 17:41:59,t1_gznt9zr,t3_nmb9t6,stocks,Dealers typically still make money when selling at invoice price.,,
218,gzntawe,2021-05-27 17:42:09,t1_gzntawe,t3_nm9uol,stocks,OpenAI.,,
219,gzntbvf,2021-05-27 17:42:20,t1_gzntbvf,t3_nm3mzs,stocks,With the shortage of industrial supplies do you think it’s a smart move to buy HD (Home depot) while its low or is it worsening some of their long term fundamentals?,,
220,gzntdag,2021-05-27 17:42:37,t1_gzntdag,t3_nm3mzs,stocks,Who needs investing fundamentals lol.,,
221,gzntdyq,2021-05-27 17:42:45,t1_gzntdyq,t1_gznfwqj,stocks,Healthy balance sheet is tons of cash and little debt.,,
222,gznteex,2021-05-27 17:42:50,t1_gznteex,t3_nm3mzs,stocks,Thoughts on Applied Materials? I bought at 121 a few weeks ago and it's sitting at around 137 after beating earnings.,,
223,gzntk51,2021-05-27 17:43:56,t1_gzntk51,t3_nm3mzs,stocks,"Looking at my trade history, realizing I bought AMC way back early this year at $4, but then sold at $8, then bought again at $12, then just sold today, now several months later at $25, imagining if I had held onto to all those $4 shares, of course I sold earlier this year to try to lock in profits, so the shares I bought later on, were all using Houses money.",,
224,gzntl4j,2021-05-27 17:44:08,t1_gzntl4j,t3_nm3mzs,stocks,This AMC surge pretty much bailed out any bag holder of it from January. Maybe the diamond hands slogan was right all along.,,
225,gzntlsw,2021-05-27 17:44:15,t1_gzntlsw,t1_gzcmck8,stocks,"Definitely possible, at this point it will probably follow the indexes. Either way great companies that should accrue more value over time.",,
226,gzntsq0,2021-05-27 17:45:34,t1_gzntsq0,t1_gznpu2j,stocks,Especially if you wanted the cool new truck anyways,,
227,gzntt54,2021-05-27 17:45:39,t1_gzntt54,t1_gznm1dc,stocks,That isn't at all true,,
228,gzntztx,2021-05-27 17:46:54,t1_gzntztx,t1_gznpsyy,stocks,Fast and Furious will be big. end of June.,,
229,gznu1z0,2021-05-27 17:47:18,t1_gznu1z0,t3_nm3mzs,stocks,"XLE (oil/energy) can't stop acting like a dog on a day it ""really"" should be doing well.",,
230,gznu3wo,2021-05-27 17:47:39,t1_gznu3wo,t1_gzn8s0c,stocks,What's this referring to?,,
231,gznu8iz,2021-05-27 17:48:32,t1_gznu8iz,t1_gzma0xb,stocks,I'll invest in ammo and take your bunker so that saves me some money.,,
232,gznu8vi,2021-05-27 17:48:36,t1_gznu8vi,t1_gznsuw8,stocks,"Lucky, I had it at $4, then sold to breakeven my costs earlier this year, only kept a couple shares, in the case the squeeze or some astronomical needle really did end up happening, to think 4 months later, it actually did, just sold today at slightly over $25, imagining if I held onto all shares, of course I had to try to sell, so I knew everything I was gambling with was houses money, so at this point really greed, and got to be grateful still walked out in the green lol.",,
233,gznua8c,2021-05-27 17:48:51,t1_gznua8c,t1_gznq9wr,stocks,"Well, he is rand al thor, all male channelers eventually go mad.",,
234,gznubny,2021-05-27 17:49:08,t1_gznubny,t3_nm3mzs,stocks,Really kicking myself for taking profits on AMC at $14 now. This was last week haha. Feels bad,,
235,gznucxr,2021-05-27 17:49:22,t1_gznucxr,t1_gznteex,stocks,"I also bought it recently.

If you're swing trading, you might want to take profits at some point given the way all semis have been behaving for months, but I'm willing to sit it out.",,
236,gznugk4,2021-05-27 17:50:03,t1_gznugk4,t1_gznow5y,stocks,It’s probably gonna hit 30 today. Based on Ortex data the squeeze hasn’t even really started yet. This is just FOMO prior to the squeeze.,,
237,gznuhs7,2021-05-27 17:50:17,t1_gznuhs7,t1_gznu8vi,stocks,I have 675 shares at an average price of $3.19. I'm loving life right now lol,,
238,gznuih6,2021-05-27 17:50:24,t1_gznuih6,t3_nm3mzs,stocks,Realistically how high do you guys think amc will go? I bought at 19.33. I’m thinking about closing 75% of my shares at 50. Is that a good idea? I’m new so idk,,
239,gznujj4,2021-05-27 17:50:36,t1_gznujj4,t3_nlufsp,stocks,"It's one of those stocks that can certainly make money, but I have zero interest in being involved with anything Viacom so they can sit and spin. I'd rather have conviction in the company.",,
240,gznuk8s,2021-05-27 17:50:44,t1_gznuk8s,t1_gznt6yq,stocks,If you find out let me know. I was down 50% and now I’m even again. On like 3k,,
241,gznuor4,2021-05-27 17:51:34,t1_gznuor4,t1_gzmfxhd,stocks,That would definitely make news! Lol,,
242,gznupb3,2021-05-27 17:51:41,t1_gznupb3,t3_nm4kla,stocks,Thank You,,
243,gznupbz,2021-05-27 17:51:41,t1_gznupbz,t1_gzmfz1r,stocks,Invest in raid ⚡ 😂,,
244,gznupcl,2021-05-27 17:51:41,t1_gznupcl,t1_gznpfsc,stocks,Dying right now: (,,
245,gznuq10,2021-05-27 17:51:49,t1_gznuq10,t1_gznuih6,stocks,It’s quite amazing since they have been printing stock non stop. Even that couldn’t stop the surge.,,
246,gznuqla,2021-05-27 17:51:55,t1_gznuqla,t1_gznuih6,stocks,No one knows. If you start throwing out price targets you know people will sell way before it.,,
247,gznusgn,2021-05-27 17:52:16,t1_gznusgn,t3_nm3mzs,stocks,"Need some option advice. Bought a 145c 1/22/2022 CRWD call for 30.95, currently at 80.15, about a 160% return.  I believe in the company 100% long term but believe the market will correct this year. Should I sell and convert profits to stock. Or hedge with put strategies.",,
248,gznuu2x,2021-05-27 17:52:33,t1_gznuu2x,t1_gznuqla,stocks,So just set a number and stick with it?,,
249,gznuvis,2021-05-27 17:52:49,t1_gznuvis,t1_gznsijl,stocks,"I see your approach, I don’t think it is bad, but than again I would rather put more in my higher conviction picks. You can’t keep track of 40 stocks the same way you keep track of 10. 

You are building your own EV ETF, that is something else than investing in individual stocks, just based on the stock alone. It can work for you, but right now I hope you are not overinvested in that industry, because most of these will not be able to keep their current valuations (Tesla, Nio,..).

BTW, in an ETF you also have giant gainers that often drive the Index, it is really interesting if you look at the data, how important the highest gainers are and if you buy let’s say 40 stocks with out one, you will most likely underperform.",,
250,gznuw61,2021-05-27 17:52:57,t1_gznuw61,t3_nmb9t6,stocks,"Would be interested in knowing whether other car manufacturers have similar plans. 

With that said, I’ll probably never buy a brand new car because of the excessive depreciation. I’ll take it 3-4 years old at 50% off, thank you!",,
251,gznuwuf,2021-05-27 17:53:05,t1_gznuwuf,t1_gzmbqcc,stocks,"The stuff released in no way proved there were aliens, just UAPs capable beyond currently available data.

Most of the people associated with it believe it to be most likely terrestrial - as they stated in their interviews.  They only acknowledged the possibility that it could be extra terrestrial.  Hence why people don't care.  They are also pretty confident that there couldn't be occupants, suggesting they were drones.

Now if one of them parked and an alien got out that would be a mind fuck and the world wouldn't ignore that.",,
252,gznuyhy,2021-05-27 17:53:24,t1_gznuyhy,t1_gznt4mx,stocks,"No. He is saying if something is worth knowing, then it is worth considering. Pretty much by definition",,
253,gznuzwc,2021-05-27 17:53:39,t1_gznuzwc,t1_gznsmrb,stocks,Like friction in high-school physic,,
254,gznv283,2021-05-27 17:54:05,t1_gznv283,t1_gznpq52,stocks,"Did the same thing, cashed out and will stay out til mid week. Holding on to my conviction plays, this kinda shit is to scary. Nearly everything in looking at is coming up so quickly. Not a fan.",,
255,gznv3tm,2021-05-27 17:54:24,t1_gznv3tm,t1_gznoxgu,stocks,"Never heard of that one, what’s the ticker?",,
256,gznv3zd,2021-05-27 17:54:26,t1_gznv3zd,t3_nm9uol,stocks,Redbull,,
257,gznv4vc,2021-05-27 17:54:36,t1_gznv4vc,t3_nmc2cf,stocks,GE is coming up on a key resistance area of around $14.50 area. If she can break through that then she's got more upside to come.,,
258,gznv4y0,2021-05-27 17:54:37,t1_gznv4y0,t1_gznuhs7,stocks,"Lol that's insane lucky! What made you buy it over a year ago? I had about 60 shares at $4, but I sold most at $12, then just again at $25, only have about 6-7 shares left, essentially tips lol.",,
259,gznv549,2021-05-27 17:54:39,t1_gznv549,t1_gzmlgcm,stocks,"They did not.  They suggested (not admitted) that there are potentially unmanned aerial vehicles more advanced than publicly available information on aerospace technologies.

Which isn't really outlandish in anyway.

UFO/UAPs = aliens, just unidentified machines.",,
260,,2021-05-27 17:54:31,t3_nmd9cr,,stocks,"Hi there. I have a good portion of my portfolio in amazon, microsoft and tesla.
Lets be real guys, this kind of stocks will not go anywhere. Their valution is simply top much. They will never reach 20 Trillion market cap.

I would like to rebalance towards growth stock with a market cap between 500M and 5B with the potential to be ten baggers.

What would you pick?",nmd9cr,The next Ten Bagger?
261,gznvafd,2021-05-27 17:55:39,t1_gznvafd,t3_nm3mzs,stocks,Any news on why everything is green?,,
262,gznvald,2021-05-27 17:55:41,t1_gznvald,t1_gznv4y0,stocks,I'm a stubborn asshole who believes in the moviegoing experience and wanted to put my money where my mouth is lol,,
263,gznvf70,2021-05-27 17:56:34,t1_gznvf70,t1_gznhwci,stocks,"Set a remindme for 5 years.

Seriously.",,
264,gznviqc,2021-05-27 17:57:15,t1_gznviqc,t1_gzn96km,stocks,Employment data comes out next Friday 😕 and CPI the following Thursday 😬. Something to keep in mind.,,
265,gznvjgv,2021-05-27 17:57:23,t1_gznvjgv,t1_gznuu2x,stocks,If it were me i'd sell shares on the way up. Like say I have 50 shares. Sell 10 now. Sell 10 at 29. Sell 10 at 30. Sell 10 at 32 and then have a higher number in mind for last 10. If it doesn't hit that number have a trailing stop loss.,,
266,gznvm83,2021-05-27 17:57:54,t1_gznvm83,t1_gznvafd,stocks,I'm actually sitting here wondering if we may fail to get back to back up again in the SPX.,,
267,gznvmc0,2021-05-27 17:57:55,t1_gznvmc0,t3_nm3qu8,stocks,Maple syrup,,
268,gznvmh8,2021-05-27 17:57:57,t1_gznvmh8,t3_nm3mzs,stocks,AMC making me sick to my stomach I sold 10 $4 shares at a loss a few months ago. The market is truly a circus now.,,
269,gznvnlx,2021-05-27 17:58:10,t1_gznvnlx,t3_nm3mzs,stocks,damn sold my AMC earlier on for $22 and now its at $29 :(,,
270,gznvqw0,2021-05-27 17:58:47,t1_gznvqw0,t1_gzntawe,stocks,This will probably be wildly overpriced as well,,
271,gznvr47,2021-05-27 17:58:49,t1_gznvr47,t1_gznmxje,stocks,Brutalized.,,
272,gznvtjd,2021-05-27 17:59:16,t1_gznvtjd,t1_gznvald,stocks,"Lol nice congrats!! That's incredible, I actually work in the movie industry, so bought it largely to support movie theaters, one of the biggest things I missed most from pre-pandemic life, I'd be too risk averse to spend $2000 on it, so only put in a couple $100s, prepared for whichever way it'd swing, thankfully went upwards haha!!",,
273,gznvufd,2021-05-27 17:59:27,t1_gznvufd,t1_gznrqjs,stocks,"The medical tech is extremely advanced in the including replacement of body parts and there is AI. Brain not so much but there are races or experiments with augmentation.

Lots of people die in the show but they're red shirts or bad guys or plot devices.",,
274,gznvujg,2021-05-27 17:59:28,t1_gznvujg,t1_gzn7ii7,stocks,Could be people turning a three day weekend into a five day weekend. We could all use a break.,,
275,gznvvfz,2021-05-27 17:59:38,t1_gznvvfz,t3_nm3mzs,stocks,There’s really no telling what frenzied retail will do is there,,
276,gznvvja,2021-05-27 17:59:39,t1_gznvvja,t3_nm3mzs,stocks,"Everybody in here is talking about AMC, but I’m watching my BB holding jump just praying I can get out without losing anything.",,
277,,2021-05-27 17:59:55,t3_nmddq9,,stocks,Looking to code a program that will track mentions across social media to try and put stocks with growing momentum on a watchlist early. I would think something like this exists. Does anyone know any websites (free hopefully) which have this capability? I remember seeing a TikTok with websites similar but can’t find it. Thanks!,nmddq9,Social media mention tracking?
278,gznvyqn,2021-05-27 18:00:15,t1_gznvyqn,t1_gygxmpk,stocks,same here looking for the amc subreddit,,
279,gznw0vo,2021-05-27 18:00:39,t1_gznw0vo,t1_gznvnlx,stocks,I told my dad to sell his yesterday cuz he finally broke even at 18. I hope he doesn’t see what amc is at rn.,,
280,gznw0xm,2021-05-27 18:00:39,t1_gznw0xm,t1_gzmf3zw,stocks,"Why would people care?  What is one thing you have seen humanity do in the last year en masse or represented by its leaders that makes you feel as if human beings, (by and large), care about anything but their own specific desires.  

I, personally, think it would be fascinating and could not overstate the monumental importance of it...but the vast majority of people...nah.  You can’t get half of the people in America to agree with the other half on a goddamn vaccine.  So there’s no way I would believe you could get all of the people to be interested in it.  Only half, and in that case it is only a news story for one side of politics or another.  I’m still waiting for the story that would supersede politics.  I used to believe that story would be disclosure, but humans will merely be the organic rot from which the next world will be born.  That’s about the best use I can think of for us.",,
281,gznw4ce,2021-05-27 18:01:18,t1_gznw4ce,t1_gznsk48,stocks,Make that $29,,
282,gznw4gm,2021-05-27 18:01:19,t1_gznw4gm,t1_gzntbvf,stocks,I don't believe HD is going to benefit from industrial supplies shortages. They will have a harder time to restock (longueur lead time by factories) and will have to increase prices (which doesn't mean they will make more profit). If anything you'd want the companies who are the suppliers of HD.,,
283,gznw55n,2021-05-27 18:01:27,t1_gznw55n,t1_gznvtjd,stocks,AMC A-List changed my life. Its the least I could do for them haha,,
284,gznw5r0,2021-05-27 18:01:34,t1_gznw5r0,t1_gznuyhy,stocks,"He said it's not worth considering when deciding whether to buy actual Ford stock, like it should not factor in your decision to do so.  But, it is still something worth knowing about, like if you have the stock.",,
285,gznw63w,2021-05-27 18:01:38,t1_gznw63w,t1_ghhtzfl,stocks,aged even worse,,
286,gznw782,2021-05-27 18:01:51,t1_gznw782,t1_gznvvja,stocks,"Well I've bought in few shares when BB was around $18... I've managed to average down to 11.5, although if we get to that point I'm not going to sell. Will start thinking around $20",,
287,gznw78s,2021-05-27 18:01:51,t1_gznw78s,t1_gznuyhy,stocks,"But is it worth considering when buying Ford stock? Would you buy Ford stock just for that $120 discount? No, therefore it's not worth considering when buying Ford stock, but worth knowing in case one ever does.",,
288,gznw7l7,2021-05-27 18:01:55,t1_gznw7l7,t3_nm94eb,stocks,"I prefer to stay with well-financed companies that have deep pocket, like HON, GOOG and IBM.  HON already has commercial applications.",,
289,gznw9py,2021-05-27 18:02:19,t1_gznw9py,t3_nm4vmg,stocks,This is getting ridiculous.,,
290,gznwa8l,2021-05-27 18:02:25,t1_gznwa8l,t1_gzky2hg,stocks,TD Ameritrade charges $39 as well,,
291,gznwb5e,2021-05-27 18:02:36,t1_gznwb5e,t1_gznvmh8,stocks,"It’s not, just short sellers getting destroyed by by retailers. Funny as hell to see.

Imagine going to Harvard or an Ivy League school losing your entire hedge fund or losing an entire investment portfolio to dumb money.

No skin in the game but things will get back to normal. I’d say the easy money of these idiots shorting everything with tons of cash is long gone",,
292,gznwb8j,2021-05-27 18:02:37,t1_gznwb8j,t3_nmd9cr,stocks,Are you not seeing what's happening with AMC and gme...,,
293,gznwble,2021-05-27 18:02:41,t1_gznwble,t3_nmdg1u,stocks,"Sorry, your [submission](https://www.reddit.com/r/stocks/comments/nmdg1u/is_there_a_website_that_you_can_track_what_stocks/) in /r/stocks has been automatically removed due to Rule 3:  Low effort.

If you just want to post 1 liners or just want to know everyone's thoughts, then post a comment to our daily discussion thread which are generally stickied or [click here.](https://www.reddit.com/r/stocks/search?q=author%3Aautomoderator+daily+discussion&restrict_sr=on&sort=new&t=all)

If you're wondering **why a stock moved** a certain way, check out [Reuters](https://www.reuters.com/), [Motley Fool](https://www.fool.com/), and **especially** [Finviz](https://finviz.com/quote.ashx?t=spy) **which aggregates the most news for almost every stock**.

If instead you're wondering what a term means, go to Investopedia.com and search for said term there.

Either way come back here to repost with your findings, thanks!

A list of the [rules can be found here](https://www.reddit.com/r/stocks/about/rules/), and if you're new to r/stocks please see the [wiki](https://www.reddit.com/r/stocks/wiki/index) and/or [read this post.](https://www.reddit.com/r/stocks/comments/4x1419/if_youre_new_here_read_this_post_first/)

*I am a bot, and this action was performed automatically. Please [contact the moderators of this subreddit](/message/compose/?to=/r/stocks) if you have any questions or concerns.*",,
294,gznwd25,2021-05-27 18:02:59,t1_gznwd25,t3_nmdgem,stocks,"Sorry, your [submission](https://www.reddit.com/r/stocks/comments/nmdgem/nwyu_new_you_inc_subsidiary_st_brands_acquires/) in /r/stocks has been automatically removed due to Rule 3:  Low effort.

If you just want to post 1 liners or just want to know everyone's thoughts, then post a comment to our daily discussion thread which are generally stickied or [click here.](https://www.reddit.com/r/stocks/search?q=author%3Aautomoderator+daily+discussion&restrict_sr=on&sort=new&t=all)

If you're wondering **why a stock moved** a certain way, check out [Reuters](https://www.reuters.com/), [Motley Fool](https://www.fool.com/), and **especially** [Finviz](https://finviz.com/quote.ashx?t=spy) **which aggregates the most news for almost every stock**.

If instead you're wondering what a term means, go to Investopedia.com and search for said term there.

Either way come back here to repost with your findings, thanks!

A list of the [rules can be found here](https://www.reddit.com/r/stocks/about/rules/), and if you're new to r/stocks please see the [wiki](https://www.reddit.com/r/stocks/wiki/index) and/or [read this post.](https://www.reddit.com/r/stocks/comments/4x1419/if_youre_new_here_read_this_post_first/)

*I am a bot, and this action was performed automatically. Please [contact the moderators of this subreddit](/message/compose/?to=/r/stocks) if you have any questions or concerns.*",,
295,gznwd2v,2021-05-27 18:02:59,t1_gznwd2v,t1_gznvvfz,stocks,"Eh, the amount of shares flying around (volume) this isn’t retail alone.  There are bigger players in it too.",,
296,gznwe8a,2021-05-27 18:03:12,t1_gznwe8a,t3_nmd9cr,stocks,Whats the point of ten bagger if u blow ur account 15 times,,
297,gznwecj,2021-05-27 18:03:14,t1_gznwecj,t1_gznuwuf,stocks,"Yeah I know, that’s why I wrote the possibility.  It was the first acknowledgement that it was technology and not a technical artifact, or otherwise inorganic routine.",,
298,gznwgfz,2021-05-27 18:03:38,t1_gznwgfz,t3_nm3mzs,stocks,"SNOW thrashes paper hands. Dropped 10+ pts after hours, as low as $218, responding to earning report. Today up, \~ $243.",,
299,gznwgtt,2021-05-27 18:03:43,t1_gznwgtt,t1_gznvnlx,stocks,"I bought a way out of the money call the other day when it started popping but it lost money by the end of the day, so I sold it at a slight loss.  If I had held to today, I would have made $400 from $50.  Oh well.",,
300,gznwl39,2021-05-27 18:04:31,t1_gznwl39,t1_gznvafd,stocks,Not all my stocks are green🥲,,
301,gznwl3y,2021-05-27 18:04:32,t1_gznwl3y,t1_gznw0vo,stocks,"Get rid of the wifi, quick!",,
302,gznwl8p,2021-05-27 18:04:33,t1_gznwl8p,t3_nm3mzs,stocks,"I accidentally just put 2k down on puts for tomorrow, and the second I do AMC tanks.

This is the world trying to bait me into thinking nothing matters",,
303,gznwotd,2021-05-27 18:05:12,t1_gznwotd,t3_nm3mzs,stocks,"AMC really just made up 4 years of losses in one day... 😂

This market is dumb. Amazing, but dumb.",,
304,gznwowq,2021-05-27 18:05:14,t1_gznwowq,t3_nm9uol,stocks,"Green Bay Packers, even though they're technically public.",,
305,gznwpne,2021-05-27 18:05:22,t1_gznwpne,t1_gznwgfz,stocks,Glad I held,,
306,gznwqln,2021-05-27 18:05:32,t1_gznwqln,t1_gznvvfz,stocks,Retail doesn't move billions in a stock.,,
307,gznwrt0,2021-05-27 18:05:46,t1_gznwrt0,t1_gznvald,stocks,It’s probably a good idea to sell some for a profit now and let the rest ride for free if you believe in the stock,,
308,gznws2t,2021-05-27 18:05:49,t1_gznws2t,t1_gznw55n,stocks,"Nice always wished I got it, but I only go to movie theaters every 1-2 months to really take advantage of it! Convinced I've found more success in the stock market, but just thinking about companies I personally use and going with it, independent of popular mainstream opinion. SHOP, PTON, DIS, all comes to mind. Can't wait for movie theaters to full open across the country again lol!",,
309,gznws34,2021-05-27 18:05:49,t1_gznws34,t3_nmd9cr,stocks,Nvidia after split,,
310,gznws58,2021-05-27 18:05:49,t1_gznws58,t1_gznt234,stocks,Oh interesting. So it's basically a penalty for people who make capital gains while also making over a certain amount from their normal salary.,,
311,gznwsmc,2021-05-27 18:05:55,t1_gznwsmc,t1_gznwl3y,stocks,Lol yeah. Damnit,,
312,gznwvai,2021-05-27 18:06:24,t1_gznwvai,t1_gznoxgu,stocks,This is all starting to look like a very unhealthy climb. I hate to be gloom and doom but shit.,,
313,gznwy1l,2021-05-27 18:06:56,t1_gznwy1l,t1_gznmxje,stocks,"Yes, my 10 year old 3rd car Mini

lol",,
314,gznwy3p,2021-05-27 18:06:57,t1_gznwy3p,t1_gznupcl,stocks,"Squeezes don't last that long, you'll eventually be fine.",,
315,gznx1i2,2021-05-27 18:07:36,t1_gznx1i2,t1_gznk25s,stocks,"While the price is correct it’s a very misleading way to look at the situation. The dealer doesn’t just sell it for invoice (cost) because Ford says to. Ford reimburses the dealer some of that discount. Everyone in this thread saying it’s 0.4% and no big deal has no idea. If it was on a model that the dealer was willing to negotiate to invoice with no discount, than with the discount they’d likely go below invoice since they would now have more money from Ford to work with. That’s a rough summary but the discount is very good right now when nearly every model goes for MSRP and in normal times when things are more negotiable it can still be good.",,
316,gznx48d,2021-05-27 18:08:08,t1_gznx48d,t1_gznw78s,stocks,is this an extreme couponing subreddit or what.,,
317,,2021-05-27 18:08:47,t3_nmdlau,,stocks,I was wondering if anyone knows what’s causing the RBLX stock price to surge? I can’t seem to find any news that is driving it? I was able to cash out at $88 because I think it was a bit overvalued at that time.,nmdlau,What’s the catalyst driving the uptick in RBLX price?
318,,2021-05-27 18:09:22,t3_nmdltr,,stocks,"I live in Europe and recently decided to give the stock market a go. My broker trades on Xetra (if that is even the way to say this). From my understanding this is the European market exchange, so my question is, how are the markets connected?

The prices seem to be nearly identical as well as the trends (at least when comparing the stocks of the same companies on yahoo finance, Apple for example). The opening hours of the markets are completely different due to the time zones, maybe my question is stupid but I somehow cannot understand how it works.

Would be very grateful if someone could give some further information on that. :)",nmdltr,How are the different markets connected?
319,gznxaw2,2021-05-27 18:09:27,t1_gznxaw2,t1_gzkc9sb,stocks,"Oh good, I'm looking to finally buy in the next year.",,
320,gznxbbl,2021-05-27 18:09:32,t1_gznxbbl,t1_gznqeub,stocks,what's ma cooking for dinner?,,
321,gznxccg,2021-05-27 18:09:44,t1_gznxccg,t1_gznow5y,stocks,"Which price did you short it on? Get out of it now. You shouldn't be messing with meme stocks like AMC, GME, UWMC, RKT, and many others.",,
322,gznxd10,2021-05-27 18:09:52,t1_gznxd10,t1_gznavlg,stocks,So Aldi?,,
323,gznxeyu,2021-05-27 18:10:15,t1_gznxeyu,t3_nm3mzs,stocks,"I just bought puts on AMC. I'm an options ""noob"" but with this rapid rise I had to take this opportunity to try it out. I can take the loss if need be but i'll be sad haha",,
324,gznxfet,2021-05-27 18:10:20,t1_gznxfet,t3_nmd9cr,stocks,Cang,,
325,gznxg4t,2021-05-27 18:10:28,t1_gznxg4t,t3_nmddq9,stocks,Isn't that $BUZZ ETF doing exactly this ?,,
