,comment_id,created,fullname,parent_id,subreddit,text,post_id,title
0,gzngt6i,2021-05-27 16:14:06,t1_gzngt6i,t3_nlqtjo,stocks,I understand that good news has Resulted in,,
1,gzngvuv,2021-05-27 16:14:38,t1_gzngvuv,t1_gznecmr,stocks,"The losses will offset the gains,thus lowering the tax liability. I would’ve owed taxes on gains this year if the $4000 loss from last year in my other account didn’t cancel the overall $2500 gain in the other account. That’s overall taxes with all accounts reported. Many do tax loss harvesting in their individual account by selling losing positions to lower taxes.",,
2,gzngw1s,2021-05-27 16:14:40,t1_gzngw1s,t3_nm9uol,stocks,"I believe that there are two things that will always capture people's attention: the power of porn and the power of Elon. So, I would quickly invest in the IPO of any of the following:

Pornhub

Only Fans

SpaceX

Neuralink",,
3,gzngwfv,2021-05-27 16:14:45,t1_gzngwfv,t1_gy6m6sa,stocks,You suck poop. We're winning,,
4,gzngx0v,2021-05-27 16:14:52,t1_gzngx0v,t1_gzncdyi,stocks,Fully automatic luxury space communism,,
5,gzngxur,2021-05-27 16:15:02,t1_gzngxur,t1_gy8cbrz,stocks,I'm starting to match your gains now..,,
6,gzngy9j,2021-05-27 16:15:07,t1_gzngy9j,t1_gzncdyi,stocks,"Within the federation any needs are meet, especially on earth. The high level of tech includes basically unlimited power, automation of anything, and replicator tech that givens you anything you'd want including food. People literally don't need to work but often choose to because bored. Things and labor don't really have value at that point and capitalism is over.

Colonies or other races can be different. People might choose to give up tech or just not have access to things on a new world. Other races might still have capitalism and trade. People within the federation might interact with people that still use money or trade so might as well.",,
7,gznh4o8,2021-05-27 16:16:25,t1_gznh4o8,t1_gzmfg1n,stocks,I like how you claim as if there's precedence for alien visitors coming to earth lol.,,
8,gznh6dv,2021-05-27 16:16:45,t1_gznh6dv,t3_mb68oo,stocks,Any EQ investors participate in the Hotel Tonight/ABNB deal?  Would love to ask you a few questions.,,
9,gznh7vd,2021-05-27 16:17:02,t1_gznh7vd,t1_gzm9u0z,stocks,"And maybe even if they do, tbh.  If they share tech advanced enough to catapult us into a true post-scarcity society, who gives a shit about money anymore",,
10,gznh83r,2021-05-27 16:17:05,t1_gznh83r,t3_nm3mzs,stocks,"I've been looking at GTLS, but I'm not sure if it's a buy. I like the sector they're in, and they've consistently been beating earnings, but is a 49 P/E a bit on the high side for a stock with a $5 billion market cap. They pull in about	 $1.2 billion in annual revenue with a 3-7% profit margin. Thoughts?",,
11,gznhbav,2021-05-27 16:17:44,t1_gznhbav,t3_nm3qu8,stocks,Defense contractors,,
12,gznhfjb,2021-05-27 16:18:35,t1_gznhfjb,t1_gzm2dpx,stocks,Which industry? Amazon is a major player in so many right now.,,
13,gznhg1b,2021-05-27 16:18:40,t1_gznhg1b,t1_gznf2zr,stocks,"You might have delayed data. If you're buying at the bid, you're not guaranteed to have your order filled, but if you're buying the ask, you probably have delayed data. Try tradingview and compare the numbers. They seem to have accurate bid/ask data for high liquidity stocks",,
14,gznhj2v,2021-05-27 16:19:16,t1_gznhj2v,t3_nm9uol,stocks,Mammoth Technologies,,
15,gznhmbz,2021-05-27 16:19:54,t1_gznhmbz,t1_gznfk7y,stocks,"Another way of thinking about it is that if you do owe taxes, not filing a return will only hurt you. The IRS will choose the worst possible option for all your income (cap gains with zero basis being the big one).

It's better to close the loop proactively and present the case you want to the IRS than roll the dice and find out in 5 years that actually, you *should* have filed.",,
16,gznhs8n,2021-05-27 16:21:03,t1_gznhs8n,t1_gznhmbz,stocks,I do know that that’s so true thank you very much,,
17,gznhtdm,2021-05-27 16:21:17,t1_gznhtdm,t1_gznd4t0,stocks,"Here in Wisconsin we have Culver’s, where the Butterburger Cheese reigns supreme. But I’m a strong, strong advocate of no IPO, because the second they do food quality will go down in the pursuit of large margins and profit taking.",,
18,gznhwci,2021-05-27 16:21:51,t1_gznhwci,t1_gznc4t3,stocks,I'm gonna assume you're joking and get on with life with my mind at peace,,
19,gznhztb,2021-05-27 16:22:32,t1_gznhztb,t1_gzncbft,stocks,"I had this same question, so glad you posted this",,
20,gzni2dd,2021-05-27 16:23:02,t1_gzni2dd,t1_gznf87d,stocks,"Yes, and in the last month the commodities rally has largely stalled and inflation expectations have stabilized.  How have you adjusted your investing thesis for these factors?  Or are you rigidly attaching your money to a dogma and hand wringing over fed watching?

These are the important factors, not contemplating mindless memes like “this time it’s different.”",,
21,gzni2kg,2021-05-27 16:23:04,t1_gzni2kg,t1_gznhg1b,stocks,Yeah Etrade is 15 minutes delayed unless you have like 10k in there or something like that,,
22,gzni32o,2021-05-27 16:23:10,t1_gzni32o,t1_gzn9umr,stocks,Bro it's just a burger,,
23,gzni56c,2021-05-27 16:23:35,t1_gzni56c,t3_nm9uol,stocks,Stripe!,,
24,gzni57a,2021-05-27 16:23:35,t1_gzni57a,t3_nm9uol,stocks,Chick fil a,,
25,gzni8t3,2021-05-27 16:24:18,t1_gzni8t3,t3_nm9uol,stocks,"Harry's Razors. 

I think they are a disruptor with room to grow, and they already were blocked from being bought out.",,
26,gzniak7,2021-05-27 16:24:39,t1_gzniak7,t3_nm3mzs,stocks,"If inflation data is surging more than expected, that would motivate more dems supporting the gop bill. Less long term inflation, less tax hike and stocks will be surging upwards. So better hope for real bad inflation data.",,
27,gzniawl,2021-05-27 16:24:43,t1_gzniawl,t1_gzmxmjo,stocks,"I guess you could replace ""convert into cash"" with ""receive economic benefit from""",,
28,gznidp3,2021-05-27 16:25:16,t1_gznidp3,t1_gznakoj,stocks,"I don't really think the price is warranted, its just EV momentum. Eventually they have to show profit margins on EV vs Combustion to show they are valued properly. I bought puts hoping it will pay out as it drops back to  sustainable level.",,
29,gzniiej,2021-05-27 16:26:14,t1_gzniiej,t3_nm9uol,stocks,Crunchy roll or Trader Joe’s,,
30,gznijc5,2021-05-27 16:26:25,t1_gznijc5,t1_gzn779c,stocks,Cut your losses and invest in something that will provide a return in this market.,,
31,,2021-05-27 16:27:03,t3_nmb9t6,,stocks,"[link](https://www.google.com/url?sa=t&rct=j&q=&esrc=s&source=web&cd=&ved=2ahUKEwi_2q33ourwAhUxIjQIHRlvCMAQFjAAegQIBBAD&url=https%3A%2F%2Fshareholder.ford.com%2Finvestors%2Fresources%2Fdefault.aspx&usg=AOvVaw1AloXhdbbrkLuCEEAgYSLk)

Wish I would've known before. Maybe everyone else knows. A bit salty since we already bought a mach E and just started investing in Ford a couple days ago. 

Hopefully this will be of some what to current shareholders or even someone on the fence. Seems like it could even pay for itself for people who buy a new pickup every 3-4 years. 

Copy and pasted from the site.

Ford Motor Company offers the “Friends and Neighbors” pricing discount to our qualifying shareholders. To be eligible, you must show you are a current Ford Motor Company shareholder who has held a minimum of one hundred (100) shares of Ford Motor Company stock for at least the past 6 months. We call this discount the Shareholder X-Plan Program.

The application for a shareholder X-Plan Pin (X-Pin) can be found at the link below. All further instructions are included in this document

Shareholder X-Plan Program

You can also obtain the application and submit additional questions about how the plan works by contacting the AXZ Headquarters using the contact information below.

Contact AXZ Headquarters

Telephone: 1-800-348-7709

Email: axzfaxes@ford.com",nmb9t6,TIL you can get friends and family discount on Ford vehicles if you own 100 shares of Ford stock for 6 months.
32,gznimz8,2021-05-27 16:27:08,t1_gznimz8,t3_nm9uol,stocks,Pornhub. At 69 dollars a share.,,
33,gznioe9,2021-05-27 16:27:25,t1_gznioe9,t1_gznimz8,stocks,"69? Nice. 

I am a bot lol.",,
34,gzniok8,2021-05-27 16:27:27,t1_gzniok8,t1_gznc4t3,stocks,you can buy it in 1 year for 20% its current price and hold it for as long as you like,,
35,gznipkw,2021-05-27 16:27:38,t1_gznipkw,t1_gzmflu7,stocks,"For short-to-medium term? Yeah, just look at Boeing. If you invested in 2018 and held you'd be hating life for at least another year or two.",,
36,gznitj1,2021-05-27 16:28:25,t1_gznitj1,t1_gznftpz,stocks,VTI is a VTI-like index fund,,
37,gzniycd,2021-05-27 16:29:22,t1_gzniycd,t1_gzmyzcd,stocks,"It will be like Palestine attacking Israel.  Perhaps the aliens will show some restraint, whilst flushing out the trouble makers?",,
38,,2021-05-27 16:29:53,t3_nmbc27,,stocks,"
Lloyd’s Bank (American ADR - LYG) released the following statement in their 2021 Shareholder Event call last week regarding the opportunity to pay an additional dividend in 2021 beyond the maximum allowable set by the UK government in response to the Covid crisis. 

“Regarding our dividend. Last year, following a request to all banks by the Prudential Regulation Authority, the Group suspended dividends on ordinary shares and cancelled the final dividend for 2019. These decisions were not taken lightly and I'm sure will have come as a disappointment to you, our shareholders.

However, our capital position has remained strong as a result and, following the PRA announcement in December, the Board was therefore able to recommend a total ordinary dividend of 0.57 pence per share - the maximum allowable within the PRA guidelines.

We recognise the importance of the dividend to many of our shareholders. The PRA has said that they will consider their guidance on 2021 dividends before banks announce their half-year results, so the Board expects to be in a position to discuss interim dividends when it reviews the performance of the business for the first half of the year. Our position on quarterly dividends will also be confirmed at this time.

The Board remains committed to future capital returns. In 2021, subject to regulatory guidance, the Board intends to grow the dividend from 2020, in line with the Group's progressive and sustainable ordinary dividend policy.”

https://www.proactiveinvestors.co.uk/LON:LLOY/Lloyds-Banking-Group/rns/975557

The Prudential Regulation Authority will release an update to their guidance requiring UK banks to scrap dividends throughout 2020 and 4Q 2019 sometime this summer. Currently a maximum allowable dividend of 0.47p is set for 2021. However the PRA is expected to either increase this amount or allow banks to reinstate unrestricted dividends. Although unrestricted dividends will most likely occur in 2022, the opportunity for additional dividends in 2021 and a large increase in yield beginning in 2022 could be a catalyst for LYG to cross the $3 threshold and touch $4 around the time the updated guidance and dividend plan is released. 

Additional info from Q1 2021:

Lloyd’s CET1 ratio is 16.4% before dividends and 16.2% after, well ahead of the bank’s target of around 12.5% and regulatory requirements around 11%.

Lloyd’s released approximately $460M from their impairment reserve that was created in response to the Covid crisis. $3,740M remains in the reserve. 

Lloyd’s UK banking peers (Barclays, HSBC, NatWest) are in similar positions.",nmbc27,LYG - Additional Dividend Opportunity in 2021.
39,gznj1i8,2021-05-27 16:29:59,t1_gznj1i8,t1_gzkw16p,stocks,"I had my friend help me set up screeners on TOS, they work really well",,
40,gznj2w9,2021-05-27 16:30:15,t1_gznj2w9,t3_nmb9t6,stocks,Holy cow appreciate the info op!,,
41,gznj344,2021-05-27 16:30:18,t1_gznj344,t1_gzniak7,stocks,wtf are you talking about? if inflation is worse the feds needs to step in. All these tech/growth stock are going to plummet.,,
42,gznj6k5,2021-05-27 16:30:59,t1_gznj6k5,t3_nmb9t6,stocks,Oh wow! Does this include all of the electric vehicles as well?,,
43,gznj73s,2021-05-27 16:31:06,t1_gznj73s,t1_gzmk2w4,stocks,"Your post was fine. Maybe next time you drop a hypothetical on Reddit, use a variable instead of a proper company name. 

People get testy with their investments. It triggers a backfire effect when people have a lot of money on the line.",,
44,gznj7h5,2021-05-27 16:31:10,t1_gznj7h5,t3_nmb9t6,stocks,What’s the discount?,,
45,gznj89d,2021-05-27 16:31:19,t1_gznj89d,t3_nln5br,stocks,He just reads wsb. Could work out or you could lose everything’. Thats how those stocks work.,,
46,gznj8a9,2021-05-27 16:31:19,t1_gznj8a9,t3_nm3mzs,stocks,How is everyone downloading data to their Excel sheets? My Excel 2010 is unable to to get data from external websites. I try using it and it just does not work with yahoo and many other sites. It gets script error and freezes. On Reuters it opens the site but does not recognize the tables. Is there a solution other than buying a newer version of Excel?,,
47,gznjapq,2021-05-27 16:31:48,t1_gznjapq,t3_nm3mzs,stocks,Finally closed my SPCE position 😬 today was a good day,,
48,gznjbxq,2021-05-27 16:32:03,t1_gznjbxq,t1_gyvb1k3,stocks,Did you sell?,,
49,gznjcen,2021-05-27 16:32:08,t1_gznjcen,t3_nm3qu8,stocks,"Are they coming to start shit or do they come in peace?

Either invest in military defense contractors if we're going to war...

Or invest in tech companies that are going to reverse engineer & reproduce their tech...

Or both? We kick their ass then take their tech?",,
50,gznjh1q,2021-05-27 16:33:03,t1_gznjh1q,t1_gznj344,stocks,"Inflation is also corporations and people worrying about the very overspent bill being passed. That’s why they are stockpiling as they are worried about more artificial demand from these bills, if the spending bill is significantly trimmed, fed won’t have to step in and inflation should tame.",,
51,gznji3w,2021-05-27 16:33:16,t1_gznji3w,t1_gznd4t0,stocks,"I think that's very controversial. 

I don't think we will be eating like we are now in 10, 20 or 100 years. We are wastefull and irresponsible.

Will meat even be legal? Will it be only lab created? Will we create our own foods with nano technology? Will we increase taxes on fast food? Will we create an obesity tax? Meat tax? Single use plastic ban/tax? Climate change will change how we eat. 

I think it's weird to automatically assume fast food will always be around. I don't think it will be forever. 

No one goes to the movies anymore because we can stream almost anything. 

In the future, no one goes out to eat because....",,
52,gznjil8,2021-05-27 16:33:22,t1_gznjil8,t3_nmb9t6,stocks,Whoa,,
53,gznjjl4,2021-05-27 16:33:34,t1_gznjjl4,t1_gzm2wmt,stocks,Well I think my advice is better stated - sell the losers and keep the winners,,
54,gznjm1h,2021-05-27 16:34:03,t1_gznjm1h,t3_nm3mzs,stocks,COMMODITY GANG LFG,,
55,gznjn4r,2021-05-27 16:34:16,t1_gznjn4r,t1_gznjbxq,stocks,"I did. I know it went higher, but that's the thing with sell limits. In a perfect world, you sold it at the apex, but I didn't. Either way, I made money, so it's a win to me.",,
56,gznjnif,2021-05-27 16:34:21,t1_gznjnif,t1_gzn35r0,stocks,"These are great questions! 

I see a huge emphasis being put on energy storage. There are countries that are regularly exceeding their energy demand using renewables but as soon as the sun sets or the wind dies down, they need to ramp up fossil fuel plants again. I see utilities and electrical producers investing heavily in infrastructure to store massive amounts of energy. This could be done through a variety of physical and   
 chemical methods. Additionally, we should expect to see energy prices increase as utilities and energy companies have to start sequestering carbon. My background is in atmospheric chemistry so I've been a lot more amped on the chemical energy storage but physical storage will likely scale better. 

&#x200B;

I have a lot of thoughts about hydrogen. Long story short, it needs a lot more work. On paper, hydrogen fuel cells look game changing but the real world applications are a little trickier. Infrastructure issues behind mass deployment of hydrogen is an issue (see: The Hindenberg) as well as long term durability of fuel cells. Additionally, the most efficient way to get H2 gas is to ""crack"" methane (CH4) or other hydrocarbons. This means there will still be a demand for natural gas extraction (which is very detrimental to our climate and local air quality) in order to power our hydrogen fuel cells. I really, really want to believe in hydrogen but I don't see it beating electric and alternative fueled vehicles in the next decade. Those two sectors have their own set of hurdles to surmount but it'll be a lot easier than hydrogen.

&#x200B;

The two aspects of renewable energy that have gotten me really excited recently are biochemical production of natural gas (e.g. renewable natural gas) and plasma gasification. Using microbes to produce natural gas not only gives us useable natural gas to power infrastructure but it also serves as a method of carbon sequestration. Plasma gasification is using plasma to heat materials so that they release all combustible gases and produce solid carbon and trace metals (which can be disposed of).

&#x200B;

Again, great questions. Feel free to hit me with any others if you got 'em",,
57,gznjp3t,2021-05-27 16:34:40,t1_gznjp3t,t3_nldj8c,stocks,Not a good idea to do options on such a volatile stock,,
58,gznjplx,2021-05-27 16:34:46,t1_gznjplx,t1_gzna70q,stocks,"Pls pls allocate some portfolio to commodities (oil, precious metals, uranium, steel, etc)",,
59,gznjpvi,2021-05-27 16:34:49,t1_gznjpvi,t1_gzmp9yw,stocks,"Lol love that I'm getting down voted for asking about legitimate human rights issues.

You fucks are worse than him because you're not even getting rich off it, you just want people to suffer",,
60,gznjpxe,2021-05-27 16:34:49,t1_gznjpxe,t3_nm3qu8,stocks,"Boeing, Lockheed martin, and any/all defense contractors. Plus Walmart and anyone else who sells stuff that the world will stock up on in anticipation of an invasion.",,
