,comment_id,created,fullname,parent_id,subreddit,text,post_id,title
731,gzoekek,2021-05-27 20:12:16,t1_gzoekek,t1_gznxku5,stocks,Doubt it. They don't really need the cash injection and they are still growing pretty quick with just word of mouth.,,
732,gzoeklr,2021-05-27 20:12:18,t1_gzoeklr,t3_nmb9t6,stocks,I've 850.   I'm 30% up though I don't care about the discount.,,
733,gzoekpi,2021-05-27 20:12:19,t1_gzoekpi,t1_gzoatr3,stocks,Lmao I’m up 🤷‍♂️,,
734,gzoembm,2021-05-27 20:12:39,t1_gzoembm,t1_gzodxqq,stocks,"Splitting is when you take a share and turn it into more shares (1 becomes 10).

Reverse splitting is the opposite of that.

https://www.investopedia.com/terms/r/reversesplit.asp",,
735,gzoemn2,2021-05-27 20:12:43,t1_gzoemn2,t3_nm3mzs,stocks,"Real Estate stocks just plummetted, Fred Kaplan just talked about stepping in because private investments are buying up all these houses instead of families. Homebuilders about to get fucked.",,
736,gzoeo06,2021-05-27 20:12:59,t1_gzoeo06,t3_kuujp8,stocks,so these stocks would do well after it gets passed?,,
737,gzoeoyn,2021-05-27 20:13:11,t1_gzoeoyn,t1_gznl6ur,stocks,"Math is hard.  Technically it's MSRP (dealer price) vs Invoice (dealer cost).  Typically the dealer sets an MSRP 15% above what their factory invoice cost is... So the .4% ""$120"" plus $275 fee is $395 above their cost.   SO the deal works out to be roughly a 14.5% discount off the MSRP... e.g. save $5000 on a $35k vehicle for HODLING $1470 (todays price) of F stonk for 6 months is actually a good deal.",,
738,gzoesqa,2021-05-27 20:13:56,t1_gzoesqa,t1_gzo1mxm,stocks,Screenshotted,,
739,gzoeucn,2021-05-27 20:14:17,t1_gzoeucn,t3_nmf4sa,stocks,"In a 6:1 reverse split it basically means for each 6 shares you own will be exchanged to 1 share instead. But since it happens to all shares you would still own the same portion of the Company and theoretically share Price would be 6 times higher for each share after the split. 
Just google “former employer” reverse split and see if anything comes up. I understand if you don’t feel like disclosing the Company here",,
740,gzoev78,2021-05-27 20:14:27,t1_gzoev78,t3_nm9vy4,stocks,"Overpriced, interesting company though.",,
741,gzoexck,2021-05-27 20:14:52,t1_gzoexck,t1_gzo1vco,stocks,A few million*,,
742,gzoeygc,2021-05-27 20:15:05,t1_gzoeygc,t1_gzoemn2,stocks,Which ones?,,
743,gzoeyrn,2021-05-27 20:15:09,t1_gzoeyrn,t1_gzodnyd,stocks,You mean billion?,,
744,gzoeysd,2021-05-27 20:15:09,t1_gzoeysd,t3_nm9uol,stocks,"Lego  
OnlyFans  
SpaceX  
Starlink  
Stripe  
Instacart  
Stripe",,
745,gzoezam,2021-05-27 20:15:15,t1_gzoezam,t1_gzodsl0,stocks,Lol I had calls and sold at like 28.5 thinking it's getting to it's top again...then I get news alerts that cruising officially on the menu,,
746,gzof0xb,2021-05-27 20:15:34,t1_gzof0xb,t3_nmdr3z,stocks,"The value premium has historically been greater during periods of high inflation and lower/negative during periods of low inflation/deflation. REITs also have done very well historically during inflation.

In my Roth IRA, I'm mostly in value indexes and a REIT index.

In my taxable brokerage, I'm heavily in VYM which is a high dividend index, which leans towards large cap value, as well as VIG, SPHD, and a couple REITs(O). The idea is producing income for myself to worry less about timing my sells when I need to withdraw, while having mostly value exposure.",,
747,gzof2p7,2021-05-27 20:15:55,t1_gzof2p7,t1_gzne4bl,stocks,"You realize their marketplace is minor compared to AWS right? They’re also in talks to acquire MGM further beefing up Prime. And they had a pretty substantial ad revenue as well. 

Yes, no one can say what will happen in 20 years. Jassi might be a total idiot and destroy the company. But to narrow down their business model to their marketplace is wrong.",,
748,gzof2zo,2021-05-27 20:15:58,t1_gzof2zo,t3_nmgie6,stocks,"A reminder to everyone, please focus on how this is going to affect a specific stock or the stock market in general.

If your comment is pushing political agendas, memes, insults, trolling, etc then your comment is going to get removed and/or get you banned.

If you *have* to discuss just the politics, then post this topic to r/PoliticalDiscussion without linking back to r/stocks, thanks!

*I am a bot, and this action was performed automatically. Please [contact the moderators of this subreddit](/message/compose/?to=/r/stocks) if you have any questions or concerns.*",,
749,,2021-05-27 20:15:58,t3_nmgie6,,stocks," WASHINGTON — President Joe Biden will propose $5 trillion in new federal spending over the next decade on Friday, part of his fiscal year 2022 budget request, a source familiar with the proposal tells CNBC.

The new spending would be paid for in part by $3.6 trillion in additional revenues over the same period. The result would be a net deficit of $1.4 trillion, which would begin shrinking after 2030.

Biden will include $300 billion of the $5 trillion total in his budget request to Congress for fiscal year 2022. This will bring the president’s total budget request for next year to $6 trillion, the source said.

Biden’s budget also projects that inflation will reach no more than 2.3% annually over the next 10 years, reflecting the administration’s belief that concerns among some economists about runaway inflation are overblown.

Like in all presidential budgets, the vast majority of the money in Biden’s 2022 budget request will be spent on programs that the federal government is obligated to fund, including Medicare, Medicaid and Social Security.

Beyond those, Biden has requested $1.5 trillion in discretionary funds, half of which is slated for defense.

The president’s new spending, the $5 trillion over 10 years, is intended to fund the twin pillars of his sweeping domestic agenda: the American Jobs Plan and the American Families Plan.

The former would make major investments in both traditional infrastructure and in green technology, which Biden argues is crucial to making America competitive in the global economy. It would also shore up the U.S. electrical grid, expand broadband access and bolster care for the elderly and disabled.

This second piece contains additional funding for two years of free universal pre-K and two years of free community college. It also funds heavily subsidized child care for middle-class families, federal paid family leave and expanded child tax credits.

The combined cost of these two programs is $4.1 trillion over the next decade and would be paid for primarily through higher taxes on corporations and the wealthiest taxpayers.

The White House is currently negotiating with Senate Republicans on a potential bipartisan infrastructure deal, but this negotiation is separate from the FY 2022 budget request.

Presidential budgets are typically one part plan and one part wish list, designed to illustrate the president’s policy priorities as much as they are to inform congressional appropriators.

Presidential budget requests are also dependent upon Congress to pass them. But with Democrats in control of both chambers this year, Biden has a far better chance of seeing his budget enacted into law than most of his recent predecessors.

In former President Barack Obama’s final year in office in 2016, Republicans who controlled both the House and Senate disregarded his budget altogether.

[https://www.cnbc.com/2021/05/27/bidens-budget-will-include-5-trillion-in-new-federal-spending-over-the-next-decade.html](https://www.cnbc.com/2021/05/27/bidens-budget-will-include-5-trillion-in-new-federal-spending-over-the-next-decade.html)",nmgie6,Biden’s budget will include $5 trillion in new federal spending over the next decade
750,gzof3sg,2021-05-27 20:16:08,t1_gzof3sg,t1_gzoezam,stocks,I have 30c 7/16 calls. Super pumped but I’m gonna sell before their 6/14 earnings,,
751,gzof585,2021-05-27 20:16:25,t1_gzof585,t1_gzo218n,stocks,This guy has no idea what he’s talking about. Maybe out stop losses on non-shorted stocks.,,
752,gzof5og,2021-05-27 20:16:31,t1_gzof5og,t1_gzodn50,stocks,"Maybe the last few months, but not historically.  Just ignore it, come back in 10 years and marvel at how rich you are.",,
753,gzof5z8,2021-05-27 20:16:34,t1_gzof5z8,t1_gzo9oc6,stocks,"If you already own the stocks then you should get the discount, but it is not worth buying them purely for the discount. How is this tripping so many people up?",,
754,gzof89n,2021-05-27 20:17:02,t1_gzof89n,t3_nmgie6,stocks,I miss trump,,
755,gzof9ft,2021-05-27 20:17:16,t1_gzof9ft,t1_gzodxqq,stocks,"It means every 6 shares will be converted to 1 instead. Hypothetically share Price should increase by a factor 6 so total value should stay the same and you still own the same % of the Company.
I understand not disclosing the Company here so try googling “former employer” reverse split and see what pops up",,
756,gzofal2,2021-05-27 20:17:30,t1_gzofal2,t3_nmb9t6,stocks,Do we know if other deals have this too or just F?,,
757,gzofbxm,2021-05-27 20:17:47,t1_gzofbxm,t1_gzodxkk,stocks,FB was a champ for me.,,
758,gzofcfd,2021-05-27 20:17:52,t1_gzofcfd,t1_gzoed5d,stocks,It's a little absurd how the price in 15 minutes of afterhours has moved about as much as it did for the entire market session.,,
759,gzofef9,2021-05-27 20:18:16,t1_gzofef9,t1_gzo5chj,stocks,"It's .4% above dealer invoice, so far below MSRP.  The discount depends on how low the dealer already goes below MSRP.",,
760,gzoff80,2021-05-27 20:18:26,t1_gzoff80,t3_nm3mzs,stocks,Is this the same thing as last time when GME shorts sold their FANG shares to cover the loss?,,
761,gzofin1,2021-05-27 20:19:08,t1_gzofin1,t1_gzoedit,stocks,"If you're losing on AMC right now that means you're short, you're not reading the news, and I have no sympathy for you. 

I personally have no horse in that race, but I do understand what's going on with it. My savings and financial situation are perfectly sound right now, thank you very much.",,
762,gzofjna,2021-05-27 20:19:19,t1_gzofjna,t1_gznk25s,stocks,"Technically it's MSRP (dealer price) vs Invoice (dealer cost).  Typically the dealer sets an MSRP 15% above what their factory invoice cost is... So the .4% ""$120"" plus $275 fee is $395 above their cost.   SO the deal works out to be roughly a 14.5% discount off the MSRP... e.g. save $5000 on a $35k vehicle for HODLING $1470 (todays price) of F stonk for 6 months is actually a good deal.",,
763,gzofk7o,2021-05-27 20:19:26,t1_gzofk7o,t1_gzoembm,stocks,"Thanks! So based on the context, I'm assuming that this is all legal?   


It's just really annoying from my perspective, because the company memos and trainings all represented this as being the same as having stocks with a broker, where the value would increase if left untouched.",,
764,gzofkvd,2021-05-27 20:19:34,t1_gzofkvd,t1_gzo2jw5,stocks,"Same here. Have a considerable amount invested in but not enough to make me homeless. If I lose it all, well so be it (will likely sell before that happens lol). But I’m in it for the LONG haul. So fingers crossed.",,
765,gzofmel,2021-05-27 20:19:53,t1_gzofmel,t1_gzoemn2,stocks,Why would homebuilders be fucked? Who else is going to build the homes to solve the supply issue?,,
766,gzofmff,2021-05-27 20:19:53,t1_gzofmff,t1_gznlbgi,stocks,CORRECT!,,
767,gzofn2d,2021-05-27 20:20:01,t1_gzofn2d,t3_nmdr3z,stocks,Tips,,
768,gzofog2,2021-05-27 20:20:17,t1_gzofog2,t3_nmgie6,stocks,Get these people out of office! Our dollar will be worth nothing by the time they are done!,,
769,gzofpw0,2021-05-27 20:20:34,t1_gzofpw0,t1_gzoazu3,stocks,"Good question. I’d advise to contact your broker for that, but I’m very sure that they’ll send you a notification about it. You should see something from them around January.",,
770,gzofq8z,2021-05-27 20:20:38,t1_gzofq8z,t3_nmgmao,stocks,"Sorry, your [submission](https://www.reddit.com/r/stocks/comments/nmgmao/what_do_you_use_for_realtime_quotes/) in /r/stocks has been automatically removed due to Rule 3:  Low effort.

If you just want to post 1 liners or just want to know everyone's thoughts, then post a comment to our daily discussion thread which are generally stickied or [click here.](https://www.reddit.com/r/stocks/search?q=author%3Aautomoderator+daily+discussion&restrict_sr=on&sort=new&t=all)

If you're wondering **why a stock moved** a certain way, check out [Reuters](https://www.reuters.com/), [Motley Fool](https://www.fool.com/), and **especially** [Finviz](https://finviz.com/quote.ashx?t=spy) **which aggregates the most news for almost every stock**.

If instead you're wondering what a term means, go to Investopedia.com and search for said term there.

Either way come back here to repost with your findings, thanks!

A list of the [rules can be found here](https://www.reddit.com/r/stocks/about/rules/), and if you're new to r/stocks please see the [wiki](https://www.reddit.com/r/stocks/wiki/index) and/or [read this post.](https://www.reddit.com/r/stocks/comments/4x1419/if_youre_new_here_read_this_post_first/)

*I am a bot, and this action was performed automatically. Please [contact the moderators of this subreddit](/message/compose/?to=/r/stocks) if you have any questions or concerns.*",,
771,gzofsd7,2021-05-27 20:21:03,t1_gzofsd7,t3_nmb9t6,stocks,"Yeah I learned this a couple weeks back when someone posted about Berkshire holders getting geico at a discount. I think 8% off. I’d ended up finding a good handful of stocks have some sort of benefit like so. 

And geico didn’t even confirm. I mean I do own Brk.b, but they didn’t ask for anything to confirm like they did like with this Ford example. They just said okay and got an updated rate in the mail a few days later.",,
772,gzoftwr,2021-05-27 20:21:21,t1_gzoftwr,t1_gzoeoyn,stocks,"There's nothing in your comment that is accurate except for the ""math is hard"" (for you). You'll feel more comfortable sticking with meme stocks and shitcoins.",,
773,gzofueg,2021-05-27 20:21:26,t1_gzofueg,t1_gzoff80,stocks,"That would be my guess. Someone is liquidating. GOOG got hit hard, Apple a little. Shorted companies shot up, including TSLA and NKLA. Whoever shorted those also must have shorted FB because it shot up too.",,
774,gzofvc7,2021-05-27 20:21:37,t1_gzofvc7,t3_kqvt2m,stocks,"I was looking for posts related with this company and found this thread.

I bought them in December, never heard of them but run into them after playing with fundamentals and applying some filters so they eventually came up.

Bought them and have been performing well since then. Today another good rise. Still seems to me very undervalued but I don't hear any news about them and they very much under any radar",,
775,gzofve7,2021-05-27 20:21:38,t1_gzofve7,t1_gzof2zo,stocks,"I don't understand, you want to ban comments that are political, but I don't see a direct correlation in the OP text of how it relates to the market.",,
776,,2021-05-27 20:21:20,t3_nmgmvt,,stocks,"Realty Income corp.  Ticker: $**O**

***Financials\~***

**Total Rev:**1,680,088

**Gross Profit:**1,572,592, ***6.58% increase YoY*** 

**EPS:** .26

**Debt to equity:**  **.**8

**AFFO:** .86

In 2021, Realty invested \~1 billion in properties/expansions with 403 million in properties and properties under development or expansion, including $403.0 million in U.K. properties

***The real bread and butter of the stock***

 **Dividends:**

**Monthly dividends at 4.10 (annually)**

**27 YEARS** of Consecutive Dividend Increases (annually)

Dividend per share (monthly)

= \~    $0.235 

$2.82 (yearly dividend)

**610 consecutive monthly div.** 

**94 consecutive quarterly increase**

**What realty does\~** 

**Leases properties directed at retail**  **\***based on percentage of total portfolio annualized rental revenue. Lease durations are usually exceeding 10 years

**Top 5 clients**

· **Walgreens**

· **7-Eleven**

· **Dollar General**

· **FedEx**

· **Dollar Tree/ Family Dollar** 

*While a very nice stock for the most part, the 10 year leases may limit the ability for the stock to grow, therefore, a great monthly dividend stock but it is something I would have in a very long term account like for your retirement and but not one meant for growth.* 

Short write-up as I am more so seeking out growth stocks to research but the monthly dividend was enticing. I currently hold around an extremely small position of 1 share.",nmgmvt,Realty income $O
777,gzofw51,2021-05-27 20:21:47,t1_gzofw51,t1_gznd4t0,stocks,In N Out.  Company makes a fortune and basically has a cult following,,
778,gzofw9y,2021-05-27 20:21:48,t1_gzofw9y,t1_gzof9ft,stocks,Wow. This was exactly the google search I needed.,,
779,gzofyfd,2021-05-27 20:22:14,t1_gzofyfd,t1_gzo7btk,stocks,"Because saying there are a few thousand retail investors is not only nonsensical, but the entire support of his argument.",,
780,gzog1xo,2021-05-27 20:22:57,t1_gzog1xo,t3_nm4kla,stocks,"The Balance Sheet, a. k. a., The Statement of Financial Position =\]

When I am doing my monthly budgets, updating the movement of my equity is so fun! =D 

Numbers make me happy!",,
781,gzog35b,2021-05-27 20:23:11,t1_gzog35b,t1_gzodxkk,stocks,F and N were green though,,
782,gzog5h2,2021-05-27 20:23:40,t1_gzog5h2,t1_gzofw51,stocks,"They have to have a restaurant within a certain distance of a slaughterhouse to get the freshest meats. Part of the reason they won’t go public, I’d guess.",,
783,gzog5hf,2021-05-27 20:23:40,t1_gzog5hf,t3_nky43y,stocks,"Their CEO Hattersley said on CNBC today that they would still keep using insecure Microsoft garbage, so I would never invest in them.  Microsoft has destroyed so many of their customers.",,
784,gzog649,2021-05-27 20:23:48,t1_gzog649,t1_gzodn50,stocks,not to me. i'm holding for life. daily/weekly/monthly ups and downs don't matter in the slightest.,,
785,gzog6fb,2021-05-27 20:23:52,t1_gzog6fb,t1_gzne2jd,stocks,I may draining my bank account for in n out stock if it ever ipos.  They have such a solid business model and foundation.,,
786,gzog6ra,2021-05-27 20:23:56,t1_gzog6ra,t3_nmgmvt,stocks,As usual\~ please let me know what information you want to see on DD and if you have any companies in particular you want a write up on let me know!,,
787,gzog9r3,2021-05-27 20:24:32,t1_gzog9r3,t3_nmb9t6,stocks,"FYI, this is not the friends and family plan.  This is the Shareholder X-Plan.",,
788,gzogalk,2021-05-27 20:24:43,t1_gzogalk,t1_gzo82jf,stocks,It's looking like it's hopefully on the right track!  Good luck bro,,
789,gzogb31,2021-05-27 20:24:48,t1_gzogb31,t1_gznlg0r,stocks,How do you get the info on the invoice minus rebates price? Im assuming they dont want to tell customers,,
790,gzogbsb,2021-05-27 20:24:57,t1_gzogbsb,t1_gzofueg,stocks,"Yeah, and ARKK also shot up in the last 10 minutes",,
791,gzogc39,2021-05-27 20:25:01,t1_gzogc39,t1_gznw78s,stocks,"I happen to have 100 shares (exactly) of Ford stock and am sort of interested in buying a Ford vehicle, but I didn't know about this program. So this is useful information to me.",,
792,gzogdiw,2021-05-27 20:25:19,t1_gzogdiw,t3_nmgmvt,stocks,I've been eyeballing getting some for a while now.,,
793,gzogdkr,2021-05-27 20:25:19,t1_gzogdkr,t1_gzodn50,stocks,"Institutional investors and smart money just recently dumped a lot of their Apple shares. No one has a clue as to why, but one reason could be the up and coming trial results. Either way, I don't think Apple's going to the moon in the near term, so funds that want to make higher returns are likely to exit for better growth opportunities; Apple is basically acting like a value stock these days.",,
794,gzogdpe,2021-05-27 20:25:21,t1_gzogdpe,t1_gzog35b,stocks,Then in that case. AAG.,,
795,gzogdvc,2021-05-27 20:25:23,t1_gzogdvc,t1_gzof89n,stocks,"Me too man, me too",,
796,gzoge8v,2021-05-27 20:25:27,t1_gzoge8v,t1_gzofmel,stocks,"These demand is all made up to increase house prices, they build like 30 and put only 5 in the market, home sales are already down. Remember theyve been building these houses with jacked up prices for materials. If the house prices goes down they cant sell these homes for a loss.",,
797,gzogfjh,2021-05-27 20:25:43,t1_gzogfjh,t1_gzob2h6,stocks,Why not ask about stocks under $100?,,
798,gzogi2e,2021-05-27 20:26:14,t1_gzogi2e,t1_gzogfjh,stocks,because i dont have enough buying power atm,,
799,gzogi5i,2021-05-27 20:26:15,t1_gzogi5i,t3_kvm78l,stocks,Supposedly dropping at the end of next month!!!! We’ll see.,,
