,comment_id,created,parent_id,subreddit,text,Organizations,Sentiment
455,gzki7an,2021-05-26,t3_nln5br,stocks,Is this a joke lol if it's all for his college anyways just do what he says then if there's no money when it's college time he has nobody to blame but himself.,[],0
456,gzki8kx,2021-05-26,t3_nl26o9,stocks,"Cyber security. Insurance companies are cracking down and telling small and medium businesses to sign up for x y z services/ buy x type of firewall (not vendor specific, feature targeted requirements) or get dropped / put in noncompliance on their policy.",[],0
457,gzkia9v,2021-05-26,t1_gzfea5x,stocks,"I was SO SOOOOOOO close to pulling the trigger on ttcf last week or before when it was $16.90 or whatever

Kicking myself

Always keep powder available folks

That’s a lesson for me",[],0
459,gzkiev3,2021-05-26,t3_nlilhm,stocks,Fords are turds,[],0
460,gzkifri,2021-05-26,t3_lv5dlb,stocks,"hello i am 13 year old, starting to try invest stock
4 positions but looking for new opportunities 

AAPL     -1.07%
GRWG    15.48%
HGEN     16.01%
PSFE       -13.98",[],0
461,gzkil3h,2021-05-26,t1_gzi9j05,stocks,"I scrolled way too far to find someone talk about breakeven costs. That's what will fuck over someone when buying high IV options.

May 28th 19 calls are like 290% IV",[],0
462,gzkimgq,2021-05-26,t1_gzk22sp,stocks,I thought that also. But GME  is up 80 points in a week.,['GME'],0
463,gzkiot4,2021-05-26,t3_nlilhm,stocks,Buying based on hopes and dreams will leave you in nightmares..,[],0
464,gzkiour,2021-05-26,t1_gzkhint,stocks,Master Limited Partnership,[],0
465,gzkisbu,2021-05-26,t1_gzindhi,stocks,"Ah yes, ""a lot of call/put spreads"", ""adequately leveraged"" and ""safe return"" in one sentence.

You aren't on WSB, little reason to give such advices to a newbie.",[],0
466,gzkisdy,2021-05-26,t1_gzkiour,stocks,Okay thanks I’ll start doing research then on what all that entails. Thank you once again. 👍🏼,[],1
467,gzkiuou,2021-05-26,t1_gzjqt8l,stocks,I like that idea a lot may look into that trade style,[],0
468,gzkiynx,2021-05-26,t3_nlhpv3,stocks,"What a load of shit lol 

“On behalf of 17,000 Dutch citizens” 

I’m sure I can find 17,00 Dutch citizens who would want the court to screw off.",[],0
469,gzkiz5n,2021-05-26,t1_gzkil3h,stocks,This guy probably had a good day if he bought those Monday or Tuesday,[],0
470,gzkizm2,2021-05-26,t3_nlcs5h,stocks,My one share of GME that I got for shits and giggles last week at 169 is really paying off.,['GME'],0
471,gzkj04u,2021-05-26,t1_gzjx1yw,stocks,Rule # 1: never short a meme stock.,[],0
472,gzkj3oi,2021-05-26,t1_gzk7bl4,stocks,"You can't. Look at ZScaler for example, it beat by a bit and it went up today, but I'm sure people sold before thinking it would drop. Don't try to time the market, you will have a terrible time.",[],0
473,gzkj70g,2021-05-26,t1_gzkifri,stocks,"Congratulations on starting so early! That's great!

One idea for you - Think about places you or your parents like to shop and consider that as a next position?",[],1
474,gzkj8vk,2021-05-26,t3_nlt96n,stocks,"Sorry, your [submission](https://www.reddit.com/r/stocks/comments/nlt96n/anybody_holding_crsp/) in /r/stocks has been automatically removed due to Rule 3:  Low effort.

If you just want to post 1 liners or just want to know everyone's thoughts, then post a comment to our daily discussion thread which are generally stickied or [click here.](https://www.reddit.com/r/stocks/search?q=author%3Aautomoderator+daily+discussion&restrict_sr=on&sort=new&t=all)

If you're wondering **why a stock moved** a certain way, check out [Reuters](https://www.reuters.com/), [Motley Fool](https://www.fool.com/), and **especially** [Finviz](https://finviz.com/quote.ashx?t=spy) **which aggregates the most news for almost every stock**.

If instead you're wondering what a term means, go to Investopedia.com and search for said term there.

Either way come back here to repost with your findings, thanks!

A list of the [rules can be found here](https://www.reddit.com/r/stocks/about/rules/), and if you're new to r/stocks please see the [wiki](https://www.reddit.com/r/stocks/wiki/index) and/or [read this post.](https://www.reddit.com/r/stocks/comments/4x1419/if_youre_new_here_read_this_post_first/)

*I am a bot, and this action was performed automatically. Please [contact the moderators of this subreddit](/message/compose/?to=/r/stocks) if you have any questions or concerns.*",[],1
475,gzkjap9,2021-05-26,t1_gzkisdy,stocks,Definitely look into it more before buying. Filing K-1s can make your taxes more complicated and expensive. So owning M.L.Ps and L.Ps are only beneficial if you own a bunch of shares in order to off set that expense.,[],1
476,gzkjceb,2021-05-26,t3_nlhcci,stocks,Great Post!,[],1
477,gzkjcsz,2021-05-26,t1_gzk0coi,stocks,"did you ever think that might have been sarcastic you absolute buffoon, geez some people just don’t understand satire….",[],1
478,gzkjer2,2021-05-26,t3_nln5br,stocks,"So I feel like your son is on wsb, so I would talk to him about that first. Tell him to take everything ont here with a grain of salt or two. Then I would invest in ETFs and maybe a 10-20÷ share in individual stocks and other riskier investments.",[],0
479,gzkjfy7,2021-05-26,t3_nlnekw,stocks,"People would probably look to Amazon (and probably find what they’re looking for there, or a comparable product) before they go elsewhere.",[],0
480,gzkjlxj,2021-05-26,t1_gzkjap9,stocks,Ah got ya that makes total sense. Thank you.,[],0
481,gzkjs05,2021-05-26,t1_gziy0w7,stocks,The new Fidelity app is available as a beta to certain users and the new UI looks really clean and a lot easier to use. (based on the given screenshots),[],0
482,gzkjsxf,2021-05-26,t3_nllnfg,stocks,"What book? 

Are you talking about Graham and Dodd?

It's still relevant.  But so is hard fucking work. If you want the cliff notes to learn from,  expect the cliff notes returns.  The bottom line is if you want success you have to work for it.  So if you want successful investing study the whole book , and probably a dozen others.  Quit your job and work 10-12 hours a day to learn investing and you MAY become successful.",[],0
483,gzkk1a6,2021-05-26,t3_nlh6fq,stocks,Good move to gobble up IP. A bit of an overpay but will be worth it long term,[],0
484,gzkk3tu,2021-05-26,t1_gzkgdph,stocks,The question isn’t about what level of profits Amazon makes. The argument you’re proposing is that Amazon won’t get accepted into Caremark which is objectively false. Amazon Pharmacy can fulfill orders for Caremark managed patients.,[],1
485,gzkk5cf,2021-05-26,t1_gzjcx94,stocks,Dreams,[],1
486,gzkk7tu,2021-05-26,t1_gzi6bnt,stocks,"I'm actually sitting on 100% railroads, CP, CNI, UNP, CSX, NSC. I sold my KSU shares after the CNI merger news to avoid arbitrage losses after they gapped up.  I understand their PE's are in the high 20s which is unusual for them, but rail is so ingrained in our economy. It always has and will be the cheapest way to ship goods in North America and thus, a very safe investment regardless.

While I think AAPL, MSFT, FB and GOOGL are great companies, when whatever is coming comes, those companies will- fairly or unfairly- get hammered along with the tech fall. Personally, I think GOOGL is actually undervalued but that's another story haha",['AAPL'],1
487,gzkk8v7,2021-05-26,t3_nlhcci,stocks,Profit & Loss is also journal which tracks all profit and loss accounts. The US has different terminology compared to Canada/UK.,[],0
488,gzkkb9p,2021-05-26,t3_nlkdvg,stocks,"Over 20-25 and you lose diversification benefits and better off buying an index according to data.  But if your a good stock picker, that really doesn’t apply",[],1
489,gzkkdya,2021-05-26,t1_gziv1xi,stocks,I second this. Also love your username as I find it very relevant to my day to day situation lol,[],1
490,gzkkgmc,2021-05-26,t3_nljpkq,stocks,Supposedly IBM is a leader in quantum computing,[],0
491,gzkkgmp,2021-05-26,t3_nlkpw4,stocks,"""grasshopper"" the knock off brand on ebay, aliexpress and soon to be amazon will be taking their market share any day. 

now granted thats something I just pulled out of my ass, but really what does this company offer that cant be replicated by another?",[],0
492,gzkkhf1,2021-05-26,t3_nltgi6,stocks,"Sorry, your [submission](https://www.reddit.com/r/stocks/comments/nltgi6/realtime_afterhour_candlestick_charts/) in /r/stocks has been automatically removed due to Rule 3:  Low effort.

If you just want to post 1 liners or just want to know everyone's thoughts, then post a comment to our daily discussion thread which are generally stickied or [click here.](https://www.reddit.com/r/stocks/search?q=author%3Aautomoderator+daily+discussion&restrict_sr=on&sort=new&t=all)

If you're wondering **why a stock moved** a certain way, check out [Reuters](https://www.reuters.com/), [Motley Fool](https://www.fool.com/), and **especially** [Finviz](https://finviz.com/quote.ashx?t=spy) **which aggregates the most news for almost every stock**.

If instead you're wondering what a term means, go to Investopedia.com and search for said term there.

Either way come back here to repost with your findings, thanks!

A list of the [rules can be found here](https://www.reddit.com/r/stocks/about/rules/), and if you're new to r/stocks please see the [wiki](https://www.reddit.com/r/stocks/wiki/index) and/or [read this post.](https://www.reddit.com/r/stocks/comments/4x1419/if_youre_new_here_read_this_post_first/)

*I am a bot, and this action was performed automatically. Please [contact the moderators of this subreddit](/message/compose/?to=/r/stocks) if you have any questions or concerns.*",[],1
493,gzkklfi,2021-05-26,t1_gzkiz5n,stocks,"Haha yeah, sitting on a like a hundred bucks if he got it at $0.74, not bad",[],0
494,gzkknlu,2021-05-26,t1_gzkkgmp,stocks,"Great customer service, innovation, and a 50 year head start. Again, I'm just as fine with proving everyone wrong lol. Im up big and will continue to big up bigger.",[],1
495,gzkktv0,2021-05-26,t1_gzki4r7,stocks,Market closed (with $AAPL red),['AAPL'],0
496,gzkkvdj,2021-05-26,t1_gziefc5,stocks,"There was a post somewhere on here, or on r/investing regarding hedge funds actually shorting the bond market of the US Federal Reserve to keep rates low and money flowing. Keep in mind, this is the reserve currency of the world so whenever this deregulated market catches up with us, kaboom for sure.

Ah, here it is: not sure if this is the original or a similar one, but tells the same story.

https://www.reddit.com/r/Superstonk/comments/mke2m3/the\_everything\_short/",[],1
498,gzkl17b,2021-05-26,t1_gzgrr47,stocks,"Lots of things do depend on TSM, so I feel like for this year I will increase my holdings on them.",[],1
499,gzkl2iz,2021-05-26,t1_gzk1jvn,stocks,Thank you for this by the way!,[],0
500,gzkl32u,2021-05-26,t1_gzki3zs,stocks,"My peak EBay experience was probably ~15 years ago when I was a lot younger. My dad got me into baseball cards and we’d look for good deals from all the different vendors. It seemed like a great website at the time with PayPal and everything, but now it certainly feels like it’s fallen behind over the years.",[],1
501,gzkl85w,2021-05-26,t3_nlqtjo,stocks,Any update on the arm acquisition? I think nvda need that approval to fly.,[],1
502,gzklcc9,2021-05-26,t1_gzkktv0,stocks,That happened so long ago it isn't even relevant anymore. Quit bringing up old news,[],0
503,gzklcrz,2021-05-26,t1_gzkbmeo,stocks,Them should be in the next Bond movie.,[],1
504,gzkll5x,2021-05-26,t3_nljpkq,stocks,QUBT trades on OTC Market. My long term play in quantum computing. Had a wild year shooting up to $20 and back down to around $6.,[],1
505,gzklnya,2021-05-26,t3_nltj9w,stocks,not really sure how they'd have a competitive advantage in brick and mortar since they're mostly digital stuff but sure this could be interesting,[],1
506,gzklqt1,2021-05-26,t1_gzjjs3n,stocks,"I’m holding both to slightly diversify. The only problem I see with them is that they don’t hold enough wind energy companies, or at least they didn’t last time I checked. Was considering adding fan as well.
Also OP worth checking r/investing for more information on icln.",[],1
508,gzkm11s,2021-05-26,t1_gzjsw5k,stocks,"BB going up is like a no-hitter in baseball, the more anyone says it out loud the smaller the chances of it happening are",[],0
509,gzkm4nv,2021-05-26,t1_gzjmxjn,stocks,Self fulfilling prophecy init?,[],0
511,gzkmb4g,2021-05-26,t3_nlm9wp,stocks,Interactive brokers. Lowest commissions and margin rates. The mobile app has bit of a learning curve though.,[],0
512,gzkmhuy,2021-05-26,t1_gzj589p,stocks,I'm curious why this makes no sense. Could someone explain?,[],0
513,gzkmk7p,2021-05-26,t3_nl3qq4,stocks,Looks like a H+S top on IWM to me.  Am watching it closely...,[],1
514,gzkmkwu,2021-05-26,t3_nlhbrq,stocks,"Did you add the macro variables like CPI, M2 us10yield monthly data as well? Do you plan as well to add a regression model with maybe 100‘s of variables?
And in your training algorithm are you checking as well the price development within minutes/hour range e.g. with high positive sentiment on twitter during AH time, on the next trading day on the opening of the market an increase of 10% could have been noted as a pattern within the first 30mins etc.

But in general I like what you developed, keep up the good work",[],1
515,gzkmmpg,2021-05-26,t3_nlhpv3,stocks,🤔 Isn't carbon like plant food and shit?,[],0
516,gzkmnsu,2021-05-26,t3_nltj9w,stocks,"UNVC has a CEO who used to be CEO of Rite Aid,and has partnered with Amazon,They havent really said much as to what all they will be doing besides online pharmacy.They will be uplisted probably next week.Its at pennies now,I am long in this the forecast is dollars very soon.",[],0
517,gzkmp8g,2021-05-26,t1_ggft848,stocks,Hey Dipshit how’s “one of the least bullish stocks” been performing? Up over 100% from this post and Just recently started breaking down. Oh yeah and still paying dividend,[],0
518,gzkmtj7,2021-05-26,t1_gzk3bsb,stocks,Watch it dip after earnings even if its their best quarter.,[],1
519,gzkmwej,2021-05-26,t1_gzkg93d,stocks,I just never understand this push to blame the oil companies when hardly anyone is willing to give up the luxuries that petroleum products provide. It’s hard to produce oil with “less of an impact on the environment” while still meeting the demand.,[],0
520,gzkmyi4,2021-05-26,t1_gzk580s,stocks,Miner would have bought them up is what would have happened.  Expect gaming revenues to fall though a roof them these mining cards hit the market and buyer that got scalper cards hold on to them for longer due to the premium paid.,[],0
521,gzkn0wl,2021-05-26,t1_gzkmnsu,stocks,"UNVC is nothing but a pennystock scam that they have been running for years.

EVERYONE SHOULD AVOID UNVC AT ALL COSTS.

This lie about the stock being uplisted to NASDAQ has been told for several years now and was always false.

AVOID UNVC !!!",[],0
523,gzknfme,2021-05-26,t1_gzjq4zr,stocks,"If he has any money tell him you’ll buy one together, having some skin in the game may be interesting",[],0
524,gzknjsi,2021-05-26,t3_nlhpv3,stocks,"Many people don’t realise this but we were supposed to be at 0 by the 30s. The 2050 reduction goal is pissing in the wind.     
This is a very minor positive step but still doesn’t suffice.",[],0
525,gzknm3t,2021-05-26,t3_nlo9el,stocks,Hey guys! What do you think about companies that do a lot of online retail sales like Amazon and Target? I was just thinking those might do really well because of this coronavirus thing preventing people from going into stores and stuff.,[],1
526,gzknmez,2021-05-26,t1_gzk4kaf,stocks,kind of feels like we're out of it.  Unless this just becomes a year of chop.,[],1
527,gzknojl,2021-05-26,t1_gzkn0wl,stocks,"I am still long,its happening.believe what you believe.I trust this.",[],0
528,gzknosy,2021-05-26,t1_gzizwm1,stocks,Isn’t carbon capture inefficient?,[],0
529,gzknscu,2021-05-26,t3_l8rhr3,stocks,Great info on which broker is good vs bad. Thanks,[],1
530,gzknt09,2021-05-26,t1_gzknojl,stocks,"Never happening.  Hasn't happened during the 10 years they said it would.  

UNVC is not a real thing.  It's just a pennystock boilerroom type scam.",[],0
531,gzknte0,2021-05-26,t3_ndo7u3,stocks,"I am interested in renewable energy etfs but looking at ICLN that rebalances portfolio based on market cap, is market cap always indicator of progress made by companies?  Also it is heavily leaned on US companies when other contries are making better progress in clean energy sector.",[],0
532,gzknufl,2021-05-26,t3_nlkgg1,stocks,"ETON. 3 PDUSA catalysts coming out over the next month, 2 of them this week.",[],0
533,gzknurr,2021-05-26,t1_gzizwdg,stocks,"Thanks I appreciate that and I think it's time I consolidate behind behind a smaller number of companies that I have high conviction in. That said, I have recurring buys in all these companies so I can DCA into a position slowly. I find that I can say, ""Oh I want to keep an eye on Crocs, it seems like an interesting business."" But if I buy just a little piece, like $50-100, then I will be more likely to actually continue to do the research and deepen my understanding.",[],1
534,gzknxzd,2021-05-26,t1_gzknt09,stocks,"That was a shell,this is not that.someone else owns it now.",[],0
535,gzko276,2021-05-26,t3_nlilhm,stocks,First lesson. Buy before it takes off. Not after.,[],0
536,gzko4qd,2021-05-26,t1_gziy28e,stocks,"I think this is a terrible acquisition and an overpay, Amazon’s Achilles heel is it’s prime video content and design. If you scroll through the MGM catalog, it’s a lot of old old Hollywood blockbusters and a womanizing middle aged guy with a license to shoot people. How does that play into today’s content consumers? It was as if this thesis was written by a 57 year old white guy .

To think Disney acquired Marvel and Lucas films for less than this.",[],0
537,gzko8z5,2021-05-26,t1_gzknxzd,stocks,"UNVC is a scam.  It is nothing but a scam.

All year long they were saying it would be uplisted to NASDAQ in April 2021.  Came and went.  Wasn't listed.  Same story as the past 10 years.  It's coming soon.   IT'S COMING NEVER!!!!!!

Don't be fooled by con artists.  Avoid UNVC before it falls back to $0.000001 per share just like every other time they ran this fraud.",[],1
538,gzkockw,2021-05-26,t1_gzk4fuk,stocks,...being the court?,[],1
539,gzkoghl,2021-05-26,t1_gzjkamx,stocks,I think this is just a trap to lure guys to her onlyfans.,[],1
540,gzkoj4z,2021-05-26,t1_gzko8z5,stocks,"All i know is i made gains this year after holding for 3 years,took some profit still long,im good.",[],1
541,gzkojmv,2021-05-26,t3_nlhpv3,stocks,"Moving the HQ soon…

They will be removing the “Dutch” in the name… mark my words!!!",[],1
542,gzkopaa,2021-05-26,t1_gzknosy,stocks,"If it is, it will get buried.

It’s all just theater.",[],1
543,gzkopxb,2021-05-26,t1_gzkoj4z,stocks,"People always make money if they get in early at the beginning of a scam.  However, you have to get out before the gig is up and it comes tumbling down --- like every other time the ran the UNVC scam over the past 10 years.",[],1
544,gzkorgx,2021-05-26,t1_gzjlewp,stocks,"Shop, yes. Don’t know TTD well enough",[],1
545,gzkosb4,2021-05-26,t1_gzk30y5,stocks,"It's still information that's relevant. Everyone can have their own opinion on the matter. More information is always better wether it's positive, negative or if it's only a meaningless drop in the bucket. If you want you can look at it that they don't do enough to help guide with the climate battle. But it's still relevant.",[],0
546,gzkosk6,2021-05-26,t1_gzko4qd,stocks,Damn white guys.,[],0
547,gzkoza5,2021-05-26,t3_nljpkq,stocks,"It’s going to be a very long time before these are mainstreamed. They only do some things substantially faster, but they’re wildly more expensive.

If you want to get in now, go for it. My personal opinion is that the tech will take many years before it mainstreams, if it does at all. I think the first quantum supercomputers will be used for encryption/decryption by federal agencies and regulated, which will further hamper industry adoption on top of already massive price tags and expensive maintenance costs.",[],0
548,gzkp23l,2021-05-26,t1_gzkk3tu,stocks,"Amazon won't make money unless they get PBM market share period. The largest PBM in the country excludes them from receiving payments for the vast majority of medications. You're missing my point. Amazon won't be getting payments for maintenance drugs from CVS *because most Caremark contracts feature CVS-only fills.* Some plans are more open ended on pharmacy networks but only if the client employer opts into it. Maintenance choice and retail 90 plan designs determine the pharmacy network, and most are the more restrictive former option. Caremark's plans almost universally feature specialty drugs *only* being filled at CVS specialty pharmacy. If people want to try to buy specialty drugs without insurance at a pharmacy of their choice, I wish them luck.

Who's paying for all the shit, Pig? The PBM--which directs patients as to where they can or cannot fill. The economic ramifications should be obvious. 

CVS Caremark is moated; an Amazon pharmacy enterprise without a PBM is anything but.",[],0
549,gzkp5b8,2021-05-26,t3_nlhpv3,stocks,The next virus will be much worse then...  Dammit,[],0
550,gzkp66u,2021-05-26,t1_gzknosy,stocks,As much as I would like to say yes or no I wouldn't know a good answer. But I think we all agree that preventing is better than cleaning up.,[],1
551,gzkp7tc,2021-05-26,t1_gz3kanr,stocks,The general public would be ecstatic if Bezos was locked up. Me included,[],0
552,gzkpagt,2021-05-26,t1_gzimj5t,stocks,"100% 

Then, just like with the US, they will just move to where the regulations will allow the company to operate with less hinderance.",[],0
553,gzkpfd1,2021-05-26,t1_gzkdy85,stocks,You still have several weeks. Why the concern with tomorrow?,[],0
554,gzkpgh7,2021-05-26,t1_gz2h19v,stocks,"“Make China their closest ally”

Bruh did you even take history class??",[],0
555,gzkphfu,2021-05-26,t1_gzk5lri,stocks,"Let's wait til they are on the road.  


A lot of speculations about ""taking the market away from Tesla"" lately. However Tesla still has its ""the only one"" privilege. That's why its stock is that high. Wait until actual data is there to make that determination",['TSLA'],0
556,gzkpidt,2021-05-26,t1_gzk7jys,stocks,Yeah because you know what’s gonna happen to a stock that multiple brokers suspiciously and arbitrarily prevented their customers from buying. I bet you’ve seen many of those over the years. And also that those stocks had a global social media following of people that most likely own more shares than there is supposed to be in the float...,[],0
557,gzkpnai,2021-05-26,t1_gzkizm2,stocks,For wall street too.    Using loss leaders to get fresh dumb money into the market is a smart play.   Especially when they can use the house (our) money to do it eh guys?,[],1
558,gzkpnqz,2021-05-26,t1_gzkp23l,stocks,"Do you have any evidence that Caremark doesn’t pay Amazon Pharmacy claims for maintenance drugs? 

First of all you need to understand that maintenance drugs and specialty drugs are two separate categories of drugs, you keep mixing them together.

Specialty drugs as I said in my other comment is very complex and require URAC accreditation to get the talks for contracting started. It isn’t completely off the table. Amazon can pursue it if it wanted to if the numbers make sense but Caremark could require one sided contract that Amazon may not find it to be worth anything.

Amazon. Already. Does. Maintenance. Drugs. For. Caremark. Patients. Your head doesn’t seem to grasp this for whatever reason. I have gotten my maintenance drugs before, as someone who’s claims are paid by Caremark. 

Dumbass.",[],0
559,gzkppsa,2021-05-26,t3_nltj9w,stocks,All this will do is destroy long time family owned drug stores and regional companies all the while costing 3x times more for medication most likely being processed by the lowest bidder in china.,[],1
560,gzkpqwr,2021-05-26,t3_nlcs5h,stocks,I am aware of a 400k share sell wall at $20.00 on AMC.,['AMC'],1
561,gzkptd0,2021-05-26,t1_gzkc9sb,stocks,It just needs to stay pumped up until late next month when my condo goes on the market lol,[],1
562,gzkpuxj,2021-05-26,t3_nlilhm,stocks,"My 1/2022 10c’s are printing right now, bullish on $F juve!!",[],1
563,gzkpvc1,2021-05-26,t3_nlilhm,stocks,Best of luck. Hopefully the lightning is a hit. I don't like that debt to asset ratio tho.,[],1
564,gzkpy99,2021-05-26,t1_gzkp66u,stocks,"Well, last I heard, recently, was that it’s not “commercially” viable, but I realise that means it may work but just not well enough for money men to care.      
My understanding is that it’s basically a pipe dream in the grand scale of carbon pollution management",[],0
565,gzkpz5l,2021-05-26,t1_gziwtfo,stocks,"I've watched a lot of interviews and listened to calls with the CEO.

I'm pretty sure he's really bullish about their new product lines, from seeing early results.

Again, investing in a turn-around story like this is a risk, but it's a risk I'm willing to take from what I observe.......",[],0
566,gzkpzcn,2021-05-26,t1_gzkpnqz,stocks,I work for Caremark lol.,[],0
567,gzkq334,2021-05-26,t1_gzk6ger,stocks,What an American thing to say. You won’t be worrying about gas prices when your kids are choking on carbon dioxide in 10 years..,[],0
568,gzkq48c,2021-05-26,t1_gzkk7tu,stocks,Seems you've got a pretty good selection. Railroads are definitely one area that's quite stable against both a recession and industry disruption. Hard to be more efficient than rail.,[],1
