,comment_id,created,parent_id,subreddit,text,Organizations,Sentiment
218,gzk53nl,2021-05-26,t3_nlqu1g,stocks,"If you want to hold the stock because you think it is going to rise again, you buy more shares at the low price and hold the original shares. You don’t sell anything. Put another way, you increase your position in the stock.

This also has the effect of averaging your cost basis among the various purchase points. You have your original 100 shares purchased at $10. When the stock price drops to $6, you purchase another 100 shares. You now have 200 shares at an average price of $8 per share.",[],0
219,gzk580s,2021-05-26,t3_nlqtjo,stocks,"Considering how hard it was to buy the new RTX 3000 series, I wonder what would have happened if the cards had been produced in larger quantities and easier to buy.",[],0
220,gzk58my,2021-05-26,t3_nlqtjo,stocks,So did miners.,[],0
221,gzk58vr,2021-05-26,t1_gzk2r5a,stocks,"Never said he was, but his claims were based on the science available at the time. One of which he cited it during his Nobel prize acceptance speech which you'd think is full of scientists that would've set the record straight. 

You say politicians aren't scientists and scientists aren't politicians, I've been wondering about that for a while, funding is funding.

Problem is default positions are not conductive to long term results when they're so militantly and rabidly enforced by people that have no interest in anything other than what has already heed digested for them. A good number of the greatest minds in science are so precisely because they went against consensus, sometimes at personal cost.

Agreed, I have no expectation we'll solve this subject on a reddit discussion but seeing how hot under the collar some people get is always interesting.",[],1
222,gzk5cn6,2021-05-26,t1_gzjd2cp,stocks,"On what basis is F150 the best selling *vehicle* for 39 straight years?  I'm pretty sure I've seen many years in the past where Taurus and Corolla and civic and focus been top selling selling.  Top selling truck, sure that sounds plausible.  But top selling vehicle overall doesn't seem correct.  Maybe they're fudging numbers somehow?",[],0
223,gzk5d3h,2021-05-26,t3_nlqu1g,stocks,No reason to sell at 6 and buy back at 6. If you sell at a loss and buy back within 30 days the loss is added to your cost basis. Just buy 400 worth more if you want. No guarantee it will come back up. What is the stock?,[],0
224,gzk5em0,2021-05-26,t1_gzk36on,stocks,"Same, sold at 13, but still profited",[],1
225,gzk5fmk,2021-05-26,t1_gzj9pzn,stocks,What made you think last week was a good time to sell?,[],1
226,gzk5lri,2021-05-26,t1_gziolpn,stocks,Idk if Tesla is valued 600Billion Ford should be 2 Trillion.  The F150 lightning is going to destroy the cyber truck in sales and is a real product.,[],0
227,gzk5m5g,2021-05-26,t3_nlhcci,stocks,Damn you just basically gave an entire intro to accounting course in a Reddit post and still explained it better than my profs. Cheers my man these are fantastic and super helpful for anyone who hasn’t taken finance and who may be learning on their own,[],1
228,gzk5ml4,2021-05-26,t1_gzk1b9n,stocks,"I'm not going to today as I'm in a much better mood than I was this morning but I'd suggest strolling over to superstonk lmao.

They think that a 10000+ price target or even higher is not a meme...at least some of them.

And I think that would cause problems.",[],0
229,gzk5nzq,2021-05-26,t3_nlcs5h,stocks,Domino's stock is legitimately $420.69 right now...,[],1
230,gzk5p1d,2021-05-26,t1_gzjckjz,stocks,Wait what type of discount are we talking about here lol,[],0
231,gzk5px8,2021-05-26,t1_gzk53nl,stocks,"Not in a position to double my investment. To bring those numbers closer to whats actually happening, I invested a total of 4k into a stock thats worth around 2500. Was thinking of partially closing some shares and topping off before buying again at the dip",[],0
232,gzk5qju,2021-05-26,t3_nlr2h2,stocks,"Sorry, your [submission](https://www.reddit.com/r/stocks/comments/nlr2h2/tesla_analysis/) in /r/stocks has been automatically removed since it was a link only.

**Please resubmit your post & provide some text (or quote) along with your link.**  Also if you have any open positions related to the financial instrument, please include that, thanks!

A list of the [rules can be found here](https://www.reddit.com/r/stocks/about/rules/), and if you're new to r/stocks please see the [wiki](https://www.reddit.com/r/stocks/wiki/index) and/or [read this post.](https://www.reddit.com/r/stocks/comments/4x1419/if_youre_new_here_read_this_post_first/)

*I am a bot, and this action was performed automatically. Please [contact the moderators of this subreddit](/message/compose/?to=/r/stocks) if you have any questions or concerns.*",[],1
233,gzk5sun,2021-05-26,t1_gzjwlwn,stocks,"Arguably, different asset classes entirely would be a better bet if one is truly basing things on fear of runaway inflation.",[],0
234,gzk5t6v,2021-05-26,t1_gzisb2e,stocks,I agree..I think at some point the govt will take a closer look into it...kinda like how china is to baba.....right?,[],0
235,gzk5tpx,2021-05-26,t1_gzjtqrc,stocks,Exactly.,[],1
236,gzk5v1v,2021-05-26,t1_gzf58x1,stocks,Wouldn’t be so sure about that. Amazon’s shipping is way wack too expending on location,[],0
237,gzk5vac,2021-05-26,t3_nlqtjo,stocks,Aaaand it’s down after market lol,[],1
238,gzk60m9,2021-05-26,t1_gzk4hpi,stocks,"Ah right! Interest is right. I recall that from The Big Short now, lol.",[],0
239,gzk60mb,2021-05-26,t3_nlqtjo,stocks,wow,[],1
240,gzk63dw,2021-05-26,t3_nlr4kb,stocks,"Sorry, your [submission](https://www.reddit.com/r/stocks/comments/nlr4kb/serious_to_the_people_who_warn_that_you_wont_get/) in /r/stocks has been automatically removed due to Rule 3:  Low effort.

If you just want to post 1 liners or just want to know everyone's thoughts, then post a comment to our daily discussion thread which are generally stickied or [click here.](https://www.reddit.com/r/stocks/search?q=author%3Aautomoderator+daily+discussion&restrict_sr=on&sort=new&t=all)

If you're wondering **why a stock moved** a certain way, check out [Reuters](https://www.reuters.com/), [Motley Fool](https://www.fool.com/), and **especially** [Finviz](https://finviz.com/quote.ashx?t=spy) **which aggregates the most news for almost every stock**.

If instead you're wondering what a term means, go to Investopedia.com and search for said term there.

Either way come back here to repost with your findings, thanks!

A list of the [rules can be found here](https://www.reddit.com/r/stocks/about/rules/), and if you're new to r/stocks please see the [wiki](https://www.reddit.com/r/stocks/wiki/index) and/or [read this post.](https://www.reddit.com/r/stocks/comments/4x1419/if_youre_new_here_read_this_post_first/)

*I am a bot, and this action was performed automatically. Please [contact the moderators of this subreddit](/message/compose/?to=/r/stocks) if you have any questions or concerns.*",[],1
241,gzk65d2,2021-05-26,t3_nlcs5h,stocks,AAPL my duuuude what is you doin,['AAPL'],0
242,gzk65fy,2021-05-26,t3_nlq74u,stocks,I don’t hold any gme or amc but if you do nice job you have had a few great days of profit,[],1
243,gzk66bq,2021-05-26,t1_gzk5p1d,stocks,Friends and Family = ~wholesale with no need to negotiate. It’s how we buy our cars.,[],1
244,gzk67om,2021-05-26,t1_gzk5ml4,stocks,This is the second post on this topic I’ve seen. Def going to check that out for the lols,[],1
245,gzk67we,2021-05-26,t3_nlo9el,stocks,Where have you been the last year?,[],1
246,gzk6btw,2021-05-26,t1_gziu752,stocks,What here is different in Canada? Or is that a big post all on its own.,[],0
247,gzk6c0y,2021-05-26,t1_gzjtqqg,stocks,textbook,[],0
248,gzk6cn9,2021-05-26,t3_nlkdvg,stocks,"People may say you are limiting your upside potential with so many stocks, others may say you are nicely diversified. I think it's also important to take on more stocks as a young investor. The more you pick, the more companies you follow, the more you learn. You'll see what works and what doesn't, and can fine tune your strategy as your account grows over the years.",[],1
249,gzk6cr0,2021-05-26,t3_nlcs5h,stocks,Will people dump $F tomorrow? My puts are hurting. Shoulda sold yesterday 😔,[],1
250,gzk6dl0,2021-05-26,t3_nln5br,stocks,Are you single?,[],1
251,gzk6eho,2021-05-26,t1_gzk3o11,stocks,Yea that was back in March. It's may now. It's never going that high again. Come back to reality,[],0
252,gzk6fv9,2021-05-26,t3_nlhcci,stocks,I'm sure this is useful for people who understand all this.,[],0
253,gzk6ger,2021-05-26,t3_nlhpv3,stocks,Can’t wait to pay higher gas prices!,[],0
254,gzk6hcu,2021-05-26,t1_gzixc1i,stocks,"Not gonna lie, I'd happily watch a good female James (Jane?) Bond, it might spice things up. Then again I've always liked Modesty Blaise, an original femme fatale, just as much as James Bond",[],1
255,gzk6jjj,2021-05-26,t1_gzk65fy,stocks,"Nah, I'm not into meme stocks. Though, their impacts do concern me.",[],0
257,gzk6nq4,2021-05-26,t3_nlilhm,stocks,"I actually am impressed that you're considering aspects like inflation (even though I'm not as fearful of inflation as pundits are, good on you for at least having it on your mind) and secondly for implying that you would be willing to sell.  Too many beginners make an oath to ""hold it forever"".  During my career, that mindset has been ruinous.  Few stocks are worth keeping blindly, forever.  They rise and fall.  Today's best company can be next decade's joke.  Stocks are mostly pieces of paper, symbols, computer digits.  They're not your family.  You buy them with the expectation of making money, and that only happens when you sell. 

I would have also liked to see you maybe say you're prepared to lose money, because that is also a reality of stock market investing.",[],0
258,gzk6q77,2021-05-26,t1_gzk6eho,stocks,2 month is very short time,[],0
259,gzk6rz9,2021-05-26,t1_gzj1iw1,stocks,You the voice we need. Much appreciated :),[],1
260,gzk6sdp,2021-05-26,t1_gzjmufa,stocks,As in depth as the 30% rise in the past 2 days,[],0
261,gzk6v2h,2021-05-26,t3_nlhpv3,stocks,I hate when NA companies are hit so hard... major contributors to green house gases are Middle East and China... get those folks to get emissions under control,[],0
262,gzk6vqm,2021-05-26,t3_nlhpv3,stocks,Shell: “Well I guess we’re out on the Netherlands.”,[],0
263,gzk6y19,2021-05-26,t1_gzig9tu,stocks,good job everybody,[],1
264,gzk6y91,2021-05-26,t1_gzk6dl0,stocks,Yes,[],0
265,gzk6ylk,2021-05-26,t3_nlcs5h,stocks,"\[Serious\] To the people who warn that 'you won't get these returns in a normal market', are you talking to investors or day traders? I'm just curious if you think that day traders wouldn't have the same experience in any market. What about short sellers?",[],0
266,gzk70ka,2021-05-26,t1_gzk320m,stocks,How does living in a basement prevent you from making money at the expense of a hedge fund?,[],0
267,gzk71lr,2021-05-26,t1_gzk6cr0,stocks,What are you contract stats?,[],0
268,gzk760n,2021-05-26,t3_nlilhm,stocks,"If there was anytime not to buy $F, its right now when the hype and inflated price is at it's highest.",[],0
269,gzk76b0,2021-05-26,t1_gzk65d2,stocks,LOL. I was looking at that a few mins ago. Literally everything on my watch list in the green---except AAPL.,['AAPL'],0
270,gzk76hm,2021-05-26,t3_nlhpv3,stocks,emmmmm,[],0
271,gzk77ll,2021-05-26,t3_nln5br,stocks,"Its been lumped in with the ""meme"" stocks or more accurately heavily shorted stocks. These memes are made because supposed ""smart"" money or wall street took heavy loses this entire year on shorted stocks including this week, and the internet has made memes that smart money my not be so smart. The shorters seem to think they can get there money back because of they say these stocks are overvalued. In the world of trading something is only worth what you can get someone to pay for it, retail all ready proved they would pay more. If the shorters do encounter an infinite squeeze there be forced to buy these stocks back at possible unbelievable prices. There needs to be more transparency in shorting but honestly after January there is less and its becoming a large issue in the stock market.",[],0
272,gzk77vc,2021-05-26,t1_gzk46rs,stocks,Three days ago is history I focus on the present,[],1
273,gzk782h,2021-05-26,t1_gzk320m,stocks,"No I don’t, but I also don’t think the hedge funds were prepared for the amount of effort and DD that has gone into this the past few months.  Have you read some of the DD?  It isn’t some high schooler writing those up.

No one knows what’s going to happen, including you.",[],0
274,gzk79e6,2021-05-26,t1_gzk320m,stocks,"Gasparino, is that you?

Why are you so obsessed with your mom’s basement? Still trying to figure the way out from it yourself?",[],0
275,gzk79eu,2021-05-26,t1_gzk4xeo,stocks,*Short Squeeze,[],0
276,gzk7awg,2021-05-26,t1_gzk580s,stocks,"Really makes you wonder, doesn't it ? Hope Lovelace will fare much better.",[],0
277,gzk7b06,2021-05-26,t1_gzk6q77,stocks,Cool pile your lifesaving into it and watch as it does nothing but continue to fail,[],0
278,gzk7bl4,2021-05-26,t1_gzk5vac,stocks,At this point let's anticipate and buy the dip :),[],0
279,gzk7byg,2021-05-26,t1_gmwt2h4,stocks,"Past performance does not indicate future results.   With that said, I am thinking the same as you and bought some shares for pennies.  They are now converting to warrants for the new shares but I have no idea what they’re worth at the moment.   Offshore industry has been hammered the past few years and I am gambling that valaris will make a comeback.  If not, I lose a few bucks.  Seriously doubt it will ever reach the $200’s again, but one can dream.",[],0
280,gzk7ce3,2021-05-26,t1_gzk4xnf,stocks,That is crazy! Stock should go up +20%,[],0
281,gzk7dl7,2021-05-26,t1_gzk5vac,stocks,Priced in already,[],0
282,gzk7duh,2021-05-26,t1_gzk70ka,stocks,It doesnt. The point is that the hedges won't get caught with their pants down again,[],0
283,gzk7gsi,2021-05-26,t1_gzk6eho,stocks,"Also that is exacly what kenny want you to think its been 2 month its over let sell

That what a normal ppl would think but
Where dumb ass ape and dont think like other",[],0
284,gzk7hoj,2021-05-26,t1_gzk7gsi,stocks,"Dumb ass-ape

[xkcd: Hyphen](https://xkcd.com/37/)

---

^^Beep ^^boop, ^^I'm ^^a ^^bot. ^^- ^^[FAQ](https://pastebin.com/raw/vyWra3ns)",[],0
285,gzk7jys,2021-05-26,t1_gzk782h,stocks,"I do know what's going to happen, because it's happened to ever company with a shitty buisness model for the past 20 years. It will have a fewnmore rises, but never return to 400 and then it will die out and return to the 20$ share it was always meant to be",[],0
286,gzk7k49,2021-05-26,t1_gzk6vqm,stocks,"Funny thing to note:

Shell its full name is actually Royal Dutch Shell. In the Netherlands, the king can make a company “Koninklijk” (which is Dutch for Royal) when the company has existed for at least 100 years and fulfills an important need in society.",[],1
287,gzk7l33,2021-05-26,t1_gzk71lr,stocks,"$14p 6/18 expire with a 0.91 average. 

So I have time I believe, but I was up pretty nice yesterday and wanted to see if it dropped more today. But then some news came out about them spending $30 billion on EVs and that might have pushed em up more today🤷‍♂️",[],0
289,gzk7nji,2021-05-26,t1_gzjlkr0,stocks,Hotmamma I’m thinking of changing my name to hotdaddy. Any advise?,[],0
290,gzk7ola,2021-05-26,t3_nl7km5,stocks,"Nagarro's former parent company, Allgeier SE is also traded in Germany.",[],0
291,gzk7r9m,2021-05-26,t3_nlhcci,stocks,Thanks King,[],1
292,gzk7rsj,2021-05-26,t1_gzk2zei,stocks,😂😂😂😂🏆🏆🏆🏆,[],0
293,gzk7utg,2021-05-26,t1_gzk4xnf,stocks,I would think that it's mainly miners,[],0
294,gzk7y47,2021-05-26,t1_gziotw9,stocks,"This is Shell, who dates back to the 1400s or something.  I think they will embrace change and do what it takes",[],0
295,gzk7yri,2021-05-26,t1_gzk7nji,stocks,Do it!! 😉,[],0
296,gzk7zsl,2021-05-26,t3_nlhcci,stocks,Just put everything into expenses,[],0
297,gzk80ce,2021-05-26,t3_nlqtjo,stocks,"Gaming up 106% YoY, Datacenter up 79% YoY, overall revenue up 84% YoY. Insane growth.

And they’re projecting $6.3B revenue next quarter.",[],0
298,gzk812b,2021-05-26,t1_gxk17po,stocks,Agree. Just buy more GOOD profitable companies.  Invest now. I say optimism is the only realism.  If the market tanks buy more and hold what you have.  Just make sure they are growing profitable companies.,[],0
299,gzk84f8,2021-05-26,t1_gzjouc7,stocks,"Basically everything has rallied for the last year with complete disregard for fundamentals, so...

JETS is still almost 40 points under SPY from the pre-crash peak, and 60 points under QQQ.",[],0
300,gzk84gg,2021-05-26,t3_lv5dlb,stocks,"Just started at 35 after having to clear out my saving to start my company. What do you think? Still building up aa few positions.

QQQ	12.98%  
SCHD	9.55%  
IVV	9.34%  
BIP	7.08%  
PBW	4.99%  
SOXL	4.95%  
VONG	4.57%  
ARKK	4.25%  
EMQQ	4.15%  
IEHS	4.06%  
PSA	3.88%  
ARKG	3.87%  
DLR	3.77%  
ARKQ	3.37%  
FMHI	2.78%  
UPRO	2.64%  
FDIS	2.62%  
IIPR	2.54%  
NVDA	2.23%  
XLF	2.18%  
SAA	2.17%  
COIN	0.99%  
FND	0.88%",[],0
301,gzk864i,2021-05-26,t3_nlilhm,stocks,please make a post for all the stock you buy,[],0
302,gzk88ef,2021-05-26,t3_nlhcci,stocks,Could you explain what is meant when one says a company is investing through the income statement?,[],0
303,gzk8b81,2021-05-26,t1_gzk6ylk,stocks,"Day trader statistics aren’t great though. Few make money, and even fewer beat the DOW or S&P 500.",[],1
304,gzk8h73,2021-05-26,t1_gzk7jys,stocks,"Dude you have zero idea what you’re talking about.  Zero.  

I’m not even a GME fanboy, but I can certainly tell you the company is worth more than $20 today and the foreseeable future.  You should do your own DD on GameStop; they’re not the same company they were 12 months ago.",['GME'],0
305,gzk8mam,2021-05-26,t3_nlq74u,stocks,Don’t worry about GME & AMC if you aren’t in them. What you should be worried about is the Reverse Repo Rates. In the last 3 days 1T USD has been pushed into the market at 0% interest. They have another collateral issue. 2.1M Mortgages are in the overdue 90+ days.,[],0
306,gzk8plt,2021-05-26,t1_gzk2zqt,stocks,"True about the luxury vehicles, but does that really matter as much as at the cheap side of vehicles, where consumers are far more concerned about cost ?",[],0
307,gzk8pzc,2021-05-26,t1_gzk5px8,stocks,It makes no sense at all to sell at a loss only to buy more shares at the lower price. It’s basic math.,[],0
308,gzk8ty0,2021-05-26,t1_gzjx89x,stocks,"Wow most of this really is word-for-word. Same images too. Pretty lame, OP.",[],0
309,gzk8ukz,2021-05-26,t1_gzk36on,stocks,"I don’t pay careful attention to stocks after I sell them, it’s too much of a “look at the $$ you could have made!” most of the time. I sold AMC at 14 for a 10% profit, my normal time to exit. I only look if there is a major dip to see if I should buy again.",['AMC'],0
310,gzk8uy6,2021-05-26,t1_gzj6dsv,stocks,"I agree 100%. The writing on the wall is quite clear with a totally different political climate as other periods in time. I am going to be shocked if ICLN doesn’t do well in the next few years. 

Let me know if you have any questions! I’m always amped to talk about sustainability and renewables.",[],0
311,gzk8v00,2021-05-26,t1_gzjiusd,stocks,"Wait till earnings (June 24), it will likely drop after.",[],0
312,gzk926c,2021-05-26,t1_gzixddg,stocks,How DARE you!,[],0
313,gzk95ra,2021-05-26,t1_gzjs3om,stocks,Yeah I bought a shit ton more at $70 ish so all is well again,[],0
314,gzk96hz,2021-05-26,t1_gzk6hcu,stocks,I don’t mind seeing Tessa Thompson as a Bond.,[],1
315,gzk99vp,2021-05-26,t1_gzk79eu,stocks,Oh he got you there,[],0
316,gzk9bye,2021-05-26,t3_nlhpv3,stocks,How the fuck does an oil company cut carbon emissions? They ARE carbon emissions,[],0
317,gzk9dd3,2021-05-26,t1_gzivoth,stocks,Think there is a chance CVS sees $80 before it bounces?,[],0
318,gzk9dnh,2021-05-26,t1_gzfayay,stocks,How are some of those folks on r/FulfillmentByAmazon making it work? I was thinking about getting into this in my professional niche but I hear so many of these horror stories,[],1
319,gzk9dp6,2021-05-26,t1_gzk8v00,stocks,That's the way she goes. Great earnings: drop. Horrible earnings: drop.,[],0
320,gzk9g12,2021-05-26,t1_gzinsby,stocks,It isn't meant to be held expecting to generate gains. It's just an arena for daytraders to take each other's money.,[],0
321,gzk9gv7,2021-05-26,t1_gzk9bye,stocks,"Companies that are too polluting can actually buy carbon credits from other companies for example, to make up for their pollution.",[],0
322,gzk9hgc,2021-05-26,t1_gzji4ia,stocks,"The funny thing is that the Dutch government was not involved at all in this court case. In fact, the Dutch government lost a similar court case recently because they made significant progress towards the goals of the Paris agreement",[],1
323,gzk9lsv,2021-05-26,t1_gzhy1to,stocks,"It's a much more common thing in certain countries with less consumer protections, especially when they sell their shares to foreigners who can't just walk over to their headquarters to check it out.",[],0
324,gzk9p4o,2021-05-26,t1_gzgc54w,stocks,Agreed. I guess we don't buy obscure trinkets like some people on here. I definitely find value in Amazon.,[],0
325,gzk9vl5,2021-05-26,t1_gzk22sp,stocks,"Is that why AMC is up 58% in the last week????????????? Doesn’t seem like it’s over, genius",['AMC'],0
326,gzk9wgr,2021-05-26,t1_gzk4xnf,stocks,"I feel like I am the only you who actually managed to buy a 3070 in my country and many people are upset, so...",[],1
327,gzk9xg1,2021-05-26,t3_nlqtjo,stocks,"Trades at lofty valuations, but continues to show massive growth justifying the valuation.",[],1
328,gzk9y44,2021-05-26,t3_nlrd89,stocks,Which one of these pencil necks is splitting that shit?,[],1
329,gzka1l8,2021-05-26,t1_gzk320m,stocks,There are institutions and big players invested in GME and AMC as well,"['GME', 'AMC']",0
330,gzka4p6,2021-05-26,t1_gzk7jys,stocks,You don’t know.,[],1
331,gzka5nt,2021-05-26,t1_gzhay67,stocks,Seriously.,[],0
332,gzka5xo,2021-05-26,t3_nlhcci,stocks,Dude this is so money thank you,[],0
333,gzka77x,2021-05-26,t1_gzjxgc7,stocks,no,[],0
334,gzka99u,2021-05-26,t3_nloc31,stocks,"A potential workaround which I'm using is based on moving averages. 

I use trading view for most of my charting needs. 

For your scenario you may consider using a 20 period moving average for example.

A $10 increase from the hypothetical dip to $60 
Would generally correspond to a break above a certain periods (e.g. on a 4hour chart)'s 20 period moving average.

Trading view can send you an alert when the stock touches/breaks above the 20period MA.

You may then manually buy the stock.",[],0
335,gzkabar,2021-05-26,t1_gzk6cr0,stocks,"with the amount of hype the flash is getting from both the US government and the financial media in general, ou might be out of luck friend",[],1
336,gzkajpm,2021-05-26,t1_gzk9dnh,stocks,"Unless you have a new product idea, or you can somehow differentiate your product or brand in some new way, then it is a guaranteed money loser. The people who are making money on 
r/fulfillmentbyamazon either got in way back at the beginning so they have thousands of five star reviews, or they have a unique product. You simply cannot complete with Chinese sellers, because they can sell the product for what you would pay for it after all costs are tallied.",[],0
337,gzkam77,2021-05-26,t1_gzhnmd1,stocks,"Once everything is EV, sure.   


But big engines (ie. planes) need forced induction. They are not going EV any time soon (I don't think - personally)",[],0
338,gzkap2o,2021-05-26,t1_gzjfhrl,stocks,2 weeks ago is when you should have been buying.,[],0
339,gzkaqxr,2021-05-26,t1_gzk0qsk,stocks,It’s illegal for a PBM to lock out other pharmacies without any reason,[],0
340,gzkatn6,2021-05-26,t3_nlkdvg,stocks,"I try to keep it around 10 high conviction stocks, of which I attend earnings calls and am completely on top of. More would be too much work. Sometimes I pool stocks into a single play, like for example I own 3 stocks from different stages of the semiconductor supply chain, but I count them as 1. Ideally I make quarterly revisions to my portfolio where I adjust allocations depending on market condition, but to be honest I sometimes start moving stuff around when a probable catalyst is expected short term and start concentrating in that like a degenerate.

 I close positions when I find a better stock than a specific one in my portfolio and ""trade them"".

I also use a correlation table to avoid having too much exposure to the same trends. This is key to measure your diversification. If you have 1000 stocks that always move together then you are not diversified.",[],0
341,gzkatsn,2021-05-26,t1_gzk8ty0,stocks,"Yeah almost all of it is word for word Damadoran with some other info from different sources, like the vertical/horizontal analysis parts since he didn't cover that.

I just thought others would find it useful! Would you like me to delete it?",[],0
342,gzkayvz,2021-05-26,t3_nln5br,stocks,"Your son isnt giving you any logical reasoning to invest in it other than he saw a meme about it through social media. Yeah, you might get lucky here and there but long-term, you are going to get burned 'investing' like this.",[],1
343,gzkaz9w,2021-05-26,t3_nlqu1g,stocks,this guy owns a potential multi bagger in under a year! Hold baby 😂😂,[],1
344,gzkb36t,2021-05-26,t3_nlilhm,stocks,"Ford needs to reinstate its dividend and i would probably buy it.  Whether electric or gas, Ford and the other automakers outlook is going to remain very similar to what it currently is.",[],0
