,comment_id,created,parent_id,subreddit,text,Organizations,Sentiment
0,gzjrgks,2021-05-26,t1_gzipmeb,stocks,"Most pieces of an options price are known. The DTE, the strike, and the price and history of the underlying. However, the future volatility of the underlying is unknown, and influences the price of an option. If you own an OTM put that is increasing in value as the price of the underlying moves against you, the market believes the price of the underlying will be more volatile in the future.",[],1
1,gzjrie9,2021-05-26,t1_gzjquab,stocks,Ideally I would like to make some quick bucks now but primarily keep the majority long term. My son is very smart so I'm going to follow his instincts and buy a few in the ones he suggested. (He is also suggesting AMC) but before I invest anything substantial I wanted to get others advice who might be more experienced.,['AMC'],1
2,gzjrj8b,2021-05-26,t3_nlcs5h,stocks,TELL on the other hand,[],0
3,gzjrjhr,2021-05-26,t3_nlcs5h,stocks,I continue to load the boat on Deere. I think people are missing how big agtech can get,[],1
4,gzjrkvy,2021-05-26,t1_gzj7t6u,stocks,They say their scrubs are more anti odor than other scrub brands.,[],1
5,gzjro5d,2021-05-26,t1_gzjic6i,stocks,I bought three shares of CIBR and QQQM and one of DIA.,[],0
6,gzjroub,2021-05-26,t1_gzjia53,stocks,There down 2.2 billion today,[],1
7,gzjrp2y,2021-05-26,t1_gzjn545,stocks,"Doesn't sound like it.  I know this isn't the kind of advice you are looking for but as someone totally inexperienced myself, the constant ""who friggen knows!?"" articles concerning blackberry would stop me from putting much in it.  

I bought it as a meme stock when I first started investing (betting at this point) at $21 CAD.  I've lost over half my money on it so I've been keeping an eye on articles and it's literally a coin toss as to whether they say it's the next biggest thing or it's going nowhere.  100% of them say that they can't really recommend one way or another.

Hopefully someone here can give you a better idea but at this point, I doubt they can.  All I can say is that every stock that I've invested in with some some knowledge has done fairly well for me, and both ""It's a sure thing!"" stocks from reddit have kicked my ass.",[],0
8,gzjrqet,2021-05-26,t1_gzjovvt,stocks,Lmt,[],0
9,gzjru8w,2021-05-26,t1_gzjbu2e,stocks,"I don't know, if you want the money back and not spend it on other stocks that's fine. But I just recently sold a stock that had it's fundamentals change in a way that I did not feel confident in it anymore and put it all into a different stock 2 days ago on which I am extremely bullish (it's SFT, went down 15 percent after an offering of senior notes and dropped to like 6.30, where I doubled down on my position). Either way that stock is now up to like 7.15 today. So sometimes it really is better to cut losses as the other stock I sold ended up going down further.",[],1
10,gzjrula,2021-05-26,t1_gzjemp7,stocks,"The global middle class are responsible for the majority of emissions. 

The wealthy have higher footprints per capita, but the lionshare of emissions are from the transportation, energy, and consumption habits that are the standard in North America, Europe and east asia.",[],0
11,gzjrzkq,2021-05-26,t1_gzjemp7,stocks,"Lopsided consumerism makes a carbon tax even more attractive.  Why not penalize those who use the most carbon?

And yes taxes hurt economies, but the impact of taxes can be offset somewhat by spending the tax revenue.   The best plan by far is just offering everyone a pro-rata credit based on all carbon taxes collected.  E.G. if a carbon tax in the US generates $300 billion in revenue each quarter, each citizen will get a quarterly check for $1,000 (assuming 300m people).   Net cost to taxpayers is zero, but those who fly more and eat more meat and own humvees will lose relative to those who don't travel and take the bus.

Yes, it would still be a net detriment to the economy in the short term (as we would be pushing people away from the most efficient and cheapest fuel sources), but presumably we should be willing to take that hit in order to do more to fight climate change.",[],0
12,gzjs038,2021-05-26,t1_gzjmud0,stocks,"I’m a musician in Los Angeles. All of the amplifier and keyboard techs have been totally slammed for the last three months. Most of them have stopped taking work for the time being because they can’t do it all. Yeah, concerts are coming back.",[],0
13,gzjs0yz,2021-05-26,t1_gzji1xv,stocks,"Hey, I have a question as someone totally new to investing.  

I've invested in ETFs instead rather than traditional funds.  Is this a bad move? 

 ETFs just seemed to be much more within my price range while still acting pretty much identical to the actual funds they are supposed to represent.  

Are there downsides I don't know about?",[],0
14,gzjs2y8,2021-05-26,t1_gzjo72f,stocks,Mach E looks pretty nice.,[],1
15,gzjs3d6,2021-05-26,t1_gziryy5,stocks,They're mostly forced to cut their own emmisions. Not so much of their customers.,[],0
16,gzjs3om,2021-05-26,t1_gx3quv4,stocks,Bought at 84 and just sold at 110. 30% gain in 20 days or so. Sometimes it works out...,[],0
17,gzjs4di,2021-05-26,t1_gzjrie9,stocks,You should cut your son as the middle man and just stalk WSB subreddit lol. My guess is his next suggestion is DodgeCoin.,[],1
18,gzjs6ip,2021-05-26,t1_gzjqdvb,stocks,"Why I’m referring to the fact that I’m investing in microsoft of course! Jokes aside, I am investing after the announcement of a new windows system being made.",[],0
19,gzjs6p8,2021-05-26,t1_gzjp8p9,stocks,"You’re missing the point, they’ve spent decades trying to say it is running out, the ice will melt, the temps will increase by 2 degrees and we’ll all die,  they had models for all of those predictions. At this point they’re no better than the clairvoyants claiming the world will end by x year. You’re trying to predict a system thats billions of years old with what? 150-200 years worth of data and even then the patterns are not terribly clear unless you find what you’re looking for, lol.

If it was as big of an emergency as they say it is they’d reduce emissions from the military and the marine shipping industry, guess it’s not important for them as it should be for us. Also, if you take any sort of stance other than complete support for the measures it is almost scientific career suicide, the whole thing is a joke and a circus.

Anyhow, I’ve said my piece. This isn’t really the forum for this subject.",[],1
20,gzjs709,2021-05-26,t3_nlilhm,stocks,"In response to all saying they have debt and don’t even have the electric F150 out yet…

All the car companies that are competing with F have debt. Which ones are profitable without government handouts & loans or a side hustle? They are valued by their potential EV sales 5, 10 or 20 years into the future. 

I can’t go to the local dealership lot and buy an all EV truck (with a bed)  from anyone else yet, can I? 

Why is F held to a different standard? Maybe because their CEO doesn’t love to tweet or he is not a “strong woman”.  F has been around a long time and has a new CEO who wants to compete in the EV market. I wouldn’t count them out. 

By the way I’m a woman and I don’t currently own any F stock. I just don’t see why they are viewed like they are a thing of the past. They have years of experience to bring to the table. 

Rant over.",[],1
21,gzjs8xn,2021-05-26,t1_gzj7tc8,stocks,What happened? Been trying to find a link,[],0
22,gzjs9q1,2021-05-26,t1_gzjqesm,stocks,why not?,[],0
23,gzjsel5,2021-05-26,t1_gzjqu65,stocks,"Wow, thank you.",[],1
24,gzjsfsi,2021-05-26,t1_gzjjvcd,stocks,"It’s kind of the question whether this is really law or judicial activism. We’ll have to see whether it will hold up in appeal and probably in cassation (as either of the parties would probably depending on the result).

Even in judicial circles this has resulted in some raised air brows and surprise.",[],0
25,gzjsinj,2021-05-26,t3_nke9vc,stocks,"Peloton does close to a billion in annual recurring revenue, growing at 25-30% annually.

That's more ARR than Snowflake.",[],0
26,gzjsis4,2021-05-26,t3_nlcs5h,stocks,Why do I still have my 8 shares of acer,[],1
27,gzjsj0b,2021-05-26,t1_gzixi6q,stocks,There is a lot of debate on when peak oil will occur but many think its pretty much here already.,[],0
28,gzjspj1,2021-05-26,t1_gzjs6ip,stocks,Gotcha. I was considering investing in them as well which is why I was curious.,[],1
29,gzjsqds,2021-05-26,t1_gzjs0yz,stocks,"ETFs are great! I’ve got a Tech ETF that I’m invested in. 

I’ve only had 5 years of investing experience. I’m sure there’s more experienced people in the sub.

From what I understand ETFs can be traded from market open until market close. Where as index funds can be bought and sold only for the price set at the end of the trading day.",[],1
30,gzjsra4,2021-05-26,t1_gzb8jil,stocks,"I ended up closing my position a today for a 5k profit (I averaged down quite a bit), but yeah, there are somethings weighing heavily on this. One reason may have been that SPAC hearing the other day and there are some big spikes in volume",[],0
31,gzjss5d,2021-05-26,t1_gzjpuuh,stocks,Its wasn't meant to hurt. I'm just stating facts. I never expected it to even register. The most pathetic thing is after all the arrogance and badmouthing you will end up FOMOing in like a little bitch when the price starts spiking past 1000.,[],0
32,gzjst4f,2021-05-26,t3_lbpbif,stocks,This aged well! Do you still have your shares? 😊,[],0
33,gzjsw5k,2021-05-26,t3_nlcs5h,stocks,"What happened today? I haven't had a day this nice in months.

BB finally paying off!",[],0
34,gzjsy7o,2021-05-26,t3_nlhcci,stocks,appicate it,[],0
35,gzjsyia,2021-05-26,t1_gra3yfn,stocks,Is that so?,[],0
36,gzjszfn,2021-05-26,t1_gzixjg3,stocks,it's still pocket change for them. and a good investment.,[],1
37,gzjt0ur,2021-05-26,t1_glwnnj2,stocks,I more than doubled my money today with AMC! 🎉,['AMC'],0
38,gzjt1bc,2021-05-26,t1_gzjim34,stocks,what does this have to do with his space company,[],0
39,gzjt21s,2021-05-26,t1_gzj5zc2,stocks,Yeah dunno when these hydrogen stocks are good to buy again. Feel like they could be corrected a bit more,[],0
40,gzjt37g,2021-05-26,t3_nlo9el,stocks,I'm with Warren when it comes to airlines.,[],0
41,gzjt3dk,2021-05-26,t1_gy6cfkq,stocks,RemindMe! 6 months,[],0
42,gzjt3xl,2021-05-26,t1_gzjrj8b,stocks,It's not sexy tech but it is a 10 bagger. TELL your friends.,[],1
43,gzjt47g,2021-05-26,t1_gzjr8oz,stocks,I wonder if the margin calls are looming and they’re being forced to cover. I can’t believe how high AMC is right now.,['AMC'],0
44,gzjt892,2021-05-26,t1_gzjsqds,stocks,Awesome thank you!,[],1
45,gzjta3k,2021-05-26,t1_glvvido,stocks,Too bad you didn't hold! 😉,[],0
46,gzjteec,2021-05-26,t1_gzjss5d,stocks,Whatever helps you sleep at night👌,[],0
47,gzjtfr1,2021-05-26,t3_nldj8c,stocks,"Op. Hijacking your post for help


Is there a method to follow while selling call spreads? I bought a net debit spread already. Asking abou selling it. 
First sell the short option, then the long option next? 
I got a message from fidelity while buying the spread. Like if i day trade, margin will change something. 
I can option trade level 3 in fidelity- covered put and also spreads",[],0
48,gzjthcr,2021-05-26,t1_gzjs0yz,stocks,It’s completely fine to invest purely in ETFs! They were developed as an alternative to mutual funds. They are typically have a lot more liquidity than mutual funds and cost a lot less to manage,[],0
49,gzjti2x,2021-05-26,t3_nlcs5h,stocks,Glad zh is finally moving for the past 2 days after stuck at 7.80 for sometime.,[],1
50,gzjtop8,2021-05-26,t1_gzjd0mn,stocks,but there are others that do. why would you be restricted exclusively to that one single broker? especially if it doesn't fit your investment strategy?,[],1
51,gzjtp4f,2021-05-26,t3_nlhpv3,stocks,"Didn't read...but I like, how Dutch people challenge themselves by setting higher standards ahead of everyone else. That seems to cost effort to be the first, but in the long run it works out. For the largest gain in such things as technology, research,etc. one needs to do it right, but also be the first to do it ;)",[],1
52,gzjtqqg,2021-05-26,t1_gzik0yf,stocks,muffin,[],0
53,gzjtqrc,2021-05-26,t1_gziotw9,stocks,This is what every Canadian oil company is doing right now.,[],0
54,gzjtr5i,2021-05-26,t1_gzjsj0b,stocks,"Given the way we see how developing countries are going about their way, it is not really a debate, we haven't seen peak oil and likely won't for another decade, not unless we see a generational shift on a global scale which is unlikely at best.",[],0
55,gzjts2l,2021-05-26,t1_glwc5mv,stocks,This aged well! 😉,[],0
56,gzjtwak,2021-05-26,t3_nlcs5h,stocks,Holy shit first time I've been overall in the green since February. That's not including the ARK that I sold at a loss though so if it included that I'd still be red. But whatever the app shows green SO WE GREEEEN.,[],1
57,gzju4vg,2021-05-26,t1_gzjthcr,stocks,"Awesome, that's exactly why I chose them over mutual funds.

I've only been at this for a bit under a year so every once in a while I second guess all of my choices and assume I've just set myself up for failure lol.

Thanks for the help!",[],1
58,gzjw2r5,2021-05-26,t3_nlilhm,stocks,"Lol, I bought 1000 shares of Ford back in March at its 2 year high. Today I sold all of them. I agree Ford wil go higher but after the volatile April and May I just had to sell them for my peace of mind and cash in my profit. I'll definitely scoop back some shares if it goes down. You might have to hold a few months to break even but it was a good decision for a first purchase.",[],1
59,gzjw4iy,2021-05-26,t3_nlntnl,stocks,"$155 at split,,, just a guess",[],0
60,gzjw5oi,2021-05-26,t1_gzjvtpa,stocks,"AMZN, AAPL, and MSFT have been a pain in my ass for months now",['AAPL'],0
61,gzjwf54,2021-05-26,t1_gzjw044,stocks,The article is simply a collection of studies by analysts from a wide collection of agencies and oil companies. They may be wrong but to speak with such certainty like you are makes me wonder why you believe you have better knowledge then people that do this for a living.,[],0
62,gzjwi8i,2021-05-26,t1_gzjrjhr,stocks,"Its soared like crazy over the past year+ though. How much more can it really still have in its tank?

And what happens if/when they pass laws that allow farmers to repair their JD equipment other than JD dealerships? Its insane they're allowed to mandate that",[],0
63,gzjwkwi,2021-05-26,t1_gzjia53,stocks,Bill Gates foundation selling and bought CPNG,[],0
64,gzjwlvj,2021-05-26,t1_gzjetiz,stocks,"The ice melting and the effects of climate change don't appear in a single type of event like Y2K was supposed to be. You sound pretty naive about that.

There is an overwhelmingly large consensus around the fact that gravity exist, yet it doesnt stop scientists from debating about its iner workings.

By rambling about some corporate greenwashing and the atrocious vIrTuE sIgNaLiNg you juste wave the whole concept of the problem like its no big deal.

You should buy some beachfront property in New Orleans if you're so confident about keeping your head so far up your ass for the coming years.",[],1
65,gzjwlwn,2021-05-26,t1_gzjiyox,stocks,"Car manufacturers are the last thing you want to bet on during a high inflation scenario. Food companies, agribusiness and market chains should be your bet if you want to protect your investments against inflation.",[],0
66,gzjwnjz,2021-05-26,t3_nlm9wp,stocks,"I have CIBC Investors Edge. Not the sexiest but cheapest trades compared to the other bank and in all honesty has failed maybe once or twice since I’ve had it a couple years back. 

Personally I recommend it.",[],0
67,gzjwnzj,2021-05-26,t3_nljfic,stocks,"I like Fidelity, but that app is a time capsule back to the early 2000's",[],1
68,gzjwp2z,2021-05-26,t1_gzjs038,stocks,Bout damn time. I've never wanted to go to a concert so bad,[],0
69,gzjwvmg,2021-05-26,t3_nlhpv3,stocks,Urgh my stocks,[],1
70,gzjwzes,2021-05-26,t3_nl0qad,stocks,"Thanks for posting this. Im curious in how this has worked out for you, what your portfolio consists of, and whether or not this method still is valid in the YOLO economy of GME and AMC.","['GME', 'AMC']",1
71,gzjx1yw,2021-05-26,t1_gzjvmyt,stocks,It's it the same as mine? I shorted 200 amc this morning...,[],0
72,gzjx4wu,2021-05-26,t3_nlmpvf,stocks,"With that amount of money, you probably would be better served to plug most of it in index investing, unless of course you happen to have a few other couple 100Ks laying around...

Also no offense, but how have you lost money on OSK? I owned the stock and it has been up 20% the past quarter, and 5% the past month. If you literally bought it last week and are now question your tactic because its down, perhaps you need to reflect if you have the right mindset to plug that much money into individual stocks.",[],0
73,gzjx6s1,2021-05-26,t1_gzjvmyt,stocks,"Is it like a mixture of blue and yellow? I wouldn't know personally, just heard rumors of it. 🤣",[],1
74,gzjx89x,2021-05-26,t3_nlhcci,stocks,"If you rewrite pretty much most of what Aswath Damodaran teaches on his slides on youtube, at least be a man and say that.

For anyone wondering, most of this text is word by word, segment by segment from Aswath Damodaran's youtube channel about Accounting 101. Guess what, it starts with The Income Statement.

[The Income Statement by Aswath](https://www.youtube.com/watch?v=Q8wKr1QDSwg&list=PLUkh9m2BorqmKaLrNBjKtFDhpdFdi8f7C&index=3)",[],0
75,gzjx8n7,2021-05-26,t1_gzjlwmg,stocks,"Greed is excellent way to lose money, just look at wsb and loss porn",[],0
76,gzjx98k,2021-05-26,t1_gzinioe,stocks,Ive taken 2 courses on thermodynamics in university . But thanks for the wiki info???,[],1
77,gzjxbx5,2021-05-26,t3_nloc31,stocks,"i'm confused, what exactly do you want the order to do?

wait for a stock to drop precipitously and then buy when it goes up 10 bucks or buy when a stock goes up 10 bucks?

if youre expecting an order to predict the bottom, there's no way of doing that",[],0
78,gzjxcie,2021-05-26,t3_nlj25d,stocks,"CVS isn't a pharmacy play anymore, it's a full-vertical play (Aetna+MinuteClinic+Pharmacy) so the initial selloff (~3%+) was a *huge* overreaction. $100 PT year end, 4.1% of my portfolio, second highest-conviction stock (behind MSFT).",[],1
79,gzjxf2a,2021-05-26,t1_gzinjt1,stocks,"Check Aswath Damodaran on youtube, Accounting 101 The Income Statement, tell me if you see the similarity. :)",[],0
80,gzjxgc7,2021-05-26,t3_nlcs5h,stocks,Was yesterday and today the short squeeze that we were expecting from GME and AMC or will it continue over the next week or so??,"['GME', 'AMC']",1
81,gzjxhrx,2021-05-26,t1_gzjrjhr,stocks,Mind sharing your bull thesis on it?,[],1
82,gzjxkz3,2021-05-26,t1_gzjuyyk,stocks,"Yes, I think you are correct. I believe I was misunderstanding the term ""impairment.""",[],0
83,gzjxl5w,2021-05-26,t3_nl0qad,stocks,[This is also how I go about doing DD](https://old.reddit.com/r/runningAndJumping22/comments/n46qep/how_i_do_due_diligence/).,[],0
84,gzjxlpc,2021-05-26,t3_nln5br,stocks,"His earlier recommendations worked out due to luck. Gut feelings, tip from a friend, ""experts"" on Reddit. Invest something to show your support but investing in individual stocks on a hunch can go south real fast.

Of all the stocks to pick BB would not be one of them.",[],1
85,gzjxqtz,2021-05-26,t1_gzjmqd0,stocks,I find the opposite. At least eBay doesn't clump together reviews and doesn't hide where the seller is located.,[],1
86,gzjxqw1,2021-05-26,t3_nln5br,stocks,"well all of these are considered meme stocks.  GME obviously the biggest.  AMC is the other major one out there.  BB was trying to be hyped up and got to $16 or so then toppled down in that same timeframe.  BB has a future, but we really don't know when. 

I'm personally thinking of pulling the ripcord on BB right now to get out of it on today's gains.  So probably a good play lol.","['GME', 'AMC']",1
87,gzjxseb,2021-05-26,t3_nlkdvg,stocks,"I would suggest looking into r/bogleheads. Index investing is the easiest way to diversify in an efficiently.

If you try to make up random spreadsheets of the best companies to balance your risky portfolio, it may become cumbersome. There is a nice sense of simplicity to take a huge chunk of your cash, stick it into a total market index fund, and watch it go to work. No more constantly checking your investment portfolio of 30+ stocks, which is stupidly time consuming.",[],1
88,gzjxshr,2021-05-26,t1_gzimj5t,stocks,"This is pretty narrow thinking. Climate change happens at the demand side & the supply side.

You can't simply fix climate change by getting some people to use less plastic bags and wooden straws. Change must also happen at the systemic level.

People who work for slave wages in poorer countries aren't ""demanding it."" They do it because they are desperate and poor.",[],0
89,gzjxte7,2021-05-26,t1_gzioir0,stocks,"Risky, yes. Volatile, yes. I think that if you are a super long term and want to play the sector, then that is probably one of the best ways to do so. I personally don’t think the industry will catch traction for a little while.

Long ARKG.",[],1
90,gzjxv5x,2021-05-26,t1_gzjx6s1,stocks,I might be colorblind.,[],0
91,gzjxwk3,2021-05-26,t3_nlnhas,stocks,"I really like SE, but i think their valuation is mind boggling. They have so much competition in SE Asia ( Lazada, tokopedia). They are currently growing very agressively in order to gain market share. They are luring customer with discounts. I dont think that huge growth is sustainable. Nevertheless, I think the stock willl gain momentum again.

Coupang is also a cool company, but I think the market in Southkorea is too small, altought they have a huge online penetration in retail. I would like to see them entering new markets in South korea. 

Personally, I think BABA is currently just stupid undervalued. Its like China and SEA Etf with only fast growing companies",[],1
92,gzjxxw1,2021-05-26,t3_nlcs5h,stocks,"Hooray, down to a 4 digit overall loss! 🥴",[],0
94,gzjy9fp,2021-05-26,t3_nlhpv3,stocks,Look at what happens when people band together.,[],0
95,gzjygaf,2021-05-26,t1_gzjgho9,stocks,Then you guys can all go be assholes together.,[],1
96,gzjykgy,2021-05-26,t1_gzjan76,stocks,Lol at you being downvoted. This is a multi-bagger. I have a big position.,[],0
97,gzjymv0,2021-05-26,t3_nlhpv3,stocks,So oil prices going up. Niceee,[],0
98,gzjynau,2021-05-26,t1_gzjn7bz,stocks,"Thanks for your very helpful comment. I'm married to a woman but you're right, I never talk to her. Go insult people elsewhere.",[],0
99,gzjyo1k,2021-05-26,t1_gzj7tc8,stocks,He seems like the guy who’s a dick to the waiter to “impress” his friends,[],0
100,gzjyrn1,2021-05-26,t3_nlkgg1,stocks,"Opko Health and CoreMedix. Both are super undervalued for quite some time now. Go do your DD on them, or just look at what the analysts are saying if you are lazy",[],0
101,gzjysmk,2021-05-26,t1_gzjgpm6,stocks,"Then why reply if you don't own DIS, and since you did reply why would you bring up the fact that you dont own DIS? Sounds like you're just being defensive because you wrote a thoughtless reactionary comment.",[],1
102,gzjysoi,2021-05-26,t1_gzjxxw1,stocks,hahaha same.,[],0
103,gzjyz0h,2021-05-26,t1_gzj0phz,stocks,Facts,[],1
104,gzjyzwk,2021-05-26,t1_gzjuu8v,stocks,"Sorry -- your post or comment was removed because as per rules 2 and 7, we don't allow shilling, promotion, or pump & dumps.  That includes telling everyone (spamming) to buy & hold a specific stock.

If a stock is good enough to be bought, then explain it using fundamental, technical, or quantitative analysis rather than depending on everyone buying it at the same time.",[],1
105,gzjz1wl,2021-05-26,t1_gzjrj8b,stocks,"Sorry -- your post or comment was removed because as per rules 2 and 7, we don't allow shilling, promotion, or pump & dumps.  That includes telling everyone (spamming) to buy & hold a specific stock.

If a stock is good enough to be bought, then explain it using fundamental, technical, or quantitative analysis rather than depending on everyone buying it at the same time.",[],1
106,gzjz385,2021-05-26,t3_nlilhm,stocks,I see a lot of buzz around Ford. It seems like a lot of positive movement in the EV world but idk if I like it long term. So many electric and self driving vehicles it’ll just be dictated on new releases of vehicles and ability to self drive in the near term,[],1
107,gzjz53s,2021-05-26,t1_gziclbs,stocks,The idea is that a rising tide lifts all boats.,[],0
108,gzjz6es,2021-05-26,t3_nldj8c,stocks,Following as I have no idea about options either.,[],0
109,gzjz9v4,2021-05-26,t1_gzjx89x,stocks,"Oh yeah absolutely it's almost all Damodoran's work, with some Harvard Business School and other sources sprinkled in. I never claimed that any of this was original work, based on my opinions or anything like that, in fact the second sentence of the post mentions that it's based on notes, I'll edit to add sources but I took these notes a while ago so I'm not sure where some of it is from anymore.",[],0
110,gzjzamb,2021-05-26,t1_gzjyzwk,stocks,"Ok, sorry.",[],0
111,gzjzf7s,2021-05-26,t1_gzjsw5k,stocks,Shh you'll scare it away!,[],1
112,gzjzm4x,2021-05-26,t1_gzjs2y8,stocks,"So do the EV F150s. Not a terrible price either.

For now I'm stuck with an old one tho.",[],0
113,gzjzmgy,2021-05-26,t1_gzjw5oi,stocks,\*past 9 months,[],0
