,comment_id,created,parent_id,subreddit,text,Organizations,Sentiment
672,gzkxaum,2021-05-27,t1_gzktm86,stocks,"Two things: first, most people will not sell at the peak. It's called the geometric mean - essentially its a way to calculate the central tendency and estimate selling distribution. Based on this (this guys here did a calculation https://www.reddit.com/r/GME/comments/m9td6w/estimations_for_the_total_payout_of_gme_based_on/), even if it gets to $20M/share (I'm still highly skeptical, buy hey who knows), the highest likely price would be $4T. 

This part I am entirely unsure of, because I don't think this type of event has ever occurred. But from what's been pieced together, this is what I think the chain of events are: When the short seller's debt exceeds their margin, the broker liquidates collateral to settle the debt. When the debt is so high the brokers can't solve the debt, the clearing entities liquidate the brokers. This chain continues all the way up to the DTCC and eventually the Feds. As far as I understand it (and I could be wrong, I'm not an expert on this), the DTCC originally never believed any of its members would run into such a financial shit show. They literally didn't have any mechanisms in place to protect the market from a financial black hole. This is one of the reasons (believed) for the flurry of rules being passed lately. The DTCC's job is to make sure people get their money and the market doesn't shatter, after all.

At the end of the day, the money will have to come from somewhere. Even if that results in money printing from the Fed (hence Dr Burry's prediction of hyperinflation). If GME share holders don't get paid, then it becomes an international fraud issue. And I don't think the US government wants international fraud across hundreds of countries. 

Of course, this is the hypothetical if the squeeze does happen. Nothing is certain.",['GME'],0
673,gzkxb2t,2021-05-27,t1_gzjjnhu,stocks,Not true. Value just doesn’t go down as hard or become noticeably overvalued.,[],0
674,gzkxcyt,2021-05-27,t1_gzhfoat,stocks,They were already profitable my friend,[],1
675,gzkxfa8,2021-05-27,t1_gzcq54x,stocks,You short amazon yet with this buyout deal?,[],0
676,gzkxfpm,2021-05-27,t3_nlcs5h,stocks,"Question on placing orders.

Here are two scenarios I’d like to do. I don’t think they exist though. Can anyone suggest an alternative and/or a quick explanation on why they won’t work?

1) Buy stock at $10. When it hits $15 I want an automatic stop order placed at $12. This is close to a trailing stop loss but looking for something with more concrete amounts.

2) I want to place two orders at once and have one automatically cancelled if the other triggers. See stock around $10. Create order for $9.50 and $10.50. If it drops great I get a normal limit order, if it rises I don’t want to be left behind so I’ll buy some at higher amount if I have to. But I don’t want to buy double if it dips then rises.

Are either of these possible? Trying to not stare at screen all day but also pretty particular about trades. So I’m hoping a complex buy order could do both at once.",[],1
677,gzkxfpr,2021-05-27,t1_gzkx5e6,stocks,"Thank you. I've tried researching this, and always end up with overly complicated answers that explain everything but what I wanted answers for.",[],1
678,gzkxj2t,2021-05-27,t1_gzkwtcf,stocks,The Redstone’s owned Viacom and CBS.. it wasn’t really a “merger”,[],0
679,gzkxmbp,2021-05-27,t1_gzk4hpi,stocks,">Yeah, to my understanding, the main thing you have to do is pay interest. 

Well, no, not really.

First you have to pay borrowing costs in addition to the interest you pay on your margin account. And the borrowing costs depend on how difficult it is to borrow that stock. So for something undergoing a short squeeze the borrowing costs snowball higher and higher.

Second, as the price of the stock increases, so do your short ""losses"" or amount of money you owe. If this gets too high then you'll get margin called.

So you can't just remain short forever waiting for the price to drop.

This will only happen if people sell. But if they know too many people are short and nobody sells then the price just goes up and eventually shorts will be forced to cover.",[],0
680,gzkxn1g,2021-05-27,t3_nluj1s,stocks,"Get in on DCRN before the merger while its still cheap:  
[https://www.thetechee.com/2021/05/spac-ev-charger-maker-tritium-to-go.html](https://www.thetechee.com/2021/05/spac-ev-charger-maker-tritium-to-go.html)",[],0
681,gzkxnhj,2021-05-27,t3_nluj1s,stocks,"I suggest Dollar Cost Averaging into VT and SCHD.
How do you know a bear market will arrive in two month? If you know the dates of future bear and bull markets, you will be very rich soon enough.  Most well known experts just ride out the bears and bulls because they can’t predict them.",[],1
682,gzkxo8l,2021-05-27,t1_gzkwjsf,stocks,"That's awesome knowledge almost worth buying 100 shares for, just because.",[],1
683,gzkxq7o,2021-05-27,t1_gzgxvnm,stocks,"Not sure what you mean at least for ezgo sales up 225 percent..
So they are the only ones doing great even better",[],0
684,gzkxqkx,2021-05-27,t3_nliwx4,stocks,"When you say emerging markets, are you referring to the big BRIC economies, or trying to get more niche than that?",[],0
685,gzkxrmk,2021-05-27,t1_gzk76b0,stocks,"That’s because of Apple is to have a 20% annualized return over the next 5 years, it would grow to a 5 trillion market cap.",['AAPL'],1
686,gzkxt2x,2021-05-27,t1_gzkw16p,stocks,TDA has a great research section. No complaints.,[],1
687,gzkxuq8,2021-05-27,t3_nlhpv3,stocks,"If I was the CEO I’d tell investors to sell their shares, declare the company to meet such goals, all while dismantling the entire operation. Not just liquidate, but completely remove my infrastructure from any further use.",[],1
688,gzkxxri,2021-05-27,t1_gzkxo8l,stocks,The 100 share investment will pay for itself if you purchase a new Ford. It’s a no brainer for anyone who might buy a Ford. So glad people found this helpful. Lots of other perks at companies for just being a shareholder. Always ask! :),[],0
689,gzkxyxj,2021-05-27,t1_gzkwtcf,stocks,"Apple is a strange one, they only make originals. So who knows. They’ll have to either give up or make a big play IMHO, or they will be destroyed by Amazon and Disney. 

And on the merger, the CEO said just today they are open to another one, which is what sent the stock flying. It’s a crazy sector at the moment, they’re cannibalising each other.",['AAPL'],1
690,gzkxzx7,2021-05-27,t1_gzk3o11,stocks,">I think around 400 is when they get margin call

There's no such thing.

Everyone gets margin called at a different amount based on their own financial situation.

You only get margin called when your maintenance margin gets higher than the value of your account. And different people have different account values",[],0
691,gzky05r,2021-05-27,t1_gzk7utg,stocks,Spending around gaming is up across pretty much the entire industry. I'd actually guess that it's probably mainly scalpers buying up all the inventory,[],0
692,gzky0vs,2021-05-27,t1_gzizduc,stocks,lol nerd,[],0
693,gzky0yi,2021-05-27,t3_nlcs5h,stocks,Do stop loss orders work in premarket? Meant to be a general question but to make it relevant lets say one of the meme stocks are sold off before the open tomorrow would a stop loss be triggered in the premarket?,[],0
694,gzky13p,2021-05-27,t1_gzknosy,stocks,"Carbon capture takes energy, which costs money. It's best to not create the CO2 in the first place, but right now there isnt enough green energy to make the things people want, so we burn fossil fuels.",[],0
695,gzky2hg,2021-05-27,t3_nlv5hd,stocks,Yes they can be traded like a stock. Yes any gains or losses is treated the same. Say if a warrant is priced at $1 and let's you buy the stock for $10 then the warrant is worth $11. If the stock is currently trading for $9 then it's not worth it. If it's trading for $12 then it may be worth it. Your broker will charge you to exercise the warrant to buy the stock. Schwab charges $39. The process will take a week or three and the value may have changed by then. Warrants have an expiration date after which they have no value.,[],0
696,gzky7x4,2021-05-27,t3_nlufsp,stocks,“The Last Airdender”,[],0
697,gzky9av,2021-05-27,t1_gzkl85w,stocks,They need that approval to not tank. It's mostly priced in already I think,[],1
698,gzkyalu,2021-05-27,t1_gzkxyxj,stocks,Why would apple tarnish their brand with another brand. Apple will build from the ground up,['AAPL'],0
699,gzkydh3,2021-05-27,t1_gzk7dl7,stocks,And so the mega market cap tech starts rotation. Feb all over again.,[],0
700,gzkyfan,2021-05-27,t1_gzkwtcf,stocks,Paramount is cbs. Cbs and Paramount are viacom.,[],0
701,gzkygpi,2021-05-27,t1_gzhy1to,stocks,There was that new Jersey deli that ended up being a backdoor asian spac or something.,[],1
703,gzkyjxp,2021-05-27,t1_gzkopaa,stocks,"Isn't kinda the problem that we dig stuff up and burn it?

For example cutting down trees isn't worse part. It gets bad when we start burning it. Using wood to build things is in my opinion a great way to store CO2. As long as enough new trees grow back.

Fun fact whales actually absorb a massive amount of CO2 which they take down to the ocean floor upon death.",[],0
704,gzkykaf,2021-05-27,t1_gzkruqh,stocks,And it's paying a dividend of 24 cents per share while holding a PE of 10.,[],1
705,gzkyn90,2021-05-27,t3_nlufsp,stocks,"If you listened to the last ER call and recent investors presentation, we also have a very good near term set of catalysts, primarily they are dropping 1,000 premium movies from their library on P+ in early June and this is on the heels of the theatrical release of Quiet Place II, which will probably lead box office sales over Memorial Day weekend. As you note, Chopra, the CFO, explicitly stated on the last ER they are indeed ending licensing agreements with third party streamers to bring that content exclusive to Paramount+, and by the end of 2021 will have over 2,000 movies on the service and Will strait dropping a new movie every week in 2022. The most important aspect of ViacomCBS is that they are the only media conglomerate left that is solely devoted to content creation and they are vertically integrated - i.e. they produce the content and have the distribution channels, they don’t need anyone else... MGM for instance is NOT vertically integrated. The one thing VIAC needs is scale. I don’t see Amazon buying them at this point after acquiring MGM, they made their move, and it woks cause some regulatory issues if they also went for VIAC; however, the big behemoth that is Apple, 2.1 trillion market cap.. compared to 26 billion for VIAC.. is likely to now make a move, and VIAC is the crown jewel.. in terms of content creation they are the second biggest global only second to Disney... that’s all VIAC does is create and distribute content across its distribution channels to generate ad and subscription revenue... they also have cutting edge addressable advertising technology that makes them even more attractive... there are just so many positive things going for VIAC sits mind boggling...",['AAPL'],0
706,gzkyos4,2021-05-27,t3_nlufsp,stocks,You do all that to diligence for only fucking 40 shares are you kidding me what kind of stupidity are you the moron type holy shit,[],0
707,gzkyp6d,2021-05-27,t1_gzkxzx7,stocks,"Why can it not be 400 for them

You dont dump  200 000 share worth almost 100 mill for fun they did that to drop the price when It was close too 400",[],0
708,gzkytkc,2021-05-27,t3_nlr7pv,stocks,"Thank you!!  


Anyone have thoughts on Tritium going public via SPAC merger?  Currently trading as DCRN, I think they will be a key part of the EV movement as far as charging goes.  
[https://www.thetechee.com/2021/05/spac-ev-charger-maker-tritium-to-go.html](https://www.thetechee.com/2021/05/spac-ev-charger-maker-tritium-to-go.html)",[],0
709,gzkyus9,2021-05-27,t3_nlkdvg,stocks,I got about $100k invested and I’ve got 7 stocks,[],1
710,gzkyuu7,2021-05-27,t1_gzkpy99,stocks,At some moments I wonder why money does get in the way of making progress. It's only a made up concept to a certain point. If the resources are present why would we be limited by some made up numbers?,[],0
711,gzkyvc2,2021-05-27,t1_gzkxfpm,stocks,"Depends on your broker but something like that may be possible if there and ""advanced order"" button on your order page.",[],1
712,gzkywry,2021-05-27,t1_gzkyalu,stocks,"Well building from the ground up is failing them so far. You can’t just make 30,000 TV episodes in a couple of years. And by then it’s too late. If they want scale, a buyout is a possible way to a library to support their original shows.",[],0
713,gzkyx52,2021-05-27,t1_gzk5lri,stocks,"Doubt it.  

TSLA has the background in battery manufacturing and the EV motors.  The CEO of FORD was on CNBC today and even with the extended range one (which won't be available until 2022) it would only be about 300 miles in range.

The TSLA Cyber Truck is being advertised with 500+ range for the tri-motor one.  

Then we have the issue of the 1600-1800 lb battery, impacting the GVWR (axle or gross) and thus, the payload.  With the Model S, I can see a 1K payload sticker.  But on a truck, that's not going to cut it.",['FORD'],0
714,gzkyxzb,2021-05-27,t1_gzkvyxy,stocks,"right, so you should be happy the price has gone down, no? F is trading at $14.14 currently. i would not be looking to sell back the option with several weeks remaining. the most you can lose is your premium.",[],1
715,gzkyyus,2021-05-27,t1_gzk22sp,stocks,"Dunno why you’re getting downvoted. I’m so tired of the narrative as well. They are called hedge funds for a reason they hedge their trades. When gme rallied the first time that was then covering their shorts. Then guess what happened. Other funds then reopened their shorts at 450$ a share and made the profit back on the way down. 

So the stock can have high short interest but the price level the short interest was bought at was high so even with this current rally they are still fine.",[],0
716,gzkz1dn,2021-05-27,t1_gzk9dp6,stocks,"They release their numbers which is the most important part. Even if earnings is great, the company might be overvalued based on what the analysts perceive to be the price.

Stock prices reflect how much people are willing to pay for future growth and potential. If you wouldn’t buy a stock at that price, why hold it at all? Doesn’t matter if you’re up or down, there’s always a more efficient usage of capital.

$BB used to be a $4-5 stock for a reason. There was no change besides the mania with the short percentage. They might be getting more contracts, but I wouldn’t buy it until it hits $6-7 again.",[],0
717,gzkz1yu,2021-05-27,t1_gzkopxb,stocks,Different people now running it.,[],1
718,gzkz2x1,2021-05-27,t1_gzkyos4,stocks,"Keep buying GME calls buddy, good luck to you",['GME'],0
719,gzkz39r,2021-05-27,t1_gzk1i1k,stocks,Take a look at her profile and it's very obvious...,[],0
720,gzkz3df,2021-05-27,t1_gzk26c8,stocks,I'm not an expert in it either but I did take advantage of a mid day rise in AMC today to make some money in a day trade. In at $18.32 and out at $18.73 about 20 minutes later. I hate the nerve wracking feeling not knowing whether or not I'm going to lose a ton of money on partly or largely emotion based movements in the price. Oh and by not leaving it in to the close of trading today I lost out out on making a lot more.,['AMC'],0
721,gzkz425,2021-05-27,t3_nltj9w,stocks,I would love for amazon to spend billions on brick and mortar outlets. I don't think they're that stupid though.,[],1
722,gzkz86n,2021-05-27,t3_nlnekw,stocks,"Morningstar considers Target price as 63% overvalued as of today, and considers Amazon price as 22% undervalued as of today.",[],1
723,gzkzct2,2021-05-27,t1_gzkyfan,stocks,Paramount is Tom Cruise movies. CBS is crime procedurals for old people,[],0
724,gzkzf7c,2021-05-27,t3_nlilhm,stocks,"The majority of your long-term portfolio should be an index fund, not a specific company.

FORD is solid  though, with the recent F150 news (on the back of the aluminum body / bed of the prior F150), it didn't suffer as badly during the prior financial debacle that GM did.

You never can nor should try to time the market perfectly (unless you're sitting on some catastrophic insider news), and should be looking out for the long term.

Inflation will affect future earnings, and a weaker dollar will make exports to other countries less desirable as well.  That's a lesson for another day though.

Enjoy the stock watching!",['FORD'],1
725,gzkzkow,2021-05-27,t1_gzgesze,stocks,Lspd is crazy volitile. I want it to succeed but it keeps going to 70 then to 50. Wish I would’ve traded those jumps but instead I gave up and sold for no loss no gain. And of course it’s now way up ffs.,[],1
726,gzkzof9,2021-05-27,t1_gzkz3df,stocks,"Idk, I think the real money with AMC is holding. believe that the shorts have not covered.",['AMC'],0
727,gzkzpv0,2021-05-27,t1_gzky2hg,stocks,Thank you,[],1
728,gzkzr14,2021-05-27,t1_gzjt37g,stocks,I’m with Gordon Gekko,[],0
729,gzkzt39,2021-05-27,t1_gzkwtcf,stocks,"If anything, they merged the two, as well as putting up their NY HQ for sale, and selling Simon and Schuester as well as CNET, to make them more attractive M&A target to a certain trillion dollar companies as a lean mean second biggest vertically integrated solely devoted to content creation machine...",[],0
730,gzkztsu,2021-05-27,t1_gzkx7x6,stocks,Historical and theory mainly.,[],0
731,gzl00uu,2021-05-27,t1_gzkq48c,stocks,"Well I figured two things here. One, invest in things you like, know or trust. I've loved trains since I was a kid, so it's fun to keep up with the industry.

Second, yes they are stable. Let's be real, nobody is building any more railroads. Railroads are land owners for the right-of-way the tracks are laid on, asset holding companies for the rails, locomotives and rolling stock, and major freight/intermodal players. Backtested against the SP500, they blow it out of the water over the last 20 years with practically zero risk giving how essential they are to the country.

I'll give ya a quick rundown on the remaining 5 Class I railroads:

BNSF - privately owned by Berkshire Hathaway. I own some BRK.B because of this. Really, really wish they were public. Best of the bunch for US rail, imo.

UNP - largest public US railroad. Covers Western US. They haul everything across the country. Rate of stock gain is 2nd to last, but I can't imagine owning railroads without UNP in there. 

CSX and NSC - East coast/Midwest freight hauling coal/intermodal/commodities. Growing exponentially in terms of value. Good buy

CNI - just merged with KSU (Kansas City Southern) to create the only Canada-US-Mexico point-to-point railroad. Great entry point right now too as they paid so much for KSU that their stock took a 13% drop due to the debt taken on. Until now, rate of stock gain has been slowest of the 5 railroads, but should this merger go through long-term they may be the best hold.

CP - far and away my favorite holding. Their rate of growth is incredible, their financials strong, their leadership the best in the business. They along with CNI are the only Class I railroads in Canada. Their stock regularly takes 8% dips then roars back, so I'd wait for a better entry point or DCA in with a small initial.

Of course, do your own DD, but that's my take from a guy whose been holding these a long time. About 30-40 years ago there were 100s of railroads. Soo Line, Wisconsin Central, etc etc etc. They've all been bought out by these 5, making them stronger and resistant to competition than ever, and thus laws were passed against any more mergers due to monopoly concerns. The CNI-KSU merger is likely the last we will ever see, and it's still no sure thing as the STB (Surface Transportation Board) has not approved it yet as it would make CNI too strong. I consider each of these railroads as akin to Google essentially owning the internet. Nobody is coming for them. 

Lastly, they all recently underwent PSR (Precision Scheduled Railroading) which is a new way of moving freight, instead of going when a unit train is full, they run at set times, regardless of manifest cargo, in order to keep cars moving and customers from waiting. This has enormously cleaned up operations costs and efficiency for all involved, and railroads are now operating in the 21st century with better revenues than ever. 

I wrote much more than I meant to, but I guess I just like trains :)",[],0
732,gzl01si,2021-05-27,t3_nltpx9,stocks,😒,[],0
733,gzl04co,2021-05-27,t1_gzkxyxj,stocks,"Where did he say that today? He spoke at the investor presentation yesterday, and Chopra spoke at the JP Morgan conference, neither specifically said that, that I am aware of. The reason VIAC was up today was because Amazon buying MGM for 8.5 billion puts VIAC’s valuation into more perspective.",[],0
734,gzl07xe,2021-05-27,t1_gzk6c0y,stocks,buyback,[],0
735,gzl08sr,2021-05-27,t3_nknzhl,stocks,"My company is like a mini Berkshire Hathaway. I’m allowed to ourchase 150,000 usd per month which is absurd but I get 10% free if I hold for 12 months

Soo..... take out loan every month for 150,000$ for 2% interest. Short 150,000$ each month and oay 1% borrow rate since it’s super slow dinosaur stock. Wait 12 months. Pocket the 10% free shares, pay off 2% for borrowing and 1% for short borrowing. 7% of 150k per month profit. 

I wish I had the balls to do this but I think I’d get fired. Not sure.",[],0
736,gzl09yy,2021-05-27,t1_gzkxyxj,stocks,Again.. Viacom merging with CBS was an internal deal... the Redstone’s owned both...,[],0
737,gzl0apr,2021-05-27,t3_nln5br,stocks,"GME was the only play in those suggestions, it’s still good",['GME'],1
738,gzl0bzo,2021-05-27,t3_nlv7pc,stocks,I've been using trading view. I made a link app in my phone. I'm new at this,[],1
739,gzl0an1,2021-05-27,t1_gzkyxzb,stocks,"Yes, but it closed yesterday at $12.89. It went up quite a bit today.",[],0
740,gzl0ege,2021-05-27,t1_gzkyuu7,stocks,"Even more so for the ultra wealthy with the capacity to spend freely until their end of days. Money truly is just a concept when you are not limited by it. Yet there are a collection of them who only fight harder to put more capital to their name, despite being beyond any realm of capability to deplete what they have already accrued.      
Then they fund green washing ad campaigns😅",[],0
741,gzl0huy,2021-05-27,t1_gzk3iyu,stocks,Lol,[],0
742,gzl0k78,2021-05-27,t1_gzjlwmg,stocks,Invest $200 and give your son $300 to put into it then.,[],1
743,gzl0k7g,2021-05-27,t3_nlufsp,stocks,Hope Disney buys them to spark the antitrust debate these consolidations are creating.,[],0
744,gzl0n4i,2021-05-27,t1_gzjjmo4,stocks,"I personally divested from Amazon recently. I don’t hold too much of it. 

There is too much negative pressure on Amazon from world governments and general public on variety of things. Plus Bezos retiring, Jassy won’t have the same mindset. Amazons catalog has also come into lot of scrutiny with fake reviews and cheap goods, undercutting sellers and private labeling their own goods, etc. list goes on. Ecommerce competition is heating up daily basis. Azure and G cloud have gotten significantly better and continue to do so.

I also don’t like Amazon dipping it’s toes into so many things. I wish it focused on just dominating global commerce and AWS. Now it’s Pharmacy, Food, movies, etc. 

Given all of that, Amazon is worth $1.7T. It will be difficult to increase the market cap x3+ anytime soon. I think the money will see a better ROI in other companies moving forward. I rode Amazon for 8 years, I’m done with it. Too much risk and not enough reward potential. 

It’s okay if you’re looking for decent return for next decade, but again too much opportunity risk for relatively small reward. 

IMHO.",[],1
745,gzl0oaz,2021-05-27,t1_gzkdqu6,stocks,"With respect mate, I think you're projecting (just a little). I know you're coming from the right place and all. But this is certainly a calculated risk. That is to say (it's a risk, but a calculated one). I put thought into this and it is still a risk. So it qualifies that statement. 

As for why I was spooked. I think you've misunderstood. 

I knew the stock consolidation was coming. But when it did happen it glitched out the systems on my broker telling me I only had $70 (you can understand my confusion).

An hour later though it corrected itself. So all is good. 

For the record though, I am heeding the caution and advice of everyone and am looking into more sophisticated ways to hedge against volatility (options). I only put $2000 into UVXY so we'll see if that crash I anticipate comes out way sooner rather than later.",[],0
746,gzl0p7k,2021-05-27,t1_gzjqti2,stocks,Many.,[],0
747,gzl0qi5,2021-05-27,t3_nlv7pc,stocks,DeAndre Ayton probably.,[],0
748,gzl0tw0,2021-05-27,t3_nlqtjo,stocks,Think it'll go again for the split ala Tesla/Apple....dip baby dip,[],0
749,gzl0u88,2021-05-27,t3_nlkdvg,stocks,"Yes, you're fine, as long as you're paying attention to all 28, and from the sounds of it, you are.  

I was trained not to have so many tickers, but eventually learned that being involved is better from an emotional standpoint, as long as you have the time and information capacity to manage them.  

Emotion is an important factor for long term retail investors, and having a lot of tickers means that there's always something interesting to pay attention to, to anticipate.  

I worry you're not truly diversified if you're saying you have a bunch of Ark holdings and big tech.  That sounds more concentrated and correlated perhaps.",[],0
