,comment_id,created,parent_id,subreddit,text,Organizations,Sentiment
0,gzbvkbt,2021-05-24,t1_gzbrve4,stocks,"I'll be honest with you, that smells like pure gasoline.",[],0
1,gzbvkpz,2021-05-24,t1_gzbprq9,stocks,In this situation maybe you don’t care how much each widget cost but IRS does they want to tax you that’s why it matters,[],0
2,gzbvkzi,2021-05-24,t1_gzbj16a,stocks,So it's a Hooters with a different uniform?,[],0
3,gzbvn3l,2021-05-24,t3_lv5dlb,stocks,"Brk-b
Pltr
Hmc
Baba
Adbe
Aapl 
Snps
Jpm
Fslr
Bac

Critique plz",[],0
4,gzbvojb,2021-05-24,t1_gzbsqt7,stocks,Some people who are on discord are followed because they have been making a profit for years but other than that yes I agree.,[],0
5,gzbvrym,2021-05-24,t1_gzbt90f,stocks,I'll agree with you that it would be nice for them to give a warning if you are making a buy order that equals or is less than the fees that would go along with the purchase.,[],0
6,gzbvsmq,2021-05-24,t1_gzblq3w,stocks,"Yea, they offloading Vimeo. Get getting while the getting is good as they say. I think many people lost a lot of money and learned many lessons with this flood shit SPACs and I think there is a lot of exhaustion now.",[],0
7,gzbvsob,2021-05-24,t3_nk1757,stocks,I just started too. *snaps and chews a fresh crayon*,[],0
8,gzbvta8,2021-05-24,t1_gzaiqed,stocks,"That's not actually true, but people whine about elitism and gatekeeping if you point it out. The way tax implications and effort/reward changes drastically depending on how much money you have to where % gains and loss DOES matter pretty significantly

For instance if you have 100k, making 1 or 2% in a few weeks with a couple hours of researching picks is a massive gain, and still within reasonable tax implications. If you make 1% on 100 bucks for that same effort you aren't going to be taxed but you literally made 1 dollar for a few hours of work. Absolute waste of time. On the flip side if you have a million bucks, a small % loss is a ton of money, and not simply something you can easily get back with a day job. Small gains also carry with them significant tax implications at higher brackets, to where trading can really screw you and not be worth the effort compared to investing.",[],0
9,gzbvty9,2021-05-24,t3_nk1757,stocks,3 days ago— “Why are VOO and AAPL down?”,['AAPL'],0
10,gzbvufk,2021-05-24,t1_gzalz5l,stocks,"You can be an expert with a 100% winning streak and then the market does something ""impossible"" and poof now you're broke",[],0
11,gzbvw1a,2021-05-24,t3_nkazfv,stocks,There are a lot of articles about this online. Do a search for how to determine if a stock is over or under valued.,[],0
12,gzbvwam,2021-05-24,t3_nk92eo,stocks,"Taxes aren't necessarily based on first-in, first-out--you can actually choose which shares sell every time you sell.  Most brokers aren't going to directly give you this option, and will default to selling first-in, first-out, though.  Depending on your broker, you may be able to change the default and / or manually choose tax lots to sell through an advanced order page.  Some brokers may not provide many options for that in their apps and sites, and will require you to call them, but all of them will let you choose which tax lot you want to sell if you really want to as far as I'm aware.  Most of the time, FIFO is going to make the most sense, though.",[],1
13,gzbvx0f,2021-05-24,t1_gzbvak7,stocks,No you make your own. But most brokers have the tool you just enter in what you want it to look for. Example you pick the sector say a bank the price of stock maybe under $10 profit last qtr above 50% and it will spit out any stocks that match.,[],1
14,gzbvx4w,2021-05-24,t1_gzbalu2,stocks,3.31%  I expect to give a little back tomorrow,[],0
15,gzbvxsn,2021-05-24,t1_gzbkym9,stocks,Why is it good time to buy now? Share price went up for absolutely no reason. How is that good time to buy?,[],0
16,gzbvyl0,2021-05-24,t1_gzbvak7,stocks,Whose your broker?,[],0
17,gzbvyts,2021-05-24,t1_gzbsibm,stocks,I have about 5k and it would kill me if I lost it lol but Im in a small town and barely make ends meet.,[],1
18,gzbw342,2021-05-24,t1_gzbvyl0,stocks,I dont have one im 16 lol i invest on my dads account using my own money im.trying to find good stock picks only one i have found is a company called guru i tjink its a rly good growth company in the energy drink section check it out,[],1
19,gzbw4f3,2021-05-24,t1_gzbvx0f,stocks,What site can i use to do that,[],1
20,gzbw5kc,2021-05-24,t1_gzapmwa,stocks,I heard about that!,[],0
21,gzbw7nm,2021-05-24,t1_gzbuvu2,stocks,"Environment has changed.  I bought a Schwinn eliptical, I dont need a virtual cheer team to motivate me.  Since gyms have opened, I havent touched it, & really need to sell it on FB marketplace (along with everyone else who bought home gym stuff, & now sees it as a space waster).  Home gyms cant keep expanding forever, it plateaus at some point.",[],0
22,gzbw7xn,2021-05-24,t3_njtw5g,stocks,I sold all of my ADM to buy new iPhone. Feels good and bad at the same time.,[],1
23,gzbw83u,2021-05-24,t1_gzb6xw3,stocks,I do that anyways and my boss browses wall st bets,[],0
24,gzbw890,2021-05-24,t1_gzbuinp,stocks,"Yes the stockmarkwt is massively rigged against retail investors.
Yes robinhood will almost certainly pull more shenanigans during the squeeze. Their paymaster is citadel after all. I feel bad for those who dont and cant move to another broker. Thousands of customers have already transferred to fidelity alone.

Not hoping there is more than enough evidence if you actually look for it. You raise a good point about the rules being changed. Recently a number of regualtory changes  have been passed by the SEC which paint a powetful picture of whats to come. Google OCC-004 and OCC- 003 , if only for curiosity  Or dont, the choice is yours. 

The SEC /DTCC are preparing for a nuclear bomb and are battening down the hatches in order to isolate the damage and reduce a wider negative market impact.

My point is that this is much bigger than you realise. This is why it is so hard for people to get onboard as the whole scenario seems improbable. I get it. Call me a flat earther etx but all the evidence points to it.

I could call you out  for selling so low but i wont. Profit is profit at the end of the day. All i will say is this is the definition of an asymmetric bet. Pick up a share just for the fun of it. You have been trading for 2 years im sure you can afford it.

When it starts spiking again, the FOMO will be real.",[],0
25,gzbw8hx,2021-05-24,t1_gzbjkym,stocks,Did you read my post properly? I said i did not sell.,[],0
26,gzbwaln,2021-05-24,t1_gzbpgkf,stocks,"It’s not even my evaluation. I mentioned the average range that experts get. Sure they can be off, but they’re not going to be 2.5x off. I trust Morningstar knows how to evaluate tech companies. They don’t get some pass on being new. Their value exists regardless of how much hope you have in them. They have decades of ultra fast growth priced in and one misstep and it’s going to come crashing down.",[],0
27,gzbwe9n,2021-05-24,t1_gzbn27e,stocks,True but it trades significantly higher than its historic p/e and forward p/e. I still think it’s a well run company and continue to hold but I think it isn’t very probable to see large returns at these level. I would say the same about Msft as well,[],1
28,gzbwej0,2021-05-24,t3_nkba0b,stocks,"Sorry, your [submission](https://www.reddit.com/r/stocks/comments/nkba0b/looking_to_invest_in_cannabis_any_good_ideas/) in /r/stocks has been automatically removed due to Rule 3:  Low effort.

If you just want to post 1 liners or just want to know everyone's thoughts, then post a comment to our daily discussion thread which are generally stickied or [click here.](https://www.reddit.com/r/stocks/search?q=author%3Aautomoderator+daily+discussion&restrict_sr=on&sort=new&t=all)

If you're wondering **why a stock moved** a certain way, check out [Reuters](https://www.reuters.com/), [Motley Fool](https://www.fool.com/), and **especially** [Finviz](https://finviz.com/quote.ashx?t=spy) **which aggregates the most news for almost every stock**.

If instead you're wondering what a term means, go to Investopedia.com and search for said term there.

Either way come back here to repost with your findings, thanks!

A list of the [rules can be found here](https://www.reddit.com/r/stocks/about/rules/), and if you're new to r/stocks please see the [wiki](https://www.reddit.com/r/stocks/wiki/index) and/or [read this post.](https://www.reddit.com/r/stocks/comments/4x1419/if_youre_new_here_read_this_post_first/)

*I am a bot, and this action was performed automatically. Please [contact the moderators of this subreddit](/message/compose/?to=/r/stocks) if you have any questions or concerns.*",[],1
29,gzbwey5,2021-05-24,t1_gzbw890,stocks,"The federal reserve will not let the market crash, period.",[],0
30,gzbwgeo,2021-05-24,t3_nk1757,stocks,Better get out while ahead..,[],0
31,gzbwi42,2021-05-24,t3_nk1757,stocks,If you don't have a way to ignore the short term capital gains tax then shove it right back in or don't withdraw it to your bank for a year. Hopefully where ever your investing allows withdraws to paypal,[],0
32,gzbwitu,2021-05-24,t1_gzbklgc,stocks,"Yes, I and I worked in medical device manufacturing for over half a decade.  There's a LOT more than just the hourly wage of the workers involved in manufacturing, hopefully you'd know this. To suggest the iphone would still have massive profit margins if all components were manufactured within the USA is laughable. 

If you meant simply having all the components manufactured abroad and then assembled here you *might* have a point.",[],0
33,gzbwixh,2021-05-24,t1_gzazqq9,stocks,Do you need more? Serious question,[],1
34,gzbwk2q,2021-05-24,t1_gzafbih,stocks,"I don't think you understand, he's got *indicators* that tell him when to buy and sell.",[],0
35,gzbwk33,2021-05-24,t1_gzbw342,stocks,"Well when you log in there should be a name. Like schwab TD amiertrade, fidelity. Then you can just Google how to set up a stock screener on (fill in the blank of whatever company it is) I’m sure there instructions online for how to do that specific site. If your using like robinhood or one of the other random ones no idea if they have it I don’t use those exchanges. Good luck",[],0
36,gzbwktb,2021-05-24,t1_gzbr60v,stocks,"So if you lose more than $10k, you're just kinda fucked from a tax sense? That sucks.",[],0
37,gzbwlwc,2021-05-24,t3_nk7kd0,stocks,We are a bunch of pretentious dbags here. We do not use the term stonks...,[],1
38,gzbwmji,2021-05-24,t1_gzbeajq,stocks,"You should do more research on how to assess a company's fair value and arrive at your own conclusion on whether to buy more, hold, or sell. You have a lot invested in tech and it's an oversimplification to say a stock's price will increase simply because a company will grow in the future. I anticipate your panic is in part because you don't know the value of what you own.

If a security is trading at or below your interpreted fair value, then you won't have to be as worried about whether or not there's a market-wide correction. In the long term, you've vetted your securities as being well priced and you will see appreciable gains in due time.",[],0
39,gzbwn0n,2021-05-24,t1_gzbgs2i,stocks,"Prime is the only membership I’ve continuously renewed since 2011. $119/year for online shopping, selected movies, tv and music streaming, 2%-5% cashback rewards on various purchases, free photo storage, etc is still worth it for me.",[],0
40,gzbwnyq,2021-05-24,t1_gzbwey5,stocks,"The rules are aimed at preventing this.

You cant honestly be that naive btw. Where was the federal reserve in 2008?",[],0
41,gzbwogh,2021-05-24,t1_gyqz2vy,stocks,We have Teams and still use Zoom. Teams is shit,[],1
42,gzbwoio,2021-05-24,t1_gzbvxsn,stocks,"the reason why AMD and APPLE are ""poor buys"" in the short term, because makes no sense.

just follow the momentum. stop acting like stocks should respond to actual fundamentals.",[],0
43,gzbwph9,2021-05-24,t1_gzbwk33,stocks,Im on finviz rn on the screener what stocks are usually better value stocks or growth? Growth is when they are undervalued correct?,[],1
44,gzbwq15,2021-05-24,t1_gzb8qea,stocks,"You are talking about a rare event that happened in 2000, 2008 and partially in 2020 for one month.

If that happens honestly, I am dead anyway... My 401k will be wiped.",[],0
45,gzbwrin,2021-05-24,t3_nkbcac,stocks,"Sorry, your [submission](https://www.reddit.com/r/stocks/comments/nkbcac/looking_to_invest_in_cannabis/) in /r/stocks has been automatically removed due to Rule 3:  Low effort.

If you just want to post 1 liners or just want to know everyone's thoughts, then post a comment to our daily discussion thread which are generally stickied or [click here.](https://www.reddit.com/r/stocks/search?q=author%3Aautomoderator+daily+discussion&restrict_sr=on&sort=new&t=all)

If you're wondering **why a stock moved** a certain way, check out [Reuters](https://www.reuters.com/), [Motley Fool](https://www.fool.com/), and **especially** [Finviz](https://finviz.com/quote.ashx?t=spy) **which aggregates the most news for almost every stock**.

If instead you're wondering what a term means, go to Investopedia.com and search for said term there.

Either way come back here to repost with your findings, thanks!

A list of the [rules can be found here](https://www.reddit.com/r/stocks/about/rules/), and if you're new to r/stocks please see the [wiki](https://www.reddit.com/r/stocks/wiki/index) and/or [read this post.](https://www.reddit.com/r/stocks/comments/4x1419/if_youre_new_here_read_this_post_first/)

*I am a bot, and this action was performed automatically. Please [contact the moderators of this subreddit](/message/compose/?to=/r/stocks) if you have any questions or concerns.*",[],1
46,gzbwv9m,2021-05-24,t1_gzag7wy,stocks,"Disagree, I’m happy letting a Covered Call expire once it’s OTM. I don’t see the sense closing and opening a new position if IV drops and the stock is trading flat.",[],0
47,gzbwwm9,2021-05-24,t1_gzbu5u0,stocks,"I was minus 150 on Friday. I was minus 250 on Tuesday.

I never sold. Just held.",[],1
48,gzbwyjb,2021-05-24,t1_gzbvty9,stocks,Haha so funny. Did you read my post that I never sold??,[],1
49,gzbwzpn,2021-05-24,t1_gzbwktb,stocks,"Well the goal isn’t to lose money every year, but ya it would be way to easy to abuse the system if it was unlimited",[],0
50,gzbx17n,2021-05-24,t1_gzbwogh,stocks,"As with everything MS, it will eventually be good enough after a few tries.",[],1
51,gzbx2gd,2021-05-24,t3_njtw5g,stocks,"Bought a ton of RBLX puts, am I fucked?",[],0
52,gzbx34s,2021-05-24,t1_gzbwoio,stocks,"Depends. If you trade momentum the yea. I don't, Im terrible at timing when to hop onto the bandwagon and when to hop off. So for me fundamentals matter a lot.",[],0
53,gzbx3iy,2021-05-24,t1_gzbvufk,stocks,"Yea I guess I can agree to this.  Smart investors will mitigate their risk with a solid foundation within their portfolio (ETF's, Fortune 500 companies, etc.) so when their ""indicators"" or ""YOLO"" investments go belly-up, its not a big deal.",[],0
54,gzbx4bq,2021-05-24,t1_gzbdvzw,stocks,"True, but imagine what working with the estate and (Barbara in particular) could entail: A Bond series with each series leading up to a film, which has its own setup for the next season. Not to mention the other IP MGM owns. This is not small money",[],0
55,gzbx5yz,2021-05-24,t1_gzagbtz,stocks,Dungeons and Dragons? I do young sire... but I assume this is not what you mean...,[],0
56,gzbx78r,2021-05-24,t3_nk1757,stocks,Now learn compounding!,[],1
58,gzbxbol,2021-05-24,t1_gzbwnyq,stocks,"Um, well, they printed us out of it as you can see form 09-11.

I’m not against GME dude but you need to question yourself when you’re main point is ‘well there’s still something bigger going on’ and ‘well the SEC is gonna margin call citadel and bankrupt them and make GME 10 mil a share’ or whatever the conspiracy is.  

I could care less cause it’s bullshit.  None of that proves GameStop is going to be a viable business in the digital gaming age.  They have proven nothing, and they still don’t have an actual plan yet.  Do they?  I’d like to see.  

And yeah I still have some shares for fun but that’s all - I’m not expecting to make much more than I already did in the first squeeze - and yes, it’s riggeg, so I go with what works, and right now I don’t make much from GME.  

There’s so many other amazing stocks and companies and investments",['GME'],0
59,gzbxi2m,2021-05-24,t1_gzb4fto,stocks,I do the index.,[],0
60,gzbxinl,2021-05-24,t3_nkbgpl,stocks,"Sorry, your [submission](https://www.reddit.com/r/stocks/comments/nkbgpl/type_of_stocks/) in /r/stocks has been automatically removed due to Rule 3:  Low effort.

If you just want to post 1 liners or just want to know everyone's thoughts, then post a comment to our daily discussion thread which are generally stickied or [click here.](https://www.reddit.com/r/stocks/search?q=author%3Aautomoderator+daily+discussion&restrict_sr=on&sort=new&t=all)

If you're wondering **why a stock moved** a certain way, check out [Reuters](https://www.reuters.com/), [Motley Fool](https://www.fool.com/), and **especially** [Finviz](https://finviz.com/quote.ashx?t=spy) **which aggregates the most news for almost every stock**.

If instead you're wondering what a term means, go to Investopedia.com and search for said term there.

Either way come back here to repost with your findings, thanks!

A list of the [rules can be found here](https://www.reddit.com/r/stocks/about/rules/), and if you're new to r/stocks please see the [wiki](https://www.reddit.com/r/stocks/wiki/index) and/or [read this post.](https://www.reddit.com/r/stocks/comments/4x1419/if_youre_new_here_read_this_post_first/)

*I am a bot, and this action was performed automatically. Please [contact the moderators of this subreddit](/message/compose/?to=/r/stocks) if you have any questions or concerns.*",[],1
61,gzbxlv3,2021-05-24,t3_nkbhbx,stocks,"Sorry, your [submission](https://www.reddit.com/r/stocks/comments/nkbhbx/growth_vs_value/) in /r/stocks has been automatically removed due to Rule 3:  Low effort.

If you just want to post 1 liners or just want to know everyone's thoughts, then post a comment to our daily discussion thread which are generally stickied or [click here.](https://www.reddit.com/r/stocks/search?q=author%3Aautomoderator+daily+discussion&restrict_sr=on&sort=new&t=all)

If you're wondering **why a stock moved** a certain way, check out [Reuters](https://www.reuters.com/), [Motley Fool](https://www.fool.com/), and **especially** [Finviz](https://finviz.com/quote.ashx?t=spy) **which aggregates the most news for almost every stock**.

If instead you're wondering what a term means, go to Investopedia.com and search for said term there.

Either way come back here to repost with your findings, thanks!

A list of the [rules can be found here](https://www.reddit.com/r/stocks/about/rules/), and if you're new to r/stocks please see the [wiki](https://www.reddit.com/r/stocks/wiki/index) and/or [read this post.](https://www.reddit.com/r/stocks/comments/4x1419/if_youre_new_here_read_this_post_first/)

*I am a bot, and this action was performed automatically. Please [contact the moderators of this subreddit](/message/compose/?to=/r/stocks) if you have any questions or concerns.*",[],1
62,gzbxo6d,2021-05-24,t1_gzaqwwo,stocks,"My gut has been correct 80% of the time.

If my research had involved actually ordering Papa Johns, it would have been 100%

Honestly though, Google 'insert company name here' news is enough to give you an educated feeling",[],1
63,gzbxofp,2021-05-24,t3_nkbhsp,stocks,"Sorry, your [submission](https://www.reddit.com/r/stocks/comments/nkbhsp/help_me_plz_on_what_they_luke/) in /r/stocks has been automatically removed due to Rule 3:  Low effort.

If you just want to post 1 liners or just want to know everyone's thoughts, then post a comment to our daily discussion thread which are generally stickied or [click here.](https://www.reddit.com/r/stocks/search?q=author%3Aautomoderator+daily+discussion&restrict_sr=on&sort=new&t=all)

If you're wondering **why a stock moved** a certain way, check out [Reuters](https://www.reuters.com/), [Motley Fool](https://www.fool.com/), and **especially** [Finviz](https://finviz.com/quote.ashx?t=spy) **which aggregates the most news for almost every stock**.

If instead you're wondering what a term means, go to Investopedia.com and search for said term there.

Either way come back here to repost with your findings, thanks!

A list of the [rules can be found here](https://www.reddit.com/r/stocks/about/rules/), and if you're new to r/stocks please see the [wiki](https://www.reddit.com/r/stocks/wiki/index) and/or [read this post.](https://www.reddit.com/r/stocks/comments/4x1419/if_youre_new_here_read_this_post_first/)

*I am a bot, and this action was performed automatically. Please [contact the moderators of this subreddit](/message/compose/?to=/r/stocks) if you have any questions or concerns.*",[],1
64,gzbxr2e,2021-05-24,t1_gzbwzpn,stocks,I don't see the issue with making the carryforward unlimited if it's only $3000 max though?,[],1
65,gzbxtyr,2021-05-24,t1_gzbx34s,stocks,"well it was a joke, I'm more of a long term trader, so I focus more on fundementals.",[],0
66,gzbxv3v,2021-05-24,t3_nkbj0x,stocks,"Sorry, your [submission](https://www.reddit.com/r/stocks/comments/nkbj0x/dm_me_plz_this_subreddit_wont_let_me_post/) in /r/stocks has been automatically removed due to Rule 3:  Low effort.

If you just want to post 1 liners or just want to know everyone's thoughts, then post a comment to our daily discussion thread which are generally stickied or [click here.](https://www.reddit.com/r/stocks/search?q=author%3Aautomoderator+daily+discussion&restrict_sr=on&sort=new&t=all)

If you're wondering **why a stock moved** a certain way, check out [Reuters](https://www.reuters.com/), [Motley Fool](https://www.fool.com/), and **especially** [Finviz](https://finviz.com/quote.ashx?t=spy) **which aggregates the most news for almost every stock**.

If instead you're wondering what a term means, go to Investopedia.com and search for said term there.

Either way come back here to repost with your findings, thanks!

A list of the [rules can be found here](https://www.reddit.com/r/stocks/about/rules/), and if you're new to r/stocks please see the [wiki](https://www.reddit.com/r/stocks/wiki/index) and/or [read this post.](https://www.reddit.com/r/stocks/comments/4x1419/if_youre_new_here_read_this_post_first/)

*I am a bot, and this action was performed automatically. Please [contact the moderators of this subreddit](/message/compose/?to=/r/stocks) if you have any questions or concerns.*",[],1
67,gzbxvup,2021-05-24,t1_gzbxbol,stocks,">Um, well, they printed us out of it

Nailed it.

Thats cool  i listed several things to go and look up but if you just wanna call it bullshit go ahead. A closed mind is a disadvantage tho. That goes for everything.


>And yeah I still have some shares for fun

Well done. You need to hold on to those. You dont have to believe but when it hits 1k youre going to be tempted to sell. DONT.",[],1
68,gzbxyie,2021-05-24,t1_gz99hv4,stocks,"I can nitpick words too if you want. Wont stoop to your level. Either use the entire thought, (aka paragraph) or shut it down.",[],0
69,gzbxyn7,2021-05-24,t1_gzbv5ec,stocks,"not sure which broker you use, but you can usually find the individual costs under ""tax lots"" or something similar.  the averaged cost basis is for your convenience.",[],0
70,gzby01b,2021-05-24,t3_nkbjuo,stocks,"Welcome to r/stocks!

For beginner advice, brokerage info, book recommendations, even advanced topics and more, please read our [Wiki here.](https://www.reddit.com/r/stocks/wiki/index)

If you're wondering **why a stock moved** a certain way, check out [Finviz](https://finviz.com/quote.ashx?t=spy) which aggregates the most news for almost every stock, but also see [Reuters](https://www.reuters.com/), and even [Yahoo Finance](https://finance.yahoo.com/).

Please direct all simple questions towards the stickied Daily Discussion and Quarterly Rate My Portfolio threads (sort by Hot, they're at the top).

Also include *some* [due diligence](https://www.investopedia.com/terms/d/duediligence.asp) to this post or it may be removed if it's low effort.

*I am a bot, and this action was performed automatically. Please [contact the moderators of this subreddit](/message/compose/?to=/r/stocks) if you have any questions or concerns.*",[],1
71,gzby11u,2021-05-24,t1_gzbxr2e,stocks,Because then you can choose to close a larger loss and no gains in one year just to carry it forever and then take gains every other year.,[],1
74,gzby7l0,2021-05-24,t1_gzbxvup,stocks,"I’d probably sell at 1k that’s definitely the ceiling lol.

Check out silver, it’s a much more fun conspiracy.  The idea is that there’s a 250:1 ‘paper silver’ to ‘physical silver’ ratio, aka short interest.  Big players are buying up all the silver to bankrupt the COMEX and LBMA and fuck up JP Morgan.  All said and done, when their short positions have to be covered, they will need our physical silver to cover their paper derivatives.  It’s like GME but for real cause physical silver is actually something the big banks will need from us.

r/wallstreetsilver",['GME'],1
75,gzby9mc,2021-05-24,t1_gzbvkzi,stocks,"Yes in general. But the space is much wider and bigger than a hooters concept, as well as having a live DJ onsite when it’s then turned into a livelier bar and club style venue. That’s what attracts the crowd and improves the alcohol sales %.",[],0
