,comment_id,created,parent_id,subreddit,text,Organizations,Sentiment
0,gyuevgq,2021-05-20,t1_gysj4e6,stocks,"No, but generally speaking, this is a very overvalued market",[],0
1,gyuezlq,2021-05-20,t3_ngt4js,stocks,"welp since no one said it. Make your own sub, and document with great detail down to  what time you take your shits and for how long. 

we don't like those weekly spam updates.",[],1
2,gyuf095,2021-05-20,t3_nh5i9p,stocks,I would check Redfin although it ran a lot already. As far as I can tell they are one of the few that have a full service.,[],0
3,gyuf108,2021-05-20,t1_gyrilez,stocks,"Sadly, its probably pretty accurate about how corrupt wall street really is. What happens in this movie (not the silly stuff but the actual insider trading) is probably a lot more frequent than anyone wants to admit and I would guess that 95% of the time, it isnt caught.",[],0
4,gyuf1ec,2021-05-20,t3_nh2trh,stocks,Pharma is extremely volatile and unpredictable even more than most stocks.,[],1
5,gyuf25r,2021-05-20,t3_ngcedr,stocks,"Idk but seeing my Amazon stock be totally unaffected by earnings, and then seeing Disney skyrocket days after they had to close down several companies and lay off everyone under their conglomerate... I put a lot of stuff in VTI and I’m just gonna leave it come what may",[],0
6,gyuf4bq,2021-05-20,t1_gyudshq,stocks,This. As a brokerage they actively prevented their customers/marks from buying a stonk but allowed them to continue selling it.  Why would anyone trust a company that did that?,[],0
7,gyuf5oi,2021-05-20,t1_gyudjyc,stocks,"The problem is the order triggers as the stop loss is reached but does not fill and before it can  MM clear all market orders and in turn clear your order completely. The typical brokerage account without an advisor/manager doesn’t have a way of resubmitting the order automatically. 

So your order triggers-doesn’t get filled-gets erased-brokerage thinks it’s done it’s job completely so no resubmit.",[],1
8,gyuf5p8,2021-05-20,t3_nh5lxl,stocks,"I may not be completely understanding your question but my guess is that the value of the put has gone up, which is why you're showing a profit.

For example, you buy 2 puts of XYZ @ 165 strike for $4 while it's trading at $167. The stock drops to $164 before any time decay really catches up, in this case you should be able to sell your puts at a profit.

The breakeven for options is indeed strike plus/minus premium but that includes time decay. If you let these puts expire in the money then you will sell the shares at $161. If the stock dips below $161, you're selling the stock at price higher than the market so you're coming out on top. If the stock closes at $162, then you're still selling at $161. If the stock closes at $166, then you've lost all $4 as the put will expire worthless.",[],0
9,gyuf6ev,2021-05-20,t3_nh5ay4,stocks,"Any chance you can re-write this such that we can follow what you’re saying? As it is, this comes off as semi-literate conspiracy nonsense.",[],0
10,gyuf6f7,2021-05-20,t3_nh3l8m,stocks,Why do they have so much new debt?,[],1
11,gyuf7ok,2021-05-20,t1_gyuetls,stocks,No surprise there,[],1
12,gyuf93i,2021-05-20,t1_gyuetls,stocks,"It’s up 27%, how is that falling lol.",[],0
13,gyufbmj,2021-05-20,t1_gyue57p,stocks,Here comes the cry baby.,[],0
14,gyufcj3,2021-05-20,t3_nh44e8,stocks,It can happen in CFDs where brokers make the market,[],0
15,gyufdbf,2021-05-20,t3_nh5lxl,stocks,If you have the right to sell a share at $165 but you paid $4 for that right then your break even is ($165 - $4 = $161). Basically the stock needs to hit 161 or lower at expiration or else you lost money on that put due to the initial cost.,[],0
16,gyufefu,2021-05-20,t3_ngt4js,stocks,"hope you can but man that seems impossible. 100x gain, that takes decades to achieve?",[],0
17,gyufehe,2021-05-20,t1_gytxkxk,stocks,Lmao,[],0
18,gyufetb,2021-05-20,t1_gyuf5p8,stocks,Thanks Kam.. i think i have it.. i tend to stress and just would rather ask questions before it's too late:),[],0
19,gyufez3,2021-05-20,t1_gyu7v8j,stocks,"That PEG is 5 years, but yea, PEG is no magic bullet. I’m just trying to illustrate why a rational market could sell off on an earnings beat.",[],1
20,gyufg9l,2021-05-20,t1_gyuds4j,stocks,"when you only spend $100?

Yeah that's risk free.",[],0
21,gyufgto,2021-05-20,t1_gytxrjd,stocks,"FWIW, regulatory capture is less of a problem at the SEC than at many/most other federal agencies... which doesn't mean it's not also a problem there.",[],0
22,gyufiom,2021-05-20,t1_gyuems5,stocks,"1. Diversification with Gunbroker.com purchase.
2. Overseas government contracts
3. New manufacturing location specifically set to fulfill already orders already in place.",[],0
23,gyufjdi,2021-05-20,t3_ngvmrw,stocks,"Let me introduce to a great company , it's called amazon 👩‍🦲",[],1
24,gyufm9n,2021-05-20,t1_gyuf93i,stocks,"What, trading212 says down 14%",[],0
25,gyufmbb,2021-05-20,t1_gyu70ub,stocks,"
https://www.ft.com/content/a801dc8a-3d3a-4352-953b-092bde158393",[],0
26,gyufnrg,2021-05-20,t3_nh5lxl,stocks,"What your broker app is showing is with respect to market value of the your puts if you sold it back in the market now.

Your 165 strike, $4 in premium, hence breakeven at $161 is a calculation only at time of expiry.

Today the puts have some extrinsic value as well, hence because of that you can make profit even above $161, if you sell back those puts in the market.",[],1
27,gyufnrp,2021-05-20,t1_gyudwh8,stocks,My biggest position too followed by apple. lol,[],0
29,gyufpv8,2021-05-20,t1_gyq8a9o,stocks,Are these only available to the hedge funds and the super high end trading companies?  Or do normal people have computers doing trades for them?  I don't understand how that would work.,[],0
30,gyufqhs,2021-05-20,t1_gyufdbf,stocks,"yeah.. that's the thing though.. at strike my broker says i can still sell it and make back basically what i paid for the premium.. it might just be another fun think or swim ""Feature"" :)",[],0
31,gyufqzl,2021-05-20,t1_gyuf4bq,stocks,Because their clearing house required them to have more liquidity to continue buying those stocks. It's happened with several different brokers but all you the hills have eyes rejects keep bringing this shit up.,[],0
32,gyufskn,2021-05-20,t3_ngi6ua,stocks,$APRE .  Huge potential but risky,[],1
33,gyufuz3,2021-05-20,t1_gytxrjd,stocks,"Respectfully disagree. You may be right about a few of the political appointees at the top but most people don't choose to work for government pay just to help their ""getting paid a fuck ton more"" buddies on Wall St stay out of trouble. People to into high level law enforcement because they like catching bad guys.",[],0
34,gyufvdb,2021-05-20,t3_nh5lxl,stocks,"I'm far from knowledgeable when it comes to options, I am also new to options and have been researching them, but as I understand it, for some reason that I cant find an answer to executing an option will only ever at best earn your money back, the idea is to sell it off for more then the premium you paid before the expiry date. Absolutely not financial advice",[],1
35,gyufwhh,2021-05-20,t1_gyu2r8v,stocks,They're making progress towards building their factory.  Working with DOE I think,[],0
36,gyufwnf,2021-05-20,t3_ngt4js,stocks,"sure as long as you're willing to throw away $100 :)

But it's good to have fun once in a while",[],1
37,gyufx3d,2021-05-20,t1_gyudbjh,stocks,No not really. I've noticed that the coin that shall not be named will follow stocks but not vice versa. We didn't see a huge drop in stocks when coin dropped in '17 nor just a few days ago.,[],0
38,gyufz0s,2021-05-20,t1_gyu2e12,stocks,Main winners today ?,[],1
39,gyug120,2021-05-20,t3_nh3l8m,stocks,I actually work here and they have an employee stock program that is pretty nice. Definitely a long term investment that's reliable.,[],1
40,gyug3a7,2021-05-20,t3_ngcedr,stocks,"Well for starters the entire market is rigged, but you should know that seeing as you used to be a mod for r/gme and witnessed many mods (probably including yourself) become bought out.",[],1
41,gyug4xe,2021-05-20,t1_gyufuz3,stocks,But they don’t set policy,[],1
42,gyug6yf,2021-05-20,t1_gyud3pf,stocks,"Yeah
 That is if the country doesn't default",[],0
43,gyug891,2021-05-20,t1_gyqkytj,stocks,I love this response.,[],1
44,gyug8uw,2021-05-20,t1_gyue4t3,stocks,"I'm just saying, investors and traders are irrational. That's a truism that you are ignoring. For someone so confident, you too easily forget that not everyone is as smart(?) as you are. Unlike investing geniuses like yourself, when Buffett dies, there could be a knee-jerk reaction from less savvy investors that freakout and bail. There could even be professionals that try to induce and capitalize off such irrational fear.",[],0
45,gyugavf,2021-05-20,t1_gyue7ha,stocks,"I see you are very woke, may I borrow your tinfoil hat I left mine at home",[],0
46,gyugc2z,2021-05-20,t3_nh5i9p,stocks,"I was balls deep in RKT since IPO, sold 75% at 40$, rest rode until 20-low and sold at a loss. Why? guidance projects 20% decrease in revenue and loans, the share buyback has time period validity for a year still. I think RKT will be OK again but not until EOY or at least for next 2 earnings reports. Better off with Zillow who seem more consistent (projected revenue and EPS wise).",[],0
47,gyugcmd,2021-05-20,t1_gytdn2o,stocks,"Stop loss doesn't exactly work like how you describe.

If the security price drops below your stop loss, say $95, you will sell your position at ANY price. Most of the time, it is around $95.

But in a flash crash situation, if there is no buyer and you are unlucky, theoretically nothing is stopping your stop loss to be executed at 90,80, or even $20.",[],1
48,gyugcw8,2021-05-20,t1_gyufnrg,stocks,thank you :) think i got it now.,[],1
49,gyugeuj,2021-05-20,t3_laocbm,stocks,It's been doing crazy good,[],1
50,gyugffy,2021-05-20,t1_gytug9s,stocks,Chance to average down ..,[],0
51,gyugftn,2021-05-20,t1_gyu67tr,stocks,You must be new to stock trading arent ya?,[],1
52,gyugg20,2021-05-20,t3_ngt4js,stocks,I taught this was a pisstake until you seriously straight out asked what to buy,[],0
53,gyugh6q,2021-05-20,t1_gyubmcw,stocks,"If you are going long, there is a saying that goes time in the market is better than timing the market. Timing the market is almost impossible and if you are lookig to hold onto a stock for years, a price point of a few dollars will not make a difference.",[],1
54,gyughsw,2021-05-20,t1_gyufg9l,stocks,"Except risk management is relative to your account size so if he blows 100% of his account in one go, whether that's 100 bucks or 100000. It's high risk.",[],0
55,gyugi0g,2021-05-20,t1_gyuems5,stocks,"1. Diversification with Gunbroker.com purchase.
2. Overseas contracts for orders.
3. Manufacturing catching up to historical market demand.

Not sure why some Redditors get so upset with sharing news. Fred Wagenhals, AMMO's Chairman & CEO, is out there saying this. I guess I'm just a believer.",[],0
56,gyugilp,2021-05-20,t1_gytddd1,stocks,"That sounds awesome, I wonder if its been posted online anywhere.",[],1
57,gyugkur,2021-05-20,t3_ngcedr,stocks,"because Robinhood (and possibly other brokers who PFOF) are using a Just in time delivery of stocks.  Meaning they don't actually buy your stocks when you buy them.  They just make a note of what stock you wanted and then pass that order on to CITADEL through PFOF.  Citadel takes the short position opposite your purchases.  This short position (created as part of their market making activities) drives the price down.  The more retail customers buying through Robinhood (for sure seems to be doing this, dunno about other brokers) the more shorting pressure as the market maker takes the opposite short position to stay net neutral.   Between this and the fact that robinhood seems to not actualy buy your stock until you sell, sure seems like they are setup to automatically short whatever retail thinks is popular and has a net downward force on stocks.  They (Citadel) then uses Strategic Failure to delivers and doesn't even actually own the stock filling shares through borrowing from ETFs and other methods.  They may even be passing these shorts off as collateral on other securities.  

https://www.reddit.com/r/Superstonk/comments/ngun6e/proof_that_rh_scrambled_to_find_shares_during_my/

This post shows that during transfer robinhood is buying shares so they can actually transfer accounts and shares to other companies.  These are not the values the users bought at, which goes to show robinhood isn't actually buying shares when you buy through them.  (wonder why they have blocked coins and stocks at times?)  its cause they were going up and not down like their business model requires.  They got margin called and had that forgiven because they blocked buys...  

The markets are currently completely fraudulent currently.",[],0
58,gyugmt8,2021-05-20,t3_ngx4qm,stocks,I’m holding. I’m praying for a successful launch!!,[],1
59,gyugng6,2021-05-20,t1_gyuees7,stocks,"Mine is sitting at around $20 trailing lol. It’s still a leveraged fund, and of course as soon as I say it’s not that bumpy it decided to go and prove me wrong.",[],1
60,gyugnjj,2021-05-20,t3_ngcedr,stocks,That’s like literally not even close to what’s happening.,[],0
61,gyugo29,2021-05-20,t1_gyudteg,stocks,"What? Nothing that you said contradicts my statement. Just like any limit order, there is no guarantee that it will be executed but it is impossible for a limit order to be filled at a lower price for a sell or higher for a buy. That's what a limit order is.",[],0
62,gyugqyh,2021-05-20,t3_ngvmrw,stocks,"What stocks should I be looking at daily to gain an overall perspective of the market and momentum in where it relates to the overall economy?

Hey all, thanks for stopping by. I've been involved in the market for approximately 2 1/2 years now, mostly trading on momentum and hype, but now im looking at gaining my overall knowledge on how to look at the overall perspective of the economy and where it relates to specific sectors.   
I've included below some screenshots of how my visuals and charting is set up. I'd also like to add specific charting features to look at how the stocks are moving with the momentum in the trading day.   
Tech:   
[https://imgur.com/AXXP5cy](https://imgur.com/AXXP5cy)

  
Housing Market:   
[https://imgur.com/w2SHtkj](https://imgur.com/w2SHtkj)

  
Macroeconomics:  
[https://imgur.com/fJSVPYG](https://imgur.com/fJSVPYG)

  
Banking/Financials:  
[https://imgur.com/U7kwFHl](https://imgur.com/U7kwFHl)",[],1
63,gyugst0,2021-05-20,t1_gyubyve,stocks,"I believe you will be able to sell, just not buy.",[],0
64,gyugu19,2021-05-20,t3_ngy0m2,stocks,"One thing no one else has mentioned that I’ll point out is that you short sell in lots of 100 (like options). So you can’t just short sell 5 or 10 shares the minimum is 100.

As for my opinion: 

Due to borrow fees and interest rates on shares borrowed short selling is not for the majority of retail. It can pay off when you’re able to take large positions and have cash to burn if the trade turns a against you. You should be able to afford to buy calls you expect to expire worthless as insurance to short selling. 

If you’re trading with less than say 8 figures stick to puts if you’re bearish.",[],0
65,gyugwsq,2021-05-20,t3_nh5i9p,stocks,UWMC,[],0
66,gyuh0em,2021-05-20,t1_gytqmpa,stocks,I don't get it. HIMX + TSEM + RNECF all down,[],0
67,gyuh192,2021-05-20,t1_gyueio6,stocks,"He has been saying it consistently for quite a while now.

[https://www.forbes.com/sites/robertberger/2020/11/24/how-to-invest-money-based-on-advice-from-warren-buffett/?sh=90e25a5526c2](https://www.forbes.com/sites/robertberger/2020/11/24/how-to-invest-money-based-on-advice-from-warren-buffett/?sh=90e25a5526c2)

In his 2013 letter to Berkshire Hathaway shareholders, Mr. Buffett described how he has advised trustees to manage the money he will leave to his wife: “Put 10% of the cash in short-term government bonds and 90% in a very low-cost S&P 500 index fund.""

[https://www.cnbc.com/2020/05/04/warren-buffett-berkshire-hathaway-annual-shareholder-meeting-highlights.html](https://www.cnbc.com/2020/05/04/warren-buffett-berkshire-hathaway-annual-shareholder-meeting-highlights.html)

Here is another quote from 2020 Berkshire shareholder meeting: “In my view, for most people, the best thing is to do is owning the S&P 500 index fund,” Buffett said. “There are huge amounts of money people pay for advice they really don’t need.”",[],0
68,gyuh1de,2021-05-20,t1_gyuaime,stocks,This has nothing to do with AMC and GME.  This law was enacted long before they blew up.,"['GME', 'AMC']",0
69,gyuh1s8,2021-05-20,t1_gytkrkf,stocks,Pink No Information stocks.,[],0
70,gyuh3an,2021-05-20,t3_nh02hb,stocks,"Many good reasons listed above. In addition here is another possibility (maybe not for this company, but big picture reason): too much cash on hand creates a potential takeover target.",[],0
71,gyuh61w,2021-05-20,t1_gyuf5oi,stocks,"Hmmm. I don't have the background knowledge to refute what you're claiming but it feels wrong. My broker knows that my order wasn't executed. I guess that it would still show up in my ""completed"" orders list as cancelled or something. Not sure. Never experienced it so I'll just talk your word on it.",[],0
72,gyuh6p2,2021-05-20,t1_gyufm9n,stocks,"im confused by that, I guess trading212 got the ipo late?",[],1
73,gyuh7cc,2021-05-20,t1_gyug6yf,stocks,You'd have bigger things to worry about than money in that situation.,[],0
74,gyuh91t,2021-05-20,t1_gyuagit,stocks,It's down 1.5%. that's pretty tame nowdays.,[],1
75,gyuh9lp,2021-05-20,t3_ngi6ua,stocks,Inovio or INO,[],0
76,gyuha5a,2021-05-20,t1_gyud3pf,stocks,"But also let’s not pretend like any government agency is looking out for your best interests above their own. AIG didn’t exactly start giving handouts to regular joes in 2008, no sense risking that again, get off RH",[],0
77,gyuhcvl,2021-05-20,t1_gyu8mv9,stocks,"I mean, we have 13 years of hard data telling us that deficit spending and quantitative easing are pretty good at supporting economic expansion.",[],0
78,gyuhdwa,2021-05-20,t3_ngyrsj,stocks,Stop losses are for pussies.,[],0
79,gyuhet3,2021-05-20,t1_gyugqyh,stocks,"If there were to hypothetically be another march 2020 type crash, would TQQQ leaps be the best way to maximize returns? I vote yes! What say you?",[],0
80,gyuhezq,2021-05-20,t3_nfnyup,stocks,"Wow, $13B valuation? Like the brand and product, but not this investment",[],1
82,gyuhhtv,2021-05-20,t1_gypyt5f,stocks,"Might need to make a correction here, my bad:

&#x200B;

U like apples? How u like them apples: $AAPL (+2%)",[],0
83,gyuhhy9,2021-05-20,t1_gyu7b0o,stocks,"If you make it back in before it recovers, the idea of a flash crash is it’s really quick. You’ll probably get back and see you sold your shares at 90 in your example, and they’re trading at 100 with no idea why. Long term holders don’t tend to be watching constantly.",[],0
84,gyuhj8w,2021-05-20,t1_gyuagys,stocks,It's delicious and better for the environment,[],1
85,gyuhk6d,2021-05-20,t3_ngvmrw,stocks,Whats is the deal with DISCA?,[],0
86,gyuhk9l,2021-05-20,t1_gyuf6ev,stocks,"I'm on my phone in bed so too inconvenient to post urls lol. But many ppl on superstonk have posted screenshots of their 'cost -basis' (I'm very new at investing dunno what that is) and it appears robinhood is buying them fractional shares at weird prices or something. 

Then something something tax fraud, tax man, I dunno I'm still new lol.",[],0
87,gyuhlfq,2021-05-20,t1_gyue4r9,stocks,"I'm not vegan, I never buy milk, but I do buy oat milk. I don't use milk a lot and regular milk goes bad way before I use it all, oat milk doesn't have that problem. For baking i use heavy cream which lasts way longer than milk.

Still not touching oatly though, that shit is too trendy to know what it's future looks like.",[],0
88,gyuhlyb,2021-05-20,t1_gyu76n1,stocks,">	LOL petty af

>	LMAO remember when you said that shit?",[],0
89,gyuhmqb,2021-05-20,t1_gyuddwt,stocks,"Sure, man 👌",[],0
90,gyuhnic,2021-05-20,t1_gyugi0g,stocks,"I agree, and I could go on with more. Just curious as to the bear/pump and dump case for it.

I do believe it's running hot right now. If you compare it to industry peers, it's trading at multiples a little higher than average. $5.50 to $6 would give it a market cap more in line with average. With that said, it's growth rate is significantly stronger than peers, and shows little sign of slowing down. The contracts are there, the production ability is ramping up. They're not over leveraged in debt, and they have a healthy 50% profit margin on much of their business. Gunbroker alone more than doubled their revenue stream.

I'm factoring in continued growth, but I'm currently looking at a price target somewhere between $12-15, and buying sub $7. Added another couple hundred yesterday when it touched $6 flat. Of course, if they keep growing as aggressively as they have, I'll raise that target as they get closer.",[],0
91,gyuhnp5,2021-05-20,t1_gyugst0,stocks,"Brokers won't be able to submit quotes for these stocks out to the exchange, so you won't be able to sell either. 

Transferring to another broker outside of the US is an option.

Waiting on these companies to get current on their filings is another option.",[],1
92,gyuhosj,2021-05-20,t1_gyughsw,stocks,lol it’s $100 my man,[],0
93,gyuhp37,2021-05-20,t1_gyug6yf,stocks,I'd be worried more about survival than my account balance if that was the case,[],0
95,gyuhro1,2021-05-20,t1_gyuh61w,stocks,I’m with you on the part where I don’t understand why they can’t resubmit I’m not sure on that at all and your broker would know better. I’m just sure on why they get canceled and not filled.,[],0
96,gyuhrwa,2021-05-20,t1_gyud03c,stocks,"Why is this undervalued?  PEG of 1.5, P/E of  10, twice as much debt as cash, and negative cash flow.",[],0
97,gyuhrzi,2021-05-20,t3_ngvmrw,stocks,"If there were to hypothetically be another march 2020 type crash, would TQQQ leaps be the best way to maximize returns? I vote yes! What say you?",[],0
98,gyuhu0l,2021-05-20,t3_ngcedr,stocks,"Your biggest mistake is thinking the stock market is rational.  When has it ever been?  The stock market rarely reflects the intrinisic value of companies since fundamentals always majorly lags sentiment.  Also, you have to take into account that Wall Street does whatever is most profitable for them, there is no honesty in this market.  If they have the capital and capacity to pump or dump a certain stock, they will and they don't care that it invokes a ""the market is not fair"" response in your mind.",[],0
99,gyuhuqd,2021-05-20,t1_gyu5mtt,stocks,"literally every website about investing says this, this is not new nor deep wisdom",[],0
100,gyuhv45,2021-05-20,t1_gyuh91t,stocks,"It was more about how drastic and quick the drop was, but it coincided with the marketwide downturn.",[],0
101,gyuhvlr,2021-05-20,t1_gyugftn,stocks,You must me new to stock pumping,[],1
102,gyuhw7o,2021-05-20,t1_gyu6mxn,stocks,"Today, they like my cash more than most days :-(  Greedy Bastards..... but that's ok, Tuesday I was the greedy bastard.",[],0
103,gyuhzho,2021-05-20,t3_nh6cna,stocks,https://www.investopedia.com/terms/b/bid-askspread.asp,[],0
104,gyui3t4,2021-05-20,t1_gytne2y,stocks,"Risk is far greater with options. If you think there will be a significant move down, you’re better off shorting the stock. The interest you pay daily is generally far less than the time decay you pay you lose on the option daily.",[],1
105,gyui52a,2021-05-20,t1_gyuhp37,stocks,Fair enough.,[],0
106,gyui5p4,2021-05-20,t1_gytxkxk,stocks,Don't forget to set some apart for taxes,[],0
107,gyui7ur,2021-05-20,t1_gyuh6p2,stocks,"Nah. It ipo’d at $17 a share, but opened like 30% higher. Then it dropped",[],0
108,gyui9k3,2021-05-20,t1_gyuhosj,stocks,"lol no problemo my dudeski.

Options are still risky as fuck though. the amount is irrelevant",[],1
109,gyuiaj1,2021-05-20,t1_gyufqzl,stocks,No. In the last gamestop hearing the DTCC confirmed that Robinhood got it lifted and it was their own choice.,[],0
110,gyuib34,2021-05-20,t1_gyui9k3,stocks,"Not as irrelevant as ur mom
***
^I ^am ^a ^bot. ^Downvote ^to ^remove. ^[PM](https://www.reddit.com/message/compose/?to=YoMommaJokeBot) ^me ^if ^there's ^anything ^for ^me ^to ^know!",[],0
111,gyuictj,2021-05-20,t3_ngcedr,stocks,"Short answer “it’s the algos”, the long answer will require a tin foil hat.",[],0
112,gyuicto,2021-05-20,t3_ngcedr,stocks,"Short answer “it’s the algos”, the long answer will require a tin foil hat.",[],0
113,gyuida5,2021-05-20,t1_gyub6az,stocks,"Whoa, this is a neat website. Thanks.",[],0
114,gyuig7k,2021-05-20,t3_l8rhr3,stocks,Can Saxo be added to the list (the Danish broker). It's quite a big broker in Europe and I know some apes are transferring to it from IBKR (like myself) after the fkcry that IBKR pulled.,[],0
115,gyuigbb,2021-05-20,t1_gyufez3,stocks,It’s all about expectations and not just sellside estimates. Buyside have own estimates. If not hitting then stock can sell off. Stock has had a hell of a run so expectations were clearly high and buyside is cognizant of getting out/profit taking if there are signs of deceleration. If the company beats but doesn’t raise it can be cause for concern,[],0
116,gyuigl2,2021-05-20,t3_ngvmrw,stocks,$FORD up 13% while $F is up 2.6%. Makes me wonder if Forward Industries released an EV Pickup too...,['FORD'],0
117,gyuihu6,2021-05-20,t1_gyrktpz,stocks,"Maybe, but I feel like most retail traders would put at least some of that money in total market safer picks",[],0
118,gyuiie1,2021-05-20,t3_nh6bxq,stocks,"The f150 looks an amazing truck, if they can scale production up they will flourish.",[],1
