,comment_id,created,parent_id,subreddit,text,Organizations,Sentiment
716,gyv1zjj,2021-05-20,t1_gyuv8u2,stocks,Several countries have enacted legislation to ban the sale of gas powered cars by 2030. Does that also apply to large diesel trucks? I’m not sure.,[],0
717,gyv1zko,2021-05-20,t1_gyteeuh,stocks,"I've read about limits several times and I've always come away confused. Your explanation here finally made it click with me, so thank you for that.",[],0
718,gyv24vn,2021-05-20,t1_gyv0ln3,stocks,N,[],1
719,gyv250z,2021-05-20,t1_gyv1vd1,stocks,You and me both. I've never understood it.,[],0
722,gyv295n,2021-05-20,t3_lv5dlb,stocks,Cidm..   last 2 minutesto get in,[],0
723,gyv2aej,2021-05-20,t1_gyuvzxk,stocks,Stocks could go up down or sideways tomorrow. If I had a crystal ball I wouldn’t be here.,[],0
724,gyv2c79,2021-05-20,t1_gyurhr5,stocks,I know this is off topic but your username bothers me because her last name doesn't actually have an S in it,[],1
725,gyv2ci0,2021-05-20,t1_gytshd6,stocks,I’m buying companies who beat expectations every quarter and have positive ROI and earning yield above 5%. I’m just wondering sometimes why they are down 10% on no news. I’m obviously buying more when it happens. Just doesn’t add up anybody would want to sell something that makes 3 times the yield of bonds 🤫,[],1
726,gyv2fz4,2021-05-20,t3_ngvmrw,stocks,What does Airbnb have to do to get some love in this market?,[],1
727,gyv2hje,2021-05-20,t1_gyuxs1c,stocks,I ended up selling my NTDY for exactly how much I paid for it due to it acting like that. I had it for a couple months and it doesn’t have a great dividend to justify keeping it in my portfolio. Hasbro is similar.,[],1
728,gyv2ls4,2021-05-20,t1_gyuzkfz,stocks,"VW makes literally everything that moves on a road from enormous lorries to tiny cars. I'd think they have the scale to expand market share where maybe some others can't keep up, and can even subsidise their cheaper models to make up with it in luxury and commercial segments. So they're definitely not like Ford.",[],0
729,gyv2lyp,2021-05-20,t1_gyskd6e,stocks,Personally I like what it gives me exposure to for the purposes of diversification ([https://www.ssga.com/us/en/institutional/etfs/funds/spdr-portfolio-sp-500-high-dividend-etf-spyd](https://www.ssga.com/us/en/institutional/etfs/funds/spdr-portfolio-sp-500-high-dividend-etf-spyd)) and the dividend yield on it makes it really easy to let it continue re-investing in itself over time.,[],1
730,gyv2mm4,2021-05-20,t1_gyv1db5,stocks,"yeah I'm a dumbass, checking my order history shows that one of my stops was market, with the rest of them being limit. I just chalked it up to the ridiculous scenario.",[],0
731,gyv2n0y,2021-05-20,t1_gyugo29,stocks,"yeah I'm a dumbass, checking my order history shows that one of my stops was market, with the rest of them being limit. I just chalked it up to the ridiculous scenario.",[],0
732,gyv2nuh,2021-05-20,t1_gyuv3jt,stocks,"yeah I'm a dumbass, checking my order history shows that one of my stops was market, with the rest of them being limit. I just chalked it up to the ridiculous scenario.",[],0
733,gyv2raz,2021-05-20,t1_gyuvzxk,stocks,🔮,[],0
734,gyv2rsz,2021-05-20,t1_gyv24vn,stocks,I,[],0
735,gyv2utf,2021-05-20,t1_gyuetls,stocks,It will be volatile for awhile since it’s new.,[],1
736,gyv2v9x,2021-05-20,t1_gyu6wuy,stocks,"Like half of LDOS is former LMT

> Leidos merged with Lockheed Martin's IT sector in August 2016 for Information Systems & Global Solutions business to create the defense industry’s largest IT services provider.",[],1
737,gyv2vhu,2021-05-20,t3_nh8q13,stocks,"I keep it in portfolio to remind me what a dumbass bagholder looks like who got FOMO at $28.50.

If you see it on Reddit its already too late!",[],1
738,gyv2wr9,2021-05-20,t3_nh8q13,stocks,If you have nothing else then hold it,[],1
739,gyv2y2o,2021-05-20,t3_ngvmrw,stocks,when was the last time we got back to back good days?,[],1
740,gyv2zby,2021-05-20,t1_gyv1vsb,stocks,Deez nutz gotem heh:),[],1
741,gyv2zzb,2021-05-20,t1_gyuwjcp,stocks,"The period from June 2009-February 2020 represented the longest continuous economic expansion in the history of capitalism.  

Pretty pretty good.",[],1
742,gyv30ge,2021-05-20,t1_gyuyr61,stocks,"Historically, yes small-caps as a whole do outperform large-caps as a whole. This is called the small-cap risk premium. Some studies recently have found that it's not as large as it was once thought to be but it's still there, if you remove small-cap growth and only focus on small-cap value then the premium becomes pretty big.",[],1
743,gyv31v7,2021-05-20,t1_gyuzkfz,stocks,It's a buy. Already bashing Tesla in Europe. Will then take over the world.,['TSLA'],0
744,gyv35li,2021-05-20,t1_gyuvvv9,stocks,I am not buying ford but I think it has potential because the government is planning to move all their vehicles to EV and I feel the government and a lot of Americans will prefer FORD over Tesla.,"['TSLA', 'FORD']",0
745,gyv373e,2021-05-20,t3_nh6bxq,stocks,How has Ford been a company for a century and not have a dividend?,[],0
746,gyv380n,2021-05-20,t1_gyuwk98,stocks,And this is bad news?!?,[],0
747,gyv3anx,2021-05-20,t1_gyv2y2o,stocks,"For the broader market...

Last week.

In growth tech?

I don't know.

But based off what I've been hearing, growth tech hasn't been having a bad week. The story really should shift now...even though it's just 30 stocks, the index that's the best lead for all cyclicals (at least IMO) did not hold two ramps today.",[],0
748,gyv3b8p,2021-05-20,t1_gyt7fe8,stocks,Fuck off... tell you what vs adding lame ass comments tell me where how and why I’m wrong then I’ll be the first one to agree and respect you as a person.  In the mean time keep buying your gme and post rocket ships.,[],0
749,gyv3bjk,2021-05-20,t1_gyux1pl,stocks,"I think that the fundamental value of the company and performance of the stock won't really change except some volatility during the introduction of a new product, especially one that has been publicly test driven by POTUS. I think ford is actually a reasonably solid company, but the stocks just don't perform well. It might make a few % gain in the short term.

Also as part of a larger transition to electric cars in the US, being the first company to offer a consumer grade truck that isn't crazy expensive will attract some customers, it's just a bit of a niche market- those that want a pickup but are okay with short range and a relatively new technology.",[],1
750,gyv3c8i,2021-05-20,t1_gyv3b8p,stocks,"Lame ass-comments

[xkcd: Hyphen](https://xkcd.com/37/)

---

^^Beep ^^boop, ^^I'm ^^a ^^bot. ^^- ^^[FAQ](https://pastebin.com/raw/vyWra3ns)",[],0
751,gyv3inx,2021-05-20,t3_ngvmrw,stocks,Wonder if we’ll get a mega Green Day tomorrow to complete the weekly rerun.,[],0
752,gyv3j5m,2021-05-20,t1_gqy3klz,stocks,"I heard from a friend, jony that it took him less then 1 day to get his money, he is still shocked.
I guess it is not always like this but even 1 case sounds nice",[],0
753,gyv3kp4,2021-05-20,t1_gyv1ysz,stocks,The F-150. If you read my post you’d know. I work in construction,[],0
754,gyv3kyt,2021-05-20,t3_ngt4js,stocks,You'll lose everything in 1 day.,[],0
755,gyv3ncf,2021-05-20,t1_gyurc5b,stocks,Wash TRADES people. Wash sales are when you fomo back into that stock that is cratering,[],0
756,gyv3oa3,2021-05-20,t3_nh6bxq,stocks,Nice. Checkout BYND. Buy low sell high.,[],1
757,gyv3oyt,2021-05-20,t1_gyuvzxk,stocks,"Depending on your situation, just set up some stop losses if you NEED the money but still want to let a couple of your winners run a bit more.",[],0
758,gyv3pq0,2021-05-20,t1_gyuuwn4,stocks,Wash *Trades,[],0
759,gyv3shx,2021-05-20,t3_nh6bxq,stocks,I waited 2 months for ford to move from $12 to 11 and got out quick.  I salute you but you could of put that money somewhere else my friend and done a whole lot more.,[],0
760,gyv3zpv,2021-05-20,t3_lv5dlb,stocks,"Rate my portfolio (suggestions are welcomed) -MAY 2021

PYPL: 17.5%
GOOG: 17.5%
DIS: 11.88%
AMAZ:11.88%
ABNB: 6.42%
V: 6.30%
XPEV: 5.94%

I still have about 20% to play with and suggestions for tech or non-tech companies are welcomed! I was looking at KO but idk, is it a good idea?",[],1
761,gyv40jq,2021-05-20,t1_gyv17sj,stocks,Ok,[],0
762,gyv40kv,2021-05-20,t1_gl970sc,stocks,"Yesterday, the total volume on AMC was 61% shorts.  Citadel is who AMC stock holders have their hands wrapped around the neck of.",['AMC'],0
763,gyv416s,2021-05-20,t3_ngcedr,stocks,Insane money printing,[],0
766,gyv4eqk,2021-05-20,t1_gyv2lyp,stocks,Is it a long term hold say 40+ years? Thought about putting it in my Roth IRA. Or relying on SPYD for income once I retire.,[],1
767,gyv4fkh,2021-05-20,t1_gyuxmfi,stocks,"The year is 2051, in dark places on the internet you can still find some aging conspiracy theorists discussing how the company going bankrupt and dissolving in 2033 was a misinformation campaign by the hedgies. The squeeze is imminent, their returns will be massive. Estimates put it at almost 2/3 as much as if they had bought VOO in 2021.",[],1
768,gyv4fxw,2021-05-20,t1_gyuvvv9,stocks,"When there is a market disruption like how EVs are disrupting gas vehicles, most, if not all incumbents suffer. It’s hard to determine the winners ahead of time.

Just look at the smartphone disruption. I admit it isn’t a perfect analogy, but I’d stay away from legacy automakers right now.",[],0
769,gyv4jc1,2021-05-20,t3_ngvmrw,stocks,Can we do it again tomorrow? Same place same time pretty please.,[],1
770,gyv4kph,2021-05-20,t1_gyv380n,stocks,According to u/financeanalyst yes. According to actual financial analysts no.,[],1
771,gyv4l39,2021-05-20,t1_gyuaime,stocks,Nether of those are pink OTC securities. I hate super noobs so much.,[],0
772,gyv4mcf,2021-05-20,t3_nh01bu,stocks,"OTC is divided into a few parts, namely OTCQX, OTCQB, and Pinks. Pinks are further subdivided, based on if they report or not. QX, QB, and Pinks that report and are up to date are not affected by this rule. 

Check out otcmarkets.com to see if any of the OTC stocks you own are up to date. You will see a green check and something that says “current” or “reporting” if your stocks are clear.",[],1
773,gyv4oem,2021-05-20,t1_gyuhk6d,stocks,"Ignorance is my best guess. I picked up 100 shares in DISCK, should probably do 100% return next year......",[],0
774,gyv4op6,2021-05-20,t1_gyuzsqg,stocks,Oof,[],0
775,gyv4ot0,2021-05-20,t1_gyuvy2i,stocks,"For people using it as a work truck that don’t have to travel super long distances, having a portable powerful electricity source would be pretty damn useful.",[],1
776,gyv4p0i,2021-05-20,t1_gyuy16x,stocks,Who do you thing the merger is going to be with and when?,[],0
777,gyv4p2y,2021-05-20,t1_gyv1ixn,stocks,"OH JEEZ AM I NOT UP TO THE STANDARDS OF SOME RANDOM INTERNET DICKHEAD

Bruh, don't care won't care.",[],0
778,gyv4qoo,2021-05-20,t1_gynkwxl,stocks,"> If FB charges subscription, won’t they have to pay App Store and google the 30% cut. May be that is what Apple really wants.

doesn't that only apply if they process payments through them?

this is why some services that operate on those devices simply only let people make purchases on pc in their webbrowser.",['AAPL'],0
779,gyv4rom,2021-05-20,t1_gyuk42k,stocks,Ford is a stock you should just buy and hold. It's a solid dividend stock. The people here treating it like a growth stock are doing it wrong.,[],1
780,gyv4rwk,2021-05-20,t3_nha7kn,stocks,"I don’t think we’ll see a housing market collapse because the volume of default *probably* won’t get to that point. It could, but as of right now, it doesn’t appear to be a 2008 2.0 scenario or anything.

I do think we’ll see a healthy deflation in home prices and an increase in supply. There will be some economic damage, but we (as a society, not the individual folks and families that are suffering) may actually appreciate the outcome because right now home prices are soaring and demand is far exceeding supply.",[],1
781,gyv4sjr,2021-05-20,t1_gyurhr5,stocks,I mean typically no because you'd clearly be selling on the upswing but who knows. The option is there because someone may find utility in it for some reason.,[],0
782,gyv4u2r,2021-05-20,t3_nh8jr8,stocks,"My key takeaway is that you’ve learned a lot, but haven’t succeeded.   yet.  

Realistically if you want to get back in the market, you should probably just try to pile some cash up that you won’t need in the near term.   Fear is a powerful driver and if you need that money for a house / car / emergency then you’re going to react.   Just because you haven’t succeeded yet doesn’t mean you won’t.

It’s generally not too hard to at least break even in the market, you just have to  do DD, buy low, and not sell if it’s below what you paid for it.   Trying to game and time things almost never works for ordinary people.   If you’re still holding then just wait another year, whatever you were in has a strong chance it will come back up.   I’ve been down 50% in a position and just buy more and go outside, it’s always worked out for me so far.

People are all panicked about a potential crash in the medium to near term future, and it’s probably going to happen.   If you can’t afford to be 50% down for a year or more and still hold then put the money somewhere safer.   Trying to move to quickly is usually a big problem for beginners.",[],0
783,gyv4u79,2021-05-20,t1_gytx5dj,stocks,But he isn’t involved with the company and the new leadership has been doing very well.,[],0
784,gyv4ut8,2021-05-20,t1_gyuilv1,stocks,Bronco? Miss those things.,[],0
785,gyv4w92,2021-05-20,t1_gyuxs0m,stocks,Gay,[],1
786,gyv4wgw,2021-05-20,t3_nha7k8,stocks,"My best advice is; Expect to ""fuck up"" to some extend.  


More important than my best advice: Learn from the fuck-ups you make.  


The good old ""don't invest anything you can't afford to lose""  


Don't overcomplicate things, do simple analysis. What sector is the business in, and what do they use their money on? Dividens, improving offices, salaries, customer-perks?",[],0
787,gyv4wr1,2021-05-20,t1_gyux0q6,stocks,So what is the list of index do you recommend? Lol,[],0
788,gyv4x4j,2021-05-20,t1_gyt1l93,stocks,"Aka Net Options Price Effect, or...NOPE",[],1
789,gyv4yxs,2021-05-20,t1_gyv2n0y,stocks,Yeah in general market orders are not recommended for volatile stocks or in generally on market open unless you really need to get in.,[],1
790,gyv4z4e,2021-05-20,t1_gyuyr61,stocks,"Are you asking because you want to invest in a general small cap fund? I'm not sure, but as the other reply states it looks like they do. But, I'm not sure if that knowledge matters unless you want to invest in a general fund covering smaller cap stocks, or unless you have a good idea as to who the winners would be. The reason many people avoid small cap speculative stocks is because they haven't built up their history and reputation, so there is inherently more risk as well as more potential reward. So while there might end up being a few winners, the majority of people who invest in small cap stocks will still get burned because of the sheer number of losers as well.

I am an investor who tends to try and look for small cap stocks that, given a long enough outlook, will outperform larger cap companies and I can tell you just one thing. It's not easy, and it's a whole lot of speculation. But I enjoy speculating, so there you go.",[],1
791,gyv50ix,2021-05-20,t1_gyurz3y,stocks,The Japan bubble is wild,[],1
792,gyv50mi,2021-05-20,t1_gyv24vn,stocks,Goodbye,[],0
793,gyv52uy,2021-05-20,t3_nh6bxq,stocks,"If Ford would spin their super duty trucks off into a different company, I would invest in that. Ford has steadily declined in quality otherwise over the past decade.",[],0
794,gyv539h,2021-05-20,t3_nh6bxq,stocks,Ford needs to go bankrupt!,[],1
795,gyv54vs,2021-05-20,t1_gyurxif,stocks,Same with environmental protections - I remember a buddy who worked for a major refinery saying they had excel sheets weighing the profits vs fines and it almost always made sense to pay the fine (if they even got caught).,[],0
796,gyv55c4,2021-05-20,t3_ngi6ua,stocks, Nutanix….ticker NTNX,[],0
797,gyv56xq,2021-05-20,t3_nh6bxq,stocks,"Ford has been $10 many times, which time are you referring to?",[],1
798,gyv572s,2021-05-20,t3_nha7k8,stocks,"Maybe a large broad etf like vti, it’s vanguards total market etf, there are several like this that are somewhat safe",[],1
799,gyv57jt,2021-05-20,t3_nh7ld4,stocks,Rockwell Automation (manufacturing robotics),[],0
800,gyv59nb,2021-05-20,t3_nh3l8m,stocks,"Great company with a diverse product offering from Defense to healthcare. Using IT innovation to get into health and behavioral health. They are pretty much a safe investment. I have worked with them before on projects and have always been impressed with their business. They run very lean. I'm not invested in their stock, but have always liked this company.",[],1
801,gyv5cja,2021-05-20,t1_gytzfjc,stocks,Up 6% at close today.,[],0
802,gyv5d5u,2021-05-20,t3_nh7ld4,stocks,"If you're planning for 30 years better get an index fund plus diversify into emerging markets. The world economy will be a different ballgame in 30 years. Declining fertility rates in the West and markets such as SE Asia, Africa are promising.",[],1
803,gyv5eig,2021-05-20,t1_gyuzds9,stocks,"Yeah seriously. Like I live AAPL but who’s to say it doesn’t end up like GE or something. 

I know AAPL is an extremely innovative company but say Tom Cook is replaced and the new CEO is a dud like Steve balmer lol.","['GE', 'AAPL']",1
804,gyv5eiy,2021-05-20,t1_gyv1ri4,stocks,"Not for a couple years.

Ford seems to have a thing for botching new model roll-outs. The current Explorer and F150 being prime examples with defects and recalls. 

If they could get the quality under control, first time around, they would be a hit machine as of late.",[],0
805,gyv5f6h,2021-05-20,t1_gyv0r68,stocks,"Massively incorrect. Battery costs are not decreasing because we are not at a sufficient capacity. People want to drive 500 miles on a charge not 200. Battery costs go up every year there is an improvement and not down like you are suggesting. 

Battery prices will come down when we hit the bare minimum range and people are satisfied with that. Until then economies with battery production do not exist.",[],1
806,gyv5fif,2021-05-20,t1_gyuszvj,stocks,What an incredibly uniformed comment. Ford stock will outperform Tesla over the next five years.,[],1
807,gyv5gfz,2021-05-20,t1_gs3z5j0,stocks,How’s the carnival short going 🤡,[],0
808,gyv5hwc,2021-05-20,t3_nh6bxq,stocks,Yeah they are gonna sell a lot of cars as they always do. Just better margins in the near term with their 70k base f150,[],0
809,gyv5i72,2021-05-20,t1_gyuvvv9,stocks,Holy shit you know absolutely nothing about Ford!,[],1
810,gyv5jcz,2021-05-20,t1_gyuxs1c,stocks,Nintendo is a long term hold for me with Nintendo World and it eventually coming to the US,[],1
811,gyv5jiu,2021-05-20,t1_gyv4z4e,stocks,"Not looking to invest, but I have an allocation of ETFs for all cap market and a much higher % in S&P 500, and I'm considering putting a higher weight into all cap/even small cap only ETF, but not necessarily",[],1
812,gyv5jp3,2021-05-20,t1_gytddd1,stocks,That's an interesting perspective when my thinking is geared towards our current state of capitalism being a paperclip maximizer in many ways. Thanks!,[],1
813,gyv5jpn,2021-05-20,t3_nh8q13,stocks,"Depends on why you got in initially. If it was to make a quick buck, cash out. But seeing as you held when it ran up to $30, you're probably waiting for the mother of all catalysts, which is full US legalization. If that's the case, you'll have to ride the cannabis peaks and valleys for a couple/few years. If the swings are bothering you, at least cash out your principal + some profits and just play with house money.",[],0
814,gyv5kf3,2021-05-20,t1_gyuzv4o,stocks,I see so $150 million buy orders have been filled and $121 million in sell orders have been correct? Which doesn't directly impact the price of the stock if I'm following correctly?,[],0
815,gyv5kx0,2021-05-20,t3_ngi6ua,stocks,"Jones Soda. Great stuff, I'm probably a little addicted",[],1
816,gyv5mah,2021-05-20,t1_gyuxmfi,stocks,You have been banned from r/superstonk,[],1
817,gyv5mmz,2021-05-20,t3_nha7k8,stocks,"My advice:

The days I lose money from picking individual stocks I actually ache and get sad. 

The day I gain from picking stocks I end up looking at other stocks doing better.

The pain is wore than the joy.  

Advice: Invest in the total market funds.  Many to choose from.  VT works for me.",[],1
818,gyv5ms5,2021-05-20,t1_gyuilv1,stocks,The F150 is the bestselling VEHICLE in America you doofus,[],0
819,gyv5pb2,2021-05-20,t3_nh7ld4,stocks,"Have you considered slowly adding to a high-dividend etf over time? Aiming for 10-20% of your portfolio? It adds up over 30 years when you set it up as a DRIP. I’m trying to build a portfolio that does exactly that. A mix of future speculative investments, some that I think will stick around...then some high performing steady ETFs. 

I’ve recently divorced with the ARK funds realizing it’s foolish to bet on aggressive ETFs that buy into hype. No thanks...not sustainable. Maybe I’ll consider going back in after some time.",[],1
820,gyv5ps1,2021-05-20,t1_gytxpfa,stocks,"https://www.fool.com/quote/nyse/gamestop/gme/major-holders/

Add up institutional ownership. 

Check out other reddit posts with people that have done similar with the most recent filings. 

Institutions own the entire float. What shares do I and the rest of retail own?

Short interest is reported at about 10million shares.

 Things don't add up here.",[],1
821,gyv5pvd,2021-05-20,t1_gyuoz2f,stocks,Buy a shit ton so I can retire early please,[],0
822,gyv5pwh,2021-05-20,t1_gyu1raq,stocks,"Better faster returns in AT&T, Discovery and VIAC :-)",[],0
823,gyv5pwl,2021-05-20,t1_gyuteji,stocks,who then?,[],0
824,gyv5qjw,2021-05-20,t3_nh6bxq,stocks,Best thing was they used Atlas by Battles in the adverts.,[],1
825,gyv5qnx,2021-05-20,t3_nha7k8,stocks,"Start with loading a savings account with 6 months worth of expenses (emergency fund).

After that I would pay off any debts you have.

For the investing portion, i would personally recommend staying away from day trading or any types of swing trades. Best advice is the most boring: index funds. VTI covers the whole US market, it’s not exciting, but it has proven that over time it is the most consistent with returns. I don’t know your timeframe, so if you want to pull it out in 10 years, or anything sooner than retirement, put it in a normal brokerage account. If you really don’t need the money, place it in a Roth IRA and relax when you retire.

Hope this helps!",[],0
826,gyv5rhj,2021-05-20,t1_gyv3pq0,stocks,Its a wash sale. The IRS even has a ruling about it: https://www.investopedia.com/terms/w/washsalerule.asp,[],0
827,gyv5ro2,2021-05-20,t3_nh6bxq,stocks,The number of uninformed comments from people who probably bought HYLN at $45 is incredible.,[],0
828,gyv5txx,2021-05-20,t1_gyv5kf3,stocks,Theres a correlation but its not a 100% correlation,[],0
829,gyv5u65,2021-05-20,t3_nha7kn,stocks,"1) Collapse would mean people with mortgages have no money, no jobs.  These people are usually willing do to anything to keep their family home.

2) Companies can't find people to work, there is no shortage of jobs.

3) I don't expect a housing collapse",[],0
830,gyv5ur3,2021-05-20,t1_gyv4rwk,stocks,Where do you live? House market here (Europe) is nuts and the prices only know one direction and that is up. Demand is getting bigger and you have to buy quick or everybody keeps pushing the price to get it. Was one of the most frustrating times to find a house we liked and actually get the chance to buy it,[],1
831,gyv5v79,2021-05-20,t1_gyuvvv9,stocks,"I think we should also take into account a head start in EV adoption when thinking about the auto industry. Some big players like Toyota haven't shown any seriousness in transitioning to that space so there is the room for growth you mentioned.

Also it is expensive to develop EVs right now but by the time they're mass producing them, battery costs will go down even more. Probably not as wildly as the last decade but still enough to make an impact. Their partnership with a established battery maker (SK Innovation) should also help with that. EVs also require less moving parts and less complex manufacturing so there should be better margins once battery costs start coming down.

All that being said, I have no clue if it'll reach $20 or not, I'd lean t the no side since they've siloed themselves to the pickup truck and SUV market. That is the most profitable market though.",[],0
832,gyv5ypv,2021-05-20,t1_gyu2b1d,stocks,"Counter point. Who wants to watch me take $10k and turn it into $100. 

I will supply this entertainment for a mere $10k...up front",[],0
