,created,subreddit,text,comment_id,parent_id,Organizations,Sentiment
255,2021-05-25,investing,"The market hadn’t fully priced in COVID by March 17, 2020 and there was a lot more room for it to go down its just that a week and a half later the government came together and signed the first of several relief bills. Had that not come about it’s all but certain that the risk wasn’t fully priced in and that everything would have fallen much further. 

At present, we all know inflation is around the corner. What we don’t know if whether the fed will keep to what it’s previously signaled and let inflation run higher than their targets, and therefore not raise rates this year. Or if it’s going to soar so far past their target that they’re forced to backpedal and raise rates sooner. And if rates go up, no one knows by how much. Contrast this to the bailout where in a very short time the market knew the steps the fed and treasury were taking. 

So no I don’t think it’s priced in at all. We don’t know any of the metrics that are going to make up the investment environment 6 months, 1 year or 2 years out.",gzg342g,t3_nk02im,[],0
256,2021-05-25,investing,"Holding cash is gambling too by that measure, as it's fiat currency and there's no certainty how much inflation there will be.

You could lose in real estate or gold too, as many have in the past.

Diversifying is all about regret maximization. Buy as much of different things as you can so you have a good chance at being to hold onto at least some of your wealth.",gzg34iz,t1_gzfi9cc,[],1
257,2021-05-25,investing,I understand that. The question though is what is the reason for deciding which securities are available or not available. I imagine that there could be myriad of reasons. I've only ever worked at brokerages that handled institutional trading so these types of retail brokerage decisions are interesting to me.,gzg34ww,t1_gzg1q5o,[],0
258,2021-05-25,investing,"57 for federal employees with decades in the workforce. 62 for those with less. 

I think you’re talking about federal police",gzg35om,t1_gzfeeem,[],0
259,2021-05-25,investing,Yeah I was being sarcastic lol. My point was that guys argument about turning off the printers is stupid.,gzg3848,t1_gzdx46h,[],0
260,2021-05-25,investing,"I don’t know. They have a blanket policy of no ETNs. Past that it’s any bodies guess. I thought maybe new/untested issuers was the issue, but they wouldn’t even let me buy a vanguard etf (vceb, I believe. An ESG bond etf). Even the rep I got on the line was at a loss for words about that one.",gzg3f8q,t1_gzg34ww,[],0
261,2021-05-25,investing,More annoying than concerning,gzg3i6a,t1_gzfy4tf,[],0
262,2021-05-25,investing,"I'm new to all this.  Keeping my investments to beer-money denominations until this starts to feel less alien.

Stumbled across a thread on a different /r/ where someone mentioned making a crapton of cash off a 'triple leveraged etf.'  What I was able to find about them explained what they are supposed to do, but there wasn't much out there about how they do it.  

What's the 'engine' at work that drives their outcome to 3x (or -3x) the index they're associated with?",gzg3ma0,t3_nkl62k,[],0
263,2021-05-25,investing,You're not going to get a lot of positive reactions around here trying to time the market.,gzg3myj,t1_gzfgpqo,[],1
264,2021-05-25,investing,*The single greatest edge an investor can have is insider information.*,gzg3p7a,t1_gzdvw2h,[],1
265,2021-05-25,investing,"Your submission was automatically removed because it looks like your post is better served as a comment on an existing post. Please also take a moment to review the [r/investing rules](https://www.reddit.com/r/investing/wiki/index/rules) if you have not yet done so. I am a bot and sometimes not the smartest so if you feel your comment was removed in error please message the moderators.

*I am a bot, and this action was performed automatically. Please [contact the moderators of this subreddit](/message/compose/?to=/r/investing) if you have any questions or concerns.*",gzg3w3l,t3_nl248a,[],1
266,2021-05-25,investing,millionaire next door covers this.,gzg3ym1,t1_gze6d16,[],0
267,2021-05-25,investing,Same. You just didn’t start young enough.,gzg4gca,t1_gzfguvl,[],0
268,2021-05-25,investing,"Honestly it's a bit foolish to make such a telegraphed trade on such a simple view. If it was that obvious the market would have already figured it out and moved in anticipation (hint: maybe it already has???).

People have been guessing wrong on inflation for decades now. You have to really believe you know something about inflation the market doesn't for that to work.

Better to focus on building a portfolio that's resilient in alot of different environments rather than risk guessing wrong on one.",gzg4nh6,t3_nksv5w,[],0
269,2021-05-25,investing,"Interactive brokers has that tool, but not sure if you can use it if you're not a client",gzg4ru3,t3_nky9pg,[],1
270,2021-05-25,investing,"Backstory: Had well over 120k in debt in anything and everything, played stupid games with the IRS in my 20's, won stupid prizes. Recently paid off all my debt short of my mortgage, and at the age of 34 I'm just now starting my retirement contributions.  
  
Yesterday I made a Vanguard account and will be making $500/mo automatic contributions into an IRA for the rest of my working life. In addition to this, I'm adding about $25k cash to the account as a jump-start in long-term index funds. I am not trying to win the lotto or play games with Crypto/GME. I just don't want to live off Social Security when I'm 67. I'm self-employed so my income comes and goes in waves, but my realistic goal is to contribute 15-20% of my gross annually for the next 35-ish years.  
  
Upon research, VTSAX seems to be the golden boy for the long game, but VTI has a .01% lower fee to it, and doesn't have the $3000 minimum purchase. Considering they're effectively the same, it seems like I should just put everything in VTI, right? Or do I buy VTI until it grows to $3000 and transfer it to VTSAX?",gzg4vnl,t3_nkl62k,[],0
271,2021-05-25,investing,"I get what you’re trying to say, but it would be 40k a year with favorable taxation compared to W2 income, and presumably you shouldn’t have a mortgage at that point, and don’t need to set aside a chunk of monthly income for “saving for retirement”, so that plus social security should be pretty comfortable in most areas.",gzg4xb6,t1_gzesrbt,[],1
272,2021-05-25,investing,Leave it. If it tanks buy more.....,gzg51ho,t1_gzfgpqo,[],0
273,2021-05-25,investing,How are people retiring on just home equity? Reverse mortgages I guess?,gzg51kr,t1_gzerwtt,[],0
274,2021-05-25,investing,"Bro even if I started out of college in mid 2000, the pension plan offered wouldn't be enough lmao. So your claim that ""literally any gov job"" can allow people to retire at 50 is a lie. And I bet your pension won't let you retire and take withdrawals until your mid to late 50s without some penalties in distributions.",gzg52ds,t1_gzg4gca,[],0
275,2021-05-25,investing,"I don't really know anything about them. I do know they made the calculators I used in high school though lol. I don't know what they specialize in or where their revenue comes from but their calculators are probably going on the decline. Most schools are replacing course work and text books with computers and having a computer on hand negates the need for a seperate calculator, as many computers will come with an expansive list of calculators in them. If you need a more sophisticated calculator a rudimentary search on the web will usually yield an online calculator or a program you can use. Why buy or rent a calculator for several hundred when there are incredibly cheap or even free online alternatives. They might begin looking at other similar markets: Small, low power isolated devices. Whatever those might end up being. As for automotives? I didn't even know they did stuff like that. If the trend continues vehicles are going to need more electronic componenets, and the systems needed to better interact with, maintain and construct these vehicles will also consequentially be more electronic in nature, like   
 the tools, batteries and chargers.

This is all anecdotal and obviously I fixated on their calculators. I only brought up the companies i'm familiar with so take it how it comes.",gzg53pl,t1_gzfstsm,[],1
276,2021-05-25,investing,Nice I’m hold some United too but bought at $42... yeah I’m sure something new will come along eventually,gzg53sd,t1_gzfgi6i,[],1
277,2021-05-25,investing,"1 yes ETFS are open end and trade very close to their NAV

2 Daily ETF holdings are public so you can check for changes youself, or even script it. I hear ARK sends emails about their trades. Maybe others do as well but I don't think it's common. Or you can check if their underlying index provider has an email service. I'm not sure what the point of announcing a non-change like reinvesting dividends in an accumulating fund would be.  

3 You own the company and when the company grows, you do share in the profit. You don't have a majority say in how that profit is used, only a minority share.  

For some mature stocks which aren't able to grow as much and don't do buybacks, the dividend is often going to be the main form of returns. But generally a company's earnings can also be allocated for shareholder benefit in other ways. You may find it helpful to see a stock as an unsellable stake in a tangible small business. You benefit when the company pays you explicitly and you may benefit more when the business retains some earnings to grow and be able to pay you more in the future. In some cases you may need to invest more capital into the business for several years before it can start to pay off.   

Then add on the ability to sell that stake to others when you need cash now in a liquid market to others who don't. The stock price is not just a mirror of the business in its current state; it is the expected future cashflows of the business discounted to present value at a rate that depends on how much the marginal buyers and sellers prefer money now vs more later and how much risk they are willing to take. (A framework called DCF)",gzg5drw,t1_gzfqvkz,[],0
278,2021-05-25,investing,"You can get the EITC even if you don't have children. You can also be eligible for both. I don't know details of the EITC. But for the CTC, instead of getting $3600 back 1 time when you file taxes, you get half of it in monthly equal payments starting July and the rest when you file next year. $3600 is for children under 6 and $3000 is for children 6 and over. This is per child",gzg5g4j,t1_gzc1yj0,[],0
279,2021-05-25,investing,"I would take a look at AMKR as well, they don’t manufacture the chips but do secondary services like testing and packaging globally but are based in Scottsdale AZ",gzg5gth,t1_gzdh2p0,[],1
280,2021-05-25,investing,"200K: pay off a big chunk of our mortgage or invest? 
My spouse and I are in our mid 40s. We sold a piece of real estate and are wondering where we will get the best results: pay off a big chunk of our mortgage and take years off the loan and save tons on interest or invest it hoping for bigger payout over time? The stock market is increasingly volatile which could mean great returns(and risks). We do not need the money for another 15 years, but want it to work for us in the meantime. We already have a decent retirement spread over a 401K, and a diverse, though USA, stock portfolio.
Thanks! 
ps I got the tip for buying match.com from here years ago and am still happily holding!",gzg5ihx,t3_nkl62k,[],1
281,2021-05-25,investing,I think this is what people really misunderstand in these arguments. Inflation from one perspective is about prices. On the other hand there is currency devaluation. You can have one without the other but you often find they are highly correlated as the most often cause is increase in money supply which caused devaluation and in this case affects prices.,gzg5l66,t1_gzf7f5r,[],0
282,2021-05-25,investing,Correct. Additionally if there is inflation there are levers you can pull to increase or decrease liquidity with monetary policy. With no inflation (or too much inflation) you lose access to these levers and can't operate your economy as efficiently or moderate/increase risk appetite as easily.,gzg5u0g,t1_gzfei3w,[],0
283,2021-05-25,investing,"Thanks man, very appreciative of the response",gzg62qx,t1_gzfptlo,[],1
284,2021-05-25,investing,It certainly does. But pointing out that most people dont access that money till later in life.,gzg64vm,t1_gzfeogw,[],0
285,2021-05-25,investing,that sounds like total made up bullshit.,gzg67t8,t1_gze4jlq,[],1
286,2021-05-25,investing,"Most aren't, but of those that are they can live off of social security which is enough to pay for taxes and food, but not much else.  They may need help from their kids when their car dies and they need a new one for example.

Some people have to sell their house to make ends meet.  Some people rely on their kids.",gzg6ajx,t1_gzg51kr,[],1
287,2021-05-25,investing,"I can retire now at 30 years old on $1M using the 4% rule. 




That would allow me to withdraw $40k forever. Its a bit less after taxes though. But it’s still more than what i current spend annually.",gzg6cwt,t1_gzfi8am,[],0
288,2021-05-25,investing,It takes a while for people to realize that what gives people the most pleasure is doing a difficult task and completing it successfully.,gzg6d3l,t1_gzenlyg,[],0
289,2021-05-25,investing,"I think we have a different views the world and economics ... We're not likely to agree.  In my mind, comparing the US today to the Weimar (or any other of your comparisons) is hyperbole.

In general, QE has minimal impact on inflation and requires private banks to make loans (something they're not doing alot of today).

I'm also not sure how government liabilities impact inflation.  In my mind this is deflationary.

If you're worried about inflation PPP loans and fiscial spend are the only policies of concern.

Back to your question. I see no catalyst for long term inflation.  In the short term, will see price hikes, attributed to the reopening, but the forces of demographics, technology, globalization will keep inflation down, as it has since the 70s.  If you don't agree, that a look at Japan.  BOJ has been doing QE on and off for 20 years, they have over twice the amount of government liabilities as the US and have none existent inflation.",gzg6duy,t1_gzf95fj,[],1
290,2021-05-25,investing,It is possible that these ETFs are blocked because they employ factor based strategies which the platform may consider as too advanced for an average investors.,gzg6ii0,t3_nkpmiv,[],0
291,2021-05-25,investing,Gme only - rest of my life,gzg6irh,t3_nklmfn,[],1
292,2021-05-25,investing,"10 years, reevaluate, then another 20 after that",gzg6tc3,t3_nklmfn,[],1
293,2021-05-25,investing,"Your submission was removed because it is a short post. Any self-post below 400 characters in the body will be removed.  Please refer to rule 6 and make sure your post meets our standards of effort. Automod evasion will be met with a lengthy ban. Do not post just an article; highlight the parts of the article you find relevant or offer some commentary surrounding the article. Self-posts that offer some simple thoughts or questions like ""what do you think"", ""here's my thoughts"", etc. belong as comments to existing posts or the [Daily Advice Thread](https://www.reddit.com/r/investing/about/sticky?num=2).

*I am a bot, and this action was performed automatically. Please [contact the moderators of this subreddit](/message/compose/?to=/r/investing) if you have any questions or concerns.*",gzg6toz,t3_nl2lvy,[],1
294,2021-05-25,investing,Sounds like some people can bring home the $$$,gzg6ytd,t1_gzg5g4j,[],0
295,2021-05-25,investing,That was a good article! Appreciate it. I’m wary about investing in anything with Dividend on it since dividends themselves don’t predict anything that isn’t better explained by other factors,gzg6z30,t1_gzfo3aa,[],1
296,2021-05-25,investing,"Your [submission](https://www.reddit.com/r/investing/comments/nl2nx9/is_trading_a_scam_or_legit/) in /r/investing was automatically removed because your account has insufficient Karma. Users can earn Karma by commenting on existing threads.

*I am a bot, and this action was performed automatically. Please [contact the moderators of this subreddit](/message/compose/?to=/r/investing) if you have any questions or concerns.*",gzg763i,t3_nl2nx9,[],0
297,2021-05-25,investing,"**Hi, welcome to /r/investing. Please note that as a topic focused subreddit we have higher posting standards than much of Reddit:**

**1)** Please direct all **advice requests and beginner questions to the stickied daily threads.** This includes beginner questions and portfolio help.

**2) Important: We have strict political posting guidelines** (described [here](https://www.reddit.com/r/investing/comments/cyee69/formal_posting_guidelines_for_political_topics/) and [here](https://www.reddit.com/r/investing/comments/escewo/temporary_rule_change_what_happens_to_stocks_if/)). Violations will result in a likely 60 day ban upon **first instance.**

**3)** This is an open forum but we expect you to conduct yourself like an adult. Disagree, argue, criticize, but **no personal attacks.**


*I am a bot, and this action was performed automatically. Please [contact the moderators of this subreddit](/message/compose/?to=/r/investing) if you have any questions or concerns.*",gzg7a4a,t3_nl2olf,[],0
299,2021-05-25,investing,All based on a return price of 20$,gzg7jsj,t3_nkcyw3,[],0
300,2021-05-25,investing,lol it’s a scam but anyone can play,gzg7pq8,t3_nl2olf,[],1
301,2021-05-25,investing,Sure these are all true things but they are similar in that they hold value without government backing and Bitcoin could be the first thing to do that without holding a tangible good. And yes Bitcoin still needs to stand the test of time to prove that but the comparison and possibility is there.,gzg7tyg,t1_gzd26hw,[],1
302,2021-05-25,investing,"Paying for peoples advice or following their trades are scams. Day trading is very hard, only a very small percentage can actually do it profitably",gzg7yog,t3_nl2olf,[],0
303,2021-05-25,investing,"Not a fan of dividend stocks... ""Here im going to give you your own money back so you can pay tax on it..""",gzg7zut,t3_nksv5w,[],0
304,2021-05-25,investing,"I have a simple question about the “institutional ownership” data/number on Finviz’s screener tool, if someone could assist: What *specific* number does this percentage refer to? For example, let’s use $STEM. Institutional ownership is at 11% and institutional transactions is at -52.31%. Does the institutional transactions number reflect a period of time? I.e., “in the last week”, or “in the last 24 hours”, etc? I can’t help but feel like I misunderstand the metric for that one.

Related question: How often are these values updated?

For example, just 2 weeks ago, $STEM had 75.2% institutional ownership (with a positive % of transactions), and it has dropped a ton (down to 11% ownership/-52.31% transactions). Depending on how often this metric is updated, I’m wondering if this might mean investors knew it was going to drop over the past few weeks, or if someone knows something bad is about to happen. This is a pretty well-liked stock from most I see mention it.",gzg81j4,t3_nkl6nk,[],0
305,2021-05-25,investing,"Not everyone does it because it's hard, and with a regular job you can't lose your money. The only one who can scam you in the stock market is yourself",gzg84ed,t3_nl2olf,[],0
306,2021-05-25,investing,If you make money its legit but if you loose money its a scam.,gzg84f3,t3_nl2olf,[],0
307,2021-05-25,investing,Reading this made my eye twitch and I’m pretty sure I’m building up to a stroke.,gzg85d5,t3_nl2olf,[],0
308,2021-05-25,investing,Sounds like the small percentage of people that's lucky and win in the casino...,gzg8649,t1_gzg7yog,[],1
309,2021-05-25,investing,"No one can predict the market. People trade stocks based on education of price movements compared to historical ones that happen repeatedly, volume changes, news and other catalysts with the stock, and a few thousand other factors. No one wins all the time. The ones successful at it win more than they lose. Most people lose at first because there is so much to learn. The large majority give up and quit before achieving any success.",gzg873p,t3_nl2olf,[],0
310,2021-05-25,investing,How do you loose money?,gzg88dp,t1_gzg84f3,[],0
311,2021-05-25,investing,like a casino,gzg89u5,t1_gzg84f3,[],1
312,2021-05-25,investing,We call those pensions here,gzg8c65,t1_gzeb9vn,[],0
313,2021-05-25,investing,"well, explain yourself smart boy",gzg8cfx,t1_gzg85d5,[],1
314,2021-05-25,investing,"Don't buy individual stocks unless you research them first. If you think EVs are going to do good, you should look for an ETF that has a bunch of EV related stocks in it and buy that (but maybe avoid tesla)",gzg8lcl,t1_gzftc94,[],0
315,2021-05-25,investing,"spacs are more so gambling so don’t know what u babbling about

spacs are made for the companies to get easy money off gamblers",gzg8v9z,t1_gzfr4hp,[],0
316,2021-05-25,investing,Yeah i figured.  But I'm new to it and getting the yips like I'm sure so many have.,gzg8yy2,t1_gzg3myj,[],0
317,2021-05-25,investing,"you’re right holding cash is gambling too, just gambler safer",gzg913r,t1_gzg34iz,[],1
318,2021-05-25,investing,"This post was so painful to read I’m assuming you just learned the stock market existed today, and I’m not going to type you up an entire novel explaining the stock market or investing and trading to you. 

[Start here. ](https://www.investopedia.com/terms/s/stockmarket.asp)When you get to a word or phrase you don’t recognize, look it up and learn about it. Then go from there, exploring different topics related to investing that you’ll come across from reading that.",gzg9718,t1_gzg8cfx,[],1
319,2021-05-25,investing,What did families of the 20% do differently?,gzg9aeq,t1_gze4jlq,[],1
320,2021-05-25,investing,"Meme stocks keep my wealth down, very similar.",gzg9cfp,t1_gzeonpq,[],1
321,2021-05-25,investing,"He lives in an apartment, don't have kids and doesn't have a warehouse membership like Costco or Sam's.",gzg9fcu,t1_gzfum87,[],0
322,2021-05-25,investing,">80% of millionaires today are self made

The definition of self made from that survey is VERY generous.",gzg9fqx,t1_gze4jlq,[],1
323,2021-05-25,investing,Nope no penalty. 30 and out. Medical and 72% salary for life. Hopped in at 18. Out at 48.,gzg9hyy,t1_gzg52ds,[],1
324,2021-05-25,investing,"coin volume increases with mining, trade volume increases, volatility increases, new coins come to market, and repeat
  
They were giving out money for signing up.  They are looking to increasing their market coverage.",gzg9ip5,t1_gz9x1r9,[],0
325,2021-05-25,investing,This is basically saying don't play options,gzg9lbl,t1_gzdk63z,[],1
326,2021-05-25,investing,Remindme! 1 year,gzg9lje,t1_gzg6duy,[],0
327,2021-05-25,investing,Like inflation protected bonds. Sure.,gzg9mue,t1_gzcmkhs,[],1
328,2021-05-25,investing,"Your submission was removed because it is a short post. Any self-post below 400 characters in the body will be removed.  Please refer to rule 6 and make sure your post meets our standards of effort. Automod evasion will be met with a lengthy ban. Do not post just an article; highlight the parts of the article you find relevant or offer some commentary surrounding the article. Self-posts that offer some simple thoughts or questions like ""what do you think"", ""here's my thoughts"", etc. belong as comments to existing posts or the [Daily Advice Thread](https://www.reddit.com/r/investing/about/sticky?num=2).

*I am a bot, and this action was performed automatically. Please [contact the moderators of this subreddit](/message/compose/?to=/r/investing) if you have any questions or concerns.*",gzg9pg9,t3_nl32io,[],1
329,2021-05-25,investing,"Hi Redditor, it would seem you have strayed too far from WSB, there are too many emojis detected. Try making a comment with no emoji at all.  Have a great day! 

*I am a bot, and this action was performed automatically. Please [contact the moderators of this subreddit](/message/compose/?to=/r/investing) if you have any questions or concerns.*",gzg9pr2,t1_gzg9ppx,[],1
330,2021-05-25,investing,">But this does suggest that most individuals aren't getting $1M+ lump sum inheritances.

Okay, but what if I just give my kid 1M? It's not an inheritance because I'm still alive. Therefore he is a self made millionaire.",gzg9pvl,t1_gzej0up,[],0
331,2021-05-25,investing,The fact that 10-Q/K reports for every company directly stated they're gonna pass all the additional input cost to consumers in the next 1-2 quarters and people telling you not to buy stuff? Just ignore them.,gzg9t69,t1_gzft6l7,[],0
332,2021-05-25,investing,"I’ll be financially ready by next year to start investing beyond crypto and general funds. But I have the devil’s touch and it’s been like this my whole life. Whatever I touch will plummet. I have an aura of bad luck and I figured I might as well use it. 

Which markets do you guys want me to crash? Or should I just hold onto USD and let the currency crash?",gzg9tq5,t3_nkl6nk,[],0
333,2021-05-25,investing,"None of the top results suited you when you googled ""etf overlap tool"" ?",gzg9ts3,t3_nky9pg,[],0
334,2021-05-25,investing,"25 years is giving a company a LONG time to fail. There are barely a few that have beaten the s&p in all this time.

Who could've thought Kodak, GE, Exxon would be outperforming the S&P during their heydays. Same can happen to most companies today",gzg9w6b,t1_gzeedfp,['GE'],0
