,created,subreddit,text,comment_id,parent_id,Organizations,Sentiment
1039,2021-05-18,investing,"350 people went to prison for fraud related to the GFC. 

You don't go to prison for being ""at fault""; you go to prison for lying. And CEOs as well as high profile people like Martha Stewart are sent to prison *all the time* for financial fraud. 

No matter what impression you might have from reading what 14 year olds write in reddit, those crimes are taken very seriously. 

But just making stupid investments? That's not a crime, neither is incompetence.",gyixh02,t1_gyieund,[],0
1040,2021-05-18,investing,"> while the market is hot.

Is the market how right now though?",gyixh8n,t1_gyhovk6,[],1
1041,2021-05-18,investing,"What happends if they keep selling everything they produce and keep growing as predicted 40-60% growth YoY?

They weren't telling their chip suppliers to cancel orders back in march 2020 instead the opposite.",gyixhi4,t1_gyi2sou,[],0
1042,2021-05-18,investing,Not so clear to me. Actually nothing fundamental changed from $300 to $240 other than price dropped,gyixhky,t1_gyiw4a2,[],1
1043,2021-05-18,investing,Correct. Tesla's quality is honestly insane considering how many iterations they've had and how much money they've made. The quality of their cars is mediocre for what they purport.,gyixj6b,t1_gyi6pq0,['TSLA'],0
1044,2021-05-18,investing,Are you like 14?...,gyixjfk,t1_gyii5a0,[],1
1045,2021-05-18,investing,"Dilution is fine if there's a clear path to victory, but I don't think Coinbase has clearly articulated their vision to the everyday investors. (If they have I stand corrected and would like to know what it is).",gyixk3l,t1_gyhqsn1,[],1
1046,2021-05-18,investing,"COIN has a very straight forward business model.  They make money in good or bad markets.  They are also branchng way outside of simple exchange services.  COIN isn't going to just be an exchange just like Amazon is no longer just a mail order book seller.

You're right, COIN is nothing like Facebook.  Facebook didnt produce profit for 2 years after it started trading on the market.",gyixl4e,t1_gyiwyrs,[],0
1047,2021-05-18,investing,"Your submission was automatically removed because it contains a keyword not suitable for /r/investing.  Common words prevalent on WSB, hate language, or derogatory political nicknames are not appropriate here.  I am a bot and sometimes not the smartest so if you feel your comment was removed in error please message the moderators.

*I am a bot, and this action was performed automatically. Please [contact the moderators of this subreddit](/message/compose/?to=/r/investing) if you have any questions or concerns.*",gyixlv0,t1_gyixltf,[],0
1048,2021-05-18,investing,Yea but fundamentals were never attractive.,gyixm05,t1_gyixhky,[],1
1049,2021-05-18,investing,DD: they have solved the issue of taking too long to respond to support tickets. Now they don't read what you said and copy paste some help article instead,gyixm9f,t3_nercxl,[],0
1050,2021-05-18,investing,"Your submission was automatically removed because it contains a keyword not suitable for /r/investing.  Common words prevalent on WSB, hate language, or derogatory political nicknames are not appropriate here.  I am a bot and sometimes not the smartest so if you feel your comment was removed in error please message the moderators.

*I am a bot, and this action was performed automatically. Please [contact the moderators of this subreddit](/message/compose/?to=/r/investing) if you have any questions or concerns.*",gyixoms,t1_gyixoj2,[],0
1051,2021-05-18,investing,"To you. If there’s a seller, there’s a buyer",gyixqdh,t1_gyixm05,[],0
1052,2021-05-18,investing,"To expand on that:

>**Note 4. Investments in equity securities (*Continued*)**

>Our equity security investments include $10 billion in Occidental Corporation (“Occidental”) Cumulative Perpetual Preferred
Stock with an aggregate liquidation value of $10 billion and warrants to purchase up to 83.86 million shares of Occidental common
stock at an exercise price of $59.62 per share. The preferred stock accrues dividends at 8% per annum and is redeemable at the option
of Occidental commencing in 2029 at a redemption price equal to 105% of the liquidation preference plus any accumulated and
unpaid dividends or is mandatorily redeemable under specified events. Dividends on the preferred stock may be paid in cash or, at
Occidental’s option, in shares of Occidental common stock. The warrants are exercisable in whole or in part until one year after the
redemption of the preferred stock. 


Page 9
https://www.berkshirehathaway.com/qtrly/1stqtr21.pdf",gyixqvu,t1_gyimy8e,[],1
1053,2021-05-18,investing,"Eh, hello Porsche Taycan? Are you blind as well as stupid?",gyixru5,t1_gyi0gx0,[],0
1054,2021-05-18,investing,No this kind of thing bursts without notice. I’ll hold,gyixsf4,t1_gyix9jt,[],1
1055,2021-05-18,investing,I’d like to know how long they’ll be able to take 1-4% of transactions. That’s insane. And it only works when cryptos are highly overvalued and enjoying a speculative run for the ages,gyixsv0,t1_gyixl4e,[],1
1056,2021-05-18,investing,What if you tilt it too far?,gyixxwj,t1_gyiwhpf,[],1
1057,2021-05-18,investing,"Bonds are not guaranteed to get hit. If there's a 0.50% increase priced in, but the Fed only raises rates 0.25%, bonds go up after the interest rate increase.

Do you really think bonds don't already price in interest rate increases?",gyiy1v3,t1_gyhbcrw,[],1
1058,2021-05-18,investing,"Fair enough. Premiums are insane, otherwise I’d look into shorting. But just from using the product, I can say it’s garbage.",gyiy2cd,t1_gyixqdh,[],0
1059,2021-05-18,investing,You won’t be able to afford it,gyiy3ec,t1_gyixxwj,[],0
1060,2021-05-18,investing,His luck will run out!,gyiy3rn,t1_gyirmg6,[],0
1061,2021-05-18,investing,"On a meta level the world is going to move towards more conflicts, not less. Global warming is going to trigger more pandemics and food shortages. The move towards automation is going to displace workers and drive more instability in societies that are not ready for this change. That's going to give rise to more nationalism, tribalism, and racism. 

I don't see defense spending going down any time soon.",gyiy41w,t3_nehv61,[],1
1062,2021-05-18,investing,"I wish I could copy this man, just a much lower scale... but I don’t know what I am doing...",gyiy7dl,t3_nenw6h,[],0
1063,2021-05-18,investing,"Your submission was automatically removed because it looks like your post is better served as a comment on an existing post. Please also take a moment to review the [r/investing rules](https://www.reddit.com/r/investing/wiki/index/rules) if you have not yet done so. I am a bot and sometimes not the smartest so if you feel your comment was removed in error please message the moderators.

*I am a bot, and this action was performed automatically. Please [contact the moderators of this subreddit](/message/compose/?to=/r/investing) if you have any questions or concerns.*",gyiy9jc,t3_nezk8j,[],1
1064,2021-05-18,investing,"Your [submission](https://www.reddit.com/r/investing/comments/nezks5/thoughts_on_investing_in_chainlink/) in /r/investing was automatically removed because your account has insufficient Karma. Users can earn Karma by commenting on existing threads.

*I am a bot, and this action was performed automatically. Please [contact the moderators of this subreddit](/message/compose/?to=/r/investing) if you have any questions or concerns.*",gyiycdx,t3_nezks5,[],0
1066,2021-05-18,investing,"**Hi, welcome to /r/investing. Please note that as a topic focused subreddit we have higher posting standards than much of Reddit:**

**1)** Please direct all **advice requests and beginner questions to the stickied daily threads.** This includes beginner questions and portfolio help.

**2) Important: We have strict political posting guidelines** (described [here](https://www.reddit.com/r/investing/comments/cyee69/formal_posting_guidelines_for_political_topics/) and [here](https://www.reddit.com/r/investing/comments/escewo/temporary_rule_change_what_happens_to_stocks_if/)). Violations will result in a likely 60 day ban upon **first instance.**

**3)** This is an open forum but we expect you to conduct yourself like an adult. Disagree, argue, criticize, but **no personal attacks.**


*I am a bot, and this action was performed automatically. Please [contact the moderators of this subreddit](/message/compose/?to=/r/investing) if you have any questions or concerns.*",gyiyd1q,t3_nezkx0,[],0
1067,2021-05-18,investing,Hyundai and Kia both beat Tesla.,gyiye1f,t1_gyilefo,[],1
1068,2021-05-18,investing,"Your submission was removed because it is a short post. Any self-post below 400 characters in the body will be removed.  Please refer to rule 6 and make sure your post meets our standards of effort. Automod evasion will be met with a lengthy ban. Do not post just an article; highlight the parts of the article you find relevant or offer some commentary surrounding the article. Self-posts that offer some simple thoughts or questions like ""what do you think"", ""here's my thoughts"", etc. belong as comments to existing posts or the [Daily Advice Thread](https://www.reddit.com/r/investing/about/sticky?num=2).

*I am a bot, and this action was performed automatically. Please [contact the moderators of this subreddit](/message/compose/?to=/r/investing) if you have any questions or concerns.*",gyiyghq,t3_nezljj,[],1
1069,2021-05-18,investing,"If you are so sure, just sell calls and use the premium to buy puts. Or just short the stock directly.",gyiyjh6,t1_gyiy2cd,[],0
1070,2021-05-18,investing,I just want ice cream :(,gyiyjrk,t1_gyiy3ec,[],1
1071,2021-05-18,investing,Yup he’s fucked when he can’t trade the carbon credit anymore. As all the carmakers moved to EV they won’t be selling them their credits. Tesla will be done by the end of the 20s,gyiyneo,t1_gyi4ayz,[],1
1072,2021-05-18,investing,">Apple isn't a ""status"" brand; they are a brand like Honda or Toyota - reliable, predictable, and very very popular.

This legit had me laughing, thank you I needed that.  Honda makes cars that will last 10 years or 100k miles easily without major issue.

Apple makes phones that are intentionally made to go to shit after a certain point or brick themselves if people repair them themselves.  

I can see arguing in favor of Apple based on performance, but comparing them to Honda is just hilarious.",gyiyovl,t1_gyix1q6,['AAPL'],1
1073,2021-05-18,investing,Doubt it. He’s smart.  He buys puts at an ATH of 850 and knows he has to disclose 45 days later. At a guess he sold yesterday before the disclosure and before he could get GME’D by WSB. Someone smarter than me could work out the profits rewind 45 days and check the Tesla put prices.,gyiyxc0,t1_gyhyt5i,[],0
1074,2021-05-18,investing,Not a fan of high risk low reward. Good luck though man. I hope it works out for you,gyiyy27,t1_gyiyjh6,[],0
1075,2021-05-18,investing,They won’t nail self driving.,gyiyzet,t1_gyhty1a,[],0
1076,2021-05-18,investing,Buying puts is different than opening a short position though...,gyiz1uf,t1_gyh5d6c,[],0
1077,2021-05-18,investing,"I'm not paying 1-4% in fees.  I pay a maximum of .5%.  It works when crypto prices are up or down.  It doesnt only work when cryptos are high overvalued.

After 11 years and all these major financial and banking institutions moving in, can you really say this is a speculative run?  How many times does crypto have to completely blow away your expectations before you realize this is here, it exists and companies are deploying massive amounts of resources to bring products and services to institutional and retail investors.

Any technology that can reduce costs, improve efficiency and allow you to expand your potential market to any connected device around the world is going to become mainstream.",gyiz1wl,t1_gyixsv0,[],0
1078,2021-05-18,investing,This is the way.,gyiz6ry,t1_gyiwhpf,[],0
1079,2021-05-18,investing,Maths,gyiz91n,t1_gyivy0k,[],0
1080,2021-05-18,investing,There is a quote in the big short saying “you being early is the same as being wrong” lol. No diss tho i just find it funny,gyiza5y,t1_gyi1x0l,[],1
1081,2021-05-18,investing,"40 y/o Roth, 401k, brokerage account for the past 15 years, generally on track to retire early. However working through how to organize my existing retirement portfolio to maximize income in retirement.

Recently been looking at securities that pay dividends such as NYSE:O which pays a monthly dividend with an annual yield of ~4%. Considering how to best incorporate this into my retirement strategy.

The question I pose, is it better to build a position with dividend stocks in my Roth to take advantage of tax benefits? Or would it be better to focus on growth oriented stocks for my Roth assuming the benefits from the capital gains would outweigh the tax benefit on the dividends?",gyizaed,t3_neb4xj,[],0
1082,2021-05-18,investing,Anyone have any thoughts on the chainlink hype? Dodgecoin 2.0 or just a passing fad?,gyizbis,t3_neb5lg,[],1
1083,2021-05-18,investing,"VTSAX

There done.",gyizful,t1_gyiin7t,[],0
1084,2021-05-18,investing,I need to do alot more research it looks like.  Thank you for your help,gyizlqh,t1_gyisp9e,[],1
1085,2021-05-18,investing,"I don't get why everyone obsesses over his airline position. Berkshire lost $3 billion from that position because of the COVID-19 pandemic on a $300 billion portfolio and a $600+ billion market cap. Its barely noteworthy. If that is an example of one Buffett's biggest failures, I would say he is doing alright. His other big failures Kraft Heinz and IMB? He broke even on those. Meanwhile, he nearly had 4x on his investment in Apple, turning $34 billion into $120+ billion. People miss the forest for the trees sometimes.",gyizows,t1_gyis68n,['AAPL'],0
1086,2021-05-18,investing,"Yeah, I figured that. I would love to use CB Pro if they just had automatic deposits. Guess it's worth the hassle though. I just buy Stellar and send it to my Kraken wallet. I barely pay any fees that way. Then I convert that to the coins I'm holding.",gyizt7e,t1_gyiv1yz,[],0
1087,2021-05-18,investing,"We can hope. Misinformation makes the market more volatile, creating opportunity for the savvy investor.",gyiztzn,t1_gyi5sc4,[],0
1088,2021-05-18,investing,"What were there revenues and profits outside of the last two major speculative runs? And what percentage of people are paying 0.5%? They profit from volume. 

And btw, that’s still a really high fee if you’re trading large sums. Plus they are taking the premium on the bid/ask spread. 

I don’t foresee crypto ever being an actual medium of payment for physical assets unless it is pegged to a real currency. Too much volatility. Maybe that eventually goes away, who knows. But gold and silver have never stopped being volatile, and I see them as physical equivalents. A currency which is backed by nothing other than sentiment is subject to wild swings. 

Seriously selling gold picks during the gold rush? Tell you what, I sure as hell would have stayed away from any company doing that business. Booming for a few years and then gone. I don’t get how that’s a positive comparison.",gyizy9p,t1_gyiz1wl,[],0
1089,2021-05-18,investing,These tesla Kool aid drinkers man. The company is valued more than every other car company combined if you think that evaluation is proper I don't even know anymore,gyizyj4,t3_ncc7gx,[],0
1090,2021-05-18,investing,"Amazon has arguably the biggest moat in the world, it's not even comparable",gyj00r9,t1_gyhvw04,[],1
1091,2021-05-18,investing,"FWIW those filing values are baloney.  He is long 8001 puts, aka 800100 shares, closing price on 3/31 was $667.93... so 800100*668=$534m.  He didn't pay that much for the puts, that's the value of the underlying on 3/31.",gyj05n5,t3_nenw6h,[],0
1092,2021-05-18,investing,Not only that but their tiny moat is all but gone. All thats left is the fanboys and their dwdindling equity,gyj0bh6,t1_gyhb8dc,[],0
1093,2021-05-18,investing,"Before everyone just downvotes you, printing actual dollars really is small potatoes in the grand scheme of things. Think of the actual cash in circulation as the tip of the iceberg, and loan reserves/interest rates in/for banks as the real berg. Meaning: inflation due to ""money printing"" has been relatively off point for a long time now.",gyj0bkt,t1_gyi3e2u,[],0
1094,2021-05-18,investing,Wait what,gyj0c6v,t1_gyiecvl,[],0
1095,2021-05-18,investing,I have Barricks Gold (GOLD ticker) calls and stock.  It’s had a nice run up - I see inflation as a big driver but rapid increases often see a pull back.  What y’all think will happen?,gyj0cs7,t3_neb5lg,[],0
1096,2021-05-18,investing,Me too but i painted my bathroom a different hue cause of ice cream. But i love it,gyj0i24,t1_gyiyjrk,[],1
1097,2021-05-18,investing,"""The government"" doesn't necessarily mean they're getting anyone who knows what they're doing to actually do the running of the company. 

Zimbabwe got rid of farmers who had generations of farming knowledge. The government gave the land to people who had no clue about how to run a farm, and then people started starving in what was once called the bread basket of Africa. 

The government won't dismantle the mine, but they may well appropriate their vehicles to some nonsensical endeavor somewhere else. Like: If some politician's nephew wants to try out a truffle farm and decides that trucks are needed, those trucks will be taken from wherever they're available, and if that's a nickel mine - so be it. This example may well happen even without nepotism. If the government decides that nickel isn't what is going to get produced, then the mine will shut down and workers and equipment will be moved somewhere else.

""As long as something can be produced there will be profits"" - this is nonsensical. If that were the case, there would not be a single unprofitable venture anywhere. Just because something is produced, doesn't mean someone will want it enough to exchange something else of value for it.

People run businesses and operations. It seems like you think every operator of any venture is interchangeable, but we have ample evidence that this isn't the case. Farmers in Zimbabwe either know how to run a farm, or they don't. Mining experts either know how to run a mine or they don't. 

Venezuelan oil experts know how to profit off of large reserves of oil, and still the government decides to hand them over to whoever, because ""the (socialist) government"" thinks that people are interchangeable and therefore it makes no difference.",gyj0l6p,t1_gyi33v4,[],1
1098,2021-05-18,investing,"Actually it's been pretty damn awesome for me. The moment they hit $800 I started buying puts and I've made more money on shorting TSLA than the rest of my entire portfolio during the past 4 months.

Even if I jumped the gun and bought em at $750 or $700 id be laughing my way to the bank",gyj0pfh,t1_gyhbcs5,[],1
1099,2021-05-18,investing,"If you're that thorough and meticulous with researching a company you could look for historical reports on currently successful companies like Netflix, Amazon, or Google before they broke out. You may find trends or patterns in all those variables you mentioned that somehow indicate that a company is poised for extreme growth over the long term. This may lead to the next 30,000% stock and viola, Lambo time.",gyj0rre,t1_gyijvyl,[],0
1100,2021-05-18,investing,"We're all guessing. I still think regardless, if you're interested in equities, the inflation will push those valuations up and we'll wash out just fine. It's the people with no real investment exposure who will get squeezed because store prices will go up but wages won't.",gyj0vle,t3_neid4u,[],0
1101,2021-05-18,investing,"Don't you have that reversed? Selling a put is a short position because you owe money if exercised. Buying a put is a long position because you are owed.

https://www.investopedia.com/ask/answers/100314/whats-difference-between-long-and-short-position-market.asp",gyj0whf,t1_gyi49fc,[],0
1102,2021-05-18,investing,"I don't think so, the date at least",gyj120p,t1_gyhb6pu,[],0
1103,2021-05-18,investing,"Inflation due to money printing is unlikely. Inflation due to supply shortages and long term Chinese labor shortages, sure. Housing market crashes are unlikely, considering most everyone just refinanced or moved. Hard for a market to pop when no one is selling. Millenials are still hoping prices come back down, which means that those same millenials will continue buying. 

0% interest rates are all over the place around the world, even negative. Not that crazy. 

The stimulus was a loan on the debt side of the balance sheet.",gyj13ci,t1_gyhjiy2,[],0
1104,2021-05-18,investing,"> He will probably be the first to admit it happens. But time will tell in this case. My guess is that, in 10 years, what Berkshire did with that money will ...

He's going to say it's an occident.

Actually, he's probably not going to say anything at all, it's likely he'll be dead. According to actuarial tables, 90 year old males have a life expectancy of 4 years.",gyj170g,t1_gyi7815,[],0
1105,2021-05-18,investing,"But it's the context around those maths that people don't fully understand. Going into this thread I never would have caught the error because I don't have the context of how put options and their contracts function. Without that context, it really seems like someone just paid a half a billion dollars to bet against 800,000 shares of Tesla - as is my limited understanding of it. But I don't know how those holdings work so my brain just kinda goes ""wow! Big number!"" Until someone explains that there's time limits and expiry dates on them.",gyj19gq,t1_gyiz91n,[],0
1106,2021-05-18,investing,"Dramatically higher? I've seen two prices move up after tracking for the past 24 months: milk-(back to normal, 2016, prices after a long glut), and bread, which rose 25%. That's it so far from the Midwest.",gyj1cgr,t1_gygtqfj,[],1
1107,2021-05-18,investing,"good, it keeps the people on their toes. idk shit though. Is it possible to be more profitable by short selling the stock than buying options?",gyj1csm,t1_gyih5id,[],1
1108,2021-05-18,investing,Still ended better than game of thrones...,gyj1ejc,t1_gyfiqby,[],1
1109,2021-05-18,investing,is the expiration date of these puts also disclosed ?,gyj1ioy,t3_nenw6h,[],1
1110,2021-05-18,investing,"**Hi, welcome to /r/investing. Please note that as a topic focused subreddit we have higher posting standards than much of Reddit:**

**1)** Please direct all **advice requests and beginner questions to the stickied daily threads.** This includes beginner questions and portfolio help.

**2) Important: We have strict political posting guidelines** (described [here](https://www.reddit.com/r/investing/comments/cyee69/formal_posting_guidelines_for_political_topics/) and [here](https://www.reddit.com/r/investing/comments/escewo/temporary_rule_change_what_happens_to_stocks_if/)). Violations will result in a likely 60 day ban upon **first instance.**

**3)** This is an open forum but we expect you to conduct yourself like an adult. Disagree, argue, criticize, but **no personal attacks.**


*I am a bot, and this action was performed automatically. Please [contact the moderators of this subreddit](/message/compose/?to=/r/investing) if you have any questions or concerns.*",gyj1kwy,t3_nf05p5,[],0
1111,2021-05-18,investing,"I could care less about wealth inequality and concentration as a mid-class citizen. Honestly, as long as the middle class gets to have 1-2% growth on top of inflation, that's awesome. It's like a free extra $500-1000 a year. 

That said, I do see the effects of wealth concentration in media empires, monopolistic companies, relatively pork-barreled politics, etc.",gyj1l87,t1_gyhfa8z,[],0
1113,2021-05-18,investing,"It is entirely possible that Chile, as an emerging market, simply does not have enough of the expertise required to operate a mine and profit off the production. 

In that case, it makes sense to outsource the running of the mine to foreign companies. Those are foreign investments by the way - money is coming into the country from abroad in the form of an investment, and those investments pay for the local labor. On top of that, the government taxes the profits from the mine. 

If by ""extraction"" you mean that natural resources are being extracted - well, that's exactly right. I've always found it fascinating how people, especially left-leaning self-proclaimed environmentalists, demand electrification due to it being more climate-friendly, but when you ask them if they'd allow for extracting battery metals, ten times out of ten they say: ""No, you shouldn't build that mine.""

So my question is, naturally, who is going to do without electrification since we need battery and other metals to do the electrification, but if we're not allowed to extract them, that means that everyone will not benefit from electrification and they will thus have to power their society using fossil fuels. 

So left-leaning environmentalists demand something they're absolutely not willing to allow to happen, just so that they can look down on people who they themselves force to use fossil fuels.

It's actually incredibly twisted.",gyj1qmf,t1_gyhjil8,[],0
1114,2021-05-18,investing,"Your submission was automatically removed because it contains a keyword not suitable for /r/investing.  Common words prevalent on WSB, hate language, or derogatory political nicknames are not appropriate here.  I am a bot and sometimes not the smartest so if you feel your comment was removed in error please message the moderators.

*I am a bot, and this action was performed automatically. Please [contact the moderators of this subreddit](/message/compose/?to=/r/investing) if you have any questions or concerns.*",gyj1tg0,t1_gyj1teu,[],0
