,created,subreddit,text,comment_id,parent_id,Organizations,Sentiment
472,2021-05-17,investing,"Yes. It’s funny, leverage was the hot topic on this forum before the March 2020 crash, but hasn’t come up as much since.

Here’s a 2008 paper out of Yale about how leverage can maximize returns over the long term.

https://papers.ssrn.com/sol3/papers.cfm?abstract_id=1149340",gyi1r7w,t3_nepe4z,[],1
473,2021-05-17,investing,Not just a fancier way since with derivatives things can get complicated and confusing. For example you sold calls on TSLA and are now SHORT TSLA calls. When you buy back to cover you’re neutral (neither long/short). Long/short is just your current position. Long = you own the contract or security; short = borrowed or you are on the hook of a contract.,gyi1rih,t1_gyhn71b,[],0
474,2021-05-17,investing,OK thanks!,gyi1s9a,t1_gyi1ej4,[],0
475,2021-05-17,investing,I think the last time we saw his positions there were a lot of Google calls and shares of Google. And this position against Tesla that's gotta be painful to hold onto!,gyi1tyi,t3_nenw6h,[],0
476,2021-05-17,investing,"Which ones are nationalizing industries? 

A few have nationalized healthcare, but outside of that I can't think of anything.",gyi1uh9,t1_gyhzgm4,[],0
477,2021-05-17,investing,The bank stocks also rose significantly after Michael Burry placed his short bet in 2008. Just because he didn’t get the timing right doesn’t mean he was wrong.,gyi1x0l,t1_gyhc5ma,[],0
478,2021-05-17,investing,"Socialism or leftwing? There is a big difference between the government owning all businesses and say a progressive tax plan + laws applying to rich people as well as average Joe's. The ""risk"" of seeing a modern day socialist/communist state rise is to small to count. History doesn't lie...",gyi1xfp,t1_gyhlxox,[],0
479,2021-05-17,investing,I thought people on r/investing were supposed to be smarter than r/wsb. Do you know how options work?,gyi1xny,t3_nenw6h,[],1
480,2021-05-17,investing,"**Hi, welcome to /r/investing. Please note that as a topic focused subreddit we have higher posting standards than much of Reddit:**

**1)** Please direct all **advice requests and beginner questions to the stickied daily threads.** This includes beginner questions and portfolio help.

**2) Important: We have strict political posting guidelines** (described [here](https://www.reddit.com/r/investing/comments/cyee69/formal_posting_guidelines_for_political_topics/) and [here](https://www.reddit.com/r/investing/comments/escewo/temporary_rule_change_what_happens_to_stocks_if/)). Violations will result in a likely 60 day ban upon **first instance.**

**3)** This is an open forum but we expect you to conduct yourself like an adult. Disagree, argue, criticize, but **no personal attacks.**


*I am a bot, and this action was performed automatically. Please [contact the moderators of this subreddit](/message/compose/?to=/r/investing) if you have any questions or concerns.*",gyi1yae,t3_netzay,[],0
482,2021-05-17,investing,The comment before is implying shorting TSLA = shorting shares. There are a lot of ways to short a company.,gyi1z2z,t1_gyhsiub,[],0
483,2021-05-17,investing,"Tesla reminds me a lot of Apple.  Seen as a status symbol, over priced for what it is, protective of their product by legislating against right to repair or making their product intentionally difficult to repair, lots of competitors which offer just as good similar products for cheaper but have less ""status symbol value"".

Yet, Apple is now one of the richest companies in the world and shows a significant portion of consumers care more about marketing and brand recognition than price and performance.  

I have the feeling that Tesla will survive and essentially be the Apple of the EV market.",gyi1zje,t1_gyhrfx1,['AAPL'],1
484,2021-05-17,investing,What relation does this have to their choice to direct list?,gyi21iz,t1_gyhnz0y,[],0
485,2021-05-17,investing,"Your submission was automatically removed because it looks like you are asking for advice which belongs in the [Daily Advice Thread](https://www.reddit.com/r/investing/about/sticky?num=2) stickied at the top of the subreddit. I am a bot and sometimes not the smartest so if you feel your comment was removed in error please message the moderators.

*I am a bot, and this action was performed automatically. Please [contact the moderators of this subreddit](/message/compose/?to=/r/investing) if you have any questions or concerns.*",gyi21oz,t3_netzwa,[],1
486,2021-05-17,investing,actually last year tesla cost shorts billions and billions of dollars.,gyi25tf,t1_gyhc2yt,[],0
487,2021-05-17,investing,"Important to remember that the reason VW is so into EV's because they were forced to pay billions in fines due to the ""clean diesel"" scandal. And those fines manifested in VW paying for the electrify America network. So they are very invested in it succeeding. Not that that is any reason to root against them, but still feels important to remember their motivations",gyi29um,t1_gyhvicp,[],0
488,2021-05-17,investing,"Quite the interesting day today, with the ATT dividend cut.  
I hold some, and it dove. But I have some hedge, in that I wrote some CCs on my position.  
But it dove due to capital flight from many of its owners desiring safe dividend yields, which it no longer has.  
Where did they go? Well some of them went to the next best choice on the aristocrat list, XOM, up 2.3% on the day.  
It is my good fortune to be holding XOM as well, indeed 4 times as much as I hold T.  


As a consequence, when I entered my portfolio values into my database software as market close today, my total portfolio values exceeded $1,000,000, for the first time ever, today.  


Sure, I was worth more than that already, as I have money in bank accounts and property and the like, but this is a milestone. I feel a little awed and scared.   


Anyway, if I can do it, you guys can too. Just stay the course. Cheers!",gyi2b0r,t3_neb5lg,[],1
489,2021-05-17,investing,"I seriously wish someone told me this earlier. Just submitted my SF and Ive got some usage in my history, so I know its gonna be a pain.",gyi2ec1,t1_gyhkany,[],0
490,2021-05-17,investing,"shorting is distinct from buying puts, no?",gyi2ekb,t1_gyhsqkh,[],0
491,2021-05-17,investing,"i meant that people always say that ""i knew it was going to go down from here"" but with no actual analysis as to why

at that point youre just gambling

im sure burry didnt just say ""oh i thnk its going down from here, let just throw half a billion dollar at it""

he probably siffed through tons of research before pulling the trigger",gyi2ga4,t1_gyhucqx,[],0
492,2021-05-17,investing,nope,gyi2io8,t3_net1s9,[],0
493,2021-05-17,investing,"Funny how ""Pro business"" usually jst translates to ""Pro corruption"" by giving deals to whoever pays the best. Same applies to USA, the market has given lower returns during a ""Pro business"" president then the other party. Almost as if cutting taxes isn't the best wya to help businesses, getting people educated/working is.",gyi2jsz,t1_gyhhblp,[],0
494,2021-05-17,investing,Indeed. I hate bears and I never short. But sure this time I'm shorting the hell of TSLA even if I loss big.. no mercy for this clown,gyi2l7x,t1_gyhb3gs,[],0
495,2021-05-17,investing,"Lol what? It'll probably be a party for another 20 years and then when he is about to retire, itll blow.",gyi2m9u,t1_gygzqk9,[],0
496,2021-05-17,investing,"Your submission was removed because it is a short post. Any self-post below 400 characters in the body will be removed.  Please refer to rule 6 and make sure your post meets our standards of effort. Automod evasion will be met with a lengthy ban. Do not post just an article; highlight the parts of the article you find relevant or offer some commentary surrounding the article. Self-posts that offer some simple thoughts or questions like ""what do you think"", ""here's my thoughts"", etc. belong as comments to existing posts or the [Daily Advice Thread](https://www.reddit.com/r/investing/about/sticky?num=2).

*I am a bot, and this action was performed automatically. Please [contact the moderators of this subreddit](/message/compose/?to=/r/investing) if you have any questions or concerns.*",gyi2qt1,t3_neu42e,[],1
497,2021-05-17,investing,"The short answer is it doesn't matter, the semi conductor shortage is more about manufacturing capacity then a shortage of any one chip.",gyi2sou,t1_gyhz5ph,[],0
498,2021-05-17,investing,you dont know wsb,gyi2uqo,t1_gyh983t,[],1
499,2021-05-17,investing,Mods here work hard to keep this space focused and relatively meme and shitpost free. They also seem to have a difficult time keeping their egotism out of the frame. I thought the mod might be taking it out on the users but it appears that /u/th3cr1t1c has a generally combative comment style.,gyi2ywr,t3_nesiea,[],0
500,2021-05-17,investing,This isn’t current btw.,gyi32c2,t3_nenw6h,[],0
501,2021-05-17,investing,They aint raising nothing. He is praying inflation is transitory.,gyi33d5,t1_gyhjiy2,[],1
502,2021-05-17,investing,"But if said companies leave wouldn't they create a vaccum for a new business, even government run, to take over?



It's not like a company will dismantle their mines (lol) or take their vehicles with them as they ""flee the red scare"". And if rich people leave it still means plenty of ways for other people to take their place. No one gets rich in a vaccum, as long as something can be produced there will be profits. The only threat is, as always, incompetence and nepotism but taht happens in the US as well (Donald Trump, and his long list of failed businesses and bankruptcies comes to mind)",gyi33v4,t1_gyhhj02,[],0
503,2021-05-17,investing,"When interest rates rise, bonds in general drop in value.",gyi368j,t1_gyhvjhq,[],0
504,2021-05-17,investing,"How do you know? He bought put contracts and we don’t know when he bought them (other than  in the first 3 months of the year), what price he bought them for, what strike, etc.",gyi36f9,t1_gyh5d8m,[],0
505,2021-05-17,investing,Securities fraud is a federal crime.,gyi36qu,t1_gyi15ez,[],0
506,2021-05-17,investing,"We are not a news or even an economics sub, unless your question directly ties to investing it will be removed",gyi380u,t3_nesiea,[],1
507,2021-05-17,investing,"Right, being long a far itm put option is the equivalent of shorting 100 shares.",gyi38d2,t1_gyhcngw,[],1
508,2021-05-17,investing,"I'm not particularly against the idea, and I'm surprised how pessimistic the comments have been so far. I may find myself deciding on the size of my mortgage/down payment soon, so I've had to address the topic for myself. Personally I'm not sure I could get 2.75% on my investments right now, and as has been pointed out, at least for the time being, you can get better rates on leverage elsewhere. That said, having a big mortgage with a low fixed rate that is going to be eroded by inflation over the next few years is advantageous. I'd say invest the money conservatively and you will probably come out ahead. For me, if there was a way to leave the money in the house for now but to lock in the rate (HELOC?) that would be my preference. Then I could sleep well at night but still be prepared to jump in on a major correction.",gyi38s1,t3_net1s9,[],0
509,2021-05-17,investing,Is he another alien? Something wrong with his eyes,gyi3a97,t3_nenw6h,[],0
510,2021-05-17,investing,I need to see him fight Cathy wood now,gyi3aj5,t1_gyh6h84,[],1
511,2021-05-17,investing,I could not give you advice. But I was in a similar situation. My husband and I have been paying our house for 12 years. When we purchased our rate was 5.25% After some research refinancing was a no brainer our new rate is 2.99%. The house is valued at more then double what we owe and so we could have also taken out equity. In the end we could not decide what we would do with the funds and like the other comments i’ve read buying an income property would be tough since house prices are high right now. And using the money for investing is too high a risk for us.,gyi3al2,t3_net1s9,[],0
512,2021-05-17,investing,"In a direct listing, no new shares are created. The shares sold from a DPO comes from current investors, so the money goes to the individual, not the company. In an IPO, new shares are created and funds go directly to the company. A DPO is good because it doesn't dilute the company and helps value the company on open markets, while letting the public get a piece of the company. An IPO is good because it provides new capital for the company to expand, pay off debts, etc. in hopes of becoming a stronger company.",gyi3bg2,t1_gyi21iz,[],0
513,2021-05-17,investing,"when you print 1/5th of all American dollars in 1 year, I think you can expect a large movement incoming.",gyi3e2u,t1_gygbtwa,[],0
514,2021-05-17,investing,And last time I checked he won,gyi3ez2,t1_gyh81h0,[],1
515,2021-05-17,investing,"This is a community focused post, and  has to do with the state of the sub. 

Because you're the mod in question, it might be better from an optics standpoint for you to bow out, and have another mod address this post.",gyi3ovr,t1_gyi380u,[],0
516,2021-05-17,investing,"I can’t tell from the article whether they are making new shares though. It seems like loan notes that pay a coupon, which are optionally (at their discretion) convertible to shares",gyi3phr,t1_gyi3bg2,[],0
517,2021-05-17,investing,Ok interesting. I was thinking they do margin lending and other ways to generate revenue on my assets.,gyi3qki,t1_gyhnz7r,[],1
518,2021-05-17,investing,I can't believe in Tesla until they a) make money and b) off of their cars.,gyi3s4z,t3_nenw6h,[],0
519,2021-05-17,investing,$1.12 now...,gyi3u4d,t1_gyhuqxt,[],1
520,2021-05-17,investing,The federal reserve is lending money to banks at 0% this in turn leads to banks loaning out money to persons (not at 0%) but at a rate near 0 in order to stay competitive among other money lenders.,gyi3x5t,t1_gyi1hpb,[],0
521,2021-05-17,investing,It’s cause the warranty’s are about to start running out and the real cost come out.  People will not be staying,gyi3xd2,t3_nenw6h,[],0
522,2021-05-17,investing,"So, he is betting that market wont crash?",gyi3xsk,t1_gyhx81x,[],0
523,2021-05-17,investing,did you check out the new mercedes electric auto? so classy and you can drive it up to around 700km with full battery. Germans are coming steady and strong again :D,gyi3ynr,t1_gyhos3y,[],1
524,2021-05-17,investing,I could imagine America doing this.,gyi3zfa,t1_gyfjaf8,[],0
525,2021-05-17,investing,All very likely things haha,gyi40dz,t1_gyhwsqv,[],0
526,2021-05-17,investing,What did musk do to manipulate the price? I don’t pay attention to crypto,gyi41rr,t1_gyhs60m,[],0
527,2021-05-17,investing,">the ""clean diesel"" scandal

That's only a thing really in the US market where they cheated the test, and the US is a tiny portion of their sales. Rest of the world doesn't really give a shit.

I'm not excusing them, they deserve to get fucked for that but that's also important to take into account.",gyi43bu,t1_gyi29um,[],1
528,2021-05-17,investing,Message the mods if you disagree with the removal.  I will not contest their decision but this wasn't a judgment call. This is meta and it very clearly violates the rules regarding content relevant to investing and investors.,gyi46gi,t1_gyi3ovr,[],0
529,2021-05-17,investing,That’s *Dr.* Michael Burry to you,gyi47li,t3_nenw6h,[],0
530,2021-05-17,investing,"[/u/th3cr1t1c](https://www.reddit.com/u/th3cr1t1c) just deleted my post. If that's not an indictment of his abuse of mod privileges, I don't know what is.",gyi492u,t1_gyi2ywr,[],1
531,2021-05-17,investing,It's a pocket change for them.,gyi49f4,t1_gyi1drb,[],0
532,2021-05-17,investing,Nope. You gain a short position by buying puts. I know what you're trying to say but shorting the verb is used to describe both things.,gyi49fc,t1_gyi2ekb,[],0
533,2021-05-17,investing,"ive made 3x my salary in less than 1 year. Ill take it, no risk no rewars.",gyi4a7p,t1_gyi0cjm,[],0
534,2021-05-17,investing,"I’m inclined to agree with him. Tesla is massively overvalued in the public market, and Elon’s recent shenanigans with him manipulating Crypto shows he’s open to do anything to keep the gravy train going for as long as possible. That to me shows desperation and insecurity. If he believed so much in Tesla there’d be no need to manipulate the market as much as he has already. Just my two pennies.",gyi4ayz,t3_nenw6h,[],0
535,2021-05-17,investing,"Generally speaking:

Long term bonds > stocks >= intermediate bonds >>>>>>>>> short term bonds

But in today's context where high valuation are a consequence of negative real yields, stocks have never been so sensitive to interest rates as today.",gyi4equ,t3_neo8g0,[],1
536,2021-05-17,investing,shill,gyi4hr5,t1_gyhubu8,[],0
537,2021-05-17,investing,He also has about $161 million $FB calls.,gyi4imy,t3_nenw6h,[],0
538,2021-05-17,investing,"Weapons may be an understatement.  They sell highly engineered killing machines of the highest quality.... now what does that have to do with ""profiteering off killing civilians""?",gyi4p4t,t1_gyhmkg4,[],1
539,2021-05-17,investing,*<Michael Burry furiously taking notes>*,gyi4q12,t1_gyh5d6c,[],0
540,2021-05-17,investing,Big Worm,gyi4q1q,t1_gyhd137,[],0
541,2021-05-17,investing,"Even though I'm not a pro options trader, but I do know some of the basics, and some people here are literally clueless about how options work.

* there's a difference between notional value and the actual price he paid for these put options. the 530 million is very likely the notional value of these puts, not the price he paid. unless Burry has some secret undisclosed positions, look at his 13F, his whole portfolio is worth less than 200 million. 
* when buying puts, the puts with a lower strike price will be less expensive than the higher ones. for example, stock price is 100$, puts with a strike price of 105$ will be priced higher than those with a strike price of 95$.
* Burry most likely made a bet here, so the chances he bought puts at a strike price higher than the then actual price of Tesla is very unlikely. He probably bought OTM puts options which are less expensive, thus the price paid for this position is somewhere between 1 million and 25 million (it's a long range bcuz we can't be sure about the exact price he paid), depending on the puts maturity and other factors, but it's definitely not 530 million. 
* if you do 530000000/(8000\*100)=662.50, chances are that these puts have a strike price of 662.50$. This is more or less an average, since if you look at TSLA options chain, there's no strike price of 662.50, thus Burry might have bought puts with several different strike prices. the 530 million notional value is probably also an average of the notional values of the puts.
* these puts were bought when the actual price of Tesla was way above the average strike price of 662.50$, i.e. in the 700-800$ range, and given today's price, Burry already ""most likely"" made money on these puts. 

As I said I'm not a pro options trader, I might be wrong, correct me constructively, not by saying I'm a dumbass lol.",gyi4rjl,t3_nenw6h,['TSLA'],0
542,2021-05-17,investing,Isn't Tesla unique in that every employee there has an opportunity to get some pay in stock? Could have sworn I read about janitors becoming millionaires there because of the stock purchase plan they offer to everyone.,gyi4y5y,t1_gyhxa1v,[],0
543,2021-05-17,investing,note hes been mod for less than a month... youngest account of all the mods...,gyi4z6r,t1_gyi492u,[],0
544,2021-05-17,investing,"Your submission was automatically removed because it looks like you are trying to post about non mainstream cryptocurrency. Unless your post is incredibly significant to the world of investing it likely belongs in another subreddit. If you feel your submission is incredibly significant to the investment world please message the moderators.

*I am a bot, and this action was performed automatically. Please [contact the moderators of this subreddit](/message/compose/?to=/r/investing) if you have any questions or concerns.*",gyi4z7e,t3_neui0s,[],1
545,2021-05-17,investing,Essentially betting against the electric car. Good luck. He'd probably do better betting again big oil in the long run.,gyi57ww,t3_nenw6h,[],0
546,2021-05-17,investing,ok. the way i understand it is different.,gyi590s,t1_gyi49fc,[],0
547,2021-05-17,investing,"Exactly, he's not trying to lower the price of the stock, he's just betting that the stock price goes lower.",gyi5dyf,t1_gyhpqc6,[],1
548,2021-05-17,investing,"I have sympathy with this view, having been burnt by ICLN (was the star of my MF and ETF only portfolio for 2 years, Biden admin was seen as a positive event, and since then it is clusterfuck.)",gyi5hu1,t1_gyhlnvj,[],1
549,2021-05-17,investing,"Twitter. 

Legally speaking there’s a big difference between a kid on Reddit telling you to buy something, and a billionaire who is HEAVILY invested in what he’s telling you to buy, and has the reach to actually influence the market to act.",gyi5igr,t1_gyi41rr,[],0
550,2021-05-17,investing,I'm not finding anything saying their dividend is cut...link?,gyi5iph,t1_gyi2b0r,[],1
551,2021-05-17,investing,"This makes a lot of sense if they believe their stock is overpriced. Why not give more bags around, plenty of them currently anyhow :)",gyi5kcs,t3_nercxl,[],0
552,2021-05-17,investing,Yeah think that’s the best way. Spin off companies tend to do better than the companies that spin them off historically anyway. T itself was once a spinoff of itself.,gyi5kmv,t1_gyh5j0g,[],0
553,2021-05-17,investing,"**Hi, welcome to /r/investing. Please note that as a topic focused subreddit we have higher posting standards than much of Reddit:**

**1)** Please direct all **advice requests and beginner questions to the stickied daily threads.** This includes beginner questions and portfolio help.

**2) Important: We have strict political posting guidelines** (described [here](https://www.reddit.com/r/investing/comments/cyee69/formal_posting_guidelines_for_political_topics/) and [here](https://www.reddit.com/r/investing/comments/escewo/temporary_rule_change_what_happens_to_stocks_if/)). Violations will result in a likely 60 day ban upon **first instance.**

**3)** This is an open forum but we expect you to conduct yourself like an adult. Disagree, argue, criticize, but **no personal attacks.**


*I am a bot, and this action was performed automatically. Please [contact the moderators of this subreddit](/message/compose/?to=/r/investing) if you have any questions or concerns.*",gyi5l2r,t3_neum2q,[],0
555,2021-05-17,investing,I like your comment. Taxes are no bueno. Here come the “but muh roads” horde of people.,gyi5nn4,t1_gyfwoaq,[],0
556,2021-05-17,investing,"I don't want to crush the idea here nor have I done any real research into this, but as a developer who has worked for years in software consulting, mobile app development is considered a rather unattractive business.

Like web development, the entry bar is set very low because most apps are (or start out as) really simple. In this segment, you get low prices and you compete with tons of students, freelancers and local small businesses, all of which are perfectly capable of getting the job done. Being at a social occasion and hearing ""I have an idea for an app"" is a meme among programmers, and there are many who have built apps for local businesses. It does not scale up well.

With larger projects, most companies that have critical exposure to their customers via their apps either have de facto body leasing agreements with their preferred software consultancy or a standing in-house development team.

You may be able to find a software consultancy that does a lot of app development, but a pure play is unlikely. Often, mobile development is just a side show for them, and the real money is in ERP, CRM or custom enterprise development.",gyi5ofe,t3_nesfc2,[],1
557,2021-05-17,investing,"true, but its kinda weird that the chinese ones are built better",gyi5ons,t1_gyhrfx1,[],1
558,2021-05-17,investing,So I could get a close to 0% loan right now?,gyi5p2b,t1_gyi3x5t,[],1
559,2021-05-17,investing,it’s against WSB rules to even make posts about crypto,gyi5q1z,t1_gyhuuym,[],1
560,2021-05-17,investing,No one is going to lie on their regulatory filings,gyi5rkv,t1_gyi15ez,[],0
561,2021-05-17,investing,Wait is this /r/2007scape,gyi5ryy,t1_gyhqdzc,[],0
562,2021-05-17,investing,Anddd. He's right again despite an entire internet of talking heads laughing at him. What else is new.,gyi5s7r,t3_nenw6h,[],1
563,2021-05-17,investing,Misinformation is in session on /r/investing lately. Ridiculous I had to scroll down so far to find this.,gyi5sc4,t1_gyhrq66,[],0
564,2021-05-17,investing,"If you're close to expiry, then yes that's the case. However, there were no deep in the money puts available with close-in expirations when TSLA was at $900. You had to go out to Jun 2023 and stuff like that. When you do that, you're paying for time value so your delta is nowhere close to .9 or even .6.",gyi5t9k,t1_gyhrer0,[],0
565,2021-05-17,investing,I don't doubt it is. But there are different rules for them.,gyi5tni,t1_gyi36qu,[],0
566,2021-05-17,investing,"What do you think is the main motivation of voters and eventual outcome? 

I could see 2 things that could change from the Pinochet era constitution: 

1) Less police/government powers and greater guarantee of social liberties
2) Less economic liberties and more wealth redistribution

The former may be a net positive economically, the latter may lead Chile down the Argentinian path of populism and perpetual economic decline. Which one will it be, or both?",gyi5v1v,t1_gyhigxs,[],1
