,comment_id,created,parent_id,subreddit,text,Organizations,Sentiment
200,gzc4okl,2021-05-25,t3_nkbmpp,stocks,Looks good in the long term but I’m taking a Pump and dump stance for the next few days. Will come back in < $20.,[],1
201,gzc4ou0,2021-05-25,t3_nk5zl6,stocks,How do you calculate price in 5 years with p/e etc?,[],1
202,gzc4pjg,2021-05-25,t3_nkckz8,stocks,"This is such a lazy spam.   

If you want to argue for a specific stock by all means post a DD, explain the stock's story, argue why you're into it as a business but this garbage ain't anything. ""Triangle forming,"" ""Uptrend ,"" ""Breakout,"" etc. Might have well post a bunch of rocket emojis for all it is worth.   

Technical analysis is just astrology for stock bros.",[],0
203,gzc4r54,2021-05-25,t1_gzc4iqu,stocks,Definitely!,[],1
204,gzc4tp8,2021-05-25,t3_nkchix,stocks,"I have a mix of dividend stocks, small caps, and growth stocks.  Since I tend to trade a few times a year and in the market for long term, there will be years where one of the buckets is higher or lower than the rest. Even professional wealth managers will advise to keep stocks for 3 to 5 years at min. to track performance.",[],1
205,gzc4u5a,2021-05-25,t3_nkchix,stocks,"Value stocks pay dividends. Check out the dividend aristocrats and dividend kings. They are not better or worse. You can have a more complete portfolio if you have both. I personally keep a lot of growth stocks but I also have a nontrivial amount in value as a safer bet. To be clear about my generalizations, value stocks can grow, and growth stocks can pay dividends.",[],0
206,gzc4uru,2021-05-25,t1_gz88ure,stocks,Time to rotate to tech,[],0
207,gzc4wht,2021-05-25,t3_nk43rq,stocks,"It’s ok if they overlap for a reason. Just be sure why and know what difference you’re adding.

This, or something similar, is a common portfolio.  Say you’re younger and you want to be slightly more aggresssive and by more growth stocks over value, you can add more in QQQ to achieve that. Get more returns, with more risk, when you don’t have to worry about a crash nearing retirement.

Even though SPY and VTI have many of the same holdings, it also has much more and lots of value stocks, so by adding 5-15% QQQ you’re increasing your exposure to more tech and growth stocks. It’s more volatile, but generally grows faster.

So instead of thinking of it as overlap, I’m using it to make my portfolio a little more risky beyond the S&P 500.

But if that was your intention, you don’t really need NOBL. That’s a lower risk, lower return fund. On the flip side…. Say you keep $20k in your savings account, but want to be able to access another  $40k in safer assets in your investment nets for bad years where there is a crash and lost of a job, the. You might choose to make $40k in investments in bond and low risk equity ETFs, and then everything over $40k follows the strategy you want.

What you could do is buy more small caps and mid caps. I like to keep 10-20% in small and midcaps. The Russell 2000 and the S&P 400 are indexes that will accomplish this. Mid caps over long periods have outcompeted the S&P 500, but tends to be more volatile.

Another thing you can consider is getting SPYG and SPYV instead of SPY and you can balance your own ratio between growth and value stocks. You’ll have to rebalance them over time when one grows more than the other.",[],0
208,gzc4x2p,2021-05-25,t1_gzc4pjg,stocks,"So as a professional:

Fundamental analysis, technical analysis, and mental analysis are all equally important. You’ll never obtain your potential with such negative mindsets. Read something like Trading In The Zone; otherwise keep your negative self destructive nonsense to a minimum - thanks.",[],0
209,gzc4zic,2021-05-25,t3_nkchix,stocks,"I think you just need to stop worrying about value vs growth. Dig into the actual company.  A company can be both if analyzed correctly. 

 I'll use INTC as an example.  Still strong in earnings,  pays dividend,  great balance sheet,  but the consensus is that they lost market share and will continue to do so.  The stock dropped. Nothing fundamentally bad about the company,  and they're reinvesting in increased capacity,  facilities,  expanding in automotive etc. This is not only value,  but dropped into ""growth"" territory.  You can pay about 10x earnings,  3x book and 3x sales. Which is both value,  and you can't buy any peers growth for that cheap.  

Now I'm not saying go but intc,  not was this the intent.  I used this as an example of how your can dig into everything about a company first,  look at the stock price last,  but rather than being caught up in value or growth,  find a fit for both.",[],0
210,gzc50ur,2021-05-25,t1_gzc1od4,stocks,Entirely new leadership team.,[],0
211,gzc516q,2021-05-25,t1_gzc4ou0,stocks,You multiply the estimated growth rate with the TTM and then you multiply the result with the P/E,[],0
212,gzc51z8,2021-05-25,t1_gzard8p,stocks,You guys are making profits?,[],1
213,gzc56xk,2021-05-25,t1_gzc516q,stocks,Ahh. Ok. Thanks for explaining,[],0
214,gzc5d4r,2021-05-25,t1_gzbajol,stocks,"What if you freeze water, is it wet?",[],0
215,gzc5fbu,2021-05-25,t1_gzc3i2n,stocks,Such a negative subreddit. I regret posting this.,[],1
216,gzc5hvk,2021-05-25,t3_njtw5g,stocks,"I’m curious if anyone here uses any subscription based (or free) stock advisor such as the Motley Fool premium. I was inspired to do some research by [this post analyzing the MF service](https://reddit.com/r/stocks/comments/n2hzd3/i_analyzed_all_the_motley_fool_premium/). Disregarding the clickbait, the MF picks seem decent - the post claims MF picks’ average returns beat the S&P returns by 2-3x, which might not be saying a lot, but better than I could do myself. 

I am very new to all this, and I like the idea of having this sort of a “mutual fund” through MF (or other service). Would this be better than just say buying QQQ every month (disregarding the risk of not being diverse)? 

Call me an idiot if I’m very wrong about something, but I also appreciate any advice!",[],0
217,gzc5j58,2021-05-25,t1_gzc1pmn,stocks,"Rather go with KAR, and EVERI. Both actually making money.",[],0
218,gzc5m7w,2021-05-25,t3_nkcawx,stocks,Google it.  Read the reviews on each.  I have not traded forex.,[],0
219,gzc5oi8,2021-05-25,t1_gzc3rq1,stocks,"Best bet on it potentially getting close again is honestly probably going to be just before earnings and that's not going to be for a while (July).

Don't think it's happening any sooner with the way this is going here and I would be looking for earnings to be front run (this goes for all of the big tech companies) as long as things are still on good terms then.",[],0
220,gzc5rgl,2021-05-25,t1_gzc11ar,stocks,"Vanilla is a good word, it's not bad. I have access to a prime account anyways and aside from the headliners the Hannibal movies and some of the campy horror movies are things that I'd watch again. It provides more days of the year where I can flip through and find something to watch on Amazon, and maybe makes me more likely to cut Neflix which I don't use that much anyways.",[],0
221,gzc5uar,2021-05-25,t1_gzbk0p4,stocks,Lock in short term taxes on every dollar of gain! Sweet!! /s,[],0
222,gzc5x7x,2021-05-25,t1_gzc50ur,stocks,VirginGang 🍒,[],0
224,gzc6518,2021-05-25,t3_nk0anz,stocks,Off topic. I miss the Apple Pay deposit TDA used to allow before the merger. Wish they brought that back.,['AAPL'],0
225,gzc66hc,2021-05-25,t1_gzbbjeh,stocks,"Yeah it seems to be working and it's hard to say for sure how much streaming vs faster shipping keeps people paying the monthly fee. And the fact that people are already subscribing makes them more likely to buy more stuff from Amazon as opposed to somewhere else. 

The business model clearly isn't broke, and this is just a marginal move considering.",[],0
226,gzc66ss,2021-05-25,t3_nkcvvm,stocks,Invest them in Ameren DRIP program. $AEE,[],1
228,gzc6a59,2021-05-25,t3_nkc3fe,stocks,Moratorium on Covid protected mortgages expires on June 30.,[],1
229,gzc6av9,2021-05-25,t1_gzahrnh,stocks,"That’s exactly my strategy, 280k invested. MSFT and GOOGL seem okay to me. lol.",[],1
230,gzc6bmw,2021-05-25,t1_gzc44p0,stocks,In my opinion the best plays are clinics for near term revenue. In particular Novamind (NVMDF) is already making significant revenue via Ketamine therapy along with Transcranial Magnetic Stimulation and other unique therapies. There is a whole sub about it at /r/ShroomStocks,[],1
231,gzc6c1e,2021-05-25,t3_nkcxbv,stocks,Yep,[],0
232,gzc6cem,2021-05-25,t3_nkchix,stocks,"Everything was on fire in 2020 it's hard to use last 12 months as a barometer 

But the idea is growth is quick money indeed",[],0
233,gzc6gaw,2021-05-25,t1_gzc5fbu,stocks,"You will look back on this post one day and laugh. Nothing is wrong with your excitement for your gains, if you left it that people would be positive. Especially since it involves cat toys. 

It's the second part where you arrogantly declare you have mastered the market in a week, you can see that rubs people the wrong way.",[],1
234,gzc6hpq,2021-05-25,t1_gzc6a59,stocks,"Not sure how thats a factor? Just asking 
These aren't federally backed  mortgages..

Just trying to understand",[],0
235,gzc6hww,2021-05-25,t1_gzbip4v,stocks,Taking a pretty big swing with Wheel of Time and the new LotR series.,[],1
236,gzc6hz7,2021-05-25,t3_nkcxbv,stocks,Did n e 1 explain?,[],0
237,gzc6i26,2021-05-25,t3_nkcvvm,stocks,"Personally, the only etf I would keep there is SCHD, as it is the only one that I think has good growth potential. Otherwise, I would just put money into a total market or all world fund like VTI or VT because from what I can gather, you aren’t looking for a second stream of income so no need for lots of dividends",[],1
238,gzc6j2u,2021-05-25,t1_gzc6c1e,stocks, Yep? Head in’ 4 a crash?,[],0
239,gzc6jq2,2021-05-25,t1_gzc4cou,stocks,"RemindMe! 2 years ""yeet""",[],1
240,gzc6k5c,2021-05-25,t3_nkcvvm,stocks,"Maybe sector based ETFs.

There are 11 sectors, figure out which ones you like and pull the trigger.

All of mine have a good return for the last couple years and they all pay dividends.",[],0
241,gzc6l76,2021-05-25,t1_gzbe8rn,stocks,"Stocks back in the 70s for companies ""so good that price didn't matter"" and people thought no price was too high",[],1
242,gzc6l7j,2021-05-25,t3_nk23fu,stocks,Wasn't there some lawsuit against them by the shareholders foundation? Wondering what the outcome is going to be,[],1
243,gzc6niq,2021-05-25,t3_nk8676,stocks,"whether ur broker does FIFO or not, ur account balance is going to be the same. ur avg cost per share is shown but that's really just a mental figure. if its lower it makes u feel better. if its higher it doesnt really matter because the $ in ur account is stil the same..",[],0
244,gzc6nzu,2021-05-25,t3_nkcxbv,stocks,It's going to crash once my margin call triggers.,[],0
245,gzc6pqy,2021-05-25,t3_nkcxbv,stocks,"Yes. The market crashes and recovers. PE ratio is utterly ridiculous across the board. Stay cash heavy, guard your positions, set tight stops.",[],0
246,gzc6q1a,2021-05-25,t1_gz9g33p,stocks,No. After ipo is was close to $16. That’s where I got in at. Avg is 17.20,[],0
247,gzc6qka,2021-05-25,t1_gza4lue,stocks,Thanks.  I'd rather do fscsx.  Beat the sp500 since 2000.  20% returns last 10 years.,[],1
248,gzc6sxw,2021-05-25,t3_nkcxbv,stocks,Been hearing this for ten years,[],0
249,gzc6ud6,2021-05-25,t3_nkcxbv,stocks,I absolutely expect one in the next few years - or so.,[],1
251,gzc6yk3,2021-05-25,t3_nkcxbv,stocks,do you have the same graphs during the last crash to compare the two?,[],0
252,gzc6ysh,2021-05-25,t1_gzc4x2p,stocks,"A ""professional"" *what*? The OP contains nothing even approaching ""analysis."" It is just pointing and waving, it reads like a low effort stock pump.   

I agree fundamental analysis real, I just didn't find any in the OP, that was one of my complaints.",[],1
253,gzc6z65,2021-05-25,t1_gzbh4oe,stocks,My thoughts as well. It doesn't matter. Only thing that would effect returns is being heavy in tech/qqq.,[],0
254,gzc73po,2021-05-25,t3_nkcvvm,stocks,Buy AMC and hold. Best play in the books right now,['AMC'],1
255,gzc77rj,2021-05-25,t3_nkcxbv,stocks,"Yes. We’re heading for a crash. It can happen this week. Next month. Or next year.

Stock market doesn’t have concrete 100% evidence that stock will crash, at least not for general population. A lot of people predict due to past stock market crashes & experience, they can come to conclusion with very good educational “guess”. But no one can tell when it will start, how long it will last, and how much it will go down.

If you’re trying to win a quick money you have to be extremely lucky, and I would not suggest investing in stock market if this is you (any readers) mindset. 

If you’re planning for long term investment, then just keep investing while stock market is going up, and while it’s going down. The idea is that you invested in solid stock(s), ETF, or mutual fund whether it is going down or up.

That’s my recommendation, and you (reader) do what you want with your money. I hope you come out win at the end.",[],0
256,gzc793c,2021-05-25,t1_gzc6ysh,stocks,"Trader - my boy lol. 

I own none of these yet. I don’t pump - I print. Check the stats and go through the historical picks. 

Look stay mad or don’t I don’t honestly care - but to think ONLY fundamental analysis works; when you clearly neglect mental (which is clear in your attitude) analysis and technical analysis to be a purist in just one analysis; is a poor decision.",[],0
258,gzc7f13,2021-05-25,t1_gzbv5ec,stocks,They may not show it but they certainly track it. They have to report an accurate cost basis so the government knows how much profit you owe taxes on.,[],1
259,gzc7gcx,2021-05-25,t1_gzaq3bb,stocks,He said he was making a bet. No one knows what will happen. Not even the PhD economists at the fed. They've said they will change their policy if inflation turns out to be persistent and they're.juat going to follow the data. I agree with jpowell and I think inflation will be transitory but that's just a projection. We have to wait to see what happens.,[],0
260,gzc7ge8,2021-05-25,t1_gz8wtpy,stocks,Oh yea? How’s your game censorship coming along?,[],0
261,gzc7hir,2021-05-25,t1_gzbroa4,stocks,Ever thought of opening a managed account then?...,[],0
262,gzc7hiv,2021-05-25,t1_gzbalu2,stocks,3.1% all meme stonks,[],0
263,gzc7hru,2021-05-25,t1_gzc73po,stocks,What about AMC makes you think that? How was the theater business doing before Covid?,['AMC'],0
264,gzc7hwr,2021-05-25,t3_nkcxbv,stocks,"yes definitely

because i, a random redditor, now apparently have the ability to see the future so you will pull your money out of equities. does that make sense to you?",[],0
265,gzc7iwh,2021-05-25,t3_nk1aqz,stocks,"$TSM price is too low, considering that the company has the technology and expansion roadmap. Yes, they have potential risks such as: water shortage and political tensions but as of now it is still one of the major supplier for tech companies in the world. Definitely a strong buy for me.",[],0
266,gzc7jgt,2021-05-25,t1_gzc7ge8,stocks,"I mean, pretty shithouse?",[],0
267,gzc7k7k,2021-05-25,t1_gzc6jq2,stocks,2 years? No. 20 years? Maybe,[],1
268,gzc7krb,2021-05-25,t3_nkc3fe,stocks,"You need a catalyst.  Refinancing is slowing down because everyone and their dog took care of that in the last 2 years.  Interest rates will go up and it’s assumed that will slow sales.  

To keep the party going a guaranteed COVID recovery might make a new home more attractive to someone looking for an upgrade.  Maybe the moratorium on evictions expiring in states that have one could get an abnormal amount of existing homes on the market.   

But we’re entering the best time of the year for home sales and the numbers aren’t surprising anyone.",[],0
269,gzc7myj,2021-05-25,t1_gzc56xk,stocks,No problem!,[],0
270,gzc7oab,2021-05-25,t3_njtw5g,stocks,What would NPSNY have to do to trade at the book value of their assets? Other than share buybacks.,[],0
271,gzc7pim,2021-05-25,t1_gzc7krb,stocks,Definitely a food for thought that you,[],1
272,gzc7sa4,2021-05-25,t1_gz9os0o,stocks,Has China nationalize any company before? Honest question,[],0
273,gzc7x3d,2021-05-25,t3_nkc3fe,stocks,"Ya, I'm bagholding UWMC too.   Been selling covered calls on it, I should get to even when interest rates significantly drop - which since they are effectively 0, might be a while.",[],0
274,gzc7yij,2021-05-25,t1_gzc7hru,stocks,"Awwww, you lack a little knowledge on wats really going on. Investing is changing, we look at wat a company was, how it held up during hard times and where its going. Adam aaron (CEO) is a genius, he has saved multiple companys from bankruptcy. And wat he has done with AMC along with the retail investors (me) only makes my opionion on AMC and where its goin even more bullish.",['AMC'],0
275,gzc7yul,2021-05-25,t3_nk1757,stocks,"OP got awards for this post. And then deleted his account. 

Me wishing I had awards on my account . -_-",[],0
276,gzc7z1b,2021-05-25,t1_gzc793c,stocks,"> Trader - my boy lol.    

With a Series 7, 57, and a state 63? In which case is it ethical to be posting this? And if not then by what definition are you a professional?    

>  but to think ONLY fundamental analysis works   

I think actual arguments based on facts works. Fundamental by its very nature is a fact based argument, as are DDs, background, filings, competitive landscape and similar. All you're doing is pointing at named parts of a graph and claiming you can spot winners, it is shallow crap.",[],1
277,gzc7z2c,2021-05-25,t3_nkcxbv,stocks,"yep, if you've been following the gme saga on superstonk you'll know shits about to hit the fan. could be worse than 08",[],0
278,gzc7zvt,2021-05-25,t1_gzc6ud6,stocks,It has to. Cleaning house but no one will pay.,[],0
279,gzc80sj,2021-05-25,t1_gzc7x3d,stocks,"The 300 million buyback is helping..
In my opinion it's worth near 10",[],0
280,gzc847b,2021-05-25,t3_nkcvvm,stocks,**This is not financial advice** lol,[],0
281,gzc85i3,2021-05-25,t1_gzar09k,stocks,"All stocks will go down if rates are raised. The PE multiple will contract. In a high inflationary environment money now is worth significantly more than money later. So stocks demand a higher discount value. Prices come down and expected/demanded yields go up. 

But once the crash happens it would be a good time to buy. The expected yield will cause asset prices to inflate at a higher rate.

It's kind of confusing. Why would prices come down if everyone knows prices will go up? It's the time value of money. Money now becomes worth a lot more than money later. 

Not to mention many companies may go bankrupt if they can't afford to borrow debt at high rates.",[],0
282,gzc87tn,2021-05-25,t3_njom8r,stocks,This is normal.,[],0
283,gzc88kg,2021-05-25,t1_gzbt74e,stocks,I can and do buy whole shares of plenty of stock as well as partial. I'm up 50% with it so can't complain too much. I use Fidelity for the other half of my portfolio and have no issues with either one. Call me a sucker all you want but I enjoy making money regardless of what app its on.,[],0
284,gzc8clc,2021-05-25,t1_gzc7hir,stocks,That's what my retirement is.,[],0
285,gzc8dmo,2021-05-25,t1_gzc3wra,stocks,"> There is just no way normal people will be able to go on a BO flight period. They would need astronaut training, astronaut suits etc

Source on this? ""Training"" is one day. If you look at their website, it doesn't seem like there is any actual training done. Why would BO passengers need any special suits that VG passengers don't need? The risk that is mitigated with basic suits is survival during a loss of pressure event, and I'd expect the risk would be similar.",[],1
286,gzc8fmo,2021-05-25,t1_gzc5hvk,stocks,"Most of the MF hate is a reaction to their free clickbait articles. I subscribed to Stock Advisor in my first year of investing and found it to be a great resource. It's more than just a list of stocks to blindly add to your portfolio. What really helped me were the deep dives on companies that helped me form my own research skills. There are also livestreams with MF analysts, guidance updates, forums, etc. 

I ultimately found to it to be more of a learning tool than anything else, which helped me avoid rash decisions based on hype and emotion. On another note, MF has some pretty solid podcasts like Industry Focus. Might be worth checking out a few of those to get a feel for the vibe there.",[],1
287,gzc8hj6,2021-05-25,t1_gzba9dx,stocks,"Thank you so much for your reply! I honestly don't understand all of what you wrote but at least I have a direction for my self study. I think I'm going to have to find a CPA after all. I truly appreciate you sharing all of this information! I feel like I have some direction now! And yes, I really don't like Computershare. Can't wait to get out from them completely!",[],0
288,gzc8ig6,2021-05-25,t3_nkcxbv,stocks,It’ll crash when it 💥 quit thinking of it. Once it happens you’ll know lol,[],0
289,gzc8jvd,2021-05-25,t1_gzc6yk3,stocks,You can see the last two crashes in the graph,[],0
290,gzc8kn7,2021-05-25,t3_njmeaw,stocks,Intelligent Investor by Ben Graham and Mr. Market. Helped me really redefine what stocks are and figure out why I’m buying.,[],0
291,gzc8l2s,2021-05-25,t3_nkd4ew,stocks,What’s the point of this?,[],1
292,gzc8p9v,2021-05-25,t1_gza84ee,stocks,What! I never knew it was zero sub 40k lol.,[],0
293,gzc8qtj,2021-05-25,t1_gzc80sj,stocks,"I'll sell you mine at $10, thats the strike of my covered calls.",[],0
294,gzc8soy,2021-05-25,t1_gzc73po,stocks,"AMC? LMAO. 

Correct me if I'm wrong, but the shares have been diluted 3x since 2019 [(there are 3x more shares now than in 2019 due to share issuance and AMC raising capital)](https://ycharts.com/companies/AMC/shares_outstanding) yet you think it's worth more than it was in 2019? 

The market cap in 2019 was $1 billion but today it's $4 billion...

They don't seem to have made any acquisitions of note [(source 1)](https://www.crunchbase.com/search/acquisitions/field/organizations/num_acquisitions/amc-entertainment-holdings), [(source 2)](https://www.amctheatres.com/corporate/amc-history)

If there hasn't been any significant improvement in the business model from 2019 to now, is the increase in market cap warranted? Are more people watching movies in the theater now vs 2019? Probably not. Does 2022 look better than 2019? Doubtful.",['AMC'],0
295,gzc8ss5,2021-05-25,t3_njmeaw,stocks,"I look for what I feel is a good company with damaged reputation.  The odd thing is, when I talk about investing in these kinds of companies, people always down them and talk about the possibility of bankruptcy.  The reality is, if you invest in a company that is at its best, where do you expect it to go?

During the pandemic I looked at carnival Cruise lines, it had been on a downwards trend prior to the pandemic, but took a beating during the pandemic.  March of last year I invested into carnival Cruise lines, about a month later the stock had already lost about a third of its value from where I bought in, so I bought more... I have achieved about a 200% profit on that stock now, it is close to three times my original investment.  I expect it's got about another 25 to 30% over its current value once it's full up and running again.  I don't expect it to get to his pre-pandemic stock value due to dilution and debt.

I had looked at Boeing a long time ago when the max got grounded. I'm kind of glad I didn't buy into it back then, because it took a long time before the fixed it and started delivering them again.  More recently they had a couple aircraft have their engines come apart in flight. Pratt and Whitney engines.  Pratt & Whitney is a private company, I can't invest in them through stocks. So... I invested in Boeing. It was trading about 250 when I bought into it, was trading at about 350 pre-pandemic.  I expect it to get back up to 350 when things are full up and running.  It drops since I first bought into it, so I buy a couple shares here, couple shares there. It's trading at less than 250 now, but I'm in the positive on it.

Rolls-royce, their premier engine had problems, hollow veins that were cracking.  This one is so cheap it's almost like a penny stock. It seems to go nowhere, hovering right around a buck 50 right now.  I don't expect this to go anywhere short-term, but I do expect it to double over the next two or three years.  So whenever I have extra cash in my portfolio, I buy a few shares.

I'm not recommending any of these stocks, I'm just trying to explain my thought process behind how I invest.

The stocks that I've taken the biggest beating on, namely SPACS, are ones I've heard about through other people, and follow their advice.  I definitely don't know everything, and I'm paying my tuition to learn, but I think I'll paddle my own boat from now on and not follow what other people say.

I don't day trade, I invest for the long haul, and when a stock that I'm in goes down, if I still feel good about its prospects, I buy more.",[],0
296,gzc8tiz,2021-05-25,t1_gzc3ulq,stocks,"> let’s look at the worst case scenario where they cannot make profit, we still got 2 years or more before this company falls apart, let’s talk then.

The moment it becomes clear to everyone that they will never make profit, their stock price will dive down to at or below liquidation price. The stock isn't going to hover around for the full two years for the actual money to run out.",[],0
297,gzc8tmv,2021-05-25,t1_gzc5oi8,stocks,"Flat until 2022 is a very real possibility.

They weren’t kidding about Apple being a savings account...",['AAPL'],0
