,comment_id,created,parent_id,subreddit,text,Organizations,Sentiment
195,gz2njqa,2021-05-22,t1_gz2kmlt,stocks,"That may be true, I remember him saying that.",[],0
196,gz2nk61,2021-05-22,t3_ninbyc,stocks,"Sorry, your [submission](https://www.reddit.com/r/stocks/comments/ninbyc/yo_i_need_some_advice/) in /r/stocks has been automatically removed due to Rule 3:  Low effort.

If you just want to post 1 liners or just want to know everyone's thoughts, then post a comment to our daily discussion thread which are generally stickied or [click here.](https://www.reddit.com/r/stocks/search?q=author%3Aautomoderator+daily+discussion&restrict_sr=on&sort=new&t=all)

If you're wondering **why a stock moved** a certain way, check out [Reuters](https://www.reuters.com/), [Motley Fool](https://www.fool.com/), and **especially** [Finviz](https://finviz.com/quote.ashx?t=spy) **which aggregates the most news for almost every stock**.

If instead you're wondering what a term means, go to Investopedia.com and search for said term there.

Either way come back here to repost with your findings, thanks!

A list of the [rules can be found here](https://www.reddit.com/r/stocks/about/rules/), and if you're new to r/stocks please see the [wiki](https://www.reddit.com/r/stocks/wiki/index) and/or [read this post.](https://www.reddit.com/r/stocks/comments/4x1419/if_youre_new_here_read_this_post_first/)

*I am a bot, and this action was performed automatically. Please [contact the moderators of this subreddit](/message/compose/?to=/r/stocks) if you have any questions or concerns.*",[],1
197,gz2nlu4,2021-05-22,t1_gz238mv,stocks,Have fun flying to Europe in 15 hours at low altitude and low speeds! Meanwhile I will enjoy my jet aircraft that require gas propulsion!!,[],1
198,gz2nofn,2021-05-22,t1_gz231pn,stocks,"I'm guessing you've never seen the Big Short where financial institutions, ratings agencies, and mortgage companies were colluding and packing dogshit MBS's into CDO's and writing them off as triple A's. Definitely no chance that banks could ever lie to the retail investors and cause a worldwide economic implosion.",[],0
199,gz2nqwl,2021-05-22,t3_niiukt,stocks,Genuine question here: Do we think the CCP will allow a company to become “too large” or out compete state run firms? I think the company is A+ but may become a victim of its own success. Thoughts?,[],1
200,gz2nufd,2021-05-22,t3_nin6f2,stocks,BOOOOO ccp,[],0
201,gz2nufs,2021-05-22,t1_gz1wgxu,stocks,Does the post say the week ahead compared to February?,[],0
202,gz2nvtf,2021-05-22,t1_gz22suo,stocks,"Agreed, investing in Chinese companies with current regulations seems complicated to say the least",[],0
203,gz2nxxw,2021-05-22,t3_nilf7d,stocks,"Congrats to Kelly Latimer, my former 418th FLTS colleague!",[],0
204,gz2nyi3,2021-05-22,t1_gz2lui9,stocks,"I realize my comment undermined Chinas achievements a bit with the “the US is the reason” so i fixed it. 
You are right and i agree with your comment, it’s so sad how the world really works. 
They don’t tell ya this kind of shit in school and i think it’s part of the reason why we have so many ignorant people in the US. A lot of people will blindly hate other humans without being able to provide 3 reason for the hatred they feel. 

I wish the world was more united and strived to make our civilization evolve. 
Imagine if there was no countries and humans just worked together. 
We’d probably be in other parts of the universe… have cities under water for potential survival of meteor, etc.",[],0
205,gz2nzv2,2021-05-22,t1_gz1t5p9,stocks,🌈🐻 r fuk,[],1
206,gz2o0yh,2021-05-22,t1_gz1q7kj,stocks,"Apples pe is 25, hardly overvalued. They also have 90 billion dollars cash on hand. Strange to see a company with the metrics trade sideways for 6 months, although it’s probably just taking a breather for it’s next run higher.",[],0
207,gz2o17o,2021-05-22,t3_nin6f2,stocks,Did you talk to the slave laborers?,[],0
208,gz2o4np,2021-05-22,t1_gz1x7sa,stocks,Lol why is this guy getting downvoted?,[],1
209,gz2o52y,2021-05-22,t3_nhoers,stocks,"I'm guessing Monday is going to be at least a mostly red day to be honest. IIRC, most of the first days after monthly options expire have also been red days in the past several months.

Should have a good idea of short term direction though by the time Tuesday ends and I still would not rule out SPX going for the April breakout test.",[],1
210,gz2og5f,2021-05-22,t1_gz231pn,stocks,"It's not that the data is fabricated. It's that the data doesn't take into account dark pools which is where majority of trading is taking place between funds and brokers. So the data you are seeing is incorrect because it is missing a huge amount of data by only taking into account certain trades. There's information about this all over the place and highly respected people talking about it,not just some random user on a subreddit. You should really take the time to understand how all aspects of the market work before investing, you might get burned.",[],0
211,gz2okho,2021-05-22,t1_gz2nofn,stocks,"""They did something bad in the past"" is not evidence that they are doing a different bad thing right now.",[],0
212,gz2ol0i,2021-05-22,t3_nikw11,stocks,What about csl,[],0
213,gz2ompu,2021-05-22,t1_gz2og5f,stocks,show me the evidence for this claim,[],0
214,gz2otqk,2021-05-22,t1_gz1x69a,stocks,He saw some memes,[],0
215,gz2otrq,2021-05-22,t1_gz2h19v,stocks,"China isn’t simply “establishing itself in the world” it’s:

Committing outright atrocities towards its own people (Uyghurs).

Constantly threatening attack of its neighbours (Taiwan, India).

Threatening economic consequences against countries who don’t bow down to it (Australia, Canada - On Twitter a Chinese diplomat referred to the Prime Minister of Canada as “Boy” and called Canada a “running dog”.)

Claiming almost the entirety of the South China Sea which is international waters as party of Chinese territorial waters.

Locking desperate developing nations in to economic servitude with predatory lending via the belt and road initiative (much of Africa, Bangladesh).

Outright hostage taking of foreign nationals (Canadians Michael Spavor and Michae Korvig of Canada, held since 2018 without council in windowless rooms with the lights on 24 hours a day).

That’s just a fraction of what China is up to on the world stage right now. It goes far beyond “establishing itself”, it is outright antagonistic and hostile, and unchecked it will only get worse from here.

This isn’t a China vs. US thing, this is China vs. the World.",[],1
216,gz2owpt,2021-05-22,t1_gz24hko,stocks,Username checks out,[],1
217,gz2oxx2,2021-05-22,t3_niiqns,stocks,"It will likely not be a great year for growth stocks that aren’t profitable yet; which is the type of stocks ARK looks at. If you are an investor and not a trader; the goal for high growth is to buy 10 stocks that could go through the roof and hope just 1 does.  This is what ARK does well; which means ARK is highly unpredictable year to year, but will outperform long term as I believe Cathy is better than most in the hunt to find the future 10+ baggers of the next 5 years.",[],1
218,gz2p153,2021-05-22,t1_gz2lrk4,stocks,That’s what I’m asking ffs,[],0
219,gz2p1tu,2021-05-22,t1_gz2nxxw,stocks,making a stamp in the history,[],1
220,gz2p2fw,2021-05-22,t3_nig1b3,stocks,bro do you get paid to do this??? i really hope so. Thank you for this detailed writeup. i could donate if you have some donation link,[],0
221,gz2p3j8,2021-05-22,t3_nilf7d,stocks,Cathy Wood is a moron,[],1
222,gz2pa7y,2021-05-22,t1_gz2i5i7,stocks,Care to explain why you think that?,[],0
223,gz2pcmo,2021-05-22,t3_nilf7d,stocks,"Hoping my call goes brrrrrrrrrrrr
But if not hoping my put for BRRRRRRRRRRR

Lol… I’m loving strangles these days… don’t care if it moves up or down… just want it to move.  So much less stress…

But seriously… I hope it soars to the moon for everyone… good luck!",[],0
224,gz2phpm,2021-05-22,t3_niiukt,stocks,"I think we have to take bigger picture. I mean, it is not only BABA, it is most of Chinese Stock, just take a look on MOMO, TME, IQ, LX... Probably, the problem is more politic than financial or economic. If there wasn't this political problem, BABA would be at $300 minimum... But who knows, maybe in 1 or 2 years there is a comercial agreement between USA and China and this political problem is over",[],0
225,gz2ptbn,2021-05-22,t1_gz0a5t6,stocks,People are no Homo oeconomoecus. Markets are more psychology than they are Hard facts. Maybe people expected even netter news ? There is so much to consider. I know it doesnt makes sense but think about the psychology.,[],0
226,gz2pvi7,2021-05-22,t3_nikw11,stocks,Just invest in TMO,[],0
227,gz2pvwk,2021-05-22,t1_gz2nhc8,stocks,We'll know in 6 months,[],0
228,gz2px5g,2021-05-22,t1_gyzawii,stocks,"Just put it in a savings account. You’ll lose due to inflation but you’re not emotionally able to handle anything else and will end up losing way more in stocks buying high and selling low. It’s not an insult. Just know who you are and stick with that. There’s no way around it ... Stocks go up and down.  If you can’t HODL during the dump, you don’t deserve the pump.",[],0
229,gz2q0i8,2021-05-22,t3_nikw11,stocks," Interesting, i hadn’t heard of AVTR. Do you think it’s justified that it’s worth 3x as much as last year? Also, not completely related to this post, but what do you think of Ginkgo bioworks? (Going public).

Thank you! Love the insight",[],1
230,gz2q2hd,2021-05-22,t3_ni8fp6,stocks,BABA,[],0
231,gz2q2n0,2021-05-22,t1_gz2mzbi,stocks,"Yes, it's possible. When a stock is hard to borrow and the borrow fee is high then that's a very clear indication that it's heavily shorted.",[],0
232,gz2q3ml,2021-05-22,t1_gyzmixy,stocks,But it is the way,[],0
233,gz2qcf8,2021-05-22,t3_ni8fp6,stocks,MP,[],0
234,gz2qdcm,2021-05-22,t3_nig1b3,stocks,"#I love green
#I hate red",[],0
235,gz2qdtu,2021-05-22,t1_gz1hhix,stocks,He’ll never do it,[],0
236,gz2qi1s,2021-05-22,t1_gz2n3m2,stocks,I use a language learning app and talk to many each day that way,[],0
237,gz2qjtm,2021-05-22,t3_nilf7d,stocks,Only 10 more years until this is affordable to the masses,[],1
238,gz2qk9m,2021-05-22,t1_gz2nvtf,stocks,"And the whereabouts of Jack Ma makes it little bit complicated too.

Hes only been seen one time sins his problem with the goverment and on a very odd video and after that there's only silence..

Maybe in prison  or even dead.. noone knows.",[],0
239,gz2ql1n,2021-05-22,t1_gz1i7so,stocks,"By “feel for the market” he/she means comfortable watching your portfolio tank in the short term. Otherwise, stay on the sidelines and invest in a high performance savings account. That .0001% interest is all you can handle.",[],1
240,gz2qlu7,2021-05-22,t3_niiukt,stocks,Wait did you just try and say you think Alibaba is environmentally friendly?,[],1
241,gz2qm0b,2021-05-22,t3_nilf7d,stocks,To the moon please. My only issue was I didn’t buy more!,[],0
242,gz2qm7u,2021-05-22,t1_gz2nlu4,stocks,"You do realize electric planes are better capable of flying higher and therefore faster, right?",[],1
243,gz2qt1u,2021-05-22,t1_gz2n87z,stocks,"It's not about commercial success or not, it's about the very simple question of which technology is better from a first principle perspective.",[],1
244,gz2qxhw,2021-05-22,t3_nikw11,stocks,"I like Illumina, DexCom, and Align in this sector",[],1
245,gz2qyj6,2021-05-22,t1_gz23m8e,stocks,"I bought some $TSEM a few weeks ago but it’s Israeli/American and hasn’t been doing too well, probably since tech was down and not due to politics",[],0
246,gz2qz6r,2021-05-22,t3_nhoers,stocks,"Did anyone buy Oatly stock? The extent of my due diligence is that their oat milk is always out of stock, but their ice cream tasted bad when I tried it lol",[],0
247,gz2r1ox,2021-05-22,t3_nin6f2,stocks,"This is why I tend to shy away from investing in Chinese companies. I like to be at ease and at least have a solid feelings that what I invest in will do well...because of the CCP I just don’t get that feeling with Chinese companies. In my opinion, baba is in a tough spot...they can grow as a company ...as long as they grow exactly how the CCP wants them to grow.",[],1
248,gz2r3b9,2021-05-22,t1_gz1zr2a,stocks,"I’ve had both for over 10 years. JNJ has performed much better over the long haul.  MRK does pay a better dividend.  MRK has consistently been regarded as a well run company with solid management, strong pipeline, and they haven’t had any serious missteps.  Just keep wondering when it’s going to shine?  Idk....probably right after I finally give up waiting, lol...",[],1
249,gz2r4tj,2021-05-22,t1_gyzmcbo,stocks,LOL this is preposterous. You must not be American.,[],1
250,gz2r78u,2021-05-22,t1_gyzmms4,stocks,"This isn’t useful at all, this guy  is talking about less than 1% of the population",[],0
251,gz2r7uv,2021-05-22,t3_ni2ojk,stocks,"I would not try to change your father’s opinion; you want to be an investor and day traders are not investors.  ETFs are for those that don’t have the interest, brains, experience or stomach for investing in individual stocks as you are buying the good, the bad and the ugly all together for the purpose of being average.  You father will hate the idea of trying to be average has he clearly has what it takes to beat the average himself.

Just explain that ETFs are what’s best for you at this time; that you are evolving as an investor and that your portfolio will be changing as you change and that you appreciate all the advice that he shares with you.",[],0
252,gz2r7w4,2021-05-22,t1_gz1tij4,stocks,I know ?!?!? Someone please tell me why?!?!,[],0
253,gz2r90j,2021-05-22,t1_gz1o8er,stocks,"BLIAQ is up 280% over the past 6 months and 1,000% over the past year",[],0
254,gz2rawk,2021-05-22,t3_ni77cc,stocks,CMI if you want to invest in a great company that touches a little bit of the hydrogen energy sector,[],0
255,gz2rf21,2021-05-22,t1_gz220b8,stocks,"Ah fasho, im happy to oblige u. I'm 21, own a semi successful landscaping business, around 10k in savings, made around 1k off the stock market so far but it doesnt fit my life goals to spend years getting good at trading. Realized that after browsing this sub for a couple months. I'm deaf in both ears but since I got a cochlear implant when i was one I've heard it's very hard to tell from my speech. 

I was drunk last night and believe it or not I was commending y'all on your discipline to stare at a computer screen all day and do math.",[],1
256,gz2rnn3,2021-05-22,t3_nig1b3,stocks,Thank you!! Great read!!,[],1
257,gz2rpr5,2021-05-22,t3_nhz44v,stocks,"I prefer YUM, which owns KFC, Pizza Hut, and Taco Bell",[],0
258,gz2rqg4,2021-05-22,t1_gz2ag2x,stocks,Now guess what HKD is pegged to,[],0
259,gz2rqhg,2021-05-22,t1_gz1y87j,stocks,That's dope I'm glad it's fun for you guys. I'm kinda surprised so many people got upset at me saying the stock market isn't fun for me lol. Was just looking for a discussion on the spiritual side of investing.,[],1
260,gz2rulf,2021-05-22,t1_gz2o17o,stocks,"Yes, they said they are working very hard in order to meet quota for the booming order volumes of western e-commerce 🤡🤡",[],0
261,gz2rxi1,2021-05-22,t1_gz2kz7l,stocks,"He made that play over a month ago, and not a large one.

It's safe. The party isn't going to tank BABA unless Jack Ma steps out of line again.

But they will also manipulate the fuck out of it for their own purposes. No gain in it can be expected or trusted.

You're gambling on what their personal goals for it will be.",[],0
262,gz2s272,2021-05-22,t1_gz212ln,stocks,"> the insane nonsense Cathie said about Tesla 10xing and it actually coming true.

but what's her batting average on *other* stocks? if less than 50% of her predictions come true, you'd be just as successful flipping a coin. 

I've been reading about investing for years, and have never seen anyone else make *specific* predictions like Cathie Wood does. it verges on hubris to say her funds will earn over 20% per year going forward. 

in contrast look at Will Danoff at Fidelity, for one example. he has regularly beat the market averages but *never* makes calls like Cathie does. he'll say ""I think Company X is poised for growth"" or ""Sector Y has been overlooked"" but in 30 can't find that years has never said ""I'll earn 21% next year.""",[],1
264,gz2s36a,2021-05-22,t1_gyz22ha,stocks,I don't think you should count the tech bubble in.,[],0
265,gz2s413,2021-05-22,t3_ni3q1n,stocks,"Not sure if I understand; yet if you are reinvesting the dividend, the dividend will immediately be converted to shares based on the current price of the stock. The cost basis of the shares you already own have nothing to do with it.",[],0
266,gz2s7a2,2021-05-22,t3_nio334,stocks,You should short that redacted stock then on monday morning. Double dog dare you lol,[],0
267,gz2s8gx,2021-05-22,t1_gz225ou,stocks,"My thought was Tesla's share price would stabilize when it entered the S&P 500. someone could scroll back through 6 months of comments if they wanted to find my call on the subject. 

it just seemed like common sense that buy and hold index investors and 401ks/pension funds would tie up the shares in the index and restrict liquidity somewhat.",['TSLA'],0
268,gz2sf0p,2021-05-22,t3_niauog,stocks,That stock has had a rather stupid trade history the past week.  Dropping to sub $6 for a few days then shooting up on Friday.,[],0
269,gz2sibu,2021-05-22,t1_gz0w3nq,stocks,"Do not underestimate how much shit crafters and hobbyists need, and how much they're willing to pay for it.",[],0
270,gz2sifh,2021-05-22,t1_gz2p3j8,stocks,Not really. This isn’t going to be profitable in 5 years. Maybe 10-20 years.,[],1
271,gz2six6,2021-05-22,t3_nilf7d,stocks,pls fly again (after today's successful flight),[],0
272,gz2sm07,2021-05-22,t1_gyzix6n,stocks,">	very difficult to do for accounts that have money continually added to them



I don’t understand how Robinhood is the only one that make it easy to see your actual returns.",[],0
273,gz2sohs,2021-05-22,t1_gz2sm07,stocks,Re-freaking-tweet,[],0
274,gz2t02m,2021-05-22,t1_gz2s7a2,stocks,God I wish I could award you!,[],0
276,gz2t1bc,2021-05-22,t1_gs5y5ml,stocks,Solid advice above I agree..lots of people r yoloing their life saving pliz don't do that. Save some cash for the  monthly needs too.,[],1
277,gz2t2ym,2021-05-22,t3_nie3jw,stocks,I'm skeptical of any ETF with a limited number of holdings that includes Tesla,[],0
279,gz2tb0d,2021-05-22,t3_ni19au,stocks,"Without new forms of power generation being embraced, how else are these batteries being charge than with fossil fuels at the power plants that supply said energy?",[],0
280,gz2tb5u,2021-05-22,t1_gz2t02m,stocks,"Its okay the tendie man is bringing plenty of rewards monday and tuesday. T21 and t35 babaaay. 
Wave bye bye to the rest of the market as it sinks to the ocean floor, if theres any time before out rocket breaks the atmosphere ;)",[],0
281,gz2ticz,2021-05-22,t3_nio8u0,stocks,Maybe [this one?](https://www.amazon.de/Book-Wish-Your-Parents-Children/dp/0241251028/ref=asc_df_0241251028_nodl/?tag=googshopde-21&linkCode=df0&hvadid=427660635519&hvpos=&hvnetw=g&hvrand=9685180211403689904&hvpone=&hvptwo=&hvqmt=&hvdev=m&hvdvcmdl=&hvlocint=&hvlocphy=20229&hvtargid=pla-918485885179&psc=1&th=1&psc=1&tag=&ref=&adgrpid=103245163807&hvpone=&hvptwo=&hvadid=427660635519&hvpos=&hvnetw=g&hvrand=9685180211403689904&hvqmt=&hvdev=m&hvdvcmdl=&hvlocint=&hvlocphy=20229&hvtargid=pla-918485885179),[],0
282,gz2tikp,2021-05-22,t3_nio8u0,stocks,"Speak to them personally and make sure it’s something they want to do first, I don’t think you should force your kids into something that they would not want to do especially of the stratosphere you speak off.",[],0
283,gz2tizf,2021-05-22,t3_nio8u0,stocks,"Trading view has great graphs. 

Factset is an absolute requirement",[],1
284,gz2tkzu,2021-05-22,t3_ni66ut,stocks,"- a mutual fund is a collection of stocks, bonds or other assets. these are ""mutual"" because they're owned mutually by a group of people. 

- an ETF is also a collection of stocks or other assets. the main differences are (1) ETFs trade in the middle of the day like stocks, so the price can fluctuate mid-day, but mutual funds trade only on one price at the end of the day and (2) ETFs will have an additional fee called the ""bid/ask spread"" -- bid is the buyer price, ask is the seller price. there's always a gap even if it's just a penny (but it can be much larger_, and you pay this fee to whoever handles the trade each time you buy/sell. IMO the only major advantage to ETFs is in a taxable account, because they're structured to minimize capital gains taxes. in a tax-sheltered retirement account, capital gains doesn't matter. 

- an index fund is one strategy for mutual fund or ETF investing -- an index tracks a sector of the market and doesn't do detailed stock-by-stock or company-by-company analysis. for example the Russell 1000 is just a list of the largest 1000 companies that trade on the US stock markets. every 4 months, they adjust the list as companies get bigger or smaller. the type of company, or if the company is profitable or not doesn't factor into the list. in contrast there are growth stock funds (companies growing faster than average for their type), or value investing (companies where the stock is on sale relative to the value of the company, like buying a $10,000 car for $5,000). there are sector funds (healthcare stocks, energy stocks), or other strategies. indexing will have lower management fees, and over time it's difficult to beat the averages of the overall market. so there's a wide agreement that most of your investing should be in low-fee funds.",[],1
285,gz2tmdj,2021-05-22,t1_gz2s7a2,stocks,"This post isn’t directly referring to that one stock. People complain about just about any stock that is “supposed to be going up.” The greater fool theory still exists. I made money off of [redacted meme coin] even though it didn’t make sense for it to pump that high. I don’t have a problem with meme stocks. It’s absurd when people claim market manipulation or blame shorts when their stock they want to go up isn’t going up.

I’m not an expert investor. I rather take the time to learn about things instead of blindly believing people on reddit. I never claimed to be an expert. This is basically just a reminder to people who became interested in the markets in January to not blindly believe everything they see.",[],0
286,gz2tmk0,2021-05-22,t1_gz2lb8d,stocks,?,[],0
287,gz2tmtn,2021-05-22,t3_nio334,stocks,"I agree. I think when starting out for the first time, it’s easy to fall victim to memes and hype stocks when you aren’t yet familiar with investing, reading financial statements, how to project future value, etc. Instead, a lot of people are just sticking with their YouTube gurus because they may have made money in an artificially-inflated generational bull run in 2020. 

You won’t even need a market crash for these people to end up bag-holding in the long run. Simply a regression towards the mean will do it. You have to be humble and not be foolish enough to believe “this time is different” and pay unconditional prices for stocks simply because their revenue is growing. And if you have no clue which stocks I could be talking about, you’re probably holding onto some of them.",[],0
288,gz2tniy,2021-05-22,t1_gz2tikp,stocks,Thanks. That's of course a given. But I also need to start putting together a plan to hit the ground running if they want to.,[],0
289,gz2tsvs,2021-05-22,t1_gz2tmdj,stocks,"To that one stock? You know which one im talking about. So yes it is. But heres the thing. I actually wasnt refering to your specific stock. I dont care which meme stock you redacted, they are all similar in back end mechanics effecting them. So go for it. Take your pick and short it",[],1
290,gz2ttwn,2021-05-22,t1_gz2ag2x,stocks,"I believe 1 US share is always directly convertible to 8 HK shares. It makes no difference, which you buy. If US actually delisted, they would probably put up a warning beforehand, and you would have time to convert. Of course the stock would tank overall on that unlikely news.",[],0
291,gz2tu17,2021-05-22,t1_gz2lofw,stocks,Never said they were the same thing. You said steam didn't provide streaming of games which is wrong,[],0
292,gz2tu8r,2021-05-22,t3_nio8u0,stocks,"If this is what they want to do, great. 18, and 21, those are crucial ages for figuring out who they are and what kind of life they want to live. Not everyone wants to waste their lives looking at charts and numbers on a screen. Just my 2 cents.",[],1
293,gz2tvj5,2021-05-22,t3_nio8u0,stocks,"All this shows is what YOU want...so you’re not giving them the freedom to choose what they want to do with their lives? I understand the sentiment, but honestly seems extremely overbearing and forced. But if that’s what they want to do, then go for it 👍",[],1
294,gz2twli,2021-05-22,t3_niiukt,stocks,CCP intervention risk. No thanks.,[],0
295,gz2txzp,2021-05-22,t1_gz1796y,stocks,"Earnings weren’t great + SPAC’s trade like shit for a month after that ticker change. SPAC’s are the kid at school with lice, no one wants to go near them right now and it will take time for it to shake the SPAC tag.",[],1
296,gz2ty3m,2021-05-22,t3_nig1b3,stocks,"I love this. Thank you so much for putting the time and effort into this kick ass DD.  I may not read it all, but it’s awesome to see what good DD and summarized cliff notes look like. 

Someone give this guy more gold!",[],1
297,gz2tzvj,2021-05-22,t1_gz0619y,stocks,"the number of days when there's a major drop AND you're gonna *need* to sell that particular day is so small, it's hardly worth talking about.",[],0
