,created,subreddit,text,comment_id,parent_id,Organizations,Sentiment
756,2021-05-18,investing,"If you don't think stocks are tangible assets that can produce income, I guess I can see why you think it's gambling. But you are wrong about a primary residence. It doesn't necessarily produce income while you are living in it.

I agree that the OP should manage the risk of mortgage default appropriately, but that doesn't mean he should not consider investing before his mortgage is paid off. The poster even mentioned increasing his emergency fund with some of the money before investing which seems prudent. 

You sound like someone who follows Dave Ramsey. Is that accurate or am I off base there?",gyiekhm,t1_gyid0rd,[],0
757,2021-05-18,investing,I'm betting he already cashed out.,gyiembw,t1_gyhosay,[],0
758,2021-05-18,investing,Shorting anything in 2021 seems like a scary bet...,gyienmc,t1_gyh4wys,[],1
759,2021-05-18,investing,It’s not a profit until you sell...40% is an average return day trading $TSLA options,gyiercr,t1_gyh5d8m,[],0
760,2021-05-18,investing,I've got alot of put options on TSLA as well bought in January and TLT puts! Great to see we're on the same page,gyiesu5,t3_nenw6h,[],1
761,2021-05-18,investing,"I have no idea what a Dave Ramsey is.  What I do know, is using loans to invest is a fools game. Archegos Capitol for example.",gyiet97,t1_gyiekhm,[],0
762,2021-05-18,investing,"No it's not, but my point is nobody goes to prison at that level. Case in point 08 financial crisis, nobody who was at fault did any hard time, much less soft time for that matter.",gyieund,t1_gyi6br9,[],1
763,2021-05-18,investing,"Ok that makes sense,  I'll have to dig into how to do the stock loan with my broker,  I have a margin account already.  

I supose I could buy a put option that's lower than todays price then sell it after TSLA stock drops closer to the strike price to capture some value too.  would limit my total outlay and the total risk is paid up front.... since we all know TSLA seems to have a mind of it's own.",gyievsv,t1_gyidbkt,[],0
764,2021-05-18,investing,As if it wasn’t on purpose.,gyieybx,t1_gyi8r7v,[],0
765,2021-05-18,investing,TSLA is a ~600 billion dollar company now.  GME was worth about 300 million when WSB started accumulating.  WSB doesn't have the fire power for TSLA.,gyif452,t1_gyi8iqf,['GME'],0
766,2021-05-18,investing,"I'd disagree with the notion that predicting which way the markets will go is impossible, but I do admit it's notoriously difficult for the majority of people, especially when your own money and emotions are on the line.",gyif6ce,t1_gyh0o4k,[],0
767,2021-05-18,investing,He's betting there will be inflation and that it will hurt small cap growth companies,gyif7e5,t1_gyi3xsk,[],0
768,2021-05-18,investing,"it will take YEARS to run through the population sets.  There are SO many viruses and diseases to be cured.  AT that point.  They might use their revenue for aging/something else etc.  The study/prevention of disease never stops.

  
We look at GILD and say ohhh they cured HVC but the issue is they squandered that HCV money and could cure other diseases.  If they had a platform to cure every virus GILEAD would be worth trillions at this point.  They they would stop growing and basically pay out a divy and start buying smaller innovative companies.",gyif9i2,t1_gh4ljp9,[],0
769,2021-05-18,investing,I'm a Tesla bear but they've actually secured their chip supply chain before this mess,gyifa8f,t1_gyhesov,[],0
770,2021-05-18,investing,"If you can time it right and have conviction that there will be a correction coming, then buy away. Just remember to sell before the market bounces.",gyifdog,t3_nemymh,[],0
771,2021-05-18,investing,Big Perm?,gyifec7,t1_gyi4q1q,[],0
772,2021-05-18,investing,And they have a huge network of dealers. So you have an issue oh guess what here you go. No waiting you talk to a person.,gyifigt,t1_gyi6pq0,[],0
773,2021-05-18,investing,"Ah ok my bad. He just promotes an extreme aversion to debt except for mortgages so I thought you might be a fan.

Archegos was not investing in index funds and a mortgage cannot be margin called. This is not remotely comparable. Do you think investing at all while you have a mortgage is using loans to invest and akin to gambling and a fools game or what? How is that different? If they didn't have equity but had the same amount of stocks, would you recommend them to not take a mortgage but instead sell the stocks to purchase the house as cash? That seems like not the greatest advice to me. Explain to me the difference.",gyifj1m,t1_gyiet97,[],0
774,2021-05-18,investing,What he's doing is on the 13F. They're TSLA puts.,gyiflfg,t1_gyhd04i,[],0
775,2021-05-18,investing,"I just tried to sell 1 share TSLA to see if it'd work, it just says I don't have any shares of TSLA to sell.  I have more than enough margin to buy many shares of TSLA outright.  I'll have to dig around there must be a setting somewhere.  I'm using fidelity",gyifm9l,t1_gyichq1,[],0
776,2021-05-18,investing,"Serious question on stop losses:

Would it be a good strategy to use a script that sets stop losses and immediately places a stop buy order at the same price? Assuming no fees and relatively small position size, you would maintain a constant minimum price so you wouldn't lose out or miss out on the rally.",gyifpbs,t3_neb5lg,[],1
777,2021-05-18,investing,"He bough puts, he didn't sell it short. He doesn't have to buy-back the stock, but his thesis must play out in some finite amount of time.",gyig61d,t1_gyh5d6c,[],1
778,2021-05-18,investing,Seems you need a margin account: https://www.fidelity.com/viewpoints/active-investor/selling-short,gyig68f,t1_gyifm9l,[],1
779,2021-05-18,investing,Name one stock that Musk shit posting about wouldn't impact.,gyigbyb,t1_gyi9snz,[],1
780,2021-05-18,investing,"Everyone sharing this article seems to also be sharing some misinformation. I'm starting to believe it's moreso the article's fault now.

Either way. Burry is way smarter than anyone else I know when it comes to money so he probably knows what he's talking about.",gyigcqw,t3_nenw6h,[],0
781,2021-05-18,investing,"LMT, waiting for a better entry price, its multiple is not going to expand, so its on my radar to add when its out of favor.",gyigf3j,t3_nehv61,[],1
782,2021-05-18,investing,Yes...all the way to the bank.,gyigh6b,t1_gyh8q1r,[],0
783,2021-05-18,investing,USD actually takes a TON of electricity. Far more than Bitcoin.,gyighsr,t1_gyidsj9,[],1
784,2021-05-18,investing,"> No it's not, but my point is nobody goes to prison at that level.

That is definitely not true. Just ask Rajaratnam or Steven A. Cohen's lackeys. People definitely go away for things like financial fraud. 

>Case in point 08 financial crisis, nobody who was at fault did any hard time, much less soft time for that matter.

Unfortunately, the law didn't address a lot of what caused the 08 financial crisis. Leveraging to the gills for risky investments and lending to people who aren't very creditworthy aren't crimes. 

Even if you were correct, you'd still be shaping your opinion using a particular point in time rather than from a vaster data set.",gyigi8a,t1_gyieund,[],0
785,2021-05-18,investing,"He pumped both Doge and Bitcoin, and tanked both, which subsequently caused the entire crypto market to crash to a degree. Id wager there is a very high correlation between Tesla owners/fans/stock holders and people with money in Crypto.

His previous tweets about Tesla being overvalued and $420 private funding secured, shouldve been the biggest red flags to people trusting Elon to not fuck up their investments.",gyigmkg,t1_gyhqmkh,[],0
786,2021-05-18,investing,And how do you know he’s closed the position?,gyigqs9,t1_gyhcmaw,[],0
787,2021-05-18,investing,"Stay away from rare earth , minerals, miners. -comes from the smartest man I know.",gyigqsm,t3_nem9c3,[],0
788,2021-05-18,investing,He's betting interest rates will go up. that's it. There are some that believe a market crash will follow but that is not the crux of his bet.,gyigsxl,t1_gyi3xsk,[],0
789,2021-05-18,investing,jesus take the wheel,gyigtpx,t3_nesoi0,[],0
790,2021-05-18,investing,VT,gyigu9w,t1_gyg1lwf,[],0
791,2021-05-18,investing,"Your submission was removed because it is a short post. Any self-post below 400 characters in the body will be removed.  Please refer to rule 6 and make sure your post meets our standards of effort. Automod evasion will be met with a lengthy ban. Do not post just an article; highlight the parts of the article you find relevant or offer some commentary surrounding the article. Self-posts that offer some simple thoughts or questions like ""what do you think"", ""here's my thoughts"", etc. belong as comments to existing posts or the [Daily Advice Thread](https://www.reddit.com/r/investing/about/sticky?num=2).

*I am a bot, and this action was performed automatically. Please [contact the moderators of this subreddit](/message/compose/?to=/r/investing) if you have any questions or concerns.*",gyigui5,t3_newk7z,[],1
792,2021-05-18,investing,"So he announced this in January. Please don't think he opened this this week. He opened this position when tsla was near all time highs.
I Would not be surprised if he covers the puts soon.",gyigyfn,t3_nenw6h,[],0
793,2021-05-18,investing,A lot of similarities between Musk and Trump tbh,gyigyuu,t1_gyhb3gs,[],0
794,2021-05-18,investing,"> A pullback from an ATH like that is obvious to anyone with eyes

Idk. TSLA was hitting ATHs continuously in 2020. Any pullbacks it had were minor.",gyigzdj,t1_gyhc5ma,[],1
795,2021-05-18,investing,"Kids these days. Never seen a bear market.  


To answer your question, when prices are diving, everything is on sale. You should be feeling excitement and looking for things to buy.",gyih0o1,t3_nevmkq,[],0
796,2021-05-18,investing,My att got smoked today..,gyih24r,t3_ndsznc,[],0
797,2021-05-18,investing,This has always bothered me ever since I first started investing. Grouping the two together obsfucates the conversation imo,gyih5id,t1_gyi70mo,[],0
798,2021-05-18,investing,I hear you. Those presidents that got into power because of FARC set Polombia back a couple decades.,gyih5k0,t1_gyhmqm5,[],0
799,2021-05-18,investing,"Looking for advice on which ETFs to invest in for the short-term (1-2 years) to generate a higher return on cash of $150k. Plan on using the entirety of the funds for home purchase and embedded in that is also our emergency fund. Any recommendations? Was thinking of investing around 50k in SCHD, VTI and ARKK (50/30/20%) for 50k of 150k.

&#x200B;

Thoughts?",gyih6h8,t3_neb4xj,[],0
800,2021-05-18,investing,"you lose some, you win some, importance is knowing how to scale your positions",gyih9al,t1_gyiczi0,[],0
801,2021-05-18,investing,Common sense,gyih9p6,t1_gyigqs9,[],0
802,2021-05-18,investing,"> I wonder if /r/investing will at one point go back to the ""boring"" just-buy-etfs-and-hold with the occasional quality dd post in between.

You mean like Ark?.. 

But seriously Tesla and Ark are so interesting on this sub, because some people truly believe their long term goals, while others think they are way overvalued. Its actually surprising so many investors here are involved with both, as it doesnt really fit the conservative approach this sub preaches.",gyih9qh,t1_gyh8m3r,[],0
803,2021-05-18,investing,Michael Burry has a glass eye with a fish in it,gyih9v6,t3_nenw6h,[],0
804,2021-05-18,investing,"Yeah this makes sense. I was worried about that. It's still pennies, but I'd rather pay through a transparent fee.",gyihe5w,t1_gyie9g9,[],0
805,2021-05-18,investing,"Your submission was removed because it is a short post. Any self-post below 400 characters in the body will be removed.  Please refer to rule 6 and make sure your post meets our standards of effort. Automod evasion will be met with a lengthy ban. Do not post just an article; highlight the parts of the article you find relevant or offer some commentary surrounding the article. Self-posts that offer some simple thoughts or questions like ""what do you think"", ""here's my thoughts"", etc. belong as comments to existing posts or the [Daily Advice Thread](https://www.reddit.com/r/investing/about/sticky?num=2).

*I am a bot, and this action was performed automatically. Please [contact the moderators of this subreddit](/message/compose/?to=/r/investing) if you have any questions or concerns.*",gyihfu3,t3_newnw1,[],1
806,2021-05-18,investing,"On that basis, don't index fund holders get credit for getting it right, given that they held Tesla and bought more and more all along?",gyihgda,t1_gxt98h4,[],1
807,2021-05-18,investing,Cathie's gonna buy every single one,gyihjtq,t3_nercxl,[],0
808,2021-05-18,investing,People who own Tesla’s love them.,gyihjvv,t1_gyi8emy,[],1
809,2021-05-18,investing,"Oh if you think 30% is bad, we haven't even gotten started even getting in the stratosphere of fair value. ARKK to 40, then we approach sanity.",gyihkwl,t1_gxsw63o,[],0
810,2021-05-18,investing,"Ah yes, the unknown actions of a genius, hedge fund manager to you is common sense. Lol",gyihngs,t1_gyih9p6,[],0
811,2021-05-18,investing,Yes. To me it is. Maybe not to you,gyihpxz,t1_gyihngs,[],0
812,2021-05-18,investing,This isn't the first time he was public about his Tesla short positions.,gyihqb8,t1_gyh4wys,['TSLA'],0
813,2021-05-18,investing,I dumped all my ARK funds and moved to crypto... Of course ETH and BTC shit the bed over the weekend... Thanks Elon.,gyihqpc,t1_gyihkwl,[],0
814,2021-05-18,investing,"Thank you for the laugh, I needed it champ.",gyihu1r,t1_gyihpxz,[],1
815,2021-05-18,investing,"I believe he also sold Suncor... not to mention the airlines at the absolute bottom.
Still hasn't trimmed his Apple  position either.",gyihyqb,t3_neum2q,['AAPL'],1
816,2021-05-18,investing,"No problem. Just so you know I scored in the 98th percentile of visual spatial skills professionally tested during an IQ exam. Google it.  Over all IQ is superior, not genius level. Only a visual spatial genius",gyihz3n,t1_gyihu1r,[],0
817,2021-05-18,investing,Stanning for car dealerships is an interesting flex,gyii42d,t1_gyifigt,[],1
818,2021-05-18,investing,When our mainstream media is all misinformation and hyperbole what else can we expect from the shitty little media outlets? It used to be The Enquirer was the fake headlines...,gyii4vr,t1_gyi5sc4,[],0
819,2021-05-18,investing,This short may be different this time! Elon's lost a whole bunch of fans by shitting on Bitcoin and pumping doge!,gyii5a0,t3_nenw6h,[],0
820,2021-05-18,investing,What percentage of portfolio is this 534m representing?  So context is nice,gyii663,t3_nenw6h,[],1
821,2021-05-18,investing,"Really bad play. He’s always shorting Tesla, this time he went too far and Tesla ain’t going anywhere but up.",gyii7a5,t3_nenw6h,['TSLA'],0
822,2021-05-18,investing,"> You can be long or short a put.

Well yea, because someone is on the other side of every trade.",gyii8q3,t1_gyh7xj0,[],0
823,2021-05-18,investing,"Your comment was automatically removed because it looks like you are trying to post about non mainstream cryptocurrency. This type of content belongs in another subreddit.

*I am a bot, and this action was performed automatically. Please [contact the moderators of this subreddit](/message/compose/?to=/r/investing) if you have any questions or concerns.*",gyiiabf,t1_gyiia9k,[],1
824,2021-05-18,investing,Have a look at $RIDE. Do your own DD.,gyiiapm,t1_gyhczgu,[],0
825,2021-05-18,investing,bullish,gyiidfz,t1_gyidoxs,[],0
826,2021-05-18,investing,I wrote a DD last week about how good I thought $SQM was looking at a medium term play. I'm not sure what to do with it now.,gyiie67,t3_nem9c3,[],1
827,2021-05-18,investing,Owners love them. No idea what this sub is on about how bad Tesla’s are. Both professional and personal owners I know swear by them; say they’ll never get anything but a Tesla. This sub is some real circle jerk shit with Tesla,gyiihmr,t1_gyi0gx0,[],0
828,2021-05-18,investing,Last 24h its up over 400%,gyiij9t,t1_gele34f,[],0
829,2021-05-18,investing,"Your submission was removed because it is a short post. Any self-post below 400 characters in the body will be removed.  Please refer to rule 6 and make sure your post meets our standards of effort. Automod evasion will be met with a lengthy ban. Do not post just an article; highlight the parts of the article you find relevant or offer some commentary surrounding the article. Self-posts that offer some simple thoughts or questions like ""what do you think"", ""here's my thoughts"", etc. belong as comments to existing posts or the [Daily Advice Thread](https://www.reddit.com/r/investing/about/sticky?num=2).

*I am a bot, and this action was performed automatically. Please [contact the moderators of this subreddit](/message/compose/?to=/r/investing) if you have any questions or concerns.*",gyiikvk,t3_newuuq,[],1
830,2021-05-18,investing,Florida Evans looking motherfucker.,gyiin35,t1_gyifec7,[],0
831,2021-05-18,investing,Well we could talk about what to buy and hold,gyiin7t,t1_gyhrlam,[],0
832,2021-05-18,investing,"**Hi, welcome to /r/investing. Please note that as a topic focused subreddit we have higher posting standards than much of Reddit:**

**1)** Please direct all **advice requests and beginner questions to the stickied daily threads.** This includes beginner questions and portfolio help.

**2) Important: We have strict political posting guidelines** (described [here](https://www.reddit.com/r/investing/comments/cyee69/formal_posting_guidelines_for_political_topics/) and [here](https://www.reddit.com/r/investing/comments/escewo/temporary_rule_change_what_happens_to_stocks_if/)). Violations will result in a likely 60 day ban upon **first instance.**

**3)** This is an open forum but we expect you to conduct yourself like an adult. Disagree, argue, criticize, but **no personal attacks.**


*I am a bot, and this action was performed automatically. Please [contact the moderators of this subreddit](/message/compose/?to=/r/investing) if you have any questions or concerns.*",gyiinac,t3_newv81,[],0
834,2021-05-18,investing,So companies that aren't hedge funds should engage in speculation now?,gyiirs8,t1_gyg4e5r,[],0
835,2021-05-18,investing,How do you know he’s closed out his position?,gyiis0k,t1_gyhcmaw,[],0
836,2021-05-18,investing,"Yea ik that, just never seen it this low in my young investment journey, although i’ve been buying like there’s no tomorrow",gyiis4c,t1_gyih0o1,[],0
837,2021-05-18,investing,How much are you up on that decade hold? Just curious.,gyiis75,t1_gyhiavi,[],1
838,2021-05-18,investing,"The article says 8000 contracts for control of 800,000 shares",gyiiybi,t1_gyhq3w7,[],0
839,2021-05-18,investing,"Definite ""no"" in my book. The cost of this money is 5.5% up front, and then 2.75% annually. If you are in the United States and you don't itemize, it's also probably not tax deductible. That is not particularly cheap capital in the current rate environment. For example, you can currently borrow on margin at Interactive Brokers for 1.6%. Granted, I'm comparing short-term rates to long-term rates, but nonetheless I don't think it's a good idea.",gyij2uc,t3_net1s9,[],0
840,2021-05-18,investing,"Depending on the coin/platform, you will get liquidated way before the price that your collateral is worth, to prevent mass liquidations",gyij5ix,t1_gyhy635,[],0
841,2021-05-18,investing,"You’re completely missing the point. The dollar value is just a measure of the purchasing power of however many units you have. 

The scarcity component is that the number is fixed by a social consensus that other coins do not have or these other coins have technical considerations that make centralization likely at some point enabling the supply to change. You are right that the actual number doesn’t matter.",gyij8l9,t1_gyhzj5j,[],0
842,2021-05-18,investing,"my stocks account is all in VOO. 

(my full portfolio is 70% VOO and 30% Bitcoin)",gyij95v,t3_newv81,[],0
843,2021-05-18,investing,"Your submission was removed because it is a short post. Any self-post below 400 characters in the body will be removed.  Please refer to rule 6 and make sure your post meets our standards of effort. Automod evasion will be met with a lengthy ban. Do not post just an article; highlight the parts of the article you find relevant or offer some commentary surrounding the article. Self-posts that offer some simple thoughts or questions like ""what do you think"", ""here's my thoughts"", etc. belong as comments to existing posts or the [Daily Advice Thread](https://www.reddit.com/r/investing/about/sticky?num=2).

*I am a bot, and this action was performed automatically. Please [contact the moderators of this subreddit](/message/compose/?to=/r/investing) if you have any questions or concerns.*",gyij9n1,t3_newz4s,[],1
844,2021-05-18,investing,"I used to feel that way about the iPhone until I finally got one. Then I felt that way about the Apple Watch until I got one. And I thought AirPods were the stupidest looking thing ever until I finally bought a pair and I LOVE them. 

I’ll never buy a Mac cause I’m a PC girl all the way. But apple products are legitimately better than the competition. There’s a reason people buy them and it’s not just the status symbol aspect.",gyijazq,t1_gyi1zje,[],0
845,2021-05-18,investing,"Your submission was removed because it is a short post. Any self-post below 400 characters in the body will be removed.  Please refer to rule 6 and make sure your post meets our standards of effort. Automod evasion will be met with a lengthy ban. Do not post just an article; highlight the parts of the article you find relevant or offer some commentary surrounding the article. Self-posts that offer some simple thoughts or questions like ""what do you think"", ""here's my thoughts"", etc. belong as comments to existing posts or the [Daily Advice Thread](https://www.reddit.com/r/investing/about/sticky?num=2).

*I am a bot, and this action was performed automatically. Please [contact the moderators of this subreddit](/message/compose/?to=/r/investing) if you have any questions or concerns.*",gyijclc,t3_newzmu,[],1
846,2021-05-18,investing,Your two cents are now worth only one bc of inflation,gyijdip,t1_gyi4ayz,[],1
847,2021-05-18,investing,"This is really speculative, but long term, I see Chile going down the same path as Venezuela.

Replace oil dependence with lithium dependence, same non taxed rise in spending, eventually some catalyst (might be a lithium-less battery or a thousand other things) brings about the downfall of the gov't or fiat.",gyijgwj,t3_nem9c3,[],0
848,2021-05-18,investing,Thoughts on Coinbase (COIN) stock?,gyijrs3,t1_gyij95v,[],1
849,2021-05-18,investing,We already have a full electric ford on the lot.,gyijtjq,t1_gyi6yse,[],0
850,2021-05-18,investing,Porsche >>>>>>>>>>> Tesla,gyijufk,t1_gyhwfsd,[],0
