,comment_id,created,parent_id,subreddit,text,Organizations,Sentiment
406,gzcelah,2021-05-25,t3_nkcvvm,stocks,VT and SCHD,[],0
407,gzcempc,2021-05-25,t3_nkbmpp,stocks,RemindMe! 4 years,[],1
408,gzcephk,2021-05-25,t1_gzce44z,stocks,"Tis a danger echo chamber, right or wrong. Hive mind is the downfall of many intellectual folk",[],0
409,gzcetv8,2021-05-25,t1_gzceajq,stocks,take a look at all his other spacs and tell me if retail shareholders have been happy with his deals or not,[],0
410,gzcetwu,2021-05-25,t3_nanrlu,stocks,https://www.smartinsider.com/politicians/,[],0
411,gzcewak,2021-05-25,t3_nkcvvm,stocks,"I have three kids, ages 1,4 and 6. Any birthday, holiday money goes into a total market index, in this case VTI. It's in our names, mainly to prevent FAFSA and asset complications when or if that time comes. They'll get it when they're adults, probably similar to your strategy.",[],0
412,gzceznt,2021-05-25,t3_nk7ipu,stocks,Lol. Just stopped to read this for the first time. Officially following this user.,[],0
413,gzcezwb,2021-05-25,t3_nkcvvm,stocks,"I would just but something like 75% VTI, 25% VXUS and call it good. No need to get fancy",[],1
414,gzcf07b,2021-05-25,t1_gzc4kh3,stocks,They are sinking $400mil into the plant. Do you not think that maybe they did more research then you did on it? Scrolling reddit doesn't qualify as dd.,[],0
415,gzcf0t8,2021-05-25,t3_nkdqtr,stocks,"If u really just want solid dividends/income, look into closed end funds (CEFs).",[],1
416,gzcf11t,2021-05-25,t1_gzceznt,stocks,Appreciate it!,[],1
417,gzcf1sl,2021-05-25,t1_gzcefd0,stocks,Because he sold when the 99.9% chance was that HTZ would be wiped out due to BK. That 0.1% chance happened. HTZ (now HTZGQ) was purchased out of BK in a manner that actually rewards equity shareholders. To be clear. That is not speculation. That happened. The only thing that is speculation is the end value. Somewhere between $7 and $30.,[],0
418,gzcf4k4,2021-05-25,t3_nkchix,stocks,"All investing is value investing; you buy stocks when they are undervalued and you sell stocks when they are overvalued.  The fact that a company is growing faster than others or the fact that a company is paying a bigger dividend than others are both in itself minor in the valuation process.

I suggest to stick with a few ETFs.",[],1
419,gzcf5sh,2021-05-25,t1_gzce9r1,stocks,"It still wasn't a crash. Why the fuck does it matter if it was a correction or a bear market? You're breaking my balls over a percent dude, bug off.",[],0
420,gzcf9u4,2021-05-25,t3_nk4df4,stocks,Hahahaha. Love seeing the name of this brand. Practically means fat-ass in spanish. Depends how hard you want to interpret the name.,[],0
421,gzcfd63,2021-05-25,t3_nkegl3,stocks,"Sorry, your [submission](https://www.reddit.com/r/stocks/comments/nkegl3/erricsson_and_qualcom/) in /r/stocks has been automatically removed due to Rule 3:  Low effort.

If you just want to post 1 liners or just want to know everyone's thoughts, then post a comment to our daily discussion thread which are generally stickied or [click here.](https://www.reddit.com/r/stocks/search?q=author%3Aautomoderator+daily+discussion&restrict_sr=on&sort=new&t=all)

If you're wondering **why a stock moved** a certain way, check out [Reuters](https://www.reuters.com/), [Motley Fool](https://www.fool.com/), and **especially** [Finviz](https://finviz.com/quote.ashx?t=spy) **which aggregates the most news for almost every stock**.

If instead you're wondering what a term means, go to Investopedia.com and search for said term there.

Either way come back here to repost with your findings, thanks!

A list of the [rules can be found here](https://www.reddit.com/r/stocks/about/rules/), and if you're new to r/stocks please see the [wiki](https://www.reddit.com/r/stocks/wiki/index) and/or [read this post.](https://www.reddit.com/r/stocks/comments/4x1419/if_youre_new_here_read_this_post_first/)

*I am a bot, and this action was performed automatically. Please [contact the moderators of this subreddit](/message/compose/?to=/r/stocks) if you have any questions or concerns.*",[],1
422,gzcfi04,2021-05-25,t3_nk43rq,stocks,"Gotta say having a house paid off in your early 30's is amazing. That's a major life stressor off your back.

At your income range I'd honestly just put it in either the total market index (VTI) or target retirement funds (which offer a mix of stocks and bonds for even more safety and automatically adjusts to safer investments as you age).",[],1
423,gzcfk1l,2021-05-25,t1_gzcce6d,stocks,"A small nice one to show their cutting edge commitment to their investment platform is the ability for normal retail traders to invest in IPO’s. That will be an awesome addition to their simple and user friendly retail trading platform for the upcoming generations of traders. Robinhood is the only other example that will be offering that but they don’t have all the other aspects of SoFi’s business. Sofi’s also made great pushes in Fin-tech like their acquisition of Galileo. This will allow them to branch into a lot of different offerings not only to their clients but other institutions. SoFi has been able to get a lot of stable debt in student loans for example from those banks you mentioned due to extremely attractive and nimble refi’s. Once they get their charter, I am confident they will be cooking with some gas.

To be clear, I’m not hyperbolically claiming they will overtake conventional banking, I’m just saying I think their name will be mentioned as a big up and comer in that conversation in the next 5-7 years.",[],1
425,gzcfmdj,2021-05-25,t1_gzcce6d,stocks,"I’ll tell you a story. I have a fair chunk of money at Chase. I used their CC, have gotten loans from them,  and use their mobile app for years. I try and used their mobile app for a wire transfer. It gets blocked due to some fraudulent flags cause I don’t usually sent wires. It gets blocked four times with me having to call each time to have them unblock my entire account. Four. Times. 

Each time I am told to try the wire again it should be fine now. The last time I asked what I should do as j had to make this wire. Of my own money. To myself at another bank. I was told to just go to a branch. 

It took an hour to send that wire the next day as I sat waiting for someone to assist me. I ended up finally having the manager, who was doing nothing the entire time to begrudgingly do it. 

That’s why. Fintech is going to blow these banks away with efficiency and cost controls due to more empowerment in automation and personal control and less technical red tape that requires more manual work to do the simple things.",[],0
426,gzcfms7,2021-05-25,t1_gzb99ix,stocks,Really? Why?,[],0
427,gzcfn8g,2021-05-25,t1_gzb4mz9,stocks,Does Michael Jordan still have his hoop earring in?,[],0
428,gzcfo36,2021-05-25,t1_gzag3j8,stocks,Came back to see if you’re still holding. Glad to finally see it move up a bit.,[],1
429,gzcfogi,2021-05-25,t3_nke9vc,stocks,"Peloton makes fitness equipment, Nautilus makes fitness equipment, so comparing them at a high level seems logical. But Peloton has positioned itself as a fitness social platform and lifestyle brand, whereas Nautilus is making tomorrow's yard sale items. It is an apples/oranges comparison.   

The closest competitors to what Peloton is trying to create in no particular order is: NordicTrack, Echelon, iFit, and Apple. You'll notice that only half of those even make equipment, and that is very intentional. Again: Peloton is a social platform and lifestyle brand, the physical equipment is almost *secondary*.   

I cannot guarantee that Peloton will be the next big thing, but I totally understand the current valuations. Heck it could be the next Beats headphones as an Apple acquisition, they're basically an Apple clone already and Apple could roll them into Apple's new Fitness ecosystem seamlessly.   

PS - I am not, in any way, shitting on Nautilus. They still do what they've always done: Make equipment. They just now have competitors that are doing more/throwing out a larger net.",['AAPL'],0
430,gzcfrhi,2021-05-25,t3_niaptn,stocks,I work in the automotive industry & they have significantly reduced their orders in the new future from us,[],1
431,gzcfsfz,2021-05-25,t1_gzc8zk9,stocks,"Yeah this post is sadder than OPs.

You could have just created new post to educate the OP and give feedback to them instead you make one to humiliate. Uh.",[],0
432,gzcfxex,2021-05-25,t3_nkchix,stocks,MSFT AAPL GOOGL UNH NVDA HD.  That's all you need to know.,[],1
433,gzcfxze,2021-05-25,t1_gzcfms7,stocks,""" $RICK and $MORT "" when I read it. I thought Rick and Morty. Lol. I'm kindda surprised it's been down voted. Nothing bad about it. Just what I read at first. People are touchy these days.",[],0
434,gzcfz9r,2021-05-25,t3_nk67sx,stocks,"It’s illegal for studios to own the theaters since 1930s.

Why are studios allowed to own streaming platforms?",[],0
435,gzcg0kt,2021-05-25,t1_gyzote0,stocks,Great expectations already priced in.,[],1
436,gzcg2a9,2021-05-25,t1_gzcfogi,stocks,"I agree completely
Nls has started up the social as well, unfortunately they are late to the show but are at least profitable...in the near term is say pton should make this purchase... because they have made 80 million in 6 months...will make more money....have 115 million in the bank...

If you subtract the cash from the market cap...the market is saying the company is worth 375 million....come on.....nls will make that by next year if you count all 8 quarters...I know the growth will slow but in the meantime maybe the company should buy shares at these levels",[],0
437,gzcg371,2021-05-25,t1_gzcf4k4,stocks,No you sell when you're 65 to 70!,[],1
439,gzcg3v1,2021-05-25,t1_gzcab98,stocks,If it’s the last thing we ever do...,[],0
440,gzcg7vx,2021-05-25,t3_nke6j1,stocks,Yikes.,[],0
441,gzcgb3f,2021-05-25,t3_nkbmpp,stocks,Classic pump n dump. Offering coming soon,[],1
442,gzcgb7n,2021-05-25,t1_gzcfz9r,stocks,Because we decided 4-5 companies should own everything.,[],1
443,gzcgdsf,2021-05-25,t3_nj9kk4,stocks,"Someone else provided this link a few months back.  I find it interesting.

[https://www.dataroma.com/m/home.php](https://www.dataroma.com/m/home.php)",[],1
444,gzcge5m,2021-05-25,t3_nkbkn7,stocks,You don't sell.  That's your problem.  You buy and hold till you're old!,[],0
445,gzcgeaf,2021-05-25,t1_gzcf07b,stocks,"Youre making an assumption I only scrolled Reddit..... 🤣
If you want to buy Peloton at $100, have at it.  Im not touching it.  There are better investments at these levels.",[],0
446,gzcgh3n,2021-05-25,t3_nke9vc,stocks,"PTON became a household name during Covid.  And I absolutely do believe there will be lasting effects of working out from home.  People were exposed to pretty cool 'living room' classes that weren't possible before... e.g. cycling to interactive horror stories, you have to speed up to avoid the monsters.  

While I think PTON is still currently overpriced the name/potential they now have and acquisition potentials like this one I think PTON has the potential for a very bright future.  Gonna personally sit on the sidelines for a bit, though.",[],0
447,gzcgkhf,2021-05-25,t3_nhz44v,stocks,Bill Ackman owns 6%. That’s high conviction from a value investor.,[],0
448,gzcgl3i,2021-05-25,t1_gzccz7k,stocks,"In my opinion the entire ""medical"" side of marijuana is overblown. I'm sure it can be beneficial for certain things, but it simply does not have the potential that tryptamines and phenethylamines do. Granted that's comparing one plant to an entire class of molecules. But psychedelics are showing potential to treat an incredible number of psychiatric disorders, even previously considered untreatable stuff like TBI and cluster headaches. There's also huge potential in resting opiate addiction with Psilocybin or Ibogaine. That's all just the tip of the iceberg.

Sorry I'm rambling. Not trying to be contrarian or smug here, just trying to elucidate people.",[],1
449,gzcglcw,2021-05-25,t1_gzcfxze,stocks,"...yeah. That’s why you got wooshed. You’re not getting downvoted because you thought of Rick and Morty, you’re getting downvoted because you thought it needed to be said. The ticker symbols referencing Rick and Morty is literally the gimmick of his post.",[],0
450,gzcgld3,2021-05-25,t1_gzcgh3n,stocks,Absolutely agreed..I think they can both benefit...I feel pton should make a bid for nls,[],0
451,gzcgls1,2021-05-25,t1_gzcg7vx,stocks,I know! They don’t know how to spell “losses.” Fucking disgraceful.,[],1
452,gzcgnvu,2021-05-25,t3_nkchix,stocks,"Imo find a company you like and invest. 

I think younger investors have more of a sense of what’s a good undervalued company because a lot of shit is marketed towards younger investors.",[],1
454,gzcgpbk,2021-05-25,t1_gzbx2gd,stocks,maaaaaybe. But maybe not. :),[],0
455,gzcgpzp,2021-05-25,t1_gzcdjlk,stocks,Lowest cost takes the highest gain first.,[],0
456,gzcgrxk,2021-05-25,t1_gzc5hvk,stocks,"My brokerage is through fidelity and they have some great tools and insights. Zacks is one where you get to see a lot of their analysis, Argus, Ford Research and many others. Zacks though has done well for me with.",[],1
457,gzcgtbc,2021-05-25,t3_nkehy3,stocks,"Pretty clear Tesla dismissed LIDAR because the sensors where expensive and admitting they would be needed when cost feasible would hinder Elon's ability to sell a FSD soon dream to everyone.

My guess is get a stripped system they will call ""Full Self Driving"" to avoid having to do retrofits. Then quietly start shipping cars with Lidar when it becomes cost effective.",[],1
458,gzcgv6q,2021-05-25,t1_gzc8clc,stocks,I like your style.,[],1
459,gzcgwgm,2021-05-25,t3_nkepzv,stocks,"Sorry, your [submission](https://www.reddit.com/r/stocks/comments/nkepzv/have_you_all_seen_what_is_going_on_in_the_reverse/) in /r/stocks has been automatically removed due to Rule 3:  Low effort.

If you just want to post 1 liners or just want to know everyone's thoughts, then post a comment to our daily discussion thread which are generally stickied or [click here.](https://www.reddit.com/r/stocks/search?q=author%3Aautomoderator+daily+discussion&restrict_sr=on&sort=new&t=all)

If you're wondering **why a stock moved** a certain way, check out [Reuters](https://www.reuters.com/), [Motley Fool](https://www.fool.com/), and **especially** [Finviz](https://finviz.com/quote.ashx?t=spy) **which aggregates the most news for almost every stock**.

If instead you're wondering what a term means, go to Investopedia.com and search for said term there.

Either way come back here to repost with your findings, thanks!

A list of the [rules can be found here](https://www.reddit.com/r/stocks/about/rules/), and if you're new to r/stocks please see the [wiki](https://www.reddit.com/r/stocks/wiki/index) and/or [read this post.](https://www.reddit.com/r/stocks/comments/4x1419/if_youre_new_here_read_this_post_first/)

*I am a bot, and this action was performed automatically. Please [contact the moderators of this subreddit](/message/compose/?to=/r/stocks) if you have any questions or concerns.*",[],1
460,gzcgx5j,2021-05-25,t3_nk5zl6,stocks,"as a consumer, I have never regretted buying their products.  I’ve seen them deal with issues by replacing an older computer with a brand new model (5-7 years more current).

as an investor, i made plenty of money trading them but then lost as much expecting them to keep growing at the same rate as the first 6-8 months when instead they dipped and i had way more shares.

ultimately I know I want to be long their stock when i can buy more and hopefully one of my options will work out to get it at a good price point.",[],0
461,gzcgxt8,2021-05-25,t3_nke9vc,stocks,"$PTON has a bright future, I agree, but I'm not buying it > $70.  Its still too overpriced.",[],0
462,gzch184,2021-05-25,t3_nkekzu,stocks,Don't trade!  You'll lose in the end to just buy and hold.  Buy VTI and or QQQ and hold until you retire.,[],0
463,gzch2e6,2021-05-25,t1_gzcg371,stocks,"Yes; when I retire at 60 I will be making a major shift to  dividend holdings, that is their purpose and they are very good at it.  Until then; nothing is more effective than a Total Return approach based on price value when building your nest egg.",[],0
464,gzch3am,2021-05-25,t1_gzcdbq8,stocks,What is like saying that?,[],1
465,gzch3pa,2021-05-25,t1_gzcgxt8,stocks,"Yes I agree
Thought on nls?",[],0
466,gzch3rl,2021-05-25,t3_nkd4ew,stocks,"It was clearly deleted because the original poster didn’t want it out there, not really any business of yours to repost it🤨...people can be assholes on this sub",[],0
467,gzch8na,2021-05-25,t1_gzcbbdq,stocks,Just keep buy the dips and you will be fine in the long term...2018 wasn’t a crash,[],1
468,gzcharj,2021-05-25,t1_gzcgl3i,stocks,Not gonna lie you got me more interested in it. I’ll take a closer look. Thanks for sharing,[],0
469,gzchd58,2021-05-25,t1_gzcd6pa,stocks,"> that’s profit.

That’s revenue. It’s very unclear if they can ever reach profit.",[],0
470,gzche9l,2021-05-25,t1_gzch3pa,stocks,"I'll have to look more into the fundamentals & technical chart, & get back to you.  Overall, I dont see a run on home gym equipment, rather I expect to see people selling their used equipment; something the manufacturers with have to compete with.",[],0
471,gzchf7j,2021-05-25,t3_nkchix,stocks,"It's a false dichotomy. There are plenty of inexpensive stocks with good growth prospects, the difference is how much Mr. Market believes their growth story.

AXP and DFS have seen YTD returns of over 25% compared to less than 5% for V and MA. They still trade at P/E ratios about half that of the latter two.",[],1
472,gzchh7x,2021-05-25,t1_gzc8dmo,stocks,So they don’t offer to certify you as an astronaut? Source on this?,[],1
473,gzchkre,2021-05-25,t1_gzcempc,stocks,"Good call champ, only time will tell it.",[],1
474,gzchmcq,2021-05-25,t3_nkeont,stocks,">Does it have to be during an earnings call?

No

>Do they have to file with some governing body months in advance?

Yes, they have to notify SEC prior to announcing split


> Do investors vote on such a thing? 
Board of directors vote on it",[],0
475,gzchmrk,2021-05-25,t1_gzbdl04,stocks,"Disagree.  People want to bang out a workout in 30 mins at their convenience and be done for the day.  Im not interested in a bike because i weightlift and run, but the appeal of peleton is obvious.  If i can save a hour of my life a day then that becomes priceless.",[],0
476,gzchouy,2021-05-25,t1_gzbr60v,stocks,"This is wrong, you can use losses to offset gains going back 3 years, losses can be carried forward indefinitely",[],0
477,gzchpv2,2021-05-25,t1_gzchd58,stocks,"Only time will tell it, place your bets.",[],0
478,gzchqvk,2021-05-25,t1_gzc35k1,stocks,You should back up the truck then and prove the skeptics wrong. I hear so much hype about that company it’s as if people are convinced they’re positioned to become the largest software company in the world.,[],1
479,gzchrx8,2021-05-25,t3_nkd4ew,stocks,"I thought it was sweet that his first thought we hooking his cat up with toys and a bit of adventure.

He sounds like a good person.

Its a shame he felt he was harassed in to deleting everything.",[],1
480,gzchs32,2021-05-25,t3_nkchix,stocks,"Value is looking to perform better in 2021 because most analysts are expecting re-openings since the start vaccine administrations. “Value” & cyclical stocks were the ones that were the most hard hit during pandemic and like you have said, tech/ growth faired better in lock downs.

We can use the Dow index as a measure of the broad value and cyclical stocks and Nasdaq for the growth/tech. The US economy is in full swing towards reopening and it’s rebound in the values is already being seen, with Dow being up 12% YTD and Nasdaq trailing by half the amount at 6% YTD. 

Value stocks are typically the companies that are “boring”, companies that are typically matured and have consistent and predictable revenue streams. While growth stocks are usually the ones that companies might not have positive earnings, but have good future outlooks. Stocks that look for innovation and development in new industries, etc. Tech is often mixed into growth as majority of Tech stocks are built around innovation. 

Is one better than the other in the long term? I have no idea, but I don’t think you should just look at one or the other to make money. Imo, you can always find a bargain in any side, growth or value.",[],0
481,gzchv7o,2021-05-25,t1_gzbwktb,stocks,"No they are wrong you can carry forward losses indefinitely, they are incorrectly referring to offsetting gains from previous years with this years losses. You can use this years losses to offset gains from the past 3 years, any remaining losses are carried forward indefinitely",[],1
482,gzchyv6,2021-05-25,t1_gzc4zic,stocks,INTC is also a great example for why you should be looking past the financials. Technologically they've been lapped by the competition with no feasible solution until at least 2023 or 2024 while new markets have mostly passed on x86 entirely.,[],0
483,gzci0ta,2021-05-25,t3_nk4df4,stocks,Oof now the bad product has “made in u.s.a on it. That has never gone well,[],0
484,gzciaxx,2021-05-25,t3_nkeont,stocks,They don't need to inform the SEC for dividends but there are rules they have to follow.,[],1
485,gzcibud,2021-05-25,t3_nkdpq6,stocks,I see funds picking this up too like ARKF.,[],1
486,gzcihvp,2021-05-25,t3_nkeont,stocks,"A dividend is basically a company sharing their profit with their shareholders. A split whether straight or reverse is done to raise or lower the cost per share. A split is ok because it allows others to be able to invest at a lower cost per share and a reverse is when they need to raise the cost per share to maintain SEC compliance. 
A split is done in hopes of getting more investors and then raising again their share price. A reverse split is not so encouraging because it is looked upon as the company is struggling to maintain compliance. Both are done strategically to help the company in the long run. And yes they are required to file with the SEC and are voted upon most of the time by the shareholders unless they are an OTC stock and then I’m not real sure about the rules there.",[],0
487,gzcik3k,2021-05-25,t1_gzccgqd,stocks,"Is there a specific day/time I can mark on my calendar for whenever their bombshell prediction will manifest? 

I can say with confidence that they will either wait indefinitely until something occurs remotely to what they claim and pat themselves on the back or, more likely, nothing that they’re pushing will carry out and they’ll blame all the boogiemen out there.",[],1
488,gzcikaf,2021-05-25,t1_gz98cw1,stocks,"Reddit seriously needs to learn how c leadership executed stocks.

These are routine stock sells. Uh.",[],1
489,gzcim4u,2021-05-25,t1_gzcasv6,stocks,"Lmao. If I could give you a prize, I would.

In all seriousness, I have learned to hold on to my winners- but it was a hard lesson to learn. Believe it or not it can up a lot more than you think kids! 

If you sell when you make 30% you could miss a lot of upside. On the other hand if you hold on when you lose 30% you could lose a lot more (yes seriously) or you could be holding a very long time.

On the latter point, I have held TEF since 2011 when it was $25. I refused to sell it at $18. At $12. At $9. Well it's $5 now. It was never a big position but man has it taught me a lesson on losers. Now I keep holding it only to remind myself to sell losers I don't believe in. Lol. I should probably still sell it. Garbage company and management team - give themselves positive marks in shareholder comms despite driving the company into the toilet.",[],1
490,gzcio67,2021-05-25,t1_gzcibud,stocks,Agreed,[],0
491,gzcip1g,2021-05-25,t1_gzcik3k,stocks,Supposedly this Friday there’s dark reverse repo yatta yatta yatta. Such an echo chamber though,[],0
492,gzciqpy,2021-05-25,t1_gz9h49k,stocks,"Ya, little do those workers know, there will be a nice machine taking over some of their jobs lol.",[],1
493,gzcirqf,2021-05-25,t1_gzchouy,stocks,We’re both wrong lol. According to irs.gov: A net capital loss is carried back 3 years and forward up to 5 years as a short-term capital loss. Carry back a capital loss to the extent it doesn't increase or produce a net operating loss in the tax year to which it is carried.,[],1
494,gzcit9n,2021-05-25,t1_gzbz329,stocks,I think your portfolio should be inverted - mostly VTI/VXUS and lower weight on the speculative growth stocks/etf’s.,[],1
495,gzciuun,2021-05-25,t1_gzcge5m,stocks,I am all for investing long but when something is up you gotta take profits and secure them gains to reload dips or move to other plays!!!,[],1
496,gzcj0sg,2021-05-25,t1_gzcip1g,stocks,"Gotcha, thanks. What is supposed to happen then? Is the stock mark crashing in half? Will GME hit $1 million?",['GME'],0
497,gzcj38g,2021-05-25,t1_gzcihvp,stocks,"I appreciate the reply, do you know if there are regulations around when they can issue a dividend or a split or can it happen any time through the year?",[],1
498,gzcj394,2021-05-25,t1_gzbmoiz,stocks,I love the update.,[],1
499,gzcj4gm,2021-05-25,t1_gzchmcq,stocks,"I appreciate the reply, do you know if there are regulations around when they can issue a dividend or a split or can it happen any time through the year?",[],1
500,gzcj6fy,2021-05-25,t1_gzchouy,stocks,And investopedia says you can carry it indefinitely so I dunno. Should probably ask a tax professional.,[],1
501,gzcj746,2021-05-25,t3_nk4df4,stocks,stock will tank.,[],0
