,comment_id,created,parent_id,subreddit,text,Organizations,Sentiment
481,gyuuihe,2021-05-20,t1_gyulldn,stocks,Week 5: get fired.,[],1
482,gyuujme,2021-05-20,t1_gyuu7sz,stocks,"There were some nice ones set up with trump, anytime trump tweeted it would look for key words and trade buy/sell within microseconds to get a jump, sometimes they would misfire and trade the wrong way.",[],0
483,gyuujo3,2021-05-20,t1_gyum86j,stocks,So they pull out of an unprofitable market and its bad? Seems like a win to me.,[],0
484,gyuuka0,2021-05-20,t1_gyuuat5,stocks,K,[],0
485,gyuul42,2021-05-20,t1_gyuu0sc,stocks,"Same, I just lost 45k though.",[],0
487,gyuuoag,2021-05-20,t3_nh6bxq,stocks,"* Just take the F bro, nothing else to do 🤕",[],0
488,gyuuocs,2021-05-20,t1_gyutpon,stocks,"Good info, thank you!",[],1
489,gyuur6k,2021-05-20,t3_nh6bxq,stocks,"Until they can find a more green friendly way of producing batteries and a quicker way of  charging these batteries I don’t think EV will go much farther in popularity right now. Besides people can’t really afford new cars right now, thats why the used car market is in demand. That’s where the high stock prices are right now. 
Also Ford has a bad rep for crappy transmissions and a history of a lot of recalls. How do I know?  I’ve got a Ford with the above issues.  If you look at all the car companies none of them are doing very well in comparison to other industries.",[],1
490,gyuurk3,2021-05-20,t1_gyur9tw,stocks,"That is why they don't make cars anymore they make Trucks, Sports Cars, and SUV's and of those the Truck and Sports car are fairly well regarded. The F-150 along with the revamped Ranger and Bronco, along with the new Lightning put them in a good spot to capture the current market along with being a transition to the future.",[],1
491,gyuurvf,2021-05-20,t3_ngvmrw,stocks,"Goddamn Dow is rallying, or just my Dow stocks lol.",[],1
492,gyuus0a,2021-05-20,t1_gyuk42k,stocks,I got a rock,[],1
493,gyuuvi7,2021-05-20,t1_gyusc12,stocks,"1000%. On top of the electronics on the surface, it's internal, core function, bits. Module count in the last 10 years has gone from 1-3 to 60+ now.",[],0
494,gyuuvrv,2021-05-20,t1_gyuu0sc,stocks,Do you have any of your old hardware theres probably a way to get it.,[],0
495,gyuuwn4,2021-05-20,t1_gyupm6x,stocks,"Short ladder attacks are also called wash sales and they do exist. Numerous industry insiders have spoken about them.

But you can keep your head in the sand if that makes you feel better.",[],0
496,gyuuxjd,2021-05-20,t1_gyukwjt,stocks,"CAFE regulations I think, or another regulation of the sort. Emissions are based on the wheelbase and they're unable to meet the emission regulations they would need to meet for a truck the size of 80s small trucks, so they invented the mid sized trucks to go around the law and produce smaller trucks that are in the full sized category... They also look much bigger because of their height more than their overall size increase (especially full sized trucks).",[],1
497,gyuv13s,2021-05-20,t1_gyurwdx,stocks,Just type wash sales on google.,[],0
498,gyuv206,2021-05-20,t3_nh6bxq,stocks,"If the company does anything like the family today, I'm not expecting much.",[],1
500,gyuv3jt,2021-05-20,t1_gyudteg,stocks,If it was a stop limit it wouldn’t have executed at all. Since you set a stop market it executed $9 below the price you wanted.,[],0
501,gyuv4mh,2021-05-20,t1_gyups26,stocks,"Kind of? They claim 500,000 but it is trivial to put a preorder down and it isn't binding. Given that it is ugly as sin I want to see sales numbers before I believe it,.",[],0
502,gyuv522,2021-05-20,t1_gyuudsu,stocks,"If your goal is providing a product people actually want to buy then yes, everyone trying this strategy has absolutely failed on every occasion.  The only EVs that people actually want to buy today are Teslas which are custom built to be EVs.

No one else is even close to providing a compelling EV.  They pop out compliance cars to satisfy regulatory requirements.  This Ford likely won't change that.",[],1
503,gyuv5qc,2021-05-20,t1_gyuhrzi,stocks,"If you can time the bottom perfectly and volatility doesn’t jack the cost of those leaps to the moon. Honestly, I’d be inclined to go straight shares in that case.",[],1
504,gyuv5sm,2021-05-20,t1_gyuurk3,stocks,"Trucks and Sports Cars aren't cars?

>fairly well regarded

No, they aren't. They are shit. Fords are shit. It's the absolute reality.",[],1
505,gyuv5tx,2021-05-20,t3_nh6bxq,stocks,"I feel like the problem here is that for the EV F-150 to succeed, it has to cannibalize the IC F-150 sales. And it's slightly cheaper to boot.

They're not quite like Tesla, where there's a new market for breaking into.",[],0
506,gyuv5vo,2021-05-20,t1_gyuurvf,stocks,Recession cancelled,[],0
507,gyuv70f,2021-05-20,t1_gyuuka0,stocks,Y,[],0
508,gyuv8u2,2021-05-20,t1_gyuov3x,stocks,"They dont have a choice. Gas engines are gonna go the way of the dinosaur eventually and if ford doesnt establish their EV truck market share early they'll be screwed. 

It opens the door to new customers as well. There are alot of people who wont buy gas powered vehicles anymore (and more who would only buy very fuel efficient vehicles) that now will have an F150 as an option.",[],0
509,gyuv9qb,2021-05-20,t3_ngcedr,stocks,"Stock price didn’t fall. It’s up massively since March.

All you’re seeing are traders taking profits.",[],1
510,gyuv9vd,2021-05-20,t1_gyuplnj,stocks,Ford makes money off of utility esque vehicles.  Not cars.  It is smart for them to focus on trucks and truck-ey things.  But I feel like this market will be the most hesitant to adapt to EV's.,[],0
511,gyuvb0k,2021-05-20,t3_ngvmrw,stocks,"Kicking myself for not buying more ENPH 

Sheeeeesh",[],0
512,gyuvc37,2021-05-20,t3_nh6bxq,stocks,"The chip crisis is real, and is impacting the company to the point there has been layoffs. I think it will cause a pent up demand for cars, and eventually you will see some growth, but right now, I would be cautious with any car company.",[],0
514,gyuve4k,2021-05-20,t1_gyusnv7,stocks,"More like Jeff Bozo(s)! A book store can't adapt to modern living, it will never succeed.",[],1
515,gyuvfoe,2021-05-20,t1_gyukwjt,stocks,"Man, I LOVED those crucks. 2-wheel drive, smaller, lower to the ground. Easy to move furniture, etc. and drives like a car.",[],1
516,gyuvfwh,2021-05-20,t1_gyutags,stocks,"this is very true, and there have been layoffs, due to the chip shortage.",[],1
517,gyuvheg,2021-05-20,t3_ngvmrw,stocks,Oil and tech going up at the same time.  What a beautiful sight.,[],1
518,gyuvifg,2021-05-20,t1_gyuu1do,stocks,The old single cabs ya.,[],0
519,gyuviu3,2021-05-20,t3_nh8rl4,stocks,"Sorry, your [submission](https://www.reddit.com/r/stocks/comments/nh8rl4/request_for_a_friend/) in /r/stocks has been automatically removed due to Rule 3:  Low effort.

If you just want to post 1 liners or just want to know everyone's thoughts, then post a comment to our daily discussion thread which are generally stickied or [click here.](https://www.reddit.com/r/stocks/search?q=author%3Aautomoderator+daily+discussion&restrict_sr=on&sort=new&t=all)

If you're wondering **why a stock moved** a certain way, check out [Reuters](https://www.reuters.com/), [Motley Fool](https://www.fool.com/), and **especially** [Finviz](https://finviz.com/quote.ashx?t=spy) **which aggregates the most news for almost every stock**.

If instead you're wondering what a term means, go to Investopedia.com and search for said term there.

Either way come back here to repost with your findings, thanks!

A list of the [rules can be found here](https://www.reddit.com/r/stocks/about/rules/), and if you're new to r/stocks please see the [wiki](https://www.reddit.com/r/stocks/wiki/index) and/or [read this post.](https://www.reddit.com/r/stocks/comments/4x1419/if_youre_new_here_read_this_post_first/)

*I am a bot, and this action was performed automatically. Please [contact the moderators of this subreddit](/message/compose/?to=/r/stocks) if you have any questions or concerns.*",[],1
520,gyuviz9,2021-05-20,t3_ngi6ua,stocks,"IPOE/SoFi (soon to be merged). Amazing fintech disruptor, positive earnings, great revenue projections till 2025 and have beat it every quarter.",[],1
521,gyuvk0a,2021-05-20,t3_nh8q13,stocks,"Idk but I’m holding the bag here as I’m sure some others are too. Hate selling at losses, so just might be holding for a while o guess",[],1
522,gyuvki4,2021-05-20,t1_gyusgog,stocks,"Ford is in a way like Microsoft, they are not mainly selling to individual consumers on their pickup side, they are selling to businesses.",[],0
523,gyuvm20,2021-05-20,t1_gyuv70f,stocks,T,[],0
524,gyuvn70,2021-05-20,t1_gyuuat5,stocks,K,[],0
525,gyuvnhz,2021-05-20,t1_gyue4r9,stocks,"I really wasn't that impressed with it for coffee. It's too thin and watery, you don't get any of the creamy texture that even semi skimmed milk provides. Plus it has a bit of a strange taste.

It's fine for cereal though, I think the oat taste works much better there.",[],1
526,gyuvpnl,2021-05-20,t1_gyuvm20,stocks,O,[],1
527,gyuvr48,2021-05-20,t1_gyurcj5,stocks,"I think the reasoning is, they are doing better than their competitors.  So they are positioned to capture more market share.",[],1
528,gyuvs6e,2021-05-20,t1_gyuvm20,stocks,O,[],1
529,gyuvt1p,2021-05-20,t3_nh6bxq,stocks,"And partnering with Sunrun too, could be very bright for Ford.",[],1
530,gyuvtx5,2021-05-20,t1_gyu5xbp,stocks,Thanks I was also going to give a no money award,[],0
531,gyuvvv9,2021-05-20,t1_gyuszvj,stocks,"Not only that, people are buying up stocks because EV is mentioned. I don't get the logic - auto makers are spending billions to retool and develop for the EV market. That's money out the door. And the profit margins are lower because of the battery cost. It's not a winning combination unless you like buying hype.

And lets say the EV thing pays off. What then? Just because you make an EV doesn't mean you will magically sell a lot more cars than before. There are only so many new car buyers each year. So you're basically heading towards electrification in order to prevent other automakers from taking away market share in the future should EVs dominate the market. Again, that isn't bullish in of itself.",[],0
532,gyuvwb1,2021-05-20,t1_gyuvki4,stocks,"Yeah that’s true, I did see that the commercial one will be released first and that they won’t have the consumer model for a couple years, which is probably a lot better for them anyways.",[],0
533,gyuvwdg,2021-05-20,t3_nh5i9p,stocks,OPEN,[],0
534,gyuvwvt,2021-05-20,t1_gyuvk0a,stocks,"Same, down 49% on tlry 🙈 bought apha @ 19🤡",[],0
535,gyuvy2i,2021-05-20,t1_gyurreo,stocks,"Exactly they aren't selling this electric truck to the guys out in the oilfields.

They are for suburban folks who feel the need to drive a $65,000 luxury truck.",[],1
536,gyuvz0n,2021-05-20,t3_ngi6ua,stocks,Vizsla silver Corp. will be a 5x from here almost guaranteed. IMO,[],0
537,gyuvz7t,2021-05-20,t1_gyuvwvt,stocks,Lol same price point here. So sick of seeing it in my portfolio,[],0
538,gyuvzxk,2021-05-20,t3_ngvmrw,stocks,I need to cash out of my stocks. Think it’ll make a difference if I cash out tomorrow or no and get a few extra bucks. Each small increase makes a difference as i have 49k.,[],0
539,gyuw2t6,2021-05-20,t1_gyuve4k,stocks,"Yeah what are they gonna do, start selling other stuff? Good luck competing with Macys 🤣",[],0
540,gyuw4jn,2021-05-20,t3_nfrmgh,stocks,Fuck you SKLZ,[],0
541,gyuw4m6,2021-05-20,t1_gyuuvrv,stocks,"Oh don't worry, I've tried all sorts of recovery software... I had a backup of that wallet on Mega but didn't access the account for too long and they closed it... Yeah...",[],0
542,gyuw4yw,2021-05-20,t1_gyuvs6e,stocks,W,[],0
543,gyuw552,2021-05-20,t1_gyurmnm,stocks,"It's actually due to a stupid law. Auto manufacturers have to get the ""fleet average"" fuel economy up to certain targets by certain dates. But for some reason trucks under a certain size were put in with the cars. So after trying to sell tiny cars that got super great fuel economy and failing they all bumped the trucks up enough to get them included with the truck fleet numbers. This is why the new Ford ranger is now technically a full size truck (on paper). Same with Durango and Colorado.",[],0
544,gyuw7mc,2021-05-20,t1_gytytil,stocks,"What he did 15 years ago has no bearing on today. Today he is a megabillionaire who's megacorporation has been milking lower level employees, with multiple scandals about work conditions. If he wants people to *want* to work there, then Amazon needs to properly pay it's employees right down to the janitors.

You'll be the first put to the wall, in Minecraft.",[],1
545,gyuw8gk,2021-05-20,t3_nh8vrp,stocks,"Sorry, your [submission](https://www.reddit.com/r/stocks/comments/nh8vrp/starter_tips/) in /r/stocks has been automatically removed due to Rule 3:  Low effort.

If you just want to post 1 liners or just want to know everyone's thoughts, then post a comment to our daily discussion thread which are generally stickied or [click here.](https://www.reddit.com/r/stocks/search?q=author%3Aautomoderator+daily+discussion&restrict_sr=on&sort=new&t=all)

If you're wondering **why a stock moved** a certain way, check out [Reuters](https://www.reuters.com/), [Motley Fool](https://www.fool.com/), and **especially** [Finviz](https://finviz.com/quote.ashx?t=spy) **which aggregates the most news for almost every stock**.

If instead you're wondering what a term means, go to Investopedia.com and search for said term there.

Either way come back here to repost with your findings, thanks!

A list of the [rules can be found here](https://www.reddit.com/r/stocks/about/rules/), and if you're new to r/stocks please see the [wiki](https://www.reddit.com/r/stocks/wiki/index) and/or [read this post.](https://www.reddit.com/r/stocks/comments/4x1419/if_youre_new_here_read_this_post_first/)

*I am a bot, and this action was performed automatically. Please [contact the moderators of this subreddit](/message/compose/?to=/r/stocks) if you have any questions or concerns.*",[],1
546,gyuw8ls,2021-05-20,t1_gyuk8tc,stocks,Cars have to grow proportionally to the size of Americans,[],1
547,gyuw8r7,2021-05-20,t1_gyuw4yw,stocks,N,[],1
548,gyuw90e,2021-05-20,t1_gyuk8tc,stocks,A new ranger is roughly the same size as a 90s model f150.,[],0
549,gyuwalp,2021-05-20,t1_gyuw4yw,stocks,N,[],1
550,gyuwbd9,2021-05-20,t3_ngx4qm,stocks,"this is a high risk spec meme stock, perhaps worth a small position at $5 bucks a share. i used to hold a small position of 40 shares. dumped it all at $50 just 2 months ago. best trade i made this whole year lol",[],1
551,gyuwcqg,2021-05-20,t1_gyurz3y,stocks,"Agree with this.  For retirement, I'd go for SPY, QQQ, DIA, SPYV, SPYG, PPA, and other similar etfs.  I also have another account that is for me to 'play' where I would purchase shares of a company.  For this my main picls are AAPL, AMD, NVDA, ARFF ( I know etf, but more speculative), brk.b, and msft.",['AAPL'],0
552,gyuwdh2,2021-05-20,t1_gyuvheg,stocks,"Wti Oil is down but my Oil ETF keeps going up, institutions are back baby. Whales pamp it.",[],0
553,gyuwedf,2021-05-20,t1_gyo4egy,stocks,I make lots money 🤓,[],0
554,gyuwg1t,2021-05-20,t1_gyuw4m6,stocks,Wow man sorry to hear. At least you have a good story to tell!,[],0
555,gyuwg7u,2021-05-20,t3_nh6bxq,stocks,"Ok I was also invested in Ford for a bit, but I sold because I had one big concern, I’ll share it now to see what other people think. 

In order to shift from combustion engine cars to electric is a massive shift. The R&D would be very expensive, and in general, I just think they are quite different products. Just because a company is good at making one, doesn’t mean they can effectively make the other. 

Ford also doesn’t have a great credit rating, so any money needed to pump into their EV’s will be quite costly, meanwhile other EV companies in general have much better access to cheap capital. 

What do people think? Ford has been dying for years, it seems like quite the speculative bet that they will have quite the turnaround. 

Thoughts?",[],0
556,gyuwgak,2021-05-20,t3_nh6bxq,stocks,They’re going to enter an F-150 into LeMans and show old man Ferrari what’s up.,[],0
557,gyuwgv5,2021-05-20,t3_ngvmrw,stocks,"bruh I really wanna look into the minds of people who genuinely believe musks finance ""advice"" the dude calls dog coin a hustle a bit under two week ago and then today says he's diamond handing dog coin. how can anyone trust such blatant pumping and dumping?",[],0
558,gyuwhgv,2021-05-20,t1_gyus9h1,stocks,people doing exactly that is the reason his tweets pump stocks/coins so much. Its a self fulfilling prophecy.,[],1
559,gyuwj6a,2021-05-20,t1_gyuuvi7,stocks,That's feature creep for you.,[],0
560,gyuwjcp,2021-05-20,t1_gyuhcvl,stocks,"I know this is Wikipedia but it's the quickest place I can find with a succinct summary and links to original data:

[https://en.wikipedia.org/wiki/Quantitative\_easing#Effectiveness\_of\_QE](https://en.wikipedia.org/wiki/Quantitative_easing#Effectiveness_of_QE)

The data does not show that it's ""pretty good"", but rather ""modest"" at supporting GDP expansion.",[],1
561,gyuwk98,2021-05-20,t1_gyusy69,stocks,Ford stopped pouring money into a black hole and said enough was enough.,[],0
562,gyuwl8k,2021-05-20,t1_gyutos5,stocks,C,[],0
563,gyuwli7,2021-05-20,t1_gyuw90e,stocks,I never had a 90s f150 so I don't know what your talking about. The 90s s10 and ranger were small single cab/ext cab trucks. They have made all trucks bigger since then. I want the old 90s size back,[],0
564,gyuwm6y,2021-05-20,t1_gysalt0,stocks,"I'm not really worried about the option price, I collect the premium and then hold the stock for as long as it takes to get called away.",[],1
565,gyuwnlu,2021-05-20,t1_gyuqumi,stocks,"Depends on the chip market, otherwise Ford is really good at cranking out lots of cars.",[],1
566,gyuwnzr,2021-05-20,t3_nh5i9p,stocks,The Vanguard real estate index fund VGSLX is stable and it's done ok in gains for the year and last 5 years. It pays a dividend too.,[],0
567,gyuwqy1,2021-05-20,t1_gyuu22b,stocks,"If they made a new version of my 2002 Ranger, I wouldn't complain. But at this point, I'll take what I can get.",[],0
568,gyuwr3h,2021-05-20,t3_ngi6ua,stocks,JPOTF - they make electronic gambling equipment. Super cheap low volume penny stock,[],0
569,gyuwrkx,2021-05-20,t1_gyuucbv,stocks,"Your stop price is irrelevant, it's only a trigger. It's not a real order. The real order is the market or limit order that get created once the trigger gets hit.

The order will go to the exchange as a market order as soon as the stock trades at or below your stop price. If the next best bid is 20% less then so be it. Granted, you are describing an extraordinarily rare circumstance because market makers provide the necessary liquidity to keep exactly that from happening. This kind of scenario is much more likely to play out on OTC stocks that trade 5000 shares a day.

A stop market order isn't much different than hitting the 'sell at market' button. The only difference is that you set it to go live only if it reaches a certain threshold. When you hit the sell at market button, how often do you get filled a price 20% lower than the last trade?",[],1
570,gyuwscy,2021-05-20,t3_nh8z0s,stocks,"Sorry, your [submission](https://www.reddit.com/r/stocks/comments/nh8z0s/i_was_on_yahoo_finance_and_i_saw_what_analysts/) in /r/stocks has been automatically removed due to Rule 3:  Low effort.

If you just want to post 1 liners or just want to know everyone's thoughts, then post a comment to our daily discussion thread which are generally stickied or [click here.](https://www.reddit.com/r/stocks/search?q=author%3Aautomoderator+daily+discussion&restrict_sr=on&sort=new&t=all)

If you're wondering **why a stock moved** a certain way, check out [Reuters](https://www.reuters.com/), [Motley Fool](https://www.fool.com/), and **especially** [Finviz](https://finviz.com/quote.ashx?t=spy) **which aggregates the most news for almost every stock**.

If instead you're wondering what a term means, go to Investopedia.com and search for said term there.

Either way come back here to repost with your findings, thanks!

A list of the [rules can be found here](https://www.reddit.com/r/stocks/about/rules/), and if you're new to r/stocks please see the [wiki](https://www.reddit.com/r/stocks/wiki/index) and/or [read this post.](https://www.reddit.com/r/stocks/comments/4x1419/if_youre_new_here_read_this_post_first/)

*I am a bot, and this action was performed automatically. Please [contact the moderators of this subreddit](/message/compose/?to=/r/stocks) if you have any questions or concerns.*",[],1
571,gyuwuqf,2021-05-20,t3_ngvmrw,stocks,"Anyone else DE gang here? Earnings tomorrow, 8% decline in the past week. I'm banking on a 10-12% jump in the next two weeks.",[],0
572,gyuwxq6,2021-05-20,t3_ngt4js,stocks,DNMR Calls.,[],0
573,gyuwyrb,2021-05-20,t1_gyufjdi,stocks,"I'm down 5% on Amazon, bought at the wrong time apparently.",[],0
574,gyuwytv,2021-05-20,t1_gyui9k3,stocks,"Yeah bro, I mean you could loose the entire $100.

HIGH RISK",[],0
575,gyux0q6,2021-05-20,t3_nh7ld4,stocks,whats the point in buying all of them when you can just buy into VOO? Another point is that these are major companies that you don't have any special information over others so there's no point buying them when you can index.,[],0
576,gyux0v5,2021-05-20,t3_ngvmrw,stocks,"is the fuckin market gonna allow 3 straight days of increases through tomorrow?

million dolla question",[],0
577,gyux1pl,2021-05-20,t1_gyuplnj,stocks,"I feel the same way, if Ford is selling X number of cars per year now, switches over to EVs, and sells the same number of cars, why would that improve the share price? If anything you're just mitigating loss of market share, I suppose that could be a good sign to investors but I would expect explosive growth from a company who's business model is essentially ""we're trying our best to not become irrelevant""",[],1
578,gyux339,2021-05-20,t1_gyuovcc,stocks,Let us know what you find,[],0
579,gyux3kn,2021-05-20,t1_gyuv4mh,stocks,Well I’d trust them purely on the fact that they are building a whole factory dedicated to it.,[],0
580,gyux4hg,2021-05-20,t1_gyutmac,stocks,I sold AAPL and AMZN to buy a house... in 2007.,['AAPL'],1
581,gyux660,2021-05-20,t1_gyutfnf,stocks,Outside of reddit public sentiment seems decent from what I have seen. Plus at that base price it seems like a home run for Ford.,[],1
582,gyux6lp,2021-05-20,t1_gytj0ai,stocks,When the company becomes a 100-bagger in 5 years I will remember this comment. See you in court!,[],0
583,gyux6r7,2021-05-20,t1_gyulv3d,stocks,"Hi, fairly new to this. Can you point me to an explanation of what those wave cycles are",[],0
584,gyux8mn,2021-05-20,t1_gyup7vr,stocks,Chill,[],0
585,gyuxa79,2021-05-20,t1_gyuvy2i,stocks,Thank you! Ford is just giving the person who was already intending to spend $60K+ another option in the Ford family while drawing in people who'd never have considered an ICE F150.,[],1
586,gyuxbjg,2021-05-20,t1_gyuv5qc,stocks,"assuming you were from the future and could time everything perfectly with the knowledge of hindsight...You could buy 20\* leveraged CFD's (buy 20$ worth of stock for every 1$ you have, if stock goes down 5% you got 0$ and lose everything, but if timed perfectly....)

Not sure if calls would yield a higher return or not, but CFD are easier to understand at least, theres no gamma theta etc.",[],0
587,gyuxbqf,2021-05-20,t3_nh8q13,stocks,Garbage can,[],0
588,gyuxddn,2021-05-20,t1_gyu6o4r,stocks,Isn't everyone around here fond of saying to zoom out? Well zoom out on that which must not be named...,[],1
589,gyuxdro,2021-05-20,t3_ngvmrw,stocks,"SEDG, ENPH, and TAN (solar ETF) have been crushing it the past 5 days!",[],1
590,gyuxdus,2021-05-20,t1_gyuvheg,stocks,"Speaking about oil, what's a good oil stock or etf?",[],0
591,gyuxedx,2021-05-20,t1_gyuwg1t,stocks,"It went high enough that I could have cleared what we owe on my condo and our cottage... Talk about life changing while I'm out of work because of Covid!

But still, I find it sad that it's not worthless anymore because the community back then was much more fun, with the tip bot getting banned in multiple subs because people were tired of others tipping thousands of coins left and right 😂",[],1
592,gyuxemz,2021-05-20,t3_ngvmrw,stocks,Who is ready to get deep dicked by red tomorrow lol,[],0
594,gyuxhfz,2021-05-20,t1_gyuul42,stocks,Spent a week going through hard drives to find my wallet with 47k. Sold at $.06.,[],1
595,gyuxj79,2021-05-20,t1_gyuw8r7,stocks,Goodbye,[],0
596,gyuxk40,2021-05-20,t1_gyuwg7u,stocks,"It seems exciting to have a new electric f150 etc. But they've been selling the shit out of gas f150's forever. I don't understand how the new electric vehicles are supposed to make them more profitable. As you said, they've invested enormous capital just to replace their old line. Keeping their market share seems like the best outcome and that's not going to boost profits.",[],0
597,gyuxlmy,2021-05-20,t1_gytfp73,stocks,The Hedgies did this hard on game Stonk many times. I remember it locking up 5 times in a row and before you knew it it had lost 25%,[],0
598,gyuxlrf,2021-05-20,t1_gyumjru,stocks,">sold ATM calls. For 10% dividend, you are exposing your portfolio to corrections and never recovering from it with very little upside.

you're exchanging the decrease in principle for a increase in dividend. you sure are a smart one",[],0
599,gyuxmfi,2021-05-20,t3_nh7ld4,stocks,Surprised no GME - since so many are going to be holding it for the next 30 years just waiting for that squeeze lol,['GME'],1
600,gyuxmgl,2021-05-20,t3_nh6bxq,stocks,Cheap contracts,[],0
