,created,subreddit,text,comment_id,parent_id,Organizations,Sentiment
751,2021-05-26,investing,"True but the question is the extent of the damage and if you look up the concerns over the environmental impacts of space travel, the main concern is over depositing carbon directly into the stratosphere where it is capable of doing disproportionate damage in comparison to other forms of pollution from human sources (for questionable benefit).

https://agu.confex.com/agu/fm20/meetingapp.cgi/Paper/757176

https://www.nature.com/news/2010/101022/full/news.2010.558.html",gzh4nv8,t1_gzh3a2u,[],0
752,2021-05-26,investing,Im assuming they deleted that because of your extracurricular ad hominems (didn't see that bit to be honest) but if they don't give you that dividend where does that cash go? On the balance sheet contributing to the value of the underlying not into your account to be taxed.,gzh4zix,t1_gzh3n77,[],0
753,2021-05-26,investing,"what is your impact?  what are you contributing?  Where do you come from?  Were people moved so your family could live there?  We can do this all night...

I know I personally take more than I give, most everyone does.  sure, I served, but did I save the planet?  well, not by myself.  ;-)

Maybe it does not always come down to an equation...maybe we get to live our best life without guilt?",gzh503v,t1_gzgxtkl,[],1
754,2021-05-26,investing,There are way more bag holders in that sub than winners.,gzh5045,t1_gzfegs5,[],0
755,2021-05-26,investing,Here is an idea.  Sell some an a spike wait 31 days or more and buy back in on a dip.  You will realize the profit and creat a new long term position on a company you are still bullish on.,gzh51ml,t3_nl6zd6,[],1
756,2021-05-26,investing,Thanks for clarifying that the space industry isn't the same as a tablet... it was not imaginable even a few years ago that a company (let alone 3) would be closing in on opening up space commercially. Message me in 2 decades and tell me if you're impressed or not. Prepare for something amazing!,gzh51nu,t1_gzh4b95,[],0
757,2021-05-26,investing,"**Hi, welcome to /r/investing. Please note that as a topic focused subreddit we have higher posting standards than much of Reddit:**

**1)** Please direct all **advice requests and beginner questions to the stickied daily threads.** This includes beginner questions and portfolio help.

**2) Important: We have strict political posting guidelines** (described [here](https://www.reddit.com/r/investing/comments/cyee69/formal_posting_guidelines_for_political_topics/) and [here](https://www.reddit.com/r/investing/comments/escewo/temporary_rule_change_what_happens_to_stocks_if/)). Violations will result in a likely 60 day ban upon **first instance.**

**3)** This is an open forum but we expect you to conduct yourself like an adult. Disagree, argue, criticize, but **no personal attacks.**


*I am a bot, and this action was performed automatically. Please [contact the moderators of this subreddit](/message/compose/?to=/r/investing) if you have any questions or concerns.*",gzh53bp,t3_nl8046,[],0
759,2021-05-26,investing,"What is the difference between structured products vs structured investments vs structured notes? 

From what I understand, notes are debt securities which mean that you get your notional back in the end if your bet pays off. What is the difference between SPs and SIs?",gzh55xk,t3_nkl62k,[],0
760,2021-05-26,investing,">t doesn't make sense to deprive ourselves of the extraordinary because of it. 

ironically this exact mentality is what destroys the extraordinary. Exotic ecosystems get destroyed because people flock by the millions to them, trampling them into the ground and leaving waste everywhere, exotic birds become endangered or extinct because people are willing to pay tons of money to buy them from poachers, the list goes on. This western hubris and ""exploring the unknown"" by messing with rare and vulnerable shit that you don't even understand properly instead of letting experts who love and take care of these things wow you with the data they collect on it is we have such ridiculous things now like tourism in Antarctica.   


I'm not making claims either way as to whether commercial space flights will have a significant impact on the environment or not, but this ""you gotta live life bro"" mentality is myopic and selfish.",gzh58ih,t1_gzh3a2u,[],0
761,2021-05-26,investing,"It will wear off, because there’s not much more than orbits, maybe the moon and Mars.  

And let’s be real, this is Virgin Grouo. They are not research competent and this business won’t have the resources to fund more development as the product gets stale or to lower costs further. 

Every part of this business is high cost and high liability and they rely on impeccable execution over time. Not betting on that, especially when we see what a good company like space x can already do today.",gzh599e,t1_gzgdv5h,[],0
762,2021-05-26,investing,shipping costs kill it.,gzh59kx,t1_gzh0bt6,[],1
763,2021-05-26,investing,"Efficient market hypothesis.

You have to either figure out something the market doesn't already know or get lucky in order to outpace the market. 

With Covid ending I think it's more important than ever to get out of stuff you don't believe will do well in the long run. The volatility is waning and included in that is the lowering of the ceiling. 

That being said, I'm looking at business models made obsolete by COVID and what might hit its stride post COVID. Plus you have to take into account the new president. 

Typically they kick the can the first 1-2 years so I'm pulling out of sectors Biden will be taking money out of and putting in on stuff he and Obama shoveled money into before.",gzh5a6i,t3_nl6zd6,[],0
764,2021-05-26,investing,"I didn't say an ad hominem against you, just the thought you're pushing. Mods will have it back up in the morning.",gzh5db6,t1_gzh4zix,[],0
765,2021-05-26,investing,"just an expensive theme park ride for the very rich?  And on top of that it damages the environment?"" 

I'm not moving.",gzh5ep2,t1_gzh1x5k,[],1
766,2021-05-26,investing,you said this so much nicer than I did.  Great job!,gzh5gmp,t1_gzh3a2u,[],1
767,2021-05-26,investing,"OP- to your statement Amazon spent ~$46B on R&D over TTM, the next closest is Google which was $28B. The rest are close to $20B. I think investors sometimes overlook how much Amazon invests in its future (and what it would do to their PE if they were more in line with their peers).

Of all the FAAMG’s I’m most bullish on Amazon followed by Microsoft over the long run (long on Seattle area haha). Over the long run you need to go with culture - as been said before on this forum, the rest of these businesses have golden eggs (Instagram, Windows, iPhone, Search, YouTube, etc.) - I think Amazon is the only one with a Golden Goose. Brutal but effective internal culture leads to accurate and rapid decision-making (recommend Brad Stone’s books if want to learn more). They have a deep bench so I think they’ll continue to do well in the Jassy era and will have Jeff watching over from the board. As far as Google, Facebook, and Apple are concerned (most of which I own) - these really haven’t come out with a new/innovative product in over a decade. Nothing wrong with that, just skeptical they’ll be able to reinvent themselves when something disruptive arrives. Again though, I like all these companies and own all them but Apple and would much rather be sitting in them than Proctor and Gamble or Coke or some of these “Value” stocks.",gzh5kog,t3_nl7vi9,['AAPL'],0
768,2021-05-26,investing,That's a real leap to suggest that rich people as a whole get richer means that this specific company will make money in these areas. For all you know the first flight has vomit flying all over the cabin and people start rushing to get their money back and it's Fyre Festival all over again.,gzh5qzo,t1_gzh4n4n,[],0
769,2021-05-26,investing,"For what it is it isn't bad. I prefer Starwood.

Mortgage REITs aren't my thing. They don't usually own much property--some do and are more hybridized. 

Equity REITs usually offer you a much better return over a multi year time frame. Arbor isn't bad in its subsector, but the subsector just isn't good.",gzh5z18,t3_njtnys,[],1
770,2021-05-26,investing,"Sure thing bud, not sure what I'm pushing other than math.",gzh60up,t1_gzh5db6,[],0
771,2021-05-26,investing,*accountant?,gzh67re,t1_gzgxhvq,[],0
772,2021-05-26,investing,Your viewpoint doesn’t take into account that their profits are being plowed into growing the business. They could simply slow factory growth and still be profitable with zero credits. They are maximizing their advantage. It’s a disingenuous take.,gzh6cgl,t1_gzgn51e,[],0
773,2021-05-26,investing,If you have a life insurance policy and you don't die in any way that is against said policy then I guess that's what you want. You could also die in a workplace accident/product malfunction and your family could be awarded compensation after ur passing but idk.,gzh6dh2,t1_gzgxhsh,[],1
774,2021-05-26,investing,"Their suborbital flight path is about 1/10 the energy to reach orbit. Look up Everyday Astronaut's video about rocket pollution for some perspective. 

As a tourism activity, it's probably comparable to flying a private jet a few thousand miles.",gzh6haq,t1_gzh44za,[],0
775,2021-05-26,investing,Sarcastic.,gzh6i45,t1_gzh4e2b,[],0
776,2021-05-26,investing,"That portfolio doubles your money every 2-3 years,  has .63 correlation to the US stock market and its worst drawdown in the past 11 years was -19.52% compared to SPY’s -19.43%. It was fully recovered from the pandemic by May 2020. It swings harder than SPY but it’s far from being a gamble, which is why I’ll never use that strat, so I guess you’re right 😂",gzh6k50,t1_gzfnys6,[],0
777,2021-05-26,investing,"I don't see why would any normal everyday person pay extra to go to space. 
There's literally nothing to see, also the trip will cause health issues as nausea etc.

Most families won't use it  ...

So the target us a niche of wealthy spoiled bratts. Gl",gzh6moq,t3_nl3ne2,[],0
778,2021-05-26,investing,TSP typically adjusts for risk over time based on your retirement goal doesn't it?,gzh76f5,t3_nl8046,[],0
779,2021-05-26,investing,Space crack,gzh776w,t3_nl3ne2,[],0
780,2021-05-26,investing,"Concorde was going to revolutionize the airline industry with supersonic flight. It sounded great and felt like the next natural step to subsonic flight. It was certainly used, but ultimately failed becuase it was not market viable after so many years. 

Actual space travel might be different becuase of the lack of friction in space. Air resistance is the biggest blocker in air travel, so eliminating that barrier sounds awesome. But who knows, the energy it takes to exit the atmosphere might be *astronomical* to a point where it would bury the whole business, and thus space travel industry, back in the dirt. 

Maybe I'm too small money, but it sounds quite risky to me given the engineering challenges that still need to be overcome *and*  industrialized before it starts to look like a reasonable investment to a retail investor like me.",gzh78rh,t3_nl3ne2,[],0
781,2021-05-26,investing,Gtg,gzh7asy,t3_nl76tb,[],0
782,2021-05-26,investing,I needed to see this. Thanks for making this post.,gzh7gy1,t1_gzgjxqe,[],1
783,2021-05-26,investing,DeFi solves this,gzh7ntp,t3_nl640m,[],0
784,2021-05-26,investing,Never purchase an individual stock you aren't willing to hold for five years.,gzh7zib,t3_nl6zd6,[],1
785,2021-05-26,investing,"Your submission was removed because it is a short post. Any self-post below 400 characters in the body will be removed.  Please refer to rule 6 and make sure your post meets our standards of effort. Automod evasion will be met with a lengthy ban. Do not post just an article; highlight the parts of the article you find relevant or offer some commentary surrounding the article. Self-posts that offer some simple thoughts or questions like ""what do you think"", ""here's my thoughts"", etc. belong as comments to existing posts or the [Daily Advice Thread](https://www.reddit.com/r/investing/about/sticky?num=2).

*I am a bot, and this action was performed automatically. Please [contact the moderators of this subreddit](/message/compose/?to=/r/investing) if you have any questions or concerns.*",gzh83q4,t3_nl8hof,[],1
786,2021-05-26,investing,Government subsidies,gzh8489,t3_nl3ne2,[],1
787,2021-05-26,investing,Stocks are inversely correlated with inflation.,gzh84ro,t1_gzcmkhs,[],1
788,2021-05-26,investing,I can buy the ticker VIX on think or swim via TD Ameritrade.,gzh863n,t1_gzgw5fz,[],0
789,2021-05-26,investing,I don’t,gzh88jp,t3_nl3ne2,[],0
790,2021-05-26,investing,Use AAVE for a loan,gzh8jb0,t3_nl640m,[],0
791,2021-05-26,investing,Company change they still killing it in financials keep it something looks baad sell,gzh8k20,t3_nl6zd6,[],0
792,2021-05-26,investing,"Profit? The world doesn't even know the meaning of it anymore. 

It's like how they were securing investments based on page views and unique visitors during the dot com bubble. That's what they're counting.",gzh8mfl,t3_nl3ne2,[],1
793,2021-05-26,investing,"Rather at year end you sell the losers to offset the gain for capital gain tax reason.

The ones that reached yearly highs were sold. One should check the last 10 or 20 years the momentum stocks and most got sold or merged.",gzh8r76,t3_nl6zd6,[],1
794,2021-05-26,investing,"Firmly disagree.  I look for beat down sectors that can only go up.  There is no minimum for holding although for tax purposes, I'd like to hold for a year if possible.  
No way in hell I'm holding all the oil companies I currently have for five years.  But I'm not ready to sell either, not even the ones up 5x+.",gzh8tw6,t1_gzh7zib,[],1
795,2021-05-26,investing,Okay.,gzh92os,t1_gzh8tw6,[],1
796,2021-05-26,investing,"OP. Would you care to explain a little more about this deal you made because the way you put things up, buyer basically assumes no risk and all reward.

What is this?",gzh97ok,t3_nl640m,[],0
797,2021-05-26,investing,Is it a good time to invest in s&p500 now? I’m planning to hold long term and putting in 10k. Should I wait for a market correction or a crash first?,gzh9c5z,t3_nkl62k,[],1
798,2021-05-26,investing,"Your submission was automatically removed because it contains a keyword not suitable for /r/investing.  Common words prevalent on WSB, hate language, or derogatory political nicknames are not appropriate here.  I am a bot and sometimes not the smartest so if you feel your comment was removed in error please message the moderators.

*I am a bot, and this action was performed automatically. Please [contact the moderators of this subreddit](/message/compose/?to=/r/investing) if you have any questions or concerns.*",gzh9cx6,t1_gzh9cwf,[],0
799,2021-05-26,investing,"The flight emits about 60% of the carbon footprint per passenger as a round trip flight from New York to London in terms of co2. 70% of that is from the mothership.

As for the nitric oxide rocket engine, that fuel largely decomposes into oxygen rich gases, so not really sure how relevant your comment is. 

So yeah if that’s really how you feel I highly suggest never flying or driving a car again.

Virgin Galactic flights also carry scientific instruments from NOAA to measure various aspects of the upper atmosphere since their balloons can only reach about 25,000 feet which is a fraction as high as virgin will send passengers.",gzh9ga0,t1_gzgxtkl,['SPCE'],1
800,2021-05-26,investing,Yeah I don’t disagree with that. People definitely do not equate “millionaire” with $40k/year.,gzh9gkx,t1_gzgbrt0,[],1
801,2021-05-26,investing,"He has a heck of a personality. That’s what people are buying, the idea of Branson but his best days are past",gzh9oz5,t1_gzgff18,[],0
802,2021-05-26,investing,If you’re in a lifecycle fund,gzh9v7a,t1_gzh76f5,[],0
803,2021-05-26,investing,Don't make investment decisions on rumors. Also when you give advice to someone else you have to be 100% sure because if you're wrong you look like an idiot and don't expect credit if you're right.,gzha1ke,t3_nl8046,[],0
804,2021-05-26,investing,You managed to sell a company for .75mm but aren’t sure how to manage this?,gzha3c0,t3_nl640m,[],0
805,2021-05-26,investing,"Your submission was automatically removed because it contains a keyword not suitable for /r/investing.  Common words prevalent on WSB, hate language, or derogatory political nicknames are not appropriate here.  I am a bot and sometimes not the smartest so if you feel your comment was removed in error please message the moderators.

*I am a bot, and this action was performed automatically. Please [contact the moderators of this subreddit](/message/compose/?to=/r/investing) if you have any questions or concerns.*",gzha89l,t1_gzha88h,[],0
806,2021-05-26,investing,Pacific booker minerals up in Canada is sitting under $3,gzhafqj,t3_nl76tb,[],0
807,2021-05-26,investing,Time in the market always beats timing the market. Traditional wisdom says invest now : ),gzhaiw7,t1_gzh9c5z,[],1
808,2021-05-26,investing,877 Cash NOWWWWWWW,gzhaj79,t1_gzh3434,[],0
809,2021-05-26,investing,"Virgin Galactic is so speculative I don't know that it's a stretch to call it a scam. There was genuine value in attempting this form of space tourism 10 years ago - Richard Branson initially predicted a spaceflight would come in 2009. But now the entire flight profile is so ludicrously expensive and impractical compared to what SpaceX, Blue Origin, and other companies attempting manned reusable rockets that I'm not sure what market they're trying to capture any more. SpaceX will carry civilians to the **Moon** within a few years. It won't be long before they have commercial suborbital flights, and the price will be a tiny, tiny fraction of the $250,000 that Virgin Galactic is asking for.

 Their entire business model has been put into question with the development of reusable rockets. That they decided to IPO not long after that development makes it seem to me that they're just trying to keep the company alive as long as possible, which isn't easy when you consistently bleed over $100M in expenses a year on virtually zero revenue.",gzhajl8,t3_nl3ne2,['SPCE'],1
810,2021-05-26,investing,"Hey- hoping to hear some feedback on my plan.

I’m 23 years old, CPA, currently investing about 2k per month into individual stocks. Total portfolio is about 40k, made up of 28 stocks. Mostly high multiple tech (cathie wood stocks), but I keep some FANG and high yield REITs. I also have a Roth that I contribute 500 per month into something more conservative (I think Vanguard?)

I won’t need the money for 20-30 years, and I’m comfortable holding through volatility. My focus is really just finding quality companies that will be long-term winners. My question is:

1. How many stocks is enough to be adequately diversified as the portfolio grows? I feel i could cut down to under 20 stocks and concentrate in my top holdings. 

2. I’ve been aggressively buying stocks on the way down and trimming positions on the way up. Does it make sense long-term to take profits often?

Thanks in advance",gzhakem,t3_nkl62k,[],0
811,2021-05-26,investing,"No. It’s not. 

There are roughly 150k to 175k commercial passenger jet flights per day worldwide.

Virgin optimistically plans for 8000 flights over the next decade. Total emissions are roughly 70% of a roundtrip flight from NY to London. Or based on a per passenger carbon footprint metric, 60% of that same roundtrip flight.

So you’re looking at adding 1/114,700th more emissions over a decade if airline traffic doesn’t increase at all during that period, which it obviously will.

I wouldn’t exactly call that massive.

People driving cars to go to trailheads for hikes likely has a few orders of magnitude higher impact.",gzhaqvk,t1_gzh44za,[],1
812,2021-05-26,investing,Profitable if you're buying PUTS,gzhars8,t3_nl3ne2,[],0
813,2021-05-26,investing,"Your submission was removed because it is a short post. Any self-post below 400 characters in the body will be removed.  Please refer to rule 6 and make sure your post meets our standards of effort. Automod evasion will be met with a lengthy ban. Do not post just an article; highlight the parts of the article you find relevant or offer some commentary surrounding the article. Self-posts that offer some simple thoughts or questions like ""what do you think"", ""here's my thoughts"", etc. belong as comments to existing posts or the [Daily Advice Thread](https://www.reddit.com/r/investing/about/sticky?num=2).

*I am a bot, and this action was performed automatically. Please [contact the moderators of this subreddit](/message/compose/?to=/r/investing) if you have any questions or concerns.*",gzhb0um,t3_nl8zdl,[],1
814,2021-05-26,investing,"My understanding is that inflation helps stocks because all of the numbers get bigger, so your hypothesis is correct.

There are a number of factors that combine to cause sector rotation.  In this case, the expectation of interest rates is assumed to be a major factor because all companies have to borrow money and this will impact the bottom line.",gzhba7u,t1_gzgi3x3,[],0
815,2021-05-26,investing,Greatest edge you can have is to not know what you're doing. By performing randomly you achieve the average investors return (on average) but without the cost of an index tracker. If you believe this comment you should not be investing.,gzhbdfw,t3_nklmfn,[],0
816,2021-05-26,investing,"You'll need to pass the SIE (Securities Industry Essentials), Series 7, and probably Series 66 to become a fully licensed advisor. 7 is a requirement for commission-based and the 7 & 66 are needed for fee-based (simplified but those are two of the main differences in the two primary licenses needed to become an advisor). 

Investopedia is a great beginner's resource to look up different terms and the basics of the licenses. FINRA's website will also be a good place to go for a more in depth look at what the licenses test on.

One important thing to note is that you cannot take the 7 or 66 on your own, you have to be sponsored by a FINRA registered member firm. This would likely mean you would have to talk to your CU and the investment firm you work with to sponsor you (most places will pay for your study material and exam fees if you pass).

I know quite a few loan officers who have transitioned into advisors and stayed within their bank to help clients, so it's definitely doable but be prepared to sell. As much as you may want to help clients, you're also going to be held accountable for how much business you bring in (both in AUM, assets under management, and commission and fee revenue).",gzhbmfw,t3_nl3djx,[],0
817,2021-05-26,investing,"You wait. The DOW hit an all time high of 15,000 in the spring of 2013. Now, just 8 years later, it's more than doubled that. Today's ath is next years low.",gzhbnqs,t1_gzh2dtr,[],1
818,2021-05-26,investing,Selling spacecakes.,gzhbps3,t3_nl3ne2,[],0
819,2021-05-26,investing,This is the way.,gzhbpxj,t1_gzgespp,[],0
820,2021-05-26,investing,"Hi Redditor, it would seem you have strayed too far from WSB, there are too many emojis detected. Try making a comment with no emoji at all.  Have a great day! 

*I am a bot, and this action was performed automatically. Please [contact the moderators of this subreddit](/message/compose/?to=/r/investing) if you have any questions or concerns.*",gzhbste,t1_gzhbssa,[],1
821,2021-05-26,investing,"How is the market imploding? We've seen a correction, but things seems to be stabilising now.
No offence but your parents investment's are their own, and if you're worries are based on rumours or concerns about a market crash, then its unfounded imo.",gzhbuii,t3_nl8046,[],0
822,2021-05-26,investing,"If they don't have an answer for how they'll be profitable then they never should have gone public. SpaceX is managing just fine, operating with pretty fat margins on Falcon 9 while still being the most cost-effective medium-heavy launch provider on the market.",gzhbwsx,t1_gzgnxe2,[],0
823,2021-05-26,investing,Just $100?,gzhbx9r,t1_gzgu4fs,[],0
824,2021-05-26,investing,"I can't justify $100k even though I'd really like to have the experience... But a ride on a vomit comet is like $5k.  That, I could probably justify to myself :-)",gzhc7i0,t1_gzgtxc1,[],0
825,2021-05-26,investing,"My take profit stop loss goes like this, okay that fell below the line keeps dropping, me maybe we'll get a turnaround lol",gzhc7nx,t1_gzhbx9r,[],0
826,2021-05-26,investing,"I haven't sold any of my winners so far this year, only the losers so far",gzhcb76,t1_gzh8r76,[],1
827,2021-05-26,investing,"Feel like Taylor Dart has a good feel for how the gold miners stack up internally within the industry. He likes Newmont followed by Kirkland Lake. There was one he also liked with operations in Zimbabwe that I forgot the name of. 

I personally am a big Mark Bristow fan and think he will do well for Barrick after decade(s) of poor performance - was a great signal after he walked away from overpaying for copper tie-ups. The old Barrick would have bought in at any price.",gzhccko,t3_nl76tb,[],0
828,2021-05-26,investing,"I like this idea a lot, thank you.",gzhcem8,t1_gzh51ml,[],1
