,comment_id,created,parent_id,subreddit,text,Organizations,Sentiment
0,gz2bvdg,2021-05-22,t3_nhoers,stocks,How high could SPCE go on Monday? Test Flight was a success,[],1
1,gz2bvjt,2021-05-22,t1_gz26zv3,stocks,Shill,[],0
2,gz2bxtb,2021-05-22,t1_gz1a72e,stocks,"KO and V are great picks, I would buy when they are cheaper to reduce your cost basis and keep on adding to your positions for a year. Should be all set by mid 2022 IMO.",[],1
3,gz2bxyw,2021-05-22,t1_gz2b475,stocks,Thank you 👍,[],1
4,gz2by50,2021-05-22,t1_gz231pn,stocks,Shill,[],0
5,gz2c0kc,2021-05-22,t1_gz0ijqf,stocks,"The questions arise from business analysis.  I find reading business cases helpful that also provide the analysis.  This is not something that requires a formal business education.  Some of my favorite and most useful books that have helped me with business analysis deal with human behavioral psychology as well.  I like, not in any particular order.
1. The Art of War, Sun Tzu
2. Win Bigly, Scott Adams
3. Skin in the Game, Talib
4. David and Goliath, Malcolm Gladwell
5. The Bhagavad Gita
6. HBR cases.
7. Tipping Point, Gladwell

There are more but that is what comes to mind.",[],0
6,gz2c1ra,2021-05-22,t1_gz2b91l,stocks,Let me know what you think of those 3,[],0
7,gz2c40a,2021-05-22,t3_niiukt,stocks,"In regards to the ADR/Cayman islands risk. Is it hard to buy the HK listing being in the US? I dont hold BABA but I see it available as 9988 | KYG017191142 in Hong Kong through Degiro (I am European).
Of course broker fees are a bit higher than NYSE but not significant, even for a retail investor it won't exactly eat your profit.",[],0
8,gz2c637,2021-05-22,t1_gz2515p,stocks,Not yet,[],0
9,gz2c838,2021-05-22,t1_gz2bjb2,stocks,"There is not a lot I can tell you except that all of the theories are based purely on wild conjecture and misunderstanding.

Take the concept of ""short ladders"" which has been very popular recently. I can't easily give you evidence that proves that short ladders don't exist precisely because their nonexistence means nobody has written about them.

The easiest way to figure out that the theory is bunk is to look at the actual short interest data. It is not high. There is no short squeeze without high short interest. This is the crux of the MOASS theory and it is just plainly wrong on the face of it.",[],0
10,gz2c8p3,2021-05-22,t3_nhoers,stocks,"CATHIE WOOD literally bought SPCE at the top and sold at the bottom, LMFAO.",['SPCE'],0
11,gz2c9bp,2021-05-22,t1_gz1smpr,stocks,I’ll never get completely out of tech but I have trimmed mine down and added some industrial/material stocks,[],0
12,gz2clax,2021-05-22,t1_gz2bxtb,stocks,"Thanks for the advice. As a new investor, how would you rate my portfolio/what would you say of it overall? Am I on the right track/were my investments ""logical/sound"" enough?  Thanks for the read. Interesting how you say I should be all set by mid 2022 as well, which is not far at all in the grand scheme of things",[],1
13,gz2cm05,2021-05-22,t1_gz2bvjt,stocks,great point,[],1
14,gz2cp9q,2021-05-22,t1_gz2bknm,stocks,"Do it without linking to superstonk lmao, that is not evidence, it is speculation by a stranger on the internet",[],1
15,gz2cq2v,2021-05-22,t1_gz23lzm,stocks,yes just please do something AAPL,['AAPL'],0
16,gz2cqoe,2021-05-22,t1_gz2b7vz,stocks,Yup. Doesn't change the fact that the stock can make you a lot money.,[],0
18,gz2cvko,2021-05-22,t1_gz2avan,stocks,"Exactly. A broken STOCK, not a broken COMPANY.",[],1
19,gz2cxci,2021-05-22,t1_gz2c8p3,stocks,She is such an idiot. Every time I read about something she does it just makes me lol.,[],0
20,gz2cz6q,2021-05-22,t3_niiukt,stocks,Black sheep!,[],1
21,gz2czox,2021-05-22,t1_gz2bvdg,stocks,Can they make profit on it though?  And how soon.,[],1
22,gz2czuf,2021-05-22,t1_gz278k9,stocks,"Ah but what if its a contrarian of a contrarian!! Idk i think the fear of poohbear is overblown and that they will continue to make money, aka stonks up. Buy puts! Fight me! :p",[],0
23,gz2d1fg,2021-05-22,t1_gz1le02,stocks,"Me too, but in the end I would rather average into the market continuously than sit around with cash twiddling my thumbs waiting on a crash that may not happen for years",[],0
24,gz2d3jn,2021-05-22,t3_nilf7d,stocks,Congrats to the Virgin Galactic team! Can't wait for Monday,[],1
25,gz2d7lr,2021-05-22,t1_gz2clax,stocks,"I believe you should be set by 2022 only because of the assumption of buying these companies when they bottom out near their 52 week low OR a buying opportunity presents itself. Based on how often you invest your money, you can dollar cost average weekly, monthly or even daily. The more you invest smaller portions at a time in particular companies that have a gold business model, the higher your portfolio value will be. 1 full year of this will set you up right to take advantage of a inflationary world economy; everything is rotating now and this is a good time in my opinion to get a better understanding of investing. You are on the right track, as long as you diversify in different companies over time you will be ok.",[],0
26,gz2d97t,2021-05-22,t1_gz2clax,stocks,Good*,[],1
27,gz2dakg,2021-05-22,t1_gz2cp9q,stocks,"You didnt even read them. 

If you're so adamant that it is wrong, actually take the time to read what people are stating and provide counterpoints.

I'd love for someone to prove all of this wrong. In fact, everyone at suprstonk would. We've been trying to get someone to actually provide a good argument why we are wrong and prove all the research is false. 

That hasnt happened yet. 

In fact, experts with decades of experience in different branches of finance, regulation, and finance law have done AMAs and confirmed our suspicions. Some have recently made these same statements in front of Congress.

So please, change my mind.",[],1
28,gz2dcx4,2021-05-22,t3_niliq9,stocks,"Sorry, your [submission](https://www.reddit.com/r/stocks/comments/niliq9/virgin_galactic_completes_first_spaceflight_in/) in /r/stocks has been automatically removed since it was a link only.

**Please resubmit your post & provide some text (or quote) along with your link.**  Also if you have any open positions related to the financial instrument, please include that, thanks!

A list of the [rules can be found here](https://www.reddit.com/r/stocks/about/rules/), and if you're new to r/stocks please see the [wiki](https://www.reddit.com/r/stocks/wiki/index) and/or [read this post.](https://www.reddit.com/r/stocks/comments/4x1419/if_youre_new_here_read_this_post_first/)

*I am a bot, and this action was performed automatically. Please [contact the moderators of this subreddit](/message/compose/?to=/r/stocks) if you have any questions or concerns.*",[],1
29,gz2det8,2021-05-22,t1_gz1ikxn,stocks,Cresco is killing me. Was way up now just hovering like +2%. They're dominating the market but I'm worried they issued to many shares and screwed us shareholders. I have 800@$10.95.,[],0
30,gz2dg9o,2021-05-22,t1_gxsjw76,stocks,"no history yet, so in info to compute the dividend yield.",[],1
31,gz2dgfh,2021-05-22,t3_nig1b3,stocks,"I bought into NAIL on the dip, but the dip kept dipping. The steady homebuilders sentiment numbers are encouraging, but will it recover before a market wide correction or is it time to cut it loose?",[],0
32,gz2dhfv,2021-05-22,t1_gz1crwf,stocks,🤣,[],0
33,gz2dj8a,2021-05-22,t1_gz2dakg,stocks,I can't change your mind because you don't understand how to critically evaluate a source.,[],0
34,gz2dlkt,2021-05-22,t1_gz2c8p3,stocks,"Also did this with workhorse.

That sai, Buffet sold at the bottom for airlines and banks last year. So it's not like she's the only one",[],1
35,gz2dm8y,2021-05-22,t1_gz2d7lr,stocks,"thank you for the advice!! I appreciate the help. I know a lot of new investors try to get into it thinking it's a quick get-rich thing, especially by going into crip-toe. I don't trust crip-toe as of yet and I'm not comfortable with it at all. I figured I'd get my feet wet with traditional stocks and once I have experience I'll dabble in crip-toe. if it works out, great. if not, it was only a small portion and I have my rest of my stocks. 

again thanks for the help. appreciate it.",[],1
36,gz2docp,2021-05-22,t1_gz1yt5u,stocks,Perception 100,[],0
37,gz2dq7c,2021-05-22,t1_gz0ml1i,stocks,"> the production of EV batteries is not a clean one, and may never be a clean one.

It’s a one time thing and lifetime and recycling of batteries is only going to improve over time.

The same thing or worse can be said of hydrogen fuel cells.",[],0
38,gz2dqb0,2021-05-22,t1_gz1smpr,stocks,"The key is to not rotate per say, but buy one on the downtrend and let the other ride up.",[],0
39,gz2dqst,2021-05-22,t1_gz2dj8a,stocks,"Whatever you say. 

Enjoy your sad lonely life",[],1
40,gz2dsp6,2021-05-22,t3_niiukt,stocks,"I just happen to buy some more BABA yesterday, so this is good news!",[],0
41,gz2du9o,2021-05-22,t1_gz25lc9,stocks,Damn the original GME...,['GME'],1
42,gz2dww5,2021-05-22,t1_gz1e55q,stocks,Fuck yourself please,[],0
43,gz2dzg8,2021-05-22,t1_gyxq4l3,stocks,Costco has pretty good oatmilk and it's cheap.,[],1
44,gz2dzr6,2021-05-22,t1_gz27ot8,stocks,"> Who said I wouldn't ever sell?

>  I'm never going to sell

👀",[],1
45,gz2e1am,2021-05-22,t1_gz1hvcp,stocks,Oh he does. It's pretty funny,[],1
46,gz2e2f7,2021-05-22,t1_gz2c838,stocks,"That's fair, I'll have to read more about how short interest works and what a normal range is. I know a lot of people post about the SI and how it doesn't represent what it should be but I have yet to look into it further.

I think what holds people into the idea that GME is real is The Big Short and especially the scene where Micheal Burry says the market is fraudulent. At least that is what my opinion started pivoting on. Obviously this paragraph makes me sound like a complete idiot but that key point is what a lot of DD relies upon.",['GME'],0
47,gz2e9ye,2021-05-22,t3_lv5dlb,stocks,"hi i still have not started stocks trading but i wanna do it , what i cant understand is how do i know which market to pick , i guess that its risky and more rewarding if i invest in a company just starting out but how do i come to know about those companies that are starting out and how do i like know that wether prices are now gonna go down or they gonna go up ???? like",[],0
48,gz2earo,2021-05-22,t1_gz1yxhy,stocks,Well at least she got some closure,[],0
49,gz2ek7o,2021-05-22,t3_niiqns,stocks,Yes no maybe,[],0
50,gz2em1z,2021-05-22,t1_gz1axyw,stocks,The VTI is a collection of every stock in America.,[],1
51,gz2emmi,2021-05-22,t1_gz29tds,stocks,"Damn, you think it could go that low like 170-180… hard to believe but it could happen I suppose.",[],0
52,gz2emyl,2021-05-22,t3_nikw11,stocks,"I strongly believe that Biotech is gonna be the next big industry to revolutionise our world and now would be a good time to invest in a long term play. So thanks for the insight here. 

What company would you say is stable but plowing back most of their cash into innovation for future technologies? Things like neuroprosthetics.",[],1
53,gz2eqpi,2021-05-22,t1_gz1t5p9,stocks,"There’s a few different posts with good info, [check this one out](https://www.reddit.com/r/Superstonk/comments/ngru15/the_flurry_of_rules_before_the_storm_dtc_icc_occ/?utm_source=share&utm_medium=ios_app&utm_name=iossmf)

Basically, in the past 4 months, 4+ rules have been passed regarding what happens when the whole market goes tits up, and the SEC issued large payouts for whistleblowers.  Reverse repo has been insane.  If an event such as a shareholder meeting exposes issues like fraudulent voting, the market will explode.

It sure looks like everyone’s trying to get their ducks in a row now before the rug gets pulled out from under the market by an unfortunate data release.",[],0
54,gz2erxk,2021-05-22,t1_gz2emmi,stocks,It is hard to believe due to the fundamentals of the company but the gosh darn CCP and government are meanies :(,[],0
55,gz2eutg,2021-05-22,t1_gz2d3jn,stocks,Looking fwd,[],0
56,gz2ev9q,2021-05-22,t1_gz27236,stocks,"Also if superstonk makes you too uncomfortable this was posted in stocks a few months ago, give it a read if you have the time https://www.reddit.com/r/stocks/comments/likb1g/naked\_shorting\_in\_gme\_and\_how\_the\_pieces\_suddenly/?utm\_source=share&utm\_medium=web2x&context=3",[],0
57,gz2ewcj,2021-05-22,t1_gz23m8e,stocks,SOXX is a lower risk bet in the space but I don’t think that the industry is as underpriced as you our expect based on demand and supply shortage.,[],0
58,gz2fa4o,2021-05-22,t3_ni8fp6,stocks,"I bought a bunch of shares of KWEB (Chinese Internet ETF) near the peak and saw great gains for a couple weeks before seeing a terrible drop. I keep looking at the numbers for internet commerce growth potential in China and I'm confident it'll get back up there and give me a handsome return one day, but right now I can't help but sigh every time I see the red.",[],0
59,gz2fawm,2021-05-22,t1_gz25byx,stocks,"If it's overvalued, you should try shorting it, put your money where your words are",[],0
60,gz2fdqk,2021-05-22,t1_gz24hko,stocks,But you’d still rather have shares at 215 rather than 233 if you waited until it reversed its downward trend from 195. Right now BABA is a falling knife.,[],0
61,gz2fdu2,2021-05-22,t1_gz26zv3,stocks,that conspiracy theory has me up 70% since april so maybe it’s not a conspiracy after all,[],0
62,gz2fe5f,2021-05-22,t3_nhs698,stocks,"Will definitely enter in on 150-200 for short term possible uptrend until 250, sell and re-enter at the future. Thinking young cheaper investors will increase the price by a bit early on until it cools off.",[],0
64,gz2fhl1,2021-05-22,t1_gz2fawm,stocks,"It's pretty far outside my risk appetite, so no?",[],0
65,gz2fndz,2021-05-22,t3_nig1b3,stocks,We are…. Screwed I think. All this free floating fiat facilitated by the FED will have investors running a circle around inflation. Commodities and value stocks will shine,[],0
66,gz2fni3,2021-05-22,t3_niiqns,stocks,She likes the setup. 👌,[],1
67,gz2fu11,2021-05-22,t3_nhoers,stocks,"When shorting, do brokers borrow from a national pool of equities used by all brokerages or from their own clients/equities?",[],0
68,gz2fz2g,2021-05-22,t1_gz231pn,stocks,"Instead of convincing a cult, it's better for your mental health to enjoy their antics. Some of them would lose money or if they are right (which I don't believe) a lot of them would make millions.

At the end it would neither make you rich nor poor but will give you loss porn to enjoy",[],0
69,gz2fzp3,2021-05-22,t1_gz1rj5j,stocks,Great post,[],1
70,gz2g0ey,2021-05-22,t3_niiukt,stocks,"I'm still not really sure there. 

I believe that the CCP is more than willing to let Alibaba suffer because of its connection to Jack Ma and him falling out of favor.",[],0
71,gz2g11j,2021-05-22,t3_nhnwg4,stocks,"Oatly is sometimes hard to come by and the off-brand Oat-Yeah tastes weird to me but I agree and definitely consider it mainstream.   
Did anyone see that the founders of Oatly are launching a different brand now called Good Idea?   
Apparently it is proven to help with metabolism and getting rid of sugar in the system and helps with energy but has no caffeine... I imagine if it helps metabolism it might help with weight, though I am not sure how it works. 

  
Does anyone know about this? All I could find was a launching soon page [www.goodidea.us](https://www.goodidea.us)",[],0
72,gz2g2cw,2021-05-22,t1_gz254f5,stocks,Well then Amazon is up..,[],0
73,gz2g4qj,2021-05-22,t1_gz1q5gs,stocks,"And if it doesn't, then it's the next week, and then if that isn't the next one, it's the *next* one. And if it's not *that* one, it must be the next one then.",[],0
74,gz2g551,2021-05-22,t1_gz1zx9c,stocks,"No one will admit it... but you can read the following, although not related. Still paint a cute picture for the near future.

https://www.ecb.europa.eu/pub/financial-stability/fsr/html/ecb.fsr202105~757f727fe4.en.html

https://www.federalreserve.gov/publications/may-2021-purpose.htm",[],0
75,gz2g78f,2021-05-22,t1_gz0s4vm,stocks,"Just hang on.  Threads about US and EU trying to give them all kinds of subsidies, taxes, real estate, power/water th oputting fab in Arizone seems like not such a hot idea right now

https://hn.algolia.com/?dateRange=pastMonth&page=0&prefix=false&query=tsmc&sort=byPopularity&type=story

TSM and ASML have full superpowers.  Applied, KLAC, Lam have partial superpowers",[],0
76,gz2gdkb,2021-05-22,t3_ni8fp6,stocks,"Nio, not disappointed too much by the short term decline but it’s very interesting to see where it’s heading",[],1
77,gz2ge4g,2021-05-22,t1_gz287sj,stocks,"If you need to resort to calling things “conspiracies”, then you’re just trying to baselessly slander because you have no actual data.",[],0
78,gz2geen,2021-05-22,t3_nim2p4,stocks,"Sorry, your [submission](https://www.reddit.com/r/stocks/comments/nim2p4/what_are_the_best_stocks_that_you_think_will_go/) in /r/stocks has been automatically removed due to Rule 3:  Low effort.

If you just want to post 1 liners or just want to know everyone's thoughts, then post a comment to our daily discussion thread which are generally stickied or [click here.](https://www.reddit.com/r/stocks/search?q=author%3Aautomoderator+daily+discussion&restrict_sr=on&sort=new&t=all)

If you're wondering **why a stock moved** a certain way, check out [Reuters](https://www.reuters.com/), [Motley Fool](https://www.fool.com/), and **especially** [Finviz](https://finviz.com/quote.ashx?t=spy) **which aggregates the most news for almost every stock**.

If instead you're wondering what a term means, go to Investopedia.com and search for said term there.

Either way come back here to repost with your findings, thanks!

A list of the [rules can be found here](https://www.reddit.com/r/stocks/about/rules/), and if you're new to r/stocks please see the [wiki](https://www.reddit.com/r/stocks/wiki/index) and/or [read this post.](https://www.reddit.com/r/stocks/comments/4x1419/if_youre_new_here_read_this_post_first/)

*I am a bot, and this action was performed automatically. Please [contact the moderators of this subreddit](/message/compose/?to=/r/stocks) if you have any questions or concerns.*",[],1
79,gz2gfjv,2021-05-22,t1_gz1q5gs,stocks,A new cult has been born and it's only going to be worse with time passing.,[],0
80,gz2gfng,2021-05-22,t1_gz26nhr,stocks,"You realise the ""they"" are funded by institutions that benefit from MOASS right?",[],1
81,gz2ghsr,2021-05-22,t3_nig1b3,stocks,"That's funny, all this info on stocks and nothing about the SEC and OCC new filings or its new rule changes. Something smells like FUD.",[],1
82,gz2ghty,2021-05-22,t1_gz28q19,stocks,the amount of fear mongering that happens about china is literally insane. but totally expected as a rival imperialist power to the west. why would it be any other way? like i expect the US to have anything good to say about their soon to be #1 enemy? lol,[],0
83,gz2gojp,2021-05-22,t1_gz24411,stocks,i’d also rather be psychic! who else?,[],0
84,gz2grsn,2021-05-22,t1_gz2dqb0,stocks,"“Re-allocate” — yeah, i getcha, im calling it a rotation",[],1
85,gz2gvj8,2021-05-22,t1_gywurj3,stocks,"I had my old Ford for 300k kms myself. I have heard some people have issues with the f150 but my cars and the ranger were my work horse. I currently bought a new escape and it's a dream . Got their maintenance package and all my tune ups are basically scot free for 7 years. I tried kia, Hyundai, honda and Nissan but I wasn't nearly as impressed with the reliability. I found a lot of the imports cost more to maintain and a lot more went wrong with their electrical and computers. 
On the other hand I've known a few guys who had bad luck with ford's and swear by dodge instead.. ymmv",[],0
86,gz2gxcz,2021-05-22,t1_gz27w4z,stocks,"I did this back in 2013.  10x’d my money.

It’s only a bad decision if it doesn’t work.

Put your money where your mouth is.  Show me the put options you own, or the calls you’ve sold, so you can cash in when this all collapses.",[],0
87,gz2gxk0,2021-05-22,t1_gyn6fpu,stocks,"Wish I bought more, could’ve retired by now",[],0
88,gz2gyhq,2021-05-22,t1_gz2g0ey,stocks,"That is a possibility...but he's no longer the CEO,  they've already slapped a fine on $BABA, Ma went ""missing"" for like 3 months, then reappeared playing golf somewhere near China (He just kept a low profile, signaling he's falling in line with the CCP). They also squashed the Ant IPO (pun intended) so I think they've made their point. It's been like 6 months, so the tensions have cooled, so at these rock bottom prices, I'm more than willing to take that bit of risk.",[],1
89,gz2h0ip,2021-05-22,t3_nilf7d,stocks,"Also, shorts are fucked https://www.ortex.com/stocks/47838/shorts",[],0
90,gz2h19v,2021-05-22,t1_gz2ghty,stocks,"Well, since the US are the reason China has prospered- it makes no sense for them now to hate them. If the US wasn’t so paranoid and reactionary, they would have made China their closest ally and work with them back in the day. Instead they took advantage of all the manufacturing and industry of the Chinese while turning a blind eye to everything else they were doing. 
Now they act all shocked pikachu face when China is establishing itself in the world. 

I dunno this all is so silly. Why can’t we humans just work together to grow as a civilization. It’s so cringe & dumb, literally only holds us back to hate and spread war.",[],0
91,gz2h7a8,2021-05-22,t1_gz2ge4g,stocks,I'm calling them conspiracies because **they** have no actual data,[],0
92,gz2h7id,2021-05-22,t1_gz21rvy,stocks,"Lol their 5 year model assumes tsla will be the most profitable insurance company in the world, running a fleet of robot taxis inside of 4 years. It's absurd on its face.",[],1
93,gz2h8z3,2021-05-22,t1_gz2gxcz,stocks,">It’s only a bad decision if it doesn’t work.

lmao, I wish you all the luck in the world in your investing career, you're going to need it",[],1
94,gz2ha2o,2021-05-22,t1_gynbtw3,stocks,I did not :/,[],0
95,gz2ha74,2021-05-22,t1_gz2g551,stocks,"Thanks, I'll give it a read",[],0
96,gz2hbyk,2021-05-22,t1_gz2dlkt,stocks,"Yeah but you could understand it with buffet. He doesn’t like uncertainties and we were heading into the pandemic and who knew how it was going to pan out. 

She is special.",[],1
97,gz2hfni,2021-05-22,t1_gz2fdqk,stocks,"And if it went to 300 you'd be pissed off you thought you could get a better deal from the 233 point even though when you made your analysis 233 was an undervalued price. Of course I'm talking hypothetically here, not about the company square, I have no idea if 233 was an undervalued starting point of an overvalued one",[],0
98,gz2hg2e,2021-05-22,t1_gz2cqoe,stocks,Ditto,[],0
99,gz2hmo6,2021-05-22,t1_gz2hbyk,stocks,"True.

And on banks buffet more or less sold out of others to buy BAC. So it was probably a wash for him.",[],1
100,gz2hpjg,2021-05-22,t1_gz2gyhq,stocks,"That's a fair way of looking at it, and if you're willing to take the risk, it is definitely a high reward situation.

I'm just used to them not exactly having a ""cool off"" option.",[],1
101,gz2hpxx,2021-05-22,t1_gz2ha74,stocks,👍 a fair warning. They are a tad bit time consuming.,[],0
102,gz2hrvr,2021-05-22,t1_gn6mpz5,stocks,Now you should know for sure.,[],0
103,gz2hs43,2021-05-22,t1_gz1gcyp,stocks,Man i thought i bought LMND on sale in feb... and then i bought the dip in march... and april... and may just said fuck your averaging down again so I'm at the point now where i might just move the shares into a separate account so i just don't have to look at them. If it wasn't an IRA i would have sold to report the loss,[],0
104,gz2htq6,2021-05-22,t1_gz2h7id,stocks,The important part is that it's not impossible ;),[],1
105,gz2hx2j,2021-05-22,t3_ni2ty8,stocks,thanks for the recaps! I am wondering if I should buy nvda before the split or post split!:(:(,[],0
106,gz2hz75,2021-05-22,t1_gz2h7a8,stocks,I linked you to 3 posts with actual data. You chose not to read them.,[],0
