,created,subreddit,text,comment_id,parent_id,Organizations,Sentiment
99,2021-05-17,investing,hes betting theyll go down,gyhv986,t1_gyhucdd,[],0
100,2021-05-17,investing,">  see Cuba or Venezuela.

Two countries with massive US involvement and pressures.",gyhv9vt,t1_gyhu7jl,[],0
101,2021-05-17,investing,And this is exactly why I never post here.,gyhva1k,t3_nesiea,[],1
102,2021-05-17,investing,Fuck tsla,gyhva5p,t1_gyh4wys,[],0
103,2021-05-17,investing,Short puts don't have unlimited downside. Downside is limited to strike x 100.,gyhvbic,t1_gyh5d6c,[],0
104,2021-05-17,investing,"""Famed investor Michael Burry on Monday revealed a short position against Tesla worth more than half a billion, **in a regulatory filing.**""

First rule of not getting fucked in pound me in the ass federal prison, don't lie on your regulatory filings.",gyhvehu,t1_gyh4wys,[],0
105,2021-05-17,investing,"> This was because the dictator Augusto Pinochet's & company constitution, reforms and laws.

No it wasn't.",gyhvewf,t1_gyhlxox,[],0
106,2021-05-17,investing,"That's what happens when bond yields rise, the bond becomes cheaper.  (The coupon on the bond typically doesnt change.)",gyhvff1,t1_gyhv986,[],0
107,2021-05-17,investing,It’s just straight Zerohedge nonsense.,gyhvfu3,t1_gyhu4n9,[],0
108,2021-05-17,investing,"He (Musk) move markets because he actually make things happen.
How come a startup became the leader of the new way of automotive and now everyone is racing against this start up? How come the big auto makers are still struggling to keep up?
How come a startup, start sending astronauts to the space, when since the space shuttle the US had to rely on Russian rockets to send them to the space station? And is, making  better rockets for almost 1/3 of the price.

Anything this guy put the hands on, becomes the new big thing.
And everyone already know about that",gyhvg77,t1_gyg3iqx,[],0
109,2021-05-17,investing,"The US has always treated leftist governments in countries that are in positions of strategic importance to the US as threats. While US activity in the area has certainly been less brazen since the end of the cold war, you can't reasonably claim that the US has had no involvement in the politics and economics of the region.",gyhvgmh,t1_gyhu7jl,[],1
110,2021-05-17,investing,"Other manufacturers are quickly catching up, honestly feels like Tesla is at a standstill right now while companies like VW are putting their massive weight and resources behind EVs. The ""old guard"" is coming in hot, Tesla needs to actually release some new shit soon or their goodwill is going to get gobbled up.",gyhvicp,t1_gyhczgu,['TSLA'],1
111,2021-05-17,investing,"no. he has puts on TLT and calls on TBT...

this is looking very, VERY bad for the treasury bonds.

hes betting on a market crash, because he also has puts on IWO. (small companies go down first in the event of a crash)",gyhvjhq,t1_gyhucdd,[],0
112,2021-05-17,investing,"Have you looked at the graph of money velocity recently?

[Here it is](https://fred.stlouisfed.org/series/M2V). It dropped to record lows recently.",gyhvjqd,t1_gyhtbl9,[],0
113,2021-05-17,investing,"They use it as reserve, not for transactions. Average anual growth of 200% for the past 11 years is a compelling metric. 

What buzz words did I use? I can rectify them",gyhvkjg,t1_gygye8m,[],0
114,2021-05-17,investing,"This math is incorrect. He has 8001 option contracts. This is a tiny amount.

https://twitter.com/Keubiko/status/1394351225316028420?s=20

&#x200B;

WSB is trash, but at least they know how options work.",gyhvkyw,t3_nenw6h,[],1
115,2021-05-17,investing,And ruin the country again.,gyhvljm,t1_gyhkovi,[],0
116,2021-05-17,investing,What are they going to do? Tesla isn't at ~140% short interest. Nothing to squeeze.,gyhvm7d,t1_gyh983t,[],0
117,2021-05-17,investing,I agree Tesla is overvalued. The cars aren’t exactly energy efficient. And Elon is a fuck head for the pump and dumps he does. Doge and Bitcoin. Doge is a joke coin that he’s pumped and Bitcoin has real value. I bet he buys a shit ton of it as soon as he drives the value down. He should be in jail.,gyhvn24,t1_gyhb5kp,['TSLA'],0
118,2021-05-17,investing,"Yeah, it says he owned 8k total put contracts. Tesla has a high premium on all their options so it definitely wasn’t cheap, but it’s probably only a couple million dollars at risk if he’s wrong instead of the 500m the media is running with.

Also, this is information from March holdings, who knows if he’s still holding this position two months later.",gyhvoa4,t1_gyhsr39,['TSLA'],0
119,2021-05-17,investing,*subjugate.,gyhvoct,t1_gygx2jv,[],0
120,2021-05-17,investing,"Meh. Short also just means expressing a bearish view. ""Selling short"" means selling the shares, but you can be ""short"" Tesla in a manner of ways, including options. Delta is either long or short.",gyhvon6,t1_gyh5d6c,[],0
121,2021-05-17,investing,I sold all my Tesla today and bought crypto.,gyhvq8q,t3_nenw6h,[],1
122,2021-05-17,investing,"Thanks for sharing this I agree. Their are amazing cloud and business solutions. Their are amazing small business solutions to like Shopify. 

But I am just not seeing large scale companies who are building beautiful apps with a great customer journey tech agnostic. 

I know this is bundled into some IT services companies but I’m looking for a pure play as this field seems long term it could be massive. 

Even many large companies have absolutely terrible apps and customer experiences",gyhvqpg,t1_gyhulsf,[],1
123,2021-05-17,investing,Have you read about working for Tesla? Lol,gyhvs14,t1_gyhusxh,[],0
124,2021-05-17,investing,That’s what the hedge funds do every day!!,gyhvvh1,t3_nebp01,[],0
125,2021-05-17,investing,"Unfortunately the far left candidate did make it to the second round, he won the first by a good margin.",gyhvvzr,t1_gyhiia7,[],0
126,2021-05-17,investing,Do you think AMZN is overvalued? Currently has a P/E ratio of 207 as of last quarters earnings and today’s closing price.,gyhvw04,t1_gyhu880,[],0
127,2021-05-17,investing,Classic market manipulation,gyhvw6y,t1_gyht1pz,[],1
128,2021-05-17,investing,"Colour me shocked, CNBC throwing around nonsense headlines for laypeople to lap up and click lol",gyhvxhc,t1_gyhvoa4,[],0
129,2021-05-17,investing,Burry knows more about everything,gyhvzsh,t1_gyhuiqn,[],1
130,2021-05-17,investing,"Ladies and gentlemen, the unstoppable force and the immovable object...",gyhvzut,t3_nenw6h,[],0
131,2021-05-17,investing,I see. Thanks,gyhw044,t1_gyhlyy0,[],1
132,2021-05-17,investing,"Anything energy, xle, erx, or uranium plays, uuuu, pdn, ccj etc....
For God sake, if u buy options buy atleast 4 months out",gyhw0v6,t1_gyhv50k,[],0
133,2021-05-17,investing,He hurt Tesla reputation waaaaaay before any of that,gyhw71b,t1_gyh6r6g,[],0
134,2021-05-17,investing,Their entire value is based on pie in the sky idea of a robotaxi network. It could happen.  But it’s like buying a spec biotech at this point.,gyhw78b,t1_gyhakwh,[],0
135,2021-05-17,investing,"Thanks, looking for a simple buy and hold",gyhw7i2,t1_gyhw0v6,[],1
136,2021-05-17,investing,If you own bonds and yields go up you lose value so if he’s short he’s hoping they drop,gyhw7lr,t1_gyhvff1,[],0
137,2021-05-17,investing,"Can’t agree more. Having worked in multiple big aerospace defense firms this effect is slowly compiling. 

Younger folks that are sharp jump ship frequently, often completely resetting there knowledge base within the industry as the technical knowledge on specific subjects is hard to transfer. Many people that can, leave for tech if possible. Competent people that stay often get swooped into management. 

There is virtually no allocated budget for knowledge transfer and the above effects have created an intense pessimism among the older senior engineers. Everything must be “off overhead”.  Director level and above often have no technical understanding of there products beyond a surface level and focus on decision making based on performance metrics for cost and schedule that are too simple to gather a real understanding of what’s happening. There is a lot of contractual momentum within defense, but I have not seen a lot of solid products come out since working.  Just my experience!",gyhw9rj,t1_gyg7nh5,[],0
138,2021-05-17,investing,Got any comment on the sports betting of FUBO? Launch end of 21 still in the books?,gyhwapt,t3_nespkx,[],0
139,2021-05-17,investing,"I'm fine with the guidance and stickied comment, but yeah comments should be allowed.",gyhwezg,t3_nesiea,[],0
140,2021-05-17,investing,Supporting The Volkswagen Group on moral grounds is an interesting take.,gyhwfsd,t1_gyhos3y,[],1
141,2021-05-17,investing,"How is it inferior? The car is phenmonal. They have had some QC issues but not anymore. Just don't buy FSD, and you've got a car built from the ground up to take advantage of being an EV, with great range, full control via app, the best charging infrastructure in the country.",gyhwgkw,t1_gyhrfx1,[],1
142,2021-05-17,investing,Thanks mate! I would argue you are still early.,gyhwjmu,t1_gyhuyfr,[],0
143,2021-05-17,investing,"I'll try to remember to look it up later.

He'll always be in between for me though. His intelligence and success, as well as his arrogance and disregard for the opinions or needs of others, is undeniable. In other words, yet another tech billionaire.",gyhwkdj,t1_gyhuxhq,[],0
144,2021-05-17,investing,"Your submission was removed because it is a short post. Any self-post below 400 characters in the body will be removed.  Please refer to rule 6 and make sure your post meets our standards of effort. Automod evasion will be met with a lengthy ban. Do not post just an article; highlight the parts of the article you find relevant or offer some commentary surrounding the article. Self-posts that offer some simple thoughts or questions like ""what do you think"", ""here's my thoughts"", etc. belong as comments to existing posts or the [Daily Advice Thread](https://www.reddit.com/r/investing/about/sticky?num=2).

*I am a bot, and this action was performed automatically. Please [contact the moderators of this subreddit](/message/compose/?to=/r/investing) if you have any questions or concerns.*",gyhwldm,t3_net0px,[],1
145,2021-05-17,investing,"Insiders bought more! I suspect the buybacks are about to restart, or the debt is being paid down.",gyhwq88,t3_lsjfvv,[],0
146,2021-05-17,investing,"**Hi, welcome to /r/investing. Please note that as a topic focused subreddit we have higher posting standards than much of Reddit:**

**1)** Please direct all **advice requests and beginner questions to the stickied daily threads.** This includes beginner questions and portfolio help.

**2) Important: We have strict political posting guidelines** (described [here](https://www.reddit.com/r/investing/comments/cyee69/formal_posting_guidelines_for_political_topics/) and [here](https://www.reddit.com/r/investing/comments/escewo/temporary_rule_change_what_happens_to_stocks_if/)). Violations will result in a likely 60 day ban upon **first instance.**

**3)** This is an open forum but we expect you to conduct yourself like an adult. Disagree, argue, criticize, but **no personal attacks.**


*I am a bot, and this action was performed automatically. Please [contact the moderators of this subreddit](/message/compose/?to=/r/investing) if you have any questions or concerns.*",gyhwrd1,t3_net1s9,[],0
148,2021-05-17,investing,"It’s very likely the authors of the article don’t know/understand that either lol. Which isn’t a good excuse, but can explain why this was able to be pushed out.

A flashy article like that will get people talking, so they wouldn’t care to correct it either and say how much is really at risk for Burry.",gyhwsqv,t1_gyhvxhc,[],0
149,2021-05-17,investing,were you asleep during the failed coup of bolivia?,gyhwtju,t1_gyhu7jl,[],0
150,2021-05-17,investing,The time of uncertainty is worse than the actual fear.,gyhwvou,t3_nesoi0,[],0
151,2021-05-17,investing,This is a very good take.,gyhwwjs,t1_gyhesov,[],1
152,2021-05-17,investing,"He didn't pay $530m for the puts btw. That's just the notional value of the contracts. The article says:

> As of March 31, Burry owned 8,001 put contracts, with unknown value, strike price, or expiry, according to the filing.

For all we know, he could have bought 8k stupid OTM puts worth a few bucks each.

You're correct otherwise.",gyhwyx9,t1_gyh71mz,[],0
153,2021-05-17,investing,100%. The number of god damn charts I see people presenting or wanting but have no clue what they are talking about is insane.,gyhwzh4,t1_gyhw9rj,[],0
154,2021-05-17,investing,"He might be early, but he's not wrong.",gyhx12j,t3_nenw6h,[],0
155,2021-05-17,investing,"But its not about short positions though (if you refer to the post), those are 8k puts",gyhx266,t1_gyhqdzc,[],0
156,2021-05-17,investing,His short position is through puts.,gyhx4qs,t1_gyhqdzc,[],0
157,2021-05-17,investing,"Porsche Taycan over Tesla imo. 

Elon bit off more than he could chew",gyhx5ii,t1_gyhczgu,[],0
158,2021-05-17,investing,"The amount of upvoted misinformation on this thread (and sub) is incredible. He has puts on TLT (a short position). TLT is an ETF of 20+ treasury bills the value of which will decline if interest rates go UP. There is an inverse relationship between a bonds yield (interest rate) and its price.

To be clear. He will profit on his position if yields go UP (which would occur if, for example, inflation increases) which will reduce the value of previously issued bonds and hence the value of TLT.",gyhx81x,t1_gyhv986,[],1
159,2021-05-17,investing,"Your submission was removed because it is a short post. Any self-post below 400 characters in the body will be removed.  Please refer to rule 6 and make sure your post meets our standards of effort. Automod evasion will be met with a lengthy ban. Do not post just an article; highlight the parts of the article you find relevant or offer some commentary surrounding the article. Self-posts that offer some simple thoughts or questions like ""what do you think"", ""here's my thoughts"", etc. belong as comments to existing posts or the [Daily Advice Thread](https://www.reddit.com/r/investing/about/sticky?num=2).

*I am a bot, and this action was performed automatically. Please [contact the moderators of this subreddit](/message/compose/?to=/r/investing) if you have any questions or concerns.*",gyhx9dx,t3_net505,[],1
160,2021-05-17,investing,Personally I wouldn’t do it. Too risky for my blood because home value and investments could drop. You can probably find a margin account with lower interest than 2.75%.,gyhx9ud,t3_net1s9,[],0
161,2021-05-17,investing,"Owners of the company are not the company’s workers.

Did you even read what you wrote?",gyhxa1v,t1_gyhusxh,[],0
162,2021-05-17,investing,"Your submission was automatically removed because it contains a keyword not suitable for /r/investing.  Common words prevalent on WSB, hate language, or derogatory political nicknames are not appropriate here.  I am a bot and sometimes not the smartest so if you feel your comment was removed in error please message the moderators.

*I am a bot, and this action was performed automatically. Please [contact the moderators of this subreddit](/message/compose/?to=/r/investing) if you have any questions or concerns.*",gyhxbc1,t1_gyhxb6v,[],0
163,2021-05-17,investing,I think he just believes it's overvalued and he's just making a big bet.,gyhxbn0,t1_gyhtj77,[],0
164,2021-05-17,investing,"Nah. He has puts on TLT. When TLT goes down, 20-yr yields go up. Also he has calls on TBT, which is the inverse of TLT, i.e. betting on yields rising.",gyhxbwy,t1_gyhv986,[],0
165,2021-05-17,investing,"> priced in

I’m pretty sure it’s a meme",gyhxce0,t1_gygni5v,[],1
166,2021-05-17,investing,"Yes, puts are smarter after the retail / hedge fund frenzy proved that people are now deliberately squeezing short sellers . I wouldn’t want to be short . Sorry, puts not short selling .",gyhxcue,t1_gyhx266,[],1
167,2021-05-17,investing,To short tech companies is an old and usual play during inflation times.,gyhxgtf,t1_gyhiexy,[],0
168,2021-05-17,investing,"Look up Sondervermoegen in Depotgesetz (DepotG). Your assets are kept seperately from your broker's assets. This is audited anually.

No clue regarding Stimmrecht. Ask your broker or have a look at the FAQs.

Hoffe das hilft.",gyhxkfp,t1_gyfft80,[],0
169,2021-05-17,investing,"IWO != market, or small companies in general.

That's just small-cap growth, which is primed to get wrecked if money becomes more expensive to borrow (rising rates).",gyhxktc,t1_gyhvjhq,[],0
170,2021-05-17,investing,My BCH went down 10% too. That will teach me to invest in countries I know nothing about except that they have the most advanced economy in South  America. I guess it's too late to sell now. Let's hope the sellers overreacted.,gyhxlzy,t3_nem9c3,[],1
171,2021-05-17,investing,"I'm not a sophisticated investor...the idea of putting my home (and family) in jeopardy so I could put money into the market strikes me as a gamble I'd not be willing to make.  I'd much rather enjoy the fact that my home is secure come what may.  


In your scenario I'd refinance my home on terms favorable to paying it off quickly and comfortable for my budget at the lowest interest rate possible.",gyhxm6q,t3_net1s9,[],0
172,2021-05-17,investing,"Your submission was automatically removed because it contains a keyword not suitable for /r/investing.  Common words prevalent on WSB, hate language, or derogatory political nicknames are not appropriate here.  I am a bot and sometimes not the smartest so if you feel your comment was removed in error please message the moderators.

*I am a bot, and this action was performed automatically. Please [contact the moderators of this subreddit](/message/compose/?to=/r/investing) if you have any questions or concerns.*",gyhxpcg,t1_gyhxpaq,[],0
173,2021-05-17,investing,ahhh thanks for the correction!,gyhxrc3,t1_gyhxktc,[],1
174,2021-05-17,investing,I'm late to this post I mean :)  I have been accumulating DNN and CCJ since 2019,gyhxu76,t1_gyhwjmu,[],0
175,2021-05-17,investing,Taking out a loan to gamble. Go to any gamblers anonymous meeting to see how this works.,gyhxxw6,t3_net1s9,[],0
176,2021-05-17,investing,"He’s exempt though due to his fame. Just like Elon’s tweets about bitcoin significantly impact performance, someone like Burry announcing he’s bought put options signals his lack of confidence in Tesla’s performance, which will drive it down and help his performance.",gyhxyje,t1_gyh4wys,[],1
177,2021-05-17,investing,"This is a private debt offering, no? Does raising debt dilute shares?",gyhy0p6,t1_gyhqsn1,[],0
178,2021-05-17,investing,"Not sure what the legal situation is in the US, prosecuters need to get a signed warrant from a judge in most European countries to get IP information from a platform and then coerce the ISP to name the person behind the IP at the time of posting. Not to mention the cost of all of this.

Unless it is a juicy case of insider trading I doubt that the juice is worth the squeeze.",gyhy2kh,t1_gyfjaf8,[],0
179,2021-05-17,investing,"I agree on these fundamentals, just a question for thought though, since i believe we move to new era after all those years at low inflation levels. After QE started a few years ago, we have seen a large percentage of companies with increased savings, more than ever. Unusual for the classic economics in which consumers save and companies borrow. Couldnt that be a positive sign? They dont have to get overloaned plus they can take advantage on the increased rates on savings.",gyhy2pw,t1_gyhmy4e,[],1
180,2021-05-17,investing,"Europe is a different beast. I would reach out to people doing the kind of job you want and ask them what kinds of certifications you should get. Response rate is typically pretty good, so after 10 emails you should get 2 good responses back.

That's my best recommendation",gyhy38c,t1_gygaoh0,[],1
181,2021-05-17,investing,"No one is arguing that. I’m stating it’s a pool. You don’t hold the deposit. The coin does. There is default risk; tiny risk as a single default; but giant if in mass. 

This is no different than an Asset Backed Security except I didn’t see any over collateralizaiton built in to the coin.

Also in the real world, the pool manager takes less than 1% so that’s not a majority. Lol",gyhy635,t1_gyhuyh4,[],0
182,2021-05-17,investing,QVAL,gyhy6no,t1_gyhv50k,[],0
183,2021-05-17,investing,"Not a smart idea. If you want to take money or to start making money I would look into getting to buy into a rental property or some other more stable money vessel. Personally, gambling with my house just isn't something I'm willing to do as there is no guarantee that the home value will continue upwards either.",gyhy8c7,t3_net1s9,[],0
184,2021-05-17,investing,"These are put options. He won't lose an infinite amount, it just doesn't get exercised.",gyhy8yr,t1_gyh983t,[],0
185,2021-05-17,investing,"Elon has been barely active with Tesla lately. To busy flying rockets and playing celebrity.

I hope that this lights the fire under Elon to be more active with the company again.",gyhyaep,t1_gyh6r6g,['TSLA'],0
186,2021-05-17,investing,"> selling my new tesla shares when its breakeven

Ahh the old Sunk Cost Trap",gyhyerp,t1_gyhos3y,[],0
187,2021-05-17,investing,You’re right,gyhyhxa,t1_gyhx81x,[],1
188,2021-05-17,investing,"Yes, I forgot them and my list is not intended to be all encompassing. 

Amazon should probably be two companies: an online retail company and a web services company. 

The web services part has strong fundamentals although they have tough competition (google, Microsoft, Alibaba). The retail part is very shaky, especially if they are effectively subsidized by AWS. I buy a lot of things through Amazon but I do so because it is cheap and fast to deliver, there is little to no brand loyalty. 

I haven't looked supper deeply into Amazon because the P/E ratio is just way too high at the moment.",gyhyi40,t1_gyhvw04,[],0
189,2021-05-17,investing,"I always recommend going to fidelity, or schwab, both have what you are looking for.

That said, robinhood does support everything you are looking for, so technically you could go with them, but now I see you already have them. Yeah go with a professional brokerage like fidelity or schwab, you are missing some major market access in the stuff you've been trading/investing in.",gyhyiie,t1_gygnheq,[],0
190,2021-05-17,investing,You would have to be a total fucking moron to buy this stock near the top of crypto mania.,gyhykra,t3_nercxl,[],0
191,2021-05-17,investing,"I personally enjoy the sport of averaging down, using one share as an entry point",gyhym4b,t1_gyhnvff,[],1
192,2021-05-17,investing,"Publicly, we can't see all their holdings, but typically yes they are all the same, so go with the cheapest option.",gyhymjd,t1_gyg0n6u,[],0
193,2021-05-17,investing,Wat? If he went deep ITM (>90 delta) he'd be up almost all intrinsic value... so ~$200 million if he bought when TSLA was $900.,gyhymyr,t1_gyhdf6g,[],0
194,2021-05-17,investing,My mom has like 5% of her NW in TTRCX. If you take a look of it’s performance it’s been atrocious for years. Does this fund have any upside to it???,gyhynvd,t3_neb4xj,[],1
195,2021-05-17,investing,"He announced this MONTHS ago. It was known it was going to be around this figure as well. 

He just announced the actual amount shorted.",gyhyoy3,t1_gyh4wys,[],0
196,2021-05-17,investing,Any jobs that don't require clearance?,gyhyqb3,t1_gyhk3kc,[],1
197,2021-05-17,investing,"I just think that if we're going to go that route, then we need to provide a template or a checklist for OP to follow. Which I'd be fine with. But as it stands, it's at the discretion of an individual mod. Posters don't know what the pass / fail criteria are...",gyhyqbi,t1_gyhwezg,[],0
198,2021-05-17,investing,"In the unlikely event that a government has enough scruples to drop SpaceX over this, where are they going to buy heavy lift rockets from that is more ethical - Lockheed? Boeing? Northrop Grumman?

A shady-but-legal pump and dump on an unregulated asset is very small potatoes compared to what those companies have been caught doing, including defrauding their own customer by >$100million (NG), causing hundreds of avoidable deaths by intentionally deceiving the FAA (Boeing) and bribing governments around the world (Lockheed).",gyhys6b,t1_gydcmnq,[],0
199,2021-05-17,investing,TSLA is already down 35% since the beginning of the year. Is this dude still holding?,gyhyt5i,t3_nenw6h,[],1
200,2021-05-17,investing,Wondering if there is an ulterior motive to his announcement of this.  Maybe theres more to it than just his short position?,gyhyyea,t1_gyh4wys,[],0
201,2021-05-17,investing,"But what is very different about right now vs 1900 is that capitalism (as of the 90s) has become a truly global system and has nowhere left to expand. This really might result in a declining rate of profit long term. It might not be in 20 years, but in the long run he might be right. If we can't get to space or figure out how to create a *lot* more markets with technological innovation like advertisers did in the 60s and 70s, global growth long term might be in serious trouble.",gyhz00s,t3_nekops,[],1
202,2021-05-17,investing,Burry seems to think the TSLA short squeeze is over.,gyhz0eb,t1_gyh6h84,[],0
203,2021-05-17,investing,No,gyhz1n2,t1_gyhqsi5,[],0
204,2021-05-17,investing,Bears will be Bears,gyhz2qh,t3_nenw6h,[],0
