,created,subreddit,text,comment_id,parent_id,Organizations,Sentiment
65,2021-05-25,investing,">Or to buy a bag of dying companies because those are ""dumb"" indexes; there's no DCF or analysis to make up its contents just vanilla price and earnings ratios leaving you with the companies whose cash-flow is poorly valued by the market. I find it insane to group up all companies below X PE and call it value investing, if you don't wish to do the picking you can buy shares of funds managed in the spirit of value investing.

Value indexes usually use more metrics like price to book, dividend yield, etc. It's not just raw P/E, or something as simple as a company doing a required goodwill impairment causing negative GAAP earnings in one quarter would kick them off the index.

It's not the smartest indexing, but in general value investing has outperformed the SP500 historically.

Value doesn't necessarily mean dying. If you look at the top 10 holdings of VTV, for example, the only one you might be able to call ""dying"" would be Exxon Mobil, but that's if you're genuinely convinced that we're going to transition away from oil as a society in the near future. They could also have a lot of upside of oil prices keep rising.

Really I'm only into value since late last year. Once growth actually corrects to be reasonably priced again, I'll start putting new money into the overall market. But I'm not seeing that yet.",gzfipk5,t1_gzfi0n6,[],0
66,2021-05-25,investing,"I mean, Forbes called Kylie Jenner a self made billionaire..",gzfishq,t1_gzecdtp,[],0
67,2021-05-25,investing,I was being sarcastic. Penny stocks are considered a horrible investment.,gzfiy0q,t1_gzfif7p,[],1
68,2021-05-25,investing,you should look at the correlation between the etfs,gzfj123,t3_nky9pg,[],0
69,2021-05-25,investing,">	We should not rely on people “playing the game wrong” as a stopgap for fairness.

It seems more psychological to me than a function of the system. I’ve tried my god damndest to explain index investing to my little brother and it just will not click for him. It seems to me that some people grasp the ideas of personal finance better than others. I assume people who inherit money and cannot grasp the concepts of personal finance will squander the inheritance = the stop gap?",gzfj16u,t1_gzfa4e9,[],0
70,2021-05-25,investing,What are the best funds for investing in CLOs?,gzfj24r,t3_nkb976,[],1
71,2021-05-25,investing,What funds are available to invest in CLOs?,gzfj4fw,t3_nkb976,[],0
72,2021-05-25,investing,"If we measured inflation the same way we did in 1990, it would be over 10% right now",gzfj5pc,t1_gzcwc3f,[],1
73,2021-05-25,investing,Sounds pretty similar to my situation,gzfj8g6,t1_gzfdnbg,[],1
74,2021-05-25,investing,"Your submission has been automatically removed because the URL matches one on the /r/Investing banlist due to low quality content. If you believe the article you are trying to link is high quality content please [message the moderators](http://www.reddit.com/message/compose?to=%2Fr%2FInvesting) with a short message so that we may approve your submission. Please be aware that if your post can be sourced from a less sensationalist publication we will likely require you to do that.  Thank you.

*I am a bot, and this action was performed automatically. Please [contact the moderators of this subreddit](/message/compose/?to=/r/investing) if you have any questions or concerns.*",gzfj9po,t1_gzfj9ny,[],0
75,2021-05-25,investing,"Your submission was removed because it is a short post. Any self-post below 400 characters in the body will be removed.  Please refer to rule 6 and make sure your post meets our standards of effort. Automod evasion will be met with a lengthy ban. Do not post just an article; highlight the parts of the article you find relevant or offer some commentary surrounding the article. Self-posts that offer some simple thoughts or questions like ""what do you think"", ""here's my thoughts"", etc. belong as comments to existing posts or the [Daily Advice Thread](https://www.reddit.com/r/investing/about/sticky?num=2).

*I am a bot, and this action was performed automatically. Please [contact the moderators of this subreddit](/message/compose/?to=/r/investing) if you have any questions or concerns.*",gzfjbw5,t3_nkyp9m,[],1
76,2021-05-25,investing,"I really should have seen the Denver train coming when I went to Colorado a few years ago and really liked it as a Californian. Expected Texan red-ness and Mid-West flyover-ness. Was pleasantly surprised when I saw how urban and woke Denver was with the option of easily leaving the city for the best parts of more rural life in CO. Open skies and space like Texas but also surprisingly liberal cities. Green grass, mountains, quietness, and WATER like Utah but with more things to do and none of the Mormon-ness if you go into the cities.

Inb4 everyone says prices are going up because of Californians. It's partially true, but Californians can't do it alone. The NY, NH, and other coastal mega cities/states are seeing outward movement too. Inflation, a housing shortage, and building/banking policies placed in from the 07/08 crisis also played a big part. Heck, there are even those in Florida that are moving out because they are getting priced out by the rich making it their new playground and moving to other states.",gzfjfsn,t1_gzfgqx1,[],1
77,2021-05-25,investing,Morningstar Instant X-Ray does exactly what you want. It used to be totally free but you have to pay for some features now. And you have to sign up to use it.,gzfjxxk,t3_nky9pg,[],0
78,2021-05-25,investing,The problem with this method is that the ETFs can correlate just because the overall market forces movement without them having the same positions. What I meant was not to find ETFs which don't correlate with each other but a way to see where and which stock holdings overlap within the indices. E.g. apple being present in multiple funds,gzfk1z2,t1_gzfj123,[],0
79,2021-05-25,investing,Thanks for the reply! I'll be sure to check it out if there doesn't come up an open/free version in this thread,gzfk884,t1_gzfjxxk,[],0
80,2021-05-25,investing,Lmao gotta love retail investing,gzfk8i3,t1_gzekn9z,[],1
81,2021-05-25,investing,"I still think last year was the ""next big growth stock"" year and this year is going to be more difficult for growth overall. The only speculative/aggressive growth idea I've made a somewhat larger position lately is SRNG - the SPAC that announced it is doing a deal with Ginkgo Bioworks. That's a company that I've wanted to own for probably 4-5 years now and view as a 5-10 year story. I'm not looking for ""the next big thing"" for a while, the primary focus in terms of the things that I've been adding in over the last several months as aggressive growth positions got trimmed or sold is ""high quality, profitable thing with a great track record thing that I don't have to think that much about.""",gzfkeq8,t1_gzferia,[],1
82,2021-05-25,investing,It happens in pretty much all first world countries from my understanding.,gzfkewz,t1_gzebjub,[],1
83,2021-05-25,investing,"Age 24, \~80k/yr after taxes between myself and spouse. Just opened roth IRA, planning to make $500 contributions each month. Since VTSAX, VTIAX and VBTLX all have $3k minimum contributions, should I just invest in a target retirement fund until I have the capital for a three-fund portfolio? Apologies if I seem uninformed. Just started researching this week.",gzfkhzy,t3_nkl62k,[],0
84,2021-05-25,investing,Literally cannot go down,gzfki5u,t1_gzecawl,[],0
85,2021-05-25,investing,"If you’re interesting in exploring the topic more then check out Thomas Stanley’s millionaire next door. That book lays out the foundation of the study and explains where these concepts come from - these stats are plastered everywhere so it’s important to read the source material. It’s also interesting that the trends of first generational wealth seems to be a global reality. 

https://www.google.com/amp/s/www.cnbc.com/amp/2019/09/26/majority-of-the-worlds-richest-people-are-self-made-says-new-report.html

I am also interested in hearing your thoughts on inequality being a feature of agricultural societies - not a function of race (but definitely I agree is a function of race in the US currently). The class struggle is getting a lot of attention these days, and I want to caution people through a lens of history that there has been many attempts to rectify inequalities and they usually end in totalitarianism. I equally fear the pendulum swinging too far left or too far right in America because communism or fascism is at each extreme and a lot of people had to die in the 20th century to test those ideologies.",gzfkiyi,t1_gzfag75,[],1
86,2021-05-25,investing,Remember the sunk cost fallacy. Avoid getting drawn into DCAing into it and burning a hole in case it does not marginally go up allowing you to exit.,gzfksx6,t3_nkv9u9,[],0
87,2021-05-25,investing,"Yeah, CO has the same urban/rural divide you find just about everywhere.  Legalizes weed early, also elects the crazy ""jews with space lasers"" lady...  The Denver area is a pretty nice place to live as far as medium-large cities go, and has a burgeoning tech base.  Feels a bit like Sacramento with 20% less air.",gzfldqt,t1_gzfjfsn,[],1
88,2021-05-25,investing,I wouldn’t pay much attention to a publication like the Motley Fool. Diversify your information streams.,gzflhs1,t1_gzfcik8,[],0
89,2021-05-25,investing,I read a study recently that confirmed this,gzfligm,t1_gzc1j5p,[],0
90,2021-05-25,investing,"Most likely, nothing. You sold your shares and have money in your account.",gzfljd7,t1_gzeaie1,[],0
91,2021-05-25,investing,"Holy /r/preppers batman. The ironic thing is your fears about inflation causing you to panic buy is actually resulting in you losing more money. Because time value of money is a thing, even if inflation isn't a concern (and it isn't).",gzfluq4,t1_gzfcfkz,[],0
92,2021-05-25,investing,"I want to highlight that being privileged is not the only way (or a guaranteed to way) to succeed in the US. My community college and university experience was filled the socioeconomic bell curve of society and I saw that the people working hardest succeeded the most irrespective of race, religion, gender, or sexual orientation. 

I got really tripped up on the macro issues of the nation out of high school and was well on my way to nowhere because I was ready to give up before I even tried against a “rigged” system. A drug arrest later and I decided to go full send into community college to see what I could accomplish if I tried - even though the system is rigged. I ended up more successful than my wildest dreams (first person in my family with a college degree, will hopefully be able to provide an inheritance for my daughter, etc.) I guess I’m trying to bring some positivity into this thread - it’s pretty depressing talking to a lot of y’all honestly.",gzfm2su,t1_gzf72pk,[],1
93,2021-05-25,investing,"Your submission was removed because it is a short post. Any self-post below 400 characters in the body will be removed.  Please refer to rule 6 and make sure your post meets our standards of effort. Automod evasion will be met with a lengthy ban. Do not post just an article; highlight the parts of the article you find relevant or offer some commentary surrounding the article. Self-posts that offer some simple thoughts or questions like ""what do you think"", ""here's my thoughts"", etc. belong as comments to existing posts or the [Daily Advice Thread](https://www.reddit.com/r/investing/about/sticky?num=2).

*I am a bot, and this action was performed automatically. Please [contact the moderators of this subreddit](/message/compose/?to=/r/investing) if you have any questions or concerns.*",gzfm54d,t3_nkz5at,[],1
94,2021-05-25,investing,We can afford to have a one week time horizon now because we made our FU money years ago.,gzfm6kk,t1_gzey7ot,[],0
95,2021-05-25,investing,"You have the best comment on this vapid post, so of course it's being voted down.",gzfmq1c,t1_gzdo54x,[],1
96,2021-05-25,investing,"if your due dilligence is  ""research"" from a wealth management company who has vested interest in making you believe you will go broke controlling your own money, then i am speechless

Seriously, did you complete high school?? if u assert something, you need to back it up, not the person questioning you  
And you are the one making the claim...so where is YOUR evidence/stats...(no clickbait news articles please)

even 4chan investing forum has better due diligence...

ive saved this post so i can repost it anytime someone claims r/investing has any level of sophistication over monkeys throwing darts",gzfn0tk,t1_gzezg9l,[],0
97,2021-05-25,investing,"Your [submission](https://www.reddit.com/r/investing/comments/nkzav4/am_i_diversified_well_enough/) in /r/investing was automatically removed because your account has insufficient Karma. Users can earn Karma by commenting on existing threads.

*I am a bot, and this action was performed automatically. Please [contact the moderators of this subreddit](/message/compose/?to=/r/investing) if you have any questions or concerns.*",gzfn4b3,t3_nkzav4,[],0
98,2021-05-25,investing,"I'm firmly in the ""it depends"" camp.

If stimulus slows down, infrastructure proposals get stuck in congress, and the fed slows down bond purchases, I think inflation would indeed be transitory.

If congress decides to pass more stimulus and infrastructure spending, and the federal reserve stays their course, it could be lasting inflation as well.",gzfn5cs,t3_nkveh8,[],0
99,2021-05-25,investing,"I think the psychedelic sector will revolutionize psychiatric medicine as we know it, and much sooner than anyone is expecting.",gzfn6oo,t1_gzferia,[],1
100,2021-05-25,investing,You can either go with the TDF or the ETF equivalents of those funds (no minimum investment but can't buy partial shares),gzfnbwj,t1_gzfkhzy,[],0
101,2021-05-25,investing,"Your submission was automatically removed because it looks like your post is better served as a comment on an existing post. Please also take a moment to review the [r/investing rules](https://www.reddit.com/r/investing/wiki/index/rules) if you have not yet done so. I am a bot and sometimes not the smartest so if you feel your comment was removed in error please message the moderators.

*I am a bot, and this action was performed automatically. Please [contact the moderators of this subreddit](/message/compose/?to=/r/investing) if you have any questions or concerns.*",gzfneqc,t3_nkzck2,[],1
102,2021-05-25,investing,"Dang, I'm sorry about your little brother. I feel like the basic concept of index funds is relatively straightforward and it's a matter of sitting down to understand it, but I'm willing to accept that it doesn't come naturally to a lot of people. Still, I imagine there are wealth managers who can advise such people.

It just seems like such a silly reason for wealth to dissipate. It's almost hard to believe.",gzfnf69,t1_gzfj16u,[],0
103,2021-05-25,investing,"> I want to highlight that being privileged is not the only way (or a guaranteed to way) to succeed in the US

i agree. but if you acknowledge the existence of privilege, then you acknowledge that success is much easier for some people than others - that's what privilege is.

> I guess I’m trying to bring some positivity into this thread - it’s pretty depressing talking to a lot of y’all honestly.

i don't think you need to fudge the facts in order to be positive - if you're black and trans and disabled and grew up with one parent in a neighborhood with crap schools, *shit's going to be much harder for you,* but that doesn't mean you can't be very successful. it just means you'll have to work a lot harder than, say, me.",gzfnh1d,t1_gzfm2su,[],0
104,2021-05-25,investing,"I may be coming into 150k worth of inheritance money very soon. I have a middle income job of $40k/yearly and am considering investing it to open a Jiu-Jitsu school (teaching it for 10+ years at another school). As exciting as it is, I would rather find out if there is a better way to invest that money (should take about 25-30k to start the school, but still) if there is a better financial yield, and keep Jiu-Jitsu as a side hobby still. Any thoughts?",gzfnlqp,t3_nkl62k,[],0
105,2021-05-25,investing,"i literally enumerated the conditions that contribute to success which come from beyond the self. one example may be insufficient, eight examples less so.",gzfnon5,t1_gzfd5lv,[],0
106,2021-05-25,investing,"If you fail to plan, you have planned to fail. Those early life decisions determine if you can retire early or not. It makes perfect sense to plan for FIRE before you get started. Whether you have a family or not is a big decision, as is relationships. Probably the best thing you can do is live with your parents for a while after you start working and save up for a home. I did this, and it can be the most important piece of the FIRE pie. Just skip the largest bill in most people's lives (rent/mortgage), and you are way ahead of the game. Waiting until you are 30 and locked into some random family situation is the fail plan. The earlier you save, the more time your money has to compound, so you really don't want to miss out on socking away those first few years of earnings.",gzfnpzl,t1_gze46c8,[],0
107,2021-05-25,investing,All I know is that wealthier and more connected you are the luckier you get.,gzfnqgf,t1_gzfcilc,[],1
108,2021-05-25,investing,"Your submission was removed because it is a short post. Any self-post below 400 characters in the body will be removed.  Please refer to rule 6 and make sure your post meets our standards of effort. Automod evasion will be met with a lengthy ban. Do not post just an article; highlight the parts of the article you find relevant or offer some commentary surrounding the article. Self-posts that offer some simple thoughts or questions like ""what do you think"", ""here's my thoughts"", etc. belong as comments to existing posts or the [Daily Advice Thread](https://www.reddit.com/r/investing/about/sticky?num=2).

*I am a bot, and this action was performed automatically. Please [contact the moderators of this subreddit](/message/compose/?to=/r/investing) if you have any questions or concerns.*",gzfnr8c,t3_nkzed0,[],1
109,2021-05-25,investing,"The words “self made” is the important qualifier that must be carefully defined, otherwise this can be a misleading statistic. 

I’d like to know what percentage of millionaires today grew up in a household at or near the poverty line. 

Alternatively, what percentage grew up in a household earning a median income. 

My guess is it would be SIGNIFICANTLY less than 80%. But I’d be happy to be wrong",gzfnsu7,t1_gze4jlq,[],0
110,2021-05-25,investing,"Ah yes, BH, where one of the most popular threads is Hedgefundie's 3x leveraged portfolio where drawdowns are calamitous and no easier to recover from than a 100% meme stock portfolio. Everyone loves gambling - doesn't matter if its wsb, investing, or BH.",gzfnys6,t1_gzev5cw,[],1
111,2021-05-25,investing,"DGS and DLS are a few choices. Relatively expensive though...

https://www.optimizedportfolio.com/best-small-cap-value-etfs/",gzfo3aa,t1_gzfa4go,[],1
112,2021-05-25,investing,"Sure, but not any major US city.  The point still stands that a millionaire just isn't that much anymore, and is nowhere near ""generational wealth"" levels.",gzfo4mx,t1_gzfi63k,[],0
113,2021-05-25,investing,"bull markets ""climb the wall of worry""  ... the level of fear is a pretty good gauge that the bull continues.  that said, bonds are no safe haven in a macro environment of rising interest rates.  bonds lose prinicipal when rates go up.",gzfo623,t1_gzfh1f5,[],1
114,2021-05-25,investing,"Pure speculation on my part that it's related to Merrill Edge's revenue model.

Many brokers generate a lot of their revenue from net interest income. Some brokers also generate income from payment for order flow (pfof). Merrill Edge is one of the brokers that doesn't  sell order flow although they get rebates from exchanges and they may make a market as well. And there are other revenue areas as well. 

ETFs can pay a distribution fee - similar in concept to 12b-1 fees for mutual funds. To reduce fees, I recall reading that ETFs may have been reducing their fees to brokers - at least I don't see those expenses listed on ETFs.

So perhaps, Merrill Edge prefers to offer the mutual fund equivalents which offer a 12b-1 fee instead of the actively managed ETF.

I took a look at $ntsx and some of the Avantis ETFs that you mentioned. They are low volume and low net asset so blocking these funds really would have little to no impact to Merrill.

Of course - that's just a wild guess. It could be an entirely different reason. For example - I did a search on blocked ETFs on Merrill Edge. The one thing that I noticed was that blocked ETFs tended to be low net asset active ETFs regardless of the fund family or asset class - so that kinda kills my idea that it could be revenue related since I'm guessing that ETFs in the same fund family probably costs the same to process and generate similar revenue.  Ie - Pimco active bond ETFs are all available on Merrill Edge except for $emnt which has net assets under 200MM.

So... who knows... But it was an interesting diversion...",gzfo7ex,t1_gzf2kj0,[],1
115,2021-05-25,investing,Yes this answer atleast has some logic to it instead of “you print cus it’s good”. I agree it does cause an incentive to invest. Now the moral question of should the government constantly implement a flat tax to incentivize investment is another thing. Who does this hurt more? The poor people that live paycheck to paycheck or the rich people that have all their wealth in assets. Do enough Americans even understand inflation enough to cause it to be an incentive to most of them? From hearing the answers on this sub so far I’m not sure,gzfo7zn,t1_gzfei3w,[],0
116,2021-05-25,investing,"I'm not sure I buy the first two points, but want to focus on the third.

>80% of millionaires today are self made

I feel like this misses a key point.  A millionaire today is someone that has a decent retirement account and/or owns a house in a major city.  That's it.  You're essentially saying ""whats left of the middle class is middle class.""

Move that to $20 million, which would be a more accurate measure of wealth as opposed to just good middle class retirement planning, and I think your number shifts drastically.",gzfofos,t1_gze4jlq,[],1
117,2021-05-25,investing,"> the study

What study? Millionaire Next Door pretty specifically looks at wealth accumulators, and focuses on millionaires. I'm sure there's a quip or two about generational wealth, but it is far from the main topic. Again, the article you link here has nothing to do with generational wealth. The study is limited to people with a net worth greater than $30 million, and specifically looks at the 68% that were self-made, completely ignoring the 32% that are supposedly 2 generations or fewer from losing it all (and similarly ignoring that the 68% are only 3 generations from losing it all).

You quoted some very specific statistics, and seem unable or unwilling to provide the *data* behind those statistics. Until you do that, there is nothing further I wish to discuss.",gzforho,t1_gzfkiyi,[],0
118,2021-05-25,investing,Fair enough. Read the millionaire next door by Thomas Stanley. Stanley’s research was the basis for these claims that are plastered everywhere. These stats are regurgitated so many times that I’m surprised they are controversial. Like I said I though OP was being sarcastic with the original comment. Stanley’s research is 25 years old and the trends have remained relatively constant since his book was published.,gzforzh,t1_gzfn0tk,[],0
119,2021-05-25,investing,"Appreciated, after digging more into the 2:1 split, I was able to find more information.",gzfp5yq,t1_gzerfrs,[],1
120,2021-05-25,investing,"You think billionaires hold billions of dollars in their account? They would never do that theyre too smart. They know unlike you do that when the government prints money, it steals the value of everyone elses dollar, so they keep 95% of their wealth in assets.

If only 50% of coconuts are left for trading (which is a huge over exaggeration to real money it would never be close to 50%) why is that bad for the others? Theyre still going to use cocunuts as currency and everything is perfectly fine. The coconuts they have will actually be twice as valuable now since half of the supply has been cut! This is the best thing thats ever happened to them.

The example is completely  ridiculous. No very rich person hoards cash. That would be idiotic. They buy and hold long term assets with it to dodge the government printing the value of their wealth away. Even if people were hoarding money that wouldnt necessitate the extreme levels of printing that the government is doing at all",gzfp9vb,t1_gzff8gv,[],0
121,2021-05-25,investing,"The Motley fool puts out an enormous amount of garbage. If you are looking for decent technical analysis, I've found Seeking Alpha does the best job on the widest range of stocks.",gzfpamg,t1_gzfcik8,[],1
