,comment_id,created,parent_id,subreddit,text,Organizations,Sentiment
227,gyunfrm,2021-05-20,t1_gyumot5,stocks,"Supply and demand are the main drivers. But just inflow and outflow don’t necessarily gauge the actual demand.

If one person sells a million shares but 12 million people want to buy the dip but just haven’t yet that doesn’t mean that there is a negative demand on that day. The demand is still the same.

So the two are related but they aren’t correlated in a linear way.",[],0
228,gyuninq,2021-05-20,t3_nh01bu,stocks,Go to the OTC markets website. Look up your OTC stocks. If they are going to be impacted by this there will be a readily seen 🛑 icon and a disclaimer that they are not current with thier reporting.,[],0
229,gyunitk,2021-05-20,t1_gyui7ur,stocks,"ah I see, cheers",[],0
230,gyunm4x,2021-05-20,t1_gyun3os,stocks,"Isn't apple going to *partner* with a car manufacturer, and the ""apple car"" part is going to be next gen user experience for everything inside the cabin?",[],0
231,gyunm7v,2021-05-20,t3_ngvmrw,stocks,nice IPOE,[],1
232,gyunnff,2021-05-20,t3_nh5ay4,stocks,Jesus man... hard to type with an aluminum foil hat on???,[],0
233,gyunnza,2021-05-20,t1_gyu15nn,stocks,"Yeah I love the ""they can't do that, that's illegal argument""

No, they break the rules ALL THE TIME and pay ""fees"" which are more like taxes because they still end up with PROFIT.",[],0
234,gyunoam,2021-05-20,t1_gytj0v6,stocks,None of the top MSOs will be impacted. They are not pink market.,[],1
235,gyunoci,2021-05-20,t3_nh6bxq,stocks,F150 is garbage compared to cybertruck and fords margins on it will be shit.,[],0
236,gyunq0t,2021-05-20,t1_gyugwsq,stocks,I’m long this stock but I also think LDI has upside.  Plenty of REITs too for a slightly different type of real estate exposure,[],1
237,gyunrgm,2021-05-20,t1_gys26cs,stocks,"I actually forgot about this, but I really agree and think this will give oatly a leg up in the future. But, other companies can make oat milk as well. When it comes to that it's more about branding but honestly Oatly seems to be doing great with their brand and popularity. Added stock to my watchlist. Might buy some if it ever gets under $15",[],1
238,gyunsqh,2021-05-20,t3_nh5ay4,stocks,"Ameritrade, chase etc offer 0 commission trades on many stocks and ETF’s. Why will I mess up by using Robinhood, I  prefer staying safe",[],0
239,gyunvxg,2021-05-20,t3_nh6bxq,stocks,"“I always thought Ford could be a good company.” 

😂",[],1
240,gyuny43,2021-05-20,t1_gyug6yf,stocks,idiot,[],0
242,gyunzul,2021-05-20,t3_nh5i9p,stocks,UWMC all day,[],0
243,gyuo0d5,2021-05-20,t1_gyumlb2,stocks,Lol np. Lol but why am I being downvoted? Someone asked for a translation of op so all I did was give him the best translation i could,[],1
244,gyuo1of,2021-05-20,t1_gys2e07,stocks,"Same here. Taxes aside it is not always reasonable to fight windmills and “diamon hands” if you belive your assets will gain better in other stocks. If you sell like this and stay in the market then it is not taking losses, but readjusting of your positions. Something that young investors should keep in mind.",[],1
245,gyuo278,2021-05-20,t1_gytdn2o,stocks,People buy the dip. Then it becomes a 7 layer dip. Then it becomes a buffet. Then you die,[],1
246,gyuo2qk,2021-05-20,t3_nh5k0d,stocks,"I personally prefer Silver over Gold for the first time in my 12 year trading career due to shortages and demand for things like solar panels which use Silver. Stick with the good ones PAAS, AG and if you want a little more risk EXK and MAG. If you do go for gold I like GOLD, KL with AUY and IAG for a little riskier though these smaller dollar ones let you scale in easier if you don’t have a lot of money. With those you can just buy a buncha shares each week and let time be on your side.",[],0
247,gyuo30q,2021-05-20,t3_nh07hi,stocks,How does anyone feel about DOW?,[],1
248,gyuo47r,2021-05-20,t1_gyuhk9l,stocks,Superstonk is the Qanon or timecube of investing. If they say something you can pretty safely bet it's wrong,[],1
249,gyuo480,2021-05-20,t3_ngi6ua,stocks,"QuickLogic ($QUICK),  a fabless semi-conductor business that is a pioneer in open source. It is priced to explode.",[],0
250,gyuo4cl,2021-05-20,t1_gyuk1eu,stocks,Meaning it's the size of an early 2000s F-150.,[],0
251,gyuo4hl,2021-05-20,t1_gyuiudd,stocks,"Yes.  And of all the stocks I own (FAANG, etc), it’s been my favorite stonk.  If the day ends in “y”, I’ve been thinking about buying more.",[],1
252,gyuo568,2021-05-20,t3_nh07hi,stocks,"add a couple reits to an etf heavy portfolio (schd,voo, and others)",[],1
253,gyuo7n8,2021-05-20,t1_gyu7nme,stocks,JD - cause they beat earnings,[],0
254,gyuoaxb,2021-05-20,t1_gyufjdi,stocks,I've heard of them. They sell books or something right?,[],1
255,gyuocg4,2021-05-20,t3_nh01bu,stocks,"You have to sell it all now and buy me beer, or else something.",[],1
256,gyuod1a,2021-05-20,t1_gytwy22,stocks,"It varies state to state but this is a real thing in the US, at least in theory.  If you have a competent broker and your assets with them are at risk of going to the state they will do everything in their power to prevent that from happening.",[],0
257,gyuodiq,2021-05-20,t1_gyuo47r,stocks,Ty for the reply. Ah is that why I'm getting downvoted? All I was doing was trying to translate what op said per request. Reddit is a strange place,[],0
258,gyuodn0,2021-05-20,t1_gyuo7n8,stocks,"Yes, but earnings was two days ago I believe.",[],0
259,gyuoeyj,2021-05-20,t3_ngt748,stocks,QuickLogic $QUIK,[],0
260,gyuog2a,2021-05-20,t1_gyumot5,stocks,"I should also add that previous transactions on the same day change demand. As the chart rises demand goes down because people think “I’ll wait until it drops back down.”

As the chart drops down it increases demand because people think “oh I’ll buy the dip.”

The above is true if overall sentiment toward a stock is positive. The opposite applies if overall sentiment is negative.",[],0
261,gyuog6p,2021-05-20,t3_nh07hi,stocks,"SPYX. Because, you know, save the planet and all",[],1
262,gyuohj2,2021-05-20,t1_gysu0pw,stocks,That is exactly how I feel. I want BABA but I'm scared of potential political pressure..,[],1
263,gyuoigi,2021-05-20,t1_gyu8zd5,stocks,"Oat milk, the entire category across all companies, has a $400mil annual revenue. Oatly is just a fraction of that. Multiple competitors, low-margin product retail product. Yet it has a $12bil valuation. Yikes.",[],1
264,gyuokv0,2021-05-20,t1_gyulkyn,stocks,They also prevented certain canine coin to be sold,[],0
265,gyuokx0,2021-05-20,t1_gyukxeo,stocks,"My point was that they don't only do IT. They also have an entire health branch and own QTC management which handles veterans evaluations across a variety of disciplines, for example. 

I hear what you are saying, but it appears Leidos does some stuff that it a bit different. LMT is a great company, but LDOS seems to be as well and they are much smaller of a company. I would imagine they have more room to grow than someone like LMT. But I could be wrong, that's why I made this post. I am playing devil's advocate a bit just to gain more insight, not to be a dick.",[],0
266,gyuoldn,2021-05-20,t1_gyunm4x,stocks,"Not 100% certain.  

But still - even without Apple mixing it up, the automotive space is ultra-competitive. I didn't even mention Hyundai, and they are a major player too.",['AAPL'],0
267,gyuomas,2021-05-20,t1_gyt97ce,stocks,I love their products but don’t want to get bit by buying it right away for too much money.  I’ll wait a week or two and see where it’s at.,[],0
268,gyuon0h,2021-05-20,t3_ngvmrw,stocks,I am going to keep buying the HIMX dip every fcking day,[],0
270,gyuoplq,2021-05-20,t3_nh6bxq,stocks,"Ford makes shit cars.

A shiny new EV model isn't going to change this.

I don't understand any of the hype. Lol.",[],0
271,gyuor3e,2021-05-20,t3_ngyrsj,stocks,I think you overestimate how many people set stop losses. Many people invest long term and just ride the market. There are also plenty retail/new investors that just don’t know better or have no time to manage accounts or are just hopeful,[],1
272,gyuor9v,2021-05-20,t1_gyun2a8,stocks,What.,[],0
273,gyuos5d,2021-05-20,t1_gyu84z6,stocks,This is the way,[],0
274,gyuotgw,2021-05-20,t1_gyunfrm,stocks,Oh I see so does inflow account for orders that have not yet been filled?,[],0
275,gyuotv7,2021-05-20,t1_gyuccm9,stocks,Doubling your holdings consistently in 5 years isn't exciting?,[],0
276,gyuouoa,2021-05-20,t3_ngyrsj,stocks,Me. I have never remembered to set a stop loss😨,[],0
277,gyuov3x,2021-05-20,t3_nh6bxq,stocks,Ford makes all its profit from trucks. They cannot afford to EV the truck business without large cannibalization/competitor risk. The company cannot support the current truck platform and an EV truck platform. To get to $15 it needs a nice dividend. $20 is not a reasonable goal.,[],1
278,gyuov67,2021-05-20,t1_gyuk9g1,stocks,"That just points to US customers willing to pay for a shit product, not that the company is good or makes good cars.",[],1
279,gyuov7g,2021-05-20,t1_gyttzzx,stocks,"Yep, love to see it!  Great time to buy in I think.  I only have 5 shares but may pick up a few more.",[],1
280,gyuovcc,2021-05-20,t1_gyuf6f7,stocks,"Good question, I am going to look into this after work.",[],1
281,gyuowrt,2021-05-20,t1_gyun2a8,stocks,Those Ford rangers are everywhere down there.,[],0
282,gyuoybw,2021-05-20,t3_nh6bxq,stocks,Idk why the focus on the share price. It depends on shares issued. Companies are all different in thay way but the market cap is the thing to watch.  That equalizes the comparison.,[],0
283,gyuoz2f,2021-05-20,t1_gyug120,stocks,Give us the inside scoop bud,[],1
284,gyup0nj,2021-05-20,t3_ngwml0,stocks,I love BRK.B/A since it’s essentially an ETF but also a very well run business imo.  Sure it underperformed the S&P recently but that just means it’s a bit undervalued imo.  I’d buy at today’s prices.,[],0
285,gyup1su,2021-05-20,t1_gyunoci,stocks,How can you even compare the two? You think any normal American adult in the market for a new truck  would buy a cybertruck over a normal looking f150? Lol.,[],0
286,gyup1wh,2021-05-20,t1_gyufqzl,stocks,"The underlying reason is secondary.  If a brokerage is holding my cash and I direct them to buy something it sounds be bought.  

Whether it was an evil conspiracy by lizard people or it was simply them not having their shit together - the net resume was the same.",[],0
287,gyup2zl,2021-05-20,t1_gysy6oq,stocks,I just watched this last night why is the world built like this,[],1
288,gyup3df,2021-05-20,t3_ngt4js,stocks,Turned $21.03 into $175.11 in 13 days. Just put in my 2 weeks. EARLY RETIREMENT! If anyone is I terested in my trades and secret to success let me know. /s,[],0
289,gyup4vz,2021-05-20,t1_gyudi2a,stocks,"Let's all donate $5 to a cleaner water charity, see if we can get some change going in the world?

r/HydroHomies would be proud.",[],0
290,gyup69w,2021-05-20,t1_gyuiie1,stocks,"the F150 is a great truck.  Using the same shell and trying to stuff batteries in it likely won't be great.  

Every single auto maker that has tried this did not succeed.  It's a different technology platform and therefore has different needs.  Stuffing the EV tech into a design meant for a gas engine rarely turns out well.

&#x200B;

Ford may prove me wrong but it's not very likely.",[],0
291,gyup73g,2021-05-20,t3_ngvmrw,stocks,ATTENTION: get in now while still low! I’ve been following RDHL since news first broke on its COVID treatment drug. The drug efficacy research is amazing and so are the results from compassionate use trials. It just started its climb again and hopefully breaking through $20 by Q4 this year. Anyone else following RDHL?,[],0
292,gyup7vr,2021-05-20,t3_nh7ld4,stocks,GME!!! New leadership under Ryan Cohen!  They will be evolving.,['GME'],0
293,gyup9r5,2021-05-20,t1_gyujijk,stocks,Theyre known for hauling loads and reliability in all climate conditions. When you work in rural communities ... there are fords. Theyre also very entry level price point for pickups and best in class. Dodge Dakota is the shitbox of trucks and they don't get anywhere near comparable to the ranger series. Mazda ? Still a joke. Tesla? No farmer will hang up their balls and buy one. The ev market for trucks however.. when gas keeps rising.. that may be interesting.,[],0
294,gyupd2y,2021-05-20,t1_gyuilv1,stocks,"I have thought this for years, because there was certainly a market for the Rangers...look how many of the old ones are still out there.

Look up P758. That's the internal code for the upcoming, actually small, pickup. No official visual releases yet, but there is information available.",[],0
295,gyupdet,2021-05-20,t1_gyu9ae7,stocks,Does the SEC regulate insecurities?,[],0
296,gyupeuc,2021-05-20,t1_gyuis5k,stocks,Sorry I was eating 🖍at the time my friend no worries 💎🙌🦍. Have a great day and if you are hodling I will see you soon on the 🌝,[],1
297,gyupgsg,2021-05-20,t1_gyupeuc,stocks,🚀🚀🚀,[],0
298,gyuph8t,2021-05-20,t1_gyu3sst,stocks,"Leidos owns Dynetics, and Dynetics lost a big NASA contract dubbed HLS (human landing system). Actually I think they still got a lot from NASA as part of the development of a HLS design, but didn't get selected to actually produce it. SpaceX got that final contract",[],0
299,gyupj08,2021-05-20,t1_gyuccgl,stocks,"It is at almost $40k now - $39,994.",[],0
300,gyupkaa,2021-05-20,t1_gyup1su,stocks,Exactly... I’m not rolling up to the job site in a Cybertruck. I’d be laughed off the site!,[],1
301,gyuplft,2021-05-20,t1_gyuiie1,stocks,The f150 is literally the best selling truck,[],1
302,gyuplnj,2021-05-20,t3_nh6bxq,stocks,Why would Ford make more money from selling electric cars than they would gas powered cars? Is there more profit to be made once you replace the internal combustion engine?,[],0
303,gyupm6x,2021-05-20,t1_gyu15nn,stocks,"He’s getting downvoted because “short ladder attacks” don’t exist. Stop hunting, sure, but not the myth of the GME “short ladder attack.”",['GME'],0
304,gyupmuz,2021-05-20,t3_nh7ld4,stocks,Palantir,[],0
305,gyupq3d,2021-05-20,t1_gyukwjt,stocks,"Ford is working on a truck called the Maverick right now.

I live around Detroit and I've seen a few prototypes driving around. It's definitely more old school Ranger sized than the current one.

I have a feeling Ford will be first back in the mini truck market. Hyundai is supposed to have an offering out soon. Though who knows how well that will sell.",[],1
306,gyupqh8,2021-05-20,t3_ngyrsj,stocks,30% is optimistic,[],0
307,gyupr1f,2021-05-20,t3_ngyrsj,stocks,"Stoploss doesn't guarantee a sale, it just creates an order",[],1
308,gyups26,2021-05-20,t1_gyup1su,stocks,"Hasn’t Cybertruck got a 1,000,000 pre orders?",[],1
309,gyuptbw,2021-05-20,t1_gyuk42k,stocks,"It hasn't taken off since the announcement, in fact down from march and april highs. Am I missing something?",[],1
310,gyuptn4,2021-05-20,t1_gyuotgw,stocks,Are you talking about money flow or order flow?,[],0
311,gyupvm4,2021-05-20,t3_nh6bxq,stocks,Sold at a loss last month but happy for u,[],1
312,gyupwhc,2021-05-20,t1_gyuk42k,stocks,If you wait it can be done in an energy-efficient manner.,[],0
313,gyupyij,2021-05-20,t1_gysp9qd,stocks,This is what is called as ' synthetic options ',[],1
314,gyupzj3,2021-05-20,t3_nh5i9p,stocks,Can’t go wrong with realty income,[],0
315,gyupzpf,2021-05-20,t3_nh6bxq,stocks,"I’d be worried as a Ford investor.

Ford are bringing out an F150 electric that is going to cannibalise their most profitable truck.

They can’t make the profits like they did on servicing and make less money actually selling it as well.",[],0
316,gyuq1bb,2021-05-20,t1_gytmpyn,stocks,And DCA all the way!,[],0
317,gyuq3wy,2021-05-20,t1_gyuptbw,stocks,Maybe he bought at $8 in 1986?,[],0
318,gyuq4bo,2021-05-20,t1_gyupd2y,stocks,Ooooo I will look it up. If they come out with something smaller I'd probably get one.,[],0
319,gyuq7i7,2021-05-20,t1_gyub6az,stocks,What tab does it say it in? I’m looking at GTBIF,[],0
320,gyuq9qm,2021-05-20,t1_gyuotgw,stocks,I think it would just show filled orders. I’m just trying to point out that just looking at flow alone isn’t a proper indicator and can be flawed.,[],0
321,gyuqa9i,2021-05-20,t1_gyukwjt,stocks,Don't forget the cleverly named Volkswagen Pickup!,[],0
322,gyuqavp,2021-05-20,t1_gyu0f91,stocks,Agreed. OP's naïvety is evenly matched by his/her attention seeking.,[],0
323,gyuqbua,2021-05-20,t3_nh6bxq,stocks,Got in at 7 something I’m not expecting it to sky rocket over night. I see it as a retirement investment. I’m 36 years old so I have a while before that does happen,[],0
324,gyuqc3o,2021-05-20,t1_gyun89m,stocks,"yeah, i found that... options are just odd to get used to. Will take some time..
Main thing i need to learn is to not throw everything at something, bad habit of going all in and getting all wiped out :)",[],0
325,gyuqecs,2021-05-20,t3_ngyrsj,stocks,If there are no buy orders then no sell orders will be filled.,[],1
326,gyuqenl,2021-05-20,t3_nh7ld4,stocks,"I love how many useful replies you’ve already gotten lol.

Of your list, i’d personally pick;

AAPL
AMZN
BA
DIS
JNJ
JPM
MSFT
PYPL",[],1
327,gyuqfbm,2021-05-20,t1_gyun3os,stocks,Check out the link between Ford and Rivian...,[],1
328,gyuqi5n,2021-05-20,t1_gytfp73,stocks,I had that happen recently.  I now use a contingency order set to my target price.  When triggered it submits a trailing stop loss sell.  Every couple of months I'll review it to see if my target price is still reasonable.  I've also doing this for buys with overvalued stocks that have long-term potential.,[],1
329,gyuqiaq,2021-05-20,t3_nh6bxq,stocks,Ford is the most dependable and well built American company. And the new EV mustang looks great. Not sure why I would want it over a Tesla besides my life long love of ford though. They will probably make the best cyber truck alternative. That the less eccentric truck purchaser will want which is probably most. Let's just pray for the fall of GM and FIAT.,['TSLA'],1
330,gyuqle4,2021-05-20,t3_ngt4js,stocks,What is deciding your entry for your trades?,[],1
331,gyuqme5,2021-05-20,t1_gyuph8t,stocks,"Thanks for the info, I will look into this more",[],0
332,gyuqnxn,2021-05-20,t3_nh6bxq,stocks,Move it into AMC and start your own Ford. Realway EV. It’s got a ring to it 😉,['AMC'],0
333,gyuqorj,2021-05-20,t3_nh6bxq,stocks,"My old man worked for Ford for 37 years. bought in with his life savings in 1996 (@30 some) and never sold because he believed in the company. You can tell by current prices how that worked out for him. Ford didn't take the auto industry bailout but they all closed down shop here and went overseas/nafta for the most part in the nineties already. I digress. They should have been on this electric ""push"" years ago. But this is the least of the problems with Ford management. How they act in Ford V Ferrari is accurate but imagine that terrible executive micromanagement 1000x these days.",[],0
334,gyuqpka,2021-05-20,t3_nh5i9p,stocks,Realty Income Corporation is a great buy,[],1
335,gyuqq22,2021-05-20,t1_gyupm6x,stocks,Iuuahaiahuah stocky the short ladder aaaa stocky the squeeze is gonna squoze!!,[],0
336,gyuqqht,2021-05-20,t3_ngt4js,stocks,What happened to that guy that just learned about day trading and wanted to make a bunch of money to donate it?,[],0
337,gyuqqnl,2021-05-20,t3_m348wh,stocks,Where's update 2,[],0
338,gyuqqto,2021-05-20,t1_gyuowrt,stocks,Everywhere? I was just down there for 2 weeks. I saw maybe 2. Hundreds of 10 year old Fords. Thousands of Asian cars and trucks.,[],0
339,gyuqqz7,2021-05-20,t1_gyup73g,stocks,isnt investing in small pharmaceutical companies pretty risky?,[],1
340,gyuqtrp,2021-05-20,t3_ngvmrw,stocks,"Has anyone considered following Elon's Twitter and just buying up everything he pumps? Instead of being annoyed at the blatant manipulation, take advantage of it right?",[],0
341,gyuqud3,2021-05-20,t1_gytfp73,stocks,"Isn't that why you should do trailing tail stop loss, with something like a 20% cap? That way, you weather most drops, but still keep your gains.",[],0
342,gyuqumi,2021-05-20,t1_gyuplft,stocks,Problem is how many can they make?,[],0
343,gyuqw0w,2021-05-20,t1_gyuqc3o,stocks,"Me too man me too.

Small amounts man small amounts. Dont want to make yourself dankrupt",[],0
344,gyuqy5f,2021-05-20,t1_gyuq1bb,stocks,"[The financial costs and benefits of DCA have also been examined in many studies using real market data, typically revealing that the strategy does not deliver on its promises and is not an ideal investment strategy.](https://en.wikipedia.org/wiki/Dollar_cost_averaging#Criticism)",[],1
345,gyuqynt,2021-05-20,t1_gyuqqz7,stocks,Yes,[],0
346,gyuqzi2,2021-05-20,t1_gyum89z,stocks,"Not really. WFH is not an ideal setup. Herman Miller will come up with new designs meeting unmet need and cater to new use case. People will want to buy new setup like desk, chair etc... its similar to Logitech, bringing new products at the right time and yet people buying it.",[],1
347,gyur0hc,2021-05-20,t1_gyuk1eu,stocks,The new quarter tons are larger than my 20 year old half ton. It's nuts,[],0
348,gyur14w,2021-05-20,t1_gyuiznt,stocks,Dark pool volume hits the tape - it’s included in flows.,[],1
349,gyur1ev,2021-05-20,t3_ngyrsj,stocks,"just buy, delete app and forget.",[],0
350,gyur2qa,2021-05-20,t1_gyuq4bo,stocks,"Recall, any images floating around are just speculative renderings and the shots with the camo are mules, which only have approximation body panels for calibration purposes.",[],0
351,gyur2qg,2021-05-20,t1_gyuqqz7,stocks,Most are just a pump and dump,[],0
352,gyur3l0,2021-05-20,t3_nh6cna,stocks,What inflow/outflow data are you looking at?,[],0
353,gyur3p4,2021-05-20,t1_gyuiie1,stocks,They are also partnering with SunRun: RUN to give residential solar charging of the EV.,[],0
354,gyur4r9,2021-05-20,t1_gyuilv1,stocks,I'd live to see a small Mustang again. The current us more if a sedan bad for handling. The 1980s Foxbody got nearly 30mph in the 4cl version would be a great candidate for EV transformation. A smaller EV mustang would set it apart from the large expensive Tesla.,[],0
355,gyur4tc,2021-05-20,t1_gyunnza,stocks,"I get in the argument fairly regularly...

*""XYZ is **illegal**""*

Yes, it is.  But people can and do break the law regularly.

This applies to everything... Investing, driving, renting/evicting, etc

Laws don't protect you from harm.  Sure, they act as a deterrent sometimes but the more a reward outweighs the penalty, and the more enforcement seems improbable or toothless, the more people will ignore the law.",[],0
356,gyur60a,2021-05-20,t3_nh7ld4,stocks,"The stocks I own (and hopefully will continue to grow) are the following 

Apple, Microsoft, Google, Facebook, Tesla, Shopify, Square, PayPal, Visa, Disney, Nvidia, AMD, TD, RBC, JPM, JNJ, Enbridge, BRK-B",['AAPL'],0
357,gyur60r,2021-05-20,t1_gyuqqz7,stocks,Pharma is extremely volatile and unpredictable yes,[],1
358,gyur9tw,2021-05-20,t1_gyun3os,stocks,Ford does not have solid products their cars are complete shit lmfao,[],1
359,gyurap9,2021-05-20,t1_gyup1su,stocks,I'd feel like a fool spending that much money on a far inferior product.,[],0
360,gyurc5b,2021-05-20,t1_gyupm6x,stocks,"Sigh.

[Blah blah wash sales blah blah FUD](https://files.brokercheck.finra.org/firm/firm_116797.pdf&ved=2ahUKEwjxxOOk9NjwAhWQLs0KHSFQANgQFjACegQIGBAC&usg=AOvVaw0LWPPGdai_TJ8QF86Ks7XF)",[],0
361,gyurcj5,2021-05-20,t1_gyuplnj,stocks,"This. Normally, when an industry is forced to spend capital due to an external trend or factors (in this case, societies moving away from gas powered cars), it's not the companies (or their profits) that benefit. 

The EV shift is somewhat different though since there will be winners and losers, some incumbents aren't going to make it. So you could argue that if GM and Ford survive the transition to EVs, their prospects will be good in that new competitive landscape. The other thing is that governments are going to subsidize EVs so in theory, Ford (as a relatively early mover) could benefit from this.

But yes, you are asking the right question.",[],1
362,gyurdtz,2021-05-20,t3_nh5i9p,stocks,"Good answers here but you can also think outside the box for real estate. People dont just buy houses, they buy stuff for their houses too.

Think something like Home Depot or Costco.",[],1
363,gyurfd0,2021-05-20,t1_gyteeuh,stocks,Great explanation,[],1
364,gyurgf5,2021-05-20,t1_gyu3sst,stocks,"NASA had three companies to choose a Human Landing System (HLS) for the return to the moon from: Dynetics (a subsidiary of Leidos), Blue Origin and SpaceX. The contract was given to SpaceX for 2.9 billion dollars. Dynetics did not get the contract because: Their asking price was 'significantly higher' than Blue Origin's which was in turn significantly higher than SpaceX's. Also, aside from the way over-budget asking price, there were some serious technical issues. Apparently, their design had 'negative mass' aka, it was too heavy for its engines to slow down enough to land on the moon. It is possible Congress will give more money to NASA so they can award a second company along with SpaceX, but this will mostly likely be Blue Origin as they are cheaper than Dynetics and have no inherent technical faults.

I don't know how much of Leidos Dynetics makes up, but in my opinion, after the report NASA gave on them, they are done.",[],0
365,gyurhqw,2021-05-20,t3_nh6bxq,stocks,Holding since 1847… my goodness.,[],1
366,gyurhr5,2021-05-20,t1_gyud2t8,stocks,It wouldn't really make sense for your limit to be higher than your trigger price,[],0
