,comment_id,created,parent_id,subreddit,text,Organizations,Sentiment
745,gz3fj5j,2021-05-22,t3_nis703,stocks,"Sorry, your [submission](https://www.reddit.com/r/stocks/comments/nis703/blackrock_iau_etf/) in /r/stocks has been automatically removed due to Rule 3:  Low effort.

If you just want to post 1 liners or just want to know everyone's thoughts, then post a comment to our daily discussion thread which are generally stickied or [click here.](https://www.reddit.com/r/stocks/search?q=author%3Aautomoderator+daily+discussion&restrict_sr=on&sort=new&t=all)

If you're wondering **why a stock moved** a certain way, check out [Reuters](https://www.reuters.com/), [Motley Fool](https://www.fool.com/), and **especially** [Finviz](https://finviz.com/quote.ashx?t=spy) **which aggregates the most news for almost every stock**.

If instead you're wondering what a term means, go to Investopedia.com and search for said term there.

Either way come back here to repost with your findings, thanks!

A list of the [rules can be found here](https://www.reddit.com/r/stocks/about/rules/), and if you're new to r/stocks please see the [wiki](https://www.reddit.com/r/stocks/wiki/index) and/or [read this post.](https://www.reddit.com/r/stocks/comments/4x1419/if_youre_new_here_read_this_post_first/)

*I am a bot, and this action was performed automatically. Please [contact the moderators of this subreddit](/message/compose/?to=/r/stocks) if you have any questions or concerns.*",[],1
746,gz3fm1p,2021-05-22,t3_nio8u0,stocks,Aren't your kids interested in college?,[],0
747,gz3fmo4,2021-05-22,t1_gyy600b,stocks,Apple never came back down to the pre-split announcement though.,['AAPL'],0
748,gz3fu6z,2021-05-22,t1_gz3fm1p,stocks,The oldest tried it for a semester and dropped. Neither knows what they want to go to college for yet.,[],0
749,gz3fuux,2021-05-22,t1_gz2zxpf,stocks,The dude only invests in 5 stocks....pretty elite club to be in.,[],1
750,gz3fvmw,2021-05-22,t1_gz297tv,stocks,That's why they have declining revenue even with they're balls deep in their turn around plan.,[],0
751,gz3fyxj,2021-05-22,t1_gz3243z,stocks,"He said it on the Berkshire call when people questioned his decision to sell. If he was an investor, govt bailing out companies owned in part by a guy with a 100Bn+ liquid asset pool would be bad optics in a time of economic hardship for poor folks. He had to sell to allow govt to provide aid.

His mistake was not buying the dip. But, in his defence, no one could've predicted the speed at which stock recovered. It was a flash crash, buffet was expecting a multi year bear market with plenty of opportunities to buy dips.",[],0
752,gz3g2m8,2021-05-22,t1_gz3dlmk,stocks,I bought it at 58,[],0
753,gz3g8o8,2021-05-22,t1_gz2uzxt,stocks,"I agree about your juvenile investor thesis but short squeezes are real. Just not in the sense that is highly popularized presently. Also, rockets to moon are real... I'm just not sure reddit has the right idea about it. As for short ladder attacks, you may be into something here",[],0
754,gz3ga1i,2021-05-22,t1_gz1yi1f,stocks,Long term disruptive trends. She saw ev starting in 2014 and invested accordingly.,[],0
755,gz3ga2j,2021-05-22,t1_gz30yt3,stocks,I totally agree with you. I was too greedy and am now down a few thousand dollars,[],0
756,gz3gcog,2021-05-22,t3_nipfr5,stocks,"The intelligent investor by Benjamin graham and a random walk down Wall Street by burton g malkiel are good books for investing. If you want to learn how to trade, read technical analysis explained by martin j pring",[],1
757,gz3gd7t,2021-05-22,t1_gz3eqfp,stocks,Fair enough!,[],0
758,gz3gmyl,2021-05-22,t3_nikw11,stocks,XNCR,[],0
759,gz3gnf8,2021-05-22,t1_gz31mh9,stocks,"I think having some international exposure is just fine, but I wouldn’t move it past ~20% of my overall holdings",[],1
760,gz3gpe1,2021-05-22,t3_nio9x0,stocks,How is Crunchbase a metaverse play? It's a website for information on startups.,[],1
761,gz3gpl9,2021-05-22,t1_gz3fes1,stocks,Think im leaning towards THOR but Dang that market cap is cheap on CWH,[],1
762,gz3gpr8,2021-05-22,t1_gz3fu6z,stocks,"That's why in most colleges your major is not declared until sophomore year or later .

Dropped out because of no interest in studying? Or other issues. 

IMO stock trading they way you want them to learn is a high stress occupation. Have they showed any interest? The fact that you have to control cell phone use seems to indicate they wouldn't pay attention if they had their phones. Not good .

Have you read The Millionaire Next Door? I read it when it came out. Apparently is read in business school.

Your oldest could learn a trade like those in the book.",[],0
763,gz3grqz,2021-05-22,t3_nilf7d,stocks,Dump it,[],0
764,gz3gryg,2021-05-22,t3_nilf7d,stocks,so monday red?,[],0
765,gz3gv68,2021-05-22,t1_gz3gpe1,stocks,They are the creaters of https://www.superworldapp.com/mobile-app/,[],0
766,gz3gy60,2021-05-22,t3_ni8fp6,stocks,T was disappointing lately but now I’m hopeful.,[],0
767,gz3h0pl,2021-05-22,t1_gz3gpl9,stocks,"THOR seems like a great hold for anyone who got in early, but it's still reasonably valued atm.",[],1
768,gz3h1fq,2021-05-22,t1_gz3buy5,stocks,"If you hold VEA and VWO in the same ratio as they are represented in VXUS, the fees are lower than VXUS alone.",[],1
769,gz3h6b6,2021-05-22,t3_nhoers,stocks,"Is doubling revenue, but doubling losses an improvement?",[],0
770,gz3h6k3,2021-05-22,t1_gz3gv68,stocks,"Interesting, had no idea.",[],1
771,gz3h6sv,2021-05-22,t3_nilf7d,stocks,*-20%,[],0
772,gz3h887,2021-05-22,t1_gz1gcyp,stocks,Both probably buys now.,[],0
773,gz3h8f3,2021-05-22,t3_nilf7d,stocks,40@51 bag holding to teach myself a lesson 😅,[],1
774,gz3h8kg,2021-05-22,t1_gz3h0pl,stocks,CHW earnings history is a little choppy so maybe its not so cheap atm,[],0
775,gz3h8km,2021-05-22,t1_gz3c53y,stocks,"If you dont know, you dont know, but stop making shit up, or keep it to the degenerate sub reddits.",[],0
776,gz3h90q,2021-05-22,t1_gz3ej2u,stocks,Because sell the news (and bc it’s SPCE),[],1
777,gz3hbd2,2021-05-22,t1_gz3h6k3,stocks,At least that's what I found when Googled supperworldapp,[],0
778,gz3hgrh,2021-05-22,t1_gz3h6k3,stocks,On the Media podcast for 5/22 they talked about Metaverse,[],0
779,gz3hlus,2021-05-22,t1_gz21ojy,stocks,What happens if the Chinese gov is that she’ll company in the Cayman Islands,[],0
780,gz3hn5f,2021-05-22,t1_gz3fyxj,stocks,Muy interesting! Thanks!,[],1
781,gz3hndx,2021-05-22,t1_gz3h8kg,stocks,"That is another noteworthy con, but I have no reason to suspect they'll slow down. They're still a relatively young stock, and the past few Quarters have been good.",[],0
782,gz3hny4,2021-05-22,t3_nio334,stocks,"I'm not gonna come at you hot like some people, but I am going to question your knowledge and I really want some straight yes or no answers. Full disclosure, I initially lost money on meme stocks and then I turned around and earned on them. I am currently earning on them and I have been/am using money that I am fully okay with losing/not having access to. I have long term investments that I'm doing just fine with.

Firstly: do you believe that retail investors and institutions are treated 100% equally? Do we all participating in the SM follow the same rules and are all punishments for not doing so applied equally? Yes or no and why or why not?

Second: do you believe that someone with 100$ in the market vs someone with 100,000,000$ has the same earning potential on any given stock? Yes or no and why or why not?

> Do your research on what you're buying
Third: have you done any research into [currently most popular meme stock]? If so, could you provide some examples of the most compelling data that you found to influence your position one way or another?

I only question you due to the nature of your post. It could just be because it's all in text, but the overall tone of your post is from an elevated position talking down. If that was unintentional, fair game, no worries. However, if it was your intention, my purpose in asking these questions is to qualify your merit.

I personally believe that none of us really knows anything about what is going to happen with ANY stock, meme or so-called ""safe"" stocks. Unless you own AT LEAST a 5% stake in any company, and that's being VERY generous, you have absolutely no idea. Of course, the higher % of a company stake you own, the more of an idea you have of what is likely or unlikely to happen.",[],0
783,gz3hpba,2021-05-22,t3_nhw5ak,stocks,FCX - copper and gold in one company,[],0
784,gz3htb6,2021-05-22,t1_gz3gpr8,stocks,"Never heard of it, I'll check it out. 

If you know people their age in America that aren't always distracted by their cell phone, please let me know lol. It seems having a truly focused attention span is not a skill their generation has and I'm simply trying to replicate a real work environment with realistic expectations or most employers so they earn what I'm paying them.",[],0
785,gz3hu0m,2021-05-22,t3_nio8u0,stocks,The first paragraph is the perfect setup for a thriller movie to begin with.,[],1
786,gz3hukz,2021-05-22,t1_gz2g4qj,stocks,Lol so true,[],1
787,gz3hxr2,2021-05-22,t3_ni8fp6,stocks,"Be hopeful for all investments. One rule of the subconscious is u can not lose anything, only through the mind. If you admit to anyone that you lost something then you lost it. But if you say you identify with that money and it will come back to you in divine order it will. It may not be from the same investment, but u will get the money back. These are manifestation laws of attraction confirmed by the CIA gateway tapes",[],0
788,gz3hxr7,2021-05-22,t1_gz3hu0m,stocks,Lol,[],0
789,gz3hxte,2021-05-22,t3_nipfr5,stocks,There’s nothing to learn. Nobody knows anything. Buy some companies you believe in and hold on.,[],1
790,gz3i06y,2021-05-22,t1_gz2s7a2,stocks,Heavy bags?,[],1
791,gz3i3w4,2021-05-22,t1_gz3hlus,stocks,Was that a stroke?,[],0
792,gz3iakj,2021-05-22,t1_gz3htb6,stocks,Cell phones are a challenge. My 2 youngest are highly motivated I never knew why (both doing graduate studies). Could be cuz kids even grown kids want to please their parents.  At school one parent demanded to see homework in a way that didn't seem healthy.,[],1
793,gz3igct,2021-05-22,t3_nilf7d,stocks,I have it on good authority from “Potato Wedge” that a $60 price target realistic in the near term. Tater is never wrong.,[],1
794,gz3ilu0,2021-05-22,t1_gz2zzl3,stocks,"I guess ""open to all suggestions"" was a lie",[],0
795,gz3ipnb,2021-05-22,t1_gz3ewk9,stocks,With such a long horizon corrections only matter if you are close to retirement. Corrections are even good for you because you get more bang for your buck.,[],0
796,gz3ipsu,2021-05-22,t1_gz3878f,stocks,There are requirements like gdpr which necessitate storage of data within a country. China and Russia have similar laws. If you want to scale or do cloud in China you have to use baba or tencent. You can’t spin up gc azure or aws to have an internet presence in China. 1.3 billion people using the internet... almost twice the population of USA and Europe combined... and alibaba leads cloud in China. It’s really that simple.,[],1
797,gz3iqfc,2021-05-22,t1_gz2nhy1,stocks,$50+ was from a short squeeze.,[],0
798,gz3iru1,2021-05-22,t1_gz0weae,stocks,[xkcd - Picking Bad Stocks](https://xkcd.com/2270/),[],0
799,gz3ivdi,2021-05-22,t3_nif769,stocks,UNH HD SHW.  GOOGL AMZN LRCX AAPL and MSFT.,[],0
800,gz3iyn9,2021-05-22,t1_gz3fvmw,stocks,"That's the thing though, it's essentially a bet on whether these new partnerships generate revenue or not, if you don't believe so then you don't invest in it. Simple as that.",[],1
801,gz3iz92,2021-05-22,t1_gz3c2pq,stocks,MSFT NVDA UNH HD SHW AAPL AMZN,[],0
802,gz3j2rc,2021-05-22,t1_gz3iakj,stocks,"I've been very hands-off with their school work in high school and their grades have suffered for it, but I was trying to let them practice good decision making. Didn't go very well lol. They have had it way too easy so far in life in that regard. 

The youngest has been fantastic at saving tho, had $1,000 to buy his own computer by 16. Unfortunately, his mother borrowed money from him, all he had, and never paid it back. The mother also had the oldest buy her food on his pre-paid credit card I got him and never paid him back (so I paid it off in exchange for holding onto the card, he has no job). I'm just trying to set the best example I can while still allowing them to make their own way in life. It's a challenge.",[],0
803,gz3j3hh,2021-05-22,t1_gz3e1tg,stocks,Do they even want to be hired into this position?,[],0
804,gz3j4l1,2021-05-22,t1_gz32hea,stocks,"For the record right now I have about 3% VXUS, 4% VSS, 3% VWO. I used to have a lot more of each but I cut them and bought  10% BRK.B and 2% TSM. with the money a few months ago. I will not sell more but I will probably not add to them for a while. But that’s just me and I’m wrong all the time :)",[],0
805,gz3j6km,2021-05-22,t3_ni8fp6,stocks,LOTZ,[],0
806,gz3j753,2021-05-22,t1_gz3dyik,stocks,"Meh. What is a “downvote” anyway? Just 1’s and 0’s in a computer somewhere. 

But you’re exactly right.",[],0
807,gz3j885,2021-05-22,t1_gz36ok2,stocks,Goddamn that will be awesome.,[],1
808,gz3j9cm,2021-05-22,t1_gyytu9c,stocks,This is a pretty outdated take. Baba adrs can be exchanged for baba Hong Kong shares at a 1 to 8 ratio.,[],0
809,gz3jch2,2021-05-22,t1_gz39bt9,stocks,You may want to come back after a day of trading. Tomorrow is Sunday bruv,[],0
810,gz3jeks,2021-05-22,t1_gz3j3hh,stocks,"I'm still putting together the business plan to present to them. That's the purpose of this thread. One step at a time. I have a feeling one will go for it and the other won't to be honest, which is why I'm putting in all the effort to put an offer together.",[],0
811,gz3jhn8,2021-05-22,t1_gz23m8e,stocks,LRCX ASML.,[],0
812,gz3ji21,2021-05-22,t1_gz22suo,stocks,Let me get this straight... you’re worried about recouping a sliver of your investment if baba goes belly up? How much do you think shareholders of Enron got back when it went belly up? This is a ridiculous reason.,[],0
813,gz3jl4g,2021-05-22,t1_gz36lz7,stocks,"Okay let me re-address something I said. Technically, an electric turbine *could* work at high altitudes, BUT it would have to spin at a much, much, higher rate than a gas turbine to overcome the low atmospheric pressure to generate thrust. Think of how helicopters are pretty much incapable of landing on Mt. Everest due to the low pressure of air at those elevations. The helicopter blades could spin faster to overcome this, or you could use propulsion (as in a jet engine). Right now kerosene jet fuel is about 15 times more energy dense than liIon batteries, and so you would need an incredibly substantial jump in energy density of batteries to overcome this. Think 30 times better than kerosene. That's not even remotely feasible right now, even with the best solid state batteries on the horizon.",[],1
814,gz3jp5c,2021-05-22,t1_gz2msxd,stocks,Biotech pennystocks is where all the adrenaline is. Not joking,[],0
815,gz3jrr6,2021-05-22,t1_gg393fr,stocks,Toyota is releasing 6 new ev this year and has stated to have 15 ev by 2025.,[],1
816,gz3jt3u,2021-05-22,t3_ni7o79,stocks,GOOGL MSFT AAPL AMZN PYPL NVDA,[],0
817,gz3jyub,2021-05-22,t1_gz0dyqb,stocks,No to ARKK!  Stick with AMZN AAPL MSFT PYPL NVDA GOOGL,[],1
818,gz3k129,2021-05-22,t3_nio9x0,stocks,NFT’s are straight up worthless with no intrinsic or extrinsic value and have no connect to any of those other applications without being shoehorned in.  A solution looking for a problem.,[],0
819,gz3k1mj,2021-05-22,t1_gz3j2rc,stocks,"I see. Have they said what they would like to do?
This is a service economy where during normal times some use their varied skills on taskrabbit , Uber in some cities is an ok option . And probably other options that don't come to mind.

The Millionaire next door is not about wall street guys. It's about tradesmen that are good at what they do.
My mechanic lives in a 1M house but still goes to work and under 40.",[],1
820,gz3k2yi,2021-05-22,t3_nio8u0,stocks,I like interactive brokers.,[],1
821,gz3k5j4,2021-05-22,t1_gz23m8e,stocks,Haven't they been tanking for months now because of the shortage? From what I've read the shortage isn't primed to let up until 2022 or 2023. Makes me personally uncomfortable to touch anything for long-term gains in that sector. I think it's possible they still have a lot of downside.,[],0
822,gz3k5ls,2021-05-22,t3_niqheh,stocks,Yes you'll be fine. Tech is going to (continue to) dominate the world.,[],1
823,gz3k7o8,2021-05-22,t3_niqheh,stocks,Yeah I hope so cause this looks like a lot like my portfolio 😆,[],0
824,gz3k7x6,2021-05-22,t1_gz2v172,stocks,...have been hemorrhaging and dragged my portfolio deep into the red.,[],0
825,gz3k883,2021-05-22,t1_gz213qs,stocks,50% of my portfolio is AAPL MSFT GOOGL AMZN etc.  Will I be ok 5 years from now?,[],0
826,gz3k8ce,2021-05-22,t1_gz3k129,stocks,http://www.wnycstudios.org/story/making-sense-metaverse/,[],0
827,gz3kanr,2021-05-22,t1_gz2ghty,stocks,They literally arrested and possibly imprisoned or killed their #1 businessman for implying China should look to the west in terms of business practices so they can catch up.  Can you imagine the US doing that with Bezos?,[],0
828,gz3kaox,2021-05-22,t1_gz2v1m2,stocks,Maybe they’re not into chicks.,[],0
829,gz3kbg3,2021-05-22,t1_gz3h6k3,stocks,http://www.wnycstudios.org/story/making-sense-metaverse/,[],0
830,gz3kc1x,2021-05-22,t3_ni8fp6,stocks,Starbucks is no Coke or Pepsi.,[],0
831,gz3ke5p,2021-05-22,t1_gz3jp5c,stocks,Good luck! And buckle up,[],1
832,gz3kevt,2021-05-22,t1_gz2otrq,stocks,He called Canada’s PM what he is?,[],1
833,gz3kfe1,2021-05-22,t1_gz3k7o8,stocks,"I think we'll be ok.  Hey if those stocks are the same or less 5 years from now the whole market will be hurting so it won't matter!

 I have faith in the Fed!",[],1
834,gz3kg2c,2021-05-22,t3_nipfr5,stocks,"First, only come to Reddit for entertainment. Don’t listen to most of the nonsense here. Only the nonsense I’m about the say. 

Now, the first thing to learn is that investing is typically pretty boring. A market like we’ve had the past year only comes along a few times in your life. Other years boring/safe investments will be the play.

I agree with others about reading The Intelligent Investor. It’s a good book that explains a lot of the most basic things about analyzing a company. Although the kind of deep value plays that Graham talks about really aren’t there anymore. The market finds everything these days. 

If you have a lot of time to pay attention and read up on individual companies, go ahead and do that. But please don’t think that day-to-day or month-to-month moves are all that important. If you’re holding something you believe in, you should be able to hold it for years. Go look at a chart of basically any company in the S&P 500 and what they’ve done for 1 month, 6 months, and a year. You’ll see ups and downs. Then zoom the chart out to 10 years or 15 years and it will look like a straight line up and to the right. Even the 2008-2009 crash will look like a tiny blip. 

Hold good companies (or index funds of good companies) and plan to hold them for many years. Your investments will increase over time.",[],1
836,gz3kkhk,2021-05-22,t1_gz3kaox,stocks,I don’t care what their into at 18 and 21 nobody wants to look at stock charts for eight hours with their dad not allowing them to look at their phones during “work hours”.. go out and chase dudes have fun,[],0
837,gz3kknq,2021-05-22,t1_gz3k5ls,stocks,I hope so.  I can't imagine all those companies going under 5 years from now.,[],0
838,gz3klsg,2021-05-22,t1_gz2zzl3,stocks,"There is absolutely nothing wrong with passing knowledge on to your children, especially knowledge that will help sustain them for the rest of their lives and ultimately give them more options to do what they truly want if they are wise. 

Ignore comments like these, you're building a legacy. I wish my father was as proactive with his finances and teaching me money-management/investing during his lifetime. 

I would only hope that you also teach them to take their earnings and invest them not only into the market but into their communities as well via local business investments, real estate, and the sort. It's tempting to hoard piles of gold like some greedy dragon but it can definitely become an unhealthy habit without building something tangible outside of the number stacking.",[],0
839,gz3km6m,2021-05-22,t1_gz3k1mj,stocks,"Nope, we haven't stumbled on anything they seem to really want to do yet. I'd rather they not get stuck in the gig economy jobs tho with no benefits and not having a living wage. The oldest did work at Taco Bell until he quit. 

Sounds like a good book, I would love for them to find a real trade they would enjoy doing.",[],1
840,gz3kmxg,2021-05-22,t1_gyzmcbo,stocks,"What the fuck are you talking about...

Dominos medium hand tossed pizza has 1g of sugar in the dough and 1g in the sauce per slice...

[https://i.imgur.com/WHGn7Ar.png](https://i.imgur.com/WHGn7Ar.png)",[],0
841,gz3kovy,2021-05-22,t1_gz3h8km,stocks,I didn’t make up anything lol,[],0
842,gz3kpjs,2021-05-22,t1_gz36ok2,stocks,Don’t lower prices unless there’s competition,[],0
843,gz3kqi5,2021-05-22,t1_gz22suo,stocks,">no voting rights

Using the GOOG/GOOGL ratio we can say investors are willing to pay a 2% premium for voting rights of internet companies. That's going to be well within the error margin of most DCF models for BABA so I really don't think that's such a big concern.

The other aspects of course do add considerable risk, which I guess is partially why this stock is so cheap.",[],0
844,gz3ks39,2021-05-22,t3_nikw11,stocks,I’m in BEAM and PACB as loooooong term gambles. We’ll see. I understand your point though.,[],1
846,gz3l17t,2021-05-22,t3_nip3ky,stocks,LCTD,[],0
847,gz3l6mg,2021-05-22,t3_nit1hp,stocks,"Invest in index fund regularly, instead doing lump-sum investment. Read books- Peter Lynch One up on the Wallstreet, Benjamin Graham - Intelligent Investor. Watch YouTube channel - Plain Bagel.",[],0
848,gz3l7va,2021-05-22,t1_gyz6gr6,stocks,"Didn't really say much that I didn't already know - I would definitely love to find research that supports paying what is now, 63x sales",[],1
849,gz3lad7,2021-05-22,t1_gz34d3d,stocks,"You need to reflect on what you are doing with your children's lives. You offer your kids a ""deal"" where they have no idea whether they have to pay a TON of money for college until after they are done? And you expect those same kids to be your investing apprentices? I hate to ask these questions, but how much of your income is from inheritance or one-off, likely unrepeatable gains (such as from the current described in your username)? I simply do not see any indication from your posts that you are prepared to run an ""investment firm,"" let alone one that you should be forcing your kids into. Reading between the lines, this sounds like you hope to one day be a successful investor and assume that if you simply had more manpower, you would be.  
It does not seem like this post is about your kids. This post seems to be all about you. That frightens me. Please encourage your kids to obtain a real education, either pay for it or don't, and be honest with them about finances.",[],0
850,gz3lao0,2021-05-22,t1_gz345ty,stocks,"Not everyone bought at IPO, and their Forward P/E is under 20 right now. They just reported a triple beat (Beat revenue, EPS, and forward guidance) and the stock went down, hence disappointing, but hopeful...",[],0
851,gz3lddo,2021-05-22,t1_gz3klsg,stocks,"Thanks. 

I have a college tuition grant non-profit on the island where I was born that's personally founded. I'm also starting another non-profit here in the US as we speak. I've always taught them to buy food for people who ask and are in need. 

I've also given them my example over and over again that what I do is only a means to finance my life and interests and what I do in no way defines me. They see how I take care of my mother and donate, so far they have shown the same compassion for others.",[],0
852,gz3lfwu,2021-05-22,t3_nio8u0,stocks,"Yeah, get ‘em lovin capitalism nice and early! Just don’t let them choke on that silver spoon...",[],0
853,gz3lga6,2021-05-22,t3_niqheh,stocks,"Honestly I would be comfortable being 25% apple, 25% Amazon, 25% google, 25% Microsoft but I’m 40% apple, 30% Amazon, 30% google",[],0
854,gz3lmr3,2021-05-22,t1_gz32090,stocks,"DYOR - the traditional call of the stupid.

Thank you for your service, you’ve been entertaining.",[],0
855,gz3lnfl,2021-05-22,t1_gz3kc1x,stocks,"In terms of brand recognition, it’s pretty darn high.",[],1
856,gz3lnu5,2021-05-22,t1_gz3km6m,stocks,"What about investing in rental real estate and getting them interested in the management and selection of properties? Very lucrative,  wealth-building and can be interesting with tax preparation (depreciation guarantees you don't pay taxes), 1031 exchanges etc",[],0
857,gz3lp8v,2021-05-22,t3_nio8u0,stocks,You need to get a Bloomberg Terminal it has everything you can ask for,[],1
858,gz3lvxh,2021-05-22,t3_nilf7d,stocks,Pump and dump alert. And I'm here to play.,[],1
859,gz3lw4r,2021-05-22,t1_gz3lnu5,stocks,"Absolutely. I would hope they do something like that with their money. I'm looking to buy a quad-plex soon so that will be a good example for them. Again tho, this is why I want them to get exposure to all aspects of different kinds of markets so they can make their own decisions.",[],0
