,comment_id,created,parent_id,subreddit,text,Organizations,Sentiment
403,gz2yeil,2021-05-22,t3_ni16t3,stocks,"If you're investing in a quality company you believe in and the numbers make sense, there is 0 reason to be scared of a drop in the stock price. It should be seen as a buying opportunity. If you're scared, it might be time to look at the companies you're invested in and why you're invested in them. Have a long term outlook. Just my opinion, cheers.",[],0
404,gz2yf9p,2021-05-22,t1_gz2qlu7,stocks,"Not me, Al Gore. Can't say what his reasoning is...but I follow his firms moves.",[],0
405,gz2ygls,2021-05-22,t1_gz2xn5m,stocks,Ill just brag harder,[],0
406,gz2yhb9,2021-05-22,t1_gz2qt1u,stocks,"Yeah you know... betamax and nuclear want to have a word with you. If you want to have a theoretical discussion about which technology is better, fine, but this is r/stocks – it's very much about commercial success here.",[],1
407,gz2yhyn,2021-05-22,t3_m1ugs5,stocks,"Yay! Wanda Group dumped all their AMC stock. AMC is still overpriced, but WG knew absolutely nothing about running movie theaters when they bought them and never learned. Maybe now someone can take over control who can turn the company around.",['AMC'],0
408,gz2yia3,2021-05-22,t1_gz2xkzg,stocks,You can tell how much someone is bagholding by the amount of tears they shed on a post. It's a direct correlation I'm afraid.,[],0
409,gz2yihb,2021-05-22,t1_gz2xzhr,stocks,"Makes sense, I guess we’ll see. I don’t think we have a very transparent look at how bad or overblown the CCP-Jack Ma drama is. I think China being generally wary of tech giants is the real problem versus a few comments from Ma being the issue. I definitely didn’t think about the possibility of relocating to aid global expansion",[],0
410,gz2ylbi,2021-05-22,t1_gz2phpm,stocks,"Like most issues, they will eventually cool off.",[],1
411,gz2ymad,2021-05-22,t1_gz2t02m,stocks,You had like 12 upvotes and now ur negative. These ppl really gonna be remembering this thread later this week lmao,[],0
412,gz2ymyo,2021-05-22,t3_lv5dlb,stocks,"Hi guys !

I'm a 27 y.o lady, today's new to stock market. Here are the stocks I want to invest it, please let me know what you're thinking, that would be very appreciated !

\- AAPL - 20%

\- TDOC - 20%

\- DIS - 20%

\- BA - 20%

\- U - 20%

I'd like to buy one unit each. Apple & Disney  seems like a decent bet for a beginner because it's quite a strong and reliable one (in my opinion, but prove me wrong). Teladoc Health & U because of the groth potential. Boing because hey, we're all going back to travelling and it has a great growth index atm.",[],1
413,gz2yp9h,2021-05-22,t1_gz2yia3,stocks,You can tell how completely useless it is to converse with certain people online based on the amount of assumptions they operate on. Have a good one,[],0
414,gz2ysjk,2021-05-22,t1_gz2qm0b,stocks,I only have 10 at an average of $18 but money made is money made regardless of how much!,[],0
415,gz2ytkr,2021-05-22,t1_gz2ylbi,stocks,"Exactly, just give them time.",[],1
416,gz2yw5i,2021-05-22,t1_gz2y03v,stocks,I personally used thinkorswim (td ameritrade platform) it has on demand and paper trading built in. I think they would learn more with trading with a really low amount of money tho. They have to learn to control emotion that way. Ya you lose more but you learn faster and learn what it’s really gonna be like.,[],1
417,gz2yzpp,2021-05-22,t1_gz2ysjk,stocks,5.5 at average of $22 it’s not much but was more fun that putting 100 on black at roulette table,[],0
418,gz2yzv3,2021-05-22,t1_gz2yp9h,stocks,"Good comeback, you're as witty as you're deluded",[],1
419,gz2z0jq,2021-05-22,t1_gz2yw5i,stocks,100% agreed. Thanks for the suggestion!,[],0
420,gz2z0zh,2021-05-22,t1_gz2fhl1,stocks,"So let me get this straight, the 6 months of financial industry insider audited/corrected/written DD that confirms the great likelihood of manipulation means nothing, but you, an internet stranger with an unsubstantiated opinion, who won’t even buy a single put position against GME, or provide any counter thesis whatsoever, is somehow to be trusted? I’ve never competed at mental gymnastics at this level unfortunately for you, but good luck with your gold medal performance!",['GME'],0
421,gz2z3h0,2021-05-22,t1_gz2yzv3,stocks,"Not really a comeback dude just saying this conversation is stupid because its operating on a completely false premise, and since i dont give a damn about you im moving on. Like i said, good day.",[],0
422,gz2z4on,2021-05-22,t1_gz2xl26,stocks,"Fair point. At this price however, that bad news has been baked into the price. Its rare for a company growing at 28% YoY with an incredible balance sheet and wide most to be trading at a P/E that is less than the S&P 500. I also needed a global stock to add to my portfolio...so yeah this one was right up my alley.",[],0
423,gz2z7m5,2021-05-22,t1_gz1poel,stocks,"You plan to ban sugar? Or is it carbonation? Or is it the salt? Which do you plan to ban exactly? Or is the specific combination that offends you?

The idea you have doesnt work, which is why even the most obese of countries dont do it. If you think about it, it wont slow obesity at all. Further, the entire anti-obesity war is made up to begin with. Its not really about fat people, its about healthcare cost.

Healthcare costs will not come down no matter what you try because insurance itself thrives on rising costs. in fact, the higher the cost the bigger their profit and the more dependent we become on them. And of course drug companies want to charge more too so those two just play off each other. In other words, your soda ban will have exactly zero effect on costs.",[],0
424,gz2z9l2,2021-05-22,t1_gz2nqwl,stocks,There are no state run e-commerce and cloud computing firms in China. There *are* huge state-owned banks tho. So there are limits on what Alibaba can do in the fintech space.,[],0
425,gz2zaob,2021-05-22,t1_gz2z0jq,stocks,If you ever need an extra son I have no relationship with my father and I’m extremely motivated ❤️,[],1
426,gz2zarc,2021-05-22,t1_gz2xfkk,stocks,"Can't lol. My sons would be partners and I wouldn't have it any other way, nor would I share that status with anyone else.",[],0
427,gz2zasq,2021-05-22,t3_nio8u0,stocks,My dad did the same when I turned 17 worked out really good.,[],0
428,gz2zeln,2021-05-22,t1_gz2j62u,stocks,"Chinese law prevents audit papers from leaving China, meaning US regulators cannot easily verify their quality and identify potential risks for investors. 

Ex: Luckin Coffee.....ouch",[],0
429,gz2zerw,2021-05-22,t1_gz2vjlw,stocks,"The market often overreacts to bad news that has no effect on a company fundamentally. You can use that to your advantage if you can recognize those opportunities in time.

A recent example is JNJ’s vaccine problems. When news came out their vaccine was being temporarily halted the stock nosedived. But JNJ is a very large company and the vaccine is just a tiny part of their business, so it really didn’t matter. They’ve since recovered and are at their ATH now.",[],0
430,gz2zg5l,2021-05-22,t1_gz2v92j,stocks,">thinkorswim

I'll check it out, thanks!",[],1
431,gz2zh4e,2021-05-22,t1_gz2z0zh,stocks,">the 6 months of financial industry insider audited/corrected/written DD 

lmao okay dude",[],0
432,gz2zjgh,2021-05-22,t3_nio8u0,stocks,Try letting your kids choose their own interests,[],0
433,gz2zka8,2021-05-22,t1_gz26zv3,stocks,Why dont you provide some insight then? stop being an asshole. YOU ARE THE ONE SPREADING BULLSHIT. cOstINg REaL peOPlE MOnEy,[],0
434,gz2zlra,2021-05-22,t1_gz2ygls,stocks,"I don’t have much to brag about.  I haven’t hit $10m, so I don’t have “fuck you” money yet.",[],1
435,gz2zlrq,2021-05-22,t1_gz2j62u,stocks,"But yeah, I believe $BABA has always been pretty upfront with U.S. investors which is why Cramer said it's the only Chinese stock he's willing to endorse.",[],0
436,gz2zn6p,2021-05-22,t1_gz2y03v,stocks,"When my dad introduced me to the markets, I was 15. He started off by “showing” me the lifestyle that can be had from sticking it out through the downs of this journey. The Richest Man of Babylon is a great classic. It’s not exactly what you’re looking for but at their age I had many opportunities and times where I could have quit but I stuck it out for the bigger goal of financial freedom for my family.",[],1
437,gz2znmk,2021-05-22,t1_gz2zka8,stocks,"Every time you people post you make yourself look more and more ridiculous, that grown adults get taken in by this is mind boggling",[],0
438,gz2zntr,2021-05-22,t1_gz2z9l2,stocks,Good point. My doubts about Alibaba stem from being “too big” for the CCP in general versus that specific point I raised which I concede. Where do you think the next runway of growth comes from? There are some great opinions/points in this sub!,[],1
439,gz2zpmf,2021-05-22,t3_lv5dlb,stocks,"New investor, only about $2000 in stock market.

Any advice? I am mainly into etf and dividends.

QTEC - 7%

KO - 3%

AAPL - 6%

SPHD - 35%

O - 24%

AGNC - 4%

STAG - 3%

Heavy into real estate. Wanna diversify but with roughly $400 a month to invest. Any tips help!",[],0
440,gz2zu2z,2021-05-22,t1_gz26fdl,stocks,Bro everyone is sleeping on $ASS,[],0
441,gz2zu5k,2021-05-22,t1_gz1c7p6,stocks,"No I am not and you need to stop your BS. Read the darn document that you yourself linked. It requires a human behind the wheel and that is literally an example of a sandbox solution. In other words, controlled environments.",[],1
443,gz2zuxv,2021-05-22,t3_nio334,stocks,"Pride is the reason you see this everywhere. If someone invests in a stock they see it as their intelligence reflected in the SP. If the SP goes up, they're a genius, if it goes down, they have too much pride to admit it may have been a bad move. Just go to any stock on stocktwits. Every time a stock is down, a bunch of people predictably claim manipulation or any other reason possible and completely avoid the possibility they're wrong.  

I'm not saying there isn't manipulation, it's just not manipulation every time a stock goes down.",[],0
444,gz2zvi3,2021-05-22,t1_gz2zlra,stocks,"I dont think the size of your win matters. When you take a position, it either goes red or green by the time you cash it.
So you were either right or wrong. Even if only bet a dollar, its brag rights",[],0
445,gz2zwes,2021-05-22,t3_nio9x0,stocks,Meow,[],0
446,gz2zxpf,2021-05-22,t1_gz26ytq,stocks,"The article says the position is only 37m, so is this even a serious thing Charlie cares about? Surely if he believed in it this much it would have been on brk.",[],0
447,gz2zzl3,2021-05-22,t1_gz2zjgh,stocks,"I'm not choosing anything for them, simply offering them a job/career path. They could give zero fu\*ks for all I care. 

Sounds like you have some issues in your past with that happening tho.",[],0
448,gz300gf,2021-05-22,t3_nip3ky,stocks,"I love the idea of VT and while I consider ETF fees as somewhat trivial, it is cheaper fee wise to buy the Vanguard ETFs that make achieve the same as VT: VTI, VEA and VWO. Owning these 3 instead of VT also allows you to tweak the balancing.",[],0
449,gz309bi,2021-05-22,t1_gz2zh4e,stocks,"Have you even seen any of the AMA’s? There are well known financial industry professionals and educators adding to the wealth of knowledge on a weekly basis at this point. I recommend you start with Dr. Suzanne Trimbath’s, Dave Lauer, and Wes Christian. We have another investigative journalist giving a second appearance on Monday. It’s fascinating stuff, but then again I have a hard time imaging hating money as much as you seem to.",[],0
450,gz30emx,2021-05-22,t1_gz2k5j4,stocks,"I personally have NEVER benefited from a reverse split. I’ve learned to GET OUT n cut my losses. They lose the benefit of any doubt to me. Are there examples where it worked like u mention? Probably. Not for me. IMO, it’s just a way to keep things going... to keep mgt. getting paid as long as they can.
U never hear “reverse split, management pay cut”!
I know of an oil exploration co. $PDGO... they did that crap... ppl making $350k a yr. while if u didn’t get out, u got the shaft.
BEWARE penny or cheap oil/gas co. I’ve found them to be crooks. One was just in the news (I forget co. Name) SEC investigating lies, fraud, etc.
SEC needs more help. Instead we class action suits which hurts a stock while shareholders get ¢ on $... of course lawyers do ok.",[],0
451,gz30jg0,2021-05-22,t1_gz1t5p9,stocks,There is a post in superstonk about all of the new rules. I’ll go find it,[],1
452,gz30myl,2021-05-22,t3_nio334,stocks,Every time I see a post bragging about buying more shares of a meme stock I tend to think that person is dumb,[],0
453,gz30qhp,2021-05-22,t1_gz0rslm,stocks,"hahaha, those $150 puts will turn into $37.5 puts post-split",[],0
454,gz30txc,2021-05-22,t1_gz2z7m5,stocks,I’m not offended why are you being so weird? Of course it won’t stop obesity  but when have governments ever taken perfectly working measures ? Cola is the symbol of obesity (literally every lesson  about a healthy diet tells you how many sugar cubes are in cola) and so it will be the first to fall. Diet Soda is even worse since it’s addicting and makes you hungrier. Returns by KO and Pepsi are way way too low for me to ever consider investing in them. They’re morally not much better than cigarette companies so 🤷‍♂️,[],0
455,gz30v1v,2021-05-22,t1_gz2vywt,stocks,Bro you played yourself lmao,[],1
456,gz30y4j,2021-05-22,t3_nip3ky,stocks,"VXUS+VTI will get you there, pretty much.",[],1
457,gz30yp4,2021-05-22,t1_gz30v1v,stocks,How so,[],0
458,gz30ys5,2021-05-22,t1_gz2zn6p,stocks,"Great comment, thank you! 

It's funny, when I was around 12 and home schooling, my father had me read this huge multi-book set about the cradle of civilization (Tigris/Euphrates, etc.). I remember he had that book when I was looking thru the library one day. I never read it until he passed away and I was going thru all the books. I never did finish it, sounds like I need to.",[],0
459,gz30yt3,2021-05-22,t1_gz1mf08,stocks,Gains are gains. I’m certainly not greedy enough to think I could’ve made more had I bought more shares of whatever before it spiked.,[],0
460,gz30zr5,2021-05-22,t1_gz2u9go,stocks,Source for this?,[],0
461,gz3104o,2021-05-22,t1_gz2xnyz,stocks,!Remindme 2 days,[],0
462,gz31119,2021-05-22,t3_ni8fp6,stocks,"GEO group. My time horizon is in 2, 4, or 8 years for the stock to revert back to its mean. But has not been easy watching it break new low every quarter.",[],0
463,gz31123,2021-05-22,t3_ni8fp6,stocks,Teladoc,[],0
464,gz313ab,2021-05-22,t1_gz1o8hq,stocks,Heck yeah! I’m selling covered calls on my GE regularly for some minor income.,['GE'],0
465,gz314mj,2021-05-22,t1_gz309bi,stocks,I recommend you turn off the computer before you get yourself into any more trouble,[],0
466,gz317w3,2021-05-22,t3_nilf7d,stocks,Amazing news. One ticker that actually gets to the moon!,[],1
467,gz318st,2021-05-22,t3_nipfr5,stocks,"Investopedia.com is a great source, might help with what you're after.",[],1
468,gz3196z,2021-05-22,t1_gz1rpuy,stocks,We all are considering this is how our parents probably view us 😆,[],0
469,gz319zm,2021-05-22,t1_gz2xnyz,stocks,RemindMe! 48 hours,[],0
470,gz31bh0,2021-05-22,t1_gz2y8lf,stocks,Thank you!,[],1
471,gz31fiv,2021-05-22,t1_gz314mj,stocks,"I’m not in any trouble whatsoever, especially after the 700%+ realized gains from the January gamma squee3. When’s the next special guest appearing on r/GME_meltdown by the way? Wait, you haven’t had *any* yet? Let me guess, you *can’t* get off the computer, because you work in a comment lab that hires shills to post this kind of nonsense! Hope it pays well, because your pay checks are gonna start bouncing pretty soon 😉",[],0
472,gz31gan,2021-05-22,t3_nio334,stocks,!remindme 2 months,[],0
473,gz31hrh,2021-05-22,t1_gz2v7mk,stocks,If I had to choose one I'd definitely choose TMO. Massive cash flow that goes into both R&D and acquisitions that expand the scope of its business. It's a monster.,[],1
474,gz31kb7,2021-05-22,t1_gz2wl9q,stocks,"awesome, good dad.",[],1
475,gz31mh9,2021-05-22,t3_nhoers,stocks,anyone else thinking to start investing heavier in stocks outside the US market? Not changing any current holdings but future buys. I recently bought into VXUS and VYMI. Owned VSS for a couple years and it’s done really well for me after initially struggling (doubled down during the pandemic bottom),[],0
476,gz31oyg,2021-05-22,t1_gz21iha,stocks,I’m pretty sure Alibaba’s audit falls under PCAOB oversight. PwC Hong Kong is the auditor.,[],0
477,gz31pd3,2021-05-22,t3_nio8u0,stocks,"Get them to paper trade by having a competition, whoever wins at the end gets ""x"".

Then dump in the strategies, and possible reads that they could use/employ.

My first introduction was ""Moving Averages 101:
Incredible Signals That Will Make You Money in the Stock Market""

Simple, and light read on basic technicals. Majority of the finance literature is very dense, and kids from the new generation lack the attention span to fully digest them.",[],0
478,gz31rjc,2021-05-22,t1_gz2qz6r,stocks,from what i’ve read their valuation went up insanely compared to last year which is suspect,[],0
479,gz31uh2,2021-05-22,t3_nilf7d,stocks,I have virgin galactic stocks . The HF have been shorting this wonderful company heavily,[],1
480,gz31w65,2021-05-22,t1_gz2d3jn,stocks,Me 2 I have 150 shares,[],0
481,gz31wdl,2021-05-22,t3_ni8fp6,stocks,What you describe sounds like good stocks to tax loss harvest. If you’re down but expect long term success.,[],1
482,gz31ya6,2021-05-22,t1_gz31mh9,stocks,"Not me, I am reducing my INTL index holdings to 10%, so far they have just been worse performing US index that more or less tracks the US index.",[],1
483,gz31ytx,2021-05-22,t1_gz2sifh,stocks,"Are your an ARKX holder? I am. She bought SPCE high, sold low, and now it's going to blow up on Monday. She totally misplayed this.",['SPCE'],0
484,gz31zql,2021-05-22,t1_gz2uhg2,stocks,"Definitely not a surveillance state like you talk about. I have friends and relatives in China and we regularly talk over WeChat, talked shit on the CCP as well",[],0
485,gz32090,2021-05-22,t1_gz30zr5,stocks,Lol? A source? Do your own research. Look at google reviews. CSL is an unprofessional company that doesn’t have it’s shit together.,[],0
486,gz320le,2021-05-22,t1_gz31fiv,stocks,You mean you SOLD?! You know you're not allowed to do that! You're supposed to be HOLDING for the squeeze!,[],1
487,gz323ns,2021-05-22,t3_nhakdg,stocks,What would be the chances of any famags being less or the same share price in 5 years?,[],1
488,gz3243z,2021-05-22,t1_gz2kmlt,stocks,Damn that's a huge detail that I'm hearing for the first time on the subject. TIL,[],1
489,gz324wk,2021-05-22,t1_gz320le,stocks,"Yeah I had a limit order trip while I was driving and couldn’t pull over fast enough to readjust it during a short 5min halt. It’s ok, I have way more than doubled my position since then. Quadrupled since. More than makes up for the mistake.",[],0
490,gz3266x,2021-05-22,t1_gz2xpan,stocks,"Good. I want people in my stock to want to hold it for many reasons. If we r a cult, thats good for the stock,so ,so what?.
If we are fundamentally wrong to keep holding because we are stupid, why do you expect us to wisen up and sell off and tank the price?",[],1
491,gz3273l,2021-05-22,t1_gz2vvhq,stocks,"Trying to gain some bear perspective other than ""she got lucky"".",[],0
492,gz327z7,2021-05-22,t1_gz31pd3,stocks,">Moving Averages 101: Incredible Signals That Will Make You Money in the Stock Market

Yeah, I was thinking about starting them off with a couple of Jim Cramer's books that were lighter reading. I'll look into that one!

The contest idea is a great one and I had thought about it last night. I thought about incentivizing it with real cash for a 1st and 2nd place I'd put into trading accounts. I know it's super important to realize some real-life gains for motivational reasons and reward for the hard work.

Thanks!",[],0
493,gz32a25,2021-05-22,t1_gyxwiex,stocks,"remember that you have to pay interest on margin

if your stock goes down it becomes more mentally challenging to want to hold it",[],0
494,gz32amn,2021-05-22,t1_gz31zql,stocks,"It's a question of time. Your friends aren't on a black list.
They have cameras everywhere and access to phone locations + face recognition etc",[],1
495,gz32ddy,2021-05-22,t1_gz2u56q,stocks,I bought at $35.00 and iVe been hurting for the last 2 months,[],0
496,gz32fci,2021-05-22,t1_gz3266x,stocks,"I don't really expect anything of you, but I do wish you would grow up",[],0
497,gz32gu4,2021-05-22,t1_gyxuxe4,stocks,How old are you and what are your investing goals and timeframe?,[],0
498,gz32hea,2021-05-22,t1_gz31ya6,stocks,thanks for the quick response! just trying to gauge others sentiment,[],1
499,gz32hlx,2021-05-22,t1_gz30yp4,stocks,"Cause you are heavily invested in GME and got butthurt when they mentioned a ""meme stock"". You took it personally.",['GME'],0
500,gz32iiu,2021-05-22,t1_gz32fci,stocks,I invest in games. You expect too much from me,[],0
501,gz32j65,2021-05-22,t1_gz2r3b9,stocks,"Actually although i'm working on the Merck DD, I already did JNJ yesterday. I am really suprised with their continued growth and widely spread sources of income! What do you think of them at the current price?",[],1
502,gz32kxg,2021-05-22,t1_gz32hlx,stocks,"Nah. I take the denial of wall street being a bunch of crooks personally, and would have years before gme ever became a thing",[],1
503,gz32mnr,2021-05-22,t1_gz2vy7x,stocks,"It’s not gambling, the fact you think it is, is very telling.",[],0
504,gz32n8a,2021-05-22,t1_gz327z7,stocks,"http://library.lol/main/6F6059E9D9C56DEC77197AAB17D1DD87

Here's a link, to a PDF version, any link under ""Get""

Lib.gen for any textbooks for *free*",[],1
505,gz32r6f,2021-05-22,t1_gz32090,stocks,Price went up on Friday... seems you have secret knowledge that the market doesn’t have,[],1
506,gz32v9l,2021-05-22,t1_gz32r6f,stocks,Oh yes fridays price movement will certainly encompass a shift in market share that will take years to fully occur. Clown shit.,[],0
507,gz32xad,2021-05-22,t1_gz32kxg,stocks,So you are heavily invested in GME. RIP dude.,['GME'],0
508,gz32yu0,2021-05-22,t1_gz2xbsx,stocks,"Makes sense but I think the political situation in China is still a clear and present opportunity given their state has political and economic ties to the prosperity of their well-run firms which contributed to their emancipation. Where do they go from here? What’s the probability that the CCP reverses course and stops the expansion of their companies' revenues, profits and taxes, meanwhile even bringing an ocean of money from the globe, I'd guess US mainly, straight into the corporate China? 

Stock markets are based on trust. China benefits from their involvement in domestic and international stock markets. If China kills Alibaba for whatever reason you think (I wonder how they are bigger then the state, when their state stopped a spin-off, for instance), they'll make themselves uninvestable, and I don't see why they would go for such a thing. To me the risk with Chinese stocks is more on the reliability of their accounting and auditing, to some extent that political involvement can lead to sub-optimal decisions for the shareholder (cue Ant).",[],0
509,gz330mp,2021-05-22,t1_gz32xad,stocks,Yup and im UP. So RIP?,[],1
510,gz330r7,2021-05-22,t1_gz2yhb9,stocks,"Fair enough, but for hydrogen all the problems it has also make it less economically viable. Double the energy required means double the cost. Unrecyclable tanks means higher costs. More maintenance means higher costs. Worse performance means (theoretically) people will pay a lower price.",[],0
511,gz330v1,2021-05-22,t3_nio8u0,stocks,18 and 21 would normally be college age. I take it there are no bachelors degrees in the making? That could be a limiting factor if your apprenticeship plan doesn’t work out.,[],0
512,gz335ye,2021-05-22,t1_gz330mp,stocks,"Yeah, tell me about how GME is gonna revolutionize the game sales industry. Take over PC sales and all that. It's a lame duck stock.",['GME'],0
513,gz337rs,2021-05-22,t3_ni8fp6,stocks,FSLY. bought it at the literal top when I was still learning the ropes. luckily I only took a small position,[],0
514,gz338bi,2021-05-22,t1_gz335ye,stocks,Thats not even the bull thesis. And why would i bother  when your here to talk shit?,[],0
515,gz338jg,2021-05-22,t1_gz32n8a,stocks,"Sweet, thanks!

I will say tho that I think physical books are super important and I certainly don't mind investing in them. I like to write in notes and over the years go back and read some again. It's amazing how your perspective can change with experience and you get more out of a book each time you re-read it. 

Everyone has their own style tho, I'll see what theirs is.",[],1
516,gz33ags,2021-05-22,t1_gz2qm7u,stocks,"I’m a mechanical engineer, I used to work for Gulfstream Aerospace in Savannah GA. You could not possibly be more wrong. Why do you think Rockets need propulsion instead of just a propeller to get into space? Because the higher you go, the less air there is, and you can no longer rely on the atmosphere to propel you. (Have you ever tried swimming in the air? It doesn’t work!) This is why GAS propulsion will always be required to fly as fast as possible at high altitudes. Electric engines have no propulsion in low atmospheric pressure conditions. Electric will be adopted for low altitude/short distance flights but that is all.",[],0
517,gz33brn,2021-05-22,t1_gz338bi,stocks,Tell us more how GME will go to the moon on Monday. Cheers bro.,['GME'],0
