,created,subreddit,text,comment_id,parent_id,Organizations,Sentiment
507,2021-05-26,investing,"Debt is fine. It CAN be good. Bankrolling ‘keeping up with the Jones’ can be a dangerous game, though.",gzgmdsj,t1_gzgcggv,[],1
508,2021-05-26,investing,"This industry is too new to make any kind of reasonable financial projection for near term (<10 years)

May be space travel will become like air travel someday, where there are hotels in space, that people can go and spend time in. SpaceX is about to do the first private charter trip to space. Some billionaire bought 4 tickets to go to space for 3 days and come back. May be this will become way more common eventually and these companies will have a headstart.

Also, may be international travel will become a version of this, instead of the 20 or so hours it takes to go from say Beijing to New york, a space plane, that goes near orbit and comes back down to ground could take like 4 hours for these long international trips.

Its just too new to decide on how much each trip would cost, how this would scale, what kind of demand there will be.",gzgmexb,t3_nl3ne2,[],0
509,2021-05-26,investing,"My father was an economist. He used to be famous. He made lots on his own. Turned 33k from my grandfather into a quarter million that I now control. I also made another quarter million on my end. So I'm swinging a half million lead pipe in the battle.

I understand most but calls and puts can really hinder my long term approach if I am not the best ninja in the game. I keep studying and I was in calculus and a computer programmer....Dean's list and all. 

I can play a mean game of chess but I feel you can get shanked in a dark alley by your tinder date if you make bad choices.",gzgmgg9,t1_gzglmuj,[],0
510,2021-05-26,investing,"we all know that assumptions can be dangerous lol, but i do think it's safe to assume that, if they are manufacturing their own vehicles for these flights, that shit ain't gonna be cheap!",gzgmnw4,t1_gzgjhsf,[],0
511,2021-05-26,investing,Fair enough.,gzgmrja,t1_gzgmgg9,[],0
512,2021-05-26,investing,"No clue about the profitability but I always think about the risk of a failed flight. 

People already get spooked from flying when there's an issue with a normal plane... And there's millions of flights every month.

I can't imagine what's going to happen if/when a SPCE flight crashes. 

Obviously I hope it never does, but that risk alone has kept me from further investigating the stock.",gzgmu0c,t3_nl3ne2,['SPCE'],0
513,2021-05-26,investing,"So the Weimar Republic had one of the highest inflation rates in history, and unemployment above 20%, but according to your analysis, their economy must've been growing? Interesting. 

Saying ""this has never happened before so it can't happen again"" is a pretty terrible way to look at markets and economics.",gzgmuls,t1_gzel0gm,[],0
514,2021-05-26,investing,"I've heard ""Give a man a fish, you feed him for a day. Give a man a poisoned fish, you feed him for the rest of his life.""",gzgmxxc,t1_gzgdxwk,[],1
515,2021-05-26,investing,In 5 years there 52 week high will seam cheap.,gzgn2se,t1_gz7eky5,[],1
516,2021-05-26,investing,"They dont.  They will burn shareholder money.  Its a 6 billion company.  They think there will be a continuous line of ppl willing to pay 1.5 mill for a 2 hr flight.  Ignoring costs, maintenance, and flight delays they have two rockets expected to do 400 trips a year?  If ppl want to support the company thats fine.  It kind of bothers me when ppl yolo into something so risky.",gzgn3yh,t1_gzghgyj,[],0
517,2021-05-26,investing,">Tesla made it quite clear. They basically said we're building factories here, here and here and they will produce these, these and these cars at this volume and we are aiming for 25% gross margins.

But...Telsa isn't profitable because of those reasons. The only way they found profit in their first year (2020) was through selling credits. And that plus bitcoin in 2021 Q1.

Maybe they will eventually be profitable from their manufacturing - but not yet.",gzgn51e,t1_gzgfcmn,[],1
518,2021-05-26,investing,"I don’t expect my cherry trees to yield fruit at same time as my berry bushes. 

I’ll eat when my crops yield",gzgn9db,t3_nklmfn,[],0
519,2021-05-26,investing,"Buy jig, sell low",gzgnczl,t3_nklmfn,[],0
520,2021-05-26,investing,"Bought UAL at ~$44 amd sold around $57.  It was just a value play for me, figured there would be no way they wouldnt get gov support to make it if they needed it.  

I also bought BA around $179 after it was getting shellacked for the MAX groundings.  Still holding that now.

I bought aircraft servicing companies (play on less air travel, more need to service existing fleets vs new aircraft) and freight/transport air services (to play on COVID supply chain issues).  Theyve all done well.  May make some trims to these plays now though.  

I only buy Value and Small cap and these stocks are a bit past my price target from a valuation perspective.",gzgndtb,t3_nkrflu,[],1
521,2021-05-26,investing,"did you see Mickelson's 4,000 yd hole-in-one?!?!  hahahah",gzgnh6d,t1_gzgf074,[],0
522,2021-05-26,investing,Buy the VIX and we’ll see peace and tranquillity breaking out everywhere,gzgnlyx,t1_gzg9tq5,[],0
523,2021-05-26,investing,"so perhaps make them as multi-functional vehicles? commercial aircraft have been carrying freight in addition to passengers for decades, so why not do that with VG as well?",gzgnnd8,t1_gzgkjgd,[],0
524,2021-05-26,investing,Being a cfp gives you credibility,gzgno8f,t1_gzgeikb,[],0
525,2021-05-26,investing,is it $1.5mil/flight revenue or profit?,gzgnt2v,t1_gzggjbu,[],0
526,2021-05-26,investing,How many engines are those planes running? I don't think they will be at all efficient in terms of cargo hauling.,gzgntz8,t1_gzgnnd8,[],1
527,2021-05-26,investing,"It's a fair question, but why expect that answer for commercial space travel in 2021 when companies like Uber and many other tech companies have yet to figure that out with why less complex businesses.",gzgnxe2,t3_nl3ne2,[],0
528,2021-05-26,investing,Ohhh yeah I didn't notice that. That's a huge turn-off. I don't focus on dividends either. They don't indicate any higher return.,gzgnxn9,t1_gzg6z30,[],0
529,2021-05-26,investing,Ooohh I might try this out. I’ll drop a few k into this. Any other thing that’s similar? I heard about an inverse ETF befire,gzgnz1w,t1_gzgnlyx,[],0
530,2021-05-26,investing,"I think the upper bounds for their current offerings will be market saturation, 200ish flights per year at $2million revenue or $400m/yr seems about right. Lets say right now their overall costs are $500m/yr; ballpark based on # of employees and quarterly losses, which is pretty much everything. That's $100m/yr in the hole. All that is to say space tourism itself is not currently profitable. 

But don't doubt Virgin's business savvy, unless I'm mistaken Virgin *Galactic* developed the engines and the propulsion system on the now functioning Virgin *Orbit.* Strategically I think Virgin is running VG as slim as possible; to contain any losses from potential loss of life during operations. 

Ultimately if VG can reliably bring people to the edge of space in their mothership-glider, they will have significant IP and a head start on concepts such as point-point high speed travel, specialty programs etc.",gzgo17o,t3_nl3ne2,[],0
531,2021-05-26,investing,There is also shrinkflation already going on with many company goods.  The price is the same but the package contents is smaller.  Kind of hidden inflation as a first step before the actual price per package goes up.  It's a sneaky way of doing things as it takes a while for consumers to notice.,gzgob7t,t1_gzg9t69,[],1
532,2021-05-26,investing,"That’s the thing though, it’s not even really breaking new ground anymore, it’s a large airplane that goes pretty high up, even blue origin’s non-orbital craft is breaking more ground then VG and neither is anywhere close to  Rocket Lab, let alone SpaceX",gzgoehq,t1_gzginl5,[],0
533,2021-05-26,investing,Been a few years since my practice was in estate planning but in PA rule against perpetuities only applied to interests creates pre-2007,gzgogwt,t1_gzgmb85,[],1
534,2021-05-26,investing,I’ve heard this before somewhere. Sex Pistols?,gzgojnc,t1_gzdk63z,[],0
535,2021-05-26,investing,"...pretty much, yeah. I bought in a bunch during the first wave of pandemic and maybe I'll just hold forever? Or until one of them eventually gets a little more exciting at least",gzgoqeq,t1_gzecawl,[],0
536,2021-05-26,investing,"I feel like shrinkflation had been happening for years now though... At least my experience.

The fact that the last 10 years recorded relatively low inflation but my actual consumer experience suggest 5%+... If inflation actually hita 5% are we looking at 10%+ consumer experience? Kind of scary thinking about it",gzgoqv7,t1_gzgob7t,[],1
537,2021-05-26,investing,Oh you mean they weren't just testing liquidity selling their btc in q1??,gzgovln,t1_gzgn51e,[],0
538,2021-05-26,investing,I don’t think OP stated Tesla has achieved their plan to profitability yet.,gzgoxin,t1_gzgn51e,[],0
539,2021-05-26,investing,"How do you think price increases happen? It happens when there's an imbalance between supply and demand. Supply shortages are exactly how price increases happen. So it's not a very compelling argument for inflation being transitory 

Demand has been artificially inflated due to government stimulus. Effective wages are up vs pre pandemic, even when large portion of the population was not working. 

Maybe a new sawmill can be set up quickly, but I can tell you now created new chip fabs will take years. So we could potentially be facing years of rising prices of electronics/cars until demand and supply come back into balance.",gzgoyq1,t1_gzf50lz,[],1
540,2021-05-26,investing,"Lmao I don’t. They might eventually mature into a low orbit spectacle company where they let you go into space but they’re primed to be dominated by other companies. 

If you’re not winning Government contracts, you’re not going to survive the space race. They’re 15 years behind Space X maybe more. If you can’t compete with Space X pricing and efficacy for satellite launches, you’re walking into a losing battle already.",gzgp621,t3_nl3ne2,[],0
541,2021-05-26,investing,You are not wrong and I commend you for that!  It is a good swing trade though.,gzgpmn8,t1_gzgg1zd,[],1
542,2021-05-26,investing,"Market plan: ramp up production of their spaceships (start with SS2, move to SS4). Each new spaceship will be more modular, making it cheaper to fly and giving it a shorter turn around time. With such high demand to go to space, they can achieve profitability likely in the next few years (they start commercial operations next year). Shortish term plan is to build up their fleet, create an experience out of it, lower costs to appeal to a wider audience, and have high profit margins. Long term is what I’m interested in. Virgin Galactic has a deal with NASA in which they can look at all of the confidential government planes and their designs so that they may make a viables supersonic commercial aircraft themselves. A few different big banks have claimed that the market for hypersonic travel will be at 270 billion by 2030, and 800 billion by 2040. Although it sounds crazy, I think that this is actually a little conservative. So in essence, short term profitability comes from building up their fleet and doing space tourism, long term high potential comes from hypersonic flights. At least that’s how I see it. Let me know if you have any thoughts or comments.",gzgpmpq,t3_nl3ne2,[],0
543,2021-05-26,investing,"Unless you have a significant amount of money at your age invested, why do you need dividend stocks at all? Sounds like going all growth stocks would be better.",gzgpmq0,t1_gzdxmsf,[],1
544,2021-05-26,investing,"Laugh at how true it was?

People hear space and go ""ooooh that has to have untapped potential!"" but when you look at the numbers, it's bad. As /u/OrionIsCalling said, the valuation is absurd.",gzgpooh,t1_gzgjb4d,[],0
545,2021-05-26,investing,Concorde failed. Why would this succeed?,gzgpqkk,t1_gzgj0jz,[],0
546,2021-05-26,investing,"i'm not familiar with the screener, but i'm curious what the answer will be to your question...also, do you have any data on how these numbers correlate to the stock price? with such a wide disparity over the past few weeks, i feel like there must be some sort of connection/relationship",gzgpqoy,t3_nl3qx8,[],1
547,2021-05-26,investing,"You are probably right.  I've just noticed it more these days,  maybe the rate is accelerating?",gzgptfs,t1_gzgoqv7,[],0
548,2021-05-26,investing,Definitely accelerating. And this is before the businesses are passing costs which seems to be scheduled for next 2 quarters.,gzgpynr,t1_gzgptfs,[],0
549,2021-05-26,investing,"It kinda sounds like you're just a SPCE bear looking to circlejerk with other SPCE bears about how bad the stock is. If you're actually  serious about finding answers to your questions, maybe you should post your questions on /r/SPCE.",gzgq3b9,t1_gzggjbu,['SPCE'],1
550,2021-05-26,investing,CFP is of questionable help in actual investing. Very much a generalist designation for all things financial. Good marketing though.,gzgq87u,t1_gzge9d0,[],0
551,2021-05-26,investing,Ha I can see it now! “The MoonStars” for a chance at best in the galaxy.,gzgqgsn,t1_gzgnh6d,[],1
552,2021-05-26,investing,Insurance lol,gzgqq3e,t1_gzggjbu,[],0
553,2021-05-26,investing,"Exactly my thought; I’ve followed $STPK/$STEM since December and have not seen as big of a move in institutional ownership/transactions on finviz as I saw when checking today. I only check once per week or so.

But also curious as to the metric itself so I can know better going forward.",gzgquql,t1_gzgpqoy,[],1
554,2021-05-26,investing,Similar question was asked at their shareholders meeting and this was their [response](https://youtu.be/N-NkX86uPI0?t=4).,gzgqyn5,t3_nl3ne2,[],1
555,2021-05-26,investing,"We know their current costs and we can assume once they are launching flights regularly, costs will only go up. TTM expenses are 300 million, so revenues have to be at least that many.",gzgr19f,t1_gzgifvq,[],0
556,2021-05-26,investing,"Don’t think they are going to even try, they spun off orbital stuff to Virgin Orbit.",gzgrbnb,t1_gzgijhb,[],1
557,2021-05-26,investing,"I don't. I'm a space junkie, and as cool as it is, I don't see how it's profitable in the long run. There's little to no scientific value in that kind of flight, at least nothing you can't achieve with a sounding rocket. It's not orbital, which means no payload capacity or satellite customers. The *only* market is tourism, now and (unless they change their entire launch structure) forever. If even just E2E Starship from SpaceX becomes viable, I expect that to not only be able to serve the same niche market that Virgin Glalactic does, but to do it cheaper as well. Maybe I'm just underestimating the value in rich people bragging rights, but I dunno. I'm not seeing it.",gzgrcxx,t3_nl3ne2,[],0
558,2021-05-26,investing,"I’m not sure about the entity specifically but PPN are pretty normal, tho the returns are pretty shitty.


Wouldn’t do it just on the basis that going spy would be better and easier",gzgrf37,t3_nkgp5o,[],0
559,2021-05-26,investing,Can you please explain this a little further?,gzgrhuj,t1_gzffle3,[],0
560,2021-05-26,investing,"In the short term yeah, but hype doesn't hold long term.",gzgrnt9,t1_gzgku1m,[],1
561,2021-05-26,investing,"There's way they don't have a business plan with all of this mapped out. You think if one of their large investors asked them for any of these numbers they wouldn't have their projected financials already all mapped out? 

There's no way their large investors poured millions of dollars into this with Virgin Galactic being like ""uhh yeah, nobody knows lol"".",gzgrrnq,t1_gzgm6j3,['SPCE'],0
562,2021-05-26,investing,International travel is nowhere near where it was pre-covid level.,gzgryqn,t1_gzee5hg,[],0
563,2021-05-26,investing,"For sure, that space tourism novelty's gonna come crashing down as soon as they have a single disaster and the more flights they do, the higher the chances of that happening.",gzgs219,t1_gzgdv5h,[],0
564,2021-05-26,investing,Space tourism and mining. Mining will be the big winner.,gzgs76t,t3_nl3ne2,[],1
565,2021-05-26,investing,"this is actually a pretty good answer in terms of how to go about executing a game plan for doing research...in terms of an actual answer to OPs question? yeah, pretty crappy...hahaha",gzgs9x9,t1_gzgenan,[],1
566,2021-05-26,investing,"To be fair, the sonic boom from Starship is only an issue for population centers on the downhill part of the trip. The offshore launch platform is being proposed just because of how obscenely loud rocket launches are.  
Once (if) Starship becomes viable, it'll serve the same function, and to many more passengers at a time.",gzgsa9s,t1_gzgjhqg,[],0
567,2021-05-26,investing,"Its been like 1-2 years of ridiculous fundamentals, and that was mostly due to pandemic shaking things up, retail investing boom, and low interest rates. This aint gonna last forever and the closer we get to a post pandemic economy the more that will become apparent. I wouldnt bet on this paradigm sticking around.",gzgsc02,t1_gzgku1m,[],0
568,2021-05-26,investing,RemindMe! 5 years,gzgsitp,t1_gzgjb4d,[],1
569,2021-05-26,investing,"Rent expense/depreciation, utilities, fixed payroll, taxes",gzgsnpk,t1_gzgkh7h,[],1
570,2021-05-26,investing,"The good, the bad, and the ugly.",gzgsnrm,t3_nkrflu,[],0
571,2021-05-26,investing,I'm actually intrigued by this idea lol,gzgsqo6,t1_gzgnh6d,[],1
572,2021-05-26,investing,"I believe they're also going to do hypersonic travel.  NY to London in 90 min.  I don't hold any positions, I just remember reading that somewhere",gzgsxmv,t3_nl3ne2,[],0
573,2021-05-26,investing,"Quite simple, interest rates at -8% and galactic has a ROI of -3% --> 5%, if you want more than that, then you fucking greedy",gzgsxqb,t3_nl3ne2,[],1
574,2021-05-26,investing,"Inflation! Everyone has an opinion, but no one will know who was right until its all over!

So I'll throw my opinion in as well.

To my knowledge, hyperinflation has not been seen in the United States since the Civil War, and then only on the Confederate side. See definition of hyper inflation: [https://www.investopedia.com/terms/h/hyperinflation.asp](https://www.investopedia.com/terms/h/hyperinflation.asp)

So I feel comfortable saying that we will not see hyperinflation in the U.S. at any time in our lives.

High inflation is of course quite possible and has occurred numerous times in U.S. history, but even in the oft referenced 70s, inflation peaked at around 13%, which, while uncomfortable, was hardly ruinous.

Right now the FED wants to see at least 2% inflation YOY. So a single quarter isn't going to be sufficient to trigger a FED response. Additionally the most recent report was heavily skewed towards a few items, like used cars. So I'm thinking we aren't really in trouble yet.

Many point to large increases in commodities prices. Quite understandable, but keep in mind that we basically shut down the economy last year. Commodity inventories drew down to extremely low levels. So now that we are reopening, commodities are suddenly in demand and it will take time to refill inventories. Simple supply/demand explanation for commodity price increases. High prices will be its own solution for commodities as commodity producers will switch into oversupply mode trying to take advantage of the price increases, which will in turn drive the prices right back down.

I do feel that wage increases pose an actual permanent inflation risk as the current worker shortage does seem to be raising wages across the board. Wages tend not to come back down once they go up. But even this is likely to be a one time bump that filters through the economy and modestly increases prices generally and then settles back down. It isn't likely that companies will keep raising wages unless they absolutely have to.

So expect some real but modest permanent inflation along with a lot of transitory inflation.",gzgt5g0,t3_nkveh8,[],1
575,2021-05-26,investing,"My point is that the government is already invested in the economy without having to actually own stock. Stock entails rights to earnings and to management of the company. Through taxation and regulatory legislation, government can exert those rights without holding shares. Companies pay a percentage of their earnings to the government in the form of taxes in much the same way they may pay out some of their earnings to shareholders as dividends. If government wants to give companies access to more capital, then it doesn't have to buy stock or bonds, but can instead give tax breaks, subsidies, and loans. In no case does the Treasury actually have to interact with the stock market to get the benefits that are involved with investing in companies the way we would as citizens. The question of whether tax rates, tax breaks, and subsidies are properly allocated is in the realm of politics, but the basic idea is that the government is always investing in the US economy and always collecting its cut of the profits.",gzgt5jj,t1_gzewexz,[],0
576,2021-05-26,investing,"Well if Standard Oil is an appropriate example, you'd get shares in two or even many companies that would go on to dominate the market for the next half century.  Probably not a bad deal at all.  

AMZN and AAPL both excellent management and deep talent benches.  If the companies are broken up, the new leaders will employ those successful management practices in new companies with the talent they take with them and they'll continue to smash the competition.",gzgtfvl,t1_gzfrozz,['AAPL'],0
577,2021-05-26,investing,"**Hi, welcome to /r/investing. Please note that as a topic focused subreddit we have higher posting standards than much of Reddit:**

**1)** Please direct all **advice requests and beginner questions to the stickied daily threads.** This includes beginner questions and portfolio help.

**2) Important: We have strict political posting guidelines** (described [here](https://www.reddit.com/r/investing/comments/cyee69/formal_posting_guidelines_for_political_topics/) and [here](https://www.reddit.com/r/investing/comments/escewo/temporary_rule_change_what_happens_to_stocks_if/)). Violations will result in a likely 60 day ban upon **first instance.**

**3)** This is an open forum but we expect you to conduct yourself like an adult. Disagree, argue, criticize, but **no personal attacks.**


*I am a bot, and this action was performed automatically. Please [contact the moderators of this subreddit](/message/compose/?to=/r/investing) if you have any questions or concerns.*",gzgtht4,t3_nl640m,[],0
579,2021-05-26,investing,"This perpetually used false equivalency of fiscal discipline and “earning your keep” is a FALLACY. And it’s actually #137 in the negative externality column of my book “Capitalism, why are poor kids on Santa’s Naughty List?”. (Still working on the title). Tying someone’s character (work ethic, wealth, etc) to how they manage their finances is a dog whistle the fat cats use to pit us v each other. That whole mentality of “individualism” and the “I created that on my own” is a fallacy. We provide goods/services which are built upon the backs / minds of those who came before us. No single person is 100% responsible for their success or failure in life. This is a social construct created by the 1% to keep us from uniting against the 1%. We are stronger together and we must unite, we must unionize, we have to work together.",gzgtlke,t1_gze4jlq,[],1
580,2021-05-26,investing,"Dumb question but is SpaceX a competitor? Because a collab would be nice, Elon and Branson are broskis, but obviously elon would never collab with Bezos.",gzgtmq4,t3_nl3ne2,[],1
581,2021-05-26,investing,"Your [submission](https://www.reddit.com/r/investing/comments/nl6586/oatley_dd_the_most_delicious_vegetable_milk/) in /r/investing was automatically removed because your account has insufficient Karma. Users can earn Karma by commenting on existing threads.

*I am a bot, and this action was performed automatically. Please [contact the moderators of this subreddit](/message/compose/?to=/r/investing) if you have any questions or concerns.*",gzgtpsi,t3_nl6586,[],0
582,2021-05-26,investing,"Your [submission](https://www.reddit.com/r/investing/comments/nl659e/тherе_is_а_yоutuber_саlled_lеоn_farаday_that/) in /r/investing was automatically removed because your account has insufficient Karma. Users can earn Karma by commenting on existing threads.

*I am a bot, and this action was performed automatically. Please [contact the moderators of this subreddit](/message/compose/?to=/r/investing) if you have any questions or concerns.*",gzgtq0j,t3_nl659e,[],0
583,2021-05-26,investing,"I would
Go in there and request full payment in safemoon and doge coin .

Pack of beer and squared away .",gzgtqjz,t3_nl640m,[],0
584,2021-05-26,investing,"I mean outside of having a nice family and all that my number one goal in life is to go to space. Take that as you will lol. 

In a couple decades when I’m 50 if a flight like they’re proposing is down to $100k or so and it’s been proven “safe,” I’m going.",gzgtxc1,t1_gzgj2pf,[],1
585,2021-05-26,investing,"As I recall, change in net working capital should match the change in revenues. 

If your sales increase by 50% your working capital will need to increase proportionally to support those sales.",gzgu24p,t3_nkyfj6,[],0
586,2021-05-26,investing,I should be 100% honest here I bought that spce bag this morning and I'm holding it! Not only that it was premarket and I I probably lost $100 already. 🤣,gzgu4fs,t1_gzgldvo,[],0
