,comment_id,created,parent_id,subreddit,text,Organizations,Sentiment
711,gzd0ehq,2021-05-25,t1_gzblk9y,stocks,I heard that machinery is so short that prices are 14% more. Just a piece of the puzzle but it should continue. IMO,[],0
712,gzd0ews,2021-05-25,t1_gzcgld3,stocks,Think tonal fits in line more for their needs. They don't have much of weights in their category.   They have alot of cardio already.  Tonal is also more hip/hype it seems.,[],1
713,gzd0ga7,2021-05-25,t1_gz6oy68,stocks,Same but waiting for June,[],0
714,gzd0kp8,2021-05-25,t1_gzd0ga7,stocks,I have been selling CCs to make some premium but will likely close 50% of the position soon and just ride out the profits!,[],1
715,gzd0od4,2021-05-25,t3_nk4df4,stocks,What am I missing. Can someone explain how a treadmill company is moving this much money!?,[],0
716,gzd0qqk,2021-05-25,t3_nk43rq,stocks,Tldr. Yes,[],0
717,gzd0ugc,2021-05-25,t3_nkgnfa,stocks,Does it even matter? The average is just there to make you feel better in this scenario.,[],0
718,gzd0xns,2021-05-25,t1_gzcwokk,stocks,"Most these companies make their money on refis and not originations, they just like to all say how new purchase loans are their target market, despite most their revenue coming from refinances. It sounds good, but its just not what the numbers show.",[],1
719,gzd0yh2,2021-05-25,t3_nk4df4,stocks,PTON is fantastic. Great company with amazing content,[],1
720,gzd10sv,2021-05-25,t1_gzbw7xn,stocks,if I used my AMD for a new iPhone I'd still have 6-7 shares left.,[],1
721,gzd12ow,2021-05-25,t3_nkhw73,stocks, Not sure where u are seeing citadel is likely to collapse. Sure it’s been a rocky year for them but collapse feels like a stretch unless I’m missing something,[],0
722,gzd12yf,2021-05-25,t1_gzbgdgr,stocks,alright sounds good :),[],1
723,gzd1c18,2021-05-25,t1_gzd12ow,stocks,"The part where they ""invested"" into Melvin capital, and Gamestop being an investment trap. The lower it goes the more they buy. The higher it goes the more cash they burn. They are buying time that isn't working.",[],0
724,gzd1cu6,2021-05-25,t1_gzcyeuw,stocks,"I remember him mentioning it once or twice and his point was he’s happy to see them raise capital so they can use it to innovate. After digging into the company pretty good I think their growth prospects aren’t very enticing, the best part about that stock is it’s relatively poorly valued compared to its peers. I don’t know, might make a good value play but it’s not exciting to me. Then again Jeremy knows what he’s doing better than I do so to each his own",[],1
725,gzd1cxx,2021-05-25,t1_gzcwgtb,stocks,"Pretty sure inflation growth is the base case now. As long as forecast remain under 3% the rally will continue. Of the inflation were seeing now is indeed only transitory and we see inflation stay lower than its looking right now, we're going to see a massive rally",[],0
726,gzd1fp5,2021-05-25,t1_gzd0ugc,stocks,It matters for tax cause you need to calculate your profit lol,[],0
727,gzd1hax,2021-05-25,t1_gzcfogi,stocks,This space is getting really saturated. Lululemon now joins too with mirror. I would say its either them or apple that win in the long game. The evaluation on pton is just too much.,[],0
728,gzd1hth,2021-05-25,t1_gzchyv6,stocks,"LOL that should the time when you buy them, not when everyone is high just like when you get greedy when everyone is worried.  And regarding Intel, eventually their weight will withstand the test of time.  Seen this before so I am not worried.",[],0
729,gzd1jea,2021-05-25,t1_gzd1c18,stocks,The part where this turned into an international phenomenon.,[],0
730,gzd1r2b,2021-05-25,t1_gzcgx5j,stocks,Im sorry to hear that you lost money but with new technology and new products coming out all the time I hope your options pans out!,[],0
731,gzd1ukb,2021-05-25,t1_gzd1hth,stocks,I've tracked the company and related companies for years and see no near-term catalysts for price appreciation along with a lot of worsening trends so that's a hard no for me. Good luck though.,[],1
732,gzd1ut9,2021-05-25,t1_gzd1cu6,stocks,"They also compensate employees through share dilution. Only time will tell, I can see it taking off at some point, it's just not right for me. 

Jeremy has a good track record (although it should be noted the main reason he has so much money is the stock market group, not necessarily market returns), not that he hasn't beaten the market consistently.",[],0
733,gzd1vu7,2021-05-25,t1_gzd12ow,stocks,"The part where they've had countless months of free publicity, and gained loyalty from the working class.",[],0
734,gzd21px,2021-05-25,t1_gzd1ut9,stocks,"I assume all those guys make more money off they’re private stock groups or paid courses than they do actually trading.

He’s massively outperformed the market since I’ve been following him and gives some really great in depth due diligence, but I’m not going to just buy everything he does.",[],1
735,gzd22ce,2021-05-25,t3_nkgnfa,stocks,Typically the broker will sell the wildest specific shares first. The remaining shares and their specific cost will determine your nee remaining average. This also means that your specific shares sold will determine your “realized gain” and be calculated accordingly.,[],1
736,gzd24zn,2021-05-25,t1_gzd1ukb,stocks,"Market is forward looking, even Intel trail screams undervalued.  Fab plus Designing and our government is backing them, they will execute with Gelsinger having the technical pedigree unlike Swan who was focus more on financials and balance sheets. Also Mobileye just have Toyota AV deal.",[],1
737,gzd26z9,2021-05-25,t1_gzcaefg,stocks,While the DCF says it’s overvalued right now that doesn’t mean that it can’t go higher in the future tho. Sure doubling in 5 years might not be the case but I’m rather bullish on AAPL that’s why rather than waiting for it to drop I’m DCA,['AAPL'],0
738,gzd28tr,2021-05-25,t1_gzb5wt2,stocks,They bought precor.  Bikes and treadmills is just the beginning.  Every hotel with precor equipment will want the personal training versions as an added service and so will many gyms.,[],0
739,gzd29se,2021-05-25,t1_gzbzlzq,stocks,Ohio is right to work as well,[],1
740,gzd2d5e,2021-05-25,t1_gzcriax,stocks,Im not ignoring the DCF. That’s why I’m not loading up on AAPL shares. But because I see the company doing well over the longterm I’m just DCA because I don’t mind paying the premium now,['AAPL'],0
741,gzd2du1,2021-05-25,t1_gzcohu8,stocks,Thank you very much!,[],1
742,gzd2eo3,2021-05-25,t1_gzcdwhn,stocks,Manufacturing will come back. With better automation the difference in the cost of labor won't matter.,[],0
743,gzd2ki3,2021-05-25,t1_gzcywly,stocks,"One man? What are you even talking about? Amazon? Just because Amazon is a behemoth doesn’t mean they “control a significant portion of the economy”. Similarly, if they were to fail, there are a million competitors that would swallow up their market share in the blink of an eye. Amazon accounts for 4% of the value of the S&P 500 and is not even the first or second largest company in the country.",[],0
744,gzd2klv,2021-05-25,t3_nk5zl6,stocks,wait for the next dip,[],0
745,gzd2kwh,2021-05-25,t1_gzd0xns,stocks,"Well, no matter how we slice it - not a great investment thesis for the near term! Only companies that actually make money on mortgage originations might benefit in an environment of rate increase - but not if there is too much downward pressure on rates due to competition.",[],1
746,gzd2n1d,2021-05-25,t1_gzd2klv,stocks,I’ll definitely wait for a dip to load up on shares,[],1
747,gzd2nl2,2021-05-25,t1_gzcyy1c,stocks,Yes.,[],0
748,gzd2rb2,2021-05-25,t1_gzd21px,stocks,"I was watching him before he made the group. When he first created it, he would disclose key metrics like like total members. I would just multiple annual subscriptions by total subscribers. Even back then, it was a shit ton of money (like 50k-100k monthly). Since then he has added upsells, price increases, and total members. I wouldn't be surprised if he is at $250k a month revenue.

All I have to say is “good for him.” Get that fucking money",[],1
749,gzd2v9u,2021-05-25,t1_gzcsdsc,stocks,"Nice. Actual short shares TSLA, or you own puts? I purchased some Tesla puts today, comically overvalued. But I feel like I'm about to get kicked in the ass by a momentum run on Tesla. Eh, I made a lot of money riding that stock down from ~$750 to ~$650 or so anyways.

But for amazon the anti-trust argument to split up Amazon seems like a weak one to me.  Why/how are they a monopoly? Because people buy anything retail from their online stores? Ebay and Alibaba are two big boy competitors in ecommerce. But perhaps the argument is specifically about brick and mortar stores? Walmart and Costco are going nowhere, in fact they're both just getting bigger. So Amazon has lots of health competition in the (e)commerce space. 

And how about AWS/cloud? Now, this is an area they truly are dominant in, with respect to market share. But with Google Cloud, Microsoft Azure, and Alibaba Cloud being great alternatives I don't see the monopoly argument here either. 

tl;dr I don't really see Amazon as a lone monopoly in any space that they play around in as of today",[],1
750,gzd2ypz,2021-05-25,t3_nkhw73,stocks,So you buying puts on SPY or not cause make sure you post the loss porn on WSB after you go bankrupt.,[],0
751,gzd33de,2021-05-25,t1_gzd2ypz,stocks,"I have GME positions since November, and my portfolio is above 300% how about you?",['GME'],0
752,gzd33dv,2021-05-25,t3_nke9vc,stocks,Peloton is the next taebo,[],0
753,gzd3acg,2021-05-25,t3_nkcvvm,stocks,"I’d start with pine, as it’s a good insulator.  Then I’d layer a wrapping weave of white birch in small stick and shaved pieces topped with some of the Eucalyptus fluffy bark strips, small.  

This should be good for most fowl in our hemisphere.  Where you mount the nest, whether it’s an airy or a burrow quality and density matters.  Some of the species even prefer lose fitted nests with gaps!

Good luck raising birds with the kids!",[],1
754,gzd3bfh,2021-05-25,t1_gzd33de,stocks,"LOL

We got ourselves a genius over here guys",[],1
755,gzd3e3u,2021-05-25,t1_gzbalor,stocks,You could always... not buy the newest iphone,[],0
756,gzd3e9h,2021-05-25,t3_nke6j1,stocks,"They're required to write these disclosures. The fact that this is what they are should tell you something.

&#x200B;

In bank accounts you get protections from the FDIC. In investing accounts you get protections through SIPC. These are things that help make sure you are protected, up a certain amount of money, if the financial institution goes under your assets are protected.

You don't have that with a Futures account.

Regulation is done through the CFTC, Commodity Futures Trading Commission. They regulate often through industry groups set up by commodity exchanges. They are are also more passive and provide a legal area where people make claims against each other on contracts. 

Futures are often leveraged. You can lose more than what you invest into it and they can get significantly risky. If something big happened in the market it is possible some couldn't pay their contract and there could be a shortage of money/run on money of futures account holders. 

I'd also note that financial futures trading is relatively new in the last few decades. Back in the '70s it was primarily for hedging for agricultural crops and mining operations, many of the regulations for the market have been established in the last few decades.

This means they haven't hammered out all the rules, not have they seen all the problems they might arise from financial futures trading during market conditions this trading hasn't been through yet.

&#x200B;

This isn't where you stick you retirement fund...",[],0
757,gzd3erg,2021-05-25,t1_gzb5tel,stocks,I’m kinda new to this but for companies like apple who seem to consistently do good or have a good outlook in the future how do you determine when to sell and when your money would be better spent invested elsewhere?,[],1
758,gzd3h51,2021-05-25,t1_gzd33de,stocks,You skip your meds today bud?,[],0
759,gzd3hfs,2021-05-25,t1_gzcxqi2,stocks,"Are these companies mining the rare earth metals on US soil, or USA companies that find and extract minerals around the world? Interesting to know.


As for your second point... with the level of anti-science mentality/backlash here in the US and the insane pro-tech/AI mentality in China plus their soft colonization of Africa and developing regions... they're going to surpass the U.S. easily well before their 100 year plan is complete, sadly. 

The only way this is avoidable is if as a nation, the USA can have a united focus on technology and advancement in the same way as the Space Race against the soviets in the 50s. Unfortunately the political and cultural divide is too far gone and it's going to enable China to lap us.",[],0
760,gzd3i1z,2021-05-25,t1_gzd33de,stocks,I see a patter alright lmao,[],0
761,gzd3lxo,2021-05-25,t1_gzcfz9r,stocks,Technically the streaming platform is going to own the studio.,[],0
762,gzd3myj,2021-05-25,t1_gzcbl7e,stocks,Probably still not high enough. Looking at Paramount and MGM's back catalogs for the last few decades the latter seems to be much more of a one-trick pony (Bond is a pretty good trick I'll grant you).,[],1
763,gzd3ol9,2021-05-25,t3_njtw5g,stocks,Best semiconductor to get into? Not just gaming,[],1
764,gzd3ooj,2021-05-25,t3_nkcvvm,stocks,I opened a custodial account for my kids (2 and 6) in Jan.  Selected a handful of REITs I felt were undervalued and well managed. So far accounts are up 15% and 17%. I recently added a small position in PSTH as well as I believe in Ackman long term. DRIP is turned on and I don’t plan on making many trades. They already have a 529 and my GI Bill from the military. Plan is to let these grow for a long time.,[],0
765,gzd3ozd,2021-05-25,t1_gzcj4gm,stocks,"Yeah, as far as I know it‘s the companies free decision to do whatever they want when it comes to that.",[],0
766,gzd3qit,2021-05-25,t1_gzcr2m6,stocks,529 is meh. You can make more even after V taking the tax hit while having more flexibility with say a Roth.,[],0
767,gzd3qk6,2021-05-25,t1_gzczuyk,stocks,To be fair you probably could have said the same about Bond following Brosnan's third film.,[],0
768,gzd3wqt,2021-05-25,t1_gzd3h51,stocks,"Lmao, you guys are hilarious. Thats why its still in 180, and rising? I am a TA kinda guy. Would like me to post my portfolio just to make you look stupid?",[],1
769,gzd3wvx,2021-05-25,t1_gzd2kwh,stocks,"Yah short term I went from bull to neutral on these; I think they will all continue to be profitable and make money but...if you make say 30% less money next year, where’s the growth? Why should we anticipate share prices rising even tho the company’s themselves predict less income?",[],0
770,gzd41qr,2021-05-25,t1_gzb97g3,stocks,"Honestly, you might enjoy some other subs out there more.  r/securityanalysis is still pretty good imho. 

r/options and r/stocks have sunk below hope though.",[],1
771,gzd44vc,2021-05-25,t1_gzczgxb,stocks,Where are they going to find someone else as likeable as Macgyver or Aquaman to hold the new series together though?,[],1
772,gzd49pn,2021-05-25,t3_njtw5g,stocks,Nmrd news due,[],0
773,gzd4gqr,2021-05-25,t1_gzd3wqt,stocks,"Yeah I can see all the amazing TA you did in the OP, solid technicals and pattern analysis you've done there sport.   

This is a finance sub, your portfolio is way less impressive than you think it is.     

Not to mention you appear to not even know what the guy was asking you, which was the real cringe part.",[],1
774,gzd4mjc,2021-05-25,t1_gz9upmw,stocks,idk lol i tried those things i think it was something like options? someone said its like extra hard mode lmao but it flashed a lot of red tho so i just deleted the app cause i only like games i win real good at,[],0
775,gzd4nj2,2021-05-25,t3_nke9vc,stocks,"PTON 120C 🚀🚀

No one is running out to get a nautilus or bow flex or whatever. Lol",[],0
776,gzd4y4i,2021-05-25,t1_gzd4gqr,stocks,"No I think your missing the logic again. Timing it would be stupid, especially if they buy more time. Its a waiting game. I wouldn't waste my money on it. I understood what he was saying. This is just going over your head huh?",[],0
777,gzd4yjh,2021-05-25,t1_gzd3e3u,stocks,"People say things like this, but then also want their Apple and Amazon stock to go up... it's pretty funny tbh",['AAPL'],1
778,gzd580o,2021-05-25,t1_gzcfz9r,stocks,And investment banks we’re supposed to be partnerships and consumer banks we’re supposed to be separate,[],0
779,gzd5asv,2021-05-25,t3_nkc3fe,stocks,"My feeling is that LDI .. Loan Depot. Is doing better than the rest of them. I bought some at 12.80$ and it is up in the high 13’s. 
Having Green Day’s. Where RKT is Red.",[],0
780,gzd5jdw,2021-05-25,t3_nk67sx,stocks,I need a stock split for amzn so I can rebalance my tiny portfolio. It’s eating up 30% of my portfolio and stagnant...,[],0
781,gzd5nzv,2021-05-25,t1_gzd4y4i,stocks,Whew,[],0
782,gzd5set,2021-05-25,t3_nkchix,stocks,"Value premium is a proven fact over the long term. It could take 20-30 years to fully experience it, but over this period you should annualize 11-15%",[],1
783,gzd5yux,2021-05-25,t1_gzb1bgg,stocks,"VT is smart like the others say, but I'd say VT is relatively low risk on a larger timescale. If you are medium-high you can drop some diversity and maybe do a mix of VT with VOO or QQQ. They should both perform admirably in the long run",[],0
785,gzd6fjm,2021-05-25,t1_gzczu10,stocks,7 companies account for the majority of the GDP in the S&P. AKA Warren buffet indicator.,[],1
786,gzd6ut6,2021-05-25,t3_nkjc5q,stocks,"Use an ETF screener. But, let me just say, are you sure you want to try and catch a falling knife? There’s an ETF for that too, lol!  NIFE",[],0
787,gzd72vn,2021-05-25,t3_nkazfv,stocks,Use screener like fidelity screener.,[],1
788,gzd73rh,2021-05-25,t1_gzccww8,stocks,"Approx 10% div each month. However the price of the etf itself doesn’t treally go anywhere. 

Would be great if you just want income monthly and not too worried and capital growth.",[],1
789,gzd787l,2021-05-25,t3_nk67sx,stocks,Bezos called the board and told them he needed movies to watch on his new yacht.,[],1
790,gzd7khs,2021-05-25,t3_njtw5g,stocks,"WTF happened to QLD, it’s just a glitch, right?",[],0
791,gzd8bse,2021-05-25,t1_gzcyy1c,stocks,Ample,[],1
792,gzd8gsm,2021-05-25,t1_gzccm4a,stocks,"How did I just instantly know you’re a PSTH mouthbreather from your first comment. Chamath lives in y’alls head rent-free lmao. 

Chamath being involved in SoFi/IPOE is irrelevant, SoFi is a unicorn. It’s THE fintech unicorn. But you cannot see this through your bias. Being so emotional is not a good way to invest.",[],0
793,gzd8k5s,2021-05-25,t3_njtw5g,stocks,"Now if the eur/usd could stabalize a little, that would be nice. Losing the last week 1 a 2%",[],0
794,gzd8p12,2021-05-25,t3_nkdpq6,stocks,"I’m balls deep in this, like HEAVY DEEP.

SoFi is THE fintech firm, an absolute unicorn in the term’s very meaning. It’s honestly baffling that this was a SPAC, because they probably would’ve gotten like a $40-80 billion valuation through a traditional IPO, instead of the $16 billion it’s at currently. Well, better for us retail investors!

I do not understand how this company is not plastered everywhere, it’s an incredible investment-opportunity.",[],0
795,gzd8sfq,2021-05-25,t1_gzcfz9r,stocks,Because it is a free country and the government should mind its own business and leave the entertainment industry alone.,[],0
796,gzd8wyw,2021-05-25,t1_gzbrzsu,stocks,"Haha, yes! Someone gets it.",[],0
797,gzd933q,2021-05-25,t1_gyvwc9g,stocks,"Hey can yiu help me? I have been wanting to buy DraftKings as my second stock. Glad I didn’t at the time it was around 60. I feel like when the pandemic lessens and as you said, football ramps up, a call would be a great purchase. I sort of understand calls, but need help with which date and price,etc. DM me if that’s easier. Thanks",[],1
798,gzd9561,2021-05-25,t3_nk23fu,stocks,Rick and Morty? Really?,[],0
799,gzd96qp,2021-05-25,t1_gyvr7z5,stocks,ELI5 please,[],0
800,gzd97rl,2021-05-25,t3_nki7qb,stocks,Developing own product is complex. Tesla found this out.,['TSLA'],1
801,gzd9amq,2021-05-25,t3_nkdpq6,stocks,"What would be the ticker if merger goes through? And how will the shares change (if for example I am owning IPOE will these shares automatically change into the merged ones)? I apologize in advance if it’s a stupid question, I am new to investing and not a USA native, so I have very little knowledge about the workings on financial system there.",[],0
802,gzd9c7k,2021-05-25,t1_gykt2tw,stocks,Kardashians,[],0
803,gzd9cc1,2021-05-25,t3_nki7qb,stocks,Stock looks like on a downward trend,[],0
804,gzd9l1x,2021-05-25,t1_gz9uii4,stocks,"lol how can you say the biggest companies in the entire stock market are risky?

if you buy an index ETF, wtf do you think you are buying?",[],0
805,gzd9lj1,2021-05-25,t1_gyxo36u,stocks,You don’t. You lose a lot,[],0
806,gzd9m9u,2021-05-25,t1_gzd9amq,stocks,"It’s fine! Questions are always welcome.

The ticker is currently $IPOE (the SPAC/blank check company), through which SoFi will merge onto the public markets. 

Once the merger goes through, the ticker for your $IPOE stocks will automatically change, you do not have to do anything. The ticker will change to $SOFI. You basically already own $SOFI, just already before it’s ticker change and introduction to the public market. 

The ticker will likely change to $SOFI on June 1st.",[],0
807,gzd9qfy,2021-05-25,t3_nki7qb,stocks,"Scaling up to mass production usually doesn't go as quickly as planned, but I hope they'll manage it. They will have to double their production quite a few times to justify their current valuation.",[],0
808,gzd9qp2,2021-05-25,t3_nk5zl6,stocks,"I’ve been holding AAPL since 2008 and In fact, I started with this as a stock and I can only tell you that best way to go is long term And DCA. Another 5-8years, I am good for retirement.",['AAPL'],1
809,gzda3l4,2021-05-25,t3_nk67sx,stocks,"Maybe it is more about cerzical integration than content IP for Amazon...
After all the, invest in warehouse infrastructure, delivery capabilities, planes etc when they are not extending to other businesses. Maybe they just want to have the MGM infrastructure & know-how on media asset production in addition to extending their content library...",[],0
810,gzda565,2021-05-25,t1_gyhcjz8,stocks,Appears you weren’t.,[],1
811,gzda9yz,2021-05-25,t1_gzd7khs,stocks,2 for 1 split,[],0
812,gzdaags,2021-05-25,t1_gzd8gsm,stocks,"I’d say your response was a bit emotional.  Have you bothered to look at how the PSTH spac is even structured? I don’t care about Ackman but I like that this is one of the few spacs where shareholder incentives are aligned with the fund bringing the spac to market.  

Chamath doesn’t do that and his spacs are pretty pump and dumpy.  I’d be thrilled to invest in SOFI if they did a direct listing or traditional ipo, but chamath getting in the middle of it made me lose interest.  

I invest based on my confidence in the management team. I don’t trust chamath because he overpromises and underdelivers. He also dumped shares of SPCE while he is the CEO - he doesn’t even believe in the company he is selling to others.  You’d invest in that kinda ceo?",['SPCE'],0
813,gzdacjj,2021-05-25,t1_gzaxvjl,stocks,"You can look at this any way you want but I don't think there's any argument for it being ""deep value"" after a 400% run up.

At least with Tesla there's the vague hope that they will be ""the future"".  What's the argument here?  I think it's a bad investment right now, but hey, I could be wrong.  But I'm absolutely certain that this is not a ""deep value"" play right now.",[],0
814,gzdadq6,2021-05-25,t1_gzata37,stocks,"I wonder, is it more like a US thing? I have never in my life heard anyone use it here in my country in EU.",[],1
815,gzdaokk,2021-05-25,t1_gzd3myj,stocks,"The Hobbit and Creed IP seem to be also owned by MGM Studios so basically paying $9B for Bond, Creed, and The Hobbit and 2001: A Space Odyssey as a rider lol.",[],0
816,gzdaq03,2021-05-25,t1_gzd3qk6,stocks,"If Amazon made a Bond TV series, now that would be something.",[],1
817,gzdaqnf,2021-05-25,t1_gzcl22e,stocks,I want them to do so a 4:1 stock split within 3 years.,[],0
818,gzdauys,2021-05-25,t3_nki7qb,stocks,Good thing I bought at 33. Can’t wait to see where this goes!,[],0
819,gzdaxep,2021-05-25,t1_gzb932z,stocks,"From Jeff's very first annual letter to investors:

>We believe that a fundamental measure of our success will be the shareholder value we create over the long-term. This value will be a direct result of our ability to extend and solidify our current market leadership position. The stronger our market leadership, the more powerful our economic model.  
  
Because of our emphasis on the long-term, we may make decisions and weigh tradeoffs differently than some companies... We will continue to make investment decisions in light of long-term market leadership considerations rather than short-term profitability considerations or short-term Wall Street reactions...We aren't so bold as to claim that the above is the 'right' investment philosophy, but it's ours, and we would be remiss if we weren't clear in the approach we have taken and will continue to take.",[],1
820,gzdb5nt,2021-05-25,t1_gzd9m9u,stocks,"Great, thank You very much, that’s awesome to hear!",[],1
821,gzdb8o4,2021-05-25,t3_nki7qb,stocks,LOL.  they are only accelerating the inevitable bankruptcy.   every car $nio sells looses money.,[],0
